Location,Name,Frequency,Duplex,Offset,Tone,rToneFreq,cToneFreq,DtcsCode,DtcsRxCode,DtcsPolarity,Mode,TStep,Comment
211,PGQlacueva,442.125,+,5,Tone,107.2,107.2,23,23,NN,FM,5,NM Santa Fe La Cueva N9PGQ 442.125 OPEN 
212,santafe,145.19,-,0.6,Tone,162.2,162.2,23,23,NN,FM,5,NM Bernalillo Santa Fe  145.19 OPEN On-Air
213,cd.juarez,145.285,+,1.6,TSQL,88.5,88.5,23,23,NN,FM,5,CH undefined Cd. Juarez  145.285 OPEN On-Air
214,5HOlacueva,145.41,-,0.6,Tone,100,100,23,23,NN,FM,5,NM Santa Fe La Cueva W5HO 145.41 OPEN Off-Air
215,"5RXlosalamos, pajarito mountain",223.94,-,1.6,,88.5,88.5,23,23,NN,FM,5,"NM Los Alamos Los Alamos, Pajarito Mountain KB5RX 223.94 OPEN On-Air"
216,5BBlosalamos,442.25,+,5,,88.5,88.5,23,23,NN,DIG,5,NM Los Alamos Los Alamos NM5BB 442.25 OPEN Off-Air
217,CMSlosalamos,927.9,-,25,Tone,131.8,131.8,23,23,NN,DIG,5,NM Los Alamos Los Alamos WD9CMS 927.9 OPEN On-Air
218,CMSlosalamos,444.775,+,5,Tone,131.8,131.8,23,23,NN,DIG,5,NM Los Alamos Los Alamos WD9CMS 444.775 OPEN On-Air
219,HSOlosalamos,144.265,,0,Tone,203.5,203.5,23,23,NN,FM,5,NM Los Alamos Los Alamos KC2HSO 144.265 OPEN On-Air
220,AVNlosalamos,442.925,+,5,,88.5,88.5,23,23,NN,DIG,5,NM Los Alamos Los Alamos KE8AVN 442.925 OPEN On-Air
221,5WRlosalamos,442.425,+,5,,88.5,88.5,23,23,NN,DIG,5,NM Los Alamos Los Alamos NM5WR 442.425 OPEN On-Air
222,BIWlosalamos,224.04,-,1.6,TSQL,100,100,23,23,NN,FM,5,NM Los Alamos Los Alamos KA5BIW 224.04 OPEN On-Air
223,BIWlosalamos,442,+,5,Tone,100,100,23,23,NN,FM,5,NM Los Alamos Los Alamos KA5BIW 442 OPEN On-Air
224,"5IAalpine, south mountain",448.725,-,5,,88.5,88.5,23,23,NN,FM,5,"AZ Apache Alpine,  South Mountain N5IA 448.725 CLOSED On-Air"
225,"5IAdeming,little florida mtn",147.04,+,0.6,,88.5,88.5,23,23,NN,FM,5,"NM Luna Deming, Little Florida Mtn N5IA 147.04 OPEN On-Air"
226,"5IAlordsburg,jacks peak",145.17,-,0.6,Tone,100,100,23,23,NN,FM,5,"NM Hidalgo Lordsburg, Jacks Peak N5IA 145.17 OPEN On-Air"
227,"5IAlordsburg,jacks peak",145.17,-,0.6,Tone,100,100,23,23,NN,FM,5,"NM Grant Lordsburg, Jacks Peak N5IA 145.17 OPEN On-Air"
228,"5IAlordsburg,jack's peak",440.825,+,5,,88.5,88.5,23,23,NN,DIG,5,"NM Hidalgo Lordsburg, Jack's Peak N5IA 440.825 OPEN On-Air"
229,"5IAlordsburg,jacks peak",449,-,5,Tone,100,100,23,23,NN,FM,5,"NM Hidalgo Lordsburg, Jacks Peak N5IA 449 PRIVATE On-Air"
230,"5IAmorenci, guthrie peak",448.975,-,5,,88.5,88.5,23,23,NN,FM,5,"AZ Greenlee Morenci,  Guthrie Peak N5IA 448.975 CLOSED On-Air"
231,SARzuni,145.43,-,0.6,Tone,162.2,162.2,23,23,NN,FM,5,NM McKinley Zuni KD5SAR 145.43 OPEN On-Air
232,"PDOlosalamos, barranca mesa",146.88,-,0.6,,88.5,88.5,23,23,NN,FM,5,"NM Los Alamos Los Alamos, Barranca Mesa W5PDO 146.88 OPEN On-Air"
233,WSBdeming,449.85,-,5,Tone,100,100,23,23,NN,FM,5,NM Luna Deming N5WSB 449.85 OPEN 
234,M2Jdeming,147.12,+,0.6,Tone,88.5,88.5,23,23,NN,FM,5,NM Luna Deming NM2J 147.12 OPEN On-Air
235,5JXdeming,147.08,+,0.6,,88.5,88.5,23,23,NN,FM,5,NM Luna Deming W5JX 147.08 OPEN 
236,6RTdeming,449.475,-,5,Tone,77,77,23,23,NN,FM,5,NM Luna Deming WA6RT 449.475 OPEN 
237,"ZQEsantafe, tesuque peak",442.825,+,5,Tone,131.8,131.8,23,23,NN,FM,5,"NM Santa Fe Santa Fe, Tesuque Peak KB5ZQE 442.825 OPEN On-Air"
238,"DARdeming,little florida mtn",146.82,-,0.6,Tone,88.5,88.5,23,23,NN,FM,5,"NM Luna Deming, Little Florida Mtn W5DAR 146.82 OPEN On-Air"
239,DARlittleflorida,449.475,-,5,Tone,77,77,23,23,NN,FM,5,NM Luna Little Florida W5DAR 449.475 OPEN On-Air
240,DARcolumbus,145.43,-,0.6,Tone,88.5,88.5,23,23,NN,FM,5,NM Luna Columbus W5DAR 145.43 OPEN 
241,5CFlittleflorida,449.85,-,5,Tone,127.3,127.3,23,23,NN,FM,5,NM Luna Little Florida W5CF 449.85 OPEN On-Air
242,WEZlasvegas,145.45,-,0.6,,88.5,88.5,23,23,NN,FM,5,NM San Miguel Las Vegas KB5WEZ 145.45 OPEN Off-Air
243,"MMIroswell,nmmi",146.64,-,0.6,Tone,100,100,23,23,NN,FM,5,"NM Chaves ROSWELL, NMMI N5MMI 146.64 OPEN On-Air"
244,ZRFanthony,442.95,+,5,Tone,67,67,23,23,NN,FM,5,TX El Paso Anthony N5ZRF 442.95 OPEN 
245,"IMJroswell,comanche hill",444,+,5,Tone,100,100,23,23,NN,FM,5,"NM Chaves Roswell, Comanche Hill N5IMJ 444 OPEN On-Air"
246,IMJmaljamar,442.075,+,5,Tone,162.2,162.2,23,23,NN,FM,5,NM Lea Maljamar N5IMJ 442.075 OPEN On-Air
247,BLOroswell,146.94,-,0.6,,88.5,88.5,23,23,NN,FM,5,NM Chaves Roswell W5BLO 146.94 OPEN Off-Air
248,WDVgallup,449.75,-,5,Tone,100,100,23,23,NN,FM,5,NM McKinley Gallup KC5WDV 449.75 OPEN On-Air
249,"WDVgallup,gibson peak",147.26,+,0.6,Tone,100,100,23,23,NN,FM,5,"NM McKinley Gallup, Gibson Peak KC5WDV 147.26 OPEN On-Air"
250,"WDVgallup,deza bluffs",448.2,-,5,Tone,100,100,23,23,NN,FM,5,"NM McKinley Gallup, Deza Bluffs KC5WDV 448.2 OPEN On-Air"
251,ELPelpaso,146.88,-,0.6,,88.5,88.5,23,23,NN,FM,5,TX El Paso El Paso K5ELP 146.88 OPEN On-Air
252,ELPelpaso,147.2,+,0.6,Tone,67,67,23,23,NN,FM,5,TX El Paso El Paso K5ELP 147.2 OPEN On-Air
253,ELPelpaso,146.7,-,0.6,Tone,114.8,114.8,23,23,NN,FM,5,TX El Paso El Paso K5ELP 146.7 OPEN On-Air
254,ELPelpaso,444.2,+,5,Tone,100,100,23,23,NN,FM,5,TX El Paso El Paso K5ELP 444.2 OPEN On-Air
255,ELPelpaso,442.825,+,5,Tone,100,100,23,23,NN,FM,5,TX El Paso El Paso K5ELP 442.825 OPEN 
256,"JXYelpaso, franklin mountains",443.85,+,5,,88.5,88.5,23,23,NN,DIG,5,"TX El Paso El Paso, Franklin Mountains WA5JXY 443.85 OPEN Off-Air"
257,"GNBroswell,comanche hill",52.94,-,0.5,Tone,100,100,23,23,NN,FM,5,"NM Chaves Roswell, Comanche Hill W5GNB 52.94 OPEN "
258,"GNBroswell,comanche hill",444.95,+,5,Tone,179.9,179.9,23,23,NN,FM,5,"NM Chaves Roswell, Comanche Hill W5GNB 444.95 OPEN On-Air"
259,"GNBroswell,comanche hill",444.425,+,5,TSQL,179.9,179.9,23,23,NN,FM,5,"NM Chaves Roswell, Comanche Hill W5GNB 444.425 OPEN On-Air"
260,GNBroswell,147.32,+,0.6,TSQL,146.2,146.2,23,23,NN,FM,5,NM Chaves Roswell W5GNB 147.32 OPEN On-Air
261,"GNBroswell,comanche hill",444.55,+,5,TSQL,162.2,162.2,23,23,NN,FM,5,"NM Chaves Roswell, Comanche Hill W5GNB 444.55 OPEN On-Air"
262,"GNBhagerman,comanche hill",147.32,+,0.6,Tone,162.2,162.2,23,23,NN,FM,5,"NM Chaves Hagerman, Comanche Hill W5GNB 147.32 OPEN "
263,CNMhope,147.38,+,0.6,Tone,123,123,23,23,NN,FM,5,NM Eddy Hope K5CNM 147.38 OPEN On-Air
264,CNMartesia,442.45,+,5,Tone,162.2,162.2,23,23,NN,FM,5,NM Eddy Artesia K5CNM 442.45 OPEN On-Air
265,"CNMqueen,queen fire station",147.3,+,0.6,Tone,123,123,23,23,NN,FM,5,"NM Eddy Queen, Queen fire station K5CNM 147.3 OPEN On-Air"
266,CNMcarlsbad,147.28,+,0.6,Tone,123,123,23,23,NN,FM,5,NM Eddy Carlsbad K5CNM 147.28 OPEN On-Air
267,CNMloving,147.36,+,0.6,Tone,123,123,23,23,NN,FM,5,NM Eddy Loving K5CNM 147.36 OPEN On-Air
268,CUBelpaso,147.28,+,0.6,Tone,67,67,23,23,NN,FM,5,TX El Paso El Paso KD6CUB 147.28 OPEN On-Air
269,CUBelpaso,224.82,-,1.6,Tone,100,100,23,23,NN,FM,5,TX El Paso El Paso KD6CUB 224.82 OPEN On-Air
270,"ARAeagar,greens peak",146.72,-,0.6,Tone,162.2,162.2,23,23,NN,FM,5,"AZ Apache Eagar, Greens Peak W7ARA 146.72 OPEN On-Air"
271,"ARAeagar,greens peak",448.375,-,5,Tone,100,100,23,23,NN,FM,5,"AZ Apache Eagar, Greens Peak W7ARA 448.375 OPEN On-Air"
272,"ARAeagar,greens peak",927.1625,-,25,Tone,151.4,151.4,23,23,NN,FM,5,"AZ Apache Eagar, Greens Peak W7ARA 927.1625 OPEN On-Air"
273,"ARAglobe,pinal peak",147.2,+,0.6,TSQL,162.2,162.2,23,23,NN,FM,5,"AZ Gila Globe, Pinal Peak W7ARA 147.2 OPEN On-Air"
274,"ARAglobe, pinal peak",448.475,-,5,Tone,100,100,23,23,NN,FM,5,"AZ Gila Globe,  Pinal Peak W7ARA 448.475 OPEN On-Air"
275,"ARAglobe,pinal peak",927.4125,-,25,Tone,151.4,151.4,23,23,NN,FM,5,"AZ Gila Globe, Pinal Peak W7ARA 927.4125 OPEN On-Air"
276,"QVUeagar,greens peak",146.62,-,0.6,Tone,162.2,162.2,23,23,NN,FM,5,"AZ Apache Eagar, Greens Peak N7QVU 146.62 OPEN On-Air"
277,"QVUeagar,greens peak",449.35,-,5,Tone,100,100,23,23,NN,FM,5,"AZ Apache Eagar, Greens Peak N7QVU 449.35 OPEN On-Air"
278,QVUovergaard,446.6,-,5,TSQL,100,100,23,23,NN,DIG,5,AZ Navajo Overgaard N7QVU 446.6 OPEN On-Air
279,"7EHeagar, greens peak",145.31,-,0.6,Tone,110.9,110.9,23,23,NN,FM,5,"AZ Apache Eagar,  Greens Peak W7EH 145.31 OPEN On-Air"
280,7EHshowlow,449.15,-,5,Tone,110.9,110.9,23,23,NN,FM,5,AZ Navajo Show Low W7EH 449.15 OPEN On-Air
281,"OEIeager, greens peak",448.85,-,5,,88.5,88.5,23,23,NN,DIG,5,"AZ Apache Eager,  Greens Peak N7OEI 448.85 OPEN On-Air"
282,ZFAfortsumner,147.14,+,0.6,Tone,100,100,23,23,NN,FM,5,NM Debaca Fort Sumner KB5ZFA 147.14 OPEN On-Air
283,ZFAcaprock,147.18,+,0.6,Tone,100,100,23,23,NN,FM,5,NM Lea Caprock KB5ZFA 147.18 OPEN Off-Air
284,ZPXelpaso,440.65,+,5,,88.5,88.5,23,23,NN,DIG,5,TX El Paso El Paso KG5ZPX 440.65 OPEN On-Air
285,5SJlybrook,145.49,-,0.6,Tone,100,100,23,23,NN,FM,5,NM Rio Arriba Lybrook NM5SJ 145.49 OPEN On-Air
286,5SJdulce,145.43,-,0.6,Tone,136.5,136.5,23,23,NN,FM,5,NM Rio Arriba Dulce NM5SJ 145.43 OPEN On-Air
287,5SJaztec,146.74,-,0.6,Tone,100,100,23,23,NN,FM,5,NM San Juan Aztec NM5SJ 146.74 OPEN On-Air
288,"5SJnebo,cedar hill",147.06,+,0.6,Tone,100,100,23,23,NN,FM,5,"NM San Juan Nebo, Cedar Hill NM5SJ 147.06 OPEN On-Air"
289,"5SJlukachukai,roof butte",146.82,-,0.6,Tone,100,100,23,23,NN,FM,5,"AZ Apache Lukachukai, Roof Butte NM5SJ 146.82 OPEN On-Air"
290,"7GCpayson,mt ord",146.96,-,0.6,Tone,141.3,141.3,23,23,NN,FM,5,"AZ Gila Payson, Mt Ord WR7GC 146.96 OPEN On-Air"
291,"7GCglobe,signal peak",449.65,-,5,Tone,100,100,23,23,NN,FM,5,"AZ Gila Globe, Signal Peak WR7GC 449.65 OPEN On-Air"
292,WPHelpaso,145.33,-,0.6,Tone,67,67,23,23,NN,FM,5,TX El Paso El Paso K5WPH 145.33 OPEN On-Air
293,WPHelpaso,147.24,+,0.6,Tone,162.2,162.2,23,23,NN,FM,5,TX El Paso El Paso K5WPH 147.24 OPEN On-Air
294,WPHelpaso,443.4,+,5,Tone,100,100,23,23,NN,FM,5,TX El Paso El Paso K5WPH 443.4 OPEN On-Air
295,WPHelpaso,442.25,+,5,Tone,100,100,23,23,NN,FM,5,TX El Paso El Paso K5WPH 442.25 OPEN On-Air
296,WPHelpaso,53.55,-,1,,88.5,88.5,23,23,NN,FM,5,TX El Paso El Paso K5WPH 53.55 OPEN On-Air
297,ELPelpaso,145.41,-,0.6,Tone,88.5,88.5,23,23,NN,FM,5,TX El Paso El Paso WX5ELP 145.41 OPEN On-Air
298,"X7Rconcho,volcano hill",449.625,-,5,DTCS,114.8,114.8,23,754,NN,DIG,5,"AZ Apache Concho, Volcano Hill NX7R 449.625 OPEN On-Air"
299,"EZChurley,murray tank",147.06,+,0.6,,88.5,88.5,23,23,NN,FM,5,"NM Grant Hurley, Murray Tank WD5EZC 147.06 OPEN "
300,"5PXdixon,cerro abajo",147.18,+,0.6,TSQL,100,100,23,23,NN,FM,5,"NM Rio Arriba Dixon, Cerro Abajo KD5PX 147.18 OPEN On-Air"
301,"ELPelpaso, comanche peak",146.62,-,0.6,,88.5,88.5,23,23,NN,DIG,5,"TX El Paso El Paso, Comanche Peak W5ELP 146.62 OPEN On-Air"
302,"HFNelpaso, montana vista",444.325,+,5,Tone,103.5,103.5,23,23,NN,FM,5,"TX El Paso El Paso, Montana Vista W5HFN 444.325 OPEN On-Air"
303,TOCelpaso,146.94,-,0.6,TSQL,123,123,23,23,NN,DIG,5,TX El Paso El Paso N6TOC 146.94 OPEN On-Air
304,TOCelpaso,444.6,+,5,,88.5,88.5,23,23,NN,DIG,5,TX El Paso El Paso N6TOC 444.6 OPEN On-Air
305,TOCelpaso,443.375,+,5,Tone,100,100,23,23,NN,FM,5,TX El Paso El Paso N6TOC 443.375 OPEN On-Air
306,WINelpaso,443.125,+,5,,88.5,88.5,23,23,NN,DIG,5,TX El Paso El Paso W5WIN 443.125 OPEN On-Air
307,WINelpaso,444.4,+,5,DTCS,88.5,88.5,23,23,NN,DIG,5,TX El Paso El Paso W5WIN 444.4 OPEN On-Air
308,WINsocorro,147.01,+,0.6,,88.5,88.5,23,23,NN,DIG,5,TX El Paso Socorro W5WIN 147.01 OPEN On-Air
309,5JRelpaso,443.6,+,5,,88.5,88.5,23,23,NN,DIG,5,TX El Paso El Paso AE5JR 443.6 OPEN 
310,5EOelpaso,147.06,+,0.6,,88.5,88.5,23,23,NN,FM,5,TX El Paso El Paso KJ5EO 147.06 CLOSED 
311,5EOelpaso,147.1,+,0.6,,88.5,88.5,23,23,NN,FM,5,TX El Paso El Paso KJ5EO 147.1 CLOSED 
312,5EOelpaso,442.6,+,5,,88.5,88.5,23,23,NN,FM,5,TX El Paso El Paso KJ5EO 442.6 CLOSED 
313,5EOelpaso,443,+,5,,88.5,88.5,23,23,NN,FM,5,TX El Paso El Paso KJ5EO 443 CLOSED 
314,LJOelpaso,442.1,+,5,Tone,123,123,23,23,NN,FM,5,TX El Paso El Paso WB5LJO 442.1 CLOSED 
315,LJOelpaso,442.55,+,5,Tone,100,100,23,23,NN,FM,5,TX El Paso El Paso WB5LJO 442.55 OPEN On-Air
316,LJOelpaso,443.7,+,5,,88.5,88.5,23,23,NN,FM,5,TX El Paso El Paso WB5LJO 443.7 CLOSED 
317,KKOelpaso,147.32,+,0.6,Tone,162.2,162.2,23,23,NN,FM,5,TX El Paso El Paso K5KKO 147.32 OPEN On-Air
318,CDJelpaso,443.925,+,5,,88.5,88.5,23,23,NN,FM,5,TX El Paso El Paso KA5CDJ 443.925 CLOSED 
319,OIBelpaso,147.36,+,0.6,,88.5,88.5,23,23,NN,FM,5,TX El Paso El Paso KE5OIB 147.36 CLOSED 
320,ZFFelpaso,441.7,+,5,Tone,100,100,23,23,NN,FM,5,TX El Paso El Paso N5ZFF 441.7 OPEN 
321,DPDelpaso,443.65,+,5,,88.5,88.5,23,23,NN,FM,5,TX El Paso El Paso W5DPD 443.65 CLOSED 
322,FAZelpaso,442.125,+,5,Tone,103.5,103.5,23,23,NN,FM,5,TX El Paso El Paso N5FAZ 442.125 OPEN On-Air
323,LENwindowrock,145.29,-,0.6,Tone,123,123,23,23,NN,FM,5,NM McKinley Window Rock K7LEN 145.29 OPEN Off-Air
324,U5Jartesia,442,+,5,,88.5,88.5,23,23,NN,FM,5,NM Eddy Artesia KU5J 442 OPEN 
325,COWartesia,444.975,+,5,Tone,156.7,156.7,23,23,NN,FM,5,NM Eddy Artesia W5COW 444.975 OPEN On-Air
326,"PFOtaos,picuris peak",449.875,-,5,Tone,123,123,23,23,NN,FM,5,"NM Taos Taos, Picuris Peak KF5PFO 449.875 OPEN Off-Air"
327,"PFOtaos,picuris peak",51.5,,0,Tone,100,100,23,23,NN,FM,5,"NM Taos Taos, Picuris Peak KF5PFO 51.5 OPEN On-Air"
328,"PFOtaos,picuris peak",147.12,+,0.6,Tone,67,67,23,23,NN,FM,5,"NM Taos Taos, Picuris Peak KF5PFO 147.12 OPEN On-Air"
329,"PFOtaos,picuris peak",224.4,-,1.6,Tone,225.7,225.7,23,23,NN,FM,5,"NM Taos Taos, Picuris Peak KF5PFO 224.4 OPEN On-Air"
330,"PFOtrespiedras, san antonio mountain",146.76,-,0.6,Tone,67,67,23,23,NN,FM,5,"NM Taos Tres Piedras, San Antonio Mountain KF5PFO 146.76 OPEN On-Air"
331,"PFOredriver, molycorp",145.39,-,0.6,Tone,100,100,23,23,NN,FM,5,"NM Taos Red River, Molycorp KF5PFO 145.39 OPEN On-Air"
332,"PFOtrespiedras,  san antonio mountain",146.76,-,0.6,Tone,67,67,23,23,NN,FM,5,"NM Rio Arriba Tres Piedras,  San Antonio Mountain KF5PFO 146.76 OPEN On-Air"
333,"PFOredriver, valle vidal",145.25,-,0.6,Tone,123,123,23,23,NN,FM,5,"NM Taos Red River, Valle Vidal KF5PFO 145.25 OPEN On-Air"
334,"D7Wpinetop-lakeside,porter mountain",146.76,-,0.6,Tone,162.2,162.2,23,23,NN,DIG,5,"AZ Navajo Pinetop-Lakeside, Porter Mountain AD7W 146.76 OPEN On-Air"
335,"D7Wpinetop-lakeside,porter mountain",449.05,-,5,,88.5,88.5,23,23,NN,DIG,5,"AZ Navajo Pinetop-Lakeside, Porter Mountain AD7W 449.05 OPEN On-Air"
336,PDCfabens,147.98,-,0.6,Tone,162.2,162.2,23,23,NN,FM,5,TX Hudspeth Fabens W5PDC 147.98 OPEN 
337,PDCfabens,442.45,+,5,Tone,203.5,203.5,23,23,NN,FM,5,TX Hudspeth Fabens W5PDC 442.45 OPEN 
338,JNIwagonmound,444.4,+,5,Tone,100,100,23,23,NN,FM,5,NM Mora Wagon Mound N7JNI 444.4 OPEN Off-Air
339,"ITSbloomfield,harris mesa",147.1,+,0.6,Tone,100,100,23,23,NN,FM,5,"NM San Juan Bloomfield, Harris mesa KB5ITS 147.1 OPEN On-Air"
340,ITSbloomfield,448.65,-,5,Tone,127.3,127.3,23,23,NN,FM,5,NM San Juan Bloomfield KB5ITS 448.65 OPEN On-Air
341,"ITSnavajodam, navajo lake",147.36,+,0.6,Tone,100,100,23,23,NN,FM,5,"NM San Juan Navajo Dam, Navajo Lake KB5ITS 147.36 OPEN On-Air"
342,ITSfarmington,53.01,-,1,Tone,131.8,131.8,23,23,NN,FM,5,NM San Juan Farmington KB5ITS 53.01 OPEN On-Air
343,ITSfarmington,146.76,-,0.6,TSQL,100,100,23,23,NN,FM,5,NM San Juan Farmington KB5ITS 146.76 OPEN On-Air
344,ITSfarmington,147,+,0.6,Tone,100,100,23,23,NN,FM,5,NM San Juan Farmington KB5ITS 147 OPEN On-Air
345,"ITSaztec,tank mtn",146.88,-,0.6,Tone,100,100,23,23,NN,FM,5,"NM San Juan Aztec, Tank Mtn KB5ITS 146.88 OPEN On-Air"
346,ITSaztec,447.45,-,5,Tone,107.2,107.2,23,23,NN,FM,5,NM San Juan Aztec KB5ITS 447.45 OPEN On-Air
347,"ITSlukachukai,roof butte",145.25,-,0.6,Tone,100,100,23,23,NN,FM,5,"AZ Apache Lukachukai, Roof Butte KB5ITS 145.25 OPEN On-Air"
348,"LEMangelfire, agua fria peak",147.34,+,0.6,Tone,100,100,23,23,NN,FM,5,"NM Colfax Angel Fire, Agua Fria Peak N5LEM 147.34 OPEN On-Air"
349,"VBDbloomfield,harris mesa",1292.3,-,20,,88.5,88.5,23,23,NN,DIG,5,"NM San Juan Bloomfield, Harris Mesa KF5VBD 1292.3 CLOSED On-Air"
350,LEAmaljamar,444.35,+,5,TSQL,162.2,162.2,23,23,NN,FM,5,NM Lea Maljamar N5LEA 444.35 OPEN On-Air
351,LEAjal,444.25,+,5,TSQL,100,100,23,23,NN,FM,5,NM Lea Jal N5LEA 444.25 OPEN On-Air
352,LEAhobbs,444.15,+,5,TSQL,162.2,162.2,23,23,NN,FM,5,NM Lea Hobbs N5LEA 444.15 OPEN On-Air
353,WJGcarlsbad,53.08,-,1,Tone,127.3,127.3,23,23,NN,FM,5,NM Eddy Carlsbad KD6WJG 53.08 OPEN 
354,WJGcarlsbad,146.76,-,0.6,Tone,127.3,127.3,23,23,NN,FM,5,NM Eddy Carlsbad KD6WJG 146.76 OPEN 
355,BOMcarlsbad,145.39,-,0.6,TSQL,100,100,23,23,NN,FM,5,NM Eddy Carlsbad KG5BOM 145.39 OPEN On-Air
356,CNMcarlsbad,146.88,-,0.6,Tone,88.5,88.5,23,23,NN,FM,5,NM Eddy Carlsbad N5CNM 146.88 OPEN On-Air
357,"TSVtaos,wheeler peak",444.975,+,5,Tone,123,123,23,23,NN,FM,5,"NM Taos Taos, Wheeler Peak N5TSV 444.975 OPEN On-Air"
358,SORpinesprings,444.05,+,5,,88.5,88.5,23,23,NN,FM,5,TX Culberson Pine Springs N5SOR 444.05 CLOSED 
359,ZIHpinedale,145.23,-,0.6,Tone,110.9,110.9,23,23,NN,FM,5,AZ Navajo Pinedale KB7ZIH 145.23 OPEN On-Air
360,WXIbloomfield,146.92,-,0.6,Tone,100,100,23,23,NN,FM,5,NM San Juan Bloomfield K5WXI 146.92 OPEN On-Air
361,WXIfarmington,146.85,-,0.6,TSQL,100,100,23,23,NN,FM,5,NM San Juan Farmington K5WXI 146.85 OPEN On-Air
362,5MJcarlsbad,224.46,-,1.6,Tone,127.3,127.3,23,23,NN,FM,5,NM Eddy Carlsbad N5MJ 224.46 OPEN 
363,5MJcarlsbad,444.45,+,5,TSQL,127.3,127.3,23,23,NN,FM,5,NM Eddy Carlsbad N5MJ 444.45 OPEN On-Air
364,RUEredlake,146.84,-,0.6,Tone,67,67,23,23,NN,FM,5,NM Roosevelt Redlake KE5RUE 146.84 OPEN On-Air
365,RUEredlake,442.25,+,5,Tone,67,67,23,23,NN,FM,5,NM Roosevelt Redlake KE5RUE 442.25 OPEN On-Air
366,RUEportales,146.82,-,0.6,Tone,67,67,23,23,NN,FM,5,NM Roosevelt Portales KE5RUE 146.82 OPEN On-Air
367,"RUEportales,eastern new mexico university",443.8,+,5,,88.5,88.5,23,23,NN,DIG,5,"NM  PORTALES, EASTERN NEW MEXICO UNIVERSITY KE5RUE 443.8 OPEN "
368,RUEmidway(portales),147,+,0.6,Tone,67,67,23,23,NN,FM,5,NM Roosevelt Midway (Portales) KE5RUE 147 OPEN 
369,ARZholbrook,146.68,-,0.6,,88.5,88.5,23,23,NN,FM,5,AZ Navajo Holbrook KA7ARZ 146.68 OPEN On-Air
370,EMAtucumcari,146.88,-,0.6,,88.5,88.5,23,23,NN,FM,5,NM Quay Tucumcari WA5EMA 146.88 OPEN On-Air
371,EMAtucumcari,224.98,-,1.6,,88.5,88.5,23,23,NN,FM,5,NM Quay Tucumcari WA5EMA 224.98 OPEN 
372,EMAtucumcari,443.75,+,5,,88.5,88.5,23,23,NN,FM,5,NM Quay Tucumcari WA5EMA 443.75 OPEN On-Air
373,"JEMsafford, heliograph peak",448.675,-,5,Tone,100,100,23,23,NN,FM,5,"AZ Graham Safford,  Heliograph Peak K7JEM 448.675 CLOSED On-Air"
374,"VBFfarmington,farmington bluffs",1291.7,-,20,,88.5,88.5,23,23,NN,DIG,5,"NM San Juan Farmington, Farmington Bluffs KF5VBF 1291.7 CLOSED On-Air"
375,VBFfarmington,444.15,+,5,,88.5,88.5,23,23,NN,DIG,5,NM San Juan Farmington KF5VBF 444.15 OPEN On-Air
376,VBEaztec,1291.1,-,20,,88.5,88.5,23,23,NN,DIG,5,NM Bernalillo Aztec KF5VBE 1291.1 CLOSED On-Air
377,VBEfarmington,145.115,-,0.6,,88.5,88.5,23,23,NN,DIG,5,NM San Juan Farmington KF5VBE 145.115 OPEN On-Air
378,UBJfarmington,442.325,+,5,,88.5,88.5,23,23,NN,DIG,5,NM San Juan Farmington N5UBJ 442.325 OPEN On-Air
379,UBJaztec,442.25,+,5,,88.5,88.5,23,23,NN,DIG,5,NM San Juan Aztec N5UBJ 442.25 OPEN On-Air
380,5WYfarmington,449,-,5,Tone,100,100,23,23,NN,FM,5,NM San Juan Farmington K5WY 449 OPEN 
381,"OMUportales,enmu greyhound stadium",147,+,0.6,Tone,67,67,23,23,NN,FM,5,"NM Roosevelt Portales, ENMU Greyhound Stadium W5OMU 147 OPEN On-Air"
382,GDRcimarron,145.21,-,0.6,TSQL,110.9,110.9,23,23,NN,FM,5,NM Colfax Cimarron N5GDR 145.21 OPEN On-Air
383,RIMovergaard,146.8,-,0.6,Tone,162.2,162.2,23,23,NN,FM,5,AZ Navajo Overgaard W7RIM 146.8 OPEN On-Air
384,A5Bclovis,147.24,+,0.6,Tone,67,67,23,23,NN,FM,5,NM Curry Clovis KA5B 147.24 OPEN On-Air
385,A5Bclovis,443.45,+,5,Tone,131.8,131.8,23,23,NN,FM,5,NM Curry Clovis KA5B 443.45 OPEN On-Air
386,S5Dclovis,147.32,+,0.6,TSQL,71.9,71.9,23,23,NN,FM,5,NM Curry Clovis WS5D 147.32 OPEN On-Air
387,S5Dclovis,444.45,+,5,TSQL,88.5,88.5,23,23,NN,FM,5,NM Curry Clovis WS5D 444.45 OPEN On-Air
388,EOJclovis,442.225,+,5,,88.5,88.5,23,23,NN,DIG,5,NM Curry Clovis N7EOJ 442.225 OPEN On-Air
389,"DSTlogan,ute lake",147.34,+,0.6,Tone,131.8,131.8,23,23,NN,FM,5,"NM Quay Logan, Ute Lake K5DST 147.34 OPEN On-Air"
390,"NAZpayson,forest lakes",447.475,-,5,Tone,88.5,88.5,23,23,NN,FM,5,"AZ Coconino Payson, Forest Lakes W7NAZ 447.475 OPEN "
391,RDZwinslow,146.84,-,0.6,,88.5,88.5,23,23,NN,FM,5,AZ Navajo Winslow N7RDZ 146.84 OPEN On-Air
392,RDZwinslow,147.38,+,0.6,Tone,91.5,91.5,23,23,NN,FM,5,AZ Navajo Winslow N7RDZ 147.38 OPEN On-Air
393,"7DRglobe,pinal peak",1283.65,-,20,Tone,100,100,23,23,NN,FM,5,"AZ Gila Globe, Pinal Peak KD7DR 1283.65 OPEN On-Air"
394,"7DRglobe,pinal peak",448.425,-,5,Tone,103.5,103.5,23,23,NN,FM,5,"AZ Gila Globe, Pinal Peak KD7DR 448.425 OPEN On-Air"
395,"QWFglobe,pinal peak",445.8625,-,5,,88.5,88.5,23,23,NN,DIG,5,"AZ Gila Globe, Pinal Peak N2QWF 445.8625 CLOSED On-Air"
396,"QWFsierravista, mule mountain",445.85,-,5,,88.5,88.5,23,23,NN,DIG,5,"AZ Cochise Sierra Vista, Mule Mountain N2QWF 445.85 OPEN On-Air"
397,"7MKglobe, pinal peak",224.1,-,1.6,Tone,156.7,156.7,23,23,NN,FM,5,"AZ Gila Globe,  Pinal Peak N7MK 224.1 OPEN On-Air"
398,"TWWglobe,pinal peak",927.8375,-,25,Tone,151.4,151.4,23,23,NN,FM,5,"AZ Gila Globe, Pinal Peak N7TWW 927.8375 OPEN On-Air"
399,"KUMglobe, pinal peak",448.65,-,5,,88.5,88.5,23,23,NN,FM,5,"AZ Gila Globe,  Pinal Peak WA7KUM 448.65 CLOSED On-Air"
400,"HUHglobe,signal peak",146.74,-,0.6,Tone,162.2,162.2,23,23,NN,FM,5,"AZ Gila Globe, Signal Peak WA7HUH 146.74 OPEN On-Air"
401,INWhobbs,147.22,+,0.6,TSQL,127.3,127.3,23,23,NN,FM,5,NM Lea Hobbs K5INW 147.22 OPEN Off-Air
402,"2AZhobbs,professional communications tower",444.275,+,5,TSQL,162.2,162.2,23,23,NN,FM,5,"NM Lea Hobbs, Professional Communications Tower AH2AZ 444.275 OPEN "
403,MWWeunice,442.9,+,7,Tone,91.5,91.5,23,23,NN,FM,5,NM Lea Eunice KB5MWW 442.9 OPEN Off-Air
404,NBReunice,147.22,+,0.6,,88.5,88.5,23,23,NN,FM,5,NM Lea Eunice N5NBR 147.22 OPEN Off-Air
405,7CQtombstone,146.92,-,0.6,TSQL,123,123,23,23,NN,DIG,5,AZ Cochise Tombstone AB7CQ 146.92 OPEN On-Air
406,7CQtombstone,444.6,+,5,TSQL,100,100,23,23,NN,DIG,5,AZ Cochise Tombstone AB7CQ 444.6 OPEN On-Air
407,PIQbenson,448.825,-,5,Tone,107.2,107.2,23,23,NN,FM,5,AZ Cochise Benson WA7PIQ 448.825 OPEN On-Air
408,ELNoracle,448.7,-,5,,88.5,88.5,23,23,NN,FM,5,AZ Pima Oracle WA7ELN 448.7 CLOSED On-Air
409,"RDGbisbee, mule mountains",146.76,-,0.6,Tone,162.2,162.2,23,23,NN,FM,5,"AZ Cochise Bisbee,  Mule Mountains K7RDG 146.76 OPEN On-Air"
410,"RDGbisbee, mule mountains",147.02,+,0.6,Tone,162.2,162.2,23,23,NN,FM,5,"AZ Cochise Bisbee,  Mule Mountains K7RDG 147.02 OPEN On-Air"
411,"RDGbisbee,mule mountains",449.525,-,5,Tone,100,100,23,23,NN,FM,5,"AZ Cochise Bisbee, Mule Mountains K7RDG 449.525 OPEN On-Air"
412,"RDGsierravista, green acres",447.95,-,5,Tone,100,100,23,23,NN,FM,5,"AZ Cochise Sierra Vista, Green Acres K7RDG 447.95 OPEN On-Air"
413,"RSTtucson,bank of america",145.115,-,0.6,,88.5,88.5,23,23,NN,DIG,5,"AZ Pima Tucson, Bank of America K7RST 145.115 OPEN On-Air"
414,"RSTtucson,mt lemmon",145.25,-,0.6,Tone,156.7,156.7,23,23,NN,DIG,5,"AZ Pima Tucson, Mt Lemmon K7RST 145.25 OPEN On-Air"
415,RSTvail,448.325,-,5,TSQL,156.7,156.7,23,23,NN,FM,5,AZ Pima Vail K7RST 448.325 OPEN On-Air
416,"SPVtucson,mt lemmon, radio ridge",1282.75,-,12,Tone,131.8,131.8,23,23,NN,FM,5,"AZ Pima Tucson, Mt Lemmon, Radio Ridge K7SPV 1282.75 OPEN On-Air"
417,"SPVbenson,haystack mtn",145.37,-,0.6,Tone,131.8,131.8,23,23,NN,FM,5,"AZ Cochise Benson, Haystack Mtn K7SPV 145.37 OPEN On-Air"
418,"PYPtucson, mt lemmon",224.5,-,1.6,Tone,156.7,156.7,23,23,NN,FM,5,"AZ Pima Tucson,  Mt Lemmon K6PYP 224.5 OPEN On-Air"
419,"PYPtucson,mt lemmon, radio ridge",927.1375,-,25,DTCS,88.5,88.5,411,411,NN,FM,5,"AZ Pima Tucson, Mt Lemmon, Radio Ridge K6PYP 927.1375 OPEN On-Air"
420,PYPtucson,927.1125,-,25,DTCS,88.5,88.5,432,432,NN,FM,5,AZ Pima Tucson K6PYP 927.1125 OPEN On-Air
421,"HNDtucson,mount lemmon",147,+,0.6,Tone,110.9,110.9,23,23,NN,FM,5,"AZ Pima Tucson, Mount Lemmon N7HND 147 OPEN On-Air"
422,"HNDtucson,mt lemmon",445.875,-,5,,88.5,88.5,23,23,NN,DIG,5,"AZ Pima Tucson, Mt Lemmon N7HND 445.875 OPEN On-Air"
423,"HNDtucson,mt lemmon",927.05,-,25,DTCS,88.5,88.5,411,411,NN,FM,5,"AZ Pima Tucson, Mt Lemmon N7HND 927.05 OPEN On-Air"
424,"LFXtucson,mt lemmon",53.72,-,1,TSQL,136.5,136.5,23,23,NN,FM,5,"AZ Pima Tucson, Mt Lemmon KA7LFX 53.72 OPEN On-Air"
425,"LFXtucson,mt lemmon",224.06,-,1.6,Tone,156.7,156.7,23,23,NN,FM,5,"AZ Pima Tucson, Mt Lemmon KA7LFX 224.06 OPEN On-Air"
426,"0LLtucson,mt lemmon",147.14,+,0.6,Tone,100,100,23,23,NN,FM,5,"AZ Pima Tucson, Mt Lemmon KC0LL 147.14 OPEN On-Air"
427,"0LLtucson,mt lemmon",444.975,+,5,Tone,100,100,23,23,NN,FM,5,"AZ Pima Tucson, Mt Lemmon KC0LL 444.975 OPEN On-Air"
428,"OEMtucson,mt lemmon",146.88,-,0.6,Tone,110.9,110.9,23,23,NN,FM,5,"AZ Pima Tucson, Mt Lemmon N7OEM 146.88 OPEN On-Air"
429,"OEMtucson, mt lemmon",448.55,-,5,Tone,110.9,110.9,23,23,NN,FM,5,"AZ Pima Tucson,  Mt Lemmon N7OEM 448.55 OPEN On-Air"
430,"ZZYtucson,mt lemmon",444.925,+,5,DTCS,88.5,88.5,23,23,NN,DIG,5,"AZ Pima Tucson, Mt Lemmon KB7ZZY 444.925 OPEN On-Air"
431,"DHStucson,mt lemmon",448.35,-,5,Tone,107.2,107.2,23,23,NN,FM,5,"AZ Pima Tucson, Mt Lemmon N1DHS 448.35 OPEN On-Air"
432,"ATNtucson, mt lemmon",445.225,-,5,Tone,103.5,103.5,23,23,NN,FM,5,"AZ Pima Tucson,  Mt Lemmon W7ATN 445.225 OPEN On-Air"
433,SVIjal,147.1,+,0.6,,88.5,88.5,23,23,NN,FM,5,NM Lea Jal N5SVI 147.1 OPEN 
434,BOPdesmoines,146.85,-,0.6,Tone,100,100,23,23,NN,FM,5,NM Union Des Moines N5BOP 146.85 OPEN Off-Air
435,BOPdesmoines,444.8,+,5,Tone,77,77,23,23,NN,FM,5,NM Union Des Moines N5BOP 444.8 OPEN Off-Air
436,D7Ftucson,146.94,-,0.6,Tone,110.9,110.9,23,23,NN,FM,5,AZ Pima Tucson WD7F 146.94 OPEN On-Air
437,"LTNsierravista, mustang corners",442.45,+,5,TSQL,100,100,23,23,NN,FM,5,"AZ Cochise Sierra Vista, Mustang Corners K7LTN 442.45 OPEN On-Air"
438,MUEhuachucacity,442,+,5,,88.5,88.5,23,23,NN,FM,5,AZ Cochise Huachuca City N7MUE 442 OPEN On-Air
439,LHRvail,449.55,-,5,Tone,107.2,107.2,23,23,NN,FM,5,AZ Pima Vail K7LHR 449.55 OPEN On-Air
440,DIGsierravista,441.2,+,5,Tone,88.5,88.5,23,23,NN,DIG,5,AZ Cochise Sierra Vista W7DIG 441.2 OPEN Off-Air
441,ULCvail,446.55,-,5,Tone,100,100,23,23,NN,FM,5,AZ Pima Vail KE7ULC 446.55 OPEN On-Air
442,NBHsierravista,1282.5,-,20,Tone,100,100,23,23,NN,FM,5,AZ Cochise Sierra Vista N0NBH 1282.5 OPEN On-Air
