Location,Name,Frequency,Duplex,Offset,Tone,rToneFreq,cToneFreq,DtcsCode,DtcsRxCode,DtcsPolarity,Mode,TStep,Comment
0,Cedaredge W0ALC 147.36,147.36,+,0.6,Tone,100,88.5,23,23,NN,FM,5,CO Delta Cedaredge W0ALC 147.36
1,Cedaredge W0ALC 449.825,449.825,-,5,Tone,100,88.5,23,23,NN,FM,5,CO Delta Cedaredge W0ALC 449.825
2,"Cedaredge, Cedar Mesa KC0QXX 147.195",147.195,+,0.6,Tone,107.2,88.5,23,23,NN,FM,5,"CO Delta Cedaredge, Cedar Mesa KC0QXX 147.195"
3,"Cedaredge, Grand Mesa  447.35",447.35,-,5,Tone,107.2,88.5,23,23,NN,FM,5,"CO Delta Cedaredge, Grand Mesa  447.35"
4,Paonia KI0MR 147.33,147.33,+,0.6,Tone,107.2,88.5,23,23,NN,FM,5,CO Delta Paonia KI0MR 147.33
5,"Carbondale, Four Mile Ridge K0ELK 449.725",449.725,-,5,Tone,179.9,88.5,23,23,NN,FM,5,"CO Garfield Carbondale, Four Mile Ridge K0ELK 449.725"
6,"Carbondale, Four Mile Ridge K0SNO 147.39",147.39,+,0.6,Tone,107.2,88.5,23,23,NN,FM,5,"CO Garfield Carbondale, Four Mile Ridge K0SNO 147.39"
7,"Carbondale, Missouri Heights K0VQ 447.15",447.15,-,5,Tone,136.5,88.5,23,23,NN,FM,5,"CO Garfield Carbondale, Missouri Heights K0VQ 447.15"
8,"Glenwood Springs, Lookout Mountain WA4HND 449.85",449.85,-,5,TSQL,131.8,131.8,23,23,NN,FM,5,"CO Garfield Glenwood Springs, Lookout Mountain WA4HND 449.85"
9,"Glenwood Springs, Sunlight Peak KB0VJJ 146.85",146.85,-,0.6,Cross,88.5,123,23,23,NN,FM,5,"CO Garfield Glenwood Springs, Sunlight Peak KB0VJJ 146.85"
10,"Glenwood Springs, Sunlight Peak KI0G 146.88",146.88,-,0.6,Tone,107.2,88.5,23,23,NN,FM,5,"CO Garfield Glenwood Springs, Sunlight Peak KI0G 146.88"
11,"Glenwood Springs, Sunlight Peak KI0G 447.1",447.1,-,5,Tone,107.2,88.5,23,23,NN,FM,5,"CO Garfield Glenwood Springs, Sunlight Peak KI0G 447.1"
12,"Glenwood Springs, Sunlight Peak N0XLI 449.6",449.6,-,5,Tone,107.2,88.5,23,23,NN,FM,5,"CO Garfield Glenwood Springs, Sunlight Peak N0XLI 449.6"
13,"Loma, Baxter Pass KB0SW 447",447,-,5,Tone,107.2,88.5,23,23,NN,FM,5,"CO Garfield Loma, Baxter Pass KB0SW 447"
14,"Parachute, Mount Callahan WA4HND 449.8",449.8,-,5,Tone,107.2,88.5,23,23,NN,FM,5,"CO Garfield Parachute, Mount Callahan WA4HND 449.8"
15,Gunnison K5GF 449.95,449.95,-,5,,88.5,88.5,23,23,NN,FM,5,CO Gunnison Gunnison K5GF 449.95
16,Gunnison W0VTL 147.12,147.12,+,0.6,,88.5,88.5,23,23,NN,FM,5,CO Gunnison Gunnison W0VTL 147.12
17,"Lake City, Hill 71 KB5ITS 147.135",147.135,-,0.6,Tone,123,88.5,23,23,NN,FM,5,"CO Hinsdale Lake City, Hill 71 KB5ITS 147.135"
18,"Silverton, Hazelton KB5ITS 444",444,+,5,Tone,67,88.5,23,23,NN,FM,5,"CO Huerfano Silverton, Hazelton KB5ITS 444"
19,"Delta, Uncompahgre Butte KB0YNA 449.4",449.4,-,5,TSQL,131.8,131.8,23,23,NN,FM,5,"CO Mesa Delta, Uncompahgre Butte KB0YNA 449.4"
20,Grand Junction K0SSI 147.105,147.105,+,0.6,,88.5,88.5,23,23,NN,FM,5,CO Mesa Grand Junction K0SSI 147.105
21,Grand Junction KC0ARV 447.5,447.5,-,5,Tone,114.8,88.5,23,23,NN,FM,5,CO Mesa Grand Junction KC0ARV 447.5
22,Grand Junction KD0SMZ 449.775,449.775,-,5,Cross,173.8,88.5,23,23,NN,FM,5,CO Mesa Grand Junction KD0SMZ 449.775
23,Grand Junction KE0TY 145.22,145.22,-,0.6,Tone,107.2,88.5,23,23,NN,FM,5,CO Mesa Grand Junction KE0TY 145.22
24,Grand Junction KE0TY 147.39,147.39,+,0.6,Tone,107.2,88.5,23,23,NN,FM,5,CO Mesa Grand Junction KE0TY 147.39
25,Grand Junction W0GJT 146.82,146.82,-,0.6,Tone,107.2,88.5,23,23,NN,FM,5,CO Mesa Grand Junction W0GJT 146.82
26,Grand Junction W0GJT 448.15,448.15,-,5,Tone,100,88.5,23,23,NN,FM,5,CO Mesa Grand Junction W0GJT 448.15
27,"Grand Junction, Black Ridge (Above Colorado Ntl Monument) W0RRZ 146.94",146.94,-,0.6,TSQL,107.2,107.2,23,23,NN,FM,5,"CO Mesa Grand Junction, Black Ridge (Above Colorado Ntl Monument) W0RRZ 146.94"
28,"Grand Junction, Black Ridge WA4HND 449.575",449.575,-,5,TSQL,131.8,131.8,23,23,NN,FM,5,"CO Mesa Grand Junction, Black Ridge WA4HND 449.575"
29,"Grand Junction, GJT W0RRZ 145.175",145.175,-,0.6,Tone,107.2,88.5,23,23,NN,FM,5,"CO Mesa Grand Junction, GJT W0RRZ 145.175"
30,"Grand Junction, Grand Mesa KB0VJJ 145.355",145.355,-,0.6,Cross,88.5,123,23,23,NN,FM,5,"CO Mesa Grand Junction, Grand Mesa KB0VJJ 145.355"
31,"Grand Junction, Grand Mesa KB0VJJ 147.355",147.355,-,0.6,Cross,88.5,123,23,23,NN,FM,5,"CO Mesa Grand Junction, Grand Mesa KB0VJJ 147.355"
32,"Grand Junction, Grand Mesa KB0YNA 449.65",449.65,-,5,TSQL,151.4,151.4,23,23,NN,FM,5,"CO Mesa Grand Junction, Grand Mesa KB0YNA 449.65"
33,"Grand Junction, Grand Mesa WA4HND 449.3",449.3,-,5,TSQL,107.2,107.2,23,23,NN,FM,5,"CO Mesa Grand Junction, Grand Mesa WA4HND 449.3"
34,Craig KB0VJJ 146.97,146.97,-,0.6,Cross,88.5,123,23,23,NN,FM,5,CO Moffat Craig KB0VJJ 146.97
35,Craig WD0HAM 145.265,145.265,-,0.6,Tone,107.2,88.5,23,23,NN,FM,5,CO Moffat Craig WD0HAM 145.265
36,"Dolores, Summit Ridge KB5ITS 447.275",447.275,-,5,Tone,100,88.5,23,23,NN,FM,5,"CO Montezuma Dolores, Summit Ridge KB5ITS 447.275"
37,Montrose KC0UUX 146.91,146.91,-,0.6,TSQL,107.2,107.2,23,23,NN,FM,5,CO Montrose Montrose KC0UUX 146.91
38,Montrose KD5OPD 146.79,146.79,-,0.6,TSQL,107.2,107.2,23,23,NN,FM,5,CO Montrose Montrose KD5OPD 146.79
39,"Montrose, Waterdog Peak KB0YNA 448.65",448.65,-,5,TSQL,88.5,151.4,23,23,NN,FM,5,"CO Montrose Montrose, Waterdog Peak KB0YNA 448.65"
40,"Montrose, Waterdog Peak WA4HND 447.2",447.2,-,5,TSQL,107.2,107.2,23,23,NN,FM,5,"CO Montrose Montrose, Waterdog Peak WA4HND 447.2"
41,"Ouray, Engineer Mountain KB5ITS 147.27",147.27,+,0.6,Tone,127.3,88.5,23,23,NN,FM,5,"CO Ouray Ouray, Engineer Mountain KB5ITS 147.27"
42,"Aspen, Aspen Mountain K0VQ 447.05",447.05,-,5,TSQL,136.5,136.5,23,23,NN,FM,5,"CO Pitkin Aspen, Aspen Mountain K0VQ 447.05"
43,Snowmass Village K0CL 146.67,146.67,-,0.6,Tone,107.2,88.5,23,23,NN,FM,5,CO Pitkin Snowmass Village K0CL 146.67
44,Silverton KB5ITS 447.525,447.525,-,5,Tone,127.3,88.5,23,23,NN,FM,5,CO San Juan Silverton KB5ITS 447.525
45,"Silverton, Buffalo Boy KB5ITS 145.325",145.325,-,0.6,Tone,127.3,88.5,23,23,NN,FM,5,"CO San Juan Silverton, Buffalo Boy KB5ITS 145.325"
46,"Silverton, Engineer Mountain KB5ITT 147.27",147.27,+,0.6,Tone,127.3,88.5,23,23,NN,FM,5,"CO San Juan Silverton, Engineer Mountain KB5ITT 147.27"
47,"Silverton, Kendall Mountain KB5ITS 147.375",147.375,+,0.6,Tone,156.7,88.5,23,23,NN,FM,5,"CO San Juan Silverton, Kendall Mountain KB5ITS 147.375"
48,"Telluride, Gray Head KB0YNA 449.7",449.7,-,5,TSQL,107.2,107.2,23,23,NN,FM,5,"CO San Miguel Telluride, Gray Head KB0YNA 449.7"
49,"Price,  Wood Hill W7CEU 145.43",145.43,-,0.6,Tone,88.5,88.5,23,23,NN,FM,5,"UT Carbon Price,  Wood Hill W7CEU 145.43"
50,"Price,  Wood Hill W7CEU 224.5",224.5,-,1.6,Tone,88.5,88.5,23,23,NN,FM,5,"UT Carbon Price,  Wood Hill W7CEU 224.5"
51,"Price,  Wood Hill W7CEU 448.3",448.3,-,5,Tone,88.5,88.5,23,23,NN,FM,5,"UT Carbon Price,  Wood Hill W7CEU 448.3"
52,"Price, Wood Hill K7GX 147.2",147.2,+,0.6,Tone,88.5,88.5,23,23,NN,FM,5,"UT Carbon Price, Wood Hill K7GX 147.2"
53,"Price, Wood Hill K7GX 448.3",448.3,-,5,,88.5,88.5,23,23,NN,FM,5,"UT Carbon Price, Wood Hill K7GX 448.3"
54,"Sunny Side, Bruin Peak WX7Y 145.175",145.175,-,0.6,,88.5,88.5,23,23,NN,FM,5,"UT Carbon Sunny Side, Bruin Peak WX7Y 145.175"
55,"Sunnyside, Bruin Point K7SDC 147.32",147.32,+,0.6,Tone,88.5,88.5,23,23,NN,FM,5,"UT Carbon Sunnyside, Bruin Point K7SDC 147.32"
56,"Sunnyside, Bruin Point K7SDC 449.05",449.05,-,5,Tone,88.5,88.5,23,23,NN,FM,5,"UT Carbon Sunnyside, Bruin Point K7SDC 449.05"
57,Altamont AD7ZW 147.28,147.28,+,0.6,TSQL,107.2,107.2,23,23,NN,FM,5,UT Duchesne Altamont AD7ZW 147.28
58,Duchense N7PQD 147.26,147.26,+,0.6,,88.5,88.5,23,23,NN,FM,5,UT Duchesne Duchense N7PQD 147.26
59,"Myton, Flat Top W7BYU 145.49",145.49,-,0.6,Tone,136.5,88.5,23,23,NN,FM,5,"UT Duchesne Myton, Flat Top W7BYU 145.49"
60,"Castle Dale, Cedar Mountain K7SDC 147.14",147.14,+,0.6,Tone,88.5,88.5,23,23,NN,FM,5,"UT Emery Castle Dale, Cedar Mountain K7SDC 147.14"
61,"Castle Dale, Cedar Mountain K7SDC 448.55",448.55,-,5,Tone,88.5,88.5,23,23,NN,FM,5,"UT Emery Castle Dale, Cedar Mountain K7SDC 448.55"
62,Moab K7QEQ 146.9,146.9,-,0.6,Tone,88.5,88.5,23,23,NN,FM,5,UT Grand Moab K7QEQ 146.9
63,"Moab, Bald Mesa K7QEQ 146.76",146.76,-,0.6,Tone,88.5,88.5,23,23,NN,FM,5,"UT Grand Moab, Bald Mesa K7QEQ 146.76"
64,"Moab, Bald Mesa K7QEQ 449.1",449.1,-,5,TSQL,107.2,107.2,23,23,NN,FM,5,"UT Grand Moab, Bald Mesa K7QEQ 449.1"
65,"Monticello, Abajo Peak K7QEQ 447.1",447.1,-,5,TSQL,107.2,107.2,23,23,NN,FM,5,"UT San Juan Monticello, Abajo Peak K7QEQ 447.1"
66,"Monticello, Abajo Peak K7SDC 146.61",146.61,-,0.6,Tone,88.5,88.5,23,23,NN,FM,5,"UT San Juan Monticello, Abajo Peak K7SDC 146.61"
67,Vernal W7BYU 449.7,449.7,-,5,Tone,136.5,88.5,23,23,NN,FM,5,UT Uintah Vernal W7BYU 449.7
68,"Vernal, Blue Mountain W7BAR 147.1",147.1,+,0.6,Tone,136.5,88.5,23,23,NN,FM,5,"UT Uintah Vernal, Blue Mountain W7BAR 147.1"
69,"Vernal, Grizzly Ridge W7BAR 147.04",147.04,+,0.6,Tone,136.5,88.5,23,23,NN,FM,5,"UT Uintah Vernal, Grizzly Ridge W7BAR 147.04"
70,"Vernal, Uintah County EOC W7BAR 449.9",449.9,-,5,Tone,136.5,88.5,23,23,NN,FM,5,"UT Uintah Vernal, Uintah County EOC W7BAR 449.9"
