Location,Name,Frequency,Duplex,Offset,Tone,rToneFreq,cToneFreq,DtcsCode,DtcsRxCode,DtcsPolarity,Mode,TStep,Comment
0,"Maysville, CO KD0MRC 145.325",145.325,-,0.6,Tone,100,88.5,23,23,NN,FM,5,"CO Chaffee Maysville, CO KD0MRC 145.325"
1,"Evergreen, Squaw Mountain N0PYY 147.3",147.3,+,0.6,TSQL,103.5,103.5,23,23,NN,FM,5,"CO Clear Creek Evergreen, Squaw Mountain N0PYY 147.3"
2,"Idaho Springs, Squaw Mountain K1DUN 449.45",449.45,-,5,Cross,103.5,127.3,23,23,NN,FM,5,"CO Clear Creek Idaho Springs, Squaw Mountain K1DUN 449.45"
3,"Idaho Springs, Squaw Mountain KB0UDD 146.67",146.67,-,0.6,TSQL,100,100,23,23,NN,FM,5,"CO Clear Creek Idaho Springs, Squaw Mountain KB0UDD 146.67"
4,"Idaho Springs, Squaw Mountain N0SZ 448.225",448.225,-,5,TSQL,141.3,141.3,23,23,NN,FM,5,"CO Clear Creek Idaho Springs, Squaw Mountain N0SZ 448.225"
5,"Idaho Springs, Squaw Mountain W0CRA 145.145",145.145,-,0.6,TSQL,107.2,107.2,23,23,NN,FM,5,"CO Clear Creek Idaho Springs, Squaw Mountain W0CRA 145.145"
6,"Idaho Springs, Squaw Mountain W0CRA 447.575",447.575,-,5,TSQL,107.2,107.2,23,23,NN,FM,5,"CO Clear Creek Idaho Springs, Squaw Mountain W0CRA 447.575"
7,"Idaho Springs, Squaw Mountain W0TX 449.35",449.35,-,5,TSQL,100,100,23,23,NN,FM,5,"CO Clear Creek Idaho Springs, Squaw Mountain W0TX 449.35"
8,"Idaho Springs, Squaw Mountain W0WYX 146.94",146.94,-,0.6,TSQL,103.5,103.5,23,23,NN,FM,5,"CO Clear Creek Idaho Springs, Squaw Mountain W0WYX 146.94"
9,"Idaho Springs, Squaw Mountain WR0AEN 449",449,-,5,TSQL,136.5,136.5,23,23,NN,FM,5,"CO Clear Creek Idaho Springs, Squaw Mountain WR0AEN 449"
10,Cedaredge W0ALC 147.36,147.36,+,0.6,Tone,100,88.5,23,23,NN,FM,5,CO Delta Cedaredge W0ALC 147.36
11,Cedaredge W0ALC 449.825,449.825,-,5,Tone,100,88.5,23,23,NN,FM,5,CO Delta Cedaredge W0ALC 449.825
12,"Cedaredge, Cedar Mesa KC0QXX 147.195",147.195,+,0.6,Tone,107.2,88.5,23,23,NN,FM,5,"CO Delta Cedaredge, Cedar Mesa KC0QXX 147.195"
13,"Cedaredge, Grand Mesa  447.35",447.35,-,5,Tone,107.2,88.5,23,23,NN,FM,5,"CO Delta Cedaredge, Grand Mesa  447.35"
14,Paonia KI0MR 147.33,147.33,+,0.6,Tone,107.2,88.5,23,23,NN,FM,5,CO Delta Paonia KI0MR 147.33
15,"Idaho Springs, Squaw Mountain W0CFI 448.675",448.675,-,5,TSQL,100,100,23,23,NN,FM,5,"CO Denver Idaho Springs, Squaw Mountain W0CFI 448.675"
16,"Idaho Springs, Squaw Mountain WG0N 449.05",449.05,-,5,TSQL,107.2,107.2,23,23,NN,FM,5,"CO Denver Idaho Springs, Squaw Mountain WG0N 449.05"
17,Vail KB0VJJ 147.345,147.345,+,0.6,Cross,88.5,123,23,23,NN,FM,5,CO Eagle Vail KB0VJJ 147.345
18,Vail N0AFO 224.8,224.8,-,1.6,,88.5,88.5,23,23,NN,FM,5,CO Eagle Vail N0AFO 224.8
19,"Vail, Bald Mountain K0RV 146.61",146.61,-,0.6,Tone,107.2,88.5,23,23,NN,FM,5,"CO Eagle Vail, Bald Mountain K0RV 146.61"
20,"Carbondale, Four Mile Ridge K0ELK 449.725",449.725,-,5,Tone,179.9,88.5,23,23,NN,FM,5,"CO Garfield Carbondale, Four Mile Ridge K0ELK 449.725"
21,"Carbondale, Four Mile Ridge K0SNO 147.39",147.39,+,0.6,Tone,107.2,88.5,23,23,NN,FM,5,"CO Garfield Carbondale, Four Mile Ridge K0SNO 147.39"
22,"Carbondale, Missouri Heights K0VQ 447.15",447.15,-,5,Tone,136.5,88.5,23,23,NN,FM,5,"CO Garfield Carbondale, Missouri Heights K0VQ 447.15"
23,"Glenwood Springs, Lookout Mountain WA4HND 449.85",449.85,-,5,TSQL,131.8,131.8,23,23,NN,FM,5,"CO Garfield Glenwood Springs, Lookout Mountain WA4HND 449.85"
24,"Glenwood Springs, Sunlight Peak KB0VJJ 146.85",146.85,-,0.6,Cross,88.5,123,23,23,NN,FM,5,"CO Garfield Glenwood Springs, Sunlight Peak KB0VJJ 146.85"
25,"Glenwood Springs, Sunlight Peak KI0G 146.88",146.88,-,0.6,Tone,107.2,88.5,23,23,NN,FM,5,"CO Garfield Glenwood Springs, Sunlight Peak KI0G 146.88"
26,"Glenwood Springs, Sunlight Peak KI0G 447.1",447.1,-,5,Tone,107.2,88.5,23,23,NN,FM,5,"CO Garfield Glenwood Springs, Sunlight Peak KI0G 447.1"
27,"Glenwood Springs, Sunlight Peak N0XLI 449.6",449.6,-,5,Tone,107.2,88.5,23,23,NN,FM,5,"CO Garfield Glenwood Springs, Sunlight Peak N0XLI 449.6"
28,"Loma, Baxter Pass KB0SW 447",447,-,5,Tone,107.2,88.5,23,23,NN,FM,5,"CO Garfield Loma, Baxter Pass KB0SW 447"
29,"Parachute, Mount Callahan WA4HND 449.8",449.8,-,5,Tone,107.2,88.5,23,23,NN,FM,5,"CO Garfield Parachute, Mount Callahan WA4HND 449.8"
30,Rollinsville W0RM 224.6,224.6,-,1.6,Tone,100,88.5,23,23,NN,FM,5,CO Gilpin Rollinsville W0RM 224.6
31,Granby KA0YDW 146.82,146.82,-,0.6,Tone,123,88.5,23,23,NN,FM,5,CO Grand Granby KA0YDW 146.82
32,"Kremmling, Santoy Peak KB0VJJ 147.075",147.075,+,0.6,Cross,88.5,123,23,23,NN,FM,5,"CO Grand Kremmling, Santoy Peak KB0VJJ 147.075"
33,Winter Park WA4CCC 447.45,447.45,-,5,Tone,103.5,88.5,23,23,NN,FM,5,CO Grand Winter Park WA4CCC 447.45
34,"Winter Park, Winter Park KB0VJJ 147.285",147.285,+,0.6,Cross,88.5,123,23,23,NN,FM,5,"CO Grand Winter Park, Winter Park KB0VJJ 147.285"
35,Gunnison K5GF 449.95,449.95,-,5,,88.5,88.5,23,23,NN,FM,5,CO Gunnison Gunnison K5GF 449.95
36,Gunnison W0VTL 147.12,147.12,+,0.6,,88.5,88.5,23,23,NN,FM,5,CO Gunnison Gunnison W0VTL 147.12
37,"Gunnison, W Mountain or Tenderfoot Mountain KB0YNA 447.65",447.65,-,5,TSQL,151.4,151.4,23,23,NN,FM,5,"CO Gunnison Gunnison, W Mountain or Tenderfoot Mountain KB0YNA 447.65"
38,"Walden, Peterson Ridge KB0VJJ 145.16",145.16,-,0.6,Cross,88.5,123,23,23,NN,FM,5,"CO Jackson Walden, Peterson Ridge KB0VJJ 145.16"
39,"Idaho Springs, Centennial Cone W0TX 145.49",145.49,-,0.6,TSQL,100,100,23,23,NN,FM,5,"CO Jefferson Idaho Springs, Centennial Cone W0TX 145.49"
40,"Leadville, Mosquito Pass KB0VJJ 145.445",145.445,-,0.6,Tone,88.5,88.5,23,23,NN,FM,5,"CO Lake Leadville, Mosquito Pass KB0VJJ 145.445"
41,"Delta, Uncompahgre Butte KB0YNA 449.4",449.4,-,5,TSQL,131.8,131.8,23,23,NN,FM,5,"CO Mesa Delta, Uncompahgre Butte KB0YNA 449.4"
42,Grand Junction K0SSI 147.105,147.105,+,0.6,,88.5,88.5,23,23,NN,FM,5,CO Mesa Grand Junction K0SSI 147.105
43,Grand Junction KC0ARV 447.5,447.5,-,5,Tone,114.8,88.5,23,23,NN,FM,5,CO Mesa Grand Junction KC0ARV 447.5
44,Grand Junction KD0SMZ 449.775,449.775,-,5,Cross,173.8,88.5,23,23,NN,FM,5,CO Mesa Grand Junction KD0SMZ 449.775
45,Grand Junction KE0TY 145.22,145.22,-,0.6,Tone,107.2,88.5,23,23,NN,FM,5,CO Mesa Grand Junction KE0TY 145.22
46,Grand Junction KE0TY 147.39,147.39,+,0.6,Tone,107.2,88.5,23,23,NN,FM,5,CO Mesa Grand Junction KE0TY 147.39
47,Grand Junction W0GJT 146.82,146.82,-,0.6,Tone,107.2,88.5,23,23,NN,FM,5,CO Mesa Grand Junction W0GJT 146.82
48,Grand Junction W0GJT 448.15,448.15,-,5,Tone,100,88.5,23,23,NN,FM,5,CO Mesa Grand Junction W0GJT 448.15
49,"Grand Junction, Black Ridge (Above Colorado Ntl Monument) W0RRZ 146.94",146.94,-,0.6,TSQL,107.2,107.2,23,23,NN,FM,5,"CO Mesa Grand Junction, Black Ridge (Above Colorado Ntl Monument) W0RRZ 146.94"
50,"Grand Junction, Black Ridge WA4HND 449.575",449.575,-,5,TSQL,131.8,131.8,23,23,NN,FM,5,"CO Mesa Grand Junction, Black Ridge WA4HND 449.575"
51,"Grand Junction, GJT W0RRZ 145.175",145.175,-,0.6,Tone,107.2,88.5,23,23,NN,FM,5,"CO Mesa Grand Junction, GJT W0RRZ 145.175"
52,"Grand Junction, Grand Mesa KB0VJJ 145.355",145.355,-,0.6,Cross,88.5,123,23,23,NN,FM,5,"CO Mesa Grand Junction, Grand Mesa KB0VJJ 145.355"
53,"Grand Junction, Grand Mesa KB0VJJ 147.355",147.355,-,0.6,Cross,88.5,123,23,23,NN,FM,5,"CO Mesa Grand Junction, Grand Mesa KB0VJJ 147.355"
54,"Grand Junction, Grand Mesa KB0YNA 449.65",449.65,-,5,TSQL,151.4,151.4,23,23,NN,FM,5,"CO Mesa Grand Junction, Grand Mesa KB0YNA 449.65"
55,"Grand Junction, Grand Mesa WA4HND 449.3",449.3,-,5,TSQL,107.2,107.2,23,23,NN,FM,5,"CO Mesa Grand Junction, Grand Mesa WA4HND 449.3"
56,Craig KB0VJJ 146.97,146.97,-,0.6,Cross,88.5,123,23,23,NN,FM,5,CO Moffat Craig KB0VJJ 146.97
57,Craig WD0HAM 145.265,145.265,-,0.6,Tone,107.2,88.5,23,23,NN,FM,5,CO Moffat Craig WD0HAM 145.265
58,Montrose KC0UUX 146.91,146.91,-,0.6,TSQL,107.2,107.2,23,23,NN,FM,5,CO Montrose Montrose KC0UUX 146.91
59,Montrose KD5OPD 146.79,146.79,-,0.6,TSQL,107.2,107.2,23,23,NN,FM,5,CO Montrose Montrose KD5OPD 146.79
60,"Montrose, Waterdog Peak KB0YNA 448.65",448.65,-,5,TSQL,88.5,151.4,23,23,NN,FM,5,"CO Montrose Montrose, Waterdog Peak KB0YNA 448.65"
61,"Montrose, Waterdog Peak WA4HND 447.2",447.2,-,5,TSQL,107.2,107.2,23,23,NN,FM,5,"CO Montrose Montrose, Waterdog Peak WA4HND 447.2"
62,"Bailey, Dick Mountain AB0PC 146.895",146.895,-,0.6,TSQL,100,100,23,23,NN,FM,5,"CO Park Bailey, Dick Mountain AB0PC 146.895"
63,"Fairplay, Sacramento Mountain WZ0N 447.125",447.125,-,5,TSQL,103.5,103.5,23,23,NN,FM,5,"CO Park Fairplay, Sacramento Mountain WZ0N 447.125"
64,"Aspen, Aspen Mountain K0VQ 447.05",447.05,-,5,TSQL,136.5,136.5,23,23,NN,FM,5,"CO Pitkin Aspen, Aspen Mountain K0VQ 447.05"
65,Snowmass Village K0CL 146.67,146.67,-,0.6,Tone,107.2,88.5,23,23,NN,FM,5,CO Pitkin Snowmass Village K0CL 146.67
66,Steamboat Springs KB0VJJ 147.165,147.165,+,0.6,Cross,88.5,123,23,23,NN,FM,5,CO Routt Steamboat Springs KB0VJJ 147.165
67,Steamboat Springs KB0VJJ 449.625,449.625,-,5,TSQL,123,123,23,23,NN,FM,5,CO Routt Steamboat Springs KB0VJJ 449.625
68,Steamboat Springs KD0H 147.21,147.21,+,0.6,TSQL,107.2,107.2,23,23,NN,FM,5,CO Routt Steamboat Springs KD0H 147.21
69,Breckenridge WB0QMR 146.7,146.7,-,0.6,Tone,107.2,88.5,23,23,NN,FM,5,CO Summit Breckenridge WB0QMR 146.7
70,"Breckenridge, Bald Mountain KB0VJJ 147.39",147.39,+,0.6,Cross,88.5,123,23,23,NN,FM,5,"CO Summit Breckenridge, Bald Mountain KB0VJJ 147.39"
