Location,Name,Frequency,Duplex,Offset,Tone,rToneFreq,cToneFreq,DtcsCode,DtcsRxCode,DtcsPolarity,Mode,TStep,Comment
0,Brighton KD0RG 449.925,449.925,-,5,TSQL,114.8,114.8,23,23,NN,FM,5,CO Adams Brighton KD0RG 449.925
1,Northglenn K0ML 147.045,147.045,+,0.6,Tone,123,88.5,23,23,NN,FM,5,CO Adams Northglenn K0ML 147.045
2,Westminster N1UPS 449.3,449.3,-,5,Tone,100,88.5,23,23,NN,FM,5,CO Adams Westminster N1UPS 449.3
3,Aurora N0OBA 145.19,145.19,-,0.6,Cross,151.4,131.8,23,23,NN,FM,5,CO Arapahoe Aurora N0OBA 145.19
4,Aurora N0ZUQ 448.4,448.4,-,5,Tone,94.8,88.5,23,23,NN,FM,5,CO Arapahoe Aurora N0ZUQ 448.4
5,Aurora W0BG 448.275,448.275,-,5,Tone,156.7,88.5,23,23,NN,FM,5,CO Arapahoe Aurora W0BG 448.275
6,"Aurora, Smoky Hill KB0UDD 145.4",145.4,-,0.8,Tone,100,88.5,23,23,NN,FM,5,"CO Arapahoe Aurora, Smoky Hill KB0UDD 145.4"
7,Boulder W0IA 449.55,449.55,-,5,Tone,100,88.5,23,23,NN,FM,5,CO Boulder Boulder W0IA 449.55
8,"Boulder, Eldorado Mountain W0CRA 145.46",145.46,-,0.6,TSQL,107.2,107.2,23,23,NN,FM,5,"CO Boulder Boulder, Eldorado Mountain W0CRA 145.46"
9,"Boulder, Eldorado Mountain W0CRA 447.975",447.975,-,5,TSQL,107.2,107.2,23,23,NN,FM,5,"CO Boulder Boulder, Eldorado Mountain W0CRA 447.975"
10,"Boulder, Gunbarrel Hill W0IA 146.76",146.76,-,0.6,Tone,100,88.5,23,23,NN,FM,5,"CO Boulder Boulder, Gunbarrel Hill W0IA 146.76"
11,"Boulder, Lee Hill N0SZ 447.75",447.75,-,5,TSQL,141.3,141.3,23,23,NN,FM,5,"CO Boulder Boulder, Lee Hill N0SZ 447.75"
12,"Boulder, Lee Hill W0IA 224.02",224.02,-,1.6,,88.5,88.5,23,23,NN,FM,5,"CO Boulder Boulder, Lee Hill W0IA 224.02"
13,"Boulder, Table Mesa W0DK 448.9",448.9,-,5,Tone,100,88.5,23,23,NN,FM,5,"CO Boulder Boulder, Table Mesa W0DK 448.9"
14,"Boulder, Table Mountain W0DK 146.7",146.7,-,0.6,Tone,100,88.5,23,23,NN,FM,5,"CO Boulder Boulder, Table Mountain W0DK 146.7"
15,Broomfield W0LMA 448.925,448.925,-,5,Tone,131.8,88.5,23,23,NN,FM,5,CO Boulder Broomfield W0LMA 448.925
16,Broomfield W0WYX 449.825,449.825,-,5,Tone,103.5,88.5,23,23,NN,FM,5,CO Boulder Broomfield W0WYX 449.825
17,Gold Hill W0JZ 146.91,146.91,+,0.6,Cross,123,127.3,23,23,NN,FM,5,CO Boulder Gold Hill W0JZ 146.91
18,Longmont N0EPA 448.525,448.525,-,5,Tone,151.4,88.5,23,23,NN,FM,5,CO Boulder Longmont N0EPA 448.525
19,Longmont W0ENO 147.27,147.27,+,0.6,TSQL,100,100,23,23,NN,FM,5,CO Boulder Longmont W0ENO 147.27
20,Longmont W0ENO 448.8,448.8,-,5,TSQL,88.5,88.5,23,23,NN,FM,5,CO Boulder Longmont W0ENO 448.8
21,"Evergreen, Saddleback Mountain AC0KQ 447.85",447.85,-,5,TSQL,141.3,141.3,23,23,NN,FM,5,"CO Clear Creek Evergreen, Saddleback Mountain AC0KQ 447.85"
22,"Evergreen, Squaw Mountain N0PYY 147.3",147.3,+,0.6,TSQL,103.5,103.5,23,23,NN,FM,5,"CO Clear Creek Evergreen, Squaw Mountain N0PYY 147.3"
23,"Idaho Springs, Squaw Mountain K1DUN 449.45",449.45,-,5,Cross,103.5,127.3,23,23,NN,FM,5,"CO Clear Creek Idaho Springs, Squaw Mountain K1DUN 449.45"
24,"Idaho Springs, Squaw Mountain KB0UDD 146.67",146.67,-,0.6,TSQL,100,100,23,23,NN,FM,5,"CO Clear Creek Idaho Springs, Squaw Mountain KB0UDD 146.67"
25,"Idaho Springs, Squaw Mountain N0SZ 448.225",448.225,-,5,TSQL,141.3,141.3,23,23,NN,FM,5,"CO Clear Creek Idaho Springs, Squaw Mountain N0SZ 448.225"
26,"Idaho Springs, Squaw Mountain W0CRA 145.145",145.145,-,0.6,TSQL,107.2,107.2,23,23,NN,FM,5,"CO Clear Creek Idaho Springs, Squaw Mountain W0CRA 145.145"
27,"Idaho Springs, Squaw Mountain W0CRA 447.575",447.575,-,5,TSQL,107.2,107.2,23,23,NN,FM,5,"CO Clear Creek Idaho Springs, Squaw Mountain W0CRA 447.575"
28,"Idaho Springs, Squaw Mountain W0TX 449.35",449.35,-,5,TSQL,100,100,23,23,NN,FM,5,"CO Clear Creek Idaho Springs, Squaw Mountain W0TX 449.35"
29,"Idaho Springs, Squaw Mountain W0WYX 146.94",146.94,-,0.6,TSQL,103.5,103.5,23,23,NN,FM,5,"CO Clear Creek Idaho Springs, Squaw Mountain W0WYX 146.94"
30,"Idaho Springs, Squaw Mountain WR0AEN 449",449,-,5,TSQL,136.5,136.5,23,23,NN,FM,5,"CO Clear Creek Idaho Springs, Squaw Mountain WR0AEN 449"
31,"Aurora, Smokey Hill KB0UDD 448.5",448.5,-,5,Tone,100,88.5,23,23,NN,FM,5,"CO Denver Aurora, Smokey Hill KB0UDD 448.5"
32,Denver K0FEZ 447.925,447.925,-,5,TSQL,100,100,23,23,NN,FM,5,CO Denver Denver K0FEZ 447.925
33,Denver N0JXN 146.715,146.715,-,0.6,TSQL,123,123,23,23,NN,FM,5,CO Denver Denver N0JXN 146.715
34,Denver N5EHP 448.075,448.075,-,5,Tone,123,88.5,23,23,NN,FM,5,CO Denver Denver N5EHP 448.075
35,"Denver, Broadway Plaza Lofts W0JRL 447.175",447.175,-,5,TSQL,100,100,23,23,NN,FM,5,"CO Denver Denver, Broadway Plaza Lofts W0JRL 447.175"
36,"Denver, Green Valley Ranch K0GUR 448.15",448.15,-,5,TSQL,141.3,141.3,23,23,NN,FM,5,"CO Denver Denver, Green Valley Ranch K0GUR 448.15"
37,"Golden, Centennial Cone K0FEZ 146.985",146.985,-,0.6,TSQL,100,100,23,23,NN,FM,5,"CO Denver Golden, Centennial Cone K0FEZ 146.985"
38,"Idaho Springs, Squaw Mountain W0CFI 448.675",448.675,-,5,TSQL,100,100,23,23,NN,FM,5,"CO Denver Idaho Springs, Squaw Mountain W0CFI 448.675"
39,"Idaho Springs, Squaw Mountain WG0N 449.05",449.05,-,5,TSQL,107.2,107.2,23,23,NN,FM,5,"CO Denver Idaho Springs, Squaw Mountain WG0N 449.05"
40,"Castle Pines, Daniels Park W9SL 449.95",449.95,-,5,TSQL,77,77,23,23,NN,FM,5,"CO Douglas Castle Pines, Daniels Park W9SL 449.95"
41,Parker WQ8M 448.7,448.7,-,5,Tone,146.2,88.5,23,23,NN,FM,5,CO Douglas Parker WQ8M 448.7
42,"Parker, Hess Reservoir N0ESQ 447.525",447.525,-,5,Cross,203.5,146.2,23,23,NN,FM,5,"CO Douglas Parker, Hess Reservoir N0ESQ 447.525"
43,"Boulder, Thorodin Mountain KB0VJJ 145.31",145.31,-,0.6,Cross,88.5,123,23,23,NN,FM,5,"CO Gilpin Boulder, Thorodin Mountain KB0VJJ 145.31"
44,"Denver, Thorodin Mountain N0SZ 449.225",449.225,-,5,TSQL,141.3,141.3,23,23,NN,FM,5,"CO Gilpin Denver, Thorodin Mountain N0SZ 449.225"
45,Rollinsville W0RM 224.6,224.6,-,1.6,Tone,100,88.5,23,23,NN,FM,5,CO Gilpin Rollinsville W0RM 224.6
46,"Boulder, Blue Mountain KE0SJ 145.475",145.475,-,0.6,Tone,100,88.5,23,23,NN,FM,5,"CO Jefferson Boulder, Blue Mountain KE0SJ 145.475"
47,"Centennial, Warren Mountain WB0TUB 146.88",146.88,-,0.6,Tone,100,88.5,23,23,NN,FM,5,"CO Jefferson Centennial, Warren Mountain WB0TUB 146.88"
48,"Centennial, Warren Mountain WB0TUB 449.6",449.6,-,5,Tone,100,88.5,23,23,NN,FM,5,"CO Jefferson Centennial, Warren Mountain WB0TUB 449.6"
49,"Conifer, Critchell Mountain N0OWY 447.5",447.5,-,5,TSQL,88.5,88.5,23,23,NN,FM,5,"CO Jefferson Conifer, Critchell Mountain N0OWY 447.5"
50,"Critchell, Critchell Mountain N0ARA 147.12",147.12,+,0.6,TSQL,88.5,88.5,23,23,NN,FM,5,"CO Jefferson Critchell, Critchell Mountain N0ARA 147.12"
51,Evergreen KE4GUQ 145.34,145.34,-,0.6,Cross,103.5,127.3,23,23,NN,FM,5,CO Jefferson Evergreen KE4GUQ 145.34
52,Golden N0PYY 448.125,448.125,-,5,Tone,107.2,88.5,23,23,NN,FM,5,CO Jefferson Golden N0PYY 448.125
53,Golden W0GV 448.975,448.975,-,5,Tone,123,88.5,23,23,NN,FM,5,CO Jefferson Golden W0GV 448.975
54,"Golden, Centennial Cone KE0SJ 145.28",145.28,-,0.6,Tone,100,88.5,23,23,NN,FM,5,"CO Jefferson Golden, Centennial Cone KE0SJ 145.28"
55,"Golden, Centennial Cone KE0SJ 449.525",449.525,-,5,,88.5,88.5,23,23,NN,FM,5,"CO Jefferson Golden, Centennial Cone KE0SJ 449.525"
56,"Golden, Centennial Cone W0TX 448.625",448.625,-,5,TSQL,100,100,23,23,NN,FM,5,"CO Jefferson Golden, Centennial Cone W0TX 448.625"
57,"Golden, Centennial Cone WB0TUB 146.64",146.64,-,0.6,Tone,100,88.5,23,23,NN,FM,5,"CO Jefferson Golden, Centennial Cone WB0TUB 146.64"
58,"Golden, Guy Hill K0IBM 448.85",448.85,-,5,TSQL,88.5,88.5,23,23,NN,FM,5,"CO Jefferson Golden, Guy Hill K0IBM 448.85"
59,"Golden, Guy Hill KI0GO 449.75",449.75,-,5,TSQL,103.5,103.5,23,23,NN,FM,5,"CO Jefferson Golden, Guy Hill KI0GO 449.75"
60,"Golden, Guy Hill N0MHU 224",224,-,1.6,TSQL,103.5,103.5,23,23,NN,FM,5,"CO Jefferson Golden, Guy Hill N0MHU 224"
61,"Golden, Guy Hill N0POH 224.74",224.74,-,1.6,TSQL,88.5,88.5,23,23,NN,FM,5,"CO Jefferson Golden, Guy Hill N0POH 224.74"
62,"Golden, Guy Hill W0CBI 147.15",147.15,+,0.6,TSQL,100,100,23,23,NN,FM,5,"CO Jefferson Golden, Guy Hill W0CBI 147.15"
63,"Golden, Lookout Mountain W0KU 449.625",449.625,-,5,TSQL,141.3,141.3,23,23,NN,FM,5,"CO Jefferson Golden, Lookout Mountain W0KU 449.625"
64,"Idaho Springs, Centennial Cone W0TX 145.49",145.49,-,0.6,TSQL,100,100,23,23,NN,FM,5,"CO Jefferson Idaho Springs, Centennial Cone W0TX 145.49"
65,Lakewood N0ELY 448.75,448.75,-,5,TSQL,100,100,23,23,NN,FM,5,CO Jefferson Lakewood N0ELY 448.75
66,"Lakewood, Green Mountain W0TX 147.33",147.33,+,0.6,Tone,100,88.5,23,23,NN,FM,5,"CO Jefferson Lakewood, Green Mountain W0TX 147.33"
67,"Lakewood, Green Mountain W0TX 224.38",224.38,-,1.6,TSQL,100,100,23,23,NN,FM,5,"CO Jefferson Lakewood, Green Mountain W0TX 224.38"
68,"Lakewood, St Anthony Medical Campus W0TX 447.825",447.825,-,5,DTCS,88.5,88.5,73,73,NN,NFM,5,"CO Jefferson Lakewood, St Anthony Medical Campus W0TX 447.825"
69,"Morrison, Mt. Morrison N6LXX 447.875",447.875,-,5,TSQL,107.2,107.2,23,23,NN,FM,5,"CO Jefferson Morrison, Mt. Morrison N6LXX 447.875"
70,"Bailey, Dick Mountain AB0PC 146.895",146.895,-,0.6,TSQL,100,100,23,23,NN,FM,5,"CO Park Bailey, Dick Mountain AB0PC 146.895"
