Location,Name,Frequency,Duplex,Offset,Tone,rToneFreq,cToneFreq,DtcsCode,DtcsRxCode,DtcsPolarity,Mode,TStep,Comment
57,"N0JSP Pagosa Springs, Oakbrush Hill 14661 ",146.61,-,0.6,Tone,123,88.5,23,23,NN,FM,5,"CO Archuleta Pagosa Springs, Oakbrush Hill N0JSP 146.61"
58,"KD0MRC Maysville, CO 145325 ",145.325,-,0.6,Tone,100,88.5,23,23,NN,FM,5,"CO Chaffee Maysville, CO KD0MRC 145.325"
59,W0ALC Cedaredge 14736 ,147.36,+,0.6,Tone,100,88.5,23,23,NN,FM,5,CO Delta Cedaredge W0ALC 147.36
60,W0ALC Cedaredge 449825 ,449.825,-,5,Tone,100,88.5,23,23,NN,FM,5,CO Delta Cedaredge W0ALC 449.825
61,"KC0QXX Cedaredge, Cedar Mesa 147195 ",147.195,+,0.6,Tone,107.2,88.5,23,23,NN,FM,5,"CO Delta Cedaredge, Cedar Mesa KC0QXX 147.195"
62," Cedaredge, Grand Mesa 44735 ",447.35,-,5,Tone,107.2,88.5,23,23,NN,FM,5,"CO Delta Cedaredge, Grand Mesa  447.35"
63,KI0MR Paonia 14733 ,147.33,+,0.6,Tone,107.2,88.5,23,23,NN,FM,5,CO Delta Paonia KI0MR 147.33
64,"K0ELK Carbondale, Four Mile Ridge 449725 ",449.725,-,5,Tone,179.9,88.5,23,23,NN,FM,5,"CO Garfield Carbondale, Four Mile Ridge K0ELK 449.725"
65,"K0SNO Carbondale, Four Mile Ridge 14739 ",147.39,+,0.6,Tone,107.2,88.5,23,23,NN,FM,5,"CO Garfield Carbondale, Four Mile Ridge K0SNO 147.39"
66,"K0VQ Carbondale, Missouri Heights 44715 ",447.15,-,5,Tone,136.5,88.5,23,23,NN,FM,5,"CO Garfield Carbondale, Missouri Heights K0VQ 447.15"
67,"KB0VJJ Glenwood Springs, Sunlight Peak 14685 ",146.85,-,0.6,Cross,88.5,123,23,23,NN,FM,5,"CO Garfield Glenwood Springs, Sunlight Peak KB0VJJ 146.85"
68,"KI0G Glenwood Springs, Sunlight Peak 14688 ",146.88,-,0.6,Tone,107.2,88.5,23,23,NN,FM,5,"CO Garfield Glenwood Springs, Sunlight Peak KI0G 146.88"
69,"KI0G Glenwood Springs, Sunlight Peak 4471 ",447.1,-,5,Tone,107.2,88.5,23,23,NN,FM,5,"CO Garfield Glenwood Springs, Sunlight Peak KI0G 447.1"
70,"N0XLI Glenwood Springs, Sunlight Peak 4496 ",449.6,-,5,Tone,107.2,88.5,23,23,NN,FM,5,"CO Garfield Glenwood Springs, Sunlight Peak N0XLI 449.6"
71,"WA4HND Parachute, Mount Callahan 4498 ",449.8,-,5,Tone,107.2,88.5,23,23,NN,FM,5,"CO Garfield Parachute, Mount Callahan WA4HND 449.8"
72,K5GF Gunnison 44995 ,449.95,-,5,,88.5,88.5,23,23,NN,FM,5,CO Gunnison Gunnison K5GF 449.95
73,W0VTL Gunnison 14712 ,147.12,+,0.6,,88.5,88.5,23,23,NN,FM,5,CO Gunnison Gunnison W0VTL 147.12
74,"KB0YNA Gunnison, W Mountain or Tenderfoot Mountain 44765 ",447.65,-,5,TSQL,151.4,151.4,23,23,NN,FM,5,"CO Gunnison Gunnison, W Mountain or Tenderfoot Mountain KB0YNA 447.65"
75,"KB5ITS Lake City, Hill 71 147135 ",147.135,-,0.6,Tone,123,88.5,23,23,NN,FM,5,"CO Hinsdale Lake City, Hill 71 KB5ITS 147.135"
76,"KB5ITS Silverton, Hazelton 444 ",444,+,5,Tone,67,88.5,23,23,NN,FM,5,"CO Huerfano Silverton, Hazelton KB5ITS 444"
77,K0EP Durango 44985 ,449.85,-,5,TSQL,100,100,23,23,NN,FM,5,CO La Plata Durango K0EP 449.85
78,KC5EVE Durango 448625 ,448.625,-,5,TSQL,131.8,131.8,23,23,NN,FM,5,CO La Plata Durango KC5EVE 448.625
79,"K0EP Durango, Eagle Pass 14667 ",146.67,-,0.6,Tone,100,88.5,23,23,NN,FM,5,"CO La Plata Durango, Eagle Pass K0EP 146.67"
80,"K0EP Durango, Missionary Ridge 1467 ",146.7,-,0.6,TSQL,100,100,23,23,NN,FM,5,"CO La Plata Durango, Missionary Ridge K0EP 146.7"
81,"KB0VJJ Durango, Missionary Ridge 147345 ",147.345,+,0.6,Cross,88.5,123,23,23,NN,FM,5,"CO La Plata Durango, Missionary Ridge KB0VJJ 147.345"
82,"KB5ITS Durango, Smelter Mountain 147135 ",147.135,+,0.6,TSQL,100,100,23,23,NN,FM,5,"CO La Plata Durango, Smelter Mountain KB5ITS 147.135"
83,KB0VIU Hesperus 14537 ,145.37,-,0.6,TSQL,100,100,23,23,NN,FM,5,CO La Plata Hesperus KB0VIU 145.37
84,"KB5ITS Ignacio, Spring Creek 14715 ",147.15,+,0.6,Tone,100,88.5,23,23,NN,FM,5,"CO La Plata Ignacio, Spring Creek KB5ITS 147.15"
85,"KB0YNA Delta, Uncompahgre Butte 4494 ",449.4,-,5,TSQL,131.8,131.8,23,23,NN,FM,5,"CO Mesa Delta, Uncompahgre Butte KB0YNA 449.4"
86,K0SSI Grand Junction 147105 ,147.105,+,0.6,,88.5,88.5,23,23,NN,FM,5,CO Mesa Grand Junction K0SSI 147.105
87,KC0ARV Grand Junction 4475 ,447.5,-,5,Tone,114.8,88.5,23,23,NN,FM,5,CO Mesa Grand Junction KC0ARV 447.5
88,KD0SMZ Grand Junction 449775 ,449.775,-,5,Cross,173.8,88.5,23,23,NN,FM,5,CO Mesa Grand Junction KD0SMZ 449.775
89,KE0TY Grand Junction 14522 ,145.22,-,0.6,Tone,107.2,88.5,23,23,NN,FM,5,CO Mesa Grand Junction KE0TY 145.22
90,KE0TY Grand Junction 14739 ,147.39,+,0.6,Tone,107.2,88.5,23,23,NN,FM,5,CO Mesa Grand Junction KE0TY 147.39
91,W0GJT Grand Junction 14682 ,146.82,-,0.6,Tone,107.2,88.5,23,23,NN,FM,5,CO Mesa Grand Junction W0GJT 146.82
92,W0GJT Grand Junction 44815 ,448.15,-,5,Tone,100,88.5,23,23,NN,FM,5,CO Mesa Grand Junction W0GJT 448.15
93,"W0RRZ Grand Junction, Black Ridge (Above Colorado Ntl Monument) 14694 ",146.94,-,0.6,TSQL,107.2,107.2,23,23,NN,FM,5,"CO Mesa Grand Junction, Black Ridge (Above Colorado Ntl Monument) W0RRZ 146.94"
94,"WA4HND Grand Junction, Black Ridge 449575 ",449.575,-,5,TSQL,131.8,131.8,23,23,NN,FM,5,"CO Mesa Grand Junction, Black Ridge WA4HND 449.575"
95,"W0RRZ Grand Junction, GJT 145175 ",145.175,-,0.6,Tone,107.2,88.5,23,23,NN,FM,5,"CO Mesa Grand Junction, GJT W0RRZ 145.175"
96,"KB0VJJ Grand Junction, Grand Mesa 145355 ",145.355,-,0.6,Cross,88.5,123,23,23,NN,FM,5,"CO Mesa Grand Junction, Grand Mesa KB0VJJ 145.355"
97,"KB0VJJ Grand Junction, Grand Mesa 147355 ",147.355,-,0.6,Cross,88.5,123,23,23,NN,FM,5,"CO Mesa Grand Junction, Grand Mesa KB0VJJ 147.355"
98,"KB0YNA Grand Junction, Grand Mesa 44965 ",449.65,-,5,TSQL,151.4,151.4,23,23,NN,FM,5,"CO Mesa Grand Junction, Grand Mesa KB0YNA 449.65"
99,"WA4HND Grand Junction, Grand Mesa 4493 ",449.3,-,5,TSQL,107.2,107.2,23,23,NN,FM,5,"CO Mesa Grand Junction, Grand Mesa WA4HND 449.3"
100,"N0PKT Creede, Bristol Head 449525 ",449.525,-,5,TSQL,100,100,23,23,NN,FM,5,"CO Mineral Creede, Bristol Head N0PKT 449.525"
101,"KD5LWU Cortez, Downtown 14679 ",146.79,-,0.6,TSQL,127.3,127.3,23,23,NN,FM,5,"CO Montezuma Cortez, Downtown KD5LWU 146.79"
102,"KB5ITS Dolores, Summit Ridge 14519 ",145.19,-,0.6,Tone,100,88.5,23,23,NN,FM,5,"CO Montezuma Dolores, Summit Ridge KB5ITS 145.19"
103,"KB5ITS Dolores, Summit Ridge 447275 ",447.275,-,5,Tone,100,88.5,23,23,NN,FM,5,"CO Montezuma Dolores, Summit Ridge KB5ITS 447.275"
104,"KB5ITS Mancos, Caviness Mountain 442375 ",442.375,+,5,Tone,100,88.5,23,23,NN,FM,5,"CO Montezuma Mancos, Caviness Mountain KB5ITS 442.375"
105,"KB5ITS Mancos, Menefee Mountain 145325 ",145.325,-,0.6,Tone,100,88.5,23,23,NN,FM,5,"CO Montezuma Mancos, Menefee Mountain KB5ITS 145.325"
106,KC0UUX Montrose 14691 ,146.91,-,0.6,TSQL,107.2,107.2,23,23,NN,FM,5,CO Montrose Montrose KC0UUX 146.91
107,KD5OPD Montrose 14679 ,146.79,-,0.6,TSQL,107.2,107.2,23,23,NN,FM,5,CO Montrose Montrose KD5OPD 146.79
108,"KB0YNA Montrose, Waterdog Peak 44865 ",448.65,-,5,TSQL,88.5,151.4,23,23,NN,FM,5,"CO Montrose Montrose, Waterdog Peak KB0YNA 448.65"
109,"WA4HND Montrose, Waterdog Peak 4472 ",447.2,-,5,TSQL,107.2,107.2,23,23,NN,FM,5,"CO Montrose Montrose, Waterdog Peak WA4HND 447.2"
110,"KB5ITS Ouray, Engineer Mountain 14727 ",147.27,+,0.6,Tone,127.3,88.5,23,23,NN,FM,5,"CO Ouray Ouray, Engineer Mountain KB5ITS 147.27"
111,"K0VQ Aspen, Aspen Mountain 44705 ",447.05,-,5,TSQL,136.5,136.5,23,23,NN,FM,5,"CO Pitkin Aspen, Aspen Mountain K0VQ 447.05"
112,K0CL Snowmass Village 14667 ,146.67,-,0.6,Tone,107.2,88.5,23,23,NN,FM,5,CO Pitkin Snowmass Village K0CL 146.67
113,N0KM Center 14664 ,146.64,-,0.6,TSQL,77,77,23,23,NN,FM,5,CO Rio Grande Center N0KM 146.64
114,N0KM Center 4471 ,447.1,-,5,Tone,77,88.5,23,23,NN,FM,5,CO Saguache Center N0KM 447.1
115,KB5ITS Silverton 447525 ,447.525,-,5,Tone,127.3,88.5,23,23,NN,FM,5,CO San Juan Silverton KB5ITS 447.525
116,"KB5ITS Silverton, Buffalo Boy 145325 ",145.325,-,0.6,Tone,127.3,88.5,23,23,NN,FM,5,"CO San Juan Silverton, Buffalo Boy KB5ITS 145.325"
117,"KB5ITT Silverton, Engineer Mountain 14727 ",147.27,+,0.6,Tone,127.3,88.5,23,23,NN,FM,5,"CO San Juan Silverton, Engineer Mountain KB5ITT 147.27"
118,"KB5ITS Silverton, Kendall Mountain 147375 ",147.375,+,0.6,Tone,156.7,88.5,23,23,NN,FM,5,"CO San Juan Silverton, Kendall Mountain KB5ITS 147.375"
119,"KB0YNA Telluride, Gray Head 4497 ",449.7,-,5,TSQL,107.2,107.2,23,23,NN,FM,5,"CO San Miguel Telluride, Gray Head KB0YNA 449.7"
120,KB5ITS Aztec 44745 ,447.45,-,5,Tone,107.2,88.5,23,23,NN,FM,5,NM San Juan Aztec KB5ITS 447.45
121,NM5SJ Aztec 14674 ,146.74,-,0.6,Tone,100,88.5,23,23,NN,FM,5,NM San Juan Aztec NM5SJ 146.74
122,"KB5ITS Aztec, Tank Mtn 14688 ",146.88,-,0.6,Tone,100,88.5,23,23,NN,FM,5,"NM San Juan Aztec, Tank Mtn KB5ITS 146.88"
123,"NM5SJ Nebo, Cedar Hill 14706 ",147.06,+,0.6,Tone,100,88.5,23,23,NN,FM,5,"NM San Juan Nebo, Cedar Hill NM5SJ 147.06"
124,"K7QEQ Moab, Bald Mesa 14676 ",146.76,-,0.6,Tone,88.5,88.5,23,23,NN,FM,5,"UT Grand Moab, Bald Mesa K7QEQ 146.76"
125,"K7QEQ Moab, Bald Mesa 4491 ",449.1,-,5,TSQL,107.2,107.2,23,23,NN,FM,5,"UT Grand Moab, Bald Mesa K7QEQ 449.1"
126,"K7QEQ Monticello, Abajo Peak 4471 ",447.1,-,5,TSQL,107.2,107.2,23,23,NN,FM,5,"UT San Juan Monticello, Abajo Peak K7QEQ 447.1"
127,"K7SDC Monticello, Abajo Peak 14661 ",146.61,-,0.6,Tone,88.5,88.5,23,23,NN,FM,5,"UT San Juan Monticello, Abajo Peak K7SDC 146.61"
