Location,Name,Frequency,Duplex,Offset,Tone,rToneFreq,cToneFreq,DtcsCode,DtcsRxCode,DtcsPolarity,Mode,TStep,Comment
57,W0ALC 147.36,147.36,+,0.6,Tone,100,88.5,23,23,NN,FM,5,CO Delta Cedaredge W0ALC 147.36
58,W0ALC 449.825,449.825,-,5,Tone,100,88.5,23,23,NN,FM,5,CO Delta Cedaredge W0ALC 449.825
59,KC0QXX 147.195,147.195,+,0.6,Tone,107.2,88.5,23,23,NN,FM,5,"CO Delta Cedaredge, Cedar Mesa KC0QXX 147.195"
60, 447.35,447.35,-,5,Tone,107.2,88.5,23,23,NN,FM,5,"CO Delta Cedaredge, Grand Mesa  447.35"
61,KI0MR 147.33,147.33,+,0.6,Tone,107.2,88.5,23,23,NN,FM,5,CO Delta Paonia KI0MR 147.33
62,K0ELK 449.725,449.725,-,5,Tone,179.9,88.5,23,23,NN,FM,5,"CO Garfield Carbondale, Four Mile Ridge K0ELK 449.725"
63,K0SNO 147.39,147.39,+,0.6,Tone,107.2,88.5,23,23,NN,FM,5,"CO Garfield Carbondale, Four Mile Ridge K0SNO 147.39"
64,K0VQ 447.15,447.15,-,5,Tone,136.5,88.5,23,23,NN,FM,5,"CO Garfield Carbondale, Missouri Heights K0VQ 447.15"
65,WA4HND 449.85,449.85,-,5,TSQL,131.8,131.8,23,23,NN,FM,5,"CO Garfield Glenwood Springs, Lookout Mountain WA4HND 449.85"
66,KB0VJJ 146.85,146.85,-,0.6,Cross,88.5,123,23,23,NN,FM,5,"CO Garfield Glenwood Springs, Sunlight Peak KB0VJJ 146.85"
67,KI0G 146.88,146.88,-,0.6,Tone,107.2,88.5,23,23,NN,FM,5,"CO Garfield Glenwood Springs, Sunlight Peak KI0G 146.88"
68,KI0G 447.1,447.1,-,5,Tone,107.2,88.5,23,23,NN,FM,5,"CO Garfield Glenwood Springs, Sunlight Peak KI0G 447.1"
69,N0XLI 449.6,449.6,-,5,Tone,107.2,88.5,23,23,NN,FM,5,"CO Garfield Glenwood Springs, Sunlight Peak N0XLI 449.6"
70,KB0SW 447,447,-,5,Tone,107.2,88.5,23,23,NN,FM,5,"CO Garfield Loma, Baxter Pass KB0SW 447"
71,WA4HND 449.8,449.8,-,5,Tone,107.2,88.5,23,23,NN,FM,5,"CO Garfield Parachute, Mount Callahan WA4HND 449.8"
72,K5GF 449.95,449.95,-,5,,88.5,88.5,23,23,NN,FM,5,CO Gunnison Gunnison K5GF 449.95
73,W0VTL 147.12,147.12,+,0.6,,88.5,88.5,23,23,NN,FM,5,CO Gunnison Gunnison W0VTL 147.12
74,KB5ITS 147.135,147.135,-,0.6,Tone,123,88.5,23,23,NN,FM,5,"CO Hinsdale Lake City, Hill 71 KB5ITS 147.135"
75,KB5ITS 444,444,+,5,Tone,67,88.5,23,23,NN,FM,5,"CO Huerfano Silverton, Hazelton KB5ITS 444"
76,KB0YNA 449.4,449.4,-,5,TSQL,131.8,131.8,23,23,NN,FM,5,"CO Mesa Delta, Uncompahgre Butte KB0YNA 449.4"
77,K0SSI 147.105,147.105,+,0.6,,88.5,88.5,23,23,NN,FM,5,CO Mesa Grand Junction K0SSI 147.105
78,KC0ARV 447.5,447.5,-,5,Tone,114.8,88.5,23,23,NN,FM,5,CO Mesa Grand Junction KC0ARV 447.5
79,KD0SMZ 449.775,449.775,-,5,Cross,173.8,88.5,23,23,NN,FM,5,CO Mesa Grand Junction KD0SMZ 449.775
80,KE0TY 145.22,145.22,-,0.6,Tone,107.2,88.5,23,23,NN,FM,5,CO Mesa Grand Junction KE0TY 145.22
81,KE0TY 147.39,147.39,+,0.6,Tone,107.2,88.5,23,23,NN,FM,5,CO Mesa Grand Junction KE0TY 147.39
82,W0GJT 146.82,146.82,-,0.6,Tone,107.2,88.5,23,23,NN,FM,5,CO Mesa Grand Junction W0GJT 146.82
83,W0GJT 448.15,448.15,-,5,Tone,100,88.5,23,23,NN,FM,5,CO Mesa Grand Junction W0GJT 448.15
84,W0RRZ 146.94,146.94,-,0.6,TSQL,107.2,107.2,23,23,NN,FM,5,"CO Mesa Grand Junction, Black Ridge (Above Colorado Ntl Monument) W0RRZ 146.94"
85,WA4HND 449.575,449.575,-,5,TSQL,131.8,131.8,23,23,NN,FM,5,"CO Mesa Grand Junction, Black Ridge WA4HND 449.575"
86,W0RRZ 145.175,145.175,-,0.6,Tone,107.2,88.5,23,23,NN,FM,5,"CO Mesa Grand Junction, GJT W0RRZ 145.175"
87,KB0VJJ 145.355,145.355,-,0.6,Cross,88.5,123,23,23,NN,FM,5,"CO Mesa Grand Junction, Grand Mesa KB0VJJ 145.355"
88,KB0VJJ 147.355,147.355,-,0.6,Cross,88.5,123,23,23,NN,FM,5,"CO Mesa Grand Junction, Grand Mesa KB0VJJ 147.355"
89,KB0YNA 449.65,449.65,-,5,TSQL,151.4,151.4,23,23,NN,FM,5,"CO Mesa Grand Junction, Grand Mesa KB0YNA 449.65"
90,WA4HND 449.3,449.3,-,5,TSQL,107.2,107.2,23,23,NN,FM,5,"CO Mesa Grand Junction, Grand Mesa WA4HND 449.3"
91,KB0VJJ 146.97,146.97,-,0.6,Cross,88.5,123,23,23,NN,FM,5,CO Moffat Craig KB0VJJ 146.97
92,WD0HAM 145.265,145.265,-,0.6,Tone,107.2,88.5,23,23,NN,FM,5,CO Moffat Craig WD0HAM 145.265
93,KC0UUX 146.91,146.91,-,0.6,TSQL,107.2,107.2,23,23,NN,FM,5,CO Montrose Montrose KC0UUX 146.91
94,KD5OPD 146.79,146.79,-,0.6,TSQL,107.2,107.2,23,23,NN,FM,5,CO Montrose Montrose KD5OPD 146.79
95,KB0YNA 448.65,448.65,-,5,TSQL,88.5,151.4,23,23,NN,FM,5,"CO Montrose Montrose, Waterdog Peak KB0YNA 448.65"
96,WA4HND 447.2,447.2,-,5,TSQL,107.2,107.2,23,23,NN,FM,5,"CO Montrose Montrose, Waterdog Peak WA4HND 447.2"
97,KB5ITS 147.27,147.27,+,0.6,Tone,127.3,88.5,23,23,NN,FM,5,"CO Ouray Ouray, Engineer Mountain KB5ITS 147.27"
98,K0VQ 447.05,447.05,-,5,TSQL,136.5,136.5,23,23,NN,FM,5,"CO Pitkin Aspen, Aspen Mountain K0VQ 447.05"
99,K0CL 146.67,146.67,-,0.6,Tone,107.2,88.5,23,23,NN,FM,5,CO Pitkin Snowmass Village K0CL 146.67
100,KB5ITS 447.525,447.525,-,5,Tone,127.3,88.5,23,23,NN,FM,5,CO San Juan Silverton KB5ITS 447.525
101,KB5ITS 145.325,145.325,-,0.6,Tone,127.3,88.5,23,23,NN,FM,5,"CO San Juan Silverton, Buffalo Boy KB5ITS 145.325"
102,KB5ITT 147.27,147.27,+,0.6,Tone,127.3,88.5,23,23,NN,FM,5,"CO San Juan Silverton, Engineer Mountain KB5ITT 147.27"
103,KB5ITS 147.375,147.375,+,0.6,Tone,156.7,88.5,23,23,NN,FM,5,"CO San Juan Silverton, Kendall Mountain KB5ITS 147.375"
104,KB0YNA 449.7,449.7,-,5,TSQL,107.2,107.2,23,23,NN,FM,5,"CO San Miguel Telluride, Gray Head KB0YNA 449.7"
105,W7CEU 145.43,145.43,-,0.6,Tone,88.5,88.5,23,23,NN,FM,5,"UT Carbon Price,  Wood Hill W7CEU 145.43"
106,W7CEU 224.5,224.5,-,1.6,Tone,88.5,88.5,23,23,NN,FM,5,"UT Carbon Price,  Wood Hill W7CEU 224.5"
107,W7CEU 448.3,448.3,-,5,Tone,88.5,88.5,23,23,NN,FM,5,"UT Carbon Price,  Wood Hill W7CEU 448.3"
108,K7GX 147.2,147.2,+,0.6,Tone,88.5,88.5,23,23,NN,FM,5,"UT Carbon Price, Wood Hill K7GX 147.2"
109,K7GX 448.3,448.3,-,5,,88.5,88.5,23,23,NN,FM,5,"UT Carbon Price, Wood Hill K7GX 448.3"
110,WX7Y 145.175,145.175,-,0.6,,88.5,88.5,23,23,NN,FM,5,"UT Carbon Sunny Side, Bruin Peak WX7Y 145.175"
111,K7SDC 147.32,147.32,+,0.6,Tone,88.5,88.5,23,23,NN,FM,5,"UT Carbon Sunnyside, Bruin Point K7SDC 147.32"
112,K7SDC 449.05,449.05,-,5,Tone,88.5,88.5,23,23,NN,FM,5,"UT Carbon Sunnyside, Bruin Point K7SDC 449.05"
113,AD7ZW 147.28,147.28,+,0.6,TSQL,107.2,107.2,23,23,NN,FM,5,UT Duchesne Altamont AD7ZW 147.28
114,N7PQD 147.26,147.26,+,0.6,,88.5,88.5,23,23,NN,FM,5,UT Duchesne Duchense N7PQD 147.26
115,W7BYU 145.49,145.49,-,0.6,Tone,136.5,88.5,23,23,NN,FM,5,"UT Duchesne Myton, Flat Top W7BYU 145.49"
116,K7SDC 147.14,147.14,+,0.6,Tone,88.5,88.5,23,23,NN,FM,5,"UT Emery Castle Dale, Cedar Mountain K7SDC 147.14"
117,K7SDC 448.55,448.55,-,5,Tone,88.5,88.5,23,23,NN,FM,5,"UT Emery Castle Dale, Cedar Mountain K7SDC 448.55"
118,K7QEQ 146.9,146.9,-,0.6,Tone,88.5,88.5,23,23,NN,FM,5,UT Grand Moab K7QEQ 146.9
119,K7QEQ 146.76,146.76,-,0.6,Tone,88.5,88.5,23,23,NN,FM,5,"UT Grand Moab, Bald Mesa K7QEQ 146.76"
120,K7QEQ 449.1,449.1,-,5,TSQL,107.2,107.2,23,23,NN,FM,5,"UT Grand Moab, Bald Mesa K7QEQ 449.1"
121,K7QEQ 447.1,447.1,-,5,TSQL,107.2,107.2,23,23,NN,FM,5,"UT San Juan Monticello, Abajo Peak K7QEQ 447.1"
122,K7SDC 146.61,146.61,-,0.6,Tone,88.5,88.5,23,23,NN,FM,5,"UT San Juan Monticello, Abajo Peak K7SDC 146.61"
123,W7BYU 449.7,449.7,-,5,Tone,136.5,88.5,23,23,NN,FM,5,UT Uintah Vernal W7BYU 449.7
124,W7BAR 147.1,147.1,+,0.6,Tone,136.5,88.5,23,23,NN,FM,5,"UT Uintah Vernal, Blue Mountain W7BAR 147.1"
125,K7HEN 145.49,145.49,-,0.6,Tone,136.5,88.5,23,23,NN,FM,5,"UT Uintah Vernal, Grizzly Ridge K7HEN 145.49"
126,W7BAR 147.04,147.04,+,0.6,Tone,136.5,88.5,23,23,NN,FM,5,"UT Uintah Vernal, Grizzly Ridge W7BAR 147.04"
127,W7BAR 449.9,449.9,-,5,Tone,136.5,88.5,23,23,NN,FM,5,"UT Uintah Vernal, Uintah County EOC W7BAR 449.9"
