Location,Name,Frequency,Duplex,Offset,Tone,rToneFreq,cToneFreq,DtcsCode,DtcsRxCode,DtcsPolarity,Mode,TStep,Comment
308,447 KB0SW,447,-,5,Tone,107.2,88.5,23,23,NN,FM,5,"CO Garfield Loma, Baxter Pass KB0SW 447"
309,14714 NM5ML,147.14,+,0.6,Tone,67,88.5,23,23,NN,FM,5,"NM Taos Taos, Ski Valley NM5ML 147.14"
310,14519 KB5ITS,145.19,-,0.6,Tone,100,88.5,23,23,NN,FM,5,"CO Montezuma Dolores, Summit Ridge KB5ITS 145.19"
311,44727 KB5ITS,447.275,-,5,Tone,100,88.5,23,23,NN,FM,5,"CO Montezuma Dolores, Summit Ridge KB5ITS 447.275"
312,14706 NM5SJ,147.06,+,0.6,Tone,100,88.5,23,23,NN,FM,5,"NM San Juan Nebo, Cedar Hill NM5SJ 147.06"
313,44435 NM5ML,444.35,+,5,Tone,100,88.5,23,23,NN,FM,5,"NM Colfax Eagle Nest, Iron Mountain NM5ML 444.35"
314,44497 N5TSV,444.975,+,5,Tone,123,88.5,23,23,NN,FM,5,"NM Taos Taos, Wheeler Peak N5TSV 444.975"
315,14728 NM5ML,147.28,+,0.6,Tone,100,88.5,23,23,NN,FM,5,"NM Colfax Raton, Sierra Grande NM5ML 147.28"
316,14736 KB5ITS,147.36,+,0.6,Tone,100,88.5,23,23,NN,FM,5,"NM San Juan Navajo Dam, Navajo Lake KB5ITS 147.36"
317,14704 NM5EM,147.04,+,0.6,Tone,141.3,88.5,23,23,NN,FM,5,"NM Colfax Eagle Nest, Touch Me Not NM5EM 147.04"
318,14679 KD5LWU,146.79,-,0.6,TSQL,127.3,127.3,23,23,NN,FM,5,"CO Montezuma Cortez, Downtown KD5LWU 146.79"
319,4493 WB7GR,449.3,-,5,Tone,131.8,88.5,23,23,NN,FM,5,"WY Laramie Cheyenne, Chalk Bluffs WB7GR 449.3"
320,14677 KC7SNO,146.775,-,0.6,Tone,114.8,88.5,23,23,NN,FM,5,"WY Laramie Cheyenne, Denver Hill KC7SNO 146.775"
321,44702 N7EMA,447.025,-,5,,88.5,88.5,23,23,NN,FM,5,WY Laramie Cheyenne N7EMA 447.025
322,44745 KB5ITS,447.45,-,5,Tone,107.2,88.5,23,23,NN,FM,5,NM San Juan Aztec KB5ITS 447.45
323,14688 KB5ITS,146.88,-,0.6,Tone,100,88.5,23,23,NN,FM,5,"NM San Juan Aztec, Tank Mtn KB5ITS 146.88"
324,14674 NM5SJ,146.74,-,0.6,Tone,100,88.5,23,23,NN,FM,5,NM San Juan Aztec NM5SJ 146.74
325,14682 KC7SNO,146.82,-,0.6,Tone,114.8,88.5,23,23,NN,FM,5,"WY Albany Laramie, Beacon Hill KC7SNO 146.82"
326,14523 KB7SWR,145.235,-,0.6,Tone,114.8,88.5,23,23,NN,FM,5,WY Laramie Cheyenne KB7SWR 145.235
327,4499 N7JJY,449.9,-,5,TSQL,100,100,23,23,NN,FM,5,WY Laramie Cheyenne N7JJY 449.9
328,44895 KC7DHF,448.95,-,5,Tone,151.4,88.5,23,23,NN,FM,5,WY Laramie Cheyenne KC7DHF 448.95
329,14710 KC7SNO,147.105,+,0.6,Tone,114.8,88.5,23,23,NN,FM,5,"WY Laramie Cheyenne, North Park KC7SNO 147.105"
330,14676 K7QEQ,146.76,-,0.6,Tone,88.5,88.5,23,23,NN,FM,5,"UT Grand Moab, Bald Mesa K7QEQ 146.76"
331,4491 K7QEQ,449.1,-,5,TSQL,107.2,107.2,23,23,NN,FM,5,"UT Grand Moab, Bald Mesa K7QEQ 449.1"
332,14521 N5GDR,145.21,-,0.6,TSQL,110.9,110.9,23,23,NN,FM,5,NM Colfax Cimarron N5GDR 145.21
333,44865 KB5ITS,448.65,-,5,Tone,127.3,88.5,23,23,NN,FM,5,NM San Juan Bloomfield KB5ITS 448.65
334,14692 K5WXI,146.92,-,0.6,Tone,100,88.5,23,23,NN,FM,5,NM San Juan Bloomfield K5WXI 146.92
335,14734 N5LEM,147.34,+,0.6,Tone,100,88.5,23,23,NN,FM,5,"NM Colfax Angel Fire, Agua Fria Peak N5LEM 147.34"
336,1471 KB5ITS,147.1,+,0.6,Tone,100,88.5,23,23,NN,FM,5,"NM San Juan Bloomfield, Harris mesa KB5ITS 147.1"
337,14728 NM5ML,147.28,+,0.6,Tone,67,88.5,23,23,NN,FM,5,"NM San Juan Bloomfield, Harris Mesa NM5ML 147.28"
338,1454 KB0VJJ,145.4,-,0.8,Cross,88.5,123,23,23,NN,FM,5,CO Washington Akron KB0VJJ 145.4
339,14712 KF5PFO,147.12,+,0.6,Tone,67,88.5,23,23,NN,FM,5,"NM Taos Taos, Picuris Peak KF5PFO 147.12"
340,2244 KF5PFO,224.4,-,1.6,Tone,225.7,88.5,23,23,NN,FM,5,"NM Taos Taos, Picuris Peak KF5PFO 224.4"
341,44987 KF5PFO,449.875,-,5,Tone,123,88.5,23,23,NN,FM,5,"NM Taos Taos, Picuris Peak KF5PFO 449.875"
342,14718 KD5PX,147.18,+,0.6,TSQL,100,100,23,23,NN,FM,5,"NM Rio Arriba Dixon, Cerro Abajo KD5PX 147.18"
343,1469 K7QEQ,146.9,-,0.6,Tone,88.5,88.5,23,23,NN,FM,5,UT Grand Moab K7QEQ 146.9
344,449 K5WY,449,-,5,Tone,100,88.5,23,23,NN,FM,5,NM San Juan Farmington K5WY 449
345,14676 KB5ITS,146.76,-,0.6,TSQL,100,100,23,23,NN,FM,5,NM San Juan Farmington KB5ITS 146.76
346,147 KB5ITS,147,+,0.6,Tone,100,88.5,23,23,NN,FM,5,NM San Juan Farmington KB5ITS 147
347,14685 K5WXI,146.85,-,0.6,TSQL,100,100,23,23,NN,FM,5,NM San Juan Farmington K5WXI 146.85
348,14717 NM5EM,147.175,+,0.6,Tone,141.3,88.5,23,23,NN,FM,5,"NM Union Des Moines, Sierra Grande NM5EM 147.175"
349,4497 W7BYU,449.7,-,5,Tone,136.5,88.5,23,23,NN,FM,5,UT Uintah Vernal W7BYU 449.7
350,1471 W7BAR,147.1,+,0.6,Tone,136.5,88.5,23,23,NN,FM,5,"UT Uintah Vernal, Blue Mountain W7BAR 147.1"
351,14689 KE0AE,146.895,-,0.6,Tone,103.5,88.5,23,23,NN,FM,5,CO Kit Carson Stratton KE0AE 146.895
352,14661 K7SDC,146.61,-,0.6,Tone,88.5,88.5,23,23,NN,FM,5,"UT San Juan Monticello, Abajo Peak K7SDC 146.61"
353,4471 K7QEQ,447.1,-,5,TSQL,107.2,107.2,23,23,NN,FM,5,"UT San Juan Monticello, Abajo Peak K7QEQ 447.1"
354,4499 W7BAR,449.9,-,5,Tone,136.5,88.5,23,23,NN,FM,5,"UT Uintah Vernal, Uintah County EOC W7BAR 449.9"
355,14724 N7GCR,147.24,+,0.6,Tone,100,88.5,23,23,NN,FM,5,"WY Carbon Rawlins, Elk Mountain N7GCR 147.24"
356,14549 NM5SJ,145.49,-,0.6,Tone,100,88.5,23,23,NN,FM,5,NM Rio Arriba Lybrook NM5SJ 145.49
