Location,Name,Frequency,Duplex,Offset,Tone,rToneFreq,cToneFreq,DtcsCode,DtcsRxCode,DtcsPolarity,Mode,TStep,Comment
308,1471 W7BAR,147.1,+,0.6,Tone,136.5,88.5,23,23,NN,FM,5,"UT Uintah Vernal, Blue Mountain W7BAR 147.1"
309,14736 W0QEY,147.36,+,0.6,TSQL,100,100,23,23,NN,FM,5,"CO Larimer Fort Collins, CSU Durward Hall W0QEY 147.36"
310,44985 W0QEY,449.85,-,5,TSQL,100,100,23,23,NN,FM,5,"CO Larimer Fort Collins, CSU Durward Hall W0QEY 449.85"
311,44772 W7RF,447.725,-,5,Tone,131.8,88.5,23,23,NN,FM,5,CO Larimer Fort Collins W7RF 447.725
312,14673 ND0Q,146.73,-,0.6,Tone,88.5,88.5,23,23,NN,FM,5,"CO Huerfano Walsenburg, N Rattlesnake Butte ND0Q 146.73"
313,14710 WA0DE,147.105,+,0.6,TSQL,107.2,107.2,23,23,NN,FM,5,CO Elbert Simla WA0DE 147.105
314,14692 K5WXI,146.92,-,0.6,Tone,100,88.5,23,23,NN,FM,5,NM San Juan Bloomfield K5WXI 146.92
315,44865 KB5ITS,448.65,-,5,Tone,127.3,88.5,23,23,NN,FM,5,NM San Juan Bloomfield KB5ITS 448.65
316,44972 K0OJ,449.725,-,5,Tone,127.3,88.5,23,23,NN,FM,5,"CO Weld Greeley, UNC K0OJ 449.725"
317,14685 W0UPS,146.85,-,0.6,TSQL,100,100,23,23,NN,FM,5,"CO Weld Greeley, UNC W0UPS 146.85"
318,4472 N6RFI,447.2,-,5,Tone,82.5,88.5,23,23,NN,FM,5,"CO Weld Severance, Cactus Hill N6RFI 447.2"
319,44847 KC0KWD,448.475,-,5,Tone,100,88.5,23,23,NN,FM,5,CO Weld Greeley KC0KWD 448.475
320,1471 KB5ITS,147.1,+,0.6,Tone,100,88.5,23,23,NN,FM,5,"NM San Juan Bloomfield, Harris mesa KB5ITS 147.1"
321,14685 K5WXI,146.85,-,0.6,TSQL,100,100,23,23,NN,FM,5,NM San Juan Farmington K5WXI 146.85
322,14676 KB5ITS,146.76,-,0.6,TSQL,100,100,23,23,NN,FM,5,NM San Juan Farmington KB5ITS 146.76
323,147 KB5ITS,147,+,0.6,Tone,100,88.5,23,23,NN,FM,5,NM San Juan Farmington KB5ITS 147
324,449 K5WY,449,-,5,Tone,100,88.5,23,23,NN,FM,5,NM San Juan Farmington K5WY 449
325,14728 NM5ML,147.28,+,0.6,Tone,67,88.5,23,23,NN,FM,5,"NM San Juan Bloomfield, Harris Mesa NM5ML 147.28"
326,14676 KF5PFO,146.76,-,0.6,Tone,67,88.5,23,23,NN,FM,5,"NM Taos Tres Piedras, San Antonio Mountain KF5PFO 146.76"
327,44832 WB7UPS,448.325,-,5,Tone,110.9,88.5,23,23,NN,FM,5,CO Larimer Wellington WB7UPS 448.325
328,14539 KF5PFO,145.39,-,0.6,Tone,100,88.5,23,23,NN,FM,5,"NM Taos Red River, Molycorp KF5PFO 145.39"
329,14525 KF5PFO,145.25,-,0.6,Tone,123,88.5,23,23,NN,FM,5,"NM Taos Red River, Valle Vidal KF5PFO 145.25"
330,44925 K0UPS,449.25,-,5,TSQL,123,123,23,23,NN,FM,5,CO Elbert Cedar Point K0UPS 449.25
331,4499 N1FSX,449.9,-,5,Tone,107.2,88.5,23,23,NN,FM,5,CO Lincoln Punkin Center N1FSX 449.9
332,14714 NM5ML,147.14,+,0.6,Tone,67,88.5,23,23,NN,FM,5,"NM Taos Taos, Ski Valley NM5ML 147.14"
333,44497 N5TSV,444.975,+,5,Tone,123,88.5,23,23,NN,FM,5,"NM Taos Taos, Wheeler Peak N5TSV 444.975"
334,44435 NM5ML,444.35,+,5,Tone,100,88.5,23,23,NN,FM,5,"NM Colfax Eagle Nest, Iron Mountain NM5ML 444.35"
335,14682 KC7SNO,146.82,-,0.6,Tone,114.8,88.5,23,23,NN,FM,5,"WY Albany Laramie, Beacon Hill KC7SNO 146.82"
336,14549 NM5SJ,145.49,-,0.6,Tone,100,88.5,23,23,NN,FM,5,NM Rio Arriba Lybrook NM5SJ 145.49
337,14704 W7BAR,147.04,+,0.6,Tone,136.5,88.5,23,23,NN,FM,5,"UT Uintah Vernal, Grizzly Ridge W7BAR 147.04"
338,14549 K7HEN,145.49,-,0.6,Tone,136.5,88.5,23,23,NN,FM,5,"UT Uintah Vernal, Grizzly Ridge K7HEN 145.49"
339,14704 NM5EM,147.04,+,0.6,Tone,141.3,88.5,23,23,NN,FM,5,"NM Colfax Eagle Nest, Touch Me Not NM5EM 147.04"
340,44905 K7SDC,449.05,-,5,Tone,88.5,88.5,23,23,NN,FM,5,"UT Carbon Sunnyside, Bruin Point K7SDC 449.05"
341,14732 K7SDC,147.32,+,0.6,Tone,88.5,88.5,23,23,NN,FM,5,"UT Carbon Sunnyside, Bruin Point K7SDC 147.32"
342,14517 WX7Y,145.175,-,0.6,,88.5,88.5,23,23,NN,FM,5,"UT Carbon Sunny Side, Bruin Peak WX7Y 145.175"
343,14543 WA6IFI,145.43,-,0.6,Tone,107.2,88.5,23,23,NN,FM,5,"CO Las Animas Trinidad, Raton Pass WA6IFI 145.43"
344,14549 W7BYU,145.49,-,0.6,Tone,136.5,88.5,23,23,NN,FM,5,"UT Duchesne Myton, Flat Top W7BYU 145.49"
345,14724 N7GCR,147.24,+,0.6,Tone,100,88.5,23,23,NN,FM,5,"WY Carbon Rawlins, Elk Mountain N7GCR 147.24"
346,44702 N7EMA,447.025,-,5,,88.5,88.5,23,23,NN,FM,5,WY Laramie Cheyenne N7EMA 447.025
347,14677 KC7SNO,146.775,-,0.6,Tone,114.8,88.5,23,23,NN,FM,5,"WY Laramie Cheyenne, Denver Hill KC7SNO 146.775"
348,14718 KD5PX,147.18,+,0.6,TSQL,100,100,23,23,NN,FM,5,"NM Rio Arriba Dixon, Cerro Abajo KD5PX 147.18"
349,44895 KC7DHF,448.95,-,5,Tone,151.4,88.5,23,23,NN,FM,5,WY Laramie Cheyenne KC7DHF 448.95
350,14523 KB7SWR,145.235,-,0.6,Tone,114.8,88.5,23,23,NN,FM,5,WY Laramie Cheyenne KB7SWR 145.235
351,4499 N7JJY,449.9,-,5,TSQL,100,100,23,23,NN,FM,5,WY Laramie Cheyenne N7JJY 449.9
352,14728 NM5ML,147.28,+,0.6,Tone,100,88.5,23,23,NN,FM,5,"NM Colfax Raton, Sierra Grande NM5ML 147.28"
353,14710 KC7SNO,147.105,+,0.6,Tone,114.8,88.5,23,23,NN,FM,5,"WY Laramie Cheyenne, North Park KC7SNO 147.105"
354,44987 KF5PFO,449.875,-,5,Tone,123,88.5,23,23,NN,FM,5,"NM Taos Taos, Picuris Peak KF5PFO 449.875"
355,2244 KF5PFO,224.4,-,1.6,Tone,225.7,88.5,23,23,NN,FM,5,"NM Taos Taos, Picuris Peak KF5PFO 224.4"
356,4493 WB7GR,449.3,-,5,Tone,131.8,88.5,23,23,NN,FM,5,"WY Laramie Cheyenne, Chalk Bluffs WB7GR 449.3"
