Location,Name,Frequency,Duplex,Offset,Tone,rToneFreq,cToneFreq,DtcsCode,DtcsRxCode,DtcsPolarity,Mode,TStep,Comment
57,14734 KB0VJJ,147.345,+,0.6,Cross,88.5,123,23,23,NN,FM,5,CO Eagle Vail KB0VJJ 147.345
58,44715 K0VQ,447.15,-,5,Tone,136.5,88.5,23,23,NN,FM,5,"CO Garfield Carbondale, Missouri Heights K0VQ 447.15"
59,2248 N0AFO,224.8,-,1.6,,88.5,88.5,23,23,NN,FM,5,CO Eagle Vail N0AFO 224.8
60,14661 K0RV,146.61,-,0.6,Tone,107.2,88.5,23,23,NN,FM,5,"CO Eagle Vail, Bald Mountain K0RV 146.61"
61,44985 WA4HND,449.85,-,5,TSQL,131.8,131.8,23,23,NN,FM,5,"CO Garfield Glenwood Springs, Lookout Mountain WA4HND 449.85"
62,14667 K0CL,146.67,-,0.6,Tone,107.2,88.5,23,23,NN,FM,5,CO Pitkin Snowmass Village K0CL 146.67
63,44972 K0ELK,449.725,-,5,Tone,179.9,88.5,23,23,NN,FM,5,"CO Garfield Carbondale, Four Mile Ridge K0ELK 449.725"
64,14739 K0SNO,147.39,+,0.6,Tone,107.2,88.5,23,23,NN,FM,5,"CO Garfield Carbondale, Four Mile Ridge K0SNO 147.39"
65,44705 K0VQ,447.05,-,5,TSQL,136.5,136.5,23,23,NN,FM,5,"CO Pitkin Aspen, Aspen Mountain K0VQ 447.05"
66,4471 KI0G,447.1,-,5,Tone,107.2,88.5,23,23,NN,FM,5,"CO Garfield Glenwood Springs, Sunlight Peak KI0G 447.1"
67,14688 KI0G,146.88,-,0.6,Tone,107.2,88.5,23,23,NN,FM,5,"CO Garfield Glenwood Springs, Sunlight Peak KI0G 146.88"
68,4496 N0XLI,449.6,-,5,Tone,107.2,88.5,23,23,NN,FM,5,"CO Garfield Glenwood Springs, Sunlight Peak N0XLI 449.6"
69,14685 KB0VJJ,146.85,-,0.6,Cross,88.5,123,23,23,NN,FM,5,"CO Garfield Glenwood Springs, Sunlight Peak KB0VJJ 146.85"
70,14707 KB0VJJ,147.075,+,0.6,Cross,88.5,123,23,23,NN,FM,5,"CO Grand Kremmling, Santoy Peak KB0VJJ 147.075"
71,14544 KB0VJJ,145.445,-,0.6,Tone,88.5,88.5,23,23,NN,FM,5,"CO Lake Leadville, Mosquito Pass KB0VJJ 145.445"
72,1467 WB0QMR,146.7,-,0.6,Tone,107.2,88.5,23,23,NN,FM,5,CO Summit Breckenridge WB0QMR 146.7
73,14739 KB0VJJ,147.39,+,0.6,Cross,88.5,123,23,23,NN,FM,5,"CO Summit Breckenridge, Bald Mountain KB0VJJ 147.39"
74,44712 WZ0N,447.125,-,5,TSQL,103.5,103.5,23,23,NN,FM,5,"CO Park Fairplay, Sacramento Mountain WZ0N 447.125"
75,14682 KA0YDW,146.82,-,0.6,Tone,123,88.5,23,23,NN,FM,5,CO Grand Granby KA0YDW 146.82
76,14721 KD0H,147.21,+,0.6,TSQL,107.2,107.2,23,23,NN,FM,5,CO Routt Steamboat Springs KD0H 147.21
77,14716 KB0VJJ,147.165,+,0.6,Cross,88.5,123,23,23,NN,FM,5,CO Routt Steamboat Springs KB0VJJ 147.165
78,44962 KB0VJJ,449.625,-,5,TSQL,123,123,23,23,NN,FM,5,CO Routt Steamboat Springs KB0VJJ 449.625
79,44745 WA4CCC,447.45,-,5,Tone,103.5,88.5,23,23,NN,FM,5,CO Grand Winter Park WA4CCC 447.45
80,14728 KB0VJJ,147.285,+,0.6,Cross,88.5,123,23,23,NN,FM,5,"CO Grand Winter Park, Winter Park KB0VJJ 147.285"
81,4498 WA4HND,449.8,-,5,Tone,107.2,88.5,23,23,NN,FM,5,"CO Garfield Parachute, Mount Callahan WA4HND 449.8"
82,14733 KI0MR,147.33,+,0.6,Tone,107.2,88.5,23,23,NN,FM,5,CO Delta Paonia KI0MR 147.33
83,44905 WG0N,449.05,-,5,TSQL,107.2,107.2,23,23,NN,FM,5,"CO Denver Idaho Springs, Squaw Mountain WG0N 449.05"
84,14697 KB0VJJ,146.97,-,0.6,Cross,88.5,123,23,23,NN,FM,5,CO Moffat Craig KB0VJJ 146.97
85,14526 WD0HAM,145.265,-,0.6,Tone,107.2,88.5,23,23,NN,FM,5,CO Moffat Craig WD0HAM 145.265
86,14514 W0CRA,145.145,-,0.6,TSQL,107.2,107.2,23,23,NN,FM,5,"CO Clear Creek Idaho Springs, Squaw Mountain W0CRA 145.145"
87,14694 W0WYX,146.94,-,0.6,TSQL,103.5,103.5,23,23,NN,FM,5,"CO Clear Creek Idaho Springs, Squaw Mountain W0WYX 146.94"
88,14549 W0TX,145.49,-,0.6,TSQL,100,100,23,23,NN,FM,5,"CO Jefferson Idaho Springs, Centennial Cone W0TX 145.49"
89,14667 KB0UDD,146.67,-,0.6,TSQL,100,100,23,23,NN,FM,5,"CO Clear Creek Idaho Springs, Squaw Mountain KB0UDD 146.67"
90,44935 W0TX,449.35,-,5,TSQL,100,100,23,23,NN,FM,5,"CO Clear Creek Idaho Springs, Squaw Mountain W0TX 449.35"
91,44822 N0SZ,448.225,-,5,TSQL,141.3,141.3,23,23,NN,FM,5,"CO Clear Creek Idaho Springs, Squaw Mountain N0SZ 448.225"
92,44945 K1DUN,449.45,-,5,Cross,103.5,127.3,23,23,NN,FM,5,"CO Clear Creek Idaho Springs, Squaw Mountain K1DUN 449.45"
93,44757 W0CRA,447.575,-,5,TSQL,107.2,107.2,23,23,NN,FM,5,"CO Clear Creek Idaho Springs, Squaw Mountain W0CRA 447.575"
94,44867 W0CFI,448.675,-,5,TSQL,100,100,23,23,NN,FM,5,"CO Denver Idaho Springs, Squaw Mountain W0CFI 448.675"
95,1473 N0PYY,147.3,+,0.6,TSQL,103.5,103.5,23,23,NN,FM,5,"CO Clear Creek Evergreen, Squaw Mountain N0PYY 147.3"
96,449 WR0AEN,449,-,5,TSQL,136.5,136.5,23,23,NN,FM,5,"CO Clear Creek Idaho Springs, Squaw Mountain WR0AEN 449"
97,44965 KB0YNA,449.65,-,5,TSQL,151.4,151.4,23,23,NN,FM,5,"CO Mesa Grand Junction, Grand Mesa KB0YNA 449.65"
98,14535 KB0VJJ,145.355,-,0.6,Cross,88.5,123,23,23,NN,FM,5,"CO Mesa Grand Junction, Grand Mesa KB0VJJ 145.355"
99,14516 KB0VJJ,145.16,-,0.6,Cross,88.5,123,23,23,NN,FM,5,"CO Jackson Walden, Peterson Ridge KB0VJJ 145.16"
100,2246 W0RM,224.6,-,1.6,Tone,100,88.5,23,23,NN,FM,5,CO Gilpin Rollinsville W0RM 224.6
101,44765 KB0YNA,447.65,-,5,TSQL,151.4,151.4,23,23,NN,FM,5,"CO Gunnison Gunnison, W Mountain or Tenderfoot Mountain KB0YNA 447.65"
102,44785 AC0KQ,447.85,-,5,TSQL,141.3,141.3,23,23,NN,FM,5,"CO Clear Creek Evergreen, Saddleback Mountain AC0KQ 447.85"
103,14689 AB0PC,146.895,-,0.6,TSQL,100,100,23,23,NN,FM,5,"CO Park Bailey, Dick Mountain AB0PC 146.895"
104,14531 KB0VJJ,145.31,-,0.6,Cross,88.5,123,23,23,NN,FM,5,"CO Gilpin Boulder, Thorodin Mountain KB0VJJ 145.31"
105,44922 N0SZ,449.225,-,5,TSQL,141.3,141.3,23,23,NN,FM,5,"CO Gilpin Denver, Thorodin Mountain N0SZ 449.225"
106,44735 ,447.35,-,5,Tone,107.2,88.5,23,23,NN,FM,5,"CO Delta Cedaredge, Grand Mesa  447.35"
107,44995 K5GF,449.95,-,5,,88.5,88.5,23,23,NN,FM,5,CO Gunnison Gunnison K5GF 449.95
108,14712 W0VTL,147.12,+,0.6,,88.5,88.5,23,23,NN,FM,5,CO Gunnison Gunnison W0VTL 147.12
109,14698 K0FEZ,146.985,-,0.6,TSQL,100,100,23,23,NN,FM,5,"CO Denver Golden, Centennial Cone K0FEZ 146.985"
110,14528 KE0SJ,145.28,-,0.6,Tone,100,88.5,23,23,NN,FM,5,"CO Jefferson Golden, Centennial Cone KE0SJ 145.28"
111,44952 KE0SJ,449.525,-,5,,88.5,88.5,23,23,NN,FM,5,"CO Jefferson Golden, Centennial Cone KE0SJ 449.525"
112,14664 WB0TUB,146.64,-,0.6,Tone,100,88.5,23,23,NN,FM,5,"CO Jefferson Golden, Centennial Cone WB0TUB 146.64"
113,14719 KC0QXX,147.195,+,0.6,Tone,107.2,88.5,23,23,NN,FM,5,"CO Delta Cedaredge, Cedar Mesa KC0QXX 147.195"
114,44862 W0TX,448.625,-,5,TSQL,100,100,23,23,NN,FM,5,"CO Jefferson Golden, Centennial Cone W0TX 448.625"
115,14736 W0ALC,147.36,+,0.6,Tone,100,88.5,23,23,NN,FM,5,CO Delta Cedaredge W0ALC 147.36
116,44982 W0ALC,449.825,-,5,Tone,100,88.5,23,23,NN,FM,5,CO Delta Cedaredge W0ALC 449.825
117,14712 N0ARA,147.12,+,0.6,TSQL,88.5,88.5,23,23,NN,FM,5,"CO Jefferson Critchell, Critchell Mountain N0ARA 147.12"
118,224 N0MHU,224,-,1.6,TSQL,103.5,103.5,23,23,NN,FM,5,"CO Jefferson Golden, Guy Hill N0MHU 224"
119,44885 K0IBM,448.85,-,5,TSQL,88.5,88.5,23,23,NN,FM,5,"CO Jefferson Golden, Guy Hill K0IBM 448.85"
120,14715 W0CBI,147.15,+,0.6,TSQL,100,100,23,23,NN,FM,5,"CO Jefferson Golden, Guy Hill W0CBI 147.15"
121,22474 N0POH,224.74,-,1.6,TSQL,88.5,88.5,23,23,NN,FM,5,"CO Jefferson Golden, Guy Hill N0POH 224.74"
122,44975 KI0GO,449.75,-,5,TSQL,103.5,103.5,23,23,NN,FM,5,"CO Jefferson Golden, Guy Hill KI0GO 449.75"
123,14691 W0JZ,146.91,+,0.6,Cross,123,127.3,23,23,NN,FM,5,CO Boulder Gold Hill W0JZ 146.91
124,14534 KE4GUQ,145.34,-,0.6,Cross,103.5,127.3,23,23,NN,FM,5,CO Jefferson Evergreen KE4GUQ 145.34
125,14703 KI0HG,147.03,+,0.6,Tone,100,88.5,23,23,NN,FM,5,"CO Boulder Allenspark, AFPD Station #5 KI0HG 147.03"
126,14668 NX0G,146.685,-,0.6,TSQL,107.2,107.2,23,23,NN,FM,5,"CO Park Lake George, Badger Mountain NX0G 146.685"
127,14736 KC0CVU,147.36,+,0.6,TSQL,107.2,107.2,23,23,NN,FM,5,"CO Park Lake George, Badger Mountain KC0CVU 147.36"
128,44797 W0CRA,447.975,-,5,TSQL,107.2,107.2,23,23,NN,FM,5,"CO Boulder Boulder, Eldorado Mountain W0CRA 447.975"
129,44775 N0SZ,447.75,-,5,TSQL,141.3,141.3,23,23,NN,FM,5,"CO Boulder Boulder, Lee Hill N0SZ 447.75"
130,22402 W0IA,224.02,-,1.6,,88.5,88.5,23,23,NN,FM,5,"CO Boulder Boulder, Lee Hill W0IA 224.02"
131,14546 W0CRA,145.46,-,0.6,TSQL,107.2,107.2,23,23,NN,FM,5,"CO Boulder Boulder, Eldorado Mountain W0CRA 145.46"
132,14532 KD0MRC,145.325,-,0.6,Tone,100,88.5,23,23,NN,FM,5,"CO Chaffee Maysville, CO KD0MRC 145.325"
133,44962 W0KU,449.625,-,5,TSQL,141.3,141.3,23,23,NN,FM,5,"CO Jefferson Golden, Lookout Mountain W0KU 449.625"
134,1467 W0DK,146.7,-,0.6,Tone,100,88.5,23,23,NN,FM,5,"CO Boulder Boulder, Table Mountain W0DK 146.7"
135,4498 N0FH,449.8,-,5,Tone,123,88.5,23,23,NN,FM,5,CO Larimer Estes Park N0FH 449.8
136,4489 W0DK,448.9,-,5,Tone,100,88.5,23,23,NN,FM,5,"CO Boulder Boulder, Table Mesa W0DK 448.9"
137,44787 N6LXX,447.875,-,5,TSQL,107.2,107.2,23,23,NN,FM,5,"CO Jefferson Morrison, Mt. Morrison N6LXX 447.875"
138,44812 N0PYY,448.125,-,5,Tone,107.2,88.5,23,23,NN,FM,5,CO Jefferson Golden N0PYY 448.125
139,44897 W0GV,448.975,-,5,Tone,123,88.5,23,23,NN,FM,5,CO Jefferson Golden W0GV 448.975
140,44955 W0IA,449.55,-,5,Tone,100,88.5,23,23,NN,FM,5,CO Boulder Boulder W0IA 449.55
141,4493 WA4HND,449.3,-,5,TSQL,107.2,107.2,23,23,NN,FM,5,"CO Mesa Grand Junction, Grand Mesa WA4HND 449.3"
142,14668 N0FH,146.685,-,0.6,Tone,123,88.5,23,23,NN,FM,5,CO Larimer Estes Park N0FH 146.685
143,4475 N0OWY,447.5,-,5,TSQL,88.5,88.5,23,23,NN,FM,5,"CO Jefferson Conifer, Critchell Mountain N0OWY 447.5"
144,22438 W0TX,224.38,-,1.6,TSQL,100,100,23,23,NN,FM,5,"CO Jefferson Lakewood, Green Mountain W0TX 224.38"
145,14733 W0TX,147.33,+,0.6,Tone,100,88.5,23,23,NN,FM,5,"CO Jefferson Lakewood, Green Mountain W0TX 147.33"
146,44782 W0TX,447.825,-,5,DTCS,88.5,88.5,73,73,NN,NFM,5,"CO Jefferson Lakewood, St Anthony Medical Campus W0TX 447.825"
147,44875 N0ELY,448.75,-,5,TSQL,100,100,23,23,NN,FM,5,CO Jefferson Lakewood N0ELY 448.75
148,14688 WB0TUB,146.88,-,0.6,Tone,100,88.5,23,23,NN,FM,5,"CO Jefferson Centennial, Warren Mountain WB0TUB 146.88"
149,4496 WB0TUB,449.6,-,5,Tone,100,88.5,23,23,NN,FM,5,"CO Jefferson Centennial, Warren Mountain WB0TUB 449.6"
150,4497 ,449.7,-,5,Tone,107.2,88.5,23,23,NN,FM,5,CO Park Lake George  449.7
151,14676 W0IA,146.76,-,0.6,Tone,100,88.5,23,23,NN,FM,5,"CO Boulder Boulder, Gunbarrel Hill W0IA 146.76"
152,14529 KC0CVU,145.295,-,0.6,Tone,107.2,88.5,23,23,NN,FM,5,"CO Chaffee Salida, Methodist Mountain KC0CVU 145.295"
153,14728 KB0VJJ,147.285,+,0.6,Cross,88.5,123,23,23,NN,FM,5,"CO Chaffee Salida, Methodist Mountain KB0VJJ 147.285"
154,44992 WZ0N,449.925,-,5,TSQL,103.5,103.5,23,23,NN,FM,5,"CO Chaffee Salida, Methodist Mountain WZ0N 449.925"
155,44965 KC0CVU,449.65,-,5,Tone,107.2,88.5,23,23,NN,FM,5,"CO Chaffee Salida, Methodist Mountain KC0CVU 449.65"
156,44892 W0LMA,448.925,-,5,Tone,131.8,88.5,23,23,NN,FM,5,CO Boulder Broomfield W0LMA 448.925
157,44982 W0WYX,449.825,-,5,Tone,103.5,88.5,23,23,NN,FM,5,CO Boulder Broomfield W0WYX 449.825
158,44997 K0JSC,449.975,-,5,TSQL,100,100,23,23,NN,FM,5,"CO Chaffee Salida, Methodist Mountain K0JSC 449.975"
159,44752 N0ESQ,447.525,-,5,TSQL,146.2,146.2,23,23,NN,FM,5,"CO Douglas Castle Rock, Devils Head (Pike National Forest) N0ESQ 447.525"
160,4493 N1UPS,449.3,-,5,Tone,100,88.5,23,23,NN,FM,5,CO Adams Westminster N1UPS 449.3
161,14517 W0RRZ,145.175,-,0.6,Tone,107.2,88.5,23,23,NN,FM,5,"CO Mesa Grand Junction, GJT W0RRZ 145.175"
162,44717 W0JRL,447.175,-,5,TSQL,100,100,23,23,NN,FM,5,"CO Denver Denver, Broadway Plaza Lofts W0JRL 447.175"
163,44852 N0EPA,448.525,-,5,Tone,151.4,88.5,23,23,NN,FM,5,CO Boulder Longmont N0EPA 448.525
164,14547 KE0SJ,145.475,-,0.6,Tone,100,88.5,23,23,NN,FM,5,"CO Jefferson Boulder, Blue Mountain KE0SJ 145.475"
165,4488 W0ENO,448.8,-,5,TSQL,88.5,88.5,23,23,NN,FM,5,CO Boulder Longmont W0ENO 448.8
166,14671 N0JXN,146.715,-,0.6,TSQL,123,123,23,23,NN,FM,5,CO Denver Denver N0JXN 146.715
167,14727 W0ENO,147.27,+,0.6,TSQL,100,100,23,23,NN,FM,5,CO Boulder Longmont W0ENO 147.27
168,44807 N5EHP,448.075,-,5,Tone,123,88.5,23,23,NN,FM,5,CO Denver Denver N5EHP 448.075
169,44792 K0FEZ,447.925,-,5,TSQL,100,100,23,23,NN,FM,5,CO Denver Denver K0FEZ 447.925
170,4472 WA4HND,447.2,-,5,TSQL,107.2,107.2,23,23,NN,FM,5,"CO Montrose Montrose, Waterdog Peak WA4HND 447.2"
171,44865 KB0YNA,448.65,-,5,TSQL,88.5,151.4,23,23,NN,FM,5,"CO Montrose Montrose, Waterdog Peak KB0YNA 448.65"
172,14691 KC0UUX,146.91,-,0.6,TSQL,107.2,107.2,23,23,NN,FM,5,CO Montrose Montrose KC0UUX 146.91
173,14679 KD5OPD,146.79,-,0.6,TSQL,107.2,107.2,23,23,NN,FM,5,CO Montrose Montrose KD5OPD 146.79
174,14704 K0ML,147.045,+,0.6,Tone,123,88.5,23,23,NN,FM,5,CO Adams Northglenn K0ML 147.045
175,14739 KE0TY,147.39,+,0.6,Tone,107.2,88.5,23,23,NN,FM,5,CO Mesa Grand Junction KE0TY 147.39
176,14682 W0GJT,146.82,-,0.6,Tone,107.2,88.5,23,23,NN,FM,5,CO Mesa Grand Junction W0GJT 146.82
177,4475 KC0ARV,447.5,-,5,Tone,114.8,88.5,23,23,NN,FM,5,CO Mesa Grand Junction KC0ARV 447.5
178,14522 KE0TY,145.22,-,0.6,Tone,107.2,88.5,23,23,NN,FM,5,CO Mesa Grand Junction KE0TY 145.22
179,44977 KD0SMZ,449.775,-,5,Cross,173.8,88.5,23,23,NN,FM,5,CO Mesa Grand Junction KD0SMZ 449.775
180,14710 K0SSI,147.105,+,0.6,,88.5,88.5,23,23,NN,FM,5,CO Mesa Grand Junction K0SSI 147.105
181,14722 W0CRA,147.225,+,0.6,TSQL,107.2,107.2,23,23,NN,FM,5,"CO Douglas Larkspur, Westcreek W0CRA 147.225"
182,44997 K0JSC,449.975,-,5,TSQL,100,100,23,23,NN,FM,5,"CO Douglas Larkspur, Westcreek K0JSC 449.975"
183,44842 W0CRA,448.425,-,5,TSQL,107.2,107.2,23,23,NN,FM,5,"CO Douglas Larkspur, Westcreek W0CRA 448.425"
184,14735 KB0VJJ,147.355,-,0.6,Cross,88.5,123,23,23,NN,FM,5,"CO Mesa Grand Junction, Grand Mesa KB0VJJ 147.355"
185,4477 W0UPS,447.7,-,5,TSQL,100,100,23,23,NN,FM,5,"CO Larimer Fort Collins, Buckhorn Mountain W0UPS 447.7"
186,44815 W0GJT,448.15,-,5,Tone,100,88.5,23,23,NN,FM,5,CO Mesa Grand Junction W0GJT 448.15
187,44942 N0ZUQ,449.425,-,5,Tone,94.8,88.5,23,23,NN,FM,5,"CO Larimer Fort Collins, Christ Mountain N0ZUQ 449.425"
188,22484 W0UPS,224.84,-,1.6,TSQL,100,100,23,23,NN,FM,5,"CO Larimer Fort Collins, Buckhorn Mountain W0UPS 224.84"
189,14662 W0UPS,146.625,-,0.6,TSQL,100,100,23,23,NN,FM,5,"CO Larimer Fort Collins, Buckhorn Mountain W0UPS 146.625"
190,14719 W0LRA,147.195,+,0.6,Tone,100,88.5,23,23,NN,FM,5,"CO Larimer Loveland, Namaqua Hill W0LRA 147.195"
191,44995 W9SL,449.95,-,5,TSQL,77,77,23,23,NN,FM,5,"CO Douglas Castle Pines, Daniels Park W9SL 449.95"
192,44767 KA0WUC,447.675,-,5,TSQL,179.9,179.9,23,23,NN,FM,5,CO Teller Woodland Park KA0WUC 447.675
193,44932 KA4EPS,449.325,-,5,TSQL,103.5,103.5,23,23,NN,FM,5,"CO Teller Woodland Park, Paradise Pines KA4EPS 449.325"
194,44865 NX0G,448.65,-,5,Tone,107.2,88.5,23,23,NN,FM,5,CO Teller Woodland Park NX0G 448.65
195,44902 KA0WUC,449.025,-,5,Tone,141.3,88.5,23,23,NN,FM,5,CO Teller Woodland Park KA0WUC 449.025
196,14541 KA0WUC,145.415,-,0.6,Tone,179.9,88.5,23,23,NN,FM,5,CO Teller Woodland Park KA0WUC 145.415
197,14682 NX0G,146.82,-,0.6,Tone,107.2,88.5,23,23,NN,FM,5,CO Teller Woodland Park NX0G 146.82
198,44727 W0UPS,447.275,-,5,TSQL,100,100,23,23,NN,FM,5,"CO Larimer Fort Collins, Horsetooth Mountain W0UPS 447.275"
199,14511 W0UPS,145.115,-,0.6,TSQL,100,100,23,23,NN,FM,5,"CO Larimer Fort Collins, Horsetooth Mountain W0UPS 145.115"
200,44957 W0LRA,449.575,-,5,Tone,100,88.5,23,23,NN,FM,5,"CO Larimer Loveland, Namaqua Hill W0LRA 449.575"
201,44827 W0BG,448.275,-,5,Tone,156.7,88.5,23,23,NN,FM,5,CO Arapahoe Aurora W0BG 448.275
202,4484 N0ZUQ,448.4,-,5,Tone,94.8,88.5,23,23,NN,FM,5,CO Arapahoe Aurora N0ZUQ 448.4
203,4485 KB0UDD,448.5,-,5,Tone,100,88.5,23,23,NN,FM,5,"CO Denver Aurora, Smokey Hill KB0UDD 448.5"
204,44752 N0ESQ,447.525,-,5,Cross,203.5,146.2,23,23,NN,FM,5,"CO Douglas Parker, Hess Reservoir N0ESQ 447.525"
205,44745 KC0RBT,447.45,-,5,Tone,123,88.5,23,23,NN,FM,5,CO Larimer Fort Collins KC0RBT 447.45
206,14519 N0XLF,145.19,-,0.6,TSQL,131.8,131.8,23,23,NN,FM,5,"CO Douglas Palmer Lake, Monument Hill N0XLF 145.19"
207,14701 NX0G,147.015,+,0.6,Tone,107.2,88.5,23,23,NN,FM,5,CO Teller Cripple Creek NX0G 147.015
208,4474 WB0WDF,447.4,-,5,Tone,67,88.5,23,23,NN,FM,5,CO Teller Cripple Creek WB0WDF 447.4
209,22494 WB0WDF,224.94,-,1.6,Tone,67,88.5,23,23,NN,FM,5,CO Teller Cripple Creek WB0WDF 224.94
210,14546 WB0WDF,145.46,-,0.6,Tone,67,88.5,23,23,NN,FM,5,CO Teller Cripple Creek WB0WDF 145.46
211,4487 WQ8M,448.7,-,5,Tone,146.2,88.5,23,23,NN,FM,5,CO Douglas Parker WQ8M 448.7
212,44992 KD0RG,449.925,-,5,TSQL,114.8,114.8,23,23,NN,FM,5,CO Adams Brighton KD0RG 449.925
213,14519 N0OBA,145.19,-,0.6,Cross,151.4,131.8,23,23,NN,FM,5,CO Arapahoe Aurora N0OBA 145.19
214,44957 WA4HND,449.575,-,5,TSQL,131.8,131.8,23,23,NN,FM,5,"CO Mesa Grand Junction, Black Ridge WA4HND 449.575"
215,14694 W0RRZ,146.94,-,0.6,TSQL,107.2,107.2,23,23,NN,FM,5,"CO Mesa Grand Junction, Black Ridge (Above Colorado Ntl Monument) W0RRZ 146.94"
216,449 WB0WDF,449,-,5,TSQL,67,67,23,23,NN,FM,5,"CO Fremont Canon City, eightmile Mountain WB0WDF 449"
217,44845 KB0SRJ,448.45,-,5,Tone,100,88.5,23,23,NN,FM,5,"CO El Paso Colorado Springs, Pikes Peak KB0SRJ 448.45"
218,14697 KB0SRJ,146.97,-,0.6,Cross,100,123,23,23,NN,FM,5,"CO El Paso Colorado Springs, Pikes Peak KB0SRJ 146.97"
219,22496 AC0KC,224.96,-,1.6,,88.5,88.5,23,23,NN,FM,5,CO Weld Fort Lupton AC0KC 224.96
220,44815 K0GUR,448.15,-,5,TSQL,141.3,141.3,23,23,NN,FM,5,"CO Denver Denver, Green Valley Ranch K0GUR 448.15"
221,1454 KB0UDD,145.4,-,0.8,Tone,100,88.5,23,23,NN,FM,5,"CO Arapahoe Aurora, Smoky Hill KB0UDD 145.4"
222,4473 AC0KC,447.3,-,5,Tone,107.2,88.5,23,23,NN,FM,5,CO Weld Fort Lupton AC0KC 447.3
223,44772 K0NR,447.725,-,5,TSQL,100,100,23,23,NN,FM,5,"CO El Paso Monument, Monument Hill K0NR 447.725"
224,14736 W0QEY,147.36,+,0.6,TSQL,100,100,23,23,NN,FM,5,"CO Larimer Fort Collins, CSU Durward Hall W0QEY 147.36"
225,44985 W0QEY,449.85,-,5,TSQL,100,100,23,23,NN,FM,5,"CO Larimer Fort Collins, CSU Durward Hall W0QEY 449.85"
226,44772 W7RF,447.725,-,5,Tone,131.8,88.5,23,23,NN,FM,5,CO Larimer Fort Collins W7RF 447.725
227,447 KB0SW,447,-,5,Tone,107.2,88.5,23,23,NN,FM,5,"CO Garfield Loma, Baxter Pass KB0SW 447"
228,44762 KE0SJ,447.625,-,5,Tone,100,88.5,23,23,NN,FM,5,CO Adams Lochbuie KE0SJ 447.625
229,14713 KB5ITS,147.135,-,0.6,Tone,123,88.5,23,23,NN,FM,5,"CO Hinsdale Lake City, Hill 71 KB5ITS 147.135"
230,44725 K0JSC,447.25,-,5,TSQL,100,100,23,23,NN,FM,5,"CO Fremont Canon City, Fremont Peak K0JSC 447.25"
231,44775 WD0EKR,447.75,-,5,TSQL,103.5,103.5,23,23,NN,FM,5,"CO Fremont Canon City, Fremont Peak WD0EKR 447.75"
232,14549 WD0EKR,145.49,-,0.6,TSQL,103.5,103.5,23,23,NN,FM,5,"CO Fremont Canon City, Fremont Peak WD0EKR 145.49"
233,22396 WD0EKR,223.96,-,1.6,TSQL,103.5,103.5,23,23,NN,FM,5,"CO Fremont Canon City, Fremont Peak WD0EKR 223.96"
234,4472 N6RFI,447.2,-,5,Tone,82.5,88.5,23,23,NN,FM,5,"CO Weld Severance, Cactus Hill N6RFI 447.2"
235,44832 WB7UPS,448.325,-,5,Tone,110.9,88.5,23,23,NN,FM,5,CO Larimer Wellington WB7UPS 448.325
236,22472 W0MOG,224.72,-,1.6,TSQL,103.5,103.5,23,23,NN,FM,5,CO El Paso Colorado springs W0MOG 224.72
237,44797 K0JSC,447.975,-,5,TSQL,100,100,23,23,NN,FM,5,"CO Fremont Canon City, Colorado K0JSC 447.975"
238,44997 K0JSC,449.975,-,5,TSQL,100,100,23,23,NN,FM,5,"CO Fremont Canon City, Canon City K0JSC 449.975"
239,14727 ,147.27,+,0.6,,88.5,88.5,23,23,NN,FM,5,CO El Paso Colorado Springs  147.27
240,14685 W0RSH,146.85,-,0.6,Tone,103.5,88.5,23,23,NN,FM,5,CO El Paso Colorado Springs W0RSH 146.85
241,14739 W0MOG,147.39,+,0.6,Tone,103.5,88.5,23,23,NN,FM,5,CO El Paso Colorado Springs W0MOG 147.39
242,14691 K0IRP,146.91,-,0.6,TSQL,151.4,151.4,23,23,NN,FM,5,CO El Paso Colorado Springs K0IRP 146.91
243,44755 WA6IFI,447.55,-,5,Tone,123,88.5,23,23,NN,FM,5,CO El Paso Colorado Springs WA6IFI 447.55
244,44825 N0KG,448.25,-,5,Tone,123,88.5,23,23,NN,FM,5,"CO El Paso Colorado Springs, Broadmoor Area N0KG 448.25"
245,44747 NX0G,447.475,-,5,Tone,107.2,88.5,23,23,NN,FM,5,CO El Paso Colorado Springs NX0G 447.475
246,4486 W0MOG,448.6,-,5,Tone,114.8,88.5,23,23,NN,FM,5,CO El Paso Colorado Springs W0MOG 448.6
247,44735 K0IRP,447.35,-,5,Tone,151.4,88.5,23,23,NN,FM,5,CO El Paso Colorado Springs K0IRP 447.35
248,4483 AA0L,448.3,-,5,Tone,100,88.5,23,23,NN,FM,5,CO El Paso Colorado Springs AA0L 448.3
249,14727 KB5ITS,147.27,+,0.6,Tone,127.3,88.5,23,23,NN,FM,5,"CO Ouray Ouray, Engineer Mountain KB5ITS 147.27"
250,44872 KA0TTF,448.725,-,5,Tone,123,88.5,23,23,NN,FM,5,"CO El Paso Colorado Springs, Fillmore Hill KA0TTF 448.725"
251,4481 KC0CVU,448.1,-,5,TSQL,107.2,107.2,23,23,NN,FM,5,"CO El Paso Colorado Springs, Cheyenne Mountain KC0CVU 448.1"
252,14676 KC0CVU,146.76,-,0.6,TSQL,107.2,107.2,23,23,NN,FM,5,"CO El Paso Colorado Springs, Cheyenne Mountain KC0CVU 146.76"
253,14734 KC0CVU,147.345,+,0.6,TSQL,107.2,107.2,23,23,NN,FM,5,"CO El Paso Colorado Springs, Cheyenne Mountain KC0CVU 147.345"
254,448 KC0CVU,448,-,5,Tone,107.2,88.5,23,23,NN,FM,5,"CO El Paso Colorado Springs, Cheyenne Mountain KC0CVU 448"
255,14516 W0CRA,145.16,-,0.6,TSQL,107.2,107.2,23,23,NN,FM,5,"CO El Paso Colorado Springs, Cheyenne Mountain W0CRA 145.16"
256,14713 AA0L,147.135,+,0.6,Tone,100,88.5,23,23,NN,FM,5,CO El Paso Colorado Springs AA0L 147.135
257,14513 KB0VJJ,145.13,-,0.6,Cross,88.5,123,23,23,NN,FM,5,"CO El Paso Colorado Springs, Cheyenne Mountain KB0VJJ 145.13"
258,4494 KB0YNA,449.4,-,5,TSQL,131.8,131.8,23,23,NN,FM,5,"CO Mesa Delta, Uncompahgre Butte KB0YNA 449.4"
259,44972 K0OJ,449.725,-,5,Tone,127.3,88.5,23,23,NN,FM,5,"CO Weld Greeley, UNC K0OJ 449.725"
260,14685 W0UPS,146.85,-,0.6,TSQL,100,100,23,23,NN,FM,5,"CO Weld Greeley, UNC W0UPS 146.85"
261,44847 KC0KWD,448.475,-,5,Tone,100,88.5,23,23,NN,FM,5,CO Weld Greeley KC0KWD 448.475
262,44762 KD0MDP,447.625,-,5,TSQL,100,100,23,23,NN,FM,5,"CO El Paso Falcon, Black Forest KD0MDP 447.625"
263,44815 KB0TUC,448.15,-,5,TSQL,103.5,103.5,23,23,NN,FM,5,CO Custer Westcliffe KB0TUC 448.15
264,44832 K0JSC,448.325,-,5,TSQL,100,100,23,23,NN,FM,5,CO Custer Westcliffe K0JSC 448.325
265,14706 KB0TUC,147.06,+,0.6,TSQL,77,77,23,23,NN,FM,5,CO Custer Westcliffe KB0TUC 147.06
266,44952 N0PKT,449.525,-,5,TSQL,100,100,23,23,NN,FM,5,"CO Mineral Creede, Bristol Head N0PKT 449.525"
267,4497 KB0YNA,449.7,-,5,TSQL,107.2,107.2,23,23,NN,FM,5,"CO San Miguel Telluride, Gray Head KB0YNA 449.7"
268,14682 KC7SNO,146.82,-,0.6,Tone,114.8,88.5,23,23,NN,FM,5,"WY Albany Laramie, Beacon Hill KC7SNO 146.82"
269,1471 W7BAR,147.1,+,0.6,Tone,136.5,88.5,23,23,NN,FM,5,"UT Uintah Vernal, Blue Mountain W7BAR 147.1"
270,4497 W7BYU,449.7,-,5,Tone,136.5,88.5,23,23,NN,FM,5,UT Uintah Vernal W7BYU 449.7
271,444 KB5ITS,444,+,5,Tone,67,88.5,23,23,NN,FM,5,"CO Huerfano Silverton, Hazelton KB5ITS 444"
272,14532 KB5ITS,145.325,-,0.6,Tone,127.3,88.5,23,23,NN,FM,5,"CO San Juan Silverton, Buffalo Boy KB5ITS 145.325"
273,44752 KB5ITS,447.525,-,5,Tone,127.3,88.5,23,23,NN,FM,5,CO San Juan Silverton KB5ITS 447.525
274,14737 KB5ITS,147.375,+,0.6,Tone,156.7,88.5,23,23,NN,FM,5,"CO San Juan Silverton, Kendall Mountain KB5ITS 147.375"
275,14664 N0KM,146.64,-,0.6,TSQL,77,77,23,23,NN,FM,5,CO Rio Grande Center N0KM 146.64
276,4471 N0KM,447.1,-,5,Tone,77,88.5,23,23,NN,FM,5,CO Saguache Center N0KM 447.1
277,14724 N7GCR,147.24,+,0.6,Tone,100,88.5,23,23,NN,FM,5,"WY Carbon Rawlins, Elk Mountain N7GCR 147.24"
278,4499 W7BAR,449.9,-,5,Tone,136.5,88.5,23,23,NN,FM,5,"UT Uintah Vernal, Uintah County EOC W7BAR 449.9"
279,44962 KC0CVU,449.625,-,5,Tone,107.2,88.5,23,23,NN,FM,5,"CO Custer Pueblo, Deer Peak KC0CVU 449.625"
280,14727 KB5ITT,147.27,+,0.6,Tone,127.3,88.5,23,23,NN,FM,5,"CO San Juan Silverton, Engineer Mountain KB5ITT 147.27"
281,44897 K0JSC,448.975,-,5,TSQL,100,100,23,23,NN,FM,5,CO Pueblo Pueblo West K0JSC 448.975
282,14677 KC7SNO,146.775,-,0.6,Tone,114.8,88.5,23,23,NN,FM,5,"WY Laramie Cheyenne, Denver Hill KC7SNO 146.775"
283,44702 N7EMA,447.025,-,5,,88.5,88.5,23,23,NN,FM,5,WY Laramie Cheyenne N7EMA 447.025
284,44895 KC7DHF,448.95,-,5,Tone,151.4,88.5,23,23,NN,FM,5,WY Laramie Cheyenne KC7DHF 448.95
285,14523 KB7SWR,145.235,-,0.6,Tone,114.8,88.5,23,23,NN,FM,5,WY Laramie Cheyenne KB7SWR 145.235
286,14710 KC7SNO,147.105,+,0.6,Tone,114.8,88.5,23,23,NN,FM,5,"WY Laramie Cheyenne, North Park KC7SNO 147.105"
287,4499 N7JJY,449.9,-,5,TSQL,100,100,23,23,NN,FM,5,WY Laramie Cheyenne N7JJY 449.9
288,14739 KD7BN,147.39,+,0.6,Tone,100,88.5,23,23,NN,FM,5,WY Carbon Rawlins KD7BN 147.39
289,1467 N7RON,146.7,-,0.6,Tone,162.2,88.5,23,23,NN,FM,5,WY Carbon Rawlins N7RON 146.7
290,14676 KC7OZU,146.76,-,0.6,Tone,100,88.5,23,23,NN,FM,5,WY Carbon Rawlins KC7OZU 146.76
291,4483 KD7SU,448.3,-,5,Tone,100,88.5,23,23,NN,FM,5,WY Carbon Rawlins KD7SU 448.3
292,4498 N7RON,449.8,-,5,Tone,146.2,88.5,23,23,NN,FM,5,WY Carbon Rawlins N7RON 449.8
293,14710 WA0DE,147.105,+,0.6,TSQL,107.2,107.2,23,23,NN,FM,5,CO Elbert Simla WA0DE 147.105
294,44795 ND0Q,447.95,-,5,Tone,88.5,88.5,23,23,NN,FM,5,CO Pueblo Pueblo ND0Q 447.95
295,14679 ND0Q,146.79,-,0.6,Tone,88.5,88.5,23,23,NN,FM,5,"CO Pueblo Pueblo, Baculite Mesa ND0Q 146.79"
296,4493 WB7GR,449.3,-,5,Tone,131.8,88.5,23,23,NN,FM,5,"WY Laramie Cheyenne, Chalk Bluffs WB7GR 449.3"
297,14665 K0ST,146.655,-,0.6,Tone,123,88.5,23,23,NN,FM,5,"CO Pueblo Pueblo, Pueblo K0ST 146.655"
298,44972 N0PWZ,449.725,-,5,Tone,100,88.5,23,23,NN,FM,5,CO El Paso Palmer Divide N0PWZ 449.725
299,14688 ND0Q,146.88,-,0.6,Tone,88.5,88.5,23,23,NN,FM,5,"CO Pueblo Pueblo, Deer Peak ND0Q 146.88"
300,44727 K0JSC,447.275,-,5,TSQL,100,100,23,23,NN,FM,5,"CO Pueblo Pueblo, Metro K0JSC 447.275"
301,14676 K7QEQ,146.76,-,0.6,Tone,88.5,88.5,23,23,NN,FM,5,"UT Grand Moab, Bald Mesa K7QEQ 146.76"
302,4491 K7QEQ,449.1,-,5,TSQL,107.2,107.2,23,23,NN,FM,5,"UT Grand Moab, Bald Mesa K7QEQ 449.1"
303,14704 W7BAR,147.04,+,0.6,Tone,136.5,88.5,23,23,NN,FM,5,"UT Uintah Vernal, Grizzly Ridge W7BAR 147.04"
304,14549 K7HEN,145.49,-,0.6,Tone,136.5,88.5,23,23,NN,FM,5,"UT Uintah Vernal, Grizzly Ridge K7HEN 145.49"
305,44925 K0UPS,449.25,-,5,TSQL,123,123,23,23,NN,FM,5,CO Elbert Cedar Point K0UPS 449.25
306,1469 K7QEQ,146.9,-,0.6,Tone,88.5,88.5,23,23,NN,FM,5,UT Grand Moab K7QEQ 146.9
307,1467 K0EP,146.7,-,0.6,TSQL,100,100,23,23,NN,FM,5,"CO La Plata Durango, Missionary Ridge K0EP 146.7"
308,14734 KB0VJJ,147.345,+,0.6,Cross,88.5,123,23,23,NN,FM,5,"CO La Plata Durango, Missionary Ridge KB0VJJ 147.345"
309,14667 K0EP,146.67,-,0.6,Tone,100,88.5,23,23,NN,FM,5,"CO La Plata Durango, Eagle Pass K0EP 146.67"
