Location,Name,Frequency,Duplex,Offset,Tone,rToneFreq,cToneFreq,DtcsCode,DtcsRxCode,DtcsPolarity,Mode,TStep,Comment
310,44997 K0JSC,449.975,-,5,TSQL,100,100,23,23,NN,FM,5,"CO Pueblo Pueblo, Cedarwood K0JSC 449.975"
311,14661 N0JSP,146.61,-,0.6,Tone,123,88.5,23,23,NN,FM,5,"CO Archuleta Pagosa Springs, Oakbrush Hill N0JSP 146.61"
312,14661 N7RUG,146.61,-,0.6,Tone,100,88.5,23,23,NN,FM,5,"WY Sweetwater Rock Springs, Aspen Mountain N7RUG 146.61"
313,2224 K7DRA,222.4,+,1.6,Tone,123,88.5,23,23,NN,FM,5,"WY Sweetwater Rock Springs, Aspen Mtn K7DRA 222.4"
314,14694 WY7U,146.94,-,0.6,Tone,100,88.5,23,23,NN,FM,5,"WY Sweetwater Rock Springs, Aspen Mountain WY7U 146.94"
315,44237 KB5ITS,442.375,+,5,Tone,100,88.5,23,23,NN,FM,5,"CO Montezuma Mancos, Caviness Mountain KB5ITS 442.375"
316,44985 K0EP,449.85,-,5,TSQL,100,100,23,23,NN,FM,5,CO La Plata Durango K0EP 449.85
317,44862 KC5EVE,448.625,-,5,TSQL,131.8,131.8,23,23,NN,FM,5,CO La Plata Durango KC5EVE 448.625
318,14537 KB0VIU,145.37,-,0.6,TSQL,100,100,23,23,NN,FM,5,CO La Plata Hesperus KB0VIU 145.37
319,14713 KB5ITS,147.135,+,0.6,TSQL,100,100,23,23,NN,FM,5,"CO La Plata Durango, Smelter Mountain KB5ITS 147.135"
320,44727 KB5ITS,447.275,-,5,Tone,100,88.5,23,23,NN,FM,5,"CO Montezuma Dolores, Summit Ridge KB5ITS 447.275"
321,14519 KB5ITS,145.19,-,0.6,Tone,100,88.5,23,23,NN,FM,5,"CO Montezuma Dolores, Summit Ridge KB5ITS 145.19"
322,4499 N1FSX,449.9,-,5,Tone,107.2,88.5,23,23,NN,FM,5,CO Lincoln Punkin Center N1FSX 449.9
323,14549 W7BYU,145.49,-,0.6,Tone,136.5,88.5,23,23,NN,FM,5,"UT Duchesne Myton, Flat Top W7BYU 145.49"
324,14535 N0JPX,145.355,-,0.6,Tone,100,88.5,23,23,NN,FM,5,CO Huerfano La Veta N0JPX 145.355
325,14532 KB5ITS,145.325,-,0.6,Tone,100,88.5,23,23,NN,FM,5,"CO Montezuma Mancos, Menefee Mountain KB5ITS 145.325"
326,14715 KB5ITS,147.15,+,0.6,Tone,100,88.5,23,23,NN,FM,5,"CO La Plata Ignacio, Spring Creek KB5ITS 147.15"
327,14673 ND0Q,146.73,-,0.6,Tone,88.5,88.5,23,23,NN,FM,5,"CO Huerfano Walsenburg, N Rattlesnake Butte ND0Q 146.73"
328,1473 KF7OBL,147.3,+,0.6,,88.5,88.5,23,23,NN,FM,5,WY Sweetwater Rock Springs KF7OBL 147.3
329,4445 N7ABC,444.5,+,5,Tone,123,88.5,23,23,NN,FM,5,WY Sweetwater Rock Springs N7ABC 444.5
330,14679 KD5LWU,146.79,-,0.6,TSQL,127.3,127.3,23,23,NN,FM,5,"CO Montezuma Cortez, Downtown KD5LWU 146.79"
331,4447 K7DRA,444.7,+,5,Tone,123,88.5,23,23,NN,FM,5,WY Sweetwater Rock Springs K7DRA 444.7
332,14732 K7SDC,147.32,+,0.6,Tone,88.5,88.5,23,23,NN,FM,5,"UT Carbon Sunnyside, Bruin Point K7SDC 147.32"
333,44905 K7SDC,449.05,-,5,Tone,88.5,88.5,23,23,NN,FM,5,"UT Carbon Sunnyside, Bruin Point K7SDC 449.05"
334,14517 WX7Y,145.175,-,0.6,,88.5,88.5,23,23,NN,FM,5,"UT Carbon Sunny Side, Bruin Peak WX7Y 145.175"
335,44975 N0ZSN,449.75,-,5,TSQL,100,100,23,23,NN,FM,5,"CO Las Animas La Veta, Cordova Pass N0ZSN 449.75"
336,14716 KC7SNO,147.165,+,0.6,Tone,114.8,88.5,23,23,NN,FM,5,WY Laramie Albin KC7SNO 147.165
337,14543 NM5SJ,145.43,-,0.6,Tone,136.5,88.5,23,23,NN,FM,5,NM Rio Arriba Dulce NM5SJ 145.43
338,14728 AD7ZW,147.28,+,0.6,TSQL,107.2,107.2,23,23,NN,FM,5,UT Duchesne Altamont AD7ZW 147.28
339,4471 K7QEQ,447.1,-,5,TSQL,107.2,107.2,23,23,NN,FM,5,"UT San Juan Monticello, Abajo Peak K7QEQ 447.1"
340,14661 K7SDC,146.61,-,0.6,Tone,88.5,88.5,23,23,NN,FM,5,"UT San Juan Monticello, Abajo Peak K7SDC 146.61"
341,14708 W5SF,147.08,+,0.6,Tone,162.2,88.5,23,23,NN,FM,5,"NM Rio Arriba Chama, Overlook Mtn W5SF 147.08"
342,14726 N7PQD,147.26,+,0.6,,88.5,88.5,23,23,NN,FM,5,UT Duchesne Duchense N7PQD 147.26
343,22468 AE7AF,224.68,-,1.6,,88.5,88.5,23,23,NN,FM,5,WY Platte Wheatland AE7AF 224.68
344,14688 WA7SNU,146.88,-,0.6,TSQL,100,100,23,23,NN,FM,5,WY Platte Wheatland WA7SNU 146.88
345,44962 WA7SNU,449.625,-,5,Tone,151.4,88.5,23,23,NN,FM,5,WY Platte Wheatland WA7SNU 449.625
346,1454 KB0VJJ,145.4,-,0.8,Cross,88.5,123,23,23,NN,FM,5,CO Washington Akron KB0VJJ 145.4
347,14706 NM5SJ,147.06,+,0.6,Tone,100,88.5,23,23,NN,FM,5,"NM San Juan Nebo, Cedar Hill NM5SJ 147.06"
348,14722 NM5ML,147.22,+,0.6,Tone,100,88.5,23,23,NN,FM,5,"NM Rio Arriba Tres Piedras, San Antonio Mountain NM5ML 147.22"
349,14676 KF5PFO,146.76,-,0.6,Tone,67,88.5,23,23,NN,FM,5,"NM Rio Arriba Tres Piedras,  San Antonio Mountain KF5PFO 146.76"
350,14736 KB5ITS,147.36,+,0.6,Tone,100,88.5,23,23,NN,FM,5,"NM San Juan Navajo Dam, Navajo Lake KB5ITS 147.36"
351,44855 K7SDC,448.55,-,5,Tone,88.5,88.5,23,23,NN,FM,5,"UT Emery Castle Dale, Cedar Mountain K7SDC 448.55"
352,14714 K7SDC,147.14,+,0.6,Tone,88.5,88.5,23,23,NN,FM,5,"UT Emery Castle Dale, Cedar Mountain K7SDC 147.14"
353,147 N0NEB,147,-,0.6,Tone,103.5,88.5,23,23,NN,FM,5,NE Banner Harrisburg N0NEB 147
354,14674 NM5SJ,146.74,-,0.6,Tone,100,88.5,23,23,NN,FM,5,NM San Juan Aztec NM5SJ 146.74
355,14688 KB5ITS,146.88,-,0.6,Tone,100,88.5,23,23,NN,FM,5,"NM San Juan Aztec, Tank Mtn KB5ITS 146.88"
356,44745 KB5ITS,447.45,-,5,Tone,107.2,88.5,23,23,NN,FM,5,NM San Juan Aztec KB5ITS 447.45
