Location,Name,Frequency,Duplex,Offset,Tone,rToneFreq,cToneFreq,DtcsCode,DtcsRxCode,DtcsPolarity,Mode,TStep,Comment
308,14532 KB5ITS,145.325,-,0.6,Tone,100,88.5,23,23,NN,FM,5,"CO Montezuma Mancos, Menefee Mountain KB5ITS 145.325"
309,14661 N0JSP,146.61,-,0.6,Tone,123,88.5,23,23,NN,FM,5,"CO Archuleta Pagosa Springs, Oakbrush Hill N0JSP 146.61"
310,44897 K0JSC,448.975,-,5,TSQL,100,100,23,23,NN,FM,5,CO Pueblo Pueblo West K0JSC 448.975
311,4471 K7QEQ,447.1,-,5,TSQL,107.2,107.2,23,23,NN,FM,5,"UT San Juan Monticello, Abajo Peak K7QEQ 447.1"
312,14661 K7SDC,146.61,-,0.6,Tone,88.5,88.5,23,23,NN,FM,5,"UT San Juan Monticello, Abajo Peak K7SDC 146.61"
313,14728 AD7ZW,147.28,+,0.6,TSQL,107.2,107.2,23,23,NN,FM,5,UT Duchesne Altamont AD7ZW 147.28
314,14679 KD5LWU,146.79,-,0.6,TSQL,127.3,127.3,23,23,NN,FM,5,"CO Montezuma Cortez, Downtown KD5LWU 146.79"
315,14726 N7PQD,147.26,+,0.6,,88.5,88.5,23,23,NN,FM,5,UT Duchesne Duchense N7PQD 147.26
316,44795 ND0Q,447.95,-,5,Tone,88.5,88.5,23,23,NN,FM,5,CO Pueblo Pueblo ND0Q 447.95
317,14679 ND0Q,146.79,-,0.6,Tone,88.5,88.5,23,23,NN,FM,5,"CO Pueblo Pueblo, Baculite Mesa ND0Q 146.79"
318,14715 KB5ITS,147.15,+,0.6,Tone,100,88.5,23,23,NN,FM,5,"CO La Plata Ignacio, Spring Creek KB5ITS 147.15"
319,14677 KC7SNO,146.775,-,0.6,Tone,114.8,88.5,23,23,NN,FM,5,"WY Laramie Cheyenne, Denver Hill KC7SNO 146.775"
320,44702 N7EMA,447.025,-,5,,88.5,88.5,23,23,NN,FM,5,WY Laramie Cheyenne N7EMA 447.025
321,44972 N0PWZ,449.725,-,5,Tone,100,88.5,23,23,NN,FM,5,CO El Paso Palmer Divide N0PWZ 449.725
322,14688 ND0Q,146.88,-,0.6,Tone,88.5,88.5,23,23,NN,FM,5,"CO Pueblo Pueblo, Deer Peak ND0Q 146.88"
323,14665 K0ST,146.655,-,0.6,Tone,123,88.5,23,23,NN,FM,5,"CO Pueblo Pueblo, Pueblo K0ST 146.655"
324,14523 KB7SWR,145.235,-,0.6,Tone,114.8,88.5,23,23,NN,FM,5,WY Laramie Cheyenne KB7SWR 145.235
325,44895 KC7DHF,448.95,-,5,Tone,151.4,88.5,23,23,NN,FM,5,WY Laramie Cheyenne KC7DHF 448.95
326,4499 N7JJY,449.9,-,5,TSQL,100,100,23,23,NN,FM,5,WY Laramie Cheyenne N7JJY 449.9
327,14710 KC7SNO,147.105,+,0.6,Tone,114.8,88.5,23,23,NN,FM,5,"WY Laramie Cheyenne, North Park KC7SNO 147.105"
328,1473 KF7OBL,147.3,+,0.6,,88.5,88.5,23,23,NN,FM,5,WY Sweetwater Rock Springs KF7OBL 147.3
329,44727 K0JSC,447.275,-,5,TSQL,100,100,23,23,NN,FM,5,"CO Pueblo Pueblo, Metro K0JSC 447.275"
330,4445 N7ABC,444.5,+,5,Tone,123,88.5,23,23,NN,FM,5,WY Sweetwater Rock Springs N7ABC 444.5
331,14710 WA0DE,147.105,+,0.6,TSQL,107.2,107.2,23,23,NN,FM,5,CO Elbert Simla WA0DE 147.105
332,4447 K7DRA,444.7,+,5,Tone,123,88.5,23,23,NN,FM,5,WY Sweetwater Rock Springs K7DRA 444.7
333,4493 WB7GR,449.3,-,5,Tone,131.8,88.5,23,23,NN,FM,5,"WY Laramie Cheyenne, Chalk Bluffs WB7GR 449.3"
334,44855 K7SDC,448.55,-,5,Tone,88.5,88.5,23,23,NN,FM,5,"UT Emery Castle Dale, Cedar Mountain K7SDC 448.55"
335,14714 K7SDC,147.14,+,0.6,Tone,88.5,88.5,23,23,NN,FM,5,"UT Emery Castle Dale, Cedar Mountain K7SDC 147.14"
336,14543 NM5SJ,145.43,-,0.6,Tone,136.5,88.5,23,23,NN,FM,5,NM Rio Arriba Dulce NM5SJ 145.43
337,14706 NM5SJ,147.06,+,0.6,Tone,100,88.5,23,23,NN,FM,5,"NM San Juan Nebo, Cedar Hill NM5SJ 147.06"
338,44997 K0JSC,449.975,-,5,TSQL,100,100,23,23,NN,FM,5,"CO Pueblo Pueblo, Cedarwood K0JSC 449.975"
339,2245 W7CEU,224.5,-,1.6,Tone,88.5,88.5,23,23,NN,FM,5,"UT Carbon Price,  Wood Hill W7CEU 224.5"
340,4483 K7GX,448.3,-,5,,88.5,88.5,23,23,NN,FM,5,"UT Carbon Price, Wood Hill K7GX 448.3"
341,14543 W7CEU,145.43,-,0.6,Tone,88.5,88.5,23,23,NN,FM,5,"UT Carbon Price,  Wood Hill W7CEU 145.43"
342,1472 K7GX,147.2,+,0.6,Tone,88.5,88.5,23,23,NN,FM,5,"UT Carbon Price, Wood Hill K7GX 147.2"
343,4483 W7CEU,448.3,-,5,Tone,88.5,88.5,23,23,NN,FM,5,"UT Carbon Price,  Wood Hill W7CEU 448.3"
344,14708 W5SF,147.08,+,0.6,Tone,162.2,88.5,23,23,NN,FM,5,"NM Rio Arriba Chama, Overlook Mtn W5SF 147.08"
345,44925 K0UPS,449.25,-,5,TSQL,123,123,23,23,NN,FM,5,CO Elbert Cedar Point K0UPS 449.25
346,14535 N0JPX,145.355,-,0.6,Tone,100,88.5,23,23,NN,FM,5,CO Huerfano La Veta N0JPX 145.355
347,14736 KB5ITS,147.36,+,0.6,Tone,100,88.5,23,23,NN,FM,5,"NM San Juan Navajo Dam, Navajo Lake KB5ITS 147.36"
348,14688 KB5ITS,146.88,-,0.6,Tone,100,88.5,23,23,NN,FM,5,"NM San Juan Aztec, Tank Mtn KB5ITS 146.88"
349,44745 KB5ITS,447.45,-,5,Tone,107.2,88.5,23,23,NN,FM,5,NM San Juan Aztec KB5ITS 447.45
350,14674 NM5SJ,146.74,-,0.6,Tone,100,88.5,23,23,NN,FM,5,NM San Juan Aztec NM5SJ 146.74
351,14734 KG7DSO,147.34,+,0.6,Tone,136.5,88.5,23,23,NN,FM,5,"UT Uintah Vernal, Tabby Mountain KG7DSO 147.34"
352,14531 K7SDC,145.31,-,0.6,Tone,88.5,88.5,23,23,NN,FM,5,"UT Carbon Scofield, Ford Ridge K7SDC 145.31"
353,44975 N0ZSN,449.75,-,5,TSQL,100,100,23,23,NN,FM,5,"CO Las Animas La Veta, Cordova Pass N0ZSN 449.75"
354,14673 ND0Q,146.73,-,0.6,Tone,88.5,88.5,23,23,NN,FM,5,"CO Huerfano Walsenburg, N Rattlesnake Butte ND0Q 146.73"
355,14463 KF7ELU,144.635,+,0.6,Tone,100,88.5,23,23,NN,FM,5,"WY Uinta Mountain View, Hickey Mtn KF7ELU 144.635"
356,14676 KF5PFO,146.76,-,0.6,Tone,67,88.5,23,23,NN,FM,5,"NM Rio Arriba Tres Piedras,  San Antonio Mountain KF5PFO 146.76"
