Location,Name,Frequency,Duplex,Offset,Tone,rToneFreq,cToneFreq,DtcsCode,DtcsRxCode,DtcsPolarity,Mode,TStep,Comment
312,444 KB5ITS,444,+,5,Tone,67,88.5,23,23,NN,FM,5,"CO Huerfano Silverton, Hazelton KB5ITS 444"
313,44752 KB5ITS,447.525,-,5,Tone,127.3,88.5,23,23,NN,FM,5,CO San Juan Silverton KB5ITS 447.525
314,4497 KB0YNA,449.7,-,5,TSQL,107.2,107.2,23,23,NN,FM,5,"CO San Miguel Telluride, Gray Head KB0YNA 449.7"
315,14694 W0RRZ,146.94,-,0.6,TSQL,107.2,107.2,23,23,NN,FM,5,"CO Mesa Grand Junction, Black Ridge (Above Colorado Ntl Monument) W0RRZ 146.94"
316,44957 WA4HND,449.575,-,5,TSQL,131.8,131.8,23,23,NN,FM,5,"CO Mesa Grand Junction, Black Ridge WA4HND 449.575"
317,14543 WA6IFI,145.43,-,0.6,Tone,107.2,88.5,23,23,NN,FM,5,"CO Las Animas Trinidad, Raton Pass WA6IFI 145.43"
318,447 KB0SW,447,-,5,Tone,107.2,88.5,23,23,NN,FM,5,"CO Garfield Loma, Baxter Pass KB0SW 447"
319,14727 KB5ITT,147.27,+,0.6,Tone,127.3,88.5,23,23,NN,FM,5,"CO San Juan Silverton, Engineer Mountain KB5ITT 147.27"
320,4494 KB0YNA,449.4,-,5,TSQL,131.8,131.8,23,23,NN,FM,5,"CO Mesa Delta, Uncompahgre Butte KB0YNA 449.4"
321,14728 NM5ML,147.28,+,0.6,Tone,100,88.5,23,23,NN,FM,5,"NM Colfax Raton, Sierra Grande NM5ML 147.28"
322,4446 WA0VJR,444.6,+,5,Tone,146.2,88.5,23,23,NN,FM,5,KS Wallace Wallace WA0VJR 444.6
323,14701 N2VHZ,147.015,+,0.6,,88.5,88.5,23,23,NN,FM,5,NE Box Butte Alliance N2VHZ 147.015
324,14661 N0JSP,146.61,-,0.6,Tone,123,88.5,23,23,NN,FM,5,"CO Archuleta Pagosa Springs, Oakbrush Hill N0JSP 146.61"
325,14671 N0NEB,146.715,-,0.6,TSQL,103.5,103.5,23,23,NN,FM,5,NE Box Butte Alliance N0NEB 146.715
326,14676 KF5PFO,146.76,-,0.6,Tone,67,88.5,23,23,NN,FM,5,"NM Rio Arriba Tres Piedras,  San Antonio Mountain KF5PFO 146.76"
327,14722 NM5ML,147.22,+,0.6,Tone,100,88.5,23,23,NN,FM,5,"NM Rio Arriba Tres Piedras, San Antonio Mountain NM5ML 147.22"
328,44217 K0WPM,442.175,+,5,Tone,156.7,88.5,23,23,NN,FM,5,KS Greeley Tribune K0WPM 442.175
329,14676 N0UGO,146.76,-,0.6,Tone,123,88.5,23,23,NN,FM,5,NE Keith Ogallala N0UGO 146.76
330,14708 W5SF,147.08,+,0.6,Tone,162.2,88.5,23,23,NN,FM,5,"NM Rio Arriba Chama, Overlook Mtn W5SF 147.08"
331,4497 W7BYU,449.7,-,5,Tone,136.5,88.5,23,23,NN,FM,5,UT Uintah Vernal W7BYU 449.7
332,1471 W7BAR,147.1,+,0.6,Tone,136.5,88.5,23,23,NN,FM,5,"UT Uintah Vernal, Blue Mountain W7BAR 147.1"
333,1467 K0EP,146.7,-,0.6,TSQL,100,100,23,23,NN,FM,5,"CO La Plata Durango, Missionary Ridge K0EP 146.7"
334,14709 KZ0DEM,147.09,+,0.6,TSQL,118.8,118.8,23,23,NN,FM,5,CO Baca Springfield KZ0DEM 147.09
335,4492 KZ0DEM,449.2,-,5,TSQL,118.8,118.8,23,23,NN,FM,5,CO Baca Springfield KZ0DEM 449.2
336,444 K0ECT,444,+,5,TSQL,141.3,141.3,23,23,NN,FM,5,KS Hamilton Syracuse K0ECT 444
337,14734 KB0VJJ,147.345,+,0.6,Cross,88.5,123,23,23,NN,FM,5,"CO La Plata Durango, Missionary Ridge KB0VJJ 147.345"
338,14543 NM5SJ,145.43,-,0.6,Tone,136.5,88.5,23,23,NN,FM,5,NM Rio Arriba Dulce NM5SJ 145.43
339,14667 K0EP,146.67,-,0.6,Tone,100,88.5,23,23,NN,FM,5,"CO La Plata Durango, Eagle Pass K0EP 146.67"
340,14677 KA0TAO,146.775,-,0.6,,88.5,88.5,23,23,NN,FM,5,KS Hamilton Syracuse KA0TAO 146.775
341,44862 KC5EVE,448.625,-,5,TSQL,131.8,131.8,23,23,NN,FM,5,CO La Plata Durango KC5EVE 448.625
342,44985 K0EP,449.85,-,5,TSQL,100,100,23,23,NN,FM,5,CO La Plata Durango K0EP 449.85
343,14715 KB5ITS,147.15,+,0.6,Tone,100,88.5,23,23,NN,FM,5,"CO La Plata Ignacio, Spring Creek KB5ITS 147.15"
344,14713 KB5ITS,147.135,+,0.6,TSQL,100,100,23,23,NN,FM,5,"CO La Plata Durango, Smelter Mountain KB5ITS 147.135"
345,14537 KB0VIU,145.37,-,0.6,TSQL,100,100,23,23,NN,FM,5,CO La Plata Hesperus KB0VIU 145.37
346,44237 KB5ITS,442.375,+,5,Tone,100,88.5,23,23,NN,FM,5,"CO Montezuma Mancos, Caviness Mountain KB5ITS 442.375"
347,14532 KB5ITS,145.325,-,0.6,Tone,100,88.5,23,23,NN,FM,5,"CO Montezuma Mancos, Menefee Mountain KB5ITS 145.325"
348,14694 WY7U,146.94,-,0.6,Tone,100,88.5,23,23,NN,FM,5,"WY Sweetwater Rock Springs, Aspen Mountain WY7U 146.94"
349,14661 N7RUG,146.61,-,0.6,Tone,100,88.5,23,23,NN,FM,5,"WY Sweetwater Rock Springs, Aspen Mountain N7RUG 146.61"
350,2224 K7DRA,222.4,+,1.6,Tone,123,88.5,23,23,NN,FM,5,"WY Sweetwater Rock Springs, Aspen Mtn K7DRA 222.4"
351,44727 KB5ITS,447.275,-,5,Tone,100,88.5,23,23,NN,FM,5,"CO Montezuma Dolores, Summit Ridge KB5ITS 447.275"
352,14519 KB5ITS,145.19,-,0.6,Tone,100,88.5,23,23,NN,FM,5,"CO Montezuma Dolores, Summit Ridge KB5ITS 145.19"
353,14706 NM5SJ,147.06,+,0.6,Tone,100,88.5,23,23,NN,FM,5,"NM San Juan Nebo, Cedar Hill NM5SJ 147.06"
354,1473 KF7OBL,147.3,+,0.6,,88.5,88.5,23,23,NN,FM,5,WY Sweetwater Rock Springs KF7OBL 147.3
355,14679 KD5LWU,146.79,-,0.6,TSQL,127.3,127.3,23,23,NN,FM,5,"CO Montezuma Cortez, Downtown KD5LWU 146.79"
356,14698 N0OMC,146.985,-,0.6,TSQL,156.7,156.7,23,23,NN,FM,5,KS Kearney Lakin N0OMC 146.985
