Location,Name,Frequency,Duplex,Offset,Tone,rToneFreq,cToneFreq,DtcsCode,DtcsRxCode,DtcsPolarity,Mode,TStep,Comment
0,0KMcenter,146.64,-,0.6,TSQL,77,77,23,23,NN,FM,5,CO Rio Grande Center N0KM 146.64 OPEN On-Air
1,0KMcenter,447.1,-,5,Tone,77,77,23,23,NN,FM,5,CO Saguache Center N0KM 447.1 OPEN On-Air
2,"5MLtrespiedras, san antonio mountain",147.22,+,0.6,Tone,100,100,23,23,NN,FM,5,"NM Rio Arriba Tres Piedras, San Antonio Mountain NM5ML 147.22 OPEN On-Air"
3,"5MLtaos,ski valley",147.14,+,0.6,Tone,67,67,23,23,NN,FM,5,"NM Taos Taos, Ski Valley NM5ML 147.14 OPEN On-Air"
4,"5MLeaglenest, iron mountain",444.35,+,5,Tone,100,100,23,23,NN,FM,5,"NM Colfax Eagle Nest, Iron Mountain NM5ML 444.35 OPEN On-Air"
5,"5MLraton,sierra grande",147.28,+,0.6,Tone,100,100,23,23,NN,FM,5,"NM Colfax Raton, Sierra Grande NM5ML 147.28 OPEN On-Air"
6,"5MLcuba,eureka mesa",147.24,+,0.6,Tone,67,67,23,23,NN,FM,5,"NM Sandoval Cuba, Eureka Mesa NM5ML 147.24 OPEN On-Air"
7,"5MLwagonmound, turkey mountain",147.2,+,0.6,Tone,67,67,23,23,NN,FM,5,"NM Mora Wagon Mound, Turkey Mountain NM5ML 147.2 OPEN On-Air"
8,"5MLpecos,elk mountain",147.26,+,0.6,Tone,67,67,23,23,NN,FM,5,"NM San Miguel Pecos, Elk Mountain NM5ML 147.26 OPEN On-Air"
9,"5MLbloomfield,harris mesa",147.28,+,0.6,Tone,67,67,23,23,NN,FM,5,"NM San Juan Bloomfield, Harris Mesa NM5ML 147.28 OPEN On-Air"
10,"5MLalbuquerque,sandia crest",145.29,-,0.6,Tone,100,100,23,23,NN,FM,5,"NM Bernalillo Albuquerque, Sandia Crest NM5ML 145.29 OPEN On-Air"
11,"5MLalbuquerque,sandia crest",444.325,+,5,Tone,100,100,23,23,NN,FM,5,"NM Bernalillo Albuquerque, Sandia Crest NM5ML 444.325 OPEN On-Air"
12,"5MLtijeras,cedro peak",147.34,+,0.6,Tone,67,67,23,23,NN,FM,5,"NM Bernalillo Tijeras, Cedro Peak NM5ML 147.34 OPEN On-Air"
13,"5MLconchasdam, mesa rica",147.36,+,0.6,Tone,100,100,23,23,NN,FM,5,"NM San Miguel Conchas Dam, Mesa Rica NM5ML 147.36 OPEN On-Air"
14,"5MLgallup,deza bluffs",147.22,+,0.6,Tone,67,67,23,23,NN,FM,5,"NM McKinley Gallup, Deza Bluffs NM5ML 147.22 OPEN On-Air"
15,"5MLgrants,microwave ridge",146.66,-,0.6,Tone,100,100,23,23,NN,FM,5,"NM Cibola Grants, Microwave Ridge NM5ML 146.66 OPEN On-Air"
16,"5MLgrants,la mosca",444.8,+,5,Tone,67,67,23,23,NN,FM,5,"NM Cibola Grants, La Mosca NM5ML 444.8 OPEN On-Air"
17,"5MLtucumcari,tucumcari mountain",147.22,+,0.6,Tone,100,100,23,23,NN,FM,5,"NM Quay Tucumcari, Tucumcari Mountain NM5ML 147.22 OPEN On-Air"
18,"PFOtrespiedras,  san antonio mountain",146.76,-,0.6,Tone,67,67,23,23,NN,FM,5,"NM Rio Arriba Tres Piedras,  San Antonio Mountain KF5PFO 146.76 OPEN On-Air"
19,"PFOredriver, molycorp",145.39,-,0.6,Tone,100,100,23,23,NN,FM,5,"NM Taos Red River, Molycorp KF5PFO 145.39 OPEN On-Air"
20,"PFOtrespiedras, san antonio mountain",146.76,-,0.6,Tone,67,67,23,23,NN,FM,5,"NM Taos Tres Piedras, San Antonio Mountain KF5PFO 146.76 OPEN On-Air"
21,"PFOredriver, valle vidal",145.25,-,0.6,Tone,123,123,23,23,NN,FM,5,"NM Taos Red River, Valle Vidal KF5PFO 145.25 OPEN On-Air"
22,"PFOtaos,picuris peak",51.5,,0,Tone,100,100,23,23,NN,FM,5,"NM Taos Taos, Picuris Peak KF5PFO 51.5 OPEN On-Air"
23,"PFOtaos,picuris peak",147.12,+,0.6,Tone,67,67,23,23,NN,FM,5,"NM Taos Taos, Picuris Peak KF5PFO 147.12 OPEN On-Air"
24,"PFOtaos,picuris peak",224.4,-,1.6,Tone,225.7,225.7,23,23,NN,FM,5,"NM Taos Taos, Picuris Peak KF5PFO 224.4 OPEN On-Air"
25,"PFOtaos,picuris peak",449.875,-,5,Tone,123,123,23,23,NN,FM,5,"NM Taos Taos, Picuris Peak KF5PFO 449.875 OPEN Off-Air"
26,"ZSNlaveta, cordova pass",449.75,-,5,TSQL,100,100,23,23,NN,FM,5,"CO Las Animas La Veta, Cordova Pass N0ZSN 449.75 OPEN On-Air"
27,"ZSNleadville,quail mountain",147.24,+,0.6,TSQL,156.7,156.7,23,23,NN,FM,5,"CO Lake Leadville, Quail Mountain N0ZSN 147.24 OPEN Off-Air"
28,JPXlaveta,145.355,-,0.6,Tone,100,100,23,23,NN,FM,5,CO Huerfano La Veta N0JPX 145.355 OPEN On-Air
29,JSCwestcliffe,448.325,-,5,TSQL,100,100,23,23,NN,FM,5,CO Custer Westcliffe K0JSC 448.325 OPEN On-Air
30,"JSCsalida,methodist mountain",449.975,-,5,TSQL,100,100,23,23,NN,FM,5,"CO Chaffee Salida, Methodist Mountain K0JSC 449.975 OPEN On-Air"
31,"JSCcanoncity, colorado",447.975,-,5,TSQL,100,100,23,23,NN,FM,5,"CO Fremont Canon City, Colorado K0JSC 447.975 OPEN On-Air"
32,"JSCcanoncity, fremont peak",446.7375,-,5,,88.5,88.5,23,23,NN,DIG,5,"CO Fremont Canon City, Fremont Peak K0JSC 446.7375 OPEN On-Air"
33,"JSCcanoncity, fremont peak",447.25,-,5,TSQL,100,100,23,23,NN,FM,5,"CO Fremont Canon City, Fremont Peak K0JSC 447.25 OPEN On-Air"
34,"JSCcanoncity, canon city",449.975,-,5,TSQL,100,100,23,23,NN,FM,5,"CO Fremont Canon City, Canon City K0JSC 449.975 OPEN On-Air"
35,JSCpueblowest,448.975,-,5,TSQL,100,100,23,23,NN,FM,5,CO Pueblo Pueblo West K0JSC 448.975 OPEN On-Air
36,"JSCpueblo,cedarwood",449.975,-,5,TSQL,100,100,23,23,NN,FM,5,"CO Pueblo Pueblo, Cedarwood K0JSC 449.975 OPEN On-Air"
37,JSCpueblo,446.9875,-,5,,88.5,88.5,23,23,NN,DIG,5,CO Pueblo Pueblo K0JSC 446.9875 OPEN Off-Air
38,"JSCpueblo,metro",447.275,-,5,TSQL,100,100,23,23,NN,FM,5,"CO Pueblo Pueblo, Metro K0JSC 447.275 OPEN On-Air"
39,"JSClarkspur,westcreek",449.975,-,5,TSQL,100,100,23,23,NN,FM,5,"CO Douglas Larkspur, Westcreek K0JSC 449.975 OPEN On-Air"
40,"D0Qwestcliffe,deer peak",919.1,-,25,Tone,88.5,88.5,23,23,NN,FM,5,"CO Pueblo Westcliffe, Deer Peak ND0Q 919.1 OPEN Off-Air"
41,"D0Qwalsenburg,deer peak",224.32,-,1.6,Tone,88.5,88.5,23,23,NN,FM,5,"CO Custer Walsenburg, Deer Peak ND0Q 224.32 OPEN Off-Air"
42,"D0Qpueblo,deer peak",447.175,-,5,Tone,88.5,88.5,23,23,NN,FM,5,"CO Pueblo Pueblo, Deer Peak ND0Q 447.175 OPEN Off-Air"
43,"D0Qwalsenburg,n rattlesnake butte",146.73,-,0.6,Tone,88.5,88.5,23,23,NN,FM,5,"CO Huerfano Walsenburg, N Rattlesnake Butte ND0Q 146.73 OPEN On-Air"
44,D0Qpueblo,145.115,-,0.6,Tone,88.5,88.5,23,23,NN,FM,5,CO Pueblo Pueblo ND0Q 145.115 OPEN Off-Air
45,"D0Qpueblo,deer peak",146.88,-,0.6,Tone,88.5,88.5,23,23,NN,FM,5,"CO Pueblo Pueblo, Deer Peak ND0Q 146.88 OPEN On-Air"
46,"D0Qpueblo,baculite mesa",146.79,-,0.6,Tone,88.5,88.5,23,23,NN,FM,5,"CO Pueblo Pueblo, Baculite Mesa ND0Q 146.79 OPEN On-Air"
47,"D0Qpueblo,baculite mesa",224.26,-,1.6,Tone,88.5,88.5,23,23,NN,FM,5,"CO Pueblo Pueblo, Baculite Mesa ND0Q 224.26 OPEN Off-Air"
48,D0Qpueblo,447.95,-,5,Tone,88.5,88.5,23,23,NN,FM,5,CO Pueblo Pueblo ND0Q 447.95 OPEN On-Air
49,TUCwestcliffe,147.06,+,0.6,TSQL,77,77,23,23,NN,FM,5,CO Custer Westcliffe KB0TUC 147.06 OPEN On-Air
50,TUCwestcliffe,448.15,-,5,TSQL,103.5,103.5,23,23,NN,FM,5,CO Custer Westcliffe KB0TUC 448.15 OPEN On-Air
51,TUCwestcliffe,927.775,-,25,DTCS,88.5,88.5,116,116,NN,FM,5,CO Custer Westcliffe KB0TUC 927.775 OPEN On-Air
52,"TUCcanoncity, fremont peak",927.7,-,25,DTCS,88.5,88.5,114,114,NN,FM,5,"CO Fremont Canon City, Fremont Peak KB0TUC 927.7 OPEN On-Air"
53,"CVUpueblo,deer peak",449.625,-,5,Tone,107.2,107.2,23,23,NN,FM,5,"CO Custer Pueblo, Deer Peak KC0CVU 449.625 OPEN On-Air"
54,"CVUsalida,methodist mountain",449.65,-,5,Tone,107.2,107.2,23,23,NN,FM,5,"CO Chaffee Salida, Methodist Mountain KC0CVU 449.65 OPEN On-Air"
55,"CVUsalida,methodist mountain",145.295,-,0.6,Tone,107.2,107.2,23,23,NN,FM,5,"CO Chaffee Salida, Methodist Mountain KC0CVU 145.295 OPEN On-Air"
56,"CVUtrinidad,raton pass",449.6,-,5,Tone,107.2,107.2,23,23,NN,FM,5,"CO Las Animas Trinidad, Raton Pass KC0CVU 449.6 OPEN Off-Air"
57,"CVUcoloradosprings, cheyenne mountain",146.76,-,0.6,TSQL,107.2,107.2,23,23,NN,FM,5,"CO El Paso Colorado Springs, Cheyenne Mountain KC0CVU 146.76 OPEN On-Air"
58,"CVUcoloradosprings, cheyenne mountain",147.345,+,0.6,TSQL,107.2,107.2,23,23,NN,FM,5,"CO El Paso Colorado Springs, Cheyenne Mountain KC0CVU 147.345 OPEN On-Air"
59,"CVUcoloradosprings, cheyenne mountain",448,-,5,Tone,107.2,107.2,23,23,NN,FM,5,"CO El Paso Colorado Springs, Cheyenne Mountain KC0CVU 448 OPEN On-Air"
60,"CVUcoloradosprings, cheyenne mountain",448.1,-,5,TSQL,107.2,107.2,23,23,NN,FM,5,"CO El Paso Colorado Springs, Cheyenne Mountain KC0CVU 448.1 OPEN On-Air"
61,"CVUcoloradosprings, cheyenne mountain",145.375,-,0.6,,88.5,88.5,23,23,NN,DIG,5,"CO El Paso Colorado Springs, Cheyenne Mountain KC0CVU 145.375 OPEN Off-Air"
62,"CVUcoloradosprings, cheyenne mountain",446.9125,-,5,,88.5,88.5,23,23,NN,DIG,5,"CO El Paso Colorado Springs, Cheyenne Mountain KC0CVU 446.9125 OPEN On-Air"
63,"CVUcoloradosprings, cheyenne mountain",927.85,-,25,DTCS,88.5,88.5,114,114,NN,FM,5,"CO Teller Colorado Springs, Cheyenne Mountain KC0CVU 927.85 OPEN On-Air"
64,"CVUlakegeorge, badger mountain",147.36,+,0.6,TSQL,107.2,107.2,23,23,NN,FM,5,"CO Park Lake George, Badger Mountain KC0CVU 147.36 OPEN On-Air"
65,"5SFchama,overlook mtn",147.08,+,0.6,Tone,162.2,162.2,23,23,NN,FM,5,"NM Rio Arriba Chama, Overlook Mtn W5SF 147.08 OPEN On-Air"
66,"5SFlosalamos, pajarito mountain",145.19,-,0.6,Tone,162.2,162.2,23,23,NN,DIG,5,"NM Los Alamos Los Alamos, Pajarito Mountain W5SF 145.19 OPEN On-Air"
67,"5SFsantafe,  tesuque peak",146.82,-,0.6,Tone,162.2,162.2,23,23,NN,FM,5,"NM Santa Fe Santa Fe,  Tesuque Peak W5SF 146.82 OPEN On-Air"
68,"5SFlasvegas,  elk mountain",147.3,+,0.6,Tone,162.2,162.2,23,23,NN,FM,5,"NM San Miguel Las Vegas,  Elk Mountain W5SF 147.3 OPEN On-Air"
69,5SFsantafe,145.21,-,0.6,,88.5,88.5,23,23,NN,DIG,5,NM Santa Fe Santa Fe W5SF 145.21 OPEN On-Air
70,5SFsantafe,444.575,+,5,,88.5,88.5,23,23,NN,DIG,5,NM Santa Fe Santa Fe W5SF 444.575 OPEN On-Air
71,"5SFsantafe, st vincent hospital",147.2,+,0.6,Tone,162.2,162.2,23,23,NN,FM,5,"NM Santa Fe Santa Fe, St Vincent Hospital W5SF 147.2 OPEN On-Air"
72,"5EMtrespiedras, san antonio mtn.",145.175,-,0.6,Tone,141.3,141.3,23,23,NN,FM,5,"NM Taos Tres Piedras, San Antonio Mtn. NM5EM 145.175 OPEN Off-Air"
73,"5EMeaglenest, touch me not",147.04,+,0.6,Tone,141.3,141.3,23,23,NN,FM,5,"NM Colfax Eagle Nest, Touch Me Not NM5EM 147.04 OPEN On-Air"
74,"5EMabiquiu,cerro pelon",147.04,+,0.6,Tone,141.3,141.3,23,23,NN,FM,5,"NM Rio Arriba Abiquiu, Cerro Pelon NM5EM 147.04 OPEN Off-Air"
75,"5EMwagonmound, turkey mtn",145.37,-,0.6,Tone,141.3,141.3,23,23,NN,FM,5,"NM Mora Wagon Mound, Turkey Mtn NM5EM 145.37 OPEN Off-Air"
76,"5EMsantafe, tesuque peak",147.02,+,0.6,Tone,141.3,141.3,23,23,NN,FM,5,"NM Santa Fe Santa Fe, Tesuque Peak NM5EM 147.02 OPEN On-Air"
77,"5EMcuba,eureka mesa",145.175,-,0.6,Tone,141.3,141.3,23,23,NN,FM,5,"NM Sandoval Cuba, Eureka Mesa NM5EM 145.175 OPEN Off-Air"
78,"5EMdesmoines, sierra grande",147.175,+,0.6,Tone,141.3,141.3,23,23,NN,FM,5,"NM Union Des Moines, Sierra Grande NM5EM 147.175 OPEN On-Air"
79,"5EMgrants,mt taylor",146.98,-,0.6,TSQL,141.3,141.3,23,23,NN,FM,5,"NM Cibola Grants, Mt Taylor NM5EM 146.98 OPEN On-Air"
80,"5EMsantarosa, moon ranch",147.04,+,0.6,Tone,141.3,141.3,23,23,NN,FM,5,"NM Guadalupe Santa Rosa, Moon Ranch NM5EM 147.04 OPEN On-Air"
81,0JScreede,146.925,-,0.6,,88.5,88.5,23,23,NN,FM,5,CO Mineral Creede WA0JS 146.925 OPEN Off-Air
82,"TSVtaos,wheeler peak",444.975,+,5,Tone,123,123,23,23,NN,FM,5,"NM Taos Taos, Wheeler Peak N5TSV 444.975 OPEN On-Air"
83,"Z0Nsalida,methodist mountain",449.925,-,5,TSQL,103.5,103.5,23,23,NN,FM,5,"CO Chaffee Salida, Methodist Mountain WZ0N 449.925 OPEN On-Air"
84,Z0Nhartsel,448.575,-,5,TSQL,103.5,103.5,23,23,NN,FM,5,CO Park Hartsel WZ0N 448.575 OPEN Off-Air
85,"PKTcreede,bristol head",449.525,-,5,TSQL,100,100,23,23,NN,FM,5,"CO Mineral Creede, Bristol Head N0PKT 449.525 OPEN On-Air"
86,"VJJsalida,methodist mountain",147.285,+,0.6,Cross,88.5,123,23,23,NN,FM,5,"CO Chaffee Salida, Methodist Mountain KB0VJJ 147.285 OPEN On-Air"
87,"VJJcoloradosprings, cheyenne mountain",145.13,-,0.6,Cross,88.5,123,23,23,NN,FM,5,"CO El Paso Colorado Springs, Cheyenne Mountain KB0VJJ 145.13 OPEN On-Air"
88,"VJJdurango,missionary ridge",147.345,+,0.6,Cross,88.5,123,23,23,NN,FM,5,"CO La Plata Durango, Missionary Ridge KB0VJJ 147.345 OPEN On-Air"
89,"VJJleadville,mosquito pass",145.445,-,0.6,Tone,88.5,88.5,23,23,NN,FM,5,"CO Lake Leadville, Mosquito Pass KB0VJJ 145.445 OPEN On-Air"
90,"VJJbreckenridge,bald mountain",147.39,+,0.6,Cross,88.5,123,23,23,NN,FM,5,"CO Summit Breckenridge, Bald Mountain KB0VJJ 147.39 OPEN On-Air"
91,VJJvail,147.345,+,0.6,Cross,88.5,123,23,23,NN,FM,5,CO Eagle Vail KB0VJJ 147.345 OPEN On-Air
92,"VJJgrandjunction, grand mesa",145.355,-,0.6,Cross,88.5,123,23,23,NN,FM,5,"CO Mesa Grand Junction, Grand Mesa KB0VJJ 145.355 OPEN On-Air"
93,"VJJglenwoodsprings, sunlight peak",146.85,-,0.6,Cross,88.5,123,23,23,NN,FM,5,"CO Garfield Glenwood Springs, Sunlight Peak KB0VJJ 146.85 OPEN On-Air"
94,"VJJwinterpark, winter park",147.285,+,0.6,Cross,88.5,123,23,23,NN,FM,5,"CO Grand Winter Park, Winter Park KB0VJJ 147.285 OPEN On-Air"
95,"VJJboulder,thorodin mountain",145.31,-,0.6,Cross,88.5,123,23,23,NN,FM,5,"CO Gilpin Boulder, Thorodin Mountain KB0VJJ 145.31 OPEN On-Air"
96,"VJJkremmling,santoy peak",147.075,+,0.6,Cross,88.5,123,23,23,NN,FM,5,"CO Grand Kremmling, Santoy Peak KB0VJJ 147.075 OPEN On-Air"
97,"VJJgrandjunction, grand mesa",147.355,-,0.6,Cross,88.5,123,23,23,NN,FM,5,"CO Mesa Grand Junction, Grand Mesa KB0VJJ 147.355 OPEN On-Air"
98,VJJakron,145.4,-,0.6,Cross,88.5,123,23,23,NN,FM,5,CO Washington Akron KB0VJJ 145.4 OPEN On-Air
99,"JSPpagosasprings, oakbrush hill",146.61,-,0.6,Tone,123,123,23,23,NN,FM,5,"CO Archuleta Pagosa Springs, Oakbrush Hill N0JSP 146.61 OPEN On-Air"
100,5SJdulce,145.43,-,0.6,Tone,136.5,136.5,23,23,NN,FM,5,NM Rio Arriba Dulce NM5SJ 145.43 OPEN On-Air
101,"5SJnebo,cedar hill",147.06,+,0.6,Tone,100,100,23,23,NN,FM,5,"NM San Juan Nebo, Cedar Hill NM5SJ 147.06 OPEN On-Air"
102,5SJaztec,146.74,-,0.6,Tone,100,100,23,23,NN,FM,5,NM San Juan Aztec NM5SJ 146.74 OPEN On-Air
103,5SJlybrook,145.49,-,0.6,Tone,100,100,23,23,NN,FM,5,NM Rio Arriba Lybrook NM5SJ 145.49 OPEN On-Air
104,"5SJlukachukai,roof butte",146.82,-,0.6,Tone,100,100,23,23,NN,FM,5,"AZ Apache Lukachukai, Roof Butte NM5SJ 146.82 OPEN On-Air"
105,"0SZsalida,methodist mountain",446.8125,-,5,,88.5,88.5,23,23,NN,DIG,5,"CO Chaffee Salida, Methodist Mountain N0SZ 446.8125 OPEN On-Air"
106,"0SZcoloradosprings, cheyenne mountain",445.0625,-,5,,88.5,88.5,23,23,NN,DIG,5,"CO El Paso Colorado Springs, Cheyenne Mountain N0SZ 445.0625 OPEN Off-Air"
107,"0SZdurango,missionary ridge",445.1375,-,5,,88.5,88.5,23,23,NN,DIG,5,"CO La Plata Durango, Missionary Ridge N0SZ 445.1375 OPEN On-Air"
108,"0SZfairplay,badger",446.7625,-,5,,88.5,88.5,23,23,NN,DIG,5,"CO Park Fairplay, Badger N0SZ 446.7625 OPEN On-Air"
109,0SZwestcreek,446.875,-,5,,88.5,88.5,23,23,NN,DIG,5,CO Douglas Westcreek N0SZ 446.875 OPEN On-Air
110,"0SZleadville,mosquito pass",445.05,-,5,,88.5,88.5,23,23,NN,DIG,5,"CO Lake Leadville, Mosquito Pass N0SZ 445.05 OPEN On-Air"
111,"0SZbreckenridge,baldy",445.0875,-,5,,88.5,88.5,23,23,NN,DIG,5,"CO Fremont Breckenridge, Baldy N0SZ 445.0875 OPEN On-Air"
112,"0SZevergreen,lower squaw mountain",145.175,-,0.6,DTCS,88.5,88.5,73,73,NN,DIG,5,"CO Clear Creek Evergreen, Lower Squaw Mountain N0SZ 145.175 OPEN Off-Air"
113,0SZvail,445.075,-,5,,88.5,88.5,23,23,NN,DIG,5,CO Eagle Vail N0SZ 445.075 OPEN On-Air
114,"0SZidahosprings, squaw mountain",446.9375,-,5,,88.5,88.5,23,23,NN,DIG,5,"CO Clear Creek Idaho Springs, Squaw Mountain N0SZ 446.9375 OPEN On-Air"
115,"0SZidahosprings, squaw mountain",448.225,-,5,TSQL,141.3,141.3,23,23,NN,FM,5,"CO Clear Creek Idaho Springs, Squaw Mountain N0SZ 448.225 OPEN On-Air"
116,"0SZgolden,lookout mountain",145.37,-,0.6,,88.5,88.5,23,23,NN,DIG,5,"CO Jefferson Golden, Lookout Mountain N0SZ 145.37 OPEN On-Air"
117,"0SZdenver,thorodin mountain",449.225,-,5,TSQL,141.3,141.3,23,23,NN,FM,5,"CO Gilpin Denver, Thorodin Mountain N0SZ 449.225 OPEN On-Air"
118,"0SZboulder,mount thorodin",446.8,-,5,,88.5,88.5,23,23,NN,DIG,5,"CO Boulder Boulder, Mount Thorodin N0SZ 446.8 OPEN On-Air"
119,"0SZboulder,lee hill",445.05,-,5,,88.5,88.5,23,23,NN,DIG,5,"CO Boulder Boulder, Lee Hill N0SZ 445.05 OPEN On-Air"
120,"0SZboulder,lee hill",446.9875,-,5,,88.5,88.5,23,23,NN,DIG,5,"CO Boulder Boulder, Lee Hill N0SZ 446.9875 OPEN On-Air"
121,"0SZboulder,lee hill",447.75,-,5,TSQL,141.3,141.3,23,23,NN,FM,5,"CO Boulder Boulder, Lee Hill N0SZ 447.75 OPEN On-Air"
122,"0SZrangely,cathedral bluffs",445.2625,-,5,,88.5,88.5,23,23,NN,DIG,5,"CO Rio Blanco Rangely, Cathedral Bluffs N0SZ 445.2625 OPEN On-Air"
123,"QPGsalida,methodist mountain",446.975,-,5,,88.5,88.5,23,23,NN,DIG,5,"CO Chaffee Salida, Methodist Mountain KD0QPG 446.975 OPEN On-Air"
124,"RDItrinidad,raton pass",446.775,-,5,,88.5,88.5,23,23,NN,DIG,5,"CO Las Animas Trinidad, Raton Pass KD0RDI 446.775 OPEN On-Air"
125,"RDIraton,raton pass",446.775,-,5,,88.5,88.5,23,23,NN,DIG,5,"NM Colfax Raton, Raton Pass KD0RDI 446.775 OPEN On-Air"
126,"WDFcanoncity, fremont peak",53.03,-,1.7,TSQL,88.5,88.5,23,23,NN,FM,5,"CO Fremont Canon City, Fremont Peak WB0WDF 53.03 OPEN On-Air"
127,"WDFcanoncity, eightmile mountain",449,-,5,TSQL,67,67,23,23,NN,FM,5,"CO Fremont Canon City, eightmile Mountain WB0WDF 449 OPEN On-Air"
128,WDFcripplecreek,1287.7,-,20,Tone,67,67,23,23,NN,FM,5,CO Teller Cripple Creek WB0WDF 1287.7 OPEN Testing
129,WDFcripplecreek,145.46,-,0.6,Tone,67,67,23,23,NN,FM,5,CO Teller Cripple Creek WB0WDF 145.46 OPEN On-Air
130,WDFcripplecreek,224.94,-,1.6,Tone,67,67,23,23,NN,FM,5,CO Teller Cripple Creek WB0WDF 224.94 OPEN Testing
131,WDFcripplecreek,447.4,-,5,Tone,67,67,23,23,NN,FM,5,CO Teller Cripple Creek WB0WDF 447.4 OPEN On-Air
132,"EKRcanoncity, fremont peak",145.49,-,0.6,TSQL,103.5,103.5,23,23,NN,FM,5,"CO Fremont Canon City, Fremont Peak WD0EKR 145.49 OPEN On-Air"
133,"EKRcanoncity, fremont peak",223.96,-,1.6,TSQL,103.5,103.5,23,23,NN,FM,5,"CO Fremont Canon City, Fremont Peak WD0EKR 223.96 OPEN On-Air"
134,"EKRcanoncity, fremont peak",447.75,-,5,TSQL,103.5,103.5,23,23,NN,FM,5,"CO Fremont Canon City, Fremont Peak WD0EKR 447.75 OPEN On-Air"
135,"MRCmaysville,co",145.325,-,0.6,Tone,100,100,23,23,NN,FM,5,"CO Chaffee Maysville, CO KD0MRC 145.325 OPEN On-Air"
136,"0BVtrinidad,raton pass",147.375,+,0.6,TSQL,100,100,23,23,NN,FM,5,"CO Las Animas Trinidad, Raton Pass K0BV 147.375 OPEN Off-Air"
137,"5JLtrinidad,raton pass",447.375,-,5,Tone,100,100,23,23,NN,DIG,5,"CO Las Animas Trinidad, Raton Pass KG5JL 447.375 OPEN On-Air"
138,"IFItrinidad,raton pass",145.43,-,0.6,Tone,107.2,107.2,23,23,NN,FM,5,"CO Las Animas Trinidad, Raton Pass WA6IFI 145.43 OPEN On-Air"
139,"IFIcoloradosprings, almagre mountain",927.725,-,25,DTCS,88.5,88.5,114,114,NN,FM,5,"CO Teller Colorado Springs, Almagre Mountain WA6IFI 927.725 OPEN On-Air"
140,"IFIcoloradosprings, cheyenne mountain",53.13,-,1.7,TSQL,107.2,107.2,23,23,NN,FM,5,"CO El Paso Colorado Springs, Cheyenne Mountain WA6IFI 53.13 OPEN On-Air"
141,IFIcoloradosprings,447.55,-,5,Tone,123,123,23,23,NN,FM,5,CO El Paso Colorado Springs WA6IFI 447.55 OPEN On-Air
142,GDRcimarron,145.21,-,0.6,TSQL,110.9,110.9,23,23,NN,FM,5,NM Colfax Cimarron N5GDR 145.21 OPEN On-Air
143,"LEMangelfire, agua fria peak",147.34,+,0.6,Tone,100,100,23,23,NN,FM,5,"NM Colfax Angel Fire, Agua Fria Peak N5LEM 147.34 OPEN On-Air"
144,J0Tpueblo,147.24,+,0.6,Tone,103.5,103.5,23,23,NN,FM,5,CO Pueblo Pueblo KJ0T 147.24 OPEN Off-Air
145,"YNAgunnison,w mountain or tenderfoot mountain",447.65,-,5,TSQL,151.4,151.4,23,23,NN,FM,5,"CO Gunnison Gunnison, W Mountain or Tenderfoot Mountain KB0YNA 447.65 OPEN On-Air"
146,"YNAmontrose,waterdog peak",448.65,-,5,Cross,88.5,151.4,23,23,NN,FM,5,"CO Montrose Montrose, Waterdog Peak KB0YNA 448.65 OPEN On-Air"
147,"YNAtelluride,gray head",449.7,-,5,TSQL,107.2,107.2,23,23,NN,FM,5,"CO San Miguel Telluride, Gray Head KB0YNA 449.7 OPEN On-Air"
148,"YNAgrandjunction, grand mesa",449.65,-,5,TSQL,151.4,151.4,23,23,NN,FM,5,"CO Mesa Grand Junction, Grand Mesa KB0YNA 449.65 OPEN On-Air"
149,"YNAdelta,uncompahgre butte",449.4,-,5,TSQL,131.8,131.8,23,23,NN,FM,5,"CO Mesa Delta, Uncompahgre Butte KB0YNA 449.4 OPEN On-Air"
150,"0STpueblo,pueblo",146.655,-,0.6,Tone,123,123,23,23,NN,FM,5,"CO Pueblo Pueblo, Pueblo K0ST 146.655 OPEN On-Air"
151,"0KRpueblo,pueblo",447.7,-,5,TSQL,210.7,210.7,23,23,NN,DIG,5,"CO Pueblo Pueblo, Pueblo KF0KR 447.7 PRIVATE Off-Air"
152,PWZpalmerdivide,449.725,-,5,Tone,100,100,23,23,NN,FM,5,CO El Paso Palmer Divide N0PWZ 449.725 OPEN On-Air
153,"5PXdixon,cerro abajo",147.18,+,0.6,TSQL,100,100,23,23,NN,FM,5,"NM Rio Arriba Dixon, Cerro Abajo KD5PX 147.18 OPEN On-Air"
154,LSDnathrop,146.745,-,0.6,Tone,100,100,23,23,NN,FM,5,CO Chaffee Nathrop W0LSD 146.745 OPEN Off-Air
155,"ITSlakecity, hill 71",147.135,-,0.6,Tone,123,123,23,23,NN,FM,5,"CO Hinsdale Lake City, Hill 71 KB5ITS 147.135 OPEN On-Air"
156,"ITSsilverton,kendall mountain",147.375,+,0.6,Tone,156.7,156.7,23,23,NN,FM,5,"CO San Juan Silverton, Kendall Mountain KB5ITS 147.375 OPEN On-Air"
157,"ITSignacio,spring creek",147.15,+,0.6,Tone,100,100,23,23,NN,FM,5,"CO La Plata Ignacio, Spring Creek KB5ITS 147.15 OPEN On-Air"
158,"ITSsilverton,buffalo boy",145.325,-,0.6,Tone,127.3,127.3,23,23,NN,FM,5,"CO San Juan Silverton, Buffalo Boy KB5ITS 145.325 OPEN On-Air"
159,"ITSsilverton,hazelton",444,+,5,Tone,67,67,23,23,NN,FM,5,"CO San Juan Silverton, Hazelton KB5ITS 444 OPEN On-Air"
160,ITSsilverton,447.525,-,5,Tone,127.3,127.3,23,23,NN,FM,5,CO San Juan Silverton KB5ITS 447.525 OPEN On-Air
161,"ITSouray,engineer mountain",147.27,+,0.6,Tone,127.3,127.3,23,23,NN,FM,5,"CO Ouray Ouray, Engineer Mountain KB5ITS 147.27 OPEN On-Air"
162,"ITSnavajodam, navajo lake",147.36,+,0.6,Tone,100,100,23,23,NN,FM,5,"NM San Juan Navajo Dam, Navajo Lake KB5ITS 147.36 OPEN On-Air"
163,"ITSdurango,smelter mountain",147.135,+,0.6,TSQL,100,100,23,23,NN,FM,5,"CO La Plata Durango, Smelter Mountain KB5ITS 147.135 OPEN On-Air"
164,"ITSbloomfield,harris mesa",147.1,+,0.6,Tone,100,100,23,23,NN,FM,5,"NM San Juan Bloomfield, Harris mesa KB5ITS 147.1 OPEN On-Air"
165,ITSaztec,447.45,-,5,Tone,107.2,107.2,23,23,NN,FM,5,NM San Juan Aztec KB5ITS 447.45 OPEN On-Air
166,"ITSaztec,tank mtn",146.88,-,0.6,Tone,100,100,23,23,NN,FM,5,"NM San Juan Aztec, Tank Mtn KB5ITS 146.88 OPEN On-Air"
167,"ITSmancos,caviness mountain",442.375,+,5,Tone,100,100,23,23,NN,FM,5,"CO Montezuma Mancos, Caviness Mountain KB5ITS 442.375 OPEN On-Air"
168,ITSbloomfield,448.65,-,5,Tone,127.3,127.3,23,23,NN,FM,5,NM San Juan Bloomfield KB5ITS 448.65 OPEN On-Air
169,"ITSmancos,menefee mountain",145.325,-,0.6,Tone,100,100,23,23,NN,FM,5,"CO Montezuma Mancos, Menefee Mountain KB5ITS 145.325 OPEN On-Air"
170,ITSfarmington,53.01,-,1,Tone,131.8,131.8,23,23,NN,FM,5,NM San Juan Farmington KB5ITS 53.01 OPEN On-Air
171,ITSfarmington,146.76,-,0.6,TSQL,100,100,23,23,NN,FM,5,NM San Juan Farmington KB5ITS 146.76 OPEN On-Air
172,ITSfarmington,147,+,0.6,Tone,100,100,23,23,NN,FM,5,NM San Juan Farmington KB5ITS 147 OPEN On-Air
173,"ITSdolores,summit ridge",145.19,-,0.6,Tone,100,100,23,23,NN,FM,5,"CO Montezuma Dolores, Summit Ridge KB5ITS 145.19 OPEN On-Air"
174,"ITSdolores,summit ridge",447.275,-,5,Tone,100,100,23,23,NN,FM,5,"CO Montezuma Dolores, Summit Ridge KB5ITS 447.275 OPEN On-Air"
175,"ITSlukachukai,roof butte",145.25,-,0.6,Tone,100,100,23,23,NN,FM,5,"AZ Apache Lukachukai, Roof Butte KB5ITS 145.25 OPEN On-Air"
176,"E0Zpueblo,csu",147,+,0.6,,88.5,88.5,23,23,NN,FM,5,"CO Pueblo Pueblo, CSU NE0Z 147 PRIVATE On-Air"
177,5GFgunnison,449.95,-,5,,88.5,88.5,23,23,NN,FM,5,CO Gunnison Gunnison K5GF 449.95 OPEN 
178,VTLgunnison,147.12,+,0.6,,88.5,88.5,23,23,NN,FM,5,CO Gunnison Gunnison W0VTL 147.12 OPEN On-Air
179,X0Gcripplecreek,147.015,+,0.6,Tone,107.2,107.2,23,23,NN,FM,5,CO Teller Cripple Creek NX0G 147.015 OPEN On-Air
180,X0Gcoloradosprings,447.475,-,5,Tone,107.2,107.2,23,23,NN,FM,5,CO El Paso Colorado Springs NX0G 447.475 OPEN 
181,"X0Glakegeorge, badger mountain",146.685,-,0.6,TSQL,107.2,107.2,23,23,NN,FM,5,"CO Park Lake George, Badger Mountain NX0G 146.685 OPEN On-Air"
182,X0Gwoodlandpark,146.82,-,0.6,Tone,107.2,107.2,23,23,NN,FM,5,CO Teller Woodland Park NX0G 146.82 OPEN On-Air
183,X0Gwoodlandpark,448.65,-,5,Tone,107.2,107.2,23,23,NN,FM,5,CO Teller Woodland Park NX0G 448.65 OPEN On-Air
184,SRJcoloradosprings,145.265,-,0.6,TSQL,100,100,23,23,NN,DIG,5,CO El Paso Colorado Springs KB0SRJ 145.265 OPEN Off-Air
185,"SRJcoloradosprings, uccs",448.8,-,5,TSQL,100,100,23,23,NN,DIG,5,"CO El Paso Colorado Springs, UCCS KB0SRJ 448.8 OPEN Off-Air"
186,"SRJcoloradosprings, pikes peak",146.97,-,0.6,Cross,100,123,23,23,NN,FM,5,"CO El Paso Colorado Springs, Pikes Peak KB0SRJ 146.97 OPEN On-Air"
187,"SRJcoloradosprings, pikes peak",448.45,-,5,Tone,100,100,23,23,NN,FM,5,"CO El Paso Colorado Springs, Pikes Peak KB0SRJ 448.45 OPEN On-Air"
188,SRJcoloradosprings,224.06,-,1.6,,88.5,88.5,23,23,NN,FM,5,CO El Paso Colorado Springs KB0SRJ 224.06 CLOSED 
189,"PFJcoloradosprings, almagre mountain",446.95,-,5,,88.5,88.5,23,23,NN,DIG,5,"CO Teller Colorado Springs, Almagre Mountain K7PFJ 446.95 OPEN On-Air"
190,"PFJgranby,mt chauncey",446.875,-,5,,88.5,88.5,23,23,NN,DIG,5,"CO Clear Creek Granby, Mt Chauncey K7PFJ 446.875 OPEN On-Air"
191,"0SPcoloradosprings, almagre mountain",147.18,+,0.6,Tone,100,100,23,23,NN,FM,5,"CO El Paso Colorado Springs, Almagre Mountain AA0SP 147.18 PRIVATE On-Air"
192,"CRAcoloradosprings, cheyenne mountain",145.16,-,0.6,TSQL,107.2,107.2,23,23,NN,FM,5,"CO El Paso Colorado Springs, Cheyenne Mountain W0CRA 145.16 OPEN On-Air"
193,"CRAlarkspur,westcreek",147.225,+,0.6,TSQL,107.2,107.2,23,23,NN,FM,5,"CO Douglas Larkspur, Westcreek W0CRA 147.225 OPEN On-Air"
194,"CRAlarkspur,westcreek",448.425,-,5,TSQL,107.2,107.2,23,23,NN,FM,5,"CO Douglas Larkspur, Westcreek W0CRA 448.425 OPEN On-Air"
195,"CRAconifer,conifer mountain",53.05,-,1.7,TSQL,107.2,107.2,23,23,NN,FM,5,"CO Jefferson Conifer, Conifer Mountain W0CRA 53.05 OPEN Off-Air"
196,"CRAconifer,conifer mountain",1287.9,-,20,,88.5,88.5,23,23,NN,FM,5,"CO Jefferson Conifer, Conifer Mountain W0CRA 1287.9 OPEN Off-Air"
197,"CRAconifer,conifer mountain",224.98,-,1.6,TSQL,107.2,107.2,23,23,NN,FM,5,"CO Jefferson Conifer, Conifer Mountain W0CRA 224.98 OPEN Off-Air"
198,"CRAconifer,conifer mountain",447.15,-,5,TSQL,107.2,107.2,23,23,NN,FM,5,"CO Jefferson Conifer, Conifer Mountain W0CRA 447.15 OPEN Off-Air"
199,"CRAidahosprings, squaw mountain",145.145,-,0.6,TSQL,107.2,107.2,23,23,NN,FM,5,"CO Clear Creek Idaho Springs, Squaw Mountain W0CRA 145.145 OPEN On-Air"
