Location,Name,Frequency,Duplex,Offset,Tone,rToneFreq,cToneFreq,DtcsCode,DtcsRxCode,DtcsPolarity,Mode,TStep,Comment
200,"CRAidahosprings, squaw mountain",447.575,-,5,TSQL,107.2,107.2,23,23,NN,FM,5,"CO Clear Creek Idaho Springs, Squaw Mountain W0CRA 447.575 OPEN On-Air"
201,"CRAboulder,eldorado mountain",145.46,-,0.6,TSQL,107.2,107.2,23,23,NN,FM,5,"CO Boulder Boulder, Eldorado Mountain W0CRA 145.46 OPEN On-Air"
202,"CRAboulder,eldorado mountain",447.975,-,5,TSQL,107.2,107.2,23,23,NN,FM,5,"CO Boulder Boulder, Eldorado Mountain W0CRA 447.975 OPEN On-Air"
203,"0EPdurango,missionary ridge",146.7,-,0.6,TSQL,100,100,23,23,NN,FM,5,"CO La Plata Durango, Missionary Ridge K0EP 146.7 OPEN On-Air"
204,0EPdurango,449.85,-,5,TSQL,100,100,23,23,NN,FM,5,CO La Plata Durango K0EP 449.85 OPEN On-Air
205,"0EPdurango,eagle pass",146.67,-,0.6,Tone,100,100,23,23,NN,FM,5,"CO La Plata Durango, Eagle Pass K0EP 146.67 OPEN On-Air"
206,"TTFcoloradosprings, fillmore hill",448.725,-,5,Tone,123,123,23,23,NN,FM,5,"CO El Paso Colorado Springs, Fillmore Hill KA0TTF 448.725 OPEN On-Air"
207,"ITTsilverton,engineer mountain",147.27,+,0.6,Tone,127.3,127.3,23,23,NN,FM,5,"CO San Juan Silverton, Engineer Mountain KB5ITT 147.27 OPEN On-Air"
208,lakegeorge,449.7,-,5,Tone,107.2,107.2,23,23,NN,FM,5,CO Park Lake George  449.7 OPEN 
209,coloradosprings,449.575,-,5,,88.5,88.5,23,23,NN,FM,5,CO El Paso Colorado Springs  449.575 CLOSED On-Air
210,coloradosprings,147.27,+,0.6,,88.5,88.5,23,23,NN,FM,5,CO El Paso Colorado Springs  147.27 OPEN On-Air
211,falcon,447.2,-,5,Tone,151.4,151.4,23,23,NN,DIG,5,CO El Paso Falcon  447.2 OPEN Testing
212,santafe,145.19,-,0.6,Tone,162.2,162.2,23,23,NN,FM,5,NM Bernalillo Santa Fe  145.19 OPEN On-Air
213,"cedaredge,grand mesa",447.35,-,5,Tone,107.2,107.2,23,23,NN,FM,5,"CO Delta Cedaredge, Grand Mesa  447.35 OPEN "
214,boisecity,147.35,+,0.6,TSQL,88.5,88.5,23,23,NN,FM,5,OK Cimarron Boise City  147.35 OPEN On-Air
215,MOGcoloradosprings,448.6,-,5,Tone,114.8,114.8,23,23,NN,FM,5,CO El Paso Colorado Springs W0MOG 448.6 OPEN 
216,MOGcoloradosprings,927.8,-,25,DTCS,88.5,88.5,116,116,NN,FM,5,CO Teller Colorado Springs W0MOG 927.8 OPEN On-Air
217,MOGcoloradosprings,147.39,+,0.6,Tone,103.5,103.5,23,23,NN,FM,5,CO El Paso Colorado Springs W0MOG 147.39 OPEN On-Air
218,MOGcoloradosprings,224.72,-,1.6,TSQL,103.5,103.5,23,23,NN,FM,5,CO El Paso Colorado springs W0MOG 224.72 OPEN On-Air
219,A0Lcoloradosprings,448.3,-,5,Tone,100,100,23,23,NN,FM,5,CO El Paso Colorado Springs AA0L 448.3 OPEN On-Air
220,A0Lcoloradosprings,147.135,+,0.6,Tone,100,100,23,23,NN,FM,5,CO El Paso Colorado Springs AA0L 147.135 OPEN On-Air
221,IRPcoloradosprings,447.35,-,5,Tone,151.4,151.4,23,23,NN,FM,5,CO El Paso Colorado Springs K0IRP 447.35 OPEN On-Air
222,IRPcoloradosprings,146.91,-,0.6,TSQL,151.4,151.4,23,23,NN,FM,5,CO El Paso Colorado Springs K0IRP 146.91 OPEN On-Air
223,0WFcoloradosprings,447.025,-,5,Tone,123,123,23,23,NN,FM,5,CO El Paso Colorado Springs KF0WF 447.025 OPEN Off-Air
224,"0KGcoloradosprings, broadmoor area",448.25,-,5,Tone,123,123,23,23,NN,FM,5,"CO El Paso Colorado Springs, Broadmoor Area N0KG 448.25 OPEN Off-Air"
225,RSHcoloradosprings,146.85,-,0.6,Tone,103.5,103.5,23,23,NN,FM,5,CO El Paso Colorado Springs W0RSH 146.85 OPEN On-Air
226,"PDOlosalamos, barranca mesa",146.88,-,0.6,,88.5,88.5,23,23,NN,FM,5,"NM Los Alamos Los Alamos, Barranca Mesa W5PDO 146.88 OPEN On-Air"
227,EVEdurango,448.625,-,5,TSQL,131.8,131.8,23,23,NN,FM,5,CO La Plata Durango KC5EVE 448.625 OPEN On-Air
228,BIWlosalamos,224.04,-,1.6,TSQL,100,100,23,23,NN,FM,5,NM Los Alamos Los Alamos KA5BIW 224.04 OPEN On-Air
229,BIWlosalamos,442,+,5,Tone,100,100,23,23,NN,FM,5,NM Los Alamos Los Alamos KA5BIW 442 OPEN On-Air
230,CMSlosalamos,444.775,+,5,Tone,131.8,131.8,23,23,NN,DIG,5,NM Los Alamos Los Alamos WD9CMS 444.775 OPEN On-Air
231,CMSlosalamos,927.9,-,25,Tone,131.8,131.8,23,23,NN,DIG,5,NM Los Alamos Los Alamos WD9CMS 927.9 OPEN On-Air
232,5WRlosalamos,442.425,+,5,,88.5,88.5,23,23,NN,DIG,5,NM Los Alamos Los Alamos NM5WR 442.425 OPEN On-Air
233,HSOlosalamos,144.265,,0,Tone,203.5,203.5,23,23,NN,FM,5,NM Los Alamos Los Alamos KC2HSO 144.265 OPEN On-Air
234,AVNlosalamos,442.925,+,5,,88.5,88.5,23,23,NN,DIG,5,NM Los Alamos Los Alamos KE8AVN 442.925 OPEN On-Air
235,5BBlosalamos,442.25,+,5,,88.5,88.5,23,23,NN,DIG,5,NM Los Alamos Los Alamos NM5BB 442.25 OPEN Off-Air
236,"5RXlosalamos, pajarito mountain",223.94,-,1.6,,88.5,88.5,23,23,NN,FM,5,"NM Los Alamos Los Alamos, Pajarito Mountain KB5RX 223.94 OPEN On-Air"
237,WUCwoodlandpark,145.415,-,0.6,Tone,179.9,179.9,23,23,NN,FM,5,CO Teller Woodland Park KA0WUC 145.415 OPEN 
238,WUCwoodlandpark,447.675,-,5,TSQL,179.9,179.9,23,23,NN,FM,5,CO Teller Woodland Park KA0WUC 447.675 OPEN On-Air
239,WUCwoodlandpark,449.025,-,5,Tone,141.3,141.3,23,23,NN,FM,5,CO Teller Woodland Park KA0WUC 449.025 OPEN 
240,WUCwoodlandpark,927.9,-,25,DTCS,88.5,88.5,205,205,NN,FM,5,CO Teller Woodland Park KA0WUC 927.9 OPEN On-Air
241,"EPSwoodlandpark, paradise pines",449.325,-,5,TSQL,103.5,103.5,23,23,NN,FM,5,"CO Teller Woodland Park, Paradise Pines KA4EPS 449.325 OPEN On-Air"
242,"ZQEsantafe, tesuque peak",442.825,+,5,Tone,131.8,131.8,23,23,NN,FM,5,"NM Santa Fe Santa Fe, Tesuque Peak KB5ZQE 442.825 OPEN On-Air"
243,"HNDmontrose,waterdog peak",447.2,-,5,TSQL,107.2,107.2,23,23,NN,FM,5,"CO Montrose Montrose, Waterdog Peak WA4HND 447.2 OPEN On-Air"
244,"HNDglenwoodsprings, lookout mountain",449.85,-,5,TSQL,131.8,131.8,23,23,NN,FM,5,"CO Garfield Glenwood Springs, Lookout Mountain WA4HND 449.85 OPEN On-Air"
245,"HNDgrandjunction, grand mesa",449.3,-,5,TSQL,107.2,107.2,23,23,NN,FM,5,"CO Mesa Grand Junction, Grand Mesa WA4HND 449.3 OPEN On-Air"
246,"HNDparachute,mount callahan",449.8,-,5,Tone,107.2,107.2,23,23,NN,FM,5,"CO Garfield Parachute, Mount Callahan WA4HND 449.8 OPEN On-Air"
247,"HNDgrandjunction, black ridge",449.575,-,5,TSQL,131.8,131.8,23,23,NN,FM,5,"CO Mesa Grand Junction, Black Ridge WA4HND 449.575 OPEN On-Air"
248,5HOlacueva,145.41,-,0.6,Tone,100,100,23,23,NN,FM,5,NM Santa Fe La Cueva W5HO 145.41 OPEN Off-Air
249,VIUhesperus,145.37,-,0.6,TSQL,100,100,23,23,NN,FM,5,CO La Plata Hesperus KB0VIU 145.37 OPEN On-Air
250,JNIwagonmound,444.4,+,5,Tone,100,100,23,23,NN,FM,5,NM Mora Wagon Mound N7JNI 444.4 OPEN Off-Air
251,"VBDbloomfield,harris mesa",1292.3,-,20,,88.5,88.5,23,23,NN,DIG,5,"NM San Juan Bloomfield, Harris Mesa KF5VBD 1292.3 CLOSED On-Air"
252,"UFOfairplay,sacramento mountain",447.125,-,5,TSQL,103.5,103.5,23,23,NN,FM,5,"CO Park Fairplay, Sacramento Mountain KC0UFO 447.125 OPEN On-Air"
253,BOPdesmoines,146.85,-,0.6,Tone,100,100,23,23,NN,FM,5,NM Union Des Moines N5BOP 146.85 OPEN Off-Air
254,BOPdesmoines,444.8,+,5,Tone,77,77,23,23,NN,FM,5,NM Union Des Moines N5BOP 444.8 OPEN Off-Air
255,"0NRmonument,monument hill",447.725,-,5,TSQL,100,100,23,23,NN,FM,5,"CO El Paso Monument, Monument Hill K0NR 447.725 OPEN On-Air"
256,UBJaztec,442.25,+,5,,88.5,88.5,23,23,NN,DIG,5,NM San Juan Aztec N5UBJ 442.25 OPEN On-Air
257,"UBJmancos,caviness mountain",446.7375,-,5,,88.5,88.5,23,23,NN,DIG,5,"CO Montezuma Mancos, Caviness Mountain N5UBJ 446.7375 OPEN On-Air"
258,UBJfarmington,442.325,+,5,,88.5,88.5,23,23,NN,DIG,5,NM San Juan Farmington N5UBJ 442.325 OPEN On-Air
259,GAJsantafe,449.275,-,5,Tone,146.2,146.2,23,23,NN,FM,5,NM Santa Fe Santa Fe K9GAJ 449.275 OPEN On-Air
260,VBEaztec,1291.1,-,20,,88.5,88.5,23,23,NN,DIG,5,NM Bernalillo Aztec KF5VBE 1291.1 CLOSED On-Air
261,VBEfarmington,145.115,-,0.6,,88.5,88.5,23,23,NN,DIG,5,NM San Juan Farmington KF5VBE 145.115 OPEN On-Air
262,SGTsantafe,447.775,-,5,Tone,100,100,23,23,NN,FM,5,NM Santa Fe Santa Fe KF5SGT 447.775 OPEN On-Air
263,"XLFpalmerlake, monument hill",145.19,-,0.6,TSQL,131.8,131.8,23,23,NN,FM,5,"CO Douglas Palmer Lake, Monument Hill N0XLF 145.19 OPEN On-Air"
264,WXIbloomfield,146.92,-,0.6,Tone,100,100,23,23,NN,FM,5,NM San Juan Bloomfield K5WXI 146.92 OPEN On-Air
265,WXIfarmington,146.85,-,0.6,TSQL,100,100,23,23,NN,FM,5,NM San Juan Farmington K5WXI 146.85 OPEN On-Air
266,"MDPfalcon,black forest",447.625,-,5,TSQL,100,100,23,23,NN,FM,5,"CO El Paso Falcon, Black Forest KD0MDP 447.625 OPEN On-Air"
267,"0VQaspen,aspen mountain",447.05,-,5,TSQL,136.5,136.5,23,23,NN,FM,5,"CO Pitkin Aspen, Aspen Mountain K0VQ 447.05 OPEN On-Air"
268,"0VQcarbondale,missouri heights",447.15,-,5,Tone,136.5,136.5,23,23,NN,FM,5,"CO Garfield Carbondale, Missouri Heights K0VQ 447.15 OPEN On-Air"
269,"0VQglenwoodsprings, three mile ridge",147.3,+,0.6,Tone,107.2,107.2,23,23,NN,FM,5,"CO Garfield Glenwood Springs, Three Mile Ridge K0VQ 147.3 OPEN Off-Air"
270,UUXmontrose,146.91,-,0.6,TSQL,107.2,107.2,23,23,NN,FM,5,CO Montrose Montrose KC0UUX 146.91 OPEN On-Air
271,OPDmontrose,146.79,-,0.6,TSQL,107.2,107.2,23,23,NN,FM,5,CO Montrose Montrose KD5OPD 146.79 OPEN On-Air
272,PGQlacueva,53.2,-,1,Tone,107.2,107.2,23,23,NN,FM,5,NM Santa Fe La Cueva N9PGQ 53.2 OPEN Off-Air
273,PGQlacueva,146.84,-,0.6,Tone,107.2,107.2,23,23,NN,FM,5,NM Santa Fe La Cueva N9PGQ 146.84 OPEN 
274,PGQlacueva,442.125,+,5,Tone,107.2,107.2,23,23,NN,FM,5,NM Santa Fe La Cueva N9PGQ 442.125 OPEN 
275,"ESQcastlerock, devils head",446.925,-,5,,88.5,88.5,23,23,NN,DIG,5,"CO Douglas Castle Rock, Devils Head N0ESQ 446.925 OPEN On-Air"
276,"ESQcastlerock, devils head (pike national forest)",447.525,-,5,TSQL,146.2,146.2,23,23,NN,FM,5,"CO Douglas Castle Rock, Devils Head (Pike National Forest) N0ESQ 447.525 OPEN On-Air"
277,"ESQparker,hess reservoir",447.525,-,5,Cross,203.5,146.2,23,23,NN,FM,5,"CO Douglas Parker, Hess Reservoir N0ESQ 447.525 OPEN On-Air"
278,"ITFlajunta, north la junta",147.36,+,0.6,Cross,88.5,123,23,23,NN,DIG,5,"CO Otero La Junta, North La Junta KC0ITF 147.36 PRIVATE On-Air"
279,"ITFlajunta, north la junta",446.75,-,5,,88.5,88.5,23,23,NN,DIG,5,"CO Otero La Junta, North La Junta KC0ITF 446.75 PRIVATE On-Air"
280,0CLsnowmassvillage,146.67,-,0.6,Tone,107.2,107.2,23,23,NN,FM,5,CO Pitkin Snowmass Village K0CL 146.67 OPEN On-Air
281,"5SCsanysidro, pajarito peak",443.1,+,5,Tone,100,100,23,23,NN,FM,5,"NM Sandoval San Ysidro, Pajarito Peak NM5SC 443.1 OPEN On-Air"
282,"5SCplacitas,la madera",147.08,+,0.6,Tone,100,100,23,23,NN,FM,5,"NM Sandoval Placitas, La Madera NM5SC 147.08 OPEN On-Air"
283,WEZlasvegas,145.45,-,0.6,,88.5,88.5,23,23,NN,FM,5,NM San Miguel Las Vegas KB5WEZ 145.45 OPEN Off-Air
284,0MRpaonia,147.33,+,0.6,Tone,107.2,107.2,23,23,NN,FM,5,CO Delta Paonia KI0MR 147.33 OPEN On-Air
285,"0PCbailey,dick mountain",146.895,-,0.6,TSQL,100,100,23,23,NN,FM,5,"CO Park Bailey, Dick Mountain AB0PC 146.895 OPEN On-Air"
286,VBFfarmington,444.15,+,5,,88.5,88.5,23,23,NN,DIG,5,NM San Juan Farmington KF5VBF 444.15 OPEN On-Air
287,"VBFfarmington,farmington bluffs",1291.7,-,20,,88.5,88.5,23,23,NN,DIG,5,"NM San Juan Farmington, Farmington Bluffs KF5VBF 1291.7 CLOSED On-Air"
288,5WYfarmington,449,-,5,Tone,100,100,23,23,NN,FM,5,NM San Juan Farmington K5WY 449 OPEN 
289,QMRbreckenridge,146.7,-,0.6,Tone,107.2,107.2,23,23,NN,FM,5,CO Summit Breckenridge WB0QMR 146.7 OPEN On-Air
290,"OWYconifer,critchell mountain",447.5,-,5,TSQL,88.5,88.5,23,23,NN,FM,5,"CO Jefferson Conifer, Critchell Mountain N0OWY 447.5 OPEN On-Air"
291,"ARAcritchell,critchell mountain",147.12,+,0.6,TSQL,88.5,88.5,23,23,NN,FM,5,"CO Jefferson Critchell, Critchell Mountain N0ARA 147.12 OPEN On-Air"
292,"YEJsanluis, cabezon",443,+,5,Tone,100,100,23,23,NN,FM,5,"NM Sandoval San Luis, Cabezon K5YEJ 443 OPEN On-Air"
293,"TUBcentennial,warren mountain",146.88,-,0.6,Tone,100,100,23,23,NN,FM,5,"CO Jefferson Centennial, Warren Mountain WB0TUB 146.88 OPEN On-Air"
294,"TUBcentennial,warren mountain",449.6,-,5,Tone,100,100,23,23,NN,FM,5,"CO Jefferson Centennial, Warren Mountain WB0TUB 449.6 OPEN On-Air"
295,"TUBgolden,centennial cone",146.64,-,0.6,Tone,100,100,23,23,NN,FM,5,"CO Jefferson Golden, Centennial Cone WB0TUB 146.64 OPEN On-Air"
296,"IHLlasvegas, mesa apache",444.375,+,5,Tone,100,100,23,23,NN,FM,5,"NM San Miguel Las Vegas, Mesa Apache WA5IHL 444.375 CLOSED On-Air"
297,"IHLalbuquerque,sandia mnts",145.29,-,0.6,Tone,100,100,23,23,NN,FM,5,"NM Bernalillo Albuquerque, Sandia Mnts WA5IHL 145.29 OPEN On-Air"
298,IHLalbuquerque,442.25,+,5,,88.5,88.5,23,23,NN,DIG,5,NM Bernalillo Albuquerque WA5IHL 442.25 OPEN On-Air
299,PRAfranktown,446.85,-,5,,88.5,88.5,23,23,NN,DIG,5,CO Douglas Franktown K0PRA 446.85 OPEN On-Air
300,PRAparker,445.075,-,5,,88.5,88.5,23,23,NN,DIG,5,CO Douglas Parker K0PRA 445.075 OPEN On-Air
301,"9SLcastlepines, daniels park",449.95,-,5,TSQL,77,77,23,23,NN,FM,5,"CO Douglas Castle Pines, Daniels Park W9SL 449.95 OPEN On-Air"
302,"LWUcortez,downtown",146.79,-,0.6,TSQL,127.3,127.3,23,23,NN,FM,5,"CO Montezuma Cortez, Downtown KD5LWU 146.79 OPEN On-Air"
303,LWUcortez,449.175,-,5,Tone,127.3,127.3,23,23,NN,FM,5,CO Montezuma Cortez KD5LWU 449.175 OPEN Off-Air
304,ALCcedaredge,147.36,+,0.6,Tone,100,100,23,23,NN,FM,5,CO Delta Cedaredge W0ALC 147.36 OPEN 
305,ALCcedaredge,449.825,-,5,Tone,100,100,23,23,NN,FM,5,CO Delta Cedaredge W0ALC 449.825 OPEN 
306,"QXXcedaredge,cedar mesa",147.195,+,0.6,Tone,107.2,107.2,23,23,NN,FM,5,"CO Delta Cedaredge, Cedar Mesa KC0QXX 147.195 OPEN "
307,"0RVvail,bald mountain",146.61,-,0.6,Tone,107.2,107.2,23,23,NN,FM,5,"CO Eagle Vail, Bald Mountain K0RV 146.61 OPEN On-Air"
308,"AKWplacitas,sandia peak",443.4,+,5,Tone,100,100,23,23,NN,FM,5,"NM Sandoval Placitas, Sandia Peak K5AKW 443.4 OPEN On-Air"
309,FSXpunkincenter,449.9,-,5,Tone,107.2,107.2,23,23,NN,FM,5,CO Lincoln Punkin Center N1FSX 449.9 OPEN On-Air
310,AFOvail,224.8,-,1.6,,88.5,88.5,23,23,NN,FM,5,CO Eagle Vail N0AFO 224.8 OPEN Off-Air
311,AFOvail,449.9,-,5,TSQL,107.2,107.2,23,23,NN,FM,5,CO Eagle Vail N0AFO 449.9 OPEN Off-Air
312,GUQevergreen,145.34,-,0.6,Cross,103.5,127.3,23,23,NN,FM,5,CO Jefferson Evergreen KE4GUQ 145.34 OPEN On-Air
313,"AENidahosprings, squaw mountain",449,-,5,TSQL,136.5,136.5,23,23,NN,FM,5,"CO Clear Creek Idaho Springs, Squaw Mountain WR0AEN 449 OPEN On-Air"
314,AENdenver,449.65,-,5,Tone,136.5,136.5,23,23,NN,DIG,5,CO Denver Denver WR0AEN 449.65 OPEN On-Air
315,AENdenver,449.675,-,5,Tone,136.5,136.5,23,23,NN,DIG,5,CO Denver Denver WR0AEN 449.675 OPEN On-Air
316,AENaurora,449.15,-,5,Tone,136.5,136.5,23,23,NN,DIG,5,CO Arapahoe Aurora WR0AEN 449.15 OPEN On-Air
317,"CFIidahosprings, squaw mountain",448.675,-,5,TSQL,100,100,23,23,NN,FM,5,"CO Denver Idaho Springs, Squaw Mountain W0CFI 448.675 OPEN On-Air"
318,"PYYevergreen,squaw mountain",147.3,+,0.6,TSQL,103.5,103.5,23,23,NN,FM,5,"CO Clear Creek Evergreen, Squaw Mountain N0PYY 147.3 OPEN On-Air"
319,PYYgolden,448.125,-,5,Tone,107.2,107.2,23,23,NN,FM,5,CO Jefferson Golden N0PYY 448.125 OPEN On-Air
320,PYYgolden,927.7875,-,25,Tone,156.7,156.7,23,23,NN,FM,5,CO Jefferson Golden N0PYY 927.7875 OPEN On-Air
321,"DUNidahosprings, squaw mountain",449.45,-,5,Cross,103.5,127.3,23,23,NN,FM,5,"CO Clear Creek Idaho Springs, Squaw Mountain K1DUN 449.45 OPEN On-Air"
322,"0TXidahosprings, centennial cone",145.49,-,0.6,TSQL,100,100,23,23,NN,FM,5,"CO Jefferson Idaho Springs, Centennial Cone W0TX 145.49 OPEN On-Air"
323,"0TXidahosprings, squaw mountain",449.35,-,5,TSQL,100,100,23,23,NN,FM,5,"CO Clear Creek Idaho Springs, Squaw Mountain W0TX 449.35 OPEN On-Air"
324,"0TXlakewood,green mountain",147.33,+,0.6,Tone,100,100,23,23,NN,FM,5,"CO Jefferson Lakewood, Green Mountain W0TX 147.33 OPEN On-Air"
325,"0TXlakewood,green mountain",224.38,-,1.6,TSQL,100,100,23,23,NN,FM,5,"CO Jefferson Lakewood, Green Mountain W0TX 224.38 OPEN On-Air"
326,"0TXlakewood,green mtn",449.775,-,5,TSQL,100,100,23,23,NN,DIG,5,"CO Jefferson Lakewood, Green Mtn W0TX 449.775 OPEN On-Air"
327,"0TXlakewood,green mountain",53.09,-,1.7,Tone,107.2,107.2,23,23,NN,FM,5,"CO Jefferson Lakewood, Green Mountain W0TX 53.09 OPEN On-Air"
328,"0TXgolden,centennial cone",448.625,-,5,TSQL,100,100,23,23,NN,FM,5,"CO Jefferson Golden, Centennial Cone W0TX 448.625 OPEN On-Air"
329,"0TXlakewood,st anthony medical campus",447.825,-,5,DTCS,88.5,88.5,73,73,NN,NFM,5,"CO Jefferson Lakewood, St Anthony Medical Campus W0TX 447.825 OPEN On-Air"
330,"0TXdenver,centennial cone",446.7875,-,5,,88.5,88.5,23,23,NN,DIG,5,"CO Jefferson Denver, Centennial Cone W0TX 446.7875 OPEN On-Air"
331,"UDDidahosprings, squaw mountain",146.67,-,0.6,TSQL,100,100,23,23,NN,FM,5,"CO Clear Creek Idaho Springs, Squaw Mountain KB0UDD 146.67 OPEN On-Air"
332,"UDDaurora,smoky hill",145.4,-,0.8,Tone,100,100,23,23,NN,FM,5,"CO Arapahoe Aurora, Smoky Hill KB0UDD 145.4 OPEN On-Air"
333,"UDDaurora,smokey hill",448.5,-,5,Tone,100,100,23,23,NN,FM,5,"CO Denver Aurora, Smokey Hill KB0UDD 448.5 OPEN On-Air"
334,"WYXidahosprings, squaw mountain",146.94,-,0.6,TSQL,103.5,103.5,23,23,NN,FM,5,"CO Clear Creek Idaho Springs, Squaw Mountain W0WYX 146.94 OPEN On-Air"
335,WYXbroomfield,449.825,-,5,Tone,103.5,103.5,23,23,NN,FM,5,CO Boulder Broomfield W0WYX 449.825 OPEN On-Air
336,"ELKcarbondale,four mile ridge",449.725,-,5,Tone,179.9,179.9,23,23,NN,FM,5,"CO Garfield Carbondale, Four Mile Ridge K0ELK 449.725 OPEN On-Air"
337,"SNOcarbondale,four mile ridge",147.39,+,0.6,Tone,107.2,107.2,23,23,NN,FM,5,"CO Garfield Carbondale, Four Mile Ridge K0SNO 147.39 OPEN On-Air"
338,0DEsimla,147.105,+,0.6,TSQL,107.2,107.2,23,23,NN,FM,5,CO Elbert Simla WA0DE 147.105 OPEN On-Air
339,Q8Mparker,448.7,-,5,Tone,146.2,146.2,23,23,NN,FM,5,CO Douglas Parker WQ8M 448.7 OPEN On-Air
340,"LXXmorrison,mt. morrison",53.17,-,1.7,Tone,107.2,107.2,23,23,NN,FM,5,"CO Jefferson Morrison, Mt. Morrison N6LXX 53.17 OPEN On-Air"
341,"LXXmorrison,mt. morrison",447.875,-,5,TSQL,107.2,107.2,23,23,NN,FM,5,"CO Jefferson Morrison, Mt. Morrison N6LXX 447.875 OPEN On-Air"
342,"0KQevergreen,saddleback mountain",447.85,-,5,TSQL,141.3,141.3,23,23,NN,FM,5,"CO Clear Creek Evergreen, Saddleback Mountain AC0KQ 447.85 OPEN On-Air"
343,OLDriorancho,442.35,+,5,Tone,100,100,23,23,NN,FM,5,NM Sandoval Rio Rancho WA5OLD 442.35 OPEN On-Air
344,"I0Gglenwoodsprings, sunlight peak",146.88,-,0.6,Tone,107.2,107.2,23,23,NN,FM,5,"CO Garfield Glenwood Springs, Sunlight Peak KI0G 146.88 OPEN On-Air"
345,"I0Gglenwoodsprings, sunlight peak",447.1,-,5,Tone,107.2,107.2,23,23,NN,FM,5,"CO Garfield Glenwood Springs, Sunlight Peak KI0G 447.1 OPEN On-Air"
346,I0Gglenwoodsprings,224.02,-,1.6,,88.5,88.5,23,23,NN,FM,5,CO Garfield Glenwood Springs KI0G 224.02 CLOSED 
347,I0Gglenwoodsprings,447.6,-,5,,88.5,88.5,23,23,NN,FM,5,CO Garfield Glenwood Springs KI0G 447.6 CLOSED 
348,"XLIglenwoodsprings, sunlight peak",449.6,-,5,Tone,107.2,107.2,23,23,NN,FM,5,"CO Garfield Glenwood Springs, Sunlight Peak N0XLI 449.6 OPEN On-Air"
349,"G0Nidahosprings, squaw mountain",449.05,-,5,TSQL,107.2,107.2,23,23,NN,FM,5,"CO Denver Idaho Springs, Squaw Mountain WG0N 449.05 OPEN On-Air"
350,"CCBalbuquerque,sandia peak",443.75,+,5,Tone,100,100,23,23,NN,FM,5,"NM Bernalillo Albuquerque, Sandia Peak WA6CCB 443.75 CLOSED Off-Air"
351,"KREalbuquerque,sandia crest",443.3,+,5,,88.5,88.5,23,23,NN,DIG,5,"NM Bernalillo Albuquerque, Sandia Crest K5KRE 443.3 OPEN Testing"
352,"IUZalbuquerque,sandia crest",51.7,-,1,Tone,156.7,156.7,23,23,NN,FM,5,"NM Bernalillo Albuquerque, Sandia Crest WB5IUZ 51.7 OPEN Off-Air"
353,IPKriorancho,442.75,+,5,Tone,162.2,162.2,23,23,NN,FM,5,NM Sandoval Rio Rancho KC5IPK 442.75 OPEN On-Air
354,"IPKalbuquerque,sandia crest",442.75,+,5,Tone,162.2,162.2,23,23,NN,FM,5,"NM Bernalillo Albuquerque, Sandia Crest KC5IPK 442.75 OPEN On-Air"
355,"5RRriorancho, rainbow",147.1,+,0.6,TSQL,100,100,23,23,NN,FM,5,"NM Sandoval Rio Rancho, Rainbow NM5RR 147.1 OPEN On-Air"
356,"5RRriorancho, rainbow",443,+,5,Tone,100,100,23,23,NN,FM,5,"NM Sandoval Rio Rancho, Rainbow NM5RR 443 OPEN On-Air"
357,"JMWalbuquerque,sandia crest",442.9,+,5,,88.5,88.5,23,23,NN,DIG,5,"NM Bernalillo Albuquerque, Sandia Crest KA8JMW 442.9 OPEN On-Air"
358,0HCparker,927.8375,-,25.8,Tone,100,100,23,23,NN,DIG,5,CO Douglas Parker KI0HC 927.8375 OPEN On-Air
359,"0HCgolden,centennial cone",927.8375,-,25.8,DTCS,88.5,88.5,205,205,NN,DIG,5,"CO Jefferson Golden, Centennial Cone KI0HC 927.8375 OPEN On-Air"
360,"MPZalbuquerque,sandia crest",443.8,+,5,,88.5,88.5,23,23,NN,DIG,5,"NM Bernalillo Albuquerque, Sandia Crest W5MPZ 443.8 OPEN On-Air"
361,"CSYalbuquerque,sandia crest",145.33,-,0.6,Tone,100,100,23,23,NN,FM,5,"NM Bernalillo Albuquerque, Sandia Crest W5CSY 145.33 OPEN On-Air"
362,"CSYalbuquerque,sandia crest",444,+,5,Tone,100,100,23,23,NN,FM,5,"NM Bernalillo Albuquerque, Sandia Crest W5CSY 444 OPEN On-Air"
363,"FSBalbuquerque,sandia peak",442.6,+,5,Tone,100,100,23,23,NN,FM,5,"NM Bernalillo Albuquerque, Sandia Peak K5FSB 442.6 OPEN On-Air"
364,"GASalbuquerque,sandia crest",442.1,+,5,Tone,162.2,162.2,23,23,NN,FM,5,"NM Bernalillo Albuquerque, Sandia Crest KB5GAS 442.1 OPEN On-Air"
365,ELYlakewood,448.75,-,5,TSQL,100,100,23,23,NN,FM,5,CO Jefferson Lakewood N0ELY 448.75 OPEN On-Air
366,5QDcorrales,443.2,+,5,,88.5,88.5,23,23,NN,DIG,5,NM Sandoval Corrales N5QD 443.2 OPEN On-Air
367,"CDSgolden,lookout mountain",1283.9625,-,20,,88.5,88.5,23,23,NN,DIG,5,"CO Jefferson Golden, Lookout Mountain W0CDS 1283.9625 OPEN On-Air"
368,"CDSgolden,lookout mountain",1299.9,,0,,88.5,88.5,23,23,NN,DIG,5,"CO Jefferson Golden, Lookout Mountain W0CDS 1299.9 OPEN On-Air"
369,"CDSgolden,lookout mountain",145.25,-,0.6,,88.5,88.5,23,23,NN,DIG,5,"CO Jefferson Golden, Lookout Mountain W0CDS 145.25 OPEN On-Air"
370,"CDSgolden,lookout mountain",446.9625,-,5,,88.5,88.5,23,23,NN,DIG,5,"CO Jefferson Golden, Lookout Mountain W0CDS 446.9625 OPEN On-Air"
371,"YZTgolden,lookout",446.8375,-,5,,88.5,88.5,23,23,NN,DIG,5,"CO Jefferson Golden, Lookout WA2YZT 446.8375 OPEN On-Air"
372,"0SJgolden,centennial cone",145.28,-,0.6,Tone,100,100,23,23,NN,FM,5,"CO Jefferson Golden, Centennial Cone KE0SJ 145.28 OPEN On-Air"
373,"0SJgolden,centennial cone",449.525,-,5,,88.5,88.5,23,23,NN,FM,5,"CO Jefferson Golden, Centennial Cone KE0SJ 449.525 OPEN On-Air"
374,"0SJboulder,blue mountain",145.475,-,0.6,Tone,100,100,23,23,NN,FM,5,"CO Jefferson Boulder, Blue Mountain KE0SJ 145.475 OPEN On-Air"
375,0SJlochbuie,447.625,-,5,Tone,100,100,23,23,NN,FM,5,CO Adams Lochbuie KE0SJ 447.625 OPEN On-Air
376,"FEZgolden,centennial cone",146.985,-,0.6,TSQL,100,100,23,23,NN,FM,5,"CO Denver Golden, Centennial Cone K0FEZ 146.985 OPEN On-Air"
377,FEZdenver,447.925,-,5,TSQL,100,100,23,23,NN,FM,5,CO Denver Denver K0FEZ 447.925 OPEN On-Air
378,"0KUgolden,lookout mountain",449.625,-,5,TSQL,141.3,141.3,23,23,NN,FM,5,"CO Jefferson Golden, Lookout Mountain W0KU 449.625 OPEN On-Air"
379,"SLGriorancho, nm 528 and corrales rd",442.4,+,5,,88.5,88.5,23,23,NN,DIG,5,"NM Sandoval Rio Rancho, NM 528 and Corrales Rd KG5SLG 442.4 OPEN On-Air"
380,PWOcentennial,449.425,-,5,DTCS,88.5,88.5,23,23,NN,FM,5,CO Arapahoe Centennial K0PWO 449.425 OPEN Off-Air
381,OBAaurora,145.19,-,0.6,Cross,151.4,131.8,23,23,NN,FM,5,CO Arapahoe Aurora N0OBA 145.19 OPEN On-Air
382,"LIEalbuquerque,northeast heights area",224.48,-,1.6,Tone,100,100,23,23,NN,FM,5,"NM Bernalillo Albuquerque, Northeast Heights area K6LIE 224.48 OPEN On-Air"
383,"CPUriorancho, intel corp",444.7,+,5,Tone,100,100,23,23,NN,FM,5,"NM Sandoval Rio Rancho, Intel Corp K5CPU 444.7 OPEN On-Air"
384,AOXsandiapark,224.94,-,1.6,,88.5,88.5,23,23,NN,FM,5,NM Bernalillo Sandia Park W5AOX 224.94 OPEN Off-Air
385,AOXsandiapark,444.15,+,5,Tone,100,100,23,23,NN,FM,5,NM Bernalillo Sandia park W5AOX 444.15 OPEN On-Air
386,0GVgolden,448.975,-,5,Tone,123,123,23,23,NN,FM,5,CO Jefferson Golden W0GV 448.975 OPEN On-Air
387,"IBMgolden,guy hill",448.85,-,5,TSQL,88.5,88.5,23,23,NN,FM,5,"CO Jefferson Golden, Guy Hill K0IBM 448.85 OPEN On-Air"
388,"0GOgolden,guy hill",449.75,-,5,TSQL,103.5,103.5,23,23,NN,FM,5,"CO Jefferson Golden, Guy Hill KI0GO 449.75 OPEN On-Air"
389,"MHUgolden,guy hill",224,-,1.6,TSQL,103.5,103.5,23,23,NN,FM,5,"CO Jefferson Golden, Guy Hill N0MHU 224 OPEN On-Air"
390,"POHgolden,guy hill",224.74,-,1.6,TSQL,88.5,88.5,23,23,NN,FM,5,"CO Jefferson Golden, Guy Hill N0POH 224.74 OPEN On-Air"
391,"CBIgolden,guy hill",147.15,+,0.6,TSQL,100,100,23,23,NN,FM,5,"CO Jefferson Golden, Guy Hill W0CBI 147.15 OPEN On-Air"
392,"T0Cgolden,guy hill",145.22,-,0.6,TSQL,103.5,103.5,23,23,NN,DIG,5,"CO Jefferson Golden, Guy Hill WT0C 145.22 OPEN On-Air"
393,"BIQalbuquerque,bcfd fire station 35",145.13,-,0.6,TSQL,100,100,23,23,NN,FM,5,"NM Bernalillo Albuquerque, BCFD Fire Station 35 K5BIQ 145.13 OPEN On-Air"
394,"BIQtijeras,cedro peak",145.15,-,0.6,TSQL,100,100,23,23,NN,FM,5,"NM Bernalillo Tijeras, Cedro Peak K5BIQ 145.15 OPEN On-Air"
395,"BIQalbuquerque,west mesa",442.05,+,5,TSQL,100,100,23,23,NN,FM,5,"NM Bernalillo Albuquerque, West Mesa K5BIQ 442.05 OPEN On-Air"
396,"SSPlakewood,moffat treatment plant",147.21,+,0.6,TSQL,100,100,23,23,NN,FM,5,"CO Jefferson Lakewood, Moffat Treatment Plant KD0SSP 147.21 OPEN On-Air"
397,"SSPlakewood,moffat treatment plant",448.35,-,5,Tone,225.7,225.7,23,23,NN,DIG,5,"CO Jefferson Lakewood, Moffat Treatment Plant KD0SSP 448.35 OPEN On-Air"
398,QIZalbuquerque,443.85,+,5,Tone,103.5,103.5,23,23,NN,FM,5,NM Bernalillo Albuquerque KC0QIZ 443.85 OPEN On-Air
399,"VGDgolden,table mountain",446.975,-,5,,88.5,88.5,23,23,NN,DIG,5,"CO Jefferson Golden, Table Mountain KB0VGD 446.975 OPEN On-Air"
400,TPTdenver,447.9,-,5,,88.5,88.5,23,23,NN,FM,5,CO Denver Denver WB0TPT 447.9 OPEN Off-Air
401,5HDriorancho,145.37,-,0.6,Tone,162.2,162.2,23,23,NN,FM,5,NM Sandoval Rio Rancho NM5HD 145.37 OPEN On-Air
402,JXNdenver,146.715,-,0.6,TSQL,123,123,23,23,NN,FM,5,CO Denver Denver N0JXN 146.715 OPEN On-Air
403,EHPdenver,448.075,-,5,Tone,123,123,23,23,NN,FM,5,CO Denver Denver N5EHP 448.075 OPEN On-Air
404,KIZdenver,448.55,-,5,Tone,82.5,82.5,23,23,NN,FM,5,CO Denver Denver W0KIZ 448.55 OPEN Off-Air
405,JTMalbuquerque,224.58,-,1.6,Tone,100,100,23,23,NN,FM,5,NM Bernalillo Albuquerque KH6JTM 224.58 OPEN On-Air
406,"JRLdenver,broadway plaza lofts",447.175,-,5,TSQL,100,100,23,23,NN,FM,5,"CO Denver Denver, Broadway Plaza Lofts W0JRL 447.175 OPEN On-Air"
407,LXPalbuquerque,147.32,+,0.6,Tone,100,100,23,23,NN,FM,5,NM Bernalillo Albuquerque K5LXP 147.32 OPEN On-Air
408,"DEMpritchett, tator butte",146.64,-,0.6,TSQL,100,100,23,23,NN,FM,5,"CO Las Animas Pritchett,  Tator Butte KZ0DEM 146.64 OPEN Off-Air"
