Location,Name,Frequency,Duplex,Offset,Tone,rToneFreq,cToneFreq,DtcsCode,DtcsRxCode,DtcsPolarity,Mode,TStep,Comment
203,UPSwestminster,449.3,-,5,Tone,100,100,23,23,NN,FM,5,CO Adams Westminster N1UPS 449.3 OPEN On-Air
204,ELYlakewood,448.75,-,5,TSQL,100,100,23,23,NN,FM,5,CO Jefferson Lakewood N0ELY 448.75 OPEN On-Air
205,0MLnorthglenn,147.045,+,0.6,Tone,123,123,23,23,NN,FM,5,CO Adams Northglenn K0ML 147.045 OPEN On-Air
206,"JRLdenver,broadway plaza lofts",447.175,-,5,TSQL,100,100,23,23,NN,FM,5,"CO Denver Denver, Broadway Plaza Lofts W0JRL 447.175 OPEN On-Air"
207,0KCfortlupton,224.96,-,1.6,,88.5,88.5,23,23,NN,FM,5,CO Weld Fort Lupton AC0KC 224.96 OPEN On-Air
208,0KCfortlupton,447.3,-,5,Tone,107.2,107.2,23,23,NN,FM,5,CO Weld Fort Lupton AC0KC 447.3 OPEN On-Air
209,JXNdenver,146.715,-,0.6,TSQL,123,123,23,23,NN,FM,5,CO Denver Denver N0JXN 146.715 OPEN On-Air
210,EHPdenver,448.075,-,5,Tone,123,123,23,23,NN,FM,5,CO Denver Denver N5EHP 448.075 OPEN On-Air
211,KIZdenver,448.55,-,5,Tone,82.5,82.5,23,23,NN,FM,5,CO Denver Denver W0KIZ 448.55 OPEN Off-Air
212,TPTdenver,447.9,-,5,,88.5,88.5,23,23,NN,FM,5,CO Denver Denver WB0TPT 447.9 OPEN Off-Air
213,"OWYconifer,critchell mountain",447.5,-,5,TSQL,88.5,88.5,23,23,NN,FM,5,"CO Jefferson Conifer, Critchell Mountain N0OWY 447.5 OPEN On-Air"
214,KWDgreeley,147,+,0.6,TSQL,100,100,23,23,NN,DIG,5,CO Weld Greeley KC0KWD 147 OPEN On-Air
215,KWDgreeley,448.475,-,5,Tone,100,100,23,23,NN,FM,5,CO Weld Greeley KC0KWD 448.475 OPEN On-Air
216,"0OJgreeley,unc",449.725,-,5,Tone,127.3,127.3,23,23,NN,FM,5,"CO Weld Greeley, UNC K0OJ 449.725 OPEN On-Air"
217,"YNAgrandjunction, grand mesa",449.65,-,5,TSQL,151.4,151.4,23,23,NN,FM,5,"CO Mesa Grand Junction, Grand Mesa KB0YNA 449.65 OPEN On-Air"
218,"YNAgunnison,w mountain or tenderfoot mountain",447.65,-,5,TSQL,151.4,151.4,23,23,NN,FM,5,"CO Gunnison Gunnison, W Mountain or Tenderfoot Mountain KB0YNA 447.65 OPEN On-Air"
219,"YNAmontrose,waterdog peak",448.65,-,5,Cross,88.5,151.4,23,23,NN,FM,5,"CO Montrose Montrose, Waterdog Peak KB0YNA 448.65 OPEN On-Air"
220,"YNAdelta,uncompahgre butte",449.4,-,5,TSQL,131.8,131.8,23,23,NN,FM,5,"CO Mesa Delta, Uncompahgre Butte KB0YNA 449.4 OPEN On-Air"
221,"YNAtelluride,gray head",449.7,-,5,TSQL,107.2,107.2,23,23,NN,FM,5,"CO San Miguel Telluride, Gray Head KB0YNA 449.7 OPEN On-Air"
222,JJYcheyenne,449.9,-,5,TSQL,100,100,23,23,NN,FM,5,WY Laramie Cheyenne N7JJY 449.9 OPEN On-Air
223,"DHFcheyenne,old airport control tower",448.95,-,5,TSQL,151.4,151.4,23,23,NN,DIG,5,"WY Laramie Cheyenne, Old airport control tower KC7DHF 448.95 OPEN On-Air"
224,0BGaurora,448.275,-,5,Tone,156.7,156.7,23,23,NN,FM,5,CO Arapahoe Aurora W0BG 448.275 OPEN On-Air
225,ANTaurora,448.825,-,5,,88.5,88.5,23,23,NN,DIG,5,CO Arapahoe Aurora WN7ANT 448.825 OPEN On-Air
226,0MRpaonia,147.33,+,0.6,Tone,107.2,107.2,23,23,NN,FM,5,CO Delta Paonia KI0MR 147.33 OPEN On-Air
227,"cedaredge,grand mesa",447.35,-,5,Tone,107.2,107.2,23,23,NN,FM,5,"CO Delta Cedaredge, Grand Mesa  447.35 OPEN "
228,lakegeorge,449.7,-,5,Tone,107.2,107.2,23,23,NN,FM,5,CO Park Lake George  449.7 OPEN 
229,coloradosprings,147.27,+,0.6,,88.5,88.5,23,23,NN,FM,5,CO El Paso Colorado Springs  147.27 OPEN On-Air
230,coloradosprings,449.575,-,5,,88.5,88.5,23,23,NN,FM,5,CO El Paso Colorado Springs  449.575 CLOSED On-Air
231,falcon,447.2,-,5,Tone,151.4,151.4,23,23,NN,DIG,5,CO El Paso Falcon  447.2 OPEN Testing
232,"lusk,77 hill",147.33,+,0.6,,88.5,88.5,23,23,NN,FM,5,"WY Niobrara Lusk, 77 Hill  147.33 OPEN On-Air"
233,chadron,446.3,,0,,88.5,88.5,23,23,NN,FM,5,NE Dawes Chadron  446.3 OPEN On-Air
234,0RGhudson,449.925,-,5,TSQL,114.8,114.8,23,23,NN,FM,5,CO Weld Hudson KD0RG 449.925 OPEN On-Air
235,"GURdenver,green valley ranch",448.15,-,5,TSQL,141.3,141.3,23,23,NN,FM,5,"CO Denver Denver, Green Valley Ranch K0GUR 448.15 OPEN On-Air"
236,Z0Nhartsel,448.575,-,5,TSQL,103.5,103.5,23,23,NN,FM,5,CO Park Hartsel WZ0N 448.575 OPEN Off-Air
237,"Z0Nsalida,methodist mountain",449.925,-,5,TSQL,103.5,103.5,23,23,NN,FM,5,"CO Chaffee Salida, Methodist Mountain WZ0N 449.925 OPEN On-Air"
238,"X0Glakegeorge, badger mountain",146.685,-,0.6,TSQL,107.2,107.2,23,23,NN,FM,5,"CO Park Lake George, Badger Mountain NX0G 146.685 OPEN On-Air"
239,X0Gwoodlandpark,146.82,-,0.6,Tone,107.2,107.2,23,23,NN,FM,5,CO Teller Woodland Park NX0G 146.82 OPEN On-Air
240,X0Gwoodlandpark,448.65,-,5,Tone,107.2,107.2,23,23,NN,FM,5,CO Teller Woodland Park NX0G 448.65 OPEN On-Air
241,X0Gcripplecreek,147.015,+,0.6,Tone,107.2,107.2,23,23,NN,FM,5,CO Teller Cripple Creek NX0G 147.015 OPEN On-Air
242,X0Gcoloradosprings,447.475,-,5,Tone,107.2,107.2,23,23,NN,FM,5,CO El Paso Colorado Springs NX0G 447.475 OPEN 
243,"CVUlakegeorge, badger mountain",147.36,+,0.6,TSQL,107.2,107.2,23,23,NN,FM,5,"CO Park Lake George, Badger Mountain KC0CVU 147.36 OPEN On-Air"
244,"CVUsalida,methodist mountain",145.295,-,0.6,Tone,107.2,107.2,23,23,NN,FM,5,"CO Chaffee Salida, Methodist Mountain KC0CVU 145.295 OPEN On-Air"
245,"CVUsalida,methodist mountain",449.65,-,5,Tone,107.2,107.2,23,23,NN,FM,5,"CO Chaffee Salida, Methodist Mountain KC0CVU 449.65 OPEN On-Air"
246,"CVUcoloradosprings, cheyenne mountain",146.76,-,0.6,TSQL,107.2,107.2,23,23,NN,FM,5,"CO El Paso Colorado Springs, Cheyenne Mountain KC0CVU 146.76 OPEN On-Air"
247,"CVUcoloradosprings, cheyenne mountain",147.345,+,0.6,TSQL,107.2,107.2,23,23,NN,FM,5,"CO El Paso Colorado Springs, Cheyenne Mountain KC0CVU 147.345 OPEN On-Air"
248,"CVUcoloradosprings, cheyenne mountain",448,-,5,Tone,107.2,107.2,23,23,NN,FM,5,"CO El Paso Colorado Springs, Cheyenne Mountain KC0CVU 448 OPEN On-Air"
249,"CVUcoloradosprings, cheyenne mountain",448.1,-,5,TSQL,107.2,107.2,23,23,NN,FM,5,"CO El Paso Colorado Springs, Cheyenne Mountain KC0CVU 448.1 OPEN On-Air"
250,"CVUcoloradosprings, cheyenne mountain",145.375,-,0.6,,88.5,88.5,23,23,NN,DIG,5,"CO El Paso Colorado Springs, Cheyenne Mountain KC0CVU 145.375 OPEN Off-Air"
251,"CVUcoloradosprings, cheyenne mountain",446.9125,-,5,,88.5,88.5,23,23,NN,DIG,5,"CO El Paso Colorado Springs, Cheyenne Mountain KC0CVU 446.9125 OPEN On-Air"
252,"CVUcoloradosprings, cheyenne mountain",927.85,-,25,DTCS,88.5,88.5,114,114,NN,FM,5,"CO Teller Colorado Springs, Cheyenne Mountain KC0CVU 927.85 OPEN On-Air"
253,"CVUpueblo,deer peak",449.625,-,5,Tone,107.2,107.2,23,23,NN,FM,5,"CO Custer Pueblo, Deer Peak KC0CVU 449.625 OPEN On-Air"
254,"0BXgrandjunction, grand mesa",446.9125,-,5,,88.5,88.5,23,23,NN,DIG,5,"CO Mesa Grand Junction, Grand Mesa W0BX 446.9125 OPEN On-Air"
255,"BARvernal,blue mountain",147.1,+,0.6,Tone,136.5,136.5,23,23,NN,FM,5,"UT Uintah Vernal, Blue Mountain W7BAR 147.1 OPEN On-Air"
256,"BARvernal,uintah county eoc",449.9,-,5,Tone,136.5,136.5,23,23,NN,FM,5,"UT Uintah Vernal, Uintah County EOC W7BAR 449.9 OPEN "
257,"BARvernal,grizzly ridge",147.04,+,0.6,Tone,136.5,136.5,23,23,NN,FM,5,"UT Uintah Vernal, Grizzly Ridge W7BAR 147.04 OPEN On-Air"
258,BYUvernal,449.7,-,5,Tone,136.5,136.5,23,23,NN,FM,5,UT Uintah Vernal W7BYU 449.7 OPEN 
259,BYUroosevelt,146.92,-,0.6,Tone,136.5,136.5,23,23,NN,FM,5,UT Duchesne Roosevelt W7BYU 146.92 OPEN Off-Air
260,"BYUmyton,flat top",145.49,-,0.6,Tone,136.5,136.5,23,23,NN,FM,5,"UT Duchesne Myton, Flat Top W7BYU 145.49 OPEN On-Air"
261,ALCcedaredge,147.36,+,0.6,Tone,100,100,23,23,NN,FM,5,CO Delta Cedaredge W0ALC 147.36 OPEN 
262,ALCcedaredge,449.825,-,5,Tone,100,100,23,23,NN,FM,5,CO Delta Cedaredge W0ALC 449.825 OPEN 
263,"7GRcheyenne,chalk bluffs",449.3,-,5,Tone,131.8,131.8,23,23,NN,DIG,5,"WY Laramie Cheyenne, Chalk Bluffs WB7GR 449.3 OPEN On-Air"
264,"7GRscottsbluff,stage hill",444.125,+,5,Tone,114.8,114.8,23,23,NN,FM,5,"NE Scotts Bluff Scottsbluff, Stage Hill WB7GR 444.125 OPEN On-Air"
265,"QXXcedaredge,cedar mesa",147.195,+,0.6,Tone,107.2,107.2,23,23,NN,FM,5,"CO Delta Cedaredge, Cedar Mesa KC0QXX 147.195 OPEN "
266,"ESQcastlerock, devils head",446.925,-,5,,88.5,88.5,23,23,NN,DIG,5,"CO Douglas Castle Rock, Devils Head N0ESQ 446.925 OPEN On-Air"
267,"ESQcastlerock, devils head (pike national forest)",447.525,-,5,TSQL,146.2,146.2,23,23,NN,FM,5,"CO Douglas Castle Rock, Devils Head (Pike National Forest) N0ESQ 447.525 OPEN On-Air"
268,"ESQparker,hess reservoir",447.525,-,5,Cross,203.5,146.2,23,23,NN,FM,5,"CO Douglas Parker, Hess Reservoir N0ESQ 447.525 OPEN On-Air"
269,"9SLcastlepines, daniels park",449.95,-,5,TSQL,77,77,23,23,NN,FM,5,"CO Douglas Castle Pines, Daniels Park W9SL 449.95 OPEN On-Air"
270,OBAaurora,145.19,-,0.6,Cross,151.4,131.8,23,23,NN,FM,5,CO Arapahoe Aurora N0OBA 145.19 OPEN On-Air
271,Q8Mparker,448.7,-,5,Tone,146.2,146.2,23,23,NN,FM,5,CO Douglas Parker WQ8M 448.7 OPEN On-Air
272,PWOcentennial,449.425,-,5,DTCS,88.5,88.5,23,23,NN,FM,5,CO Arapahoe Centennial K0PWO 449.425 OPEN Off-Air
273,LSDnathrop,146.745,-,0.6,Tone,100,100,23,23,NN,FM,5,CO Chaffee Nathrop W0LSD 146.745 OPEN Off-Air
274,"RRZgrandjunction, gjt",145.175,-,0.6,Tone,107.2,107.2,23,23,NN,FM,5,"CO Mesa Grand Junction, GJT W0RRZ 145.175 OPEN On-Air"
275,"RRZgrandjunction, black ridge (above colorado ntl monument)",146.94,-,0.6,TSQL,107.2,107.2,23,23,NN,FM,5,"CO Mesa Grand Junction, Black Ridge (Above Colorado Ntl Monument) W0RRZ 146.94 OPEN On-Air"
276,"JSClarkspur,westcreek",449.975,-,5,TSQL,100,100,23,23,NN,FM,5,"CO Douglas Larkspur, Westcreek K0JSC 449.975 OPEN On-Air"
277,"JSCsalida,methodist mountain",449.975,-,5,TSQL,100,100,23,23,NN,FM,5,"CO Chaffee Salida, Methodist Mountain K0JSC 449.975 OPEN On-Air"
278,"JSCcanoncity, fremont peak",446.7375,-,5,,88.5,88.5,23,23,NN,DIG,5,"CO Fremont Canon City, Fremont Peak K0JSC 446.7375 OPEN On-Air"
279,"JSCcanoncity, fremont peak",447.25,-,5,TSQL,100,100,23,23,NN,FM,5,"CO Fremont Canon City, Fremont Peak K0JSC 447.25 OPEN On-Air"
280,"JSCcanoncity, colorado",447.975,-,5,TSQL,100,100,23,23,NN,FM,5,"CO Fremont Canon City, Colorado K0JSC 447.975 OPEN On-Air"
281,"JSCcanoncity, canon city",449.975,-,5,TSQL,100,100,23,23,NN,FM,5,"CO Fremont Canon City, Canon City K0JSC 449.975 OPEN On-Air"
282,JSCwestcliffe,448.325,-,5,TSQL,100,100,23,23,NN,FM,5,CO Custer Westcliffe K0JSC 448.325 OPEN On-Air
283,JSCpueblowest,448.975,-,5,TSQL,100,100,23,23,NN,FM,5,CO Pueblo Pueblo West K0JSC 448.975 OPEN On-Air
284,JSCpueblo,446.9875,-,5,,88.5,88.5,23,23,NN,DIG,5,CO Pueblo Pueblo K0JSC 446.9875 OPEN Off-Air
285,"JSCpueblo,metro",447.275,-,5,TSQL,100,100,23,23,NN,FM,5,"CO Pueblo Pueblo, Metro K0JSC 447.275 OPEN On-Air"
286,"JSCpueblo,cedarwood",449.975,-,5,TSQL,100,100,23,23,NN,FM,5,"CO Pueblo Pueblo, Cedarwood K0JSC 449.975 OPEN On-Air"
287,PRAparker,445.075,-,5,,88.5,88.5,23,23,NN,DIG,5,CO Douglas Parker K0PRA 445.075 OPEN On-Air
288,PRAfranktown,446.85,-,5,,88.5,88.5,23,23,NN,DIG,5,CO Douglas Franktown K0PRA 446.85 OPEN On-Air
289,0TYgrandjunction,147.39,+,0.6,Tone,107.2,107.2,23,23,NN,FM,5,CO Mesa Grand Junction KE0TY 147.39 OPEN 
290,0TYgrandjunction,145.22,-,0.6,Tone,107.2,107.2,23,23,NN,FM,5,CO Mesa Grand Junction KE0TY 145.22 OPEN 
291,GJTgrandjunction,146.82,-,0.6,Tone,107.2,107.2,23,23,NN,FM,5,CO Mesa Grand Junction W0GJT 146.82 OPEN On-Air
292,GJTgrandjunction,448.15,-,5,Tone,100,100,23,23,NN,FM,5,CO Mesa Grand Junction W0GJT 448.15 OPEN On-Air
293,SSIgrandjunction,147.105,+,0.6,,88.5,88.5,23,23,NN,FM,5,CO Mesa Grand Junction K0SSI 147.105 OPEN On-Air
294,5GFgunnison,449.95,-,5,,88.5,88.5,23,23,NN,FM,5,CO Gunnison Gunnison K5GF 449.95 OPEN 
295,ARVgrandjunction,447.5,-,5,Tone,114.8,114.8,23,23,NN,FM,5,CO Mesa Grand Junction KC0ARV 447.5 OPEN 
296,REDgrandjunction,446.775,-,5,,88.5,88.5,23,23,NN,DIG,5,CO Mesa Grand Junction KD0RED 446.775 OPEN On-Air
297,SMZgrandjunction,449.775,-,5,Cross,173.8,88.5,23,23,NN,FM,5,CO Mesa Grand Junction KD0SMZ 449.775 OPEN On-Air
298,VTLgunnison,147.12,+,0.6,,88.5,88.5,23,23,NN,FM,5,CO Gunnison Gunnison W0VTL 147.12 OPEN On-Air
299,"RUGrocksprings, aspen mountain",146.61,-,0.6,Tone,100,100,23,23,NN,FM,5,"WY Sweetwater Rock Springs, Aspen Mountain N7RUG 146.61 OPEN On-Air"
300,"Y7Urocksprings, aspen mountain",146.94,-,0.6,Tone,100,100,23,23,NN,FM,5,"WY Sweetwater Rock Springs, Aspen Mountain WY7U 146.94 OPEN On-Air"
301,"XLFpalmerlake, monument hill",145.19,-,0.6,TSQL,131.8,131.8,23,23,NN,FM,5,"CO Douglas Palmer Lake, Monument Hill N0XLF 145.19 OPEN On-Air"
302,"MRCmaysville,co",145.325,-,0.6,Tone,100,100,23,23,NN,FM,5,"CO Chaffee Maysville, CO KD0MRC 145.325 OPEN On-Air"
303,WUCwoodlandpark,145.415,-,0.6,Tone,179.9,179.9,23,23,NN,FM,5,CO Teller Woodland Park KA0WUC 145.415 OPEN 
304,WUCwoodlandpark,447.675,-,5,TSQL,179.9,179.9,23,23,NN,FM,5,CO Teller Woodland Park KA0WUC 447.675 OPEN On-Air
305,WUCwoodlandpark,449.025,-,5,Tone,141.3,141.3,23,23,NN,FM,5,CO Teller Woodland Park KA0WUC 449.025 OPEN 
306,WUCwoodlandpark,927.9,-,25,DTCS,88.5,88.5,205,205,NN,FM,5,CO Teller Woodland Park KA0WUC 927.9 OPEN On-Air
307,"EPSwoodlandpark, paradise pines",449.325,-,5,TSQL,103.5,103.5,23,23,NN,FM,5,"CO Teller Woodland Park, Paradise Pines KA4EPS 449.325 OPEN On-Air"
308,"HENvernal,grizzly ridge",145.49,-,0.6,Tone,136.5,136.5,23,23,NN,FM,5,"UT Uintah Vernal, Grizzly Ridge K7HEN 145.49 OPEN On-Air"
309,"0NRmonument,monument hill",447.725,-,5,TSQL,100,100,23,23,NN,FM,5,"CO El Paso Monument, Monument Hill K0NR 447.725 OPEN On-Air"
310,"QPGsalida,methodist mountain",446.975,-,5,,88.5,88.5,23,23,NN,DIG,5,"CO Chaffee Salida, Methodist Mountain KD0QPG 446.975 OPEN On-Air"
311,PJKrocksprings,147.3,+,0.6,,88.5,88.5,23,23,NN,FM,5,WY Sweetwater Rock Springs KA7PJK 147.3 OPEN Testing
312,"UUJrocksprings, aspen mountain",146.655,-,0.6,TSQL,107.2,107.2,23,23,NN,DIG,5,"WY Sweetwater Rock Springs, Aspen Mountain KE7UUJ 146.655 OPEN On-Air"
313,OBLrocksprings,448.875,-,5,Tone,123,123,23,23,NN,DIG,5,WY Sweetwater Rock Springs KF7OBL 448.875 OPEN On-Air
314,SNUwheatland,146.88,-,0.6,TSQL,100,100,23,23,NN,FM,5,WY Platte Wheatland WA7SNU 146.88 OPEN On-Air
315,SNUwheatland,449.625,-,5,Tone,151.4,151.4,23,23,NN,FM,5,WY Platte Wheatland WA7SNU 449.625 OPEN On-Air
316,7AFwheatland,224.68,-,1.6,,88.5,88.5,23,23,NN,FM,5,WY Platte Wheatland AE7AF 224.68 OPEN On-Air
317,ABCrocksprings,444.5,+,5,Tone,123,123,23,23,NN,FM,5,WY Sweetwater Rock Springs N7ABC 444.5 OPEN On-Air
318,"SRJcoloradosprings, pikes peak",146.97,-,0.6,Cross,100,123,23,23,NN,FM,5,"CO El Paso Colorado Springs, Pikes Peak KB0SRJ 146.97 OPEN On-Air"
319,"SRJcoloradosprings, pikes peak",448.45,-,5,Tone,100,100,23,23,NN,FM,5,"CO El Paso Colorado Springs, Pikes Peak KB0SRJ 448.45 OPEN On-Air"
320,SRJcoloradosprings,224.06,-,1.6,,88.5,88.5,23,23,NN,FM,5,CO El Paso Colorado Springs KB0SRJ 224.06 CLOSED 
321,SRJcoloradosprings,145.265,-,0.6,TSQL,100,100,23,23,NN,DIG,5,CO El Paso Colorado Springs KB0SRJ 145.265 OPEN Off-Air
322,"SRJcoloradosprings, uccs",448.8,-,5,TSQL,100,100,23,23,NN,DIG,5,"CO El Paso Colorado Springs, UCCS KB0SRJ 448.8 OPEN Off-Air"
323,WDFcripplecreek,1287.7,-,20,Tone,67,67,23,23,NN,FM,5,CO Teller Cripple Creek WB0WDF 1287.7 OPEN Testing
324,WDFcripplecreek,145.46,-,0.6,Tone,67,67,23,23,NN,FM,5,CO Teller Cripple Creek WB0WDF 145.46 OPEN On-Air
325,WDFcripplecreek,224.94,-,1.6,Tone,67,67,23,23,NN,FM,5,CO Teller Cripple Creek WB0WDF 224.94 OPEN Testing
326,WDFcripplecreek,447.4,-,5,Tone,67,67,23,23,NN,FM,5,CO Teller Cripple Creek WB0WDF 447.4 OPEN On-Air
327,"WDFcanoncity, eightmile mountain",449,-,5,TSQL,67,67,23,23,NN,FM,5,"CO Fremont Canon City, eightmile Mountain WB0WDF 449 OPEN On-Air"
328,"WDFcanoncity, fremont peak",53.03,-,1.7,TSQL,88.5,88.5,23,23,NN,FM,5,"CO Fremont Canon City, Fremont Peak WB0WDF 53.03 OPEN On-Air"
329,UUXmontrose,146.91,-,0.6,TSQL,107.2,107.2,23,23,NN,FM,5,CO Montrose Montrose KC0UUX 146.91 OPEN On-Air
330,OPDmontrose,146.79,-,0.6,TSQL,107.2,107.2,23,23,NN,FM,5,CO Montrose Montrose KD5OPD 146.79 OPEN On-Air
331,"IFIcoloradosprings, almagre mountain",927.725,-,25,DTCS,88.5,88.5,114,114,NN,FM,5,"CO Teller Colorado Springs, Almagre Mountain WA6IFI 927.725 OPEN On-Air"
332,IFIcoloradosprings,447.55,-,5,Tone,123,123,23,23,NN,FM,5,CO El Paso Colorado Springs WA6IFI 447.55 OPEN On-Air
333,"IFIcoloradosprings, cheyenne mountain",53.13,-,1.7,TSQL,107.2,107.2,23,23,NN,FM,5,"CO El Paso Colorado Springs, Cheyenne Mountain WA6IFI 53.13 OPEN On-Air"
334,"0SPcoloradosprings, almagre mountain",147.18,+,0.6,Tone,100,100,23,23,NN,FM,5,"CO El Paso Colorado Springs, Almagre Mountain AA0SP 147.18 PRIVATE On-Air"
335,MOGcoloradosprings,224.72,-,1.6,TSQL,103.5,103.5,23,23,NN,FM,5,CO El Paso Colorado springs W0MOG 224.72 OPEN On-Air
336,MOGcoloradosprings,147.39,+,0.6,Tone,103.5,103.5,23,23,NN,FM,5,CO El Paso Colorado Springs W0MOG 147.39 OPEN On-Air
337,MOGcoloradosprings,448.6,-,5,Tone,114.8,114.8,23,23,NN,FM,5,CO El Paso Colorado Springs W0MOG 448.6 OPEN 
338,MOGcoloradosprings,927.8,-,25,DTCS,88.5,88.5,116,116,NN,FM,5,CO Teller Colorado Springs W0MOG 927.8 OPEN On-Air
339,"0BNgreenriver, green river high school",444.775,+,5,TSQL,123,123,23,23,NN,DIG,5,"WY Sweetwater Green River, Green River High School AD0BN 444.775 OPEN Testing"
340,"MDPfalcon,black forest",447.625,-,5,TSQL,100,100,23,23,NN,FM,5,"CO El Paso Falcon, Black Forest KD0MDP 447.625 OPEN On-Air"
341,IRPcoloradosprings,146.91,-,0.6,TSQL,151.4,151.4,23,23,NN,FM,5,CO El Paso Colorado Springs K0IRP 146.91 OPEN On-Air
342,IRPcoloradosprings,447.35,-,5,Tone,151.4,151.4,23,23,NN,FM,5,CO El Paso Colorado Springs K0IRP 447.35 OPEN On-Air
343,RSHcoloradosprings,146.85,-,0.6,Tone,103.5,103.5,23,23,NN,FM,5,CO El Paso Colorado Springs W0RSH 146.85 OPEN On-Air
344,A0Lcoloradosprings,448.3,-,5,Tone,100,100,23,23,NN,FM,5,CO El Paso Colorado Springs AA0L 448.3 OPEN On-Air
345,A0Lcoloradosprings,147.135,+,0.6,Tone,100,100,23,23,NN,FM,5,CO El Paso Colorado Springs AA0L 147.135 OPEN On-Air
346,0WFcoloradosprings,447.025,-,5,Tone,123,123,23,23,NN,FM,5,CO El Paso Colorado Springs KF0WF 447.025 OPEN Off-Air
347,"0KGcoloradosprings, broadmoor area",448.25,-,5,Tone,123,123,23,23,NN,FM,5,"CO El Paso Colorado Springs, Broadmoor Area N0KG 448.25 OPEN Off-Air"
348,"PLAcasper,casper mountain",145.46,-,0.6,TSQL,110.9,110.9,23,23,NN,FM,5,"WY Natrona Casper, Casper Mountain K7PLA 145.46 OPEN On-Air"
349,"TTFcoloradosprings, fillmore hill",448.725,-,5,Tone,123,123,23,23,NN,FM,5,"CO El Paso Colorado Springs, Fillmore Hill KA0TTF 448.725 OPEN On-Air"
350,"VNJcasper,casper mountain",146.94,-,0.6,TSQL,123,123,23,23,NN,FM,5,"WY Natrona Casper, Casper Mountain W7VNJ 146.94 OPEN On-Air"
351,VNJcasper,147.28,+,0.6,DTCS,88.5,88.5,32,32,NN,DIG,5,WY Natrona Casper W7VNJ 147.28 OPEN On-Air
352,"VNJcasper,wyoming med center",449.575,-,5,TSQL,173.8,173.8,23,23,NN,FM,5,"WY Natrona Casper, Wyoming Med Center W7VNJ 449.575 OPEN On-Air"
353,VNJcasper,52.98,-,1,Tone,141.3,141.3,23,23,NN,FM,5,WY Natrona Casper W7VNJ 52.98 OPEN Off-Air
354,"AGAcasper,casper mountain",146.64,-,0.6,Tone,173.8,173.8,23,23,NN,FM,5,"WY Natrona Casper, Casper Mountain KD7AGA 146.64 OPEN Off-Air"
355,"RRBcasper,casper mountain",449.9,-,5,,88.5,88.5,23,23,NN,DIG,5,"WY Natrona Casper, Casper Mountain N7RRB 449.9 OPEN On-Air"
356,"0FTfortmorgan, fort morgan eoc",448.2,-,5,,88.5,88.5,23,23,NN,DIG,5,"CO Morgan Fort Morgan, Fort Morgan EOC W0FT 448.2 OPEN On-Air"
357,0FTakron,448.175,-,5,,88.5,88.5,23,23,NN,DIG,5,CO Morgan Akron W0FT 448.175 OPEN On-Air
358,"B7Icasper,casper mtn.",449.5,-,5,Tone,100,100,23,23,NN,FM,5,"WY Natrona Casper, Casper Mtn. NB7I 449.5 OPEN On-Air"
359,"EKRcanoncity, fremont peak",145.49,-,0.6,TSQL,103.5,103.5,23,23,NN,FM,5,"CO Fremont Canon City, Fremont Peak WD0EKR 145.49 OPEN On-Air"
360,"EKRcanoncity, fremont peak",223.96,-,1.6,TSQL,103.5,103.5,23,23,NN,FM,5,"CO Fremont Canon City, Fremont Peak WD0EKR 223.96 OPEN On-Air"
361,"EKRcanoncity, fremont peak",447.75,-,5,TSQL,103.5,103.5,23,23,NN,FM,5,"CO Fremont Canon City, Fremont Peak WD0EKR 447.75 OPEN On-Air"
362,"TUCcanoncity, fremont peak",927.7,-,25,DTCS,88.5,88.5,114,114,NN,FM,5,"CO Fremont Canon City, Fremont Peak KB0TUC 927.7 OPEN On-Air"
363,TUCwestcliffe,147.06,+,0.6,TSQL,77,77,23,23,NN,FM,5,CO Custer Westcliffe KB0TUC 147.06 OPEN On-Air
364,TUCwestcliffe,448.15,-,5,TSQL,103.5,103.5,23,23,NN,FM,5,CO Custer Westcliffe KB0TUC 448.15 OPEN On-Air
365,TUCwestcliffe,927.775,-,25,DTCS,88.5,88.5,116,116,NN,FM,5,CO Custer Westcliffe KB0TUC 927.775 OPEN On-Air
366,MJIcasper,147.345,+,0.6,,88.5,88.5,23,23,NN,FM,5,WY Natrona Casper KC7MJI 147.345 OPEN 
367,7GTcasper,146.91,-,0.6,,88.5,88.5,23,23,NN,FM,5,WY Natrona Casper N7GT 146.91 OPEN 
368,G7Tcasper,449.1,-,5,,88.5,88.5,23,23,NN,FM,5,WY Natrona Casper NG7T 449.1 OPEN 
369,"PPPlander,airport",145.445,-,0.6,Tone,110.9,110.9,23,23,NN,FM,5,"WY Fremont Lander, airport KD7PPP 145.445 OPEN On-Air"
370,0DEsimla,147.105,+,0.6,TSQL,107.2,107.2,23,23,NN,FM,5,CO Elbert Simla WA0DE 147.105 OPEN On-Air
371,"ITSlakecity, hill 71",147.135,-,0.6,Tone,123,123,23,23,NN,FM,5,"CO Hinsdale Lake City, Hill 71 KB5ITS 147.135 OPEN On-Air"
372,"ITSouray,engineer mountain",147.27,+,0.6,Tone,127.3,127.3,23,23,NN,FM,5,"CO Ouray Ouray, Engineer Mountain KB5ITS 147.27 OPEN On-Air"
373,"ITSsilverton,buffalo boy",145.325,-,0.6,Tone,127.3,127.3,23,23,NN,FM,5,"CO San Juan Silverton, Buffalo Boy KB5ITS 145.325 OPEN On-Air"
374,"ITSsilverton,hazelton",444,+,5,Tone,67,67,23,23,NN,FM,5,"CO San Juan Silverton, Hazelton KB5ITS 444 OPEN On-Air"
375,ITSsilverton,447.525,-,5,Tone,127.3,127.3,23,23,NN,FM,5,CO San Juan Silverton KB5ITS 447.525 OPEN On-Air
376,"ITSsilverton,kendall mountain",147.375,+,0.6,Tone,156.7,156.7,23,23,NN,FM,5,"CO San Juan Silverton, Kendall Mountain KB5ITS 147.375 OPEN On-Air"
377,"HYFlander,limestone mountain",449.9,-,5,DTCS,88.5,88.5,261,261,NN,FM,5,"WY Fremont Lander, Limestone Mountain N7HYF 449.9 PRIVATE On-Air"
378,HYFlander,53.03,-,1,DTCS,88.5,88.5,261,261,NN,FM,5,WY Fremont Lander N7HYF 53.03 OPEN On-Air
379,"HYFriverton,griffy hill",449.975,-,5,Tone,127.3,127.3,23,23,NN,FM,5,"WY Fremont Riverton, Griffy Hill N7HYF 449.975 OPEN On-Air"
380,NEBharrisburg,147,-,0.6,Tone,103.5,103.5,23,23,NN,FM,5,NE Banner Harrisburg N0NEB 147 OPEN On-Air
381,NEBscottsbluff,147.075,+,0.6,,88.5,88.5,23,23,NN,FM,5,NE Scotts Bluff Scottsbluff N0NEB 147.075 OPEN On-Air
382,NEBalliance,146.715,-,0.6,TSQL,103.5,103.5,23,23,NN,FM,5,NE Box Butte Alliance N0NEB 146.715 OPEN On-Air
383,"D0Qwestcliffe,deer peak",919.1,-,25,Tone,88.5,88.5,23,23,NN,FM,5,"CO Pueblo Westcliffe, Deer Peak ND0Q 919.1 OPEN Off-Air"
384,"D0Qpueblo,baculite mesa",146.79,-,0.6,Tone,88.5,88.5,23,23,NN,FM,5,"CO Pueblo Pueblo, Baculite Mesa ND0Q 146.79 OPEN On-Air"
385,"D0Qpueblo,baculite mesa",224.26,-,1.6,Tone,88.5,88.5,23,23,NN,FM,5,"CO Pueblo Pueblo, Baculite Mesa ND0Q 224.26 OPEN Off-Air"
386,D0Qpueblo,447.95,-,5,Tone,88.5,88.5,23,23,NN,FM,5,CO Pueblo Pueblo ND0Q 447.95 OPEN On-Air
387,"D0Qwalsenburg,deer peak",224.32,-,1.6,Tone,88.5,88.5,23,23,NN,FM,5,"CO Custer Walsenburg, Deer Peak ND0Q 224.32 OPEN Off-Air"
388,"D0Qpueblo,deer peak",447.175,-,5,Tone,88.5,88.5,23,23,NN,FM,5,"CO Pueblo Pueblo, Deer Peak ND0Q 447.175 OPEN Off-Air"
389,D0Qpueblo,145.115,-,0.6,Tone,88.5,88.5,23,23,NN,FM,5,CO Pueblo Pueblo ND0Q 145.115 OPEN Off-Air
390,"D0Qpueblo,deer peak",146.88,-,0.6,Tone,88.5,88.5,23,23,NN,FM,5,"CO Pueblo Pueblo, Deer Peak ND0Q 146.88 OPEN On-Air"
391,"D0Qwalsenburg,n rattlesnake butte",146.73,-,0.6,Tone,88.5,88.5,23,23,NN,FM,5,"CO Huerfano Walsenburg, N Rattlesnake Butte ND0Q 146.73 OPEN On-Air"
392,UPScedarpoint,449.25,-,5,TSQL,123,123,23,23,NN,FM,5,CO Elbert Cedar Point K0UPS 449.25 OPEN On-Air
393,7ZWaltamont,147.28,+,0.6,TSQL,107.2,107.2,23,23,NN,FM,5,UT Duchesne Altamont AD7ZW 147.28 OPEN On-Air
394,CBSaltamont,146.74,-,0.6,Tone,100,100,23,23,NN,FM,5,UT Duchesne Altamont WB7CBS 146.74 OPEN Off-Air
395,0JScreede,146.925,-,0.6,,88.5,88.5,23,23,NN,FM,5,CO Mineral Creede WA0JS 146.925 OPEN Off-Air
396,"7BVmountainview, hickey mtn",144.635,+,0.6,Tone,100,100,23,23,NN,FM,5,"WY Uinta Mountain View, Hickey Mtn WY7BV 144.635 OPEN Off-Air"
397,7BAdouglas,147.15,+,0.6,,88.5,88.5,23,23,NN,FM,5,WY Converse Douglas KK7BA 147.15 OPEN On-Air
398,"PKTcreede,bristol head",449.525,-,5,TSQL,100,100,23,23,NN,FM,5,"CO Mineral Creede, Bristol Head N0PKT 449.525 OPEN On-Air"
399,BQMmitchell,445.1,,0,TSQL,100,100,23,23,NN,FM,5,NE Scotts Bluff Mitchell WD0BQM 445.1 OPEN On-Air
400,BQMscottsbluff,145.475,-,0.6,,88.5,88.5,23,23,NN,FM,5,NE Scotts Bluff Scottsbluff WD0BQM 145.475 OPEN On-Air
401,PQDduchense,147.26,+,0.6,,88.5,88.5,23,23,NN,FM,5,UT Duchesne Duchense N7PQD 147.26 OPEN On-Air
402,"QEQmoab,bald mesa",146.76,-,0.6,Tone,88.5,88.5,23,23,NN,FM,5,"UT Grand Moab, Bald Mesa K7QEQ 146.76 OPEN On-Air"
403,"QEQmoab,bald mesa",449.1,-,5,TSQL,107.2,107.2,23,23,NN,FM,5,"UT Grand Moab, Bald Mesa K7QEQ 449.1 OPEN On-Air"
404,QEQmoab,146.9,-,0.6,Tone,88.5,88.5,23,23,NN,FM,5,UT Grand Moab K7QEQ 146.9 OPEN On-Air
405,"QEQmonticello,abajo pk",223.94,-,1.6,,88.5,88.5,23,23,NN,FM,5,"UT San Juan Monticello, Abajo Pk K7QEQ 223.94 CLOSED "
406,"QEQmonticello,abajo peak",447.1,-,5,TSQL,107.2,107.2,23,23,NN,FM,5,"UT San Juan Monticello, Abajo Peak K7QEQ 447.1 OPEN On-Air"
407,"QEQmonticello,abajo peak",447.4,-,5,,88.5,88.5,23,23,NN,FM,5,"UT San Juan Monticello, Abajo Peak K7QEQ 447.4 CLOSED "
408,"JTBsterling,co",145.295,-,0.6,,88.5,88.5,23,23,NN,FM,5,"CO Logan Sterling, CO WA0JTB 145.295 OPEN On-Air"
409,KAVscottsbluff,444.825,+,5,,88.5,88.5,23,23,NN,FM,5,NE Scotts Bluff Scottsbluff W0KAV 444.825 OPEN On-Air
410,"E0Zpueblo,csu",147,+,0.6,,88.5,88.5,23,23,NN,FM,5,"CO Pueblo Pueblo, CSU NE0Z 147 PRIVATE On-Air"
411,0KMcenter,146.64,-,0.6,TSQL,77,77,23,23,NN,FM,5,CO Rio Grande Center N0KM 146.64 OPEN On-Air
412,0KMcenter,447.1,-,5,Tone,77,77,23,23,NN,FM,5,CO Saguache Center N0KM 447.1 OPEN On-Air
413,"FOPriverton,griffey hill",145.115,-,0.6,Tone,100,100,23,23,NN,FM,5,"WY Fremont Riverton, Griffey Hill K0FOP 145.115 OPEN On-Air"
414,"0STpueblo,pueblo",146.655,-,0.6,Tone,123,123,23,23,NN,FM,5,"CO Pueblo Pueblo, Pueblo K0ST 146.655 OPEN On-Air"
415,"0KRpueblo,pueblo",447.7,-,5,TSQL,210.7,210.7,23,23,NN,DIG,5,"CO Pueblo Pueblo, Pueblo KF0KR 447.7 PRIVATE Off-Air"
416,PWZpalmerdivide,449.725,-,5,Tone,100,100,23,23,NN,FM,5,CO El Paso Palmer Divide N0PWZ 449.725 OPEN On-Air
