Location,Name,Frequency,Duplex,Offset,Tone,rToneFreq,cToneFreq,DtcsCode,DtcsRxCode,DtcsPolarity,Mode,TStep,Comment
0,VJJsteamboatsprings,147.165,+,0.6,Cross,88.5,123,23,23,NN,FM,5,CO Routt Steamboat Springs KB0VJJ 147.165 OPEN On-Air
1,VJJsteamboatsprings,449.625,-,5,TSQL,123,123,23,23,NN,FM,5,CO Routt Steamboat Springs KB0VJJ 449.625 OPEN On-Air
2,"VJJwalden,peterson ridge",145.16,-,0.6,Cross,88.5,123,23,23,NN,FM,5,"CO Jackson Walden, Peterson Ridge KB0VJJ 145.16 OPEN On-Air"
3,VJJcraig,146.97,-,0.6,Cross,88.5,123,23,23,NN,FM,5,CO Moffat Craig KB0VJJ 146.97 OPEN On-Air
4,"VJJkremmling,santoy peak",147.075,+,0.6,Cross,88.5,123,23,23,NN,FM,5,"CO Grand Kremmling, Santoy Peak KB0VJJ 147.075 OPEN On-Air"
5,VJJvail,147.345,+,0.6,Cross,88.5,123,23,23,NN,FM,5,CO Eagle Vail KB0VJJ 147.345 OPEN On-Air
6,"VJJwinterpark, winter park",147.285,+,0.6,Cross,88.5,123,23,23,NN,FM,5,"CO Grand Winter Park, Winter Park KB0VJJ 147.285 OPEN On-Air"
7,"VJJglenwoodsprings, sunlight peak",146.85,-,0.6,Cross,88.5,123,23,23,NN,FM,5,"CO Garfield Glenwood Springs, Sunlight Peak KB0VJJ 146.85 OPEN On-Air"
8,"VJJboulder,thorodin mountain",145.31,-,0.6,Cross,88.5,123,23,23,NN,FM,5,"CO Gilpin Boulder, Thorodin Mountain KB0VJJ 145.31 OPEN On-Air"
9,"VJJbreckenridge,bald mountain",147.39,+,0.6,Cross,88.5,123,23,23,NN,FM,5,"CO Summit Breckenridge, Bald Mountain KB0VJJ 147.39 OPEN On-Air"
10,"VJJleadville,mosquito pass",145.445,-,0.6,Tone,88.5,88.5,23,23,NN,FM,5,"CO Lake Leadville, Mosquito Pass KB0VJJ 145.445 OPEN On-Air"
11,"VJJgrandjunction, grand mesa",145.355,-,0.6,Cross,88.5,123,23,23,NN,FM,5,"CO Mesa Grand Junction, Grand Mesa KB0VJJ 145.355 OPEN On-Air"
12,"VJJgrandjunction, grand mesa",147.355,-,0.6,Cross,88.5,123,23,23,NN,FM,5,"CO Mesa Grand Junction, Grand Mesa KB0VJJ 147.355 OPEN On-Air"
13,"VJJsalida,methodist mountain",147.285,+,0.6,Cross,88.5,123,23,23,NN,FM,5,"CO Chaffee Salida, Methodist Mountain KB0VJJ 147.285 OPEN On-Air"
14,"VJJcoloradosprings, cheyenne mountain",145.13,-,0.6,Cross,88.5,123,23,23,NN,FM,5,"CO El Paso Colorado Springs, Cheyenne Mountain KB0VJJ 145.13 OPEN On-Air"
15,VJJakron,145.4,-,0.6,Cross,88.5,123,23,23,NN,FM,5,CO Washington Akron KB0VJJ 145.4 OPEN On-Air
16,D0Hsteamboatsprings,147.21,+,0.6,TSQL,107.2,107.2,23,23,NN,FM,5,CO Routt Steamboat Springs KD0H 147.21 OPEN On-Air
17,HAMcraig,145.265,-,0.6,Tone,107.2,107.2,23,23,NN,FM,5,CO Moffat Craig WD0HAM 145.265 OPEN 
18,"PFJgranby,mt chauncey",446.875,-,5,,88.5,88.5,23,23,NN,DIG,5,"CO Clear Creek Granby, Mt Chauncey K7PFJ 446.875 OPEN On-Air"
19,"PFJfortcollins, horsetooth mountain",446.75,-,5,,88.5,88.5,23,23,NN,DIG,5,"CO Larimer Fort Collins, Horsetooth Mountain K7PFJ 446.75 OPEN On-Air"
20,"PFJcheyenne,south",449.9375,-,5,,88.5,88.5,23,23,NN,DIG,5,"WY Laramie Cheyenne, South K7PFJ 449.9375 OPEN On-Air"
21,"PFJcoloradosprings, almagre mountain",446.95,-,5,,88.5,88.5,23,23,NN,DIG,5,"CO Teller Colorado Springs, Almagre Mountain K7PFJ 446.95 OPEN On-Air"
22,YDWgranby,146.82,-,0.6,Tone,123,123,23,23,NN,FM,5,CO Grand Granby KA0YDW 146.82 OPEN 
23,"7UWlaramie,jelm mountain",147.015,+,0.6,Tone,146.2,146.2,23,23,NN,DIG,5,"WY Albany Laramie, Jelm Mountain N7UW 147.015 OPEN On-Air"
24,"7UWlaramie,university",146.61,-,0.6,,88.5,88.5,23,23,NN,DIG,5,"WY Albany Laramie, University N7UW 146.61 OPEN On-Air"
25,0SZvail,445.075,-,5,,88.5,88.5,23,23,NN,DIG,5,CO Eagle Vail N0SZ 445.075 OPEN On-Air
26,"0SZboulder,lee hill",445.05,-,5,,88.5,88.5,23,23,NN,DIG,5,"CO Boulder Boulder, Lee Hill N0SZ 445.05 OPEN On-Air"
27,"0SZboulder,lee hill",446.9875,-,5,,88.5,88.5,23,23,NN,DIG,5,"CO Boulder Boulder, Lee Hill N0SZ 446.9875 OPEN On-Air"
28,"0SZboulder,lee hill",447.75,-,5,TSQL,141.3,141.3,23,23,NN,FM,5,"CO Boulder Boulder, Lee Hill N0SZ 447.75 OPEN On-Air"
29,"0SZbreckenridge,baldy",445.0875,-,5,,88.5,88.5,23,23,NN,DIG,5,"CO Fremont Breckenridge, Baldy N0SZ 445.0875 OPEN On-Air"
30,"0SZdenver,thorodin mountain",449.225,-,5,TSQL,141.3,141.3,23,23,NN,FM,5,"CO Gilpin Denver, Thorodin Mountain N0SZ 449.225 OPEN On-Air"
31,"0SZboulder,mount thorodin",446.8,-,5,,88.5,88.5,23,23,NN,DIG,5,"CO Boulder Boulder, Mount Thorodin N0SZ 446.8 OPEN On-Air"
32,"0SZidahosprings, squaw mountain",446.9375,-,5,,88.5,88.5,23,23,NN,DIG,5,"CO Clear Creek Idaho Springs, Squaw Mountain N0SZ 446.9375 OPEN On-Air"
33,"0SZidahosprings, squaw mountain",448.225,-,5,TSQL,141.3,141.3,23,23,NN,FM,5,"CO Clear Creek Idaho Springs, Squaw Mountain N0SZ 448.225 OPEN On-Air"
34,"0SZleadville,mosquito pass",445.05,-,5,,88.5,88.5,23,23,NN,DIG,5,"CO Lake Leadville, Mosquito Pass N0SZ 445.05 OPEN On-Air"
35,"0SZgolden,lookout mountain",145.37,-,0.6,,88.5,88.5,23,23,NN,DIG,5,"CO Jefferson Golden, Lookout Mountain N0SZ 145.37 OPEN On-Air"
36,"0SZevergreen,lower squaw mountain",145.175,-,0.6,DTCS,88.5,88.5,73,73,NN,DIG,5,"CO Clear Creek Evergreen, Lower Squaw Mountain N0SZ 145.175 OPEN Off-Air"
37,"0SZrangely,cathedral bluffs",445.2625,-,5,,88.5,88.5,23,23,NN,DIG,5,"CO Rio Blanco Rangely, Cathedral Bluffs N0SZ 445.2625 OPEN On-Air"
38,"0SZfairplay,badger",446.7625,-,5,,88.5,88.5,23,23,NN,DIG,5,"CO Park Fairplay, Badger N0SZ 446.7625 OPEN On-Air"
39,0SZwestcreek,446.875,-,5,,88.5,88.5,23,23,NN,DIG,5,CO Douglas Westcreek N0SZ 446.875 OPEN On-Air
40,"0SZsalida,methodist mountain",446.8125,-,5,,88.5,88.5,23,23,NN,DIG,5,"CO Chaffee Salida, Methodist Mountain N0SZ 446.8125 OPEN On-Air"
41,"0SZcoloradosprings, cheyenne mountain",445.0625,-,5,,88.5,88.5,23,23,NN,DIG,5,"CO El Paso Colorado Springs, Cheyenne Mountain N0SZ 445.0625 OPEN Off-Air"
42,AFOvail,224.8,-,1.6,,88.5,88.5,23,23,NN,FM,5,CO Eagle Vail N0AFO 224.8 OPEN Off-Air
43,AFOvail,449.9,-,5,TSQL,107.2,107.2,23,23,NN,FM,5,CO Eagle Vail N0AFO 449.9 OPEN Off-Air
44,"0RVvail,bald mountain",146.61,-,0.6,Tone,107.2,107.2,23,23,NN,FM,5,"CO Eagle Vail, Bald Mountain K0RV 146.61 OPEN On-Air"
45,CCCwinterpark,447.45,-,5,Tone,103.5,103.5,23,23,NN,FM,5,CO Grand Winter Park WA4CCC 447.45 OPEN On-Air
46,0FHestespark,449.8,-,5,Tone,123,123,23,23,NN,FM,5,CO Larimer Estes Park N0FH 449.8 OPEN On-Air
47,0FHestespark,146.685,-,0.6,Tone,123,123,23,23,NN,FM,5,CO Larimer Estes Park N0FH 146.685 OPEN On-Air
48,"HNDglenwoodsprings, lookout mountain",449.85,-,5,TSQL,131.8,131.8,23,23,NN,FM,5,"CO Garfield Glenwood Springs, Lookout Mountain WA4HND 449.85 OPEN On-Air"
49,"HNDparachute,mount callahan",449.8,-,5,Tone,107.2,107.2,23,23,NN,FM,5,"CO Garfield Parachute, Mount Callahan WA4HND 449.8 OPEN On-Air"
50,"HNDgrandjunction, grand mesa",449.3,-,5,TSQL,107.2,107.2,23,23,NN,FM,5,"CO Mesa Grand Junction, Grand Mesa WA4HND 449.3 OPEN On-Air"
51,"HNDgrandjunction, black ridge",449.575,-,5,TSQL,131.8,131.8,23,23,NN,FM,5,"CO Mesa Grand Junction, Black Ridge WA4HND 449.575 OPEN On-Air"
52,"HNDmontrose,waterdog peak",447.2,-,5,TSQL,107.2,107.2,23,23,NN,FM,5,"CO Montrose Montrose, Waterdog Peak WA4HND 447.2 OPEN On-Air"
53,I0Gglenwoodsprings,224.02,-,1.6,,88.5,88.5,23,23,NN,FM,5,CO Garfield Glenwood Springs KI0G 224.02 CLOSED 
54,I0Gglenwoodsprings,447.6,-,5,,88.5,88.5,23,23,NN,FM,5,CO Garfield Glenwood Springs KI0G 447.6 CLOSED 
55,"I0Gglenwoodsprings, sunlight peak",146.88,-,0.6,Tone,107.2,107.2,23,23,NN,FM,5,"CO Garfield Glenwood Springs, Sunlight Peak KI0G 146.88 OPEN On-Air"
56,"I0Gglenwoodsprings, sunlight peak",447.1,-,5,Tone,107.2,107.2,23,23,NN,FM,5,"CO Garfield Glenwood Springs, Sunlight Peak KI0G 447.1 OPEN On-Air"
57,"0VQglenwoodsprings, three mile ridge",147.3,+,0.6,Tone,107.2,107.2,23,23,NN,FM,5,"CO Garfield Glenwood Springs, Three Mile Ridge K0VQ 147.3 OPEN Off-Air"
58,"0VQcarbondale,missouri heights",447.15,-,5,Tone,136.5,136.5,23,23,NN,FM,5,"CO Garfield Carbondale, Missouri Heights K0VQ 447.15 OPEN On-Air"
59,"0VQaspen,aspen mountain",447.05,-,5,TSQL,136.5,136.5,23,23,NN,FM,5,"CO Pitkin Aspen, Aspen Mountain K0VQ 447.05 OPEN On-Air"
60,"0HGallenspark,afpd station #5",147.03,+,0.6,Tone,100,100,23,23,NN,FM,5,"CO Boulder Allenspark, AFPD Station #5 KI0HG 147.03 OPEN On-Air"
61,"XLIglenwoodsprings, sunlight peak",449.6,-,5,Tone,107.2,107.2,23,23,NN,FM,5,"CO Garfield Glenwood Springs, Sunlight Peak N0XLI 449.6 OPEN On-Air"
62,"ELKcarbondale,four mile ridge",449.725,-,5,Tone,179.9,179.9,23,23,NN,FM,5,"CO Garfield Carbondale, Four Mile Ridge K0ELK 449.725 OPEN On-Air"
63,"SNOcarbondale,four mile ridge",147.39,+,0.6,Tone,107.2,107.2,23,23,NN,FM,5,"CO Garfield Carbondale, Four Mile Ridge K0SNO 147.39 OPEN On-Air"
64,"UPSfortcollins, buckhorn mountain",146.625,-,0.6,TSQL,100,100,23,23,NN,FM,5,"CO Larimer Fort Collins, Buckhorn Mountain W0UPS 146.625 OPEN On-Air"
65,"UPSfortcollins, buckhorn mountain",224.84,-,1.6,TSQL,100,100,23,23,NN,FM,5,"CO Larimer Fort Collins, Buckhorn Mountain W0UPS 224.84 OPEN On-Air"
66,"UPSfortcollins, buckhorn mountain",447.7,-,5,TSQL,100,100,23,23,NN,FM,5,"CO Larimer Fort Collins, Buckhorn Mountain W0UPS 447.7 OPEN On-Air"
67,"UPSfortcollins, horsetooth mountain",145.115,-,0.6,TSQL,100,100,23,23,NN,FM,5,"CO Larimer Fort Collins, Horsetooth Mountain W0UPS 145.115 OPEN On-Air"
68,"UPSfortcollins, horsetooth mountain",224.52,-,1.6,TSQL,100,100,23,23,NN,FM,5,"CO Larimer Fort Collins, Horsetooth Mountain W0UPS 224.52 OPEN Off-Air"
69,"UPSfortcollins, horsetooth mountain",447.275,-,5,TSQL,100,100,23,23,NN,FM,5,"CO Larimer Fort Collins, Horsetooth Mountain W0UPS 447.275 OPEN On-Air"
70,"UPSloveland,budweiser event center",448.025,-,5,TSQL,100,100,23,23,NN,DIG,5,"CO Larimer Loveland, Budweiser Event Center W0UPS 448.025 OPEN On-Air"
71,"UPSgreeley,unc",146.85,-,0.6,TSQL,100,100,23,23,NN,FM,5,"CO Weld Greeley, UNC W0UPS 146.85 OPEN On-Air"
72,0JZgoldhill,146.91,+,0.6,Cross,123,127.3,23,23,NN,FM,5,CO Boulder Gold Hill W0JZ 146.91 OPEN On-Air
73,0RMrollinsville,224.6,-,1.6,Tone,100,100,23,23,NN,FM,5,CO Gilpin Rollinsville W0RM 224.6 OPEN 
74,"GCRrawlins,elk mountain",147.24,+,0.6,Tone,100,100,23,23,NN,FM,5,"WY Carbon Rawlins, Elk Mountain N7GCR 147.24 OPEN On-Air"
75,QMRbreckenridge,146.7,-,0.6,Tone,107.2,107.2,23,23,NN,FM,5,CO Summit Breckenridge WB0QMR 146.7 OPEN On-Air
76,"ZUQfortcollins, christ mountain",449.425,-,5,Tone,94.8,94.8,23,23,NN,FM,5,"CO Larimer Fort Collins, Christ Mountain N0ZUQ 449.425 OPEN On-Air"
77,"ZUQfortcollins, christ mountain",927.875,-,25,DTCS,88.5,88.5,114,114,NN,FM,5,"CO Larimer Fort Collins, Christ Mountain N0ZUQ 927.875 OPEN Off-Air"
78,ZUQaurora,448.4,-,5,Tone,94.8,94.8,23,23,NN,FM,5,CO Arapahoe Aurora N0ZUQ 448.4 OPEN On-Air
79,"CRAboulder,eldorado mountain",145.46,-,0.6,TSQL,107.2,107.2,23,23,NN,FM,5,"CO Boulder Boulder, Eldorado Mountain W0CRA 145.46 OPEN On-Air"
80,"CRAboulder,eldorado mountain",447.975,-,5,TSQL,107.2,107.2,23,23,NN,FM,5,"CO Boulder Boulder, Eldorado Mountain W0CRA 447.975 OPEN On-Air"
81,"CRAidahosprings, squaw mountain",145.145,-,0.6,TSQL,107.2,107.2,23,23,NN,FM,5,"CO Clear Creek Idaho Springs, Squaw Mountain W0CRA 145.145 OPEN On-Air"
82,"CRAidahosprings, squaw mountain",447.575,-,5,TSQL,107.2,107.2,23,23,NN,FM,5,"CO Clear Creek Idaho Springs, Squaw Mountain W0CRA 447.575 OPEN On-Air"
83,"CRAconifer,conifer mountain",53.05,-,1.7,TSQL,107.2,107.2,23,23,NN,FM,5,"CO Jefferson Conifer, Conifer Mountain W0CRA 53.05 OPEN Off-Air"
84,"CRAconifer,conifer mountain",1287.9,-,20,,88.5,88.5,23,23,NN,FM,5,"CO Jefferson Conifer, Conifer Mountain W0CRA 1287.9 OPEN Off-Air"
85,"CRAconifer,conifer mountain",224.98,-,1.6,TSQL,107.2,107.2,23,23,NN,FM,5,"CO Jefferson Conifer, Conifer Mountain W0CRA 224.98 OPEN Off-Air"
86,"CRAconifer,conifer mountain",447.15,-,5,TSQL,107.2,107.2,23,23,NN,FM,5,"CO Jefferson Conifer, Conifer Mountain W0CRA 447.15 OPEN Off-Air"
87,"CRAlarkspur,westcreek",147.225,+,0.6,TSQL,107.2,107.2,23,23,NN,FM,5,"CO Douglas Larkspur, Westcreek W0CRA 147.225 OPEN On-Air"
88,"CRAlarkspur,westcreek",448.425,-,5,TSQL,107.2,107.2,23,23,NN,FM,5,"CO Douglas Larkspur, Westcreek W0CRA 448.425 OPEN On-Air"
89,"CRAcoloradosprings, cheyenne mountain",145.16,-,0.6,TSQL,107.2,107.2,23,23,NN,FM,5,"CO El Paso Colorado Springs, Cheyenne Mountain W0CRA 145.16 OPEN On-Air"
90,"0IAboulder,lee hill",224.02,-,1.6,,88.5,88.5,23,23,NN,FM,5,"CO Boulder Boulder, Lee Hill W0IA 224.02 OPEN On-Air"
91,0IAboulder,449.55,-,5,Tone,100,100,23,23,NN,FM,5,CO Boulder Boulder W0IA 449.55 OPEN On-Air
92,"0IAboulder,gunbarrel hill",146.76,-,0.6,Tone,100,100,23,23,NN,FM,5,"CO Boulder Boulder, Gunbarrel Hill W0IA 146.76 OPEN On-Air"
93,SWErifle,146.76,-,0.6,Tone,107.2,107.2,23,23,NN,FM,5,CO Garfield Rifle N0SWE 146.76 OPEN Off-Air
94,"1TJfortcollins, horsetooth mountain",927.95,-,25,TSQL,100,100,23,23,NN,FM,5,"CO Larimer Fort Collins, Horsetooth Mountain K1TJ 927.95 OPEN On-Air"
95,1TJfortcollins,1283.55,-,20,Tone,100,100,23,23,NN,FM,5,CO Larimer Fort Collins K1TJ 1283.55 OPEN On-Air
96,"0SFfortcollins, horsetooth mountain",927.825,-,25,TSQL,100,100,23,23,NN,FM,5,"CO Larimer Fort Collins, Horsetooth Mountain AB0SF 927.825 OPEN On-Air"
97,"SNOlaramie,beacon hill",146.82,-,0.6,Tone,114.8,114.8,23,23,NN,FM,5,"WY Albany Laramie, Beacon Hill KC7SNO 146.82 OPEN On-Air"
98,"SNOcheyenne,denver hill",146.775,-,0.6,Tone,114.8,114.8,23,23,NN,FM,5,"WY Laramie Cheyenne, Denver Hill KC7SNO 146.775 OPEN On-Air"
99,"SNOcheyenne,north park",147.105,+,0.6,Cross,114.8,91.5,23,23,NN,FM,5,"WY Laramie Cheyenne, North Park KC7SNO 147.105 OPEN On-Air"
100,SNOalbin,147.165,+,0.6,Tone,114.8,114.8,23,23,NN,FM,5,WY Laramie Albin KC7SNO 147.165 OPEN On-Air
101,"G0Nidahosprings, squaw mountain",449.05,-,5,TSQL,107.2,107.2,23,23,NN,FM,5,"CO Denver Idaho Springs, Squaw Mountain WG0N 449.05 OPEN On-Air"
102,"VGDfortcollins , horsetooth mountain",145.265,-,0.6,,88.5,88.5,23,23,NN,DIG,5,"CO Larimer Fort Collins , Horsetooth Mountain KB0VGD 145.265 OPEN On-Air"
103,"VGDgolden,table mountain",446.975,-,5,,88.5,88.5,23,23,NN,DIG,5,"CO Jefferson Golden, Table Mountain KB0VGD 446.975 OPEN On-Air"
104,0CLsnowmassvillage,146.67,-,0.6,Tone,107.2,107.2,23,23,NN,FM,5,CO Pitkin Snowmass Village K0CL 146.67 OPEN On-Air
105,0DKboulder,1299.5,-,20,,88.5,88.5,23,23,NN,DIG,5,CO Boulder Boulder W0DK 1299.5 OPEN On-Air
106,"0DKboulder,table mountain",146.7,-,0.6,Tone,100,100,23,23,NN,FM,5,"CO Boulder Boulder, Table Mountain W0DK 146.7 OPEN On-Air"
107,0DKboulder,146.61,-,0.6,Tone,100,100,23,23,NN,FM,5,CO Boulder Boulder W0DK 146.61 OPEN Off-Air
108,"0DKboulder,table mesa",448.9,-,5,Tone,100,100,23,23,NN,FM,5,"CO Boulder Boulder, Table Mesa W0DK 448.9 OPEN On-Air"
109,0DSboulder,446.8625,-,5,,88.5,88.5,23,23,NN,DIG,5,CO Boulder Boulder KC0DS 446.8625 OPEN On-Air
110,0DSboulder,1283.8625,-,20,,88.5,88.5,23,23,NN,DIG,5,CO Boulder Boulder KC0DS 1283.8625 OPEN On-Air
111,0DSboulder,145.3875,-,0.6,,88.5,88.5,23,23,NN,DIG,5,CO Boulder Boulder KC0DS 145.3875 OPEN On-Air
112,0DKboulder,449.4,-,5,Tone,91.5,91.5,23,23,NN,FM,5,CO Boulder Boulder K0DK 449.4 OPEN Off-Air
113,0DKboulder,146.73,-,0.6,TSQL,91.5,91.5,23,23,NN,FM,5,CO Boulder Boulder K0DK 146.73 OPEN Off-Air
114,RBTfortcollins,447.45,-,5,Tone,123,123,23,23,NN,FM,5,CO Larimer Fort Collins KC0RBT 447.45 OPEN On-Air
115,AOLfortcollins,446.7375,-,5,,88.5,88.5,23,23,NN,DIG,5,CO Larimer Fort Collins N0AOL 446.7375 OPEN On-Air
116,"LRAloveland,namaqua hill",147.195,+,0.6,Tone,100,100,23,23,NN,FM,5,"CO Larimer Loveland, Namaqua Hill W0LRA 147.195 OPEN On-Air"
117,"LRAloveland,namaqua hill",449.575,-,5,Tone,100,100,23,23,NN,FM,5,"CO Larimer Loveland, Namaqua Hill W0LRA 449.575 OPEN On-Air"
118,"ZSNleadville,quail mountain",147.24,+,0.6,TSQL,156.7,156.7,23,23,NN,FM,5,"CO Lake Leadville, Quail Mountain N0ZSN 147.24 OPEN Off-Air"
119,"WYXidahosprings, squaw mountain",146.94,-,0.6,TSQL,103.5,103.5,23,23,NN,FM,5,"CO Clear Creek Idaho Springs, Squaw Mountain W0WYX 146.94 OPEN On-Air"
120,WYXbroomfield,449.825,-,5,Tone,103.5,103.5,23,23,NN,FM,5,CO Boulder Broomfield W0WYX 449.825 OPEN On-Air
121,"DUNidahosprings, squaw mountain",449.45,-,5,Cross,103.5,127.3,23,23,NN,FM,5,"CO Clear Creek Idaho Springs, Squaw Mountain K1DUN 449.45 OPEN On-Air"
122,"0TXidahosprings, centennial cone",145.49,-,0.6,TSQL,100,100,23,23,NN,FM,5,"CO Jefferson Idaho Springs, Centennial Cone W0TX 145.49 OPEN On-Air"
123,"0TXidahosprings, squaw mountain",449.35,-,5,TSQL,100,100,23,23,NN,FM,5,"CO Clear Creek Idaho Springs, Squaw Mountain W0TX 449.35 OPEN On-Air"
124,"0TXdenver,centennial cone",446.7875,-,5,,88.5,88.5,23,23,NN,DIG,5,"CO Jefferson Denver, Centennial Cone W0TX 446.7875 OPEN On-Air"
125,"0TXgolden,centennial cone",448.625,-,5,TSQL,100,100,23,23,NN,FM,5,"CO Jefferson Golden, Centennial Cone W0TX 448.625 OPEN On-Air"
126,"0TXlakewood,green mountain",53.09,-,1.7,Tone,107.2,107.2,23,23,NN,FM,5,"CO Jefferson Lakewood, Green Mountain W0TX 53.09 OPEN On-Air"
127,"0TXlakewood,st anthony medical campus",447.825,-,5,DTCS,88.5,88.5,73,73,NN,NFM,5,"CO Jefferson Lakewood, St Anthony Medical Campus W0TX 447.825 OPEN On-Air"
128,"0TXlakewood,green mountain",147.33,+,0.6,Tone,100,100,23,23,NN,FM,5,"CO Jefferson Lakewood, Green Mountain W0TX 147.33 OPEN On-Air"
129,"0TXlakewood,green mountain",224.38,-,1.6,TSQL,100,100,23,23,NN,FM,5,"CO Jefferson Lakewood, Green Mountain W0TX 224.38 OPEN On-Air"
130,"0TXlakewood,green mtn",449.775,-,5,TSQL,100,100,23,23,NN,DIG,5,"CO Jefferson Lakewood, Green Mtn W0TX 449.775 OPEN On-Air"
131,"UDDidahosprings, squaw mountain",146.67,-,0.6,TSQL,100,100,23,23,NN,FM,5,"CO Clear Creek Idaho Springs, Squaw Mountain KB0UDD 146.67 OPEN On-Air"
132,"UDDaurora,smokey hill",448.5,-,5,Tone,100,100,23,23,NN,FM,5,"CO Denver Aurora, Smokey Hill KB0UDD 448.5 OPEN On-Air"
133,"UDDaurora,smoky hill",145.4,-,0.8,Tone,100,100,23,23,NN,FM,5,"CO Arapahoe Aurora, Smoky Hill KB0UDD 145.4 OPEN On-Air"
134,"PYYevergreen,squaw mountain",147.3,+,0.6,TSQL,103.5,103.5,23,23,NN,FM,5,"CO Clear Creek Evergreen, Squaw Mountain N0PYY 147.3 OPEN On-Air"
135,PYYgolden,448.125,-,5,Tone,107.2,107.2,23,23,NN,FM,5,CO Jefferson Golden N0PYY 448.125 OPEN On-Air
136,PYYgolden,927.7875,-,25,Tone,156.7,156.7,23,23,NN,FM,5,CO Jefferson Golden N0PYY 927.7875 OPEN On-Air
137,"CFIidahosprings, squaw mountain",448.675,-,5,TSQL,100,100,23,23,NN,FM,5,"CO Denver Idaho Springs, Squaw Mountain W0CFI 448.675 OPEN On-Air"
138,"0KQevergreen,saddleback mountain",447.85,-,5,TSQL,141.3,141.3,23,23,NN,FM,5,"CO Clear Creek Evergreen, Saddleback Mountain AC0KQ 447.85 OPEN On-Air"
139,"AENidahosprings, squaw mountain",449,-,5,TSQL,136.5,136.5,23,23,NN,FM,5,"CO Clear Creek Idaho Springs, Squaw Mountain WR0AEN 449 OPEN On-Air"
140,AENdenver,449.65,-,5,Tone,136.5,136.5,23,23,NN,DIG,5,CO Denver Denver WR0AEN 449.65 OPEN On-Air
141,AENdenver,449.675,-,5,Tone,136.5,136.5,23,23,NN,DIG,5,CO Denver Denver WR0AEN 449.675 OPEN On-Air
142,AENgreeley,449.325,-,5,Tone,136.5,136.5,23,23,NN,DIG,5,CO Weld Greeley WR0AEN 449.325 OPEN On-Air
143,AENaurora,449.15,-,5,Tone,136.5,136.5,23,23,NN,DIG,5,CO Arapahoe Aurora WR0AEN 449.15 OPEN On-Air
144,"EOClaramie,pilot hill",447.225,-,5,,88.5,88.5,23,23,NN,DIG,5,"WY Albany Laramie, Pilot Hill WY7EOC 447.225 CLOSED On-Air"
145,EOCrawlins,445.05,-,5,,88.5,88.5,23,23,NN,DIG,5,WY Carbon Rawlins WY7EOC 445.05 CLOSED On-Air
146,"EOCcasper,casper mountain",449.9875,-,5,,88.5,88.5,23,23,NN,DIG,5,"WY Natrona Casper, Casper Mountain WY7EOC 449.9875 CLOSED On-Air"
147,"QEYfortcollins, csu durward hall",446.8125,-,5,,88.5,88.5,23,23,NN,DIG,5,"CO Larimer Fort Collins, CSU Durward Hall W0QEY 446.8125 OPEN On-Air"
148,"QEYfortcollins, csu durward hall",449.85,-,5,TSQL,100,100,23,23,NN,FM,5,"CO Larimer Fort Collins, CSU Durward Hall W0QEY 449.85 OPEN On-Air"
149,"QEYfortcollins, csu durward hall",147.36,+,0.6,TSQL,100,100,23,23,NN,FM,5,"CO Larimer Fort Collins, CSU Durward Hall W0QEY 147.36 OPEN On-Air"
150,"UWRlaramie, pilot hill",53.03,-,1,,88.5,88.5,23,23,NN,FM,5,"WY Albany Laramie,  Pilot Hill K7UWR 53.03 OPEN Off-Air"
151,"0HCgolden,centennial cone",927.8375,-,25.8,DTCS,88.5,88.5,205,205,NN,DIG,5,"CO Jefferson Golden, Centennial Cone KI0HC 927.8375 OPEN On-Air"
152,0HCparker,927.8375,-,25.8,Tone,100,100,23,23,NN,DIG,5,CO Douglas Parker KI0HC 927.8375 OPEN On-Air
153,7RFfortcollins,447.725,-,5,Tone,131.8,131.8,23,23,NN,FM,5,CO Larimer Fort Collins W7RF 447.725 OPEN On-Air
154,6VVloveland,224.32,-,1.6,TSQL,100,100,23,23,NN,FM,5,CO Larimer Loveland KN6VV 224.32 OPEN Off-Air
155,RONrawlins,146.7,-,0.6,Tone,162.2,162.2,23,23,NN,FM,5,WY Carbon Rawlins N7RON 146.7 OPEN On-Air
156,RONrawlins,449.8,-,5,Tone,146.2,146.2,23,23,NN,FM,5,WY Carbon Rawlins N7RON 449.8 OPEN 
157,OZUrawlins,146.76,-,0.6,Tone,100,100,23,23,NN,FM,5,WY Carbon Rawlins KC7OZU 146.76 OPEN On-Air
158,7BNrawlins,147.39,+,0.6,Tone,100,100,23,23,NN,FM,5,WY Carbon Rawlins KD7BN 147.39 OPEN On-Air
159,7SUrawlins,448.3,-,5,Tone,100,100,23,23,NN,FM,5,WY Carbon Rawlins KD7SU 448.3 OPEN 
160,"0SJgolden,centennial cone",145.28,-,0.6,Tone,100,100,23,23,NN,FM,5,"CO Jefferson Golden, Centennial Cone KE0SJ 145.28 OPEN On-Air"
161,"0SJgolden,centennial cone",449.525,-,5,,88.5,88.5,23,23,NN,FM,5,"CO Jefferson Golden, Centennial Cone KE0SJ 449.525 OPEN On-Air"
162,"0SJboulder,blue mountain",145.475,-,0.6,Tone,100,100,23,23,NN,FM,5,"CO Jefferson Boulder, Blue Mountain KE0SJ 145.475 OPEN On-Air"
163,0SJlochbuie,447.625,-,5,Tone,100,100,23,23,NN,FM,5,CO Adams Lochbuie KE0SJ 447.625 OPEN On-Air
164,"TUBgolden,centennial cone",146.64,-,0.6,Tone,100,100,23,23,NN,FM,5,"CO Jefferson Golden, Centennial Cone WB0TUB 146.64 OPEN On-Air"
165,"TUBcentennial,warren mountain",146.88,-,0.6,Tone,100,100,23,23,NN,FM,5,"CO Jefferson Centennial, Warren Mountain WB0TUB 146.88 OPEN On-Air"
166,"TUBcentennial,warren mountain",449.6,-,5,Tone,100,100,23,23,NN,FM,5,"CO Jefferson Centennial, Warren Mountain WB0TUB 449.6 OPEN On-Air"
167,"FEZgolden,centennial cone",146.985,-,0.6,TSQL,100,100,23,23,NN,FM,5,"CO Denver Golden, Centennial Cone K0FEZ 146.985 OPEN On-Air"
168,FEZdenver,447.925,-,5,TSQL,100,100,23,23,NN,FM,5,CO Denver Denver K0FEZ 447.925 OPEN On-Air
169,"IBMgolden,guy hill",448.85,-,5,TSQL,88.5,88.5,23,23,NN,FM,5,"CO Jefferson Golden, Guy Hill K0IBM 448.85 OPEN On-Air"
170,"MHUgolden,guy hill",224,-,1.6,TSQL,103.5,103.5,23,23,NN,FM,5,"CO Jefferson Golden, Guy Hill N0MHU 224 OPEN On-Air"
171,"CBIgolden,guy hill",147.15,+,0.6,TSQL,100,100,23,23,NN,FM,5,"CO Jefferson Golden, Guy Hill W0CBI 147.15 OPEN On-Air"
172,"0GOgolden,guy hill",449.75,-,5,TSQL,103.5,103.5,23,23,NN,FM,5,"CO Jefferson Golden, Guy Hill KI0GO 449.75 OPEN On-Air"
173,"POHgolden,guy hill",224.74,-,1.6,TSQL,88.5,88.5,23,23,NN,FM,5,"CO Jefferson Golden, Guy Hill N0POH 224.74 OPEN On-Air"
174,"T0Cgolden,guy hill",145.22,-,0.6,TSQL,103.5,103.5,23,23,NN,DIG,5,"CO Jefferson Golden, Guy Hill WT0C 145.22 OPEN On-Air"
175,ENOlongmont,147.27,+,0.6,TSQL,100,100,23,23,NN,FM,5,CO Boulder Longmont W0ENO 147.27 OPEN On-Air
176,ENOlongmont,448.8,-,5,TSQL,88.5,88.5,23,23,NN,FM,5,CO Boulder Longmont W0ENO 448.8 OPEN On-Air
177,EPAlongmont,448.525,-,5,Tone,151.4,151.4,23,23,NN,FM,5,CO Boulder Longmont N0EPA 448.525 OPEN On-Air
178,SWRcheyenne,448.15,-,5,Tone,100,100,23,23,NN,FM,5,WY Laramie Cheyenne KB7SWR 448.15 OPEN Off-Air
179,SWRcheyenne,145.235,-,0.6,Tone,114.8,114.8,23,23,NN,FM,5,WY Laramie Cheyenne KB7SWR 145.235 OPEN On-Air
180,"UFOfairplay,sacramento mountain",447.125,-,5,TSQL,103.5,103.5,23,23,NN,FM,5,"CO Park Fairplay, Sacramento Mountain KC0UFO 447.125 OPEN On-Air"
181,UPSwellington,448.325,-,5,Tone,110.9,110.9,23,23,NN,FM,5,CO Larimer Wellington WB7UPS 448.325 OPEN On-Air
182,0GVgolden,448.975,-,5,Tone,123,123,23,23,NN,FM,5,CO Jefferson Golden W0GV 448.975 OPEN On-Air
183,"0KUgolden,lookout mountain",449.625,-,5,TSQL,141.3,141.3,23,23,NN,FM,5,"CO Jefferson Golden, Lookout Mountain W0KU 449.625 OPEN On-Air"
184,"DMRfortcollins, timnath",147.39,+,0.6,,88.5,88.5,23,23,NN,DIG,5,"CO Larimer Fort Collins, Timnath W0DMR 147.39 OPEN On-Air"
185,"DMRfortcollins, timnath",446.775,-,5,,88.5,88.5,23,23,NN,DIG,5,"CO Larimer Fort Collins, Timnath W0DMR 446.775 OPEN On-Air"
186,"CDSgolden,lookout mountain",1283.9625,-,20,,88.5,88.5,23,23,NN,DIG,5,"CO Jefferson Golden, Lookout Mountain W0CDS 1283.9625 OPEN On-Air"
187,"CDSgolden,lookout mountain",1299.9,,0,,88.5,88.5,23,23,NN,DIG,5,"CO Jefferson Golden, Lookout Mountain W0CDS 1299.9 OPEN On-Air"
188,"CDSgolden,lookout mountain",145.25,-,0.6,,88.5,88.5,23,23,NN,DIG,5,"CO Jefferson Golden, Lookout Mountain W0CDS 145.25 OPEN On-Air"
189,"CDSgolden,lookout mountain",446.9625,-,5,,88.5,88.5,23,23,NN,DIG,5,"CO Jefferson Golden, Lookout Mountain W0CDS 446.9625 OPEN On-Air"
190,"YZTgolden,lookout",446.8375,-,5,,88.5,88.5,23,23,NN,DIG,5,"CO Jefferson Golden, Lookout WA2YZT 446.8375 OPEN On-Air"
191,GUQevergreen,145.34,-,0.6,Cross,103.5,127.3,23,23,NN,FM,5,CO Jefferson Evergreen KE4GUQ 145.34 OPEN On-Air
192,LMAbroomfield,448.925,-,5,Tone,131.8,131.8,23,23,NN,FM,5,CO Boulder Broomfield W0LMA 448.925 OPEN On-Air
193,"RFIseverance,cactus hill",447.2,-,5,Tone,82.5,82.5,23,23,NN,FM,5,"CO Weld Severance, Cactus Hill N6RFI 447.2 OPEN On-Air"
194,"LXXmorrison,mt. morrison",53.17,-,1.7,Tone,107.2,107.2,23,23,NN,FM,5,"CO Jefferson Morrison, Mt. Morrison N6LXX 53.17 OPEN On-Air"
195,"LXXmorrison,mt. morrison",447.875,-,5,TSQL,107.2,107.2,23,23,NN,FM,5,"CO Jefferson Morrison, Mt. Morrison N6LXX 447.875 OPEN On-Air"
196,"ARAcritchell,critchell mountain",147.12,+,0.6,TSQL,88.5,88.5,23,23,NN,FM,5,"CO Jefferson Critchell, Critchell Mountain N0ARA 147.12 OPEN On-Air"
197,"SSPlakewood,moffat treatment plant",147.21,+,0.6,TSQL,100,100,23,23,NN,FM,5,"CO Jefferson Lakewood, Moffat Treatment Plant KD0SSP 147.21 OPEN On-Air"
198,"SSPlakewood,moffat treatment plant",448.35,-,5,Tone,225.7,225.7,23,23,NN,DIG,5,"CO Jefferson Lakewood, Moffat Treatment Plant KD0SSP 448.35 OPEN On-Air"
199,"0PCbailey,dick mountain",146.895,-,0.6,TSQL,100,100,23,23,NN,FM,5,"CO Park Bailey, Dick Mountain AB0PC 146.895 OPEN On-Air"
200,0SWcollbran,449.5,-,5,Tone,107.2,107.2,23,23,NN,FM,5,CO Mesa Collbran KB0SW 449.5 OPEN Off-Air
201,"0SWloma,baxter pass",447,-,5,Tone,107.2,107.2,23,23,NN,FM,5,"CO Garfield Loma, Baxter Pass KB0SW 447 OPEN On-Air"
202,0SWgrandjunction,449,-,5,Cross,88.5,107.2,23,23,NN,FM,5,CO Mesa Grand Junction KB0SW 449 CLOSED On-Air
