Location,Name,Frequency,Duplex,Offset,Tone,rToneFreq,cToneFreq,DtcsCode,DtcsRxCode,DtcsPolarity,Mode,TStep,Comment
417,"SDCsunnyside,bruin point",147.32,+,0.6,Tone,88.5,88.5,23,23,NN,FM,5,"UT Carbon Sunnyside, Bruin Point K7SDC 147.32 OPEN On-Air"
418,"SDCsunnyside,bruin point",449.05,-,5,Tone,88.5,88.5,23,23,NN,FM,5,"UT Carbon Sunnyside, Bruin Point K7SDC 449.05 OPEN On-Air"
419,"SDCcastledale, cedar mountain",147.14,+,0.6,Tone,88.5,88.5,23,23,NN,FM,5,"UT Emery Castle Dale, Cedar Mountain K7SDC 147.14 OPEN On-Air"
420,"SDCcastledale, cedar mountain",448.55,-,5,Tone,88.5,88.5,23,23,NN,FM,5,"UT Emery Castle Dale, Cedar Mountain K7SDC 448.55 OPEN On-Air"
421,"SDCmonticello,abajo peak",146.61,-,0.6,Tone,88.5,88.5,23,23,NN,FM,5,"UT San Juan Monticello, Abajo Peak K7SDC 146.61 OPEN On-Air"
422,"SDChanksville,ellen peak",147.08,+,0.6,Tone,136.5,136.5,23,23,NN,FM,5,"UT Wayne Hanksville, Ellen Peak K7SDC 147.08 OPEN On-Air"
423,"X7Ysunnyside, bruin peak",145.175,-,0.6,,88.5,88.5,23,23,NN,FM,5,"UT Carbon Sunny Side, Bruin Peak WX7Y 145.175 OPEN On-Air"
424,"DMOriverton,griffy hill",441.67,+,5,,88.5,88.5,23,23,NN,DIG,5,"WY Fremont Riverton, Griffy Hill N7DMO 441.67 OPEN On-Air"
425,"RTSgenoa,limon",446.7375,-,5,,88.5,88.5,23,23,NN,DIG,5,"CO Lincoln Genoa, Limon K0RTS 446.7375 OPEN On-Air"
426,J0Tpueblo,147.24,+,0.6,Tone,103.5,103.5,23,23,NN,FM,5,CO Pueblo Pueblo KJ0T 147.24 OPEN Off-Air
427,0AEgenoa,147.06,+,0.6,Tone,103.5,103.5,23,23,NN,DIG,5,CO Lincoln Genoa KE0AE 147.06 OPEN On-Air
428,G0Nscottsbluff,146.445,,0,TSQL,88.5,88.5,23,23,NN,FM,5,NE Scotts Bluff Scottsbluff AG0N 146.445 OPEN On-Air
429,"ITTsilverton,engineer mountain",147.27,+,0.6,Tone,127.3,127.3,23,23,NN,FM,5,"CO San Juan Silverton, Engineer Mountain KB5ITT 147.27 OPEN On-Air"
430,FSXpunkincenter,449.9,-,5,Tone,107.2,107.2,23,23,NN,FM,5,CO Lincoln Punkin Center N1FSX 449.9 OPEN On-Air
431,VJDhugo,447,-,5,Tone,103.5,103.5,23,23,NN,DIG,5,CO Lincoln Hugo KC0VJD 447 OPEN On-Air
432,"DSOvernal,tabby mountain",147.34,+,0.6,Tone,136.5,136.5,23,23,NN,FM,5,"UT Uintah Vernal, Tabby Mountain KG7DSO 147.34 OPEN On-Air"
433,"VVQkemmerer,quealy peak",147.09,+,0.6,Tone,100,100,23,23,NN,FM,5,"WY Lincoln Kemmerer, Quealy Peak KG7VVQ 147.09 OPEN On-Air"
434,"SHXkemmerer,quealy peak",449.825,-,5,,88.5,88.5,23,23,NN,FM,5,"WY Lincoln Kemmerer, Quealy Peak KA7SHX 449.825 OPEN On-Air"
435,EHEkemmerer,449.075,-,5,Cross,88.5,123,23,23,NN,FM,5,WY Lincoln Kemmerer KF7EHE 449.075 OPEN Off-Air
436,"CEUprice, wood hill",145.43,-,0.6,Tone,88.5,88.5,23,23,NN,FM,5,"UT Carbon Price,  Wood Hill W7CEU 145.43 OPEN "
437,"CEUprice, wood hill",224.5,-,1.6,Tone,88.5,88.5,23,23,NN,FM,5,"UT Carbon Price,  Wood Hill W7CEU 224.5 OPEN "
438,"CEUprice, wood hill",448.3,-,5,Tone,88.5,88.5,23,23,NN,FM,5,"UT Carbon Price,  Wood Hill W7CEU 448.3 OPEN "
439,"7GXprice,wood hill",147.2,+,0.6,Tone,88.5,88.5,23,23,NN,FM,5,"UT Carbon Price, Wood Hill K7GX 147.2 OPEN On-Air"
440,"7GXprice,wood hill",448.3,-,5,,88.5,88.5,23,23,NN,FM,5,"UT Carbon Price, Wood Hill K7GX 448.3 OPEN "
441,"7YIprice,cedar mountain",448.075,-,5,,88.5,88.5,23,23,NN,DIG,5,"UT Carbon Price, Cedar Mountain K7YI 448.075 OPEN Off-Air"
442,"7YIcastledale, cedar mountain",447.125,-,5,Tone,100,100,23,23,NN,FM,5,"UT Emery Castle Dale, Cedar Mountain K7YI 447.125 CLOSED "
443,"BJYbigpiney,  the hogsback",146.88,-,0.6,Tone,100,100,23,23,NN,FM,5,"WY Sublette Big Piney,  The Hogsback KC7BJY 146.88 OPEN On-Air"
444,BJYmarbleton,145.145,-,0.6,Tone,100,100,23,23,NN,FM,5,WY Sublette Marbleton KC7BJY 145.145 OPEN On-Air
445,"BJYpinedale,mt airy",448.1,-,5,Tone,100,100,23,23,NN,FM,5,"WY Sublette Pinedale, Mt Airy KC7BJY 448.1 OPEN Off-Air"
446,"7YPpinedale,mt airy",146.775,-,0.6,,88.5,88.5,23,23,NN,FM,5,"WY Sublette Pinedale, Mt Airy W7YP 146.775 OPEN Off-Air"
447,VHZalliance,147.015,+,0.6,,88.5,88.5,23,23,NN,FM,5,NE Box Butte Alliance N2VHZ 147.015 OPEN On-Air
448,"ITFlajunta, north la junta",147.36,+,0.6,Cross,88.5,123,23,23,NN,DIG,5,"CO Otero La Junta, North La Junta KC0ITF 147.36 PRIVATE On-Air"
449,"ITFlajunta, north la junta",446.75,-,5,,88.5,88.5,23,23,NN,DIG,5,"CO Otero La Junta, North La Junta KC0ITF 446.75 PRIVATE On-Air"
450,"FLOchadron,nebraska national forest",147.36,+,0.6,TSQL,123,123,23,23,NN,FM,5,"NE Dawes Chadron, Nebraska National Forest W0FLO 147.36 OPEN On-Air"
451,FLOchadron,145.62,,0,TSQL,100,100,23,23,NN,FM,5,NE Dawes Chadron W0FLO 145.62 OPEN On-Air
