Location,Name,Frequency,Duplex,Offset,Tone,rToneFreq,cToneFreq,DtcsCode,DtcsRxCode,DtcsPolarity,Mode,TStep,Comment
57,N1UPS Westminster 4493 ,449.3,-,5,Tone,100,88.5,23,23,NN,FM,5,CO Adams Westminster N1UPS 449.3
58,"W0DK Boulder, Table Mesa 4489 ",448.9,-,5,Tone,100,88.5,23,23,NN,FM,5,"CO Boulder Boulder, Table Mesa W0DK 448.9"
59,"W0DK Boulder, Table Mountain 1467 ",146.7,-,0.6,Tone,100,88.5,23,23,NN,FM,5,"CO Boulder Boulder, Table Mountain W0DK 146.7"
60,"KD0MRC Maysville, CO 145325 ",145.325,-,0.6,Tone,100,88.5,23,23,NN,FM,5,"CO Chaffee Maysville, CO KD0MRC 145.325"
61,"K0JSC Salida, Methodist Mountain 449975 ",449.975,-,5,TSQL,100,100,23,23,NN,FM,5,"CO Chaffee Salida, Methodist Mountain K0JSC 449.975"
62,"KB0VJJ Salida, Methodist Mountain 147285 ",147.285,+,0.6,Cross,88.5,123,23,23,NN,FM,5,"CO Chaffee Salida, Methodist Mountain KB0VJJ 147.285"
63,"KC0CVU Salida, Methodist Mountain 145295 ",145.295,-,0.6,Tone,107.2,88.5,23,23,NN,FM,5,"CO Chaffee Salida, Methodist Mountain KC0CVU 145.295"
64,"KC0CVU Salida, Methodist Mountain 44965 ",449.65,-,5,Tone,107.2,88.5,23,23,NN,FM,5,"CO Chaffee Salida, Methodist Mountain KC0CVU 449.65"
65,"WZ0N Salida, Methodist Mountain 449925 ",449.925,-,5,TSQL,103.5,103.5,23,23,NN,FM,5,"CO Chaffee Salida, Methodist Mountain WZ0N 449.925"
66,"AC0KQ Evergreen, Saddleback Mountain 44785 ",447.85,-,5,TSQL,141.3,141.3,23,23,NN,FM,5,"CO Clear Creek Evergreen, Saddleback Mountain AC0KQ 447.85"
67,"N0PYY Evergreen, Squaw Mountain 1473 ",147.3,+,0.6,TSQL,103.5,103.5,23,23,NN,FM,5,"CO Clear Creek Evergreen, Squaw Mountain N0PYY 147.3"
68,"K1DUN Idaho Springs, Squaw Mountain 44945 ",449.45,-,5,Cross,103.5,127.3,23,23,NN,FM,5,"CO Clear Creek Idaho Springs, Squaw Mountain K1DUN 449.45"
69,"KB0UDD Idaho Springs, Squaw Mountain 14667 ",146.67,-,0.6,TSQL,100,100,23,23,NN,FM,5,"CO Clear Creek Idaho Springs, Squaw Mountain KB0UDD 146.67"
70,"N0SZ Idaho Springs, Squaw Mountain 448225 ",448.225,-,5,TSQL,141.3,141.3,23,23,NN,FM,5,"CO Clear Creek Idaho Springs, Squaw Mountain N0SZ 448.225"
71,"W0CRA Idaho Springs, Squaw Mountain 145145 ",145.145,-,0.6,TSQL,107.2,107.2,23,23,NN,FM,5,"CO Clear Creek Idaho Springs, Squaw Mountain W0CRA 145.145"
72,"W0CRA Idaho Springs, Squaw Mountain 447575 ",447.575,-,5,TSQL,107.2,107.2,23,23,NN,FM,5,"CO Clear Creek Idaho Springs, Squaw Mountain W0CRA 447.575"
73,"W0TX Idaho Springs, Squaw Mountain 44935 ",449.35,-,5,TSQL,100,100,23,23,NN,FM,5,"CO Clear Creek Idaho Springs, Squaw Mountain W0TX 449.35"
74,"W0WYX Idaho Springs, Squaw Mountain 14694 ",146.94,-,0.6,TSQL,103.5,103.5,23,23,NN,FM,5,"CO Clear Creek Idaho Springs, Squaw Mountain W0WYX 146.94"
75,"WR0AEN Idaho Springs, Squaw Mountain 449 ",449,-,5,TSQL,136.5,136.5,23,23,NN,FM,5,"CO Clear Creek Idaho Springs, Squaw Mountain WR0AEN 449"
76,"KC0CVU Pueblo, Deer Peak 449625 ",449.625,-,5,Tone,107.2,88.5,23,23,NN,FM,5,"CO Custer Pueblo, Deer Peak KC0CVU 449.625"
77,K0JSC Westcliffe 448325 ,448.325,-,5,TSQL,100,100,23,23,NN,FM,5,CO Custer Westcliffe K0JSC 448.325
78,KB0TUC Westcliffe 14706 ,147.06,+,0.6,TSQL,77,77,23,23,NN,FM,5,CO Custer Westcliffe KB0TUC 147.06
79,KB0TUC Westcliffe 44815 ,448.15,-,5,TSQL,103.5,103.5,23,23,NN,FM,5,CO Custer Westcliffe KB0TUC 448.15
80,KI0MR Paonia 14733 ,147.33,+,0.6,Tone,107.2,88.5,23,23,NN,FM,5,CO Delta Paonia KI0MR 147.33
81,K0FEZ Denver 447925 ,447.925,-,5,TSQL,100,100,23,23,NN,FM,5,CO Denver Denver K0FEZ 447.925
82,N0JXN Denver 146715 ,146.715,-,0.6,TSQL,123,123,23,23,NN,FM,5,CO Denver Denver N0JXN 146.715
83,N5EHP Denver 448075 ,448.075,-,5,Tone,123,88.5,23,23,NN,FM,5,CO Denver Denver N5EHP 448.075
84,"W0JRL Denver, Broadway Plaza Lofts 447175 ",447.175,-,5,TSQL,100,100,23,23,NN,FM,5,"CO Denver Denver, Broadway Plaza Lofts W0JRL 447.175"
85,"K0FEZ Golden, Centennial Cone 146985 ",146.985,-,0.6,TSQL,100,100,23,23,NN,FM,5,"CO Denver Golden, Centennial Cone K0FEZ 146.985"
86,"W0CFI Idaho Springs, Squaw Mountain 448675 ",448.675,-,5,TSQL,100,100,23,23,NN,FM,5,"CO Denver Idaho Springs, Squaw Mountain W0CFI 448.675"
87,"WG0N Idaho Springs, Squaw Mountain 44905 ",449.05,-,5,TSQL,107.2,107.2,23,23,NN,FM,5,"CO Denver Idaho Springs, Squaw Mountain WG0N 449.05"
88,"W9SL Castle Pines, Daniels Park 44995 ",449.95,-,5,TSQL,77,77,23,23,NN,FM,5,"CO Douglas Castle Pines, Daniels Park W9SL 449.95"
89,"N0ESQ Castle Rock, Devils Head (Pike National Forest) 447525 ",447.525,-,5,TSQL,146.2,146.2,23,23,NN,FM,5,"CO Douglas Castle Rock, Devils Head (Pike National Forest) N0ESQ 447.525"
90,"K0JSC Larkspur, Westcreek 449975 ",449.975,-,5,TSQL,100,100,23,23,NN,FM,5,"CO Douglas Larkspur, Westcreek K0JSC 449.975"
91,"W0CRA Larkspur, Westcreek 147225 ",147.225,+,0.6,TSQL,107.2,107.2,23,23,NN,FM,5,"CO Douglas Larkspur, Westcreek W0CRA 147.225"
92,"W0CRA Larkspur, Westcreek 448425 ",448.425,-,5,TSQL,107.2,107.2,23,23,NN,FM,5,"CO Douglas Larkspur, Westcreek W0CRA 448.425"
93,"N0XLF Palmer Lake, Monument Hill 14519 ",145.19,-,0.6,TSQL,131.8,131.8,23,23,NN,FM,5,"CO Douglas Palmer Lake, Monument Hill N0XLF 145.19"
94,WQ8M Parker 4487 ,448.7,-,5,Tone,146.2,88.5,23,23,NN,FM,5,CO Douglas Parker WQ8M 448.7
95,"N0ESQ Parker, Hess Reservoir 447525 ",447.525,-,5,Cross,203.5,146.2,23,23,NN,FM,5,"CO Douglas Parker, Hess Reservoir N0ESQ 447.525"
96,KB0VJJ Vail 147345 ,147.345,+,0.6,Cross,88.5,123,23,23,NN,FM,5,CO Eagle Vail KB0VJJ 147.345
97,N0AFO Vail 2248 ,224.8,-,1.6,,88.5,88.5,23,23,NN,FM,5,CO Eagle Vail N0AFO 224.8
98,"K0RV Vail, Bald Mountain 14661 ",146.61,-,0.6,Tone,107.2,88.5,23,23,NN,FM,5,"CO Eagle Vail, Bald Mountain K0RV 146.61"
99, Colorado Springs 14727 ,147.27,+,0.6,,88.5,88.5,23,23,NN,FM,5,CO El Paso Colorado Springs  147.27
100,AA0L Colorado Springs 147135 ,147.135,+,0.6,Tone,100,88.5,23,23,NN,FM,5,CO El Paso Colorado Springs AA0L 147.135
101,AA0L Colorado Springs 4483 ,448.3,-,5,Tone,100,88.5,23,23,NN,FM,5,CO El Paso Colorado Springs AA0L 448.3
102,K0IRP Colorado Springs 14691 ,146.91,-,0.6,TSQL,151.4,151.4,23,23,NN,FM,5,CO El Paso Colorado Springs K0IRP 146.91
103,K0IRP Colorado Springs 44735 ,447.35,-,5,Tone,151.4,88.5,23,23,NN,FM,5,CO El Paso Colorado Springs K0IRP 447.35
104,NX0G Colorado Springs 447475 ,447.475,-,5,Tone,107.2,88.5,23,23,NN,FM,5,CO El Paso Colorado Springs NX0G 447.475
105,W0MOG Colorado Springs 14739 ,147.39,+,0.6,Tone,103.5,88.5,23,23,NN,FM,5,CO El Paso Colorado Springs W0MOG 147.39
106,W0MOG Colorado Springs 4486 ,448.6,-,5,Tone,114.8,88.5,23,23,NN,FM,5,CO El Paso Colorado Springs W0MOG 448.6
107,W0RSH Colorado Springs 14685 ,146.85,-,0.6,Tone,103.5,88.5,23,23,NN,FM,5,CO El Paso Colorado Springs W0RSH 146.85
108,WA6IFI Colorado Springs 44755 ,447.55,-,5,Tone,123,88.5,23,23,NN,FM,5,CO El Paso Colorado Springs WA6IFI 447.55
109,"N0KG Colorado Springs, Broadmoor Area 44825 ",448.25,-,5,Tone,123,88.5,23,23,NN,FM,5,"CO El Paso Colorado Springs, Broadmoor Area N0KG 448.25"
110,"KB0VJJ Colorado Springs, Cheyenne Mountain 14513 ",145.13,-,0.6,Cross,88.5,123,23,23,NN,FM,5,"CO El Paso Colorado Springs, Cheyenne Mountain KB0VJJ 145.13"
111,"KC0CVU Colorado Springs, Cheyenne Mountain 14676 ",146.76,-,0.6,TSQL,107.2,107.2,23,23,NN,FM,5,"CO El Paso Colorado Springs, Cheyenne Mountain KC0CVU 146.76"
112,"KC0CVU Colorado Springs, Cheyenne Mountain 147345 ",147.345,+,0.6,TSQL,107.2,107.2,23,23,NN,FM,5,"CO El Paso Colorado Springs, Cheyenne Mountain KC0CVU 147.345"
113,"KC0CVU Colorado Springs, Cheyenne Mountain 448 ",448,-,5,Tone,107.2,88.5,23,23,NN,FM,5,"CO El Paso Colorado Springs, Cheyenne Mountain KC0CVU 448"
114,"KC0CVU Colorado Springs, Cheyenne Mountain 4481 ",448.1,-,5,TSQL,107.2,107.2,23,23,NN,FM,5,"CO El Paso Colorado Springs, Cheyenne Mountain KC0CVU 448.1"
115,"W0CRA Colorado Springs, Cheyenne Mountain 14516 ",145.16,-,0.6,TSQL,107.2,107.2,23,23,NN,FM,5,"CO El Paso Colorado Springs, Cheyenne Mountain W0CRA 145.16"
116,"KA0TTF Colorado Springs, Fillmore Hill 448725 ",448.725,-,5,Tone,123,88.5,23,23,NN,FM,5,"CO El Paso Colorado Springs, Fillmore Hill KA0TTF 448.725"
117,"KB0SRJ Colorado Springs, Pikes Peak 14697 ",146.97,-,0.6,Cross,100,123,23,23,NN,FM,5,"CO El Paso Colorado Springs, Pikes Peak KB0SRJ 146.97"
118,"KB0SRJ Colorado Springs, Pikes Peak 44845 ",448.45,-,5,Tone,100,88.5,23,23,NN,FM,5,"CO El Paso Colorado Springs, Pikes Peak KB0SRJ 448.45"
119,W0MOG Colorado springs 22472 ,224.72,-,1.6,TSQL,103.5,103.5,23,23,NN,FM,5,CO El Paso Colorado springs W0MOG 224.72
120,"KD0MDP Falcon, Black Forest 447625 ",447.625,-,5,TSQL,100,100,23,23,NN,FM,5,"CO El Paso Falcon, Black Forest KD0MDP 447.625"
121,"K0NR Monument, Monument Hill 447725 ",447.725,-,5,TSQL,100,100,23,23,NN,FM,5,"CO El Paso Monument, Monument Hill K0NR 447.725"
122,"K0JSC Canon City, Canon City 449975 ",449.975,-,5,TSQL,100,100,23,23,NN,FM,5,"CO Fremont Canon City, Canon City K0JSC 449.975"
123,"K0JSC Canon City, Colorado 447975 ",447.975,-,5,TSQL,100,100,23,23,NN,FM,5,"CO Fremont Canon City, Colorado K0JSC 447.975"
124,"K0JSC Canon City, Fremont Peak 44725 ",447.25,-,5,TSQL,100,100,23,23,NN,FM,5,"CO Fremont Canon City, Fremont Peak K0JSC 447.25"
125,"WD0EKR Canon City, Fremont Peak 14549 ",145.49,-,0.6,TSQL,103.5,103.5,23,23,NN,FM,5,"CO Fremont Canon City, Fremont Peak WD0EKR 145.49"
126,"WD0EKR Canon City, Fremont Peak 22396 ",223.96,-,1.6,TSQL,103.5,103.5,23,23,NN,FM,5,"CO Fremont Canon City, Fremont Peak WD0EKR 223.96"
127,"WD0EKR Canon City, Fremont Peak 44775 ",447.75,-,5,TSQL,103.5,103.5,23,23,NN,FM,5,"CO Fremont Canon City, Fremont Peak WD0EKR 447.75"
128,"WB0WDF Canon City, eightmile Mountain 449 ",449,-,5,TSQL,67,67,23,23,NN,FM,5,"CO Fremont Canon City, eightmile Mountain WB0WDF 449"
129,"K0ELK Carbondale, Four Mile Ridge 449725 ",449.725,-,5,Tone,179.9,88.5,23,23,NN,FM,5,"CO Garfield Carbondale, Four Mile Ridge K0ELK 449.725"
130,"K0SNO Carbondale, Four Mile Ridge 14739 ",147.39,+,0.6,Tone,107.2,88.5,23,23,NN,FM,5,"CO Garfield Carbondale, Four Mile Ridge K0SNO 147.39"
131,"K0VQ Carbondale, Missouri Heights 44715 ",447.15,-,5,Tone,136.5,88.5,23,23,NN,FM,5,"CO Garfield Carbondale, Missouri Heights K0VQ 447.15"
132,"WA4HND Glenwood Springs, Lookout Mountain 44985 ",449.85,-,5,TSQL,131.8,131.8,23,23,NN,FM,5,"CO Garfield Glenwood Springs, Lookout Mountain WA4HND 449.85"
133,"KB0VJJ Glenwood Springs, Sunlight Peak 14685 ",146.85,-,0.6,Cross,88.5,123,23,23,NN,FM,5,"CO Garfield Glenwood Springs, Sunlight Peak KB0VJJ 146.85"
134,"KI0G Glenwood Springs, Sunlight Peak 14688 ",146.88,-,0.6,Tone,107.2,88.5,23,23,NN,FM,5,"CO Garfield Glenwood Springs, Sunlight Peak KI0G 146.88"
135,"KI0G Glenwood Springs, Sunlight Peak 4471 ",447.1,-,5,Tone,107.2,88.5,23,23,NN,FM,5,"CO Garfield Glenwood Springs, Sunlight Peak KI0G 447.1"
136,"N0XLI Glenwood Springs, Sunlight Peak 4496 ",449.6,-,5,Tone,107.2,88.5,23,23,NN,FM,5,"CO Garfield Glenwood Springs, Sunlight Peak N0XLI 449.6"
137,"KB0VJJ Boulder, Thorodin Mountain 14531 ",145.31,-,0.6,Cross,88.5,123,23,23,NN,FM,5,"CO Gilpin Boulder, Thorodin Mountain KB0VJJ 145.31"
138,"N0SZ Denver, Thorodin Mountain 449225 ",449.225,-,5,TSQL,141.3,141.3,23,23,NN,FM,5,"CO Gilpin Denver, Thorodin Mountain N0SZ 449.225"
139,W0RM Rollinsville 2246 ,224.6,-,1.6,Tone,100,88.5,23,23,NN,FM,5,CO Gilpin Rollinsville W0RM 224.6
140,KA0YDW Granby 14682 ,146.82,-,0.6,Tone,123,88.5,23,23,NN,FM,5,CO Grand Granby KA0YDW 146.82
141,"KB0VJJ Kremmling, Santoy Peak 147075 ",147.075,+,0.6,Cross,88.5,123,23,23,NN,FM,5,"CO Grand Kremmling, Santoy Peak KB0VJJ 147.075"
142,WA4CCC Winter Park 44745 ,447.45,-,5,Tone,103.5,88.5,23,23,NN,FM,5,CO Grand Winter Park WA4CCC 447.45
143,"KB0VJJ Winter Park, Winter Park 147285 ",147.285,+,0.6,Cross,88.5,123,23,23,NN,FM,5,"CO Grand Winter Park, Winter Park KB0VJJ 147.285"
144,K5GF Gunnison 44995 ,449.95,-,5,,88.5,88.5,23,23,NN,FM,5,CO Gunnison Gunnison K5GF 449.95
145,W0VTL Gunnison 14712 ,147.12,+,0.6,,88.5,88.5,23,23,NN,FM,5,CO Gunnison Gunnison W0VTL 147.12
146,"KB0YNA Gunnison, W Mountain or Tenderfoot Mountain 44765 ",447.65,-,5,TSQL,151.4,151.4,23,23,NN,FM,5,"CO Gunnison Gunnison, W Mountain or Tenderfoot Mountain KB0YNA 447.65"
147,"KB5ITS Lake City, Hill 71 147135 ",147.135,-,0.6,Tone,123,88.5,23,23,NN,FM,5,"CO Hinsdale Lake City, Hill 71 KB5ITS 147.135"
148,"KE0SJ Boulder, Blue Mountain 145475 ",145.475,-,0.6,Tone,100,88.5,23,23,NN,FM,5,"CO Jefferson Boulder, Blue Mountain KE0SJ 145.475"
149,"WB0TUB Centennial, Warren Mountain 14688 ",146.88,-,0.6,Tone,100,88.5,23,23,NN,FM,5,"CO Jefferson Centennial, Warren Mountain WB0TUB 146.88"
150,"WB0TUB Centennial, Warren Mountain 4496 ",449.6,-,5,Tone,100,88.5,23,23,NN,FM,5,"CO Jefferson Centennial, Warren Mountain WB0TUB 449.6"
151,"N0OWY Conifer, Critchell Mountain 4475 ",447.5,-,5,TSQL,88.5,88.5,23,23,NN,FM,5,"CO Jefferson Conifer, Critchell Mountain N0OWY 447.5"
152,"N0ARA Critchell, Critchell Mountain 14712 ",147.12,+,0.6,TSQL,88.5,88.5,23,23,NN,FM,5,"CO Jefferson Critchell, Critchell Mountain N0ARA 147.12"
153,KE4GUQ Evergreen 14534 ,145.34,-,0.6,Cross,103.5,127.3,23,23,NN,FM,5,CO Jefferson Evergreen KE4GUQ 145.34
154,N0PYY Golden 448125 ,448.125,-,5,Tone,107.2,88.5,23,23,NN,FM,5,CO Jefferson Golden N0PYY 448.125
155,W0GV Golden 448975 ,448.975,-,5,Tone,123,88.5,23,23,NN,FM,5,CO Jefferson Golden W0GV 448.975
156,"KE0SJ Golden, Centennial Cone 14528 ",145.28,-,0.6,Tone,100,88.5,23,23,NN,FM,5,"CO Jefferson Golden, Centennial Cone KE0SJ 145.28"
157,"KE0SJ Golden, Centennial Cone 449525 ",449.525,-,5,,88.5,88.5,23,23,NN,FM,5,"CO Jefferson Golden, Centennial Cone KE0SJ 449.525"
158,"W0TX Golden, Centennial Cone 448625 ",448.625,-,5,TSQL,100,100,23,23,NN,FM,5,"CO Jefferson Golden, Centennial Cone W0TX 448.625"
159,"WB0TUB Golden, Centennial Cone 14664 ",146.64,-,0.6,Tone,100,88.5,23,23,NN,FM,5,"CO Jefferson Golden, Centennial Cone WB0TUB 146.64"
160,"K0IBM Golden, Guy Hill 44885 ",448.85,-,5,TSQL,88.5,88.5,23,23,NN,FM,5,"CO Jefferson Golden, Guy Hill K0IBM 448.85"
161,"KI0GO Golden, Guy Hill 44975 ",449.75,-,5,TSQL,103.5,103.5,23,23,NN,FM,5,"CO Jefferson Golden, Guy Hill KI0GO 449.75"
162,"N0MHU Golden, Guy Hill 224 ",224,-,1.6,TSQL,103.5,103.5,23,23,NN,FM,5,"CO Jefferson Golden, Guy Hill N0MHU 224"
163,"N0POH Golden, Guy Hill 22474 ",224.74,-,1.6,TSQL,88.5,88.5,23,23,NN,FM,5,"CO Jefferson Golden, Guy Hill N0POH 224.74"
164,"W0CBI Golden, Guy Hill 14715 ",147.15,+,0.6,TSQL,100,100,23,23,NN,FM,5,"CO Jefferson Golden, Guy Hill W0CBI 147.15"
165,"W0KU Golden, Lookout Mountain 449625 ",449.625,-,5,TSQL,141.3,141.3,23,23,NN,FM,5,"CO Jefferson Golden, Lookout Mountain W0KU 449.625"
166,"W0TX Idaho Springs, Centennial Cone 14549 ",145.49,-,0.6,TSQL,100,100,23,23,NN,FM,5,"CO Jefferson Idaho Springs, Centennial Cone W0TX 145.49"
167,N0ELY Lakewood 44875 ,448.75,-,5,TSQL,100,100,23,23,NN,FM,5,CO Jefferson Lakewood N0ELY 448.75
168,"W0TX Lakewood, Green Mountain 14733 ",147.33,+,0.6,Tone,100,88.5,23,23,NN,FM,5,"CO Jefferson Lakewood, Green Mountain W0TX 147.33"
169,"W0TX Lakewood, Green Mountain 22438 ",224.38,-,1.6,TSQL,100,100,23,23,NN,FM,5,"CO Jefferson Lakewood, Green Mountain W0TX 224.38"
170,"W0TX Lakewood, St Anthony Medical Campus 447825 ",447.825,-,5,DTCS,88.5,88.5,73,73,NN,NFM,5,"CO Jefferson Lakewood, St Anthony Medical Campus W0TX 447.825"
171,"N6LXX Morrison, Mt. Morrison 447875 ",447.875,-,5,TSQL,107.2,107.2,23,23,NN,FM,5,"CO Jefferson Morrison, Mt. Morrison N6LXX 447.875"
172,"KB0VJJ Leadville, Mosquito Pass 145445 ",145.445,-,0.6,Tone,88.5,88.5,23,23,NN,FM,5,"CO Lake Leadville, Mosquito Pass KB0VJJ 145.445"
173,"N0PKT Creede, Bristol Head 449525 ",449.525,-,5,TSQL,100,100,23,23,NN,FM,5,"CO Mineral Creede, Bristol Head N0PKT 449.525"
174,"KB0YNA Montrose, Waterdog Peak 44865 ",448.65,-,5,TSQL,88.5,151.4,23,23,NN,FM,5,"CO Montrose Montrose, Waterdog Peak KB0YNA 448.65"
175,"WA4HND Montrose, Waterdog Peak 4472 ",447.2,-,5,TSQL,107.2,107.2,23,23,NN,FM,5,"CO Montrose Montrose, Waterdog Peak WA4HND 447.2"
176,"AB0PC Bailey, Dick Mountain 146895 ",146.895,-,0.6,TSQL,100,100,23,23,NN,FM,5,"CO Park Bailey, Dick Mountain AB0PC 146.895"
177,"WZ0N Fairplay, Sacramento Mountain 447125 ",447.125,-,5,TSQL,103.5,103.5,23,23,NN,FM,5,"CO Park Fairplay, Sacramento Mountain WZ0N 447.125"
178, Lake George 4497 ,449.7,-,5,Tone,107.2,88.5,23,23,NN,FM,5,CO Park Lake George  449.7
179,"KC0CVU Lake George, Badger Mountain 14736 ",147.36,+,0.6,TSQL,107.2,107.2,23,23,NN,FM,5,"CO Park Lake George, Badger Mountain KC0CVU 147.36"
180,"NX0G Lake George, Badger Mountain 146685 ",146.685,-,0.6,TSQL,107.2,107.2,23,23,NN,FM,5,"CO Park Lake George, Badger Mountain NX0G 146.685"
181,"K0VQ Aspen, Aspen Mountain 44705 ",447.05,-,5,TSQL,136.5,136.5,23,23,NN,FM,5,"CO Pitkin Aspen, Aspen Mountain K0VQ 447.05"
182,K0CL Snowmass Village 14667 ,146.67,-,0.6,Tone,107.2,88.5,23,23,NN,FM,5,CO Pitkin Snowmass Village K0CL 146.67
183,ND0Q Pueblo 44795 ,447.95,-,5,Tone,88.5,88.5,23,23,NN,FM,5,CO Pueblo Pueblo ND0Q 447.95
184,K0JSC Pueblo West 448975 ,448.975,-,5,TSQL,100,100,23,23,NN,FM,5,CO Pueblo Pueblo West K0JSC 448.975
185,"ND0Q Pueblo, Baculite Mesa 14679 ",146.79,-,0.6,Tone,88.5,88.5,23,23,NN,FM,5,"CO Pueblo Pueblo, Baculite Mesa ND0Q 146.79"
186,N0KM Center 14664 ,146.64,-,0.6,TSQL,77,77,23,23,NN,FM,5,CO Rio Grande Center N0KM 146.64
187,N0KM Center 4471 ,447.1,-,5,Tone,77,88.5,23,23,NN,FM,5,CO Saguache Center N0KM 447.1
188,WB0QMR Breckenridge 1467 ,146.7,-,0.6,Tone,107.2,88.5,23,23,NN,FM,5,CO Summit Breckenridge WB0QMR 146.7
189,"KB0VJJ Breckenridge, Bald Mountain 14739 ",147.39,+,0.6,Cross,88.5,123,23,23,NN,FM,5,"CO Summit Breckenridge, Bald Mountain KB0VJJ 147.39"
190,NX0G Cripple Creek 147015 ,147.015,+,0.6,Tone,107.2,88.5,23,23,NN,FM,5,CO Teller Cripple Creek NX0G 147.015
191,WB0WDF Cripple Creek 14546 ,145.46,-,0.6,Tone,67,88.5,23,23,NN,FM,5,CO Teller Cripple Creek WB0WDF 145.46
192,WB0WDF Cripple Creek 22494 ,224.94,-,1.6,Tone,67,88.5,23,23,NN,FM,5,CO Teller Cripple Creek WB0WDF 224.94
193,WB0WDF Cripple Creek 4474 ,447.4,-,5,Tone,67,88.5,23,23,NN,FM,5,CO Teller Cripple Creek WB0WDF 447.4
194,KA0WUC Woodland Park 145415 ,145.415,-,0.6,Tone,179.9,88.5,23,23,NN,FM,5,CO Teller Woodland Park KA0WUC 145.415
195,KA0WUC Woodland Park 447675 ,447.675,-,5,TSQL,179.9,179.9,23,23,NN,FM,5,CO Teller Woodland Park KA0WUC 447.675
196,KA0WUC Woodland Park 449025 ,449.025,-,5,Tone,141.3,88.5,23,23,NN,FM,5,CO Teller Woodland Park KA0WUC 449.025
197,NX0G Woodland Park 14682 ,146.82,-,0.6,Tone,107.2,88.5,23,23,NN,FM,5,CO Teller Woodland Park NX0G 146.82
198,NX0G Woodland Park 44865 ,448.65,-,5,Tone,107.2,88.5,23,23,NN,FM,5,CO Teller Woodland Park NX0G 448.65
199,"KA4EPS Woodland Park, Paradise Pines 449325 ",449.325,-,5,TSQL,103.5,103.5,23,23,NN,FM,5,"CO Teller Woodland Park, Paradise Pines KA4EPS 449.325"
