Location,Name,Frequency,Duplex,Offset,Tone,rToneFreq,cToneFreq,DtcsCode,DtcsRxCode,DtcsPolarity,Mode,TStep,Comment
0,Brighton KD0RG 449.925,449.925,-,5,TSQL,114.8,114.8,23,23,NN,FM,5,CO Adams Brighton KD0RG 449.925
1,Lochbuie KE0SJ 447.625,447.625,-,5,Tone,100,88.5,23,23,NN,FM,5,CO Adams Lochbuie KE0SJ 447.625
2,Northglenn K0ML 147.045,147.045,+,0.6,Tone,123,88.5,23,23,NN,FM,5,CO Adams Northglenn K0ML 147.045
3,Westminster N1UPS 449.3,449.3,-,5,Tone,100,88.5,23,23,NN,FM,5,CO Adams Westminster N1UPS 449.3
4,Aurora N0ZUQ 448.4,448.4,-,5,Tone,94.8,88.5,23,23,NN,FM,5,CO Arapahoe Aurora N0ZUQ 448.4
5,Aurora W0BG 448.275,448.275,-,5,Tone,156.7,88.5,23,23,NN,FM,5,CO Arapahoe Aurora W0BG 448.275
6,"Allenspark, AFPD Station #5 KI0HG 147.03",147.03,+,0.6,Tone,100,88.5,23,23,NN,FM,5,"CO Boulder Allenspark, AFPD Station #5 KI0HG 147.03"
7,Boulder W0IA 449.55,449.55,-,5,Tone,100,88.5,23,23,NN,FM,5,CO Boulder Boulder W0IA 449.55
8,"Boulder, Eldorado Mountain W0CRA 145.46",145.46,-,0.6,TSQL,107.2,107.2,23,23,NN,FM,5,"CO Boulder Boulder, Eldorado Mountain W0CRA 145.46"
9,"Boulder, Eldorado Mountain W0CRA 447.975",447.975,-,5,TSQL,107.2,107.2,23,23,NN,FM,5,"CO Boulder Boulder, Eldorado Mountain W0CRA 447.975"
10,"Boulder, Gunbarrel Hill W0IA 146.76",146.76,-,0.6,Tone,100,88.5,23,23,NN,FM,5,"CO Boulder Boulder, Gunbarrel Hill W0IA 146.76"
11,"Boulder, Lee Hill N0SZ 447.75",447.75,-,5,TSQL,141.3,141.3,23,23,NN,FM,5,"CO Boulder Boulder, Lee Hill N0SZ 447.75"
12,"Boulder, Lee Hill W0IA 224.02",224.02,-,1.6,,88.5,88.5,23,23,NN,FM,5,"CO Boulder Boulder, Lee Hill W0IA 224.02"
13,"Boulder, Table Mesa W0DK 448.9",448.9,-,5,Tone,100,88.5,23,23,NN,FM,5,"CO Boulder Boulder, Table Mesa W0DK 448.9"
14,"Boulder, Table Mountain W0DK 146.7",146.7,-,0.6,Tone,100,88.5,23,23,NN,FM,5,"CO Boulder Boulder, Table Mountain W0DK 146.7"
15,Broomfield W0LMA 448.925,448.925,-,5,Tone,131.8,88.5,23,23,NN,FM,5,CO Boulder Broomfield W0LMA 448.925
16,Broomfield W0WYX 449.825,449.825,-,5,Tone,103.5,88.5,23,23,NN,FM,5,CO Boulder Broomfield W0WYX 449.825
17,Gold Hill W0JZ 146.91,146.91,+,0.6,Cross,123,127.3,23,23,NN,FM,5,CO Boulder Gold Hill W0JZ 146.91
18,Longmont N0EPA 448.525,448.525,-,5,Tone,151.4,88.5,23,23,NN,FM,5,CO Boulder Longmont N0EPA 448.525
19,Longmont W0ENO 147.27,147.27,+,0.6,TSQL,100,100,23,23,NN,FM,5,CO Boulder Longmont W0ENO 147.27
20,Longmont W0ENO 448.8,448.8,-,5,TSQL,88.5,88.5,23,23,NN,FM,5,CO Boulder Longmont W0ENO 448.8
21,"Evergreen, Saddleback Mountain AC0KQ 447.85",447.85,-,5,TSQL,141.3,141.3,23,23,NN,FM,5,"CO Clear Creek Evergreen, Saddleback Mountain AC0KQ 447.85"
22,"Evergreen, Squaw Mountain N0PYY 147.3",147.3,+,0.6,TSQL,103.5,103.5,23,23,NN,FM,5,"CO Clear Creek Evergreen, Squaw Mountain N0PYY 147.3"
23,"Idaho Springs, Squaw Mountain K1DUN 449.45",449.45,-,5,Cross,103.5,127.3,23,23,NN,FM,5,"CO Clear Creek Idaho Springs, Squaw Mountain K1DUN 449.45"
24,"Idaho Springs, Squaw Mountain KB0UDD 146.67",146.67,-,0.6,TSQL,100,100,23,23,NN,FM,5,"CO Clear Creek Idaho Springs, Squaw Mountain KB0UDD 146.67"
25,"Idaho Springs, Squaw Mountain N0SZ 448.225",448.225,-,5,TSQL,141.3,141.3,23,23,NN,FM,5,"CO Clear Creek Idaho Springs, Squaw Mountain N0SZ 448.225"
26,"Idaho Springs, Squaw Mountain W0CRA 145.145",145.145,-,0.6,TSQL,107.2,107.2,23,23,NN,FM,5,"CO Clear Creek Idaho Springs, Squaw Mountain W0CRA 145.145"
27,"Idaho Springs, Squaw Mountain W0CRA 447.575",447.575,-,5,TSQL,107.2,107.2,23,23,NN,FM,5,"CO Clear Creek Idaho Springs, Squaw Mountain W0CRA 447.575"
28,"Idaho Springs, Squaw Mountain W0TX 449.35",449.35,-,5,TSQL,100,100,23,23,NN,FM,5,"CO Clear Creek Idaho Springs, Squaw Mountain W0TX 449.35"
29,"Idaho Springs, Squaw Mountain W0WYX 146.94",146.94,-,0.6,TSQL,103.5,103.5,23,23,NN,FM,5,"CO Clear Creek Idaho Springs, Squaw Mountain W0WYX 146.94"
30,"Idaho Springs, Squaw Mountain WR0AEN 449",449,-,5,TSQL,136.5,136.5,23,23,NN,FM,5,"CO Clear Creek Idaho Springs, Squaw Mountain WR0AEN 449"
31,"Cedaredge, Grand Mesa  447.35",447.35,-,5,Tone,107.2,88.5,23,23,NN,FM,5,"CO Delta Cedaredge, Grand Mesa  447.35"
32,Paonia KI0MR 147.33,147.33,+,0.6,Tone,107.2,88.5,23,23,NN,FM,5,CO Delta Paonia KI0MR 147.33
33,"Aurora, Smokey Hill KB0UDD 448.5",448.5,-,5,Tone,100,88.5,23,23,NN,FM,5,"CO Denver Aurora, Smokey Hill KB0UDD 448.5"
34,Denver K0FEZ 447.925,447.925,-,5,TSQL,100,100,23,23,NN,FM,5,CO Denver Denver K0FEZ 447.925
35,Denver N0JXN 146.715,146.715,-,0.6,TSQL,123,123,23,23,NN,FM,5,CO Denver Denver N0JXN 146.715
36,Denver N5EHP 448.075,448.075,-,5,Tone,123,88.5,23,23,NN,FM,5,CO Denver Denver N5EHP 448.075
37,"Denver, Broadway Plaza Lofts W0JRL 447.175",447.175,-,5,TSQL,100,100,23,23,NN,FM,5,"CO Denver Denver, Broadway Plaza Lofts W0JRL 447.175"
38,"Denver, Green Valley Ranch K0GUR 448.15",448.15,-,5,TSQL,141.3,141.3,23,23,NN,FM,5,"CO Denver Denver, Green Valley Ranch K0GUR 448.15"
39,"Golden, Centennial Cone K0FEZ 146.985",146.985,-,0.6,TSQL,100,100,23,23,NN,FM,5,"CO Denver Golden, Centennial Cone K0FEZ 146.985"
40,"Idaho Springs, Squaw Mountain W0CFI 448.675",448.675,-,5,TSQL,100,100,23,23,NN,FM,5,"CO Denver Idaho Springs, Squaw Mountain W0CFI 448.675"
41,"Idaho Springs, Squaw Mountain WG0N 449.05",449.05,-,5,TSQL,107.2,107.2,23,23,NN,FM,5,"CO Denver Idaho Springs, Squaw Mountain WG0N 449.05"
42,Vail KB0VJJ 147.345,147.345,+,0.6,Cross,88.5,123,23,23,NN,FM,5,CO Eagle Vail KB0VJJ 147.345
43,Vail N0AFO 224.8,224.8,-,1.6,,88.5,88.5,23,23,NN,FM,5,CO Eagle Vail N0AFO 224.8
44,"Vail, Bald Mountain K0RV 146.61",146.61,-,0.6,Tone,107.2,88.5,23,23,NN,FM,5,"CO Eagle Vail, Bald Mountain K0RV 146.61"
45,"Carbondale, Four Mile Ridge K0ELK 449.725",449.725,-,5,Tone,179.9,88.5,23,23,NN,FM,5,"CO Garfield Carbondale, Four Mile Ridge K0ELK 449.725"
46,"Carbondale, Four Mile Ridge K0SNO 147.39",147.39,+,0.6,Tone,107.2,88.5,23,23,NN,FM,5,"CO Garfield Carbondale, Four Mile Ridge K0SNO 147.39"
47,"Carbondale, Missouri Heights K0VQ 447.15",447.15,-,5,Tone,136.5,88.5,23,23,NN,FM,5,"CO Garfield Carbondale, Missouri Heights K0VQ 447.15"
48,"Glenwood Springs, Lookout Mountain WA4HND 449.85",449.85,-,5,TSQL,131.8,131.8,23,23,NN,FM,5,"CO Garfield Glenwood Springs, Lookout Mountain WA4HND 449.85"
49,"Glenwood Springs, Sunlight Peak KB0VJJ 146.85",146.85,-,0.6,Cross,88.5,123,23,23,NN,FM,5,"CO Garfield Glenwood Springs, Sunlight Peak KB0VJJ 146.85"
50,"Glenwood Springs, Sunlight Peak KI0G 146.88",146.88,-,0.6,Tone,107.2,88.5,23,23,NN,FM,5,"CO Garfield Glenwood Springs, Sunlight Peak KI0G 146.88"
51,"Glenwood Springs, Sunlight Peak KI0G 447.1",447.1,-,5,Tone,107.2,88.5,23,23,NN,FM,5,"CO Garfield Glenwood Springs, Sunlight Peak KI0G 447.1"
52,"Glenwood Springs, Sunlight Peak N0XLI 449.6",449.6,-,5,Tone,107.2,88.5,23,23,NN,FM,5,"CO Garfield Glenwood Springs, Sunlight Peak N0XLI 449.6"
53,"Loma, Baxter Pass KB0SW 447",447,-,5,Tone,107.2,88.5,23,23,NN,FM,5,"CO Garfield Loma, Baxter Pass KB0SW 447"
54,"Parachute, Mount Callahan WA4HND 449.8",449.8,-,5,Tone,107.2,88.5,23,23,NN,FM,5,"CO Garfield Parachute, Mount Callahan WA4HND 449.8"
55,"Boulder, Thorodin Mountain KB0VJJ 145.31",145.31,-,0.6,Cross,88.5,123,23,23,NN,FM,5,"CO Gilpin Boulder, Thorodin Mountain KB0VJJ 145.31"
56,"Denver, Thorodin Mountain N0SZ 449.225",449.225,-,5,TSQL,141.3,141.3,23,23,NN,FM,5,"CO Gilpin Denver, Thorodin Mountain N0SZ 449.225"
57,Rollinsville W0RM 224.6,224.6,-,1.6,Tone,100,88.5,23,23,NN,FM,5,CO Gilpin Rollinsville W0RM 224.6
58,Granby KA0YDW 146.82,146.82,-,0.6,Tone,123,88.5,23,23,NN,FM,5,CO Grand Granby KA0YDW 146.82
59,"Kremmling, Santoy Peak KB0VJJ 147.075",147.075,+,0.6,Cross,88.5,123,23,23,NN,FM,5,"CO Grand Kremmling, Santoy Peak KB0VJJ 147.075"
60,Winter Park WA4CCC 447.45,447.45,-,5,Tone,103.5,88.5,23,23,NN,FM,5,CO Grand Winter Park WA4CCC 447.45
61,"Winter Park, Winter Park KB0VJJ 147.285",147.285,+,0.6,Cross,88.5,123,23,23,NN,FM,5,"CO Grand Winter Park, Winter Park KB0VJJ 147.285"
62,"Walden, Peterson Ridge KB0VJJ 145.16",145.16,-,0.6,Cross,88.5,123,23,23,NN,FM,5,"CO Jackson Walden, Peterson Ridge KB0VJJ 145.16"
63,"Boulder, Blue Mountain KE0SJ 145.475",145.475,-,0.6,Tone,100,88.5,23,23,NN,FM,5,"CO Jefferson Boulder, Blue Mountain KE0SJ 145.475"
64,"Centennial, Warren Mountain WB0TUB 146.88",146.88,-,0.6,Tone,100,88.5,23,23,NN,FM,5,"CO Jefferson Centennial, Warren Mountain WB0TUB 146.88"
65,"Centennial, Warren Mountain WB0TUB 449.6",449.6,-,5,Tone,100,88.5,23,23,NN,FM,5,"CO Jefferson Centennial, Warren Mountain WB0TUB 449.6"
66,"Conifer, Critchell Mountain N0OWY 447.5",447.5,-,5,TSQL,88.5,88.5,23,23,NN,FM,5,"CO Jefferson Conifer, Critchell Mountain N0OWY 447.5"
67,"Critchell, Critchell Mountain N0ARA 147.12",147.12,+,0.6,TSQL,88.5,88.5,23,23,NN,FM,5,"CO Jefferson Critchell, Critchell Mountain N0ARA 147.12"
68,Evergreen KE4GUQ 145.34,145.34,-,0.6,Cross,103.5,127.3,23,23,NN,FM,5,CO Jefferson Evergreen KE4GUQ 145.34
69,Golden N0PYY 448.125,448.125,-,5,Tone,107.2,88.5,23,23,NN,FM,5,CO Jefferson Golden N0PYY 448.125
70,Golden W0GV 448.975,448.975,-,5,Tone,123,88.5,23,23,NN,FM,5,CO Jefferson Golden W0GV 448.975
71,"Golden, Centennial Cone KE0SJ 145.28",145.28,-,0.6,Tone,100,88.5,23,23,NN,FM,5,"CO Jefferson Golden, Centennial Cone KE0SJ 145.28"
72,"Golden, Centennial Cone KE0SJ 449.525",449.525,-,5,,88.5,88.5,23,23,NN,FM,5,"CO Jefferson Golden, Centennial Cone KE0SJ 449.525"
73,"Golden, Centennial Cone W0TX 448.625",448.625,-,5,TSQL,100,100,23,23,NN,FM,5,"CO Jefferson Golden, Centennial Cone W0TX 448.625"
74,"Golden, Centennial Cone WB0TUB 146.64",146.64,-,0.6,Tone,100,88.5,23,23,NN,FM,5,"CO Jefferson Golden, Centennial Cone WB0TUB 146.64"
75,"Golden, Guy Hill K0IBM 448.85",448.85,-,5,TSQL,88.5,88.5,23,23,NN,FM,5,"CO Jefferson Golden, Guy Hill K0IBM 448.85"
76,"Golden, Guy Hill KI0GO 449.75",449.75,-,5,TSQL,103.5,103.5,23,23,NN,FM,5,"CO Jefferson Golden, Guy Hill KI0GO 449.75"
77,"Golden, Guy Hill N0MHU 224",224,-,1.6,TSQL,103.5,103.5,23,23,NN,FM,5,"CO Jefferson Golden, Guy Hill N0MHU 224"
78,"Golden, Guy Hill N0POH 224.74",224.74,-,1.6,TSQL,88.5,88.5,23,23,NN,FM,5,"CO Jefferson Golden, Guy Hill N0POH 224.74"
79,"Golden, Guy Hill W0CBI 147.15",147.15,+,0.6,TSQL,100,100,23,23,NN,FM,5,"CO Jefferson Golden, Guy Hill W0CBI 147.15"
80,"Golden, Lookout Mountain W0KU 449.625",449.625,-,5,TSQL,141.3,141.3,23,23,NN,FM,5,"CO Jefferson Golden, Lookout Mountain W0KU 449.625"
81,"Idaho Springs, Centennial Cone W0TX 145.49",145.49,-,0.6,TSQL,100,100,23,23,NN,FM,5,"CO Jefferson Idaho Springs, Centennial Cone W0TX 145.49"
82,Lakewood N0ELY 448.75,448.75,-,5,TSQL,100,100,23,23,NN,FM,5,CO Jefferson Lakewood N0ELY 448.75
83,"Lakewood, Green Mountain W0TX 147.33",147.33,+,0.6,Tone,100,88.5,23,23,NN,FM,5,"CO Jefferson Lakewood, Green Mountain W0TX 147.33"
84,"Lakewood, Green Mountain W0TX 224.38",224.38,-,1.6,TSQL,100,100,23,23,NN,FM,5,"CO Jefferson Lakewood, Green Mountain W0TX 224.38"
85,"Lakewood, St Anthony Medical Campus W0TX 447.825",447.825,-,5,DTCS,88.5,88.5,73,73,NN,NFM,5,"CO Jefferson Lakewood, St Anthony Medical Campus W0TX 447.825"
86,"Morrison, Mt. Morrison N6LXX 447.875",447.875,-,5,TSQL,107.2,107.2,23,23,NN,FM,5,"CO Jefferson Morrison, Mt. Morrison N6LXX 447.875"
87,"Leadville, Mosquito Pass KB0VJJ 145.445",145.445,-,0.6,Tone,88.5,88.5,23,23,NN,FM,5,"CO Lake Leadville, Mosquito Pass KB0VJJ 145.445"
88,Estes Park N0FH 146.685,146.685,-,0.6,Tone,123,88.5,23,23,NN,FM,5,CO Larimer Estes Park N0FH 146.685
89,Estes Park N0FH 449.8,449.8,-,5,Tone,123,88.5,23,23,NN,FM,5,CO Larimer Estes Park N0FH 449.8
90,Fort Collins KC0RBT 447.45,447.45,-,5,Tone,123,88.5,23,23,NN,FM,5,CO Larimer Fort Collins KC0RBT 447.45
91,Fort Collins W7RF 447.725,447.725,-,5,Tone,131.8,88.5,23,23,NN,FM,5,CO Larimer Fort Collins W7RF 447.725
92,"Fort Collins, Buckhorn Mountain W0UPS 146.625",146.625,-,0.6,TSQL,100,100,23,23,NN,FM,5,"CO Larimer Fort Collins, Buckhorn Mountain W0UPS 146.625"
93,"Fort Collins, Buckhorn Mountain W0UPS 224.84",224.84,-,1.6,TSQL,100,100,23,23,NN,FM,5,"CO Larimer Fort Collins, Buckhorn Mountain W0UPS 224.84"
94,"Fort Collins, Buckhorn Mountain W0UPS 447.7",447.7,-,5,TSQL,100,100,23,23,NN,FM,5,"CO Larimer Fort Collins, Buckhorn Mountain W0UPS 447.7"
95,"Fort Collins, CSU Durward Hall W0QEY 147.36",147.36,+,0.6,TSQL,100,100,23,23,NN,FM,5,"CO Larimer Fort Collins, CSU Durward Hall W0QEY 147.36"
96,"Fort Collins, CSU Durward Hall W0QEY 449.85",449.85,-,5,TSQL,100,100,23,23,NN,FM,5,"CO Larimer Fort Collins, CSU Durward Hall W0QEY 449.85"
97,"Fort Collins, Christ Mountain N0ZUQ 449.425",449.425,-,5,Tone,94.8,88.5,23,23,NN,FM,5,"CO Larimer Fort Collins, Christ Mountain N0ZUQ 449.425"
98,"Fort Collins, Horsetooth Mountain W0UPS 145.115",145.115,-,0.6,TSQL,100,100,23,23,NN,FM,5,"CO Larimer Fort Collins, Horsetooth Mountain W0UPS 145.115"
99,"Fort Collins, Horsetooth Mountain W0UPS 447.275",447.275,-,5,TSQL,100,100,23,23,NN,FM,5,"CO Larimer Fort Collins, Horsetooth Mountain W0UPS 447.275"
100,"Loveland, Namaqua Hill W0LRA 147.195",147.195,+,0.6,Tone,100,88.5,23,23,NN,FM,5,"CO Larimer Loveland, Namaqua Hill W0LRA 147.195"
101,"Loveland, Namaqua Hill W0LRA 449.575",449.575,-,5,Tone,100,88.5,23,23,NN,FM,5,"CO Larimer Loveland, Namaqua Hill W0LRA 449.575"
102,Wellington WB7UPS 448.325,448.325,-,5,Tone,110.9,88.5,23,23,NN,FM,5,CO Larimer Wellington WB7UPS 448.325
103,"Grand Junction, Grand Mesa KB0VJJ 145.355",145.355,-,0.6,Cross,88.5,123,23,23,NN,FM,5,"CO Mesa Grand Junction, Grand Mesa KB0VJJ 145.355"
104,"Grand Junction, Grand Mesa KB0YNA 449.65",449.65,-,5,TSQL,151.4,151.4,23,23,NN,FM,5,"CO Mesa Grand Junction, Grand Mesa KB0YNA 449.65"
105,Craig KB0VJJ 146.97,146.97,-,0.6,Cross,88.5,123,23,23,NN,FM,5,CO Moffat Craig KB0VJJ 146.97
106,Craig WD0HAM 145.265,145.265,-,0.6,Tone,107.2,88.5,23,23,NN,FM,5,CO Moffat Craig WD0HAM 145.265
107,"Bailey, Dick Mountain AB0PC 146.895",146.895,-,0.6,TSQL,100,100,23,23,NN,FM,5,"CO Park Bailey, Dick Mountain AB0PC 146.895"
108,"Fairplay, Sacramento Mountain WZ0N 447.125",447.125,-,5,TSQL,103.5,103.5,23,23,NN,FM,5,"CO Park Fairplay, Sacramento Mountain WZ0N 447.125"
109,"Aspen, Aspen Mountain K0VQ 447.05",447.05,-,5,TSQL,136.5,136.5,23,23,NN,FM,5,"CO Pitkin Aspen, Aspen Mountain K0VQ 447.05"
110,Snowmass Village K0CL 146.67,146.67,-,0.6,Tone,107.2,88.5,23,23,NN,FM,5,CO Pitkin Snowmass Village K0CL 146.67
111,Steamboat Springs KB0VJJ 147.165,147.165,+,0.6,Cross,88.5,123,23,23,NN,FM,5,CO Routt Steamboat Springs KB0VJJ 147.165
112,Steamboat Springs KB0VJJ 449.625,449.625,-,5,TSQL,123,123,23,23,NN,FM,5,CO Routt Steamboat Springs KB0VJJ 449.625
113,Steamboat Springs KD0H 147.21,147.21,+,0.6,TSQL,107.2,107.2,23,23,NN,FM,5,CO Routt Steamboat Springs KD0H 147.21
114,Breckenridge WB0QMR 146.7,146.7,-,0.6,Tone,107.2,88.5,23,23,NN,FM,5,CO Summit Breckenridge WB0QMR 146.7
115,"Breckenridge, Bald Mountain KB0VJJ 147.39",147.39,+,0.6,Cross,88.5,123,23,23,NN,FM,5,"CO Summit Breckenridge, Bald Mountain KB0VJJ 147.39"
116,Fort Lupton AC0KC 224.96,224.96,-,1.6,,88.5,88.5,23,23,NN,FM,5,CO Weld Fort Lupton AC0KC 224.96
117,Fort Lupton AC0KC 447.3,447.3,-,5,Tone,107.2,88.5,23,23,NN,FM,5,CO Weld Fort Lupton AC0KC 447.3
118,Greeley KC0KWD 448.475,448.475,-,5,Tone,100,88.5,23,23,NN,FM,5,CO Weld Greeley KC0KWD 448.475
119,"Greeley, UNC K0OJ 449.725",449.725,-,5,Tone,127.3,88.5,23,23,NN,FM,5,"CO Weld Greeley, UNC K0OJ 449.725"
120,"Greeley, UNC W0UPS 146.85",146.85,-,0.6,TSQL,100,100,23,23,NN,FM,5,"CO Weld Greeley, UNC W0UPS 146.85"
121,"Severance, Cactus Hill N6RFI 447.2",447.2,-,5,Tone,82.5,88.5,23,23,NN,FM,5,"CO Weld Severance, Cactus Hill N6RFI 447.2"
122,Vernal W7BYU 449.7,449.7,-,5,Tone,136.5,88.5,23,23,NN,FM,5,UT Uintah Vernal W7BYU 449.7
123,"Vernal, Blue Mountain W7BAR 147.1",147.1,+,0.6,Tone,136.5,88.5,23,23,NN,FM,5,"UT Uintah Vernal, Blue Mountain W7BAR 147.1"
124,"Vernal, Grizzly Ridge W7BAR 147.04",147.04,+,0.6,Tone,136.5,88.5,23,23,NN,FM,5,"UT Uintah Vernal, Grizzly Ridge W7BAR 147.04"
125,"Laramie, Beacon Hill KC7SNO 146.82",146.82,-,0.6,Tone,114.8,88.5,23,23,NN,FM,5,"WY Albany Laramie, Beacon Hill KC7SNO 146.82"
126,Rawlins KC7OZU 146.76,146.76,-,0.6,Tone,100,88.5,23,23,NN,FM,5,WY Carbon Rawlins KC7OZU 146.76
127,Rawlins KD7BN 147.39,147.39,+,0.6,Tone,100,88.5,23,23,NN,FM,5,WY Carbon Rawlins KD7BN 147.39
128,Rawlins KD7SU 448.3,448.3,-,5,Tone,100,88.5,23,23,NN,FM,5,WY Carbon Rawlins KD7SU 448.3
129,Rawlins N7RON 146.7,146.7,-,0.6,Tone,162.2,88.5,23,23,NN,FM,5,WY Carbon Rawlins N7RON 146.7
130,Rawlins N7RON 449.8,449.8,-,5,Tone,146.2,88.5,23,23,NN,FM,5,WY Carbon Rawlins N7RON 449.8
131,"Rawlins, Elk Mountain N7GCR 147.24",147.24,+,0.6,Tone,100,88.5,23,23,NN,FM,5,"WY Carbon Rawlins, Elk Mountain N7GCR 147.24"
132,Cheyenne KB7SWR 145.235,145.235,-,0.6,Tone,114.8,88.5,23,23,NN,FM,5,WY Laramie Cheyenne KB7SWR 145.235
133,Cheyenne KC7DHF 448.95,448.95,-,5,Tone,151.4,88.5,23,23,NN,FM,5,WY Laramie Cheyenne KC7DHF 448.95
134,Cheyenne N7EMA 447.025,447.025,-,5,,88.5,88.5,23,23,NN,FM,5,WY Laramie Cheyenne N7EMA 447.025
135,Cheyenne N7JJY 449.9,449.9,-,5,TSQL,100,100,23,23,NN,FM,5,WY Laramie Cheyenne N7JJY 449.9
136,"Cheyenne, Chalk Bluffs WB7GR 449.3",449.3,-,5,Tone,131.8,88.5,23,23,NN,FM,5,"WY Laramie Cheyenne, Chalk Bluffs WB7GR 449.3"
137,"Cheyenne, Denver Hill KC7SNO 146.775",146.775,-,0.6,Tone,114.8,88.5,23,23,NN,FM,5,"WY Laramie Cheyenne, Denver Hill KC7SNO 146.775"
138,"Cheyenne, North Park KC7SNO 147.105",147.105,+,0.6,Tone,114.8,88.5,23,23,NN,FM,5,"WY Laramie Cheyenne, North Park KC7SNO 147.105"
139,Rock Springs KF7OBL 147.3,147.3,+,0.6,,88.5,88.5,23,23,NN,FM,5,WY Sweetwater Rock Springs KF7OBL 147.3
140,"Rock Springs, Aspen Mountain N7RUG 146.61",146.61,-,0.6,Tone,100,88.5,23,23,NN,FM,5,"WY Sweetwater Rock Springs, Aspen Mountain N7RUG 146.61"
141,"Rock Springs, Aspen Mountain WY7U 146.94",146.94,-,0.6,Tone,100,88.5,23,23,NN,FM,5,"WY Sweetwater Rock Springs, Aspen Mountain WY7U 146.94"
142,"Rock Springs, Aspen Mtn K7DRA 222.4",222.4,+,1.6,Tone,123,88.5,23,23,NN,FM,5,"WY Sweetwater Rock Springs, Aspen Mtn K7DRA 222.4"
