Location,Name,Frequency,Duplex,Offset,Tone,rToneFreq,cToneFreq,DtcsCode,DtcsRxCode,DtcsPolarity,Mode,TStep,Comment
57,KD0RG Brighton 449925 ,449.925,-,5,TSQL,114.8,114.8,23,23,NN,FM,5,CO Adams Brighton KD0RG 449.925
58,KE0SJ Lochbuie 447625 ,447.625,-,5,Tone,100,88.5,23,23,NN,FM,5,CO Adams Lochbuie KE0SJ 447.625
59,K0ML Northglenn 147045 ,147.045,+,0.6,Tone,123,88.5,23,23,NN,FM,5,CO Adams Northglenn K0ML 147.045
60,N1UPS Westminster 4493 ,449.3,-,5,Tone,100,88.5,23,23,NN,FM,5,CO Adams Westminster N1UPS 449.3
61,N0ZUQ Aurora 4484 ,448.4,-,5,Tone,94.8,88.5,23,23,NN,FM,5,CO Arapahoe Aurora N0ZUQ 448.4
62,W0BG Aurora 448275 ,448.275,-,5,Tone,156.7,88.5,23,23,NN,FM,5,CO Arapahoe Aurora W0BG 448.275
63,"KI0HG Allenspark, AFPD Station #5 14703 ",147.03,+,0.6,Tone,100,88.5,23,23,NN,FM,5,"CO Boulder Allenspark, AFPD Station #5 KI0HG 147.03"
64,W0IA Boulder 44955 ,449.55,-,5,Tone,100,88.5,23,23,NN,FM,5,CO Boulder Boulder W0IA 449.55
65,"W0CRA Boulder, Eldorado Mountain 14546 ",145.46,-,0.6,TSQL,107.2,107.2,23,23,NN,FM,5,"CO Boulder Boulder, Eldorado Mountain W0CRA 145.46"
66,"W0CRA Boulder, Eldorado Mountain 447975 ",447.975,-,5,TSQL,107.2,107.2,23,23,NN,FM,5,"CO Boulder Boulder, Eldorado Mountain W0CRA 447.975"
67,"W0IA Boulder, Gunbarrel Hill 14676 ",146.76,-,0.6,Tone,100,88.5,23,23,NN,FM,5,"CO Boulder Boulder, Gunbarrel Hill W0IA 146.76"
68,"N0SZ Boulder, Lee Hill 44775 ",447.75,-,5,TSQL,141.3,141.3,23,23,NN,FM,5,"CO Boulder Boulder, Lee Hill N0SZ 447.75"
69,"W0IA Boulder, Lee Hill 22402 ",224.02,-,1.6,,88.5,88.5,23,23,NN,FM,5,"CO Boulder Boulder, Lee Hill W0IA 224.02"
70,"W0DK Boulder, Table Mesa 4489 ",448.9,-,5,Tone,100,88.5,23,23,NN,FM,5,"CO Boulder Boulder, Table Mesa W0DK 448.9"
71,"W0DK Boulder, Table Mountain 1467 ",146.7,-,0.6,Tone,100,88.5,23,23,NN,FM,5,"CO Boulder Boulder, Table Mountain W0DK 146.7"
72,W0LMA Broomfield 448925 ,448.925,-,5,Tone,131.8,88.5,23,23,NN,FM,5,CO Boulder Broomfield W0LMA 448.925
73,W0WYX Broomfield 449825 ,449.825,-,5,Tone,103.5,88.5,23,23,NN,FM,5,CO Boulder Broomfield W0WYX 449.825
74,W0JZ Gold Hill 14691 ,146.91,+,0.6,Cross,123,127.3,23,23,NN,FM,5,CO Boulder Gold Hill W0JZ 146.91
75,N0EPA Longmont 448525 ,448.525,-,5,Tone,151.4,88.5,23,23,NN,FM,5,CO Boulder Longmont N0EPA 448.525
76,W0ENO Longmont 14727 ,147.27,+,0.6,TSQL,100,100,23,23,NN,FM,5,CO Boulder Longmont W0ENO 147.27
77,W0ENO Longmont 4488 ,448.8,-,5,TSQL,88.5,88.5,23,23,NN,FM,5,CO Boulder Longmont W0ENO 448.8
78,"AC0KQ Evergreen, Saddleback Mountain 44785 ",447.85,-,5,TSQL,141.3,141.3,23,23,NN,FM,5,"CO Clear Creek Evergreen, Saddleback Mountain AC0KQ 447.85"
79,"N0PYY Evergreen, Squaw Mountain 1473 ",147.3,+,0.6,TSQL,103.5,103.5,23,23,NN,FM,5,"CO Clear Creek Evergreen, Squaw Mountain N0PYY 147.3"
80,"K1DUN Idaho Springs, Squaw Mountain 44945 ",449.45,-,5,Cross,103.5,127.3,23,23,NN,FM,5,"CO Clear Creek Idaho Springs, Squaw Mountain K1DUN 449.45"
81,"KB0UDD Idaho Springs, Squaw Mountain 14667 ",146.67,-,0.6,TSQL,100,100,23,23,NN,FM,5,"CO Clear Creek Idaho Springs, Squaw Mountain KB0UDD 146.67"
82,"N0SZ Idaho Springs, Squaw Mountain 448225 ",448.225,-,5,TSQL,141.3,141.3,23,23,NN,FM,5,"CO Clear Creek Idaho Springs, Squaw Mountain N0SZ 448.225"
83,"W0CRA Idaho Springs, Squaw Mountain 145145 ",145.145,-,0.6,TSQL,107.2,107.2,23,23,NN,FM,5,"CO Clear Creek Idaho Springs, Squaw Mountain W0CRA 145.145"
84,"W0CRA Idaho Springs, Squaw Mountain 447575 ",447.575,-,5,TSQL,107.2,107.2,23,23,NN,FM,5,"CO Clear Creek Idaho Springs, Squaw Mountain W0CRA 447.575"
85,"W0TX Idaho Springs, Squaw Mountain 44935 ",449.35,-,5,TSQL,100,100,23,23,NN,FM,5,"CO Clear Creek Idaho Springs, Squaw Mountain W0TX 449.35"
86,"W0WYX Idaho Springs, Squaw Mountain 14694 ",146.94,-,0.6,TSQL,103.5,103.5,23,23,NN,FM,5,"CO Clear Creek Idaho Springs, Squaw Mountain W0WYX 146.94"
87,"WR0AEN Idaho Springs, Squaw Mountain 449 ",449,-,5,TSQL,136.5,136.5,23,23,NN,FM,5,"CO Clear Creek Idaho Springs, Squaw Mountain WR0AEN 449"
88," Cedaredge, Grand Mesa 44735 ",447.35,-,5,Tone,107.2,88.5,23,23,NN,FM,5,"CO Delta Cedaredge, Grand Mesa  447.35"
89,KI0MR Paonia 14733 ,147.33,+,0.6,Tone,107.2,88.5,23,23,NN,FM,5,CO Delta Paonia KI0MR 147.33
90,"KB0UDD Aurora, Smokey Hill 4485 ",448.5,-,5,Tone,100,88.5,23,23,NN,FM,5,"CO Denver Aurora, Smokey Hill KB0UDD 448.5"
91,K0FEZ Denver 447925 ,447.925,-,5,TSQL,100,100,23,23,NN,FM,5,CO Denver Denver K0FEZ 447.925
92,N0JXN Denver 146715 ,146.715,-,0.6,TSQL,123,123,23,23,NN,FM,5,CO Denver Denver N0JXN 146.715
93,N5EHP Denver 448075 ,448.075,-,5,Tone,123,88.5,23,23,NN,FM,5,CO Denver Denver N5EHP 448.075
94,"W0JRL Denver, Broadway Plaza Lofts 447175 ",447.175,-,5,TSQL,100,100,23,23,NN,FM,5,"CO Denver Denver, Broadway Plaza Lofts W0JRL 447.175"
95,"K0GUR Denver, Green Valley Ranch 44815 ",448.15,-,5,TSQL,141.3,141.3,23,23,NN,FM,5,"CO Denver Denver, Green Valley Ranch K0GUR 448.15"
96,"K0FEZ Golden, Centennial Cone 146985 ",146.985,-,0.6,TSQL,100,100,23,23,NN,FM,5,"CO Denver Golden, Centennial Cone K0FEZ 146.985"
97,"W0CFI Idaho Springs, Squaw Mountain 448675 ",448.675,-,5,TSQL,100,100,23,23,NN,FM,5,"CO Denver Idaho Springs, Squaw Mountain W0CFI 448.675"
98,"WG0N Idaho Springs, Squaw Mountain 44905 ",449.05,-,5,TSQL,107.2,107.2,23,23,NN,FM,5,"CO Denver Idaho Springs, Squaw Mountain WG0N 449.05"
99,KB0VJJ Vail 147345 ,147.345,+,0.6,Cross,88.5,123,23,23,NN,FM,5,CO Eagle Vail KB0VJJ 147.345
100,N0AFO Vail 2248 ,224.8,-,1.6,,88.5,88.5,23,23,NN,FM,5,CO Eagle Vail N0AFO 224.8
101,"K0RV Vail, Bald Mountain 14661 ",146.61,-,0.6,Tone,107.2,88.5,23,23,NN,FM,5,"CO Eagle Vail, Bald Mountain K0RV 146.61"
102,"K0ELK Carbondale, Four Mile Ridge 449725 ",449.725,-,5,Tone,179.9,88.5,23,23,NN,FM,5,"CO Garfield Carbondale, Four Mile Ridge K0ELK 449.725"
103,"K0SNO Carbondale, Four Mile Ridge 14739 ",147.39,+,0.6,Tone,107.2,88.5,23,23,NN,FM,5,"CO Garfield Carbondale, Four Mile Ridge K0SNO 147.39"
104,"K0VQ Carbondale, Missouri Heights 44715 ",447.15,-,5,Tone,136.5,88.5,23,23,NN,FM,5,"CO Garfield Carbondale, Missouri Heights K0VQ 447.15"
105,"WA4HND Glenwood Springs, Lookout Mountain 44985 ",449.85,-,5,TSQL,131.8,131.8,23,23,NN,FM,5,"CO Garfield Glenwood Springs, Lookout Mountain WA4HND 449.85"
106,"KB0VJJ Glenwood Springs, Sunlight Peak 14685 ",146.85,-,0.6,Cross,88.5,123,23,23,NN,FM,5,"CO Garfield Glenwood Springs, Sunlight Peak KB0VJJ 146.85"
107,"KI0G Glenwood Springs, Sunlight Peak 14688 ",146.88,-,0.6,Tone,107.2,88.5,23,23,NN,FM,5,"CO Garfield Glenwood Springs, Sunlight Peak KI0G 146.88"
108,"KI0G Glenwood Springs, Sunlight Peak 4471 ",447.1,-,5,Tone,107.2,88.5,23,23,NN,FM,5,"CO Garfield Glenwood Springs, Sunlight Peak KI0G 447.1"
109,"N0XLI Glenwood Springs, Sunlight Peak 4496 ",449.6,-,5,Tone,107.2,88.5,23,23,NN,FM,5,"CO Garfield Glenwood Springs, Sunlight Peak N0XLI 449.6"
110,"KB0SW Loma, Baxter Pass 447 ",447,-,5,Tone,107.2,88.5,23,23,NN,FM,5,"CO Garfield Loma, Baxter Pass KB0SW 447"
111,"WA4HND Parachute, Mount Callahan 4498 ",449.8,-,5,Tone,107.2,88.5,23,23,NN,FM,5,"CO Garfield Parachute, Mount Callahan WA4HND 449.8"
112,"KB0VJJ Boulder, Thorodin Mountain 14531 ",145.31,-,0.6,Cross,88.5,123,23,23,NN,FM,5,"CO Gilpin Boulder, Thorodin Mountain KB0VJJ 145.31"
113,"N0SZ Denver, Thorodin Mountain 449225 ",449.225,-,5,TSQL,141.3,141.3,23,23,NN,FM,5,"CO Gilpin Denver, Thorodin Mountain N0SZ 449.225"
114,W0RM Rollinsville 2246 ,224.6,-,1.6,Tone,100,88.5,23,23,NN,FM,5,CO Gilpin Rollinsville W0RM 224.6
115,KA0YDW Granby 14682 ,146.82,-,0.6,Tone,123,88.5,23,23,NN,FM,5,CO Grand Granby KA0YDW 146.82
116,"KB0VJJ Kremmling, Santoy Peak 147075 ",147.075,+,0.6,Cross,88.5,123,23,23,NN,FM,5,"CO Grand Kremmling, Santoy Peak KB0VJJ 147.075"
117,WA4CCC Winter Park 44745 ,447.45,-,5,Tone,103.5,88.5,23,23,NN,FM,5,CO Grand Winter Park WA4CCC 447.45
118,"KB0VJJ Winter Park, Winter Park 147285 ",147.285,+,0.6,Cross,88.5,123,23,23,NN,FM,5,"CO Grand Winter Park, Winter Park KB0VJJ 147.285"
119,"KB0VJJ Walden, Peterson Ridge 14516 ",145.16,-,0.6,Cross,88.5,123,23,23,NN,FM,5,"CO Jackson Walden, Peterson Ridge KB0VJJ 145.16"
120,"KE0SJ Boulder, Blue Mountain 145475 ",145.475,-,0.6,Tone,100,88.5,23,23,NN,FM,5,"CO Jefferson Boulder, Blue Mountain KE0SJ 145.475"
121,"WB0TUB Centennial, Warren Mountain 14688 ",146.88,-,0.6,Tone,100,88.5,23,23,NN,FM,5,"CO Jefferson Centennial, Warren Mountain WB0TUB 146.88"
122,"WB0TUB Centennial, Warren Mountain 4496 ",449.6,-,5,Tone,100,88.5,23,23,NN,FM,5,"CO Jefferson Centennial, Warren Mountain WB0TUB 449.6"
123,"N0OWY Conifer, Critchell Mountain 4475 ",447.5,-,5,TSQL,88.5,88.5,23,23,NN,FM,5,"CO Jefferson Conifer, Critchell Mountain N0OWY 447.5"
124,"N0ARA Critchell, Critchell Mountain 14712 ",147.12,+,0.6,TSQL,88.5,88.5,23,23,NN,FM,5,"CO Jefferson Critchell, Critchell Mountain N0ARA 147.12"
125,KE4GUQ Evergreen 14534 ,145.34,-,0.6,Cross,103.5,127.3,23,23,NN,FM,5,CO Jefferson Evergreen KE4GUQ 145.34
126,N0PYY Golden 448125 ,448.125,-,5,Tone,107.2,88.5,23,23,NN,FM,5,CO Jefferson Golden N0PYY 448.125
127,W0GV Golden 448975 ,448.975,-,5,Tone,123,88.5,23,23,NN,FM,5,CO Jefferson Golden W0GV 448.975
128,"KE0SJ Golden, Centennial Cone 14528 ",145.28,-,0.6,Tone,100,88.5,23,23,NN,FM,5,"CO Jefferson Golden, Centennial Cone KE0SJ 145.28"
129,"KE0SJ Golden, Centennial Cone 449525 ",449.525,-,5,,88.5,88.5,23,23,NN,FM,5,"CO Jefferson Golden, Centennial Cone KE0SJ 449.525"
130,"W0TX Golden, Centennial Cone 448625 ",448.625,-,5,TSQL,100,100,23,23,NN,FM,5,"CO Jefferson Golden, Centennial Cone W0TX 448.625"
131,"WB0TUB Golden, Centennial Cone 14664 ",146.64,-,0.6,Tone,100,88.5,23,23,NN,FM,5,"CO Jefferson Golden, Centennial Cone WB0TUB 146.64"
132,"K0IBM Golden, Guy Hill 44885 ",448.85,-,5,TSQL,88.5,88.5,23,23,NN,FM,5,"CO Jefferson Golden, Guy Hill K0IBM 448.85"
133,"KI0GO Golden, Guy Hill 44975 ",449.75,-,5,TSQL,103.5,103.5,23,23,NN,FM,5,"CO Jefferson Golden, Guy Hill KI0GO 449.75"
134,"N0MHU Golden, Guy Hill 224 ",224,-,1.6,TSQL,103.5,103.5,23,23,NN,FM,5,"CO Jefferson Golden, Guy Hill N0MHU 224"
135,"N0POH Golden, Guy Hill 22474 ",224.74,-,1.6,TSQL,88.5,88.5,23,23,NN,FM,5,"CO Jefferson Golden, Guy Hill N0POH 224.74"
136,"W0CBI Golden, Guy Hill 14715 ",147.15,+,0.6,TSQL,100,100,23,23,NN,FM,5,"CO Jefferson Golden, Guy Hill W0CBI 147.15"
137,"W0KU Golden, Lookout Mountain 449625 ",449.625,-,5,TSQL,141.3,141.3,23,23,NN,FM,5,"CO Jefferson Golden, Lookout Mountain W0KU 449.625"
138,"W0TX Idaho Springs, Centennial Cone 14549 ",145.49,-,0.6,TSQL,100,100,23,23,NN,FM,5,"CO Jefferson Idaho Springs, Centennial Cone W0TX 145.49"
139,N0ELY Lakewood 44875 ,448.75,-,5,TSQL,100,100,23,23,NN,FM,5,CO Jefferson Lakewood N0ELY 448.75
140,"W0TX Lakewood, Green Mountain 14733 ",147.33,+,0.6,Tone,100,88.5,23,23,NN,FM,5,"CO Jefferson Lakewood, Green Mountain W0TX 147.33"
141,"W0TX Lakewood, Green Mountain 22438 ",224.38,-,1.6,TSQL,100,100,23,23,NN,FM,5,"CO Jefferson Lakewood, Green Mountain W0TX 224.38"
142,"W0TX Lakewood, St Anthony Medical Campus 447825 ",447.825,-,5,DTCS,88.5,88.5,73,73,NN,NFM,5,"CO Jefferson Lakewood, St Anthony Medical Campus W0TX 447.825"
143,"N6LXX Morrison, Mt. Morrison 447875 ",447.875,-,5,TSQL,107.2,107.2,23,23,NN,FM,5,"CO Jefferson Morrison, Mt. Morrison N6LXX 447.875"
144,"KB0VJJ Leadville, Mosquito Pass 145445 ",145.445,-,0.6,Tone,88.5,88.5,23,23,NN,FM,5,"CO Lake Leadville, Mosquito Pass KB0VJJ 145.445"
145,N0FH Estes Park 146685 ,146.685,-,0.6,Tone,123,88.5,23,23,NN,FM,5,CO Larimer Estes Park N0FH 146.685
146,N0FH Estes Park 4498 ,449.8,-,5,Tone,123,88.5,23,23,NN,FM,5,CO Larimer Estes Park N0FH 449.8
147,KC0RBT Fort Collins 44745 ,447.45,-,5,Tone,123,88.5,23,23,NN,FM,5,CO Larimer Fort Collins KC0RBT 447.45
148,W7RF Fort Collins 447725 ,447.725,-,5,Tone,131.8,88.5,23,23,NN,FM,5,CO Larimer Fort Collins W7RF 447.725
149,"W0UPS Fort Collins, Buckhorn Mountain 146625 ",146.625,-,0.6,TSQL,100,100,23,23,NN,FM,5,"CO Larimer Fort Collins, Buckhorn Mountain W0UPS 146.625"
150,"W0UPS Fort Collins, Buckhorn Mountain 22484 ",224.84,-,1.6,TSQL,100,100,23,23,NN,FM,5,"CO Larimer Fort Collins, Buckhorn Mountain W0UPS 224.84"
151,"W0UPS Fort Collins, Buckhorn Mountain 4477 ",447.7,-,5,TSQL,100,100,23,23,NN,FM,5,"CO Larimer Fort Collins, Buckhorn Mountain W0UPS 447.7"
152,"W0QEY Fort Collins, CSU Durward Hall 14736 ",147.36,+,0.6,TSQL,100,100,23,23,NN,FM,5,"CO Larimer Fort Collins, CSU Durward Hall W0QEY 147.36"
153,"W0QEY Fort Collins, CSU Durward Hall 44985 ",449.85,-,5,TSQL,100,100,23,23,NN,FM,5,"CO Larimer Fort Collins, CSU Durward Hall W0QEY 449.85"
154,"N0ZUQ Fort Collins, Christ Mountain 449425 ",449.425,-,5,Tone,94.8,88.5,23,23,NN,FM,5,"CO Larimer Fort Collins, Christ Mountain N0ZUQ 449.425"
155,"W0UPS Fort Collins, Horsetooth Mountain 145115 ",145.115,-,0.6,TSQL,100,100,23,23,NN,FM,5,"CO Larimer Fort Collins, Horsetooth Mountain W0UPS 145.115"
156,"W0UPS Fort Collins, Horsetooth Mountain 447275 ",447.275,-,5,TSQL,100,100,23,23,NN,FM,5,"CO Larimer Fort Collins, Horsetooth Mountain W0UPS 447.275"
157,"W0LRA Loveland, Namaqua Hill 147195 ",147.195,+,0.6,Tone,100,88.5,23,23,NN,FM,5,"CO Larimer Loveland, Namaqua Hill W0LRA 147.195"
158,"W0LRA Loveland, Namaqua Hill 449575 ",449.575,-,5,Tone,100,88.5,23,23,NN,FM,5,"CO Larimer Loveland, Namaqua Hill W0LRA 449.575"
159,WB7UPS Wellington 448325 ,448.325,-,5,Tone,110.9,88.5,23,23,NN,FM,5,CO Larimer Wellington WB7UPS 448.325
160,"KB0VJJ Grand Junction, Grand Mesa 145355 ",145.355,-,0.6,Cross,88.5,123,23,23,NN,FM,5,"CO Mesa Grand Junction, Grand Mesa KB0VJJ 145.355"
161,"KB0YNA Grand Junction, Grand Mesa 44965 ",449.65,-,5,TSQL,151.4,151.4,23,23,NN,FM,5,"CO Mesa Grand Junction, Grand Mesa KB0YNA 449.65"
162,KB0VJJ Craig 14697 ,146.97,-,0.6,Cross,88.5,123,23,23,NN,FM,5,CO Moffat Craig KB0VJJ 146.97
163,WD0HAM Craig 145265 ,145.265,-,0.6,Tone,107.2,88.5,23,23,NN,FM,5,CO Moffat Craig WD0HAM 145.265
164,"AB0PC Bailey, Dick Mountain 146895 ",146.895,-,0.6,TSQL,100,100,23,23,NN,FM,5,"CO Park Bailey, Dick Mountain AB0PC 146.895"
165,"WZ0N Fairplay, Sacramento Mountain 447125 ",447.125,-,5,TSQL,103.5,103.5,23,23,NN,FM,5,"CO Park Fairplay, Sacramento Mountain WZ0N 447.125"
166,"K0VQ Aspen, Aspen Mountain 44705 ",447.05,-,5,TSQL,136.5,136.5,23,23,NN,FM,5,"CO Pitkin Aspen, Aspen Mountain K0VQ 447.05"
167,K0CL Snowmass Village 14667 ,146.67,-,0.6,Tone,107.2,88.5,23,23,NN,FM,5,CO Pitkin Snowmass Village K0CL 146.67
168,KB0VJJ Steamboat Springs 147165 ,147.165,+,0.6,Cross,88.5,123,23,23,NN,FM,5,CO Routt Steamboat Springs KB0VJJ 147.165
169,KB0VJJ Steamboat Springs 449625 ,449.625,-,5,TSQL,123,123,23,23,NN,FM,5,CO Routt Steamboat Springs KB0VJJ 449.625
170,KD0H Steamboat Springs 14721 ,147.21,+,0.6,TSQL,107.2,107.2,23,23,NN,FM,5,CO Routt Steamboat Springs KD0H 147.21
171,WB0QMR Breckenridge 1467 ,146.7,-,0.6,Tone,107.2,88.5,23,23,NN,FM,5,CO Summit Breckenridge WB0QMR 146.7
172,"KB0VJJ Breckenridge, Bald Mountain 14739 ",147.39,+,0.6,Cross,88.5,123,23,23,NN,FM,5,"CO Summit Breckenridge, Bald Mountain KB0VJJ 147.39"
173,AC0KC Fort Lupton 22496 ,224.96,-,1.6,,88.5,88.5,23,23,NN,FM,5,CO Weld Fort Lupton AC0KC 224.96
174,AC0KC Fort Lupton 4473 ,447.3,-,5,Tone,107.2,88.5,23,23,NN,FM,5,CO Weld Fort Lupton AC0KC 447.3
175,KC0KWD Greeley 448475 ,448.475,-,5,Tone,100,88.5,23,23,NN,FM,5,CO Weld Greeley KC0KWD 448.475
176,"K0OJ Greeley, UNC 449725 ",449.725,-,5,Tone,127.3,88.5,23,23,NN,FM,5,"CO Weld Greeley, UNC K0OJ 449.725"
177,"W0UPS Greeley, UNC 14685 ",146.85,-,0.6,TSQL,100,100,23,23,NN,FM,5,"CO Weld Greeley, UNC W0UPS 146.85"
178,"N6RFI Severance, Cactus Hill 4472 ",447.2,-,5,Tone,82.5,88.5,23,23,NN,FM,5,"CO Weld Severance, Cactus Hill N6RFI 447.2"
179,W7BYU Vernal 4497 ,449.7,-,5,Tone,136.5,88.5,23,23,NN,FM,5,UT Uintah Vernal W7BYU 449.7
180,"W7BAR Vernal, Blue Mountain 1471 ",147.1,+,0.6,Tone,136.5,88.5,23,23,NN,FM,5,"UT Uintah Vernal, Blue Mountain W7BAR 147.1"
181,"W7BAR Vernal, Grizzly Ridge 14704 ",147.04,+,0.6,Tone,136.5,88.5,23,23,NN,FM,5,"UT Uintah Vernal, Grizzly Ridge W7BAR 147.04"
182,"KC7SNO Laramie, Beacon Hill 14682 ",146.82,-,0.6,Tone,114.8,88.5,23,23,NN,FM,5,"WY Albany Laramie, Beacon Hill KC7SNO 146.82"
183,KC7OZU Rawlins 14676 ,146.76,-,0.6,Tone,100,88.5,23,23,NN,FM,5,WY Carbon Rawlins KC7OZU 146.76
184,KD7BN Rawlins 14739 ,147.39,+,0.6,Tone,100,88.5,23,23,NN,FM,5,WY Carbon Rawlins KD7BN 147.39
185,KD7SU Rawlins 4483 ,448.3,-,5,Tone,100,88.5,23,23,NN,FM,5,WY Carbon Rawlins KD7SU 448.3
186,N7RON Rawlins 1467 ,146.7,-,0.6,Tone,162.2,88.5,23,23,NN,FM,5,WY Carbon Rawlins N7RON 146.7
187,N7RON Rawlins 4498 ,449.8,-,5,Tone,146.2,88.5,23,23,NN,FM,5,WY Carbon Rawlins N7RON 449.8
188,"N7GCR Rawlins, Elk Mountain 14724 ",147.24,+,0.6,Tone,100,88.5,23,23,NN,FM,5,"WY Carbon Rawlins, Elk Mountain N7GCR 147.24"
189,KB7SWR Cheyenne 145235 ,145.235,-,0.6,Tone,114.8,88.5,23,23,NN,FM,5,WY Laramie Cheyenne KB7SWR 145.235
190,KC7DHF Cheyenne 44895 ,448.95,-,5,Tone,151.4,88.5,23,23,NN,FM,5,WY Laramie Cheyenne KC7DHF 448.95
191,N7EMA Cheyenne 447025 ,447.025,-,5,,88.5,88.5,23,23,NN,FM,5,WY Laramie Cheyenne N7EMA 447.025
192,N7JJY Cheyenne 4499 ,449.9,-,5,TSQL,100,100,23,23,NN,FM,5,WY Laramie Cheyenne N7JJY 449.9
193,"WB7GR Cheyenne, Chalk Bluffs 4493 ",449.3,-,5,Tone,131.8,88.5,23,23,NN,FM,5,"WY Laramie Cheyenne, Chalk Bluffs WB7GR 449.3"
194,"KC7SNO Cheyenne, Denver Hill 146775 ",146.775,-,0.6,Tone,114.8,88.5,23,23,NN,FM,5,"WY Laramie Cheyenne, Denver Hill KC7SNO 146.775"
195,"KC7SNO Cheyenne, North Park 147105 ",147.105,+,0.6,Tone,114.8,88.5,23,23,NN,FM,5,"WY Laramie Cheyenne, North Park KC7SNO 147.105"
196,KF7OBL Rock Springs 1473 ,147.3,+,0.6,,88.5,88.5,23,23,NN,FM,5,WY Sweetwater Rock Springs KF7OBL 147.3
197,"N7RUG Rock Springs, Aspen Mountain 14661 ",146.61,-,0.6,Tone,100,88.5,23,23,NN,FM,5,"WY Sweetwater Rock Springs, Aspen Mountain N7RUG 146.61"
198,"WY7U Rock Springs, Aspen Mountain 14694 ",146.94,-,0.6,Tone,100,88.5,23,23,NN,FM,5,"WY Sweetwater Rock Springs, Aspen Mountain WY7U 146.94"
199,"K7DRA Rock Springs, Aspen Mtn 2224 ",222.4,+,1.6,Tone,123,88.5,23,23,NN,FM,5,"WY Sweetwater Rock Springs, Aspen Mtn K7DRA 222.4"
