Location,Name,Frequency,Duplex,Offset,Tone,rToneFreq,cToneFreq,DtcsCode,DtcsRxCode,DtcsPolarity,Mode,TStep,Comment
57,KB5ITS 145.25,145.25,-,0.6,Tone,100,88.5,23,23,NN,FM,5,"AZ Apache Lukachukai, Roof Butte KB5ITS 145.25"
58,NM5SJ 146.82,146.82,-,0.6,Tone,100,88.5,23,23,NN,FM,5,"AZ Apache Lukachukai, Roof Butte NM5SJ 146.82"
59,N0JSP 146.61,146.61,-,0.6,Tone,123,88.5,23,23,NN,FM,5,"CO Archuleta Pagosa Springs, Oakbrush Hill N0JSP 146.61"
60,KD0MRC 145.325,145.325,-,0.6,Tone,100,88.5,23,23,NN,FM,5,"CO Chaffee Maysville, CO KD0MRC 145.325"
61,K0JSC 449.975,449.975,-,5,TSQL,100,100,23,23,NN,FM,5,"CO Chaffee Salida, Methodist Mountain K0JSC 449.975"
62,KB0VJJ 147.285,147.285,+,0.6,Cross,88.5,123,23,23,NN,FM,5,"CO Chaffee Salida, Methodist Mountain KB0VJJ 147.285"
63,KC0CVU 145.295,145.295,-,0.6,Tone,107.2,88.5,23,23,NN,FM,5,"CO Chaffee Salida, Methodist Mountain KC0CVU 145.295"
64,KC0CVU 449.65,449.65,-,5,Tone,107.2,88.5,23,23,NN,FM,5,"CO Chaffee Salida, Methodist Mountain KC0CVU 449.65"
65,WZ0N 449.925,449.925,-,5,TSQL,103.5,103.5,23,23,NN,FM,5,"CO Chaffee Salida, Methodist Mountain WZ0N 449.925"
66,KC0CVU 449.625,449.625,-,5,Tone,107.2,88.5,23,23,NN,FM,5,"CO Custer Pueblo, Deer Peak KC0CVU 449.625"
67,K0JSC 448.325,448.325,-,5,TSQL,100,100,23,23,NN,FM,5,CO Custer Westcliffe K0JSC 448.325
68,KB0TUC 147.06,147.06,+,0.6,TSQL,77,77,23,23,NN,FM,5,CO Custer Westcliffe KB0TUC 147.06
69,KB0TUC 448.15,448.15,-,5,TSQL,103.5,103.5,23,23,NN,FM,5,CO Custer Westcliffe KB0TUC 448.15
70,W0ALC 147.36,147.36,+,0.6,Tone,100,88.5,23,23,NN,FM,5,CO Delta Cedaredge W0ALC 147.36
71,W0ALC 449.825,449.825,-,5,Tone,100,88.5,23,23,NN,FM,5,CO Delta Cedaredge W0ALC 449.825
72,KC0QXX 147.195,147.195,+,0.6,Tone,107.2,88.5,23,23,NN,FM,5,"CO Delta Cedaredge, Cedar Mesa KC0QXX 147.195"
73, 447.35,447.35,-,5,Tone,107.2,88.5,23,23,NN,FM,5,"CO Delta Cedaredge, Grand Mesa  447.35"
74,KI0MR 147.33,147.33,+,0.6,Tone,107.2,88.5,23,23,NN,FM,5,CO Delta Paonia KI0MR 147.33
75,K0ELK 449.725,449.725,-,5,Tone,179.9,88.5,23,23,NN,FM,5,"CO Garfield Carbondale, Four Mile Ridge K0ELK 449.725"
76,K0SNO 147.39,147.39,+,0.6,Tone,107.2,88.5,23,23,NN,FM,5,"CO Garfield Carbondale, Four Mile Ridge K0SNO 147.39"
77,K0VQ 447.15,447.15,-,5,Tone,136.5,88.5,23,23,NN,FM,5,"CO Garfield Carbondale, Missouri Heights K0VQ 447.15"
78,KB0VJJ 146.85,146.85,-,0.6,Cross,88.5,123,23,23,NN,FM,5,"CO Garfield Glenwood Springs, Sunlight Peak KB0VJJ 146.85"
79,KI0G 146.88,146.88,-,0.6,Tone,107.2,88.5,23,23,NN,FM,5,"CO Garfield Glenwood Springs, Sunlight Peak KI0G 146.88"
80,KI0G 447.1,447.1,-,5,Tone,107.2,88.5,23,23,NN,FM,5,"CO Garfield Glenwood Springs, Sunlight Peak KI0G 447.1"
81,N0XLI 449.6,449.6,-,5,Tone,107.2,88.5,23,23,NN,FM,5,"CO Garfield Glenwood Springs, Sunlight Peak N0XLI 449.6"
82,WA4HND 449.8,449.8,-,5,Tone,107.2,88.5,23,23,NN,FM,5,"CO Garfield Parachute, Mount Callahan WA4HND 449.8"
83,K5GF 449.95,449.95,-,5,,88.5,88.5,23,23,NN,FM,5,CO Gunnison Gunnison K5GF 449.95
84,W0VTL 147.12,147.12,+,0.6,,88.5,88.5,23,23,NN,FM,5,CO Gunnison Gunnison W0VTL 147.12
85,KB0YNA 447.65,447.65,-,5,TSQL,151.4,151.4,23,23,NN,FM,5,"CO Gunnison Gunnison, W Mountain or Tenderfoot Mountain KB0YNA 447.65"
86,KB5ITS 147.135,147.135,-,0.6,Tone,123,88.5,23,23,NN,FM,5,"CO Hinsdale Lake City, Hill 71 KB5ITS 147.135"
87,KB5ITS 444,444,+,5,Tone,67,88.5,23,23,NN,FM,5,"CO Huerfano Silverton, Hazelton KB5ITS 444"
88,K0EP 449.85,449.85,-,5,TSQL,100,100,23,23,NN,FM,5,CO La Plata Durango K0EP 449.85
89,KC5EVE 448.625,448.625,-,5,TSQL,131.8,131.8,23,23,NN,FM,5,CO La Plata Durango KC5EVE 448.625
90,K0EP 146.67,146.67,-,0.6,Tone,100,88.5,23,23,NN,FM,5,"CO La Plata Durango, Eagle Pass K0EP 146.67"
91,K0EP 146.7,146.7,-,0.6,TSQL,100,100,23,23,NN,FM,5,"CO La Plata Durango, Missionary Ridge K0EP 146.7"
92,KB0VJJ 147.345,147.345,+,0.6,Cross,88.5,123,23,23,NN,FM,5,"CO La Plata Durango, Missionary Ridge KB0VJJ 147.345"
93,KB5ITS 147.135,147.135,+,0.6,TSQL,100,100,23,23,NN,FM,5,"CO La Plata Durango, Smelter Mountain KB5ITS 147.135"
94,KB0VIU 145.37,145.37,-,0.6,TSQL,100,100,23,23,NN,FM,5,CO La Plata Hesperus KB0VIU 145.37
95,KB5ITS 147.15,147.15,+,0.6,Tone,100,88.5,23,23,NN,FM,5,"CO La Plata Ignacio, Spring Creek KB5ITS 147.15"
96,N0ZSN 449.75,449.75,-,5,TSQL,100,100,23,23,NN,FM,5,"CO Las Animas La Veta, Cordova Pass N0ZSN 449.75"
97,KB0YNA 449.4,449.4,-,5,TSQL,131.8,131.8,23,23,NN,FM,5,"CO Mesa Delta, Uncompahgre Butte KB0YNA 449.4"
98,K0SSI 147.105,147.105,+,0.6,,88.5,88.5,23,23,NN,FM,5,CO Mesa Grand Junction K0SSI 147.105
99,KC0ARV 447.5,447.5,-,5,Tone,114.8,88.5,23,23,NN,FM,5,CO Mesa Grand Junction KC0ARV 447.5
100,KD0SMZ 449.775,449.775,-,5,Cross,173.8,88.5,23,23,NN,FM,5,CO Mesa Grand Junction KD0SMZ 449.775
101,KE0TY 145.22,145.22,-,0.6,Tone,107.2,88.5,23,23,NN,FM,5,CO Mesa Grand Junction KE0TY 145.22
102,KE0TY 147.39,147.39,+,0.6,Tone,107.2,88.5,23,23,NN,FM,5,CO Mesa Grand Junction KE0TY 147.39
103,W0GJT 146.82,146.82,-,0.6,Tone,107.2,88.5,23,23,NN,FM,5,CO Mesa Grand Junction W0GJT 146.82
104,W0GJT 448.15,448.15,-,5,Tone,100,88.5,23,23,NN,FM,5,CO Mesa Grand Junction W0GJT 448.15
105,W0RRZ 146.94,146.94,-,0.6,TSQL,107.2,107.2,23,23,NN,FM,5,"CO Mesa Grand Junction, Black Ridge (Above Colorado Ntl Monument) W0RRZ 146.94"
106,WA4HND 449.575,449.575,-,5,TSQL,131.8,131.8,23,23,NN,FM,5,"CO Mesa Grand Junction, Black Ridge WA4HND 449.575"
107,W0RRZ 145.175,145.175,-,0.6,Tone,107.2,88.5,23,23,NN,FM,5,"CO Mesa Grand Junction, GJT W0RRZ 145.175"
108,KB0VJJ 145.355,145.355,-,0.6,Cross,88.5,123,23,23,NN,FM,5,"CO Mesa Grand Junction, Grand Mesa KB0VJJ 145.355"
109,KB0VJJ 147.355,147.355,-,0.6,Cross,88.5,123,23,23,NN,FM,5,"CO Mesa Grand Junction, Grand Mesa KB0VJJ 147.355"
110,KB0YNA 449.65,449.65,-,5,TSQL,151.4,151.4,23,23,NN,FM,5,"CO Mesa Grand Junction, Grand Mesa KB0YNA 449.65"
111,WA4HND 449.3,449.3,-,5,TSQL,107.2,107.2,23,23,NN,FM,5,"CO Mesa Grand Junction, Grand Mesa WA4HND 449.3"
112,N0PKT 449.525,449.525,-,5,TSQL,100,100,23,23,NN,FM,5,"CO Mineral Creede, Bristol Head N0PKT 449.525"
113,KD5LWU 146.79,146.79,-,0.6,TSQL,127.3,127.3,23,23,NN,FM,5,"CO Montezuma Cortez, Downtown KD5LWU 146.79"
114,KB5ITS 145.19,145.19,-,0.6,Tone,100,88.5,23,23,NN,FM,5,"CO Montezuma Dolores, Summit Ridge KB5ITS 145.19"
115,KB5ITS 447.275,447.275,-,5,Tone,100,88.5,23,23,NN,FM,5,"CO Montezuma Dolores, Summit Ridge KB5ITS 447.275"
116,KB5ITS 442.375,442.375,+,5,Tone,100,88.5,23,23,NN,FM,5,"CO Montezuma Mancos, Caviness Mountain KB5ITS 442.375"
117,KB5ITS 145.325,145.325,-,0.6,Tone,100,88.5,23,23,NN,FM,5,"CO Montezuma Mancos, Menefee Mountain KB5ITS 145.325"
118,KC0UUX 146.91,146.91,-,0.6,TSQL,107.2,107.2,23,23,NN,FM,5,CO Montrose Montrose KC0UUX 146.91
119,KD5OPD 146.79,146.79,-,0.6,TSQL,107.2,107.2,23,23,NN,FM,5,CO Montrose Montrose KD5OPD 146.79
120,KB0YNA 448.65,448.65,-,5,TSQL,88.5,151.4,23,23,NN,FM,5,"CO Montrose Montrose, Waterdog Peak KB0YNA 448.65"
121,WA4HND 447.2,447.2,-,5,TSQL,107.2,107.2,23,23,NN,FM,5,"CO Montrose Montrose, Waterdog Peak WA4HND 447.2"
122,KB5ITS 147.27,147.27,+,0.6,Tone,127.3,88.5,23,23,NN,FM,5,"CO Ouray Ouray, Engineer Mountain KB5ITS 147.27"
123,K0VQ 447.05,447.05,-,5,TSQL,136.5,136.5,23,23,NN,FM,5,"CO Pitkin Aspen, Aspen Mountain K0VQ 447.05"
124,K0CL 146.67,146.67,-,0.6,Tone,107.2,88.5,23,23,NN,FM,5,CO Pitkin Snowmass Village K0CL 146.67
125,N0KM 146.64,146.64,-,0.6,TSQL,77,77,23,23,NN,FM,5,CO Rio Grande Center N0KM 146.64
126,N0KM 447.1,447.1,-,5,Tone,77,88.5,23,23,NN,FM,5,CO Saguache Center N0KM 447.1
127,KB5ITS 447.525,447.525,-,5,Tone,127.3,88.5,23,23,NN,FM,5,CO San Juan Silverton KB5ITS 447.525
128,KB5ITS 145.325,145.325,-,0.6,Tone,127.3,88.5,23,23,NN,FM,5,"CO San Juan Silverton, Buffalo Boy KB5ITS 145.325"
129,KB5ITT 147.27,147.27,+,0.6,Tone,127.3,88.5,23,23,NN,FM,5,"CO San Juan Silverton, Engineer Mountain KB5ITT 147.27"
130,KB5ITS 147.375,147.375,+,0.6,Tone,156.7,88.5,23,23,NN,FM,5,"CO San Juan Silverton, Kendall Mountain KB5ITS 147.375"
131,KB0YNA 449.7,449.7,-,5,TSQL,107.2,107.2,23,23,NN,FM,5,"CO San Miguel Telluride, Gray Head KB0YNA 449.7"
132,KE5FYL 444.95,444.95,+,5,Cross,100,88.5,23,23,NN,FM,5,"NM Bernalillo Grants,   La Mosca Peak KE5FYL 444.95"
133,K5URR 146.64,146.64,-,0.6,TSQL,67,67,23,23,NN,FM,5,"NM Bernalillo Grants, MW Ridge K5URR 146.64"
134,KE5FYL 147.18,147.18,+,0.6,TSQL,100,100,23,23,NN,FM,5,NM Cibola Grants KE5FYL 147.18
135,WB9ERE 224.88,224.88,-,1.6,Tone,67,88.5,23,23,NN,FM,5,NM Cibola Grants WB9ERE 224.88
136,WB5EKP 146.94,146.94,-,0.6,Tone,100,88.5,23,23,NN,FM,5,"NM Cibola Grants,  Mt Taylor WB5EKP 146.94"
137,NM5ML 444.8,444.8,+,5,Tone,67,88.5,23,23,NN,FM,5,"NM Cibola Grants, La Mosca NM5ML 444.8"
138,NM5ML 146.66,146.66,-,0.6,Tone,100,88.5,23,23,NN,FM,5,"NM Cibola Grants, Microwave Ridge NM5ML 146.66"
139,NM5EM 146.98,146.98,-,0.6,TSQL,141.3,141.3,23,23,NN,FM,5,"NM Cibola Grants, Mt Taylor NM5EM 146.98"
140,NM5ML 444.35,444.35,+,5,Tone,100,88.5,23,23,NN,FM,5,"NM Colfax Eagle Nest, Iron Mountain NM5ML 444.35"
141,NM5EM 147.04,147.04,+,0.6,Tone,141.3,88.5,23,23,NN,FM,5,"NM Colfax Eagle Nest, Touch Me Not NM5EM 147.04"
142,KA5BIW 224.04,224.04,-,1.6,TSQL,100,100,23,23,NN,FM,5,NM Los Alamos Los Alamos KA5BIW 224.04
143,KA5BIW 442,442,+,5,Tone,100,88.5,23,23,NN,FM,5,NM Los Alamos Los Alamos KA5BIW 442
144,KC2HSO 144.265,144.265,,0,Tone,203.5,88.5,23,23,NN,FM,5,NM Los Alamos Los Alamos KC2HSO 144.265
145,W5PDO 146.88,146.88,-,0.6,,88.5,88.5,23,23,NN,FM,5,"NM Los Alamos Los Alamos, Barranca Mesa W5PDO 146.88"
146,KB5RX 223.94,223.94,-,1.6,,88.5,88.5,23,23,NN,FM,5,"NM Los Alamos Los Alamos, Pajarito Mountain KB5RX 223.94"
147,W5SF 145.19,145.19,-,0.6,Tone,162.2,88.5,23,23,NN,FM,5,"NM Los Alamos Los Alamos, Pajarito Mountain W5SF 145.19"
148,KC5WDV 449.75,449.75,-,5,Tone,100,88.5,23,23,NN,FM,5,NM McKinley Gallup KC5WDV 449.75
149,KC5WDV 448.2,448.2,-,5,Tone,100,88.5,23,23,NN,FM,5,"NM McKinley Gallup, Deza Bluffs KC5WDV 448.2"
150,NM5ML 147.22,147.22,+,0.6,Tone,67,88.5,23,23,NN,FM,5,"NM McKinley Gallup, Deza Bluffs NM5ML 147.22"
151,KC5WDV 147.26,147.26,+,0.6,Tone,100,88.5,23,23,NN,FM,5,"NM McKinley Gallup, Gibson Peak KC5WDV 147.26"
152,K7LEN 145.29,145.29,-,0.6,Tone,123,88.5,23,23,NN,FM,5,NM McKinley Window Rock K7LEN 145.29
153,W5SF 147.08,147.08,+,0.6,Tone,162.2,88.5,23,23,NN,FM,5,"NM Rio Arriba Chama, Overlook Mtn W5SF 147.08"
154,KD5PX 147.18,147.18,+,0.6,TSQL,100,100,23,23,NN,FM,5,"NM Rio Arriba Dixon, Cerro Abajo KD5PX 147.18"
155,NM5SJ 145.43,145.43,-,0.6,Tone,136.5,88.5,23,23,NN,FM,5,NM Rio Arriba Dulce NM5SJ 145.43
156,NM5SJ 145.49,145.49,-,0.6,Tone,100,88.5,23,23,NN,FM,5,NM Rio Arriba Lybrook NM5SJ 145.49
157,KF5PFO 146.76,146.76,-,0.6,Tone,67,88.5,23,23,NN,FM,5,"NM Rio Arriba Tres Piedras,  San Antonio Mountain KF5PFO 146.76"
158,NM5ML 147.22,147.22,+,0.6,Tone,100,88.5,23,23,NN,FM,5,"NM Rio Arriba Tres Piedras, San Antonio Mountain NM5ML 147.22"
159,KB5ITS 447.45,447.45,-,5,Tone,107.2,88.5,23,23,NN,FM,5,NM San Juan Aztec KB5ITS 447.45
160,NM5SJ 146.74,146.74,-,0.6,Tone,100,88.5,23,23,NN,FM,5,NM San Juan Aztec NM5SJ 146.74
161,KB5ITS 146.88,146.88,-,0.6,Tone,100,88.5,23,23,NN,FM,5,"NM San Juan Aztec, Tank Mtn KB5ITS 146.88"
162,K5WXI 146.92,146.92,-,0.6,Tone,100,88.5,23,23,NN,FM,5,NM San Juan Bloomfield K5WXI 146.92
163,KB5ITS 448.65,448.65,-,5,Tone,127.3,88.5,23,23,NN,FM,5,NM San Juan Bloomfield KB5ITS 448.65
164,NM5ML 147.28,147.28,+,0.6,Tone,67,88.5,23,23,NN,FM,5,"NM San Juan Bloomfield, Harris Mesa NM5ML 147.28"
165,KB5ITS 147.1,147.1,+,0.6,Tone,100,88.5,23,23,NN,FM,5,"NM San Juan Bloomfield, Harris mesa KB5ITS 147.1"
166,K5WXI 146.85,146.85,-,0.6,TSQL,100,100,23,23,NN,FM,5,NM San Juan Farmington K5WXI 146.85
167,K5WY 449,449,-,5,Tone,100,88.5,23,23,NN,FM,5,NM San Juan Farmington K5WY 449
168,KB5ITS 146.76,146.76,-,0.6,TSQL,100,100,23,23,NN,FM,5,NM San Juan Farmington KB5ITS 146.76
169,KB5ITS 147,147,+,0.6,Tone,100,88.5,23,23,NN,FM,5,NM San Juan Farmington KB5ITS 147
170,KB5ITS 147.36,147.36,+,0.6,Tone,100,88.5,23,23,NN,FM,5,"NM San Juan Navajo Dam, Navajo Lake KB5ITS 147.36"
171,NM5SJ 147.06,147.06,+,0.6,Tone,100,88.5,23,23,NN,FM,5,"NM San Juan Nebo, Cedar Hill NM5SJ 147.06"
172,NM5ML 147.24,147.24,+,0.6,Tone,67,88.5,23,23,NN,FM,5,"NM Sandoval Cuba, Eureka Mesa NM5ML 147.24"
173,K5AKW 443.4,443.4,+,5,Tone,100,88.5,23,23,NN,FM,5,"NM Sandoval Placitas, Sandia Peak K5AKW 443.4"
174,KC5IPK 442.75,442.75,+,5,Tone,162.2,88.5,23,23,NN,FM,5,NM Sandoval Rio Rancho KC5IPK 442.75
175,WA5OLD 442.35,442.35,+,5,Tone,100,88.5,23,23,NN,FM,5,NM Sandoval Rio Rancho WA5OLD 442.35
176,NM5RR 147.1,147.1,+,0.6,TSQL,100,100,23,23,NN,FM,5,"NM Sandoval Rio Rancho, Rainbow NM5RR 147.1"
177,NM5RR 443,443,+,5,Tone,100,88.5,23,23,NN,FM,5,"NM Sandoval Rio Rancho, Rainbow NM5RR 443"
178,K5YEJ 443,443,+,5,Tone,100,88.5,23,23,NN,FM,5,"NM Sandoval San Luis, Cabezon K5YEJ 443"
179,NM5SC 443.1,443.1,+,5,Tone,100,88.5,23,23,NN,FM,5,"NM Sandoval San Ysidro, Pajarito Peak NM5SC 443.1"
180,K9GAJ 449.275,449.275,-,5,Tone,146.2,88.5,23,23,NN,FM,5,NM Santa Fe Santa Fe K9GAJ 449.275
181,KF5SGT 447.775,447.775,-,5,Tone,100,88.5,23,23,NN,FM,5,NM Santa Fe Santa Fe KF5SGT 447.775
182,W5SF 146.82,146.82,-,0.6,Tone,162.2,88.5,23,23,NN,FM,5,"NM Santa Fe Santa Fe,  Tesuque Peak W5SF 146.82"
183,N5BGC 147.2,147.2,+,0.6,Tone,162.2,88.5,23,23,NN,FM,5,"NM Santa Fe Santa Fe, St Vincent Hospital N5BGC 147.2"
184,KB5ZQE 442.825,442.825,+,5,Tone,131.8,88.5,23,23,NN,FM,5,"NM Santa Fe Santa Fe, Tesuque Peak KB5ZQE 442.825"
185,NM5EM 147.02,147.02,+,0.6,Tone,141.3,88.5,23,23,NN,FM,5,"NM Santa Fe Santa Fe, Tesuque Peak NM5EM 147.02"
186,KF5PFO 145.39,145.39,-,0.6,Tone,100,88.5,23,23,NN,FM,5,"NM Taos Red River, Molycorp KF5PFO 145.39"
187,KF5PFO 145.25,145.25,-,0.6,Tone,123,88.5,23,23,NN,FM,5,"NM Taos Red River, Valle Vidal KF5PFO 145.25"
188,KF5PFO 147.12,147.12,+,0.6,Tone,67,88.5,23,23,NN,FM,5,"NM Taos Taos, Picuris Peak KF5PFO 147.12"
189,KF5PFO 224.4,224.4,-,1.6,Tone,225.7,88.5,23,23,NN,FM,5,"NM Taos Taos, Picuris Peak KF5PFO 224.4"
190,KF5PFO 449.875,449.875,-,5,Tone,123,88.5,23,23,NN,FM,5,"NM Taos Taos, Picuris Peak KF5PFO 449.875"
191,NM5ML 147.14,147.14,+,0.6,Tone,67,88.5,23,23,NN,FM,5,"NM Taos Taos, Ski Valley NM5ML 147.14"
192,N5TSV 444.975,444.975,+,5,Tone,123,88.5,23,23,NN,FM,5,"NM Taos Taos, Wheeler Peak N5TSV 444.975"
193,KF5PFO 146.76,146.76,-,0.6,Tone,67,88.5,23,23,NN,FM,5,"NM Taos Tres Piedras, San Antonio Mountain KF5PFO 146.76"
194,K7QEQ 146.9,146.9,-,0.6,Tone,88.5,88.5,23,23,NN,FM,5,UT Grand Moab K7QEQ 146.9
195,K7QEQ 146.76,146.76,-,0.6,Tone,88.5,88.5,23,23,NN,FM,5,"UT Grand Moab, Bald Mesa K7QEQ 146.76"
196,K7QEQ 449.1,449.1,-,5,TSQL,107.2,107.2,23,23,NN,FM,5,"UT Grand Moab, Bald Mesa K7QEQ 449.1"
197,KD7HLL 449.9,449.9,-,5,Tone,123,88.5,23,23,NN,FM,5,UT San Juan Mexican Hat KD7HLL 449.9
198,K7QEQ 447.1,447.1,-,5,TSQL,107.2,107.2,23,23,NN,FM,5,"UT San Juan Monticello, Abajo Peak K7QEQ 447.1"
199,K7SDC 146.61,146.61,-,0.6,Tone,88.5,88.5,23,23,NN,FM,5,"UT San Juan Monticello, Abajo Peak K7SDC 146.61"
