Location,Name,Frequency,Duplex,Offset,Tone,rToneFreq,cToneFreq,DtcsCode,DtcsRxCode,DtcsPolarity,Mode,TStep,Comment
0,Brighton KD0RG 449.925,449.925,-,5,TSQL,114.8,114.8,23,23,NN,FM,5,CO Adams Brighton KD0RG 449.925
1,Northglenn K0ML 147.045,147.045,+,0.6,Tone,123,88.5,23,23,NN,FM,5,CO Adams Northglenn K0ML 147.045
2,Westminster N1UPS 449.3,449.3,-,5,Tone,100,88.5,23,23,NN,FM,5,CO Adams Westminster N1UPS 449.3
3,Aurora N0OBA 145.19,145.19,-,0.6,Cross,151.4,131.8,23,23,NN,FM,5,CO Arapahoe Aurora N0OBA 145.19
4,Aurora N0ZUQ 448.4,448.4,-,5,Tone,94.8,88.5,23,23,NN,FM,5,CO Arapahoe Aurora N0ZUQ 448.4
5,Aurora W0BG 448.275,448.275,-,5,Tone,156.7,88.5,23,23,NN,FM,5,CO Arapahoe Aurora W0BG 448.275
6,"Aurora, Smoky Hill KB0UDD 145.4",145.4,-,0.8,Tone,100,88.5,23,23,NN,FM,5,"CO Arapahoe Aurora, Smoky Hill KB0UDD 145.4"
7,"Allenspark, AFPD Station #5 KI0HG 147.03",147.03,+,0.6,Tone,100,88.5,23,23,NN,FM,5,"CO Boulder Allenspark, AFPD Station #5 KI0HG 147.03"
8,Boulder W0IA 449.55,449.55,-,5,Tone,100,88.5,23,23,NN,FM,5,CO Boulder Boulder W0IA 449.55
9,"Boulder, Eldorado Mountain W0CRA 145.46",145.46,-,0.6,TSQL,107.2,107.2,23,23,NN,FM,5,"CO Boulder Boulder, Eldorado Mountain W0CRA 145.46"
10,"Boulder, Eldorado Mountain W0CRA 447.975",447.975,-,5,TSQL,107.2,107.2,23,23,NN,FM,5,"CO Boulder Boulder, Eldorado Mountain W0CRA 447.975"
11,"Boulder, Gunbarrel Hill W0IA 146.76",146.76,-,0.6,Tone,100,88.5,23,23,NN,FM,5,"CO Boulder Boulder, Gunbarrel Hill W0IA 146.76"
12,"Boulder, Lee Hill N0SZ 447.75",447.75,-,5,TSQL,141.3,141.3,23,23,NN,FM,5,"CO Boulder Boulder, Lee Hill N0SZ 447.75"
13,"Boulder, Lee Hill W0IA 224.02",224.02,-,1.6,,88.5,88.5,23,23,NN,FM,5,"CO Boulder Boulder, Lee Hill W0IA 224.02"
14,"Boulder, Table Mesa W0DK 448.9",448.9,-,5,Tone,100,88.5,23,23,NN,FM,5,"CO Boulder Boulder, Table Mesa W0DK 448.9"
15,"Boulder, Table Mountain W0DK 146.7",146.7,-,0.6,Tone,100,88.5,23,23,NN,FM,5,"CO Boulder Boulder, Table Mountain W0DK 146.7"
16,Broomfield W0LMA 448.925,448.925,-,5,Tone,131.8,88.5,23,23,NN,FM,5,CO Boulder Broomfield W0LMA 448.925
17,Broomfield W0WYX 449.825,449.825,-,5,Tone,103.5,88.5,23,23,NN,FM,5,CO Boulder Broomfield W0WYX 449.825
18,Gold Hill W0JZ 146.91,146.91,+,0.6,Cross,123,127.3,23,23,NN,FM,5,CO Boulder Gold Hill W0JZ 146.91
19,Longmont N0EPA 448.525,448.525,-,5,Tone,151.4,88.5,23,23,NN,FM,5,CO Boulder Longmont N0EPA 448.525
20,Longmont W0ENO 147.27,147.27,+,0.6,TSQL,100,100,23,23,NN,FM,5,CO Boulder Longmont W0ENO 147.27
21,Longmont W0ENO 448.8,448.8,-,5,TSQL,88.5,88.5,23,23,NN,FM,5,CO Boulder Longmont W0ENO 448.8
22,"Maysville, CO KD0MRC 145.325",145.325,-,0.6,Tone,100,88.5,23,23,NN,FM,5,"CO Chaffee Maysville, CO KD0MRC 145.325"
23,"Salida, Methodist Mountain K0JSC 449.975",449.975,-,5,TSQL,100,100,23,23,NN,FM,5,"CO Chaffee Salida, Methodist Mountain K0JSC 449.975"
24,"Salida, Methodist Mountain KB0VJJ 147.285",147.285,+,0.6,Cross,88.5,123,23,23,NN,FM,5,"CO Chaffee Salida, Methodist Mountain KB0VJJ 147.285"
25,"Salida, Methodist Mountain KC0CVU 145.295",145.295,-,0.6,Tone,107.2,88.5,23,23,NN,FM,5,"CO Chaffee Salida, Methodist Mountain KC0CVU 145.295"
26,"Salida, Methodist Mountain KC0CVU 449.65",449.65,-,5,Tone,107.2,88.5,23,23,NN,FM,5,"CO Chaffee Salida, Methodist Mountain KC0CVU 449.65"
27,"Salida, Methodist Mountain WZ0N 449.925",449.925,-,5,TSQL,103.5,103.5,23,23,NN,FM,5,"CO Chaffee Salida, Methodist Mountain WZ0N 449.925"
28,"Evergreen, Saddleback Mountain AC0KQ 447.85",447.85,-,5,TSQL,141.3,141.3,23,23,NN,FM,5,"CO Clear Creek Evergreen, Saddleback Mountain AC0KQ 447.85"
29,"Evergreen, Squaw Mountain N0PYY 147.3",147.3,+,0.6,TSQL,103.5,103.5,23,23,NN,FM,5,"CO Clear Creek Evergreen, Squaw Mountain N0PYY 147.3"
30,"Idaho Springs, Squaw Mountain K1DUN 449.45",449.45,-,5,Cross,103.5,127.3,23,23,NN,FM,5,"CO Clear Creek Idaho Springs, Squaw Mountain K1DUN 449.45"
31,"Idaho Springs, Squaw Mountain KB0UDD 146.67",146.67,-,0.6,TSQL,100,100,23,23,NN,FM,5,"CO Clear Creek Idaho Springs, Squaw Mountain KB0UDD 146.67"
32,"Idaho Springs, Squaw Mountain N0SZ 448.225",448.225,-,5,TSQL,141.3,141.3,23,23,NN,FM,5,"CO Clear Creek Idaho Springs, Squaw Mountain N0SZ 448.225"
33,"Idaho Springs, Squaw Mountain W0CRA 145.145",145.145,-,0.6,TSQL,107.2,107.2,23,23,NN,FM,5,"CO Clear Creek Idaho Springs, Squaw Mountain W0CRA 145.145"
34,"Idaho Springs, Squaw Mountain W0CRA 447.575",447.575,-,5,TSQL,107.2,107.2,23,23,NN,FM,5,"CO Clear Creek Idaho Springs, Squaw Mountain W0CRA 447.575"
35,"Idaho Springs, Squaw Mountain W0TX 449.35",449.35,-,5,TSQL,100,100,23,23,NN,FM,5,"CO Clear Creek Idaho Springs, Squaw Mountain W0TX 449.35"
36,"Idaho Springs, Squaw Mountain W0WYX 146.94",146.94,-,0.6,TSQL,103.5,103.5,23,23,NN,FM,5,"CO Clear Creek Idaho Springs, Squaw Mountain W0WYX 146.94"
37,"Idaho Springs, Squaw Mountain WR0AEN 449",449,-,5,TSQL,136.5,136.5,23,23,NN,FM,5,"CO Clear Creek Idaho Springs, Squaw Mountain WR0AEN 449"
38,"Aurora, Smokey Hill KB0UDD 448.5",448.5,-,5,Tone,100,88.5,23,23,NN,FM,5,"CO Denver Aurora, Smokey Hill KB0UDD 448.5"
39,Denver K0FEZ 447.925,447.925,-,5,TSQL,100,100,23,23,NN,FM,5,CO Denver Denver K0FEZ 447.925
40,Denver N0JXN 146.715,146.715,-,0.6,TSQL,123,123,23,23,NN,FM,5,CO Denver Denver N0JXN 146.715
41,Denver N5EHP 448.075,448.075,-,5,Tone,123,88.5,23,23,NN,FM,5,CO Denver Denver N5EHP 448.075
42,"Denver, Broadway Plaza Lofts W0JRL 447.175",447.175,-,5,TSQL,100,100,23,23,NN,FM,5,"CO Denver Denver, Broadway Plaza Lofts W0JRL 447.175"
43,"Denver, Green Valley Ranch K0GUR 448.15",448.15,-,5,TSQL,141.3,141.3,23,23,NN,FM,5,"CO Denver Denver, Green Valley Ranch K0GUR 448.15"
44,"Golden, Centennial Cone K0FEZ 146.985",146.985,-,0.6,TSQL,100,100,23,23,NN,FM,5,"CO Denver Golden, Centennial Cone K0FEZ 146.985"
45,"Idaho Springs, Squaw Mountain W0CFI 448.675",448.675,-,5,TSQL,100,100,23,23,NN,FM,5,"CO Denver Idaho Springs, Squaw Mountain W0CFI 448.675"
46,"Idaho Springs, Squaw Mountain WG0N 449.05",449.05,-,5,TSQL,107.2,107.2,23,23,NN,FM,5,"CO Denver Idaho Springs, Squaw Mountain WG0N 449.05"
47,"Castle Pines, Daniels Park W9SL 449.95",449.95,-,5,TSQL,77,77,23,23,NN,FM,5,"CO Douglas Castle Pines, Daniels Park W9SL 449.95"
48,"Castle Rock, Devils Head (Pike National Forest) N0ESQ 447.525",447.525,-,5,TSQL,146.2,146.2,23,23,NN,FM,5,"CO Douglas Castle Rock, Devils Head (Pike National Forest) N0ESQ 447.525"
49,"Larkspur, Westcreek K0JSC 449.975",449.975,-,5,TSQL,100,100,23,23,NN,FM,5,"CO Douglas Larkspur, Westcreek K0JSC 449.975"
50,"Larkspur, Westcreek W0CRA 147.225",147.225,+,0.6,TSQL,107.2,107.2,23,23,NN,FM,5,"CO Douglas Larkspur, Westcreek W0CRA 147.225"
51,"Larkspur, Westcreek W0CRA 448.425",448.425,-,5,TSQL,107.2,107.2,23,23,NN,FM,5,"CO Douglas Larkspur, Westcreek W0CRA 448.425"
52,"Palmer Lake, Monument Hill N0XLF 145.19",145.19,-,0.6,TSQL,131.8,131.8,23,23,NN,FM,5,"CO Douglas Palmer Lake, Monument Hill N0XLF 145.19"
53,Parker WQ8M 448.7,448.7,-,5,Tone,146.2,88.5,23,23,NN,FM,5,CO Douglas Parker WQ8M 448.7
54,"Parker, Hess Reservoir N0ESQ 447.525",447.525,-,5,Cross,203.5,146.2,23,23,NN,FM,5,"CO Douglas Parker, Hess Reservoir N0ESQ 447.525"
55,Vail KB0VJJ 147.345,147.345,+,0.6,Cross,88.5,123,23,23,NN,FM,5,CO Eagle Vail KB0VJJ 147.345
56,Vail N0AFO 224.8,224.8,-,1.6,,88.5,88.5,23,23,NN,FM,5,CO Eagle Vail N0AFO 224.8
57,"Vail, Bald Mountain K0RV 146.61",146.61,-,0.6,Tone,107.2,88.5,23,23,NN,FM,5,"CO Eagle Vail, Bald Mountain K0RV 146.61"
58,Colorado Springs  147.27,147.27,+,0.6,,88.5,88.5,23,23,NN,FM,5,CO El Paso Colorado Springs  147.27
59,Colorado Springs AA0L 147.135,147.135,+,0.6,Tone,100,88.5,23,23,NN,FM,5,CO El Paso Colorado Springs AA0L 147.135
60,Colorado Springs AA0L 448.3,448.3,-,5,Tone,100,88.5,23,23,NN,FM,5,CO El Paso Colorado Springs AA0L 448.3
61,Colorado Springs K0IRP 146.91,146.91,-,0.6,TSQL,151.4,151.4,23,23,NN,FM,5,CO El Paso Colorado Springs K0IRP 146.91
62,Colorado Springs K0IRP 447.35,447.35,-,5,Tone,151.4,88.5,23,23,NN,FM,5,CO El Paso Colorado Springs K0IRP 447.35
63,Colorado Springs NX0G 447.475,447.475,-,5,Tone,107.2,88.5,23,23,NN,FM,5,CO El Paso Colorado Springs NX0G 447.475
64,Colorado Springs W0MOG 147.39,147.39,+,0.6,Tone,103.5,88.5,23,23,NN,FM,5,CO El Paso Colorado Springs W0MOG 147.39
65,Colorado Springs W0MOG 448.6,448.6,-,5,Tone,114.8,88.5,23,23,NN,FM,5,CO El Paso Colorado Springs W0MOG 448.6
66,Colorado Springs W0RSH 146.85,146.85,-,0.6,Tone,103.5,88.5,23,23,NN,FM,5,CO El Paso Colorado Springs W0RSH 146.85
67,Colorado Springs WA6IFI 447.55,447.55,-,5,Tone,123,88.5,23,23,NN,FM,5,CO El Paso Colorado Springs WA6IFI 447.55
68,"Colorado Springs, Broadmoor Area N0KG 448.25",448.25,-,5,Tone,123,88.5,23,23,NN,FM,5,"CO El Paso Colorado Springs, Broadmoor Area N0KG 448.25"
69,"Colorado Springs, Cheyenne Mountain KB0VJJ 145.13",145.13,-,0.6,Cross,88.5,123,23,23,NN,FM,5,"CO El Paso Colorado Springs, Cheyenne Mountain KB0VJJ 145.13"
70,"Colorado Springs, Cheyenne Mountain KC0CVU 146.76",146.76,-,0.6,TSQL,107.2,107.2,23,23,NN,FM,5,"CO El Paso Colorado Springs, Cheyenne Mountain KC0CVU 146.76"
71,"Colorado Springs, Cheyenne Mountain KC0CVU 147.345",147.345,+,0.6,TSQL,107.2,107.2,23,23,NN,FM,5,"CO El Paso Colorado Springs, Cheyenne Mountain KC0CVU 147.345"
72,"Colorado Springs, Cheyenne Mountain KC0CVU 448",448,-,5,Tone,107.2,88.5,23,23,NN,FM,5,"CO El Paso Colorado Springs, Cheyenne Mountain KC0CVU 448"
73,"Colorado Springs, Cheyenne Mountain KC0CVU 448.1",448.1,-,5,TSQL,107.2,107.2,23,23,NN,FM,5,"CO El Paso Colorado Springs, Cheyenne Mountain KC0CVU 448.1"
74,"Colorado Springs, Cheyenne Mountain W0CRA 145.16",145.16,-,0.6,TSQL,107.2,107.2,23,23,NN,FM,5,"CO El Paso Colorado Springs, Cheyenne Mountain W0CRA 145.16"
75,"Colorado Springs, Fillmore Hill KA0TTF 448.725",448.725,-,5,Tone,123,88.5,23,23,NN,FM,5,"CO El Paso Colorado Springs, Fillmore Hill KA0TTF 448.725"
76,"Colorado Springs, Pikes Peak KB0SRJ 146.97",146.97,-,0.6,Cross,100,123,23,23,NN,FM,5,"CO El Paso Colorado Springs, Pikes Peak KB0SRJ 146.97"
77,"Colorado Springs, Pikes Peak KB0SRJ 448.45",448.45,-,5,Tone,100,88.5,23,23,NN,FM,5,"CO El Paso Colorado Springs, Pikes Peak KB0SRJ 448.45"
78,Colorado springs W0MOG 224.72,224.72,-,1.6,TSQL,103.5,103.5,23,23,NN,FM,5,CO El Paso Colorado springs W0MOG 224.72
79,"Falcon, Black Forest KD0MDP 447.625",447.625,-,5,TSQL,100,100,23,23,NN,FM,5,"CO El Paso Falcon, Black Forest KD0MDP 447.625"
80,"Monument, Monument Hill K0NR 447.725",447.725,-,5,TSQL,100,100,23,23,NN,FM,5,"CO El Paso Monument, Monument Hill K0NR 447.725"
81,"Canon City, Fremont Peak K0JSC 447.25",447.25,-,5,TSQL,100,100,23,23,NN,FM,5,"CO Fremont Canon City, Fremont Peak K0JSC 447.25"
82,"Canon City, Fremont Peak WD0EKR 145.49",145.49,-,0.6,TSQL,103.5,103.5,23,23,NN,FM,5,"CO Fremont Canon City, Fremont Peak WD0EKR 145.49"
83,"Canon City, Fremont Peak WD0EKR 223.96",223.96,-,1.6,TSQL,103.5,103.5,23,23,NN,FM,5,"CO Fremont Canon City, Fremont Peak WD0EKR 223.96"
84,"Canon City, Fremont Peak WD0EKR 447.75",447.75,-,5,TSQL,103.5,103.5,23,23,NN,FM,5,"CO Fremont Canon City, Fremont Peak WD0EKR 447.75"
85,"Canon City, eightmile Mountain WB0WDF 449",449,-,5,TSQL,67,67,23,23,NN,FM,5,"CO Fremont Canon City, eightmile Mountain WB0WDF 449"
86,"Carbondale, Missouri Heights K0VQ 447.15",447.15,-,5,Tone,136.5,88.5,23,23,NN,FM,5,"CO Garfield Carbondale, Missouri Heights K0VQ 447.15"
87,"Boulder, Thorodin Mountain KB0VJJ 145.31",145.31,-,0.6,Cross,88.5,123,23,23,NN,FM,5,"CO Gilpin Boulder, Thorodin Mountain KB0VJJ 145.31"
88,"Denver, Thorodin Mountain N0SZ 449.225",449.225,-,5,TSQL,141.3,141.3,23,23,NN,FM,5,"CO Gilpin Denver, Thorodin Mountain N0SZ 449.225"
89,Rollinsville W0RM 224.6,224.6,-,1.6,Tone,100,88.5,23,23,NN,FM,5,CO Gilpin Rollinsville W0RM 224.6
90,Granby KA0YDW 146.82,146.82,-,0.6,Tone,123,88.5,23,23,NN,FM,5,CO Grand Granby KA0YDW 146.82
91,"Kremmling, Santoy Peak KB0VJJ 147.075",147.075,+,0.6,Cross,88.5,123,23,23,NN,FM,5,"CO Grand Kremmling, Santoy Peak KB0VJJ 147.075"
92,Winter Park WA4CCC 447.45,447.45,-,5,Tone,103.5,88.5,23,23,NN,FM,5,CO Grand Winter Park WA4CCC 447.45
93,"Winter Park, Winter Park KB0VJJ 147.285",147.285,+,0.6,Cross,88.5,123,23,23,NN,FM,5,"CO Grand Winter Park, Winter Park KB0VJJ 147.285"
94,"Gunnison, W Mountain or Tenderfoot Mountain KB0YNA 447.65",447.65,-,5,TSQL,151.4,151.4,23,23,NN,FM,5,"CO Gunnison Gunnison, W Mountain or Tenderfoot Mountain KB0YNA 447.65"
95,"Boulder, Blue Mountain KE0SJ 145.475",145.475,-,0.6,Tone,100,88.5,23,23,NN,FM,5,"CO Jefferson Boulder, Blue Mountain KE0SJ 145.475"
96,"Centennial, Warren Mountain WB0TUB 146.88",146.88,-,0.6,Tone,100,88.5,23,23,NN,FM,5,"CO Jefferson Centennial, Warren Mountain WB0TUB 146.88"
97,"Centennial, Warren Mountain WB0TUB 449.6",449.6,-,5,Tone,100,88.5,23,23,NN,FM,5,"CO Jefferson Centennial, Warren Mountain WB0TUB 449.6"
98,"Conifer, Critchell Mountain N0OWY 447.5",447.5,-,5,TSQL,88.5,88.5,23,23,NN,FM,5,"CO Jefferson Conifer, Critchell Mountain N0OWY 447.5"
99,"Critchell, Critchell Mountain N0ARA 147.12",147.12,+,0.6,TSQL,88.5,88.5,23,23,NN,FM,5,"CO Jefferson Critchell, Critchell Mountain N0ARA 147.12"
100,Evergreen KE4GUQ 145.34,145.34,-,0.6,Cross,103.5,127.3,23,23,NN,FM,5,CO Jefferson Evergreen KE4GUQ 145.34
101,Golden N0PYY 448.125,448.125,-,5,Tone,107.2,88.5,23,23,NN,FM,5,CO Jefferson Golden N0PYY 448.125
102,Golden W0GV 448.975,448.975,-,5,Tone,123,88.5,23,23,NN,FM,5,CO Jefferson Golden W0GV 448.975
103,"Golden, Centennial Cone KE0SJ 145.28",145.28,-,0.6,Tone,100,88.5,23,23,NN,FM,5,"CO Jefferson Golden, Centennial Cone KE0SJ 145.28"
104,"Golden, Centennial Cone KE0SJ 449.525",449.525,-,5,,88.5,88.5,23,23,NN,FM,5,"CO Jefferson Golden, Centennial Cone KE0SJ 449.525"
105,"Golden, Centennial Cone W0TX 448.625",448.625,-,5,TSQL,100,100,23,23,NN,FM,5,"CO Jefferson Golden, Centennial Cone W0TX 448.625"
106,"Golden, Centennial Cone WB0TUB 146.64",146.64,-,0.6,Tone,100,88.5,23,23,NN,FM,5,"CO Jefferson Golden, Centennial Cone WB0TUB 146.64"
107,"Golden, Guy Hill K0IBM 448.85",448.85,-,5,TSQL,88.5,88.5,23,23,NN,FM,5,"CO Jefferson Golden, Guy Hill K0IBM 448.85"
108,"Golden, Guy Hill KI0GO 449.75",449.75,-,5,TSQL,103.5,103.5,23,23,NN,FM,5,"CO Jefferson Golden, Guy Hill KI0GO 449.75"
109,"Golden, Guy Hill N0MHU 224",224,-,1.6,TSQL,103.5,103.5,23,23,NN,FM,5,"CO Jefferson Golden, Guy Hill N0MHU 224"
110,"Golden, Guy Hill N0POH 224.74",224.74,-,1.6,TSQL,88.5,88.5,23,23,NN,FM,5,"CO Jefferson Golden, Guy Hill N0POH 224.74"
111,"Golden, Guy Hill W0CBI 147.15",147.15,+,0.6,TSQL,100,100,23,23,NN,FM,5,"CO Jefferson Golden, Guy Hill W0CBI 147.15"
112,"Golden, Lookout Mountain W0KU 449.625",449.625,-,5,TSQL,141.3,141.3,23,23,NN,FM,5,"CO Jefferson Golden, Lookout Mountain W0KU 449.625"
113,"Idaho Springs, Centennial Cone W0TX 145.49",145.49,-,0.6,TSQL,100,100,23,23,NN,FM,5,"CO Jefferson Idaho Springs, Centennial Cone W0TX 145.49"
114,Lakewood N0ELY 448.75,448.75,-,5,TSQL,100,100,23,23,NN,FM,5,CO Jefferson Lakewood N0ELY 448.75
115,"Lakewood, Green Mountain W0TX 147.33",147.33,+,0.6,Tone,100,88.5,23,23,NN,FM,5,"CO Jefferson Lakewood, Green Mountain W0TX 147.33"
116,"Lakewood, Green Mountain W0TX 224.38",224.38,-,1.6,TSQL,100,100,23,23,NN,FM,5,"CO Jefferson Lakewood, Green Mountain W0TX 224.38"
117,"Lakewood, St Anthony Medical Campus W0TX 447.825",447.825,-,5,DTCS,88.5,88.5,73,73,NN,NFM,5,"CO Jefferson Lakewood, St Anthony Medical Campus W0TX 447.825"
118,"Morrison, Mt. Morrison N6LXX 447.875",447.875,-,5,TSQL,107.2,107.2,23,23,NN,FM,5,"CO Jefferson Morrison, Mt. Morrison N6LXX 447.875"
119,"Leadville, Mosquito Pass KB0VJJ 145.445",145.445,-,0.6,Tone,88.5,88.5,23,23,NN,FM,5,"CO Lake Leadville, Mosquito Pass KB0VJJ 145.445"
120,Estes Park N0FH 146.685,146.685,-,0.6,Tone,123,88.5,23,23,NN,FM,5,CO Larimer Estes Park N0FH 146.685
121,Estes Park N0FH 449.8,449.8,-,5,Tone,123,88.5,23,23,NN,FM,5,CO Larimer Estes Park N0FH 449.8
122,"Bailey, Dick Mountain AB0PC 146.895",146.895,-,0.6,TSQL,100,100,23,23,NN,FM,5,"CO Park Bailey, Dick Mountain AB0PC 146.895"
123,"Fairplay, Sacramento Mountain WZ0N 447.125",447.125,-,5,TSQL,103.5,103.5,23,23,NN,FM,5,"CO Park Fairplay, Sacramento Mountain WZ0N 447.125"
124,Lake George  449.7,449.7,-,5,Tone,107.2,88.5,23,23,NN,FM,5,CO Park Lake George  449.7
125,"Lake George, Badger Mountain KC0CVU 147.36",147.36,+,0.6,TSQL,107.2,107.2,23,23,NN,FM,5,"CO Park Lake George, Badger Mountain KC0CVU 147.36"
126,"Lake George, Badger Mountain NX0G 146.685",146.685,-,0.6,TSQL,107.2,107.2,23,23,NN,FM,5,"CO Park Lake George, Badger Mountain NX0G 146.685"
127,"Aspen, Aspen Mountain K0VQ 447.05",447.05,-,5,TSQL,136.5,136.5,23,23,NN,FM,5,"CO Pitkin Aspen, Aspen Mountain K0VQ 447.05"
128,Snowmass Village K0CL 146.67,146.67,-,0.6,Tone,107.2,88.5,23,23,NN,FM,5,CO Pitkin Snowmass Village K0CL 146.67
129,Breckenridge WB0QMR 146.7,146.7,-,0.6,Tone,107.2,88.5,23,23,NN,FM,5,CO Summit Breckenridge WB0QMR 146.7
130,"Breckenridge, Bald Mountain KB0VJJ 147.39",147.39,+,0.6,Cross,88.5,123,23,23,NN,FM,5,"CO Summit Breckenridge, Bald Mountain KB0VJJ 147.39"
131,Cripple Creek NX0G 147.015,147.015,+,0.6,Tone,107.2,88.5,23,23,NN,FM,5,CO Teller Cripple Creek NX0G 147.015
132,Cripple Creek WB0WDF 145.46,145.46,-,0.6,Tone,67,88.5,23,23,NN,FM,5,CO Teller Cripple Creek WB0WDF 145.46
133,Cripple Creek WB0WDF 224.94,224.94,-,1.6,Tone,67,88.5,23,23,NN,FM,5,CO Teller Cripple Creek WB0WDF 224.94
134,Cripple Creek WB0WDF 447.4,447.4,-,5,Tone,67,88.5,23,23,NN,FM,5,CO Teller Cripple Creek WB0WDF 447.4
135,Woodland Park KA0WUC 145.415,145.415,-,0.6,Tone,179.9,88.5,23,23,NN,FM,5,CO Teller Woodland Park KA0WUC 145.415
136,Woodland Park KA0WUC 447.675,447.675,-,5,TSQL,179.9,179.9,23,23,NN,FM,5,CO Teller Woodland Park KA0WUC 447.675
137,Woodland Park KA0WUC 449.025,449.025,-,5,Tone,141.3,88.5,23,23,NN,FM,5,CO Teller Woodland Park KA0WUC 449.025
138,Woodland Park NX0G 146.82,146.82,-,0.6,Tone,107.2,88.5,23,23,NN,FM,5,CO Teller Woodland Park NX0G 146.82
139,Woodland Park NX0G 448.65,448.65,-,5,Tone,107.2,88.5,23,23,NN,FM,5,CO Teller Woodland Park NX0G 448.65
140,"Woodland Park, Paradise Pines KA4EPS 449.325",449.325,-,5,TSQL,103.5,103.5,23,23,NN,FM,5,"CO Teller Woodland Park, Paradise Pines KA4EPS 449.325"
141,Fort Lupton AC0KC 224.96,224.96,-,1.6,,88.5,88.5,23,23,NN,FM,5,CO Weld Fort Lupton AC0KC 224.96
142,Fort Lupton AC0KC 447.3,447.3,-,5,Tone,107.2,88.5,23,23,NN,FM,5,CO Weld Fort Lupton AC0KC 447.3
