Location,Name,Frequency,Duplex,Offset,Tone,rToneFreq,cToneFreq,DtcsCode,DtcsRxCode,DtcsPolarity,Mode,TStep,Comment
57,"KB5ITS Lukachukai, Roof Butte 14525 ",145.25,-,0.6,Tone,100,88.5,23,23,NN,FM,5,"AZ Apache Lukachukai, Roof Butte KB5ITS 145.25"
58,"NM5SJ Lukachukai, Roof Butte 14682 ",146.82,-,0.6,Tone,100,88.5,23,23,NN,FM,5,"AZ Apache Lukachukai, Roof Butte NM5SJ 146.82"
59,N7YSE Jacob Lake 1473 ,147.3,+,0.6,Tone,100,88.5,23,23,NN,FM,5,AZ Coconino Jacob Lake N7YSE 147.3
60,KD7KRA Tuba City 444575 ,444.575,+,5,Tone,100,88.5,23,23,NN,FM,5,AZ Coconino Tuba City KD7KRA 444.575
61,"N0JSP Pagosa Springs, Oakbrush Hill 14661 ",146.61,-,0.6,Tone,123,88.5,23,23,NN,FM,5,"CO Archuleta Pagosa Springs, Oakbrush Hill N0JSP 146.61"
62,"KD0MRC Maysville, CO 145325 ",145.325,-,0.6,Tone,100,88.5,23,23,NN,FM,5,"CO Chaffee Maysville, CO KD0MRC 145.325"
63,W0ALC Cedaredge 14736 ,147.36,+,0.6,Tone,100,88.5,23,23,NN,FM,5,CO Delta Cedaredge W0ALC 147.36
64,W0ALC Cedaredge 449825 ,449.825,-,5,Tone,100,88.5,23,23,NN,FM,5,CO Delta Cedaredge W0ALC 449.825
65,"KC0QXX Cedaredge, Cedar Mesa 147195 ",147.195,+,0.6,Tone,107.2,88.5,23,23,NN,FM,5,"CO Delta Cedaredge, Cedar Mesa KC0QXX 147.195"
66," Cedaredge, Grand Mesa 44735 ",447.35,-,5,Tone,107.2,88.5,23,23,NN,FM,5,"CO Delta Cedaredge, Grand Mesa  447.35"
67,KI0MR Paonia 14733 ,147.33,+,0.6,Tone,107.2,88.5,23,23,NN,FM,5,CO Delta Paonia KI0MR 147.33
68,"K0ELK Carbondale, Four Mile Ridge 449725 ",449.725,-,5,Tone,179.9,88.5,23,23,NN,FM,5,"CO Garfield Carbondale, Four Mile Ridge K0ELK 449.725"
69,"K0SNO Carbondale, Four Mile Ridge 14739 ",147.39,+,0.6,Tone,107.2,88.5,23,23,NN,FM,5,"CO Garfield Carbondale, Four Mile Ridge K0SNO 147.39"
70,"K0VQ Carbondale, Missouri Heights 44715 ",447.15,-,5,Tone,136.5,88.5,23,23,NN,FM,5,"CO Garfield Carbondale, Missouri Heights K0VQ 447.15"
71,"WA4HND Glenwood Springs, Lookout Mountain 44985 ",449.85,-,5,TSQL,131.8,131.8,23,23,NN,FM,5,"CO Garfield Glenwood Springs, Lookout Mountain WA4HND 449.85"
72,"KB0VJJ Glenwood Springs, Sunlight Peak 14685 ",146.85,-,0.6,Cross,88.5,123,23,23,NN,FM,5,"CO Garfield Glenwood Springs, Sunlight Peak KB0VJJ 146.85"
73,"KI0G Glenwood Springs, Sunlight Peak 14688 ",146.88,-,0.6,Tone,107.2,88.5,23,23,NN,FM,5,"CO Garfield Glenwood Springs, Sunlight Peak KI0G 146.88"
74,"KI0G Glenwood Springs, Sunlight Peak 4471 ",447.1,-,5,Tone,107.2,88.5,23,23,NN,FM,5,"CO Garfield Glenwood Springs, Sunlight Peak KI0G 447.1"
75,"N0XLI Glenwood Springs, Sunlight Peak 4496 ",449.6,-,5,Tone,107.2,88.5,23,23,NN,FM,5,"CO Garfield Glenwood Springs, Sunlight Peak N0XLI 449.6"
76,"KB0SW Loma, Baxter Pass 447 ",447,-,5,Tone,107.2,88.5,23,23,NN,FM,5,"CO Garfield Loma, Baxter Pass KB0SW 447"
77,"WA4HND Parachute, Mount Callahan 4498 ",449.8,-,5,Tone,107.2,88.5,23,23,NN,FM,5,"CO Garfield Parachute, Mount Callahan WA4HND 449.8"
78,K5GF Gunnison 44995 ,449.95,-,5,,88.5,88.5,23,23,NN,FM,5,CO Gunnison Gunnison K5GF 449.95
79,W0VTL Gunnison 14712 ,147.12,+,0.6,,88.5,88.5,23,23,NN,FM,5,CO Gunnison Gunnison W0VTL 147.12
80,"KB0YNA Gunnison, W Mountain or Tenderfoot Mountain 44765 ",447.65,-,5,TSQL,151.4,151.4,23,23,NN,FM,5,"CO Gunnison Gunnison, W Mountain or Tenderfoot Mountain KB0YNA 447.65"
81,"KB5ITS Lake City, Hill 71 147135 ",147.135,-,0.6,Tone,123,88.5,23,23,NN,FM,5,"CO Hinsdale Lake City, Hill 71 KB5ITS 147.135"
82,"KB5ITS Silverton, Hazelton 444 ",444,+,5,Tone,67,88.5,23,23,NN,FM,5,"CO Huerfano Silverton, Hazelton KB5ITS 444"
83,K0EP Durango 44985 ,449.85,-,5,TSQL,100,100,23,23,NN,FM,5,CO La Plata Durango K0EP 449.85
84,KC5EVE Durango 448625 ,448.625,-,5,TSQL,131.8,131.8,23,23,NN,FM,5,CO La Plata Durango KC5EVE 448.625
85,"K0EP Durango, Eagle Pass 14667 ",146.67,-,0.6,Tone,100,88.5,23,23,NN,FM,5,"CO La Plata Durango, Eagle Pass K0EP 146.67"
86,"K0EP Durango, Missionary Ridge 1467 ",146.7,-,0.6,TSQL,100,100,23,23,NN,FM,5,"CO La Plata Durango, Missionary Ridge K0EP 146.7"
87,"KB0VJJ Durango, Missionary Ridge 147345 ",147.345,+,0.6,Cross,88.5,123,23,23,NN,FM,5,"CO La Plata Durango, Missionary Ridge KB0VJJ 147.345"
88,"KB5ITS Durango, Smelter Mountain 147135 ",147.135,+,0.6,TSQL,100,100,23,23,NN,FM,5,"CO La Plata Durango, Smelter Mountain KB5ITS 147.135"
89,KB0VIU Hesperus 14537 ,145.37,-,0.6,TSQL,100,100,23,23,NN,FM,5,CO La Plata Hesperus KB0VIU 145.37
90,"KB5ITS Ignacio, Spring Creek 14715 ",147.15,+,0.6,Tone,100,88.5,23,23,NN,FM,5,"CO La Plata Ignacio, Spring Creek KB5ITS 147.15"
91,"KB0YNA Delta, Uncompahgre Butte 4494 ",449.4,-,5,TSQL,131.8,131.8,23,23,NN,FM,5,"CO Mesa Delta, Uncompahgre Butte KB0YNA 449.4"
92,K0SSI Grand Junction 147105 ,147.105,+,0.6,,88.5,88.5,23,23,NN,FM,5,CO Mesa Grand Junction K0SSI 147.105
93,KC0ARV Grand Junction 4475 ,447.5,-,5,Tone,114.8,88.5,23,23,NN,FM,5,CO Mesa Grand Junction KC0ARV 447.5
94,KD0SMZ Grand Junction 449775 ,449.775,-,5,Cross,173.8,88.5,23,23,NN,FM,5,CO Mesa Grand Junction KD0SMZ 449.775
95,KE0TY Grand Junction 14522 ,145.22,-,0.6,Tone,107.2,88.5,23,23,NN,FM,5,CO Mesa Grand Junction KE0TY 145.22
96,KE0TY Grand Junction 14739 ,147.39,+,0.6,Tone,107.2,88.5,23,23,NN,FM,5,CO Mesa Grand Junction KE0TY 147.39
97,W0GJT Grand Junction 14682 ,146.82,-,0.6,Tone,107.2,88.5,23,23,NN,FM,5,CO Mesa Grand Junction W0GJT 146.82
98,W0GJT Grand Junction 44815 ,448.15,-,5,Tone,100,88.5,23,23,NN,FM,5,CO Mesa Grand Junction W0GJT 448.15
99,"W0RRZ Grand Junction, Black Ridge (Above Colorado Ntl Monument) 14694 ",146.94,-,0.6,TSQL,107.2,107.2,23,23,NN,FM,5,"CO Mesa Grand Junction, Black Ridge (Above Colorado Ntl Monument) W0RRZ 146.94"
100,"WA4HND Grand Junction, Black Ridge 449575 ",449.575,-,5,TSQL,131.8,131.8,23,23,NN,FM,5,"CO Mesa Grand Junction, Black Ridge WA4HND 449.575"
101,"W0RRZ Grand Junction, GJT 145175 ",145.175,-,0.6,Tone,107.2,88.5,23,23,NN,FM,5,"CO Mesa Grand Junction, GJT W0RRZ 145.175"
102,"KB0VJJ Grand Junction, Grand Mesa 145355 ",145.355,-,0.6,Cross,88.5,123,23,23,NN,FM,5,"CO Mesa Grand Junction, Grand Mesa KB0VJJ 145.355"
103,"KB0VJJ Grand Junction, Grand Mesa 147355 ",147.355,-,0.6,Cross,88.5,123,23,23,NN,FM,5,"CO Mesa Grand Junction, Grand Mesa KB0VJJ 147.355"
104,"KB0YNA Grand Junction, Grand Mesa 44965 ",449.65,-,5,TSQL,151.4,151.4,23,23,NN,FM,5,"CO Mesa Grand Junction, Grand Mesa KB0YNA 449.65"
105,"WA4HND Grand Junction, Grand Mesa 4493 ",449.3,-,5,TSQL,107.2,107.2,23,23,NN,FM,5,"CO Mesa Grand Junction, Grand Mesa WA4HND 449.3"
106,"N0PKT Creede, Bristol Head 449525 ",449.525,-,5,TSQL,100,100,23,23,NN,FM,5,"CO Mineral Creede, Bristol Head N0PKT 449.525"
107,"KD5LWU Cortez, Downtown 14679 ",146.79,-,0.6,TSQL,127.3,127.3,23,23,NN,FM,5,"CO Montezuma Cortez, Downtown KD5LWU 146.79"
108,"KB5ITS Dolores, Summit Ridge 14519 ",145.19,-,0.6,Tone,100,88.5,23,23,NN,FM,5,"CO Montezuma Dolores, Summit Ridge KB5ITS 145.19"
109,"KB5ITS Dolores, Summit Ridge 447275 ",447.275,-,5,Tone,100,88.5,23,23,NN,FM,5,"CO Montezuma Dolores, Summit Ridge KB5ITS 447.275"
110,"KB5ITS Mancos, Caviness Mountain 442375 ",442.375,+,5,Tone,100,88.5,23,23,NN,FM,5,"CO Montezuma Mancos, Caviness Mountain KB5ITS 442.375"
111,"KB5ITS Mancos, Menefee Mountain 145325 ",145.325,-,0.6,Tone,100,88.5,23,23,NN,FM,5,"CO Montezuma Mancos, Menefee Mountain KB5ITS 145.325"
112,KC0UUX Montrose 14691 ,146.91,-,0.6,TSQL,107.2,107.2,23,23,NN,FM,5,CO Montrose Montrose KC0UUX 146.91
113,KD5OPD Montrose 14679 ,146.79,-,0.6,TSQL,107.2,107.2,23,23,NN,FM,5,CO Montrose Montrose KD5OPD 146.79
114,"KB0YNA Montrose, Waterdog Peak 44865 ",448.65,-,5,TSQL,88.5,151.4,23,23,NN,FM,5,"CO Montrose Montrose, Waterdog Peak KB0YNA 448.65"
115,"WA4HND Montrose, Waterdog Peak 4472 ",447.2,-,5,TSQL,107.2,107.2,23,23,NN,FM,5,"CO Montrose Montrose, Waterdog Peak WA4HND 447.2"
116,"KB5ITS Ouray, Engineer Mountain 14727 ",147.27,+,0.6,Tone,127.3,88.5,23,23,NN,FM,5,"CO Ouray Ouray, Engineer Mountain KB5ITS 147.27"
117,"K0VQ Aspen, Aspen Mountain 44705 ",447.05,-,5,TSQL,136.5,136.5,23,23,NN,FM,5,"CO Pitkin Aspen, Aspen Mountain K0VQ 447.05"
118,K0CL Snowmass Village 14667 ,146.67,-,0.6,Tone,107.2,88.5,23,23,NN,FM,5,CO Pitkin Snowmass Village K0CL 146.67
119,N0KM Center 14664 ,146.64,-,0.6,TSQL,77,77,23,23,NN,FM,5,CO Rio Grande Center N0KM 146.64
120,N0KM Center 4471 ,447.1,-,5,Tone,77,88.5,23,23,NN,FM,5,CO Saguache Center N0KM 447.1
121,KB5ITS Silverton 447525 ,447.525,-,5,Tone,127.3,88.5,23,23,NN,FM,5,CO San Juan Silverton KB5ITS 447.525
122,"KB5ITS Silverton, Buffalo Boy 145325 ",145.325,-,0.6,Tone,127.3,88.5,23,23,NN,FM,5,"CO San Juan Silverton, Buffalo Boy KB5ITS 145.325"
123,"KB5ITT Silverton, Engineer Mountain 14727 ",147.27,+,0.6,Tone,127.3,88.5,23,23,NN,FM,5,"CO San Juan Silverton, Engineer Mountain KB5ITT 147.27"
124,"KB5ITS Silverton, Kendall Mountain 147375 ",147.375,+,0.6,Tone,156.7,88.5,23,23,NN,FM,5,"CO San Juan Silverton, Kendall Mountain KB5ITS 147.375"
125,"KB0YNA Telluride, Gray Head 4497 ",449.7,-,5,TSQL,107.2,107.2,23,23,NN,FM,5,"CO San Miguel Telluride, Gray Head KB0YNA 449.7"
126,KC5WDV Gallup 44975 ,449.75,-,5,Tone,100,88.5,23,23,NN,FM,5,NM McKinley Gallup KC5WDV 449.75
127,"KC5WDV Gallup, Deza Bluffs 4482 ",448.2,-,5,Tone,100,88.5,23,23,NN,FM,5,"NM McKinley Gallup, Deza Bluffs KC5WDV 448.2"
128,"NM5ML Gallup, Deza Bluffs 14722 ",147.22,+,0.6,Tone,67,88.5,23,23,NN,FM,5,"NM McKinley Gallup, Deza Bluffs NM5ML 147.22"
129,"KC5WDV Gallup, Gibson Peak 14726 ",147.26,+,0.6,Tone,100,88.5,23,23,NN,FM,5,"NM McKinley Gallup, Gibson Peak KC5WDV 147.26"
130,K7LEN Window Rock 14529 ,145.29,-,0.6,Tone,123,88.5,23,23,NN,FM,5,NM McKinley Window Rock K7LEN 145.29
131,"W5SF Chama, Overlook Mtn 14708 ",147.08,+,0.6,Tone,162.2,88.5,23,23,NN,FM,5,"NM Rio Arriba Chama, Overlook Mtn W5SF 147.08"
132,NM5SJ Dulce 14543 ,145.43,-,0.6,Tone,136.5,88.5,23,23,NN,FM,5,NM Rio Arriba Dulce NM5SJ 145.43
133,NM5SJ Lybrook 14549 ,145.49,-,0.6,Tone,100,88.5,23,23,NN,FM,5,NM Rio Arriba Lybrook NM5SJ 145.49
134,KB5ITS Aztec 44745 ,447.45,-,5,Tone,107.2,88.5,23,23,NN,FM,5,NM San Juan Aztec KB5ITS 447.45
135,NM5SJ Aztec 14674 ,146.74,-,0.6,Tone,100,88.5,23,23,NN,FM,5,NM San Juan Aztec NM5SJ 146.74
136,"KB5ITS Aztec, Tank Mtn 14688 ",146.88,-,0.6,Tone,100,88.5,23,23,NN,FM,5,"NM San Juan Aztec, Tank Mtn KB5ITS 146.88"
137,K5WXI Bloomfield 14692 ,146.92,-,0.6,Tone,100,88.5,23,23,NN,FM,5,NM San Juan Bloomfield K5WXI 146.92
138,KB5ITS Bloomfield 44865 ,448.65,-,5,Tone,127.3,88.5,23,23,NN,FM,5,NM San Juan Bloomfield KB5ITS 448.65
139,"NM5ML Bloomfield, Harris Mesa 14728 ",147.28,+,0.6,Tone,67,88.5,23,23,NN,FM,5,"NM San Juan Bloomfield, Harris Mesa NM5ML 147.28"
140,"KB5ITS Bloomfield, Harris mesa 1471 ",147.1,+,0.6,Tone,100,88.5,23,23,NN,FM,5,"NM San Juan Bloomfield, Harris mesa KB5ITS 147.1"
141,K5WXI Farmington 14685 ,146.85,-,0.6,TSQL,100,100,23,23,NN,FM,5,NM San Juan Farmington K5WXI 146.85
142,K5WY Farmington 449 ,449,-,5,Tone,100,88.5,23,23,NN,FM,5,NM San Juan Farmington K5WY 449
143,KB5ITS Farmington 14676 ,146.76,-,0.6,TSQL,100,100,23,23,NN,FM,5,NM San Juan Farmington KB5ITS 146.76
144,KB5ITS Farmington 147 ,147,+,0.6,Tone,100,88.5,23,23,NN,FM,5,NM San Juan Farmington KB5ITS 147
145,"KB5ITS Navajo Dam, Navajo Lake 14736 ",147.36,+,0.6,Tone,100,88.5,23,23,NN,FM,5,"NM San Juan Navajo Dam, Navajo Lake KB5ITS 147.36"
146,"NM5SJ Nebo, Cedar Hill 14706 ",147.06,+,0.6,Tone,100,88.5,23,23,NN,FM,5,"NM San Juan Nebo, Cedar Hill NM5SJ 147.06"
147,"W7CEU Price,  Wood Hill 14543 ",145.43,-,0.6,Tone,88.5,88.5,23,23,NN,FM,5,"UT Carbon Price,  Wood Hill W7CEU 145.43"
148,"W7CEU Price,  Wood Hill 2245 ",224.5,-,1.6,Tone,88.5,88.5,23,23,NN,FM,5,"UT Carbon Price,  Wood Hill W7CEU 224.5"
149,"W7CEU Price,  Wood Hill 4483 ",448.3,-,5,Tone,88.5,88.5,23,23,NN,FM,5,"UT Carbon Price,  Wood Hill W7CEU 448.3"
150,"K7GX Price, Wood Hill 1472 ",147.2,+,0.6,Tone,88.5,88.5,23,23,NN,FM,5,"UT Carbon Price, Wood Hill K7GX 147.2"
151,"K7GX Price, Wood Hill 4483 ",448.3,-,5,,88.5,88.5,23,23,NN,FM,5,"UT Carbon Price, Wood Hill K7GX 448.3"
152,"WX7Y Scofield, Boardinghouse Rdge 22498 ",224.98,-,1.6,Tone,88.5,88.5,23,23,NN,FM,5,"UT Carbon Scofield, Boardinghouse Rdge WX7Y 224.98"
153,"K7SDC Scofield, Boardinghouse Ridge 14708 ",147.08,+,0.6,Tone,88.5,88.5,23,23,NN,FM,5,"UT Carbon Scofield, Boardinghouse Ridge K7SDC 147.08"
154,"K7SDC Scofield, Ford Ridge 14531 ",145.31,-,0.6,Tone,88.5,88.5,23,23,NN,FM,5,"UT Carbon Scofield, Ford Ridge K7SDC 145.31"
155,"WX7Y Sunny Side, Bruin Peak 145175 ",145.175,-,0.6,,88.5,88.5,23,23,NN,FM,5,"UT Carbon Sunny Side, Bruin Peak WX7Y 145.175"
156,"K7SDC Sunnyside, Bruin Point 14732 ",147.32,+,0.6,Tone,88.5,88.5,23,23,NN,FM,5,"UT Carbon Sunnyside, Bruin Point K7SDC 147.32"
157,"K7SDC Sunnyside, Bruin Point 44905 ",449.05,-,5,Tone,88.5,88.5,23,23,NN,FM,5,"UT Carbon Sunnyside, Bruin Point K7SDC 449.05"
158,AD7ZW Altamont 14728 ,147.28,+,0.6,TSQL,107.2,107.2,23,23,NN,FM,5,UT Duchesne Altamont AD7ZW 147.28
159,N7PQD Duchense 14726 ,147.26,+,0.6,,88.5,88.5,23,23,NN,FM,5,UT Duchesne Duchense N7PQD 147.26
160,"W7BYU Myton, Flat Top 14549 ",145.49,-,0.6,Tone,136.5,88.5,23,23,NN,FM,5,"UT Duchesne Myton, Flat Top W7BYU 145.49"
161,"K7SDC Castle Dale, Cedar Mountain 14714 ",147.14,+,0.6,Tone,88.5,88.5,23,23,NN,FM,5,"UT Emery Castle Dale, Cedar Mountain K7SDC 147.14"
162,"K7SDC Castle Dale, Cedar Mountain 44855 ",448.55,-,5,Tone,88.5,88.5,23,23,NN,FM,5,"UT Emery Castle Dale, Cedar Mountain K7SDC 448.55"
163,"K7SDC Castle Dale, Horn Mountain 14706 ",147.06,+,0.6,Tone,88.5,88.5,23,23,NN,FM,5,"UT Emery Castle Dale, Horn Mountain K7SDC 147.06"
164,"K7YI Castle Dale, Horn Mountain 447625 ",447.625,-,5,Tone,100,88.5,23,23,NN,FM,5,"UT Emery Castle Dale, Horn Mountain K7YI 447.625"
165,"WX7Y Castle Dale, Horn Mountain 4477 ",447.7,-,5,Tone,123,88.5,23,23,NN,FM,5,"UT Emery Castle Dale, Horn Mountain WX7Y 447.7"
166,"WX7Y Huntington,  Skyline Dr 22392 ",223.92,-,1.6,Tone,88.5,88.5,23,23,NN,FM,5,"UT Emery Huntington,  Skyline Dr WX7Y 223.92"
167,W6DZL Bryce Canyon 14535 ,145.35,-,0.6,Tone,123,88.5,23,23,NN,FM,5,UT Garfield Bryce Canyon W6DZL 145.35
168,"N7NKK Panguitch, Mount Dutton 14716 ",147.16,+,0.6,Tone,100,88.5,23,23,NN,FM,5,"UT Garfield Panguitch, Mount Dutton N7NKK 147.16"
169,K7QEQ Moab 1469 ,146.9,-,0.6,Tone,88.5,88.5,23,23,NN,FM,5,UT Grand Moab K7QEQ 146.9
170,"K7QEQ Moab, Bald Mesa 14676 ",146.76,-,0.6,Tone,88.5,88.5,23,23,NN,FM,5,"UT Grand Moab, Bald Mesa K7QEQ 146.76"
171,"K7QEQ Moab, Bald Mesa 4491 ",449.1,-,5,TSQL,107.2,107.2,23,23,NN,FM,5,"UT Grand Moab, Bald Mesa K7QEQ 449.1"
172,"K7JL Levan, Levan Peak 14527 ",145.27,-,0.6,Tone,103.5,88.5,23,23,NN,FM,5,"UT Juab Levan, Levan Peak K7JL 145.27"
173,"WB7REL Glendale, Spencer Bench 14672 ",146.72,-,0.6,Tone,100,88.5,23,23,NN,FM,5,"UT Kane Glendale, Spencer Bench WB7REL 146.72"
174,KD7HLL Mexican Hat 4499 ,449.9,-,5,Tone,123,88.5,23,23,NN,FM,5,UT San Juan Mexican Hat KD7HLL 449.9
175,"K7QEQ Monticello, Abajo Peak 4471 ",447.1,-,5,TSQL,107.2,107.2,23,23,NN,FM,5,"UT San Juan Monticello, Abajo Peak K7QEQ 447.1"
176,"K7SDC Monticello, Abajo Peak 14661 ",146.61,-,0.6,Tone,88.5,88.5,23,23,NN,FM,5,"UT San Juan Monticello, Abajo Peak K7SDC 146.61"
177,"W7CWI Page (AZ), Navajo Mountain 449925 ",449.925,-,5,Tone,100,88.5,23,23,NN,FM,5,"UT San Juan Page (AZ), Navajo Mountain W7CWI 449.925"
178,"W7WAC Page (AZ), Navajo Mountain 14696 ",146.96,-,0.6,Tone,100,88.5,23,23,NN,FM,5,"UT San Juan Page (AZ), Navajo Mountain W7WAC 146.96"
179,"NA7DB Page (az), Navajo Mountain 44875 ",448.75,-,5,Tone,100,88.5,23,23,NN,FM,5,"UT San Juan Page (az), Navajo Mountain NA7DB 448.75"
180,"WA7VHF Page, Navajo Mountain 4486 ",448.6,-,5,Tone,100,88.5,23,23,NN,FM,5,"UT San Juan Page, Navajo Mountain WA7VHF 448.6"
181,"WB7REL East Salina, Salina Canyon 14672 ",146.72,-,0.6,Tone,100,88.5,23,23,NN,FM,5,"UT San Pete East Salina, Salina Canyon WB7REL 146.72"
182,"N7IMF Ephraim,  Horseshoe 22464 ",224.64,-,1.6,,88.5,88.5,23,23,NN,FM,5,"UT San Pete Ephraim,  Horseshoe N7IMF 224.64"
183,"W7DHH Ephraim, Horseshoe 14666 ",146.66,-,0.6,Tone,100,88.5,23,23,NN,FM,5,"UT San Pete Ephraim, Horseshoe W7DHH 146.66"
184,"N7RVS Gunnison, N7RVS QTH 44735 ",447.35,-,5,Tone,88.5,88.5,23,23,NN,FM,5,"UT San Pete Gunnison, N7RVS QTH N7RVS 447.35"
185,"WB7REL Indianola, Indianola Peak 14672 ",146.72,-,0.6,Tone,100,88.5,23,23,NN,FM,5,"UT San Pete Indianola, Indianola Peak WB7REL 146.72"
186,N7YFZ Manti 44975 ,449.75,-,5,Tone,131.8,88.5,23,23,NN,FM,5,UT San Pete Manti N7YFZ 449.75
187,"KD7YE Manti, Barton Peak 448275 ",448.275,-,5,Tone,107.2,88.5,23,23,NN,FM,5,"UT San Pete Manti, Barton Peak KD7YE 448.275"
188,"WB7REL Starling, Sterling 14529 ",145.29,-,0.6,Tone,131.8,88.5,23,23,NN,FM,5,"UT San Pete Starling, Sterling WB7REL 145.29"
189,WB7REL Sterling 44785 ,447.85,-,5,Tone,131.8,88.5,23,23,NN,FM,5,UT San Pete Sterling WB7REL 447.85
190,"N7GGN Holden, Beesting Peak 1471 ",147.1,+,0.6,Tone,100,88.5,23,23,NN,FM,5,"UT Sevier Holden, Beesting Peak N7GGN 147.1"
191,"W7DHH Monroe, Monroe Peak 44745 ",447.45,-,5,Tone,114.8,88.5,23,23,NN,FM,5,"UT Sevier Monroe, Monroe Peak W7DHH 447.45"
192,"WA7HSW Monroe, Monroe Peak 14664 ",146.64,-,0.6,Tone,100,88.5,23,23,NN,FM,5,"UT Sevier Monroe, Monroe Peak WA7HSW 146.64"
193,"WB7REL Monroe, Monroe Peak 14686 ",146.86,-,0.6,Tone,100,88.5,23,23,NN,FM,5,"UT Sevier Monroe, Monroe Peak WB7REL 146.86"
194,"WA7VHF Richfield, Monroe Peak 14684 ",146.84,-,0.6,Tone,100,88.5,23,23,NN,FM,5,"UT Sevier Richfield, Monroe Peak WA7VHF 146.84"
195,"WB7REL Sterling, Salina Canyon 44925 ",449.25,-,5,Tone,131.8,88.5,23,23,NN,FM,5,"UT Sevier Sterling, Salina Canyon WB7REL 449.25"
196,W7BYU Vernal 4497 ,449.7,-,5,Tone,136.5,88.5,23,23,NN,FM,5,UT Uintah Vernal W7BYU 449.7
197,"W7BAR Vernal, Blue Mountain 1471 ",147.1,+,0.6,Tone,136.5,88.5,23,23,NN,FM,5,"UT Uintah Vernal, Blue Mountain W7BAR 147.1"
198,"W7BAR Vernal, Uintah County EOC 4499 ",449.9,-,5,Tone,136.5,88.5,23,23,NN,FM,5,"UT Uintah Vernal, Uintah County EOC W7BAR 449.9"
199,"K7SDC Hanksville, Ellen Peak 14708 ",147.08,+,0.6,Tone,136.5,88.5,23,23,NN,FM,5,"UT Wayne Hanksville, Ellen Peak K7SDC 147.08"
