Location,Name,Frequency,Duplex,Offset,Tone,rToneFreq,cToneFreq,DtcsCode,DtcsRxCode,DtcsPolarity,Mode,TStep,Comment
57,"KB5ITS Lukachukai, Roof Butte 14525 ",145.25,-,0.6,Tone,100,88.5,23,23,NN,FM,5,"AZ Apache Lukachukai, Roof Butte KB5ITS 145.25"
58,"NM5SJ Lukachukai, Roof Butte 14682 ",146.82,-,0.6,Tone,100,88.5,23,23,NN,FM,5,"AZ Apache Lukachukai, Roof Butte NM5SJ 146.82"
59,"N0JSP Pagosa Springs, Oakbrush Hill 14661 ",146.61,-,0.6,Tone,123,88.5,23,23,NN,FM,5,"CO Archuleta Pagosa Springs, Oakbrush Hill N0JSP 146.61"
60,"KD0MRC Maysville, CO 145325 ",145.325,-,0.6,Tone,100,88.5,23,23,NN,FM,5,"CO Chaffee Maysville, CO KD0MRC 145.325"
61,"K0JSC Salida, Methodist Mountain 449975 ",449.975,-,5,TSQL,100,100,23,23,NN,FM,5,"CO Chaffee Salida, Methodist Mountain K0JSC 449.975"
62,"KB0VJJ Salida, Methodist Mountain 147285 ",147.285,+,0.6,Cross,88.5,123,23,23,NN,FM,5,"CO Chaffee Salida, Methodist Mountain KB0VJJ 147.285"
63,"KC0CVU Salida, Methodist Mountain 145295 ",145.295,-,0.6,Tone,107.2,88.5,23,23,NN,FM,5,"CO Chaffee Salida, Methodist Mountain KC0CVU 145.295"
64,"KC0CVU Salida, Methodist Mountain 44965 ",449.65,-,5,Tone,107.2,88.5,23,23,NN,FM,5,"CO Chaffee Salida, Methodist Mountain KC0CVU 449.65"
65,"WZ0N Salida, Methodist Mountain 449925 ",449.925,-,5,TSQL,103.5,103.5,23,23,NN,FM,5,"CO Chaffee Salida, Methodist Mountain WZ0N 449.925"
66,"KC0CVU Pueblo, Deer Peak 449625 ",449.625,-,5,Tone,107.2,88.5,23,23,NN,FM,5,"CO Custer Pueblo, Deer Peak KC0CVU 449.625"
67,K0JSC Westcliffe 448325 ,448.325,-,5,TSQL,100,100,23,23,NN,FM,5,CO Custer Westcliffe K0JSC 448.325
68,KB0TUC Westcliffe 14706 ,147.06,+,0.6,TSQL,77,77,23,23,NN,FM,5,CO Custer Westcliffe KB0TUC 147.06
69,KB0TUC Westcliffe 44815 ,448.15,-,5,TSQL,103.5,103.5,23,23,NN,FM,5,CO Custer Westcliffe KB0TUC 448.15
70,W0ALC Cedaredge 14736 ,147.36,+,0.6,Tone,100,88.5,23,23,NN,FM,5,CO Delta Cedaredge W0ALC 147.36
71,W0ALC Cedaredge 449825 ,449.825,-,5,Tone,100,88.5,23,23,NN,FM,5,CO Delta Cedaredge W0ALC 449.825
72,"KC0QXX Cedaredge, Cedar Mesa 147195 ",147.195,+,0.6,Tone,107.2,88.5,23,23,NN,FM,5,"CO Delta Cedaredge, Cedar Mesa KC0QXX 147.195"
73," Cedaredge, Grand Mesa 44735 ",447.35,-,5,Tone,107.2,88.5,23,23,NN,FM,5,"CO Delta Cedaredge, Grand Mesa  447.35"
74,KI0MR Paonia 14733 ,147.33,+,0.6,Tone,107.2,88.5,23,23,NN,FM,5,CO Delta Paonia KI0MR 147.33
75,"K0JSC Canon City, Canon City 449975 ",449.975,-,5,TSQL,100,100,23,23,NN,FM,5,"CO Fremont Canon City, Canon City K0JSC 449.975"
76,"K0JSC Canon City, Colorado 447975 ",447.975,-,5,TSQL,100,100,23,23,NN,FM,5,"CO Fremont Canon City, Colorado K0JSC 447.975"
77,"K0JSC Canon City, Fremont Peak 44725 ",447.25,-,5,TSQL,100,100,23,23,NN,FM,5,"CO Fremont Canon City, Fremont Peak K0JSC 447.25"
78,"WD0EKR Canon City, Fremont Peak 14549 ",145.49,-,0.6,TSQL,103.5,103.5,23,23,NN,FM,5,"CO Fremont Canon City, Fremont Peak WD0EKR 145.49"
79,"WD0EKR Canon City, Fremont Peak 22396 ",223.96,-,1.6,TSQL,103.5,103.5,23,23,NN,FM,5,"CO Fremont Canon City, Fremont Peak WD0EKR 223.96"
80,"WD0EKR Canon City, Fremont Peak 44775 ",447.75,-,5,TSQL,103.5,103.5,23,23,NN,FM,5,"CO Fremont Canon City, Fremont Peak WD0EKR 447.75"
81,"WB0WDF Canon City, eightmile Mountain 449 ",449,-,5,TSQL,67,67,23,23,NN,FM,5,"CO Fremont Canon City, eightmile Mountain WB0WDF 449"
82,K5GF Gunnison 44995 ,449.95,-,5,,88.5,88.5,23,23,NN,FM,5,CO Gunnison Gunnison K5GF 449.95
83,W0VTL Gunnison 14712 ,147.12,+,0.6,,88.5,88.5,23,23,NN,FM,5,CO Gunnison Gunnison W0VTL 147.12
84,"KB0YNA Gunnison, W Mountain or Tenderfoot Mountain 44765 ",447.65,-,5,TSQL,151.4,151.4,23,23,NN,FM,5,"CO Gunnison Gunnison, W Mountain or Tenderfoot Mountain KB0YNA 447.65"
85,"KB5ITS Lake City, Hill 71 147135 ",147.135,-,0.6,Tone,123,88.5,23,23,NN,FM,5,"CO Hinsdale Lake City, Hill 71 KB5ITS 147.135"
86,N0JPX La Veta 145355 ,145.355,-,0.6,Tone,100,88.5,23,23,NN,FM,5,CO Huerfano La Veta N0JPX 145.355
87,"KB5ITS Silverton, Hazelton 444 ",444,+,5,Tone,67,88.5,23,23,NN,FM,5,"CO Huerfano Silverton, Hazelton KB5ITS 444"
88,"ND0Q Walsenburg, N Rattlesnake Butte 14673 ",146.73,-,0.6,Tone,88.5,88.5,23,23,NN,FM,5,"CO Huerfano Walsenburg, N Rattlesnake Butte ND0Q 146.73"
89,K0EP Durango 44985 ,449.85,-,5,TSQL,100,100,23,23,NN,FM,5,CO La Plata Durango K0EP 449.85
90,KC5EVE Durango 448625 ,448.625,-,5,TSQL,131.8,131.8,23,23,NN,FM,5,CO La Plata Durango KC5EVE 448.625
91,"K0EP Durango, Eagle Pass 14667 ",146.67,-,0.6,Tone,100,88.5,23,23,NN,FM,5,"CO La Plata Durango, Eagle Pass K0EP 146.67"
92,"K0EP Durango, Missionary Ridge 1467 ",146.7,-,0.6,TSQL,100,100,23,23,NN,FM,5,"CO La Plata Durango, Missionary Ridge K0EP 146.7"
93,"KB0VJJ Durango, Missionary Ridge 147345 ",147.345,+,0.6,Cross,88.5,123,23,23,NN,FM,5,"CO La Plata Durango, Missionary Ridge KB0VJJ 147.345"
94,"KB5ITS Durango, Smelter Mountain 147135 ",147.135,+,0.6,TSQL,100,100,23,23,NN,FM,5,"CO La Plata Durango, Smelter Mountain KB5ITS 147.135"
95,KB0VIU Hesperus 14537 ,145.37,-,0.6,TSQL,100,100,23,23,NN,FM,5,CO La Plata Hesperus KB0VIU 145.37
96,"KB5ITS Ignacio, Spring Creek 14715 ",147.15,+,0.6,Tone,100,88.5,23,23,NN,FM,5,"CO La Plata Ignacio, Spring Creek KB5ITS 147.15"
97,"N0ZSN La Veta, Cordova Pass 44975 ",449.75,-,5,TSQL,100,100,23,23,NN,FM,5,"CO Las Animas La Veta, Cordova Pass N0ZSN 449.75"
98,"WA6IFI Trinidad, Raton Pass 14543 ",145.43,-,0.6,Tone,107.2,88.5,23,23,NN,FM,5,"CO Las Animas Trinidad, Raton Pass WA6IFI 145.43"
99,"KB0YNA Delta, Uncompahgre Butte 4494 ",449.4,-,5,TSQL,131.8,131.8,23,23,NN,FM,5,"CO Mesa Delta, Uncompahgre Butte KB0YNA 449.4"
100,W0GJT Grand Junction 44815 ,448.15,-,5,Tone,100,88.5,23,23,NN,FM,5,CO Mesa Grand Junction W0GJT 448.15
101,"KB0VJJ Grand Junction, Grand Mesa 145355 ",145.355,-,0.6,Cross,88.5,123,23,23,NN,FM,5,"CO Mesa Grand Junction, Grand Mesa KB0VJJ 145.355"
102,"KB0YNA Grand Junction, Grand Mesa 44965 ",449.65,-,5,TSQL,151.4,151.4,23,23,NN,FM,5,"CO Mesa Grand Junction, Grand Mesa KB0YNA 449.65"
103,"WA4HND Grand Junction, Grand Mesa 4493 ",449.3,-,5,TSQL,107.2,107.2,23,23,NN,FM,5,"CO Mesa Grand Junction, Grand Mesa WA4HND 449.3"
104,"N0PKT Creede, Bristol Head 449525 ",449.525,-,5,TSQL,100,100,23,23,NN,FM,5,"CO Mineral Creede, Bristol Head N0PKT 449.525"
105,"KD5LWU Cortez, Downtown 14679 ",146.79,-,0.6,TSQL,127.3,127.3,23,23,NN,FM,5,"CO Montezuma Cortez, Downtown KD5LWU 146.79"
106,"KB5ITS Dolores, Summit Ridge 14519 ",145.19,-,0.6,Tone,100,88.5,23,23,NN,FM,5,"CO Montezuma Dolores, Summit Ridge KB5ITS 145.19"
107,"KB5ITS Dolores, Summit Ridge 447275 ",447.275,-,5,Tone,100,88.5,23,23,NN,FM,5,"CO Montezuma Dolores, Summit Ridge KB5ITS 447.275"
108,"KB5ITS Mancos, Caviness Mountain 442375 ",442.375,+,5,Tone,100,88.5,23,23,NN,FM,5,"CO Montezuma Mancos, Caviness Mountain KB5ITS 442.375"
109,"KB5ITS Mancos, Menefee Mountain 145325 ",145.325,-,0.6,Tone,100,88.5,23,23,NN,FM,5,"CO Montezuma Mancos, Menefee Mountain KB5ITS 145.325"
110,KC0UUX Montrose 14691 ,146.91,-,0.6,TSQL,107.2,107.2,23,23,NN,FM,5,CO Montrose Montrose KC0UUX 146.91
111,KD5OPD Montrose 14679 ,146.79,-,0.6,TSQL,107.2,107.2,23,23,NN,FM,5,CO Montrose Montrose KD5OPD 146.79
112,"KB0YNA Montrose, Waterdog Peak 44865 ",448.65,-,5,TSQL,88.5,151.4,23,23,NN,FM,5,"CO Montrose Montrose, Waterdog Peak KB0YNA 448.65"
113,"WA4HND Montrose, Waterdog Peak 4472 ",447.2,-,5,TSQL,107.2,107.2,23,23,NN,FM,5,"CO Montrose Montrose, Waterdog Peak WA4HND 447.2"
114,"KB5ITS Ouray, Engineer Mountain 14727 ",147.27,+,0.6,Tone,127.3,88.5,23,23,NN,FM,5,"CO Ouray Ouray, Engineer Mountain KB5ITS 147.27"
115,"WZ0N Fairplay, Sacramento Mountain 447125 ",447.125,-,5,TSQL,103.5,103.5,23,23,NN,FM,5,"CO Park Fairplay, Sacramento Mountain WZ0N 447.125"
116,"K0VQ Aspen, Aspen Mountain 44705 ",447.05,-,5,TSQL,136.5,136.5,23,23,NN,FM,5,"CO Pitkin Aspen, Aspen Mountain K0VQ 447.05"
117,K0CL Snowmass Village 14667 ,146.67,-,0.6,Tone,107.2,88.5,23,23,NN,FM,5,CO Pitkin Snowmass Village K0CL 146.67
118,K0JSC Pueblo West 448975 ,448.975,-,5,TSQL,100,100,23,23,NN,FM,5,CO Pueblo Pueblo West K0JSC 448.975
119,N0KM Center 14664 ,146.64,-,0.6,TSQL,77,77,23,23,NN,FM,5,CO Rio Grande Center N0KM 146.64
120,N0KM Center 4471 ,447.1,-,5,Tone,77,88.5,23,23,NN,FM,5,CO Saguache Center N0KM 447.1
121,KB5ITS Silverton 447525 ,447.525,-,5,Tone,127.3,88.5,23,23,NN,FM,5,CO San Juan Silverton KB5ITS 447.525
122,"KB5ITS Silverton, Buffalo Boy 145325 ",145.325,-,0.6,Tone,127.3,88.5,23,23,NN,FM,5,"CO San Juan Silverton, Buffalo Boy KB5ITS 145.325"
123,"KB5ITT Silverton, Engineer Mountain 14727 ",147.27,+,0.6,Tone,127.3,88.5,23,23,NN,FM,5,"CO San Juan Silverton, Engineer Mountain KB5ITT 147.27"
124,"KB5ITS Silverton, Kendall Mountain 147375 ",147.375,+,0.6,Tone,156.7,88.5,23,23,NN,FM,5,"CO San Juan Silverton, Kendall Mountain KB5ITS 147.375"
125,"KB0YNA Telluride, Gray Head 4497 ",449.7,-,5,TSQL,107.2,107.2,23,23,NN,FM,5,"CO San Miguel Telluride, Gray Head KB0YNA 449.7"
126,NX0G Cripple Creek 147015 ,147.015,+,0.6,Tone,107.2,88.5,23,23,NN,FM,5,CO Teller Cripple Creek NX0G 147.015
127,WB0WDF Cripple Creek 14546 ,145.46,-,0.6,Tone,67,88.5,23,23,NN,FM,5,CO Teller Cripple Creek WB0WDF 145.46
128,WB0WDF Cripple Creek 22494 ,224.94,-,1.6,Tone,67,88.5,23,23,NN,FM,5,CO Teller Cripple Creek WB0WDF 224.94
129,WB0WDF Cripple Creek 4474 ,447.4,-,5,Tone,67,88.5,23,23,NN,FM,5,CO Teller Cripple Creek WB0WDF 447.4
130,"KB5GAS Albuquerque, Sandia Crest 4421 ",442.1,+,5,Tone,162.2,88.5,23,23,NN,FM,5,"NM Bernalillo Albuquerque, Sandia Crest KB5GAS 442.1"
131,"KC5IPK Albuquerque, Sandia Crest 44275 ",442.75,+,5,Tone,162.2,88.5,23,23,NN,FM,5,"NM Bernalillo Albuquerque, Sandia Crest KC5IPK 442.75"
132,"NM5ML Albuquerque, Sandia Crest 14529 ",145.29,-,0.6,Tone,100,88.5,23,23,NN,FM,5,"NM Bernalillo Albuquerque, Sandia Crest NM5ML 145.29"
133,"NM5ML Albuquerque, Sandia Crest 444325 ",444.325,+,5,Tone,100,88.5,23,23,NN,FM,5,"NM Bernalillo Albuquerque, Sandia Crest NM5ML 444.325"
134,"KE5FYL Grants,   La Mosca Peak 44495 ",444.95,+,5,Cross,100,88.5,23,23,NN,FM,5,"NM Bernalillo Grants,   La Mosca Peak KE5FYL 444.95"
135,"WB5EKP Grants,  Mt Taylor 14694 ",146.94,-,0.6,Tone,100,88.5,23,23,NN,FM,5,"NM Cibola Grants,  Mt Taylor WB5EKP 146.94"
136,"NM5EM Grants, Mt Taylor 14698 ",146.98,-,0.6,TSQL,141.3,141.3,23,23,NN,FM,5,"NM Cibola Grants, Mt Taylor NM5EM 146.98"
137,"N5LEM Angel Fire, Agua Fria Peak 14734 ",147.34,+,0.6,Tone,100,88.5,23,23,NN,FM,5,"NM Colfax Angel Fire, Agua Fria Peak N5LEM 147.34"
138,N5GDR Cimarron 14521 ,145.21,-,0.6,TSQL,110.9,110.9,23,23,NN,FM,5,NM Colfax Cimarron N5GDR 145.21
139,"NM5ML Eagle Nest, Iron Mountain 44435 ",444.35,+,5,Tone,100,88.5,23,23,NN,FM,5,"NM Colfax Eagle Nest, Iron Mountain NM5ML 444.35"
140,"NM5EM Eagle Nest, Touch Me Not 14704 ",147.04,+,0.6,Tone,141.3,88.5,23,23,NN,FM,5,"NM Colfax Eagle Nest, Touch Me Not NM5EM 147.04"
141,"NM5ML Raton, Sierra Grande 14728 ",147.28,+,0.6,Tone,100,88.5,23,23,NN,FM,5,"NM Colfax Raton, Sierra Grande NM5ML 147.28"
142,KA5BIW Los Alamos 22404 ,224.04,-,1.6,TSQL,100,100,23,23,NN,FM,5,NM Los Alamos Los Alamos KA5BIW 224.04
143,KA5BIW Los Alamos 442 ,442,+,5,Tone,100,88.5,23,23,NN,FM,5,NM Los Alamos Los Alamos KA5BIW 442
144,KC2HSO Los Alamos 144265 ,144.265,,0,Tone,203.5,88.5,23,23,NN,FM,5,NM Los Alamos Los Alamos KC2HSO 144.265
145,"W5PDO Los Alamos, Barranca Mesa 14688 ",146.88,-,0.6,,88.5,88.5,23,23,NN,FM,5,"NM Los Alamos Los Alamos, Barranca Mesa W5PDO 146.88"
146,"KB5RX Los Alamos, Pajarito Mountain 22394 ",223.94,-,1.6,,88.5,88.5,23,23,NN,FM,5,"NM Los Alamos Los Alamos, Pajarito Mountain KB5RX 223.94"
147,"W5SF Los Alamos, Pajarito Mountain 14519 ",145.19,-,0.6,Tone,162.2,88.5,23,23,NN,FM,5,"NM Los Alamos Los Alamos, Pajarito Mountain W5SF 145.19"
148,"KC5WDV Gallup, Deza Bluffs 4482 ",448.2,-,5,Tone,100,88.5,23,23,NN,FM,5,"NM McKinley Gallup, Deza Bluffs KC5WDV 448.2"
149,"NM5ML Gallup, Deza Bluffs 14722 ",147.22,+,0.6,Tone,67,88.5,23,23,NN,FM,5,"NM McKinley Gallup, Deza Bluffs NM5ML 147.22"
150,"W5SF Chama, Overlook Mtn 14708 ",147.08,+,0.6,Tone,162.2,88.5,23,23,NN,FM,5,"NM Rio Arriba Chama, Overlook Mtn W5SF 147.08"
151,"KD5PX Dixon, Cerro Abajo 14718 ",147.18,+,0.6,TSQL,100,100,23,23,NN,FM,5,"NM Rio Arriba Dixon, Cerro Abajo KD5PX 147.18"
152,NM5SJ Dulce 14543 ,145.43,-,0.6,Tone,136.5,88.5,23,23,NN,FM,5,NM Rio Arriba Dulce NM5SJ 145.43
153,NM5SJ Lybrook 14549 ,145.49,-,0.6,Tone,100,88.5,23,23,NN,FM,5,NM Rio Arriba Lybrook NM5SJ 145.49
154,"KF5PFO Tres Piedras,  San Antonio Mountain 14676 ",146.76,-,0.6,Tone,67,88.5,23,23,NN,FM,5,"NM Rio Arriba Tres Piedras,  San Antonio Mountain KF5PFO 146.76"
155,"NM5ML Tres Piedras, San Antonio Mountain 14722 ",147.22,+,0.6,Tone,100,88.5,23,23,NN,FM,5,"NM Rio Arriba Tres Piedras, San Antonio Mountain NM5ML 147.22"
156,KB5ITS Aztec 44745 ,447.45,-,5,Tone,107.2,88.5,23,23,NN,FM,5,NM San Juan Aztec KB5ITS 447.45
157,NM5SJ Aztec 14674 ,146.74,-,0.6,Tone,100,88.5,23,23,NN,FM,5,NM San Juan Aztec NM5SJ 146.74
158,"KB5ITS Aztec, Tank Mtn 14688 ",146.88,-,0.6,Tone,100,88.5,23,23,NN,FM,5,"NM San Juan Aztec, Tank Mtn KB5ITS 146.88"
159,K5WXI Bloomfield 14692 ,146.92,-,0.6,Tone,100,88.5,23,23,NN,FM,5,NM San Juan Bloomfield K5WXI 146.92
160,KB5ITS Bloomfield 44865 ,448.65,-,5,Tone,127.3,88.5,23,23,NN,FM,5,NM San Juan Bloomfield KB5ITS 448.65
161,"NM5ML Bloomfield, Harris Mesa 14728 ",147.28,+,0.6,Tone,67,88.5,23,23,NN,FM,5,"NM San Juan Bloomfield, Harris Mesa NM5ML 147.28"
162,"KB5ITS Bloomfield, Harris mesa 1471 ",147.1,+,0.6,Tone,100,88.5,23,23,NN,FM,5,"NM San Juan Bloomfield, Harris mesa KB5ITS 147.1"
163,K5WXI Farmington 14685 ,146.85,-,0.6,TSQL,100,100,23,23,NN,FM,5,NM San Juan Farmington K5WXI 146.85
164,K5WY Farmington 449 ,449,-,5,Tone,100,88.5,23,23,NN,FM,5,NM San Juan Farmington K5WY 449
165,KB5ITS Farmington 14676 ,146.76,-,0.6,TSQL,100,100,23,23,NN,FM,5,NM San Juan Farmington KB5ITS 146.76
166,KB5ITS Farmington 147 ,147,+,0.6,Tone,100,88.5,23,23,NN,FM,5,NM San Juan Farmington KB5ITS 147
167,"KB5ITS Navajo Dam, Navajo Lake 14736 ",147.36,+,0.6,Tone,100,88.5,23,23,NN,FM,5,"NM San Juan Navajo Dam, Navajo Lake KB5ITS 147.36"
168,"NM5SJ Nebo, Cedar Hill 14706 ",147.06,+,0.6,Tone,100,88.5,23,23,NN,FM,5,"NM San Juan Nebo, Cedar Hill NM5SJ 147.06"
169,"W5SF Las Vegas,  Elk Mountain 1473 ",147.3,+,0.6,Tone,162.2,88.5,23,23,NN,FM,5,"NM San Miguel Las Vegas,  Elk Mountain W5SF 147.3"
170,"NM5ML Pecos, Elk Mountain 14726 ",147.26,+,0.6,Tone,67,88.5,23,23,NN,FM,5,"NM San Miguel Pecos, Elk Mountain NM5ML 147.26"
171,"NM5ML Cuba, Eureka Mesa 14724 ",147.24,+,0.6,Tone,67,88.5,23,23,NN,FM,5,"NM Sandoval Cuba, Eureka Mesa NM5ML 147.24"
172,"NM5SC Placitas, La Madera 14708 ",147.08,+,0.6,Tone,100,88.5,23,23,NN,FM,5,"NM Sandoval Placitas, La Madera NM5SC 147.08"
173,"K5AKW Placitas, Sandia Peak 4434 ",443.4,+,5,Tone,100,88.5,23,23,NN,FM,5,"NM Sandoval Placitas, Sandia Peak K5AKW 443.4"
174,KC5IPK Rio Rancho 44275 ,442.75,+,5,Tone,162.2,88.5,23,23,NN,FM,5,NM Sandoval Rio Rancho KC5IPK 442.75
175,NM5HD Rio Rancho 14537 ,145.37,-,0.6,Tone,162.2,88.5,23,23,NN,FM,5,NM Sandoval Rio Rancho NM5HD 145.37
176,WA5OLD Rio Rancho 44235 ,442.35,+,5,Tone,100,88.5,23,23,NN,FM,5,NM Sandoval Rio Rancho WA5OLD 442.35
177,"K5CPU Rio Rancho, Intel Corp 4447 ",444.7,+,5,Tone,100,88.5,23,23,NN,FM,5,"NM Sandoval Rio Rancho, Intel Corp K5CPU 444.7"
178,"NM5RR Rio Rancho, Rainbow 1471 ",147.1,+,0.6,TSQL,100,100,23,23,NN,FM,5,"NM Sandoval Rio Rancho, Rainbow NM5RR 147.1"
179,"NM5RR Rio Rancho, Rainbow 443 ",443,+,5,Tone,100,88.5,23,23,NN,FM,5,"NM Sandoval Rio Rancho, Rainbow NM5RR 443"
180,"K5YEJ San Luis, Cabezon 443 ",443,+,5,Tone,100,88.5,23,23,NN,FM,5,"NM Sandoval San Luis, Cabezon K5YEJ 443"
181,"NM5SC San Ysidro, Pajarito Peak 4431 ",443.1,+,5,Tone,100,88.5,23,23,NN,FM,5,"NM Sandoval San Ysidro, Pajarito Peak NM5SC 443.1"
182,N9PGQ La Cueva 14684 ,146.84,-,0.6,Tone,107.2,88.5,23,23,NN,FM,5,NM Santa Fe La Cueva N9PGQ 146.84
183,N9PGQ La Cueva 442125 ,442.125,+,5,Tone,107.2,88.5,23,23,NN,FM,5,NM Santa Fe La Cueva N9PGQ 442.125
184,K9GAJ Santa Fe 449275 ,449.275,-,5,Tone,146.2,88.5,23,23,NN,FM,5,NM Santa Fe Santa Fe K9GAJ 449.275
185,KF5SGT Santa Fe 447775 ,447.775,-,5,Tone,100,88.5,23,23,NN,FM,5,NM Santa Fe Santa Fe KF5SGT 447.775
186,"W5SF Santa Fe,  Tesuque Peak 14682 ",146.82,-,0.6,Tone,162.2,88.5,23,23,NN,FM,5,"NM Santa Fe Santa Fe,  Tesuque Peak W5SF 146.82"
187,"N5BGC Santa Fe, St Vincent Hospital 1472 ",147.2,+,0.6,Tone,162.2,88.5,23,23,NN,FM,5,"NM Santa Fe Santa Fe, St Vincent Hospital N5BGC 147.2"
188,"KB5ZQE Santa Fe, Tesuque Peak 442825 ",442.825,+,5,Tone,131.8,88.5,23,23,NN,FM,5,"NM Santa Fe Santa Fe, Tesuque Peak KB5ZQE 442.825"
189,"NM5EM Santa Fe, Tesuque Peak 14702 ",147.02,+,0.6,Tone,141.3,88.5,23,23,NN,FM,5,"NM Santa Fe Santa Fe, Tesuque Peak NM5EM 147.02"
190,"KF5PFO Red River, Molycorp 14539 ",145.39,-,0.6,Tone,100,88.5,23,23,NN,FM,5,"NM Taos Red River, Molycorp KF5PFO 145.39"
191,"KF5PFO Red River, Valle Vidal 14525 ",145.25,-,0.6,Tone,123,88.5,23,23,NN,FM,5,"NM Taos Red River, Valle Vidal KF5PFO 145.25"
192,"KF5PFO Taos, Picuris Peak 14712 ",147.12,+,0.6,Tone,67,88.5,23,23,NN,FM,5,"NM Taos Taos, Picuris Peak KF5PFO 147.12"
193,"KF5PFO Taos, Picuris Peak 2244 ",224.4,-,1.6,Tone,225.7,88.5,23,23,NN,FM,5,"NM Taos Taos, Picuris Peak KF5PFO 224.4"
194,"KF5PFO Taos, Picuris Peak 449875 ",449.875,-,5,Tone,123,88.5,23,23,NN,FM,5,"NM Taos Taos, Picuris Peak KF5PFO 449.875"
195,"NM5ML Taos, Ski Valley 14714 ",147.14,+,0.6,Tone,67,88.5,23,23,NN,FM,5,"NM Taos Taos, Ski Valley NM5ML 147.14"
196,"N5TSV Taos, Wheeler Peak 444975 ",444.975,+,5,Tone,123,88.5,23,23,NN,FM,5,"NM Taos Taos, Wheeler Peak N5TSV 444.975"
197,"KF5PFO Tres Piedras, San Antonio Mountain 14676 ",146.76,-,0.6,Tone,67,88.5,23,23,NN,FM,5,"NM Taos Tres Piedras, San Antonio Mountain KF5PFO 146.76"
198,"K7QEQ Monticello, Abajo Peak 4471 ",447.1,-,5,TSQL,107.2,107.2,23,23,NN,FM,5,"UT San Juan Monticello, Abajo Peak K7QEQ 447.1"
199,"K7SDC Monticello, Abajo Peak 14661 ",146.61,-,0.6,Tone,88.5,88.5,23,23,NN,FM,5,"UT San Juan Monticello, Abajo Peak K7SDC 146.61"
