Location,Name,Frequency,Duplex,Offset,Tone,rToneFreq,cToneFreq,DtcsCode,DtcsRxCode,DtcsPolarity,Mode,TStep,Comment
0,IRP Colorado Springs,447.35,-,5,Tone,151.4,151.4,23,23,NN,FM,5,CO El Paso Colorado Springs K0IRP 447.35
1, Colorado Springs,449.575,-,5,,88.5,88.5,23,23,NN,FM,5,CO El Paso Colorado Springs  449.575
2,0WF Colorado Springs,447.025,-,5,Tone,123,123,23,23,NN,FM,5,CO El Paso Colorado Springs KF0WF 447.025
3,MOG Colorado Springs,927.8,-,25,DTCS,88.5,88.5,116,116,NN,FM,5,CO Teller Colorado Springs W0MOG 927.8
4,X0G Colorado Springs,447.475,-,5,Tone,107.2,107.2,23,23,NN,FM,5,CO El Paso Colorado Springs NX0G 447.475
5,IFI Colorado Springs,447.55,-,5,Tone,123,123,23,23,NN,FM,5,CO El Paso Colorado Springs WA6IFI 447.55
6,SRJ Colorado Springs,224.06,-,1.6,,88.5,88.5,23,23,NN,FM,5,CO El Paso Colorado Springs KB0SRJ 224.06
7,"0KG Colorado Springs, Broadmoor Area",448.25,-,5,Tone,123,123,23,23,NN,FM,5,"CO El Paso Colorado Springs, Broadmoor Area N0KG 448.25"
8,A0L Colorado Springs,448.3,-,5,Tone,100,100,23,23,NN,FM,5,CO El Paso Colorado Springs AA0L 448.3
9,MOG Colorado Springs,448.6,-,5,Tone,114.8,114.8,23,23,NN,FM,5,CO El Paso Colorado Springs W0MOG 448.6
10,IRP Colorado Springs,146.91,-,0.6,Tone,151.4,151.4,23,23,NN,FM,5,CO El Paso Colorado Springs K0IRP 146.91
11, Colorado Springs,147.27,+,0.6,,88.5,88.5,23,23,NN,FM,5,CO El Paso Colorado Springs  147.27
12,RSH Colorado Springs,146.85,-,0.6,Tone,103.5,103.5,23,23,NN,FM,5,CO El Paso Colorado Springs W0RSH 146.85
13,MOG Colorado Springs,147.39,+,0.6,Tone,103.5,103.5,23,23,NN,FM,5,CO El Paso Colorado Springs W0MOG 147.39
14,A0L Colorado Springs,147.135,+,0.6,Tone,100,100,23,23,NN,FM,5,CO El Paso Colorado Springs AA0L 147.135
15,"TTF Colorado Springs, Fillmore Hill",448.725,-,5,Tone,123,123,23,23,NN,FM,5,"CO El Paso Colorado Springs, Fillmore Hill KA0TTF 448.725"
16,MOG Colorado springs,224.72,-,1.6,Tone,103.5,103.5,23,23,NN,FM,5,CO El Paso Colorado springs W0MOG 224.72
17,"0SZ Colorado Springs, Cheyenne Mountain",445.0625,-,5,,88.5,88.5,23,23,NN,DIG,5,"CO El Paso Colorado Springs, Cheyenne Mountain N0SZ 445.0625"
18,"CVU Colorado Springs, Cheyenne Mountain",927.85,-,25,DTCS,88.5,88.5,114,114,NN,FM,5,"CO Teller Colorado Springs, Cheyenne Mountain KC0CVU 927.85"
19,"IFI Colorado Springs, Cheyenne Mountain",53.13,-,1.7,Tone,107.2,107.2,23,23,NN,FM,5,"CO El Paso Colorado Springs, Cheyenne Mountain WA6IFI 53.13"
20,"VJJ Colorado Springs, Cheyenne Mountain",145.13,-,0.6,Tone,88.5,123,23,23,NN,FM,5,"CO El Paso Colorado Springs, Cheyenne Mountain KB0VJJ 145.13"
21,"CVU Colorado Springs, Cheyenne Mountain",446.9125,-,5,,88.5,88.5,23,23,NN,DIG,5,"CO El Paso Colorado Springs, Cheyenne Mountain KC0CVU 446.9125"
22,"CVU Colorado Springs, Cheyenne Mountain",145.375,-,0.6,,88.5,88.5,23,23,NN,DIG,5,"CO El Paso Colorado Springs, Cheyenne Mountain KC0CVU 145.375"
23,"CVU Colorado Springs, Cheyenne Mountain",147.345,+,0.6,Tone,107.2,107.2,23,23,NN,FM,5,"CO El Paso Colorado Springs, Cheyenne Mountain KC0CVU 147.345"
24,"CRA Colorado Springs, Cheyenne Mountain",145.16,-,0.6,Tone,107.2,107.2,23,23,NN,FM,5,"CO El Paso Colorado Springs, Cheyenne Mountain W0CRA 145.16"
25,"CVU Colorado Springs, Cheyenne Mountain",146.76,-,0.6,Tone,107.2,107.2,23,23,NN,FM,5,"CO El Paso Colorado Springs, Cheyenne Mountain KC0CVU 146.76"
26,"CVU Colorado Springs, Cheyenne Mountain",448.1,-,5,Tone,107.2,107.2,23,23,NN,FM,5,"CO El Paso Colorado Springs, Cheyenne Mountain KC0CVU 448.1"
27,"CVU Colorado Springs, Cheyenne Mountain",448,-,5,Tone,107.2,107.2,23,23,NN,FM,5,"CO El Paso Colorado Springs, Cheyenne Mountain KC0CVU 448"
28,"PFJ Colorado Springs, Almagre Mountain",446.95,-,5,,88.5,88.5,23,23,NN,DIG,5,"CO Teller Colorado Springs, Almagre Mountain K7PFJ 446.95"
29,"0SP Colorado Springs, Almagre Mountain",147.18,+,0.6,Tone,100,100,23,23,NN,FM,5,"CO El Paso Colorado Springs, Almagre Mountain AA0SP 147.18"
30,SRJ Colorado Springs,145.265,-,0.6,Tone,100,100,23,23,NN,DIG,5,CO El Paso Colorado Springs KB0SRJ 145.265
31,"IFI Colorado Springs, Almagre Mountain",927.725,-,25,DTCS,88.5,88.5,114,114,NN,FM,5,"CO Teller Colorado Springs, Almagre Mountain WA6IFI 927.725"
32,"SRJ Colorado Springs, UCCS",448.8,-,5,Tone,100,100,23,23,NN,DIG,5,"CO El Paso Colorado Springs, UCCS KB0SRJ 448.8"
33,"SRJ Colorado Springs, Pikes Peak",448.45,-,5,Tone,100,100,23,23,NN,FM,5,"CO El Paso Colorado Springs, Pikes Peak KB0SRJ 448.45"
34,"SRJ Colorado Springs, Pikes Peak",146.97,-,0.6,Tone,100,123,23,23,NN,FM,5,"CO El Paso Colorado Springs, Pikes Peak KB0SRJ 146.97"
35, Falcon,447.2,-,5,Tone,151.4,151.4,23,23,NN,DIG,5,CO El Paso Falcon  447.2
36,"EPS Woodland Park, Paradise Pines",449.325,-,5,Tone,103.5,103.5,23,23,NN,FM,5,"CO Teller Woodland Park, Paradise Pines KA4EPS 449.325"
37,X0G Woodland Park,448.65,-,5,Tone,107.2,107.2,23,23,NN,FM,5,CO Teller Woodland Park NX0G 448.65
38,WUC Woodland Park,449.025,-,5,Tone,141.3,141.3,23,23,NN,FM,5,CO Teller Woodland Park KA0WUC 449.025
39,X0G Woodland Park,146.82,-,0.6,Tone,107.2,107.2,23,23,NN,FM,5,CO Teller Woodland Park NX0G 146.82
40,WUC Woodland Park,927.9,-,25,DTCS,88.5,88.5,205,205,NN,FM,5,CO Teller Woodland Park KA0WUC 927.9
41,WUC Woodland Park,145.415,-,0.6,Tone,179.9,179.9,23,23,NN,FM,5,CO Teller Woodland Park KA0WUC 145.415
42,WUC Woodland Park,447.675,-,5,Tone,179.9,179.9,23,23,NN,FM,5,CO Teller Woodland Park KA0WUC 447.675
43,"0NR Monument, Monument Hill",447.725,-,5,Tone,100,100,23,23,NN,FM,5,"CO El Paso Monument, Monument Hill K0NR 447.725"
44,"MDP Falcon, Black Forest",447.625,-,5,Tone,100,100,23,23,NN,FM,5,"CO El Paso Falcon, Black Forest KD0MDP 447.625"
45,WDF Cripple Creek,224.94,-,1.6,Tone,67,67,23,23,NN,FM,5,CO Teller Cripple Creek WB0WDF 224.94
46,WDF Cripple Creek,1287.7,-,20,Tone,67,67,23,23,NN,FM,5,CO Teller Cripple Creek WB0WDF 1287.7
47,WDF Cripple Creek,145.46,-,0.6,Tone,67,67,23,23,NN,FM,5,CO Teller Cripple Creek WB0WDF 145.46
48,X0G Cripple Creek,147.015,+,0.6,Tone,107.2,107.2,23,23,NN,FM,5,CO Teller Cripple Creek NX0G 147.015
49,WDF Cripple Creek,447.4,-,5,Tone,67,67,23,23,NN,FM,5,CO Teller Cripple Creek WB0WDF 447.4
50,"XLF Palmer Lake, Monument Hill",145.19,-,0.6,Tone,131.8,131.8,23,23,NN,FM,5,"CO Douglas Palmer Lake, Monument Hill N0XLF 145.19"
51,"CRA Larkspur, Westcreek",448.425,-,5,Tone,107.2,107.2,23,23,NN,FM,5,"CO Douglas Larkspur, Westcreek W0CRA 448.425"
52,"JSC Larkspur, Westcreek",449.975,-,5,Tone,100,100,23,23,NN,FM,5,"CO Douglas Larkspur, Westcreek K0JSC 449.975"
53,"CRA Larkspur, Westcreek",147.225,+,0.6,Tone,107.2,107.2,23,23,NN,FM,5,"CO Douglas Larkspur, Westcreek W0CRA 147.225"
54,0SZ Westcreek,446.875,-,5,,88.5,88.5,23,23,NN,DIG,5,CO Douglas Westcreek N0SZ 446.875
55, Lake George,449.7,-,5,Tone,107.2,107.2,23,23,NN,FM,5,CO Park Lake George  449.7
56,"JSC Canon City, Canon City",449.975,-,5,Tone,100,100,23,23,NN,FM,5,"CO Fremont Canon City, Canon City K0JSC 449.975"
57,"ESQ Castle Rock, Devils Head",446.925,-,5,,88.5,88.5,23,23,NN,DIG,5,"CO Douglas Castle Rock, Devils Head N0ESQ 446.925"
58,"D0Q Pueblo, Baculite Mesa",224.26,-,1.6,Tone,88.5,88.5,23,23,NN,FM,5,"CO Pueblo Pueblo, Baculite Mesa ND0Q 224.26"
59,"ESQ Castle Rock, Devils Head (Pike National Forest)",447.525,-,5,Tone,146.2,146.2,23,23,NN,FM,5,"CO Douglas Castle Rock, Devils Head (Pike National Forest) N0ESQ 447.525"
60,D0Q Pueblo,447.95,-,5,Tone,88.5,88.5,23,23,NN,FM,5,CO Pueblo Pueblo ND0Q 447.95
61,"D0Q Pueblo, Baculite Mesa",146.79,-,0.6,Tone,88.5,88.5,23,23,NN,FM,5,"CO Pueblo Pueblo, Baculite Mesa ND0Q 146.79"
62,"WDF Canon City, eightmile Mountain",449,-,5,Tone,67,67,23,23,NN,FM,5,"CO Fremont Canon City, eightmile Mountain WB0WDF 449"
63,"JSC Canon City, Colorado",447.975,-,5,Tone,100,100,23,23,NN,FM,5,"CO Fremont Canon City, Colorado K0JSC 447.975"
64,"TUC Canon City, Fremont Peak",927.7,-,25,DTCS,88.5,88.5,114,114,NN,FM,5,"CO Fremont Canon City, Fremont Peak KB0TUC 927.7"
65,"EKR Canon City, Fremont Peak",223.96,-,1.6,Tone,103.5,103.5,23,23,NN,FM,5,"CO Fremont Canon City, Fremont Peak WD0EKR 223.96"
66,"JSC Canon City, Fremont Peak",446.7375,-,5,,88.5,88.5,23,23,NN,DIG,5,"CO Fremont Canon City, Fremont Peak K0JSC 446.7375"
67,"WDF Canon City, Fremont Peak",53.03,-,1.7,Tone,88.5,88.5,23,23,NN,FM,5,"CO Fremont Canon City, Fremont Peak WB0WDF 53.03"
68,"JSC Canon City, Fremont Peak",447.25,-,5,Tone,100,100,23,23,NN,FM,5,"CO Fremont Canon City, Fremont Peak K0JSC 447.25"
69,"EKR Canon City, Fremont Peak",447.75,-,5,Tone,103.5,103.5,23,23,NN,FM,5,"CO Fremont Canon City, Fremont Peak WD0EKR 447.75"
70,"EKR Canon City, Fremont Peak",145.49,-,0.6,Tone,103.5,103.5,23,23,NN,FM,5,"CO Fremont Canon City, Fremont Peak WD0EKR 145.49"
71,JSC Pueblo West,448.975,-,5,Tone,100,100,23,23,NN,FM,5,CO Pueblo Pueblo West K0JSC 448.975
72,"E0Z Pueblo, CSU",147,+,0.6,,88.5,88.5,23,23,NN,FM,5,"CO Pueblo Pueblo, CSU NE0Z 147"
73,PRA Franktown,446.85,-,5,,88.5,88.5,23,23,NN,DIG,5,CO Douglas Franktown K0PRA 446.85
74,"X0G Lake George, Badger Mountain",146.685,-,0.6,Tone,107.2,107.2,23,23,NN,FM,5,"CO Park Lake George, Badger Mountain NX0G 146.685"
75,"CVU Lake George, Badger Mountain",147.36,+,0.6,Tone,107.2,107.2,23,23,NN,FM,5,"CO Park Lake George, Badger Mountain KC0CVU 147.36"
76,D0Q Pueblo,145.115,-,0.6,Tone,88.5,88.5,23,23,NN,FM,5,CO Pueblo Pueblo ND0Q 145.115
77,"0KR Pueblo, Pueblo",447.7,-,5,Tone,210.7,210.7,23,23,NN,DIG,5,"CO Pueblo Pueblo, Pueblo KF0KR 447.7"
78,"D0Q Pueblo, Deer Peak",146.88,-,0.6,Tone,88.5,88.5,23,23,NN,FM,5,"CO Pueblo Pueblo, Deer Peak ND0Q 146.88"
79,PWZ Palmer Divide,449.725,-,5,Tone,100,100,23,23,NN,FM,5,CO El Paso Palmer Divide N0PWZ 449.725
80,"0ST Pueblo, Pueblo",146.655,-,0.6,Tone,123,123,23,23,NN,FM,5,"CO Pueblo Pueblo, Pueblo K0ST 146.655"
81,PRA Parker,445.075,-,5,,88.5,88.5,23,23,NN,DIG,5,CO Douglas Parker K0PRA 445.075
82,"JSC Pueblo, Metro",447.275,-,5,Tone,100,100,23,23,NN,FM,5,"CO Pueblo Pueblo, Metro K0JSC 447.275"
83,JSC Pueblo,446.9875,-,5,,88.5,88.5,23,23,NN,DIG,5,CO Pueblo Pueblo K0JSC 446.9875
84,J0T Pueblo,147.24,+,0.6,Tone,103.5,103.5,23,23,NN,FM,5,CO Pueblo Pueblo KJ0T 147.24
85,"9SL Castle Pines, Daniels Park",449.95,-,5,Tone,77,77,23,23,NN,FM,5,"CO Douglas Castle Pines, Daniels Park W9SL 449.95"
86,"ESQ Parker, Hess Reservoir",447.525,-,5,Tone,203.5,146.2,23,23,NN,FM,5,"CO Douglas Parker, Hess Reservoir N0ESQ 447.525"
87,0DE Simla,147.105,+,0.6,Tone,107.2,107.2,23,23,NN,FM,5,CO Elbert Simla WA0DE 147.105
88,"OWY Conifer, Critchell Mountain",447.5,-,5,Tone,88.5,88.5,23,23,NN,FM,5,"CO Jefferson Conifer, Critchell Mountain N0OWY 447.5"
89,"TUB Centennial, Warren Mountain",146.88,-,0.6,Tone,100,100,23,23,NN,FM,5,"CO Jefferson Centennial, Warren Mountain WB0TUB 146.88"
90,"TUB Centennial, Warren Mountain",449.6,-,5,Tone,100,100,23,23,NN,FM,5,"CO Jefferson Centennial, Warren Mountain WB0TUB 449.6"
91,Q8M Parker,448.7,-,5,Tone,146.2,146.2,23,23,NN,FM,5,CO Douglas Parker WQ8M 448.7
92,0HC Parker,927.8375,-,25.8,Tone,100,100,23,23,NN,DIG,5,CO Douglas Parker KI0HC 927.8375
93,"0PC Bailey, Dick Mountain",146.895,-,0.6,Tone,100,100,23,23,NN,FM,5,"CO Park Bailey, Dick Mountain AB0PC 146.895"
94,"UDD Aurora, Smoky Hill",145.4,-,0.8,Tone,100,100,23,23,NN,FM,5,"CO Arapahoe Aurora, Smoky Hill KB0UDD 145.4"
95,"CRA Conifer, Conifer Mountain",447.15,-,5,Tone,107.2,107.2,23,23,NN,FM,5,"CO Jefferson Conifer, Conifer Mountain W0CRA 447.15"
96,"CRA Conifer, Conifer Mountain",224.98,-,1.6,Tone,107.2,107.2,23,23,NN,FM,5,"CO Jefferson Conifer, Conifer Mountain W0CRA 224.98"
97,"CRA Conifer, Conifer Mountain",1287.9,-,20,,88.5,88.5,23,23,NN,FM,5,"CO Jefferson Conifer, Conifer Mountain W0CRA 1287.9"
98,PWO Centennial,449.425,-,5,DTCS,88.5,88.5,23,23,NN,FM,5,CO Arapahoe Centennial K0PWO 449.425
99,"ARA Critchell, Critchell Mountain",147.12,+,0.6,Tone,88.5,88.5,23,23,NN,FM,5,"CO Jefferson Critchell, Critchell Mountain N0ARA 147.12"
100,OBA Aurora,145.19,-,0.6,Tone,151.4,131.8,23,23,NN,FM,5,CO Arapahoe Aurora N0OBA 145.19
101,"CRA Conifer, Conifer Mountain",53.05,-,1.7,Tone,107.2,107.2,23,23,NN,FM,5,"CO Jefferson Conifer, Conifer Mountain W0CRA 53.05"
102,"JSC Pueblo, Cedarwood",449.975,-,5,Tone,100,100,23,23,NN,FM,5,"CO Pueblo Pueblo, Cedarwood K0JSC 449.975"
103,"0SZ Fairplay, Badger",446.7625,-,5,,88.5,88.5,23,23,NN,DIG,5,"CO Park Fairplay, Badger N0SZ 446.7625"
104,"CVU Pueblo, Deer Peak",449.625,-,5,Tone,107.2,107.2,23,23,NN,FM,5,"CO Custer Pueblo, Deer Peak KC0CVU 449.625"
105,"D0Q Pueblo, Deer Peak",447.175,-,5,Tone,88.5,88.5,23,23,NN,FM,5,"CO Pueblo Pueblo, Deer Peak ND0Q 447.175"
106,"D0Q Walsenburg, Deer Peak",224.32,-,1.6,Tone,88.5,88.5,23,23,NN,FM,5,"CO Custer Walsenburg, Deer Peak ND0Q 224.32"
107,TUC Westcliffe,927.775,-,25,DTCS,88.5,88.5,116,116,NN,FM,5,CO Custer Westcliffe KB0TUC 927.775
108,TUC Westcliffe,147.06,+,0.6,Tone,77,77,23,23,NN,FM,5,CO Custer Westcliffe KB0TUC 147.06
109,TUC Westcliffe,448.15,-,5,Tone,103.5,103.5,23,23,NN,FM,5,CO Custer Westcliffe KB0TUC 448.15
110,"D0Q Westcliffe, Deer Peak",919.1,-,25,Tone,88.5,88.5,23,23,NN,FM,5,"CO Pueblo Westcliffe, Deer Peak ND0Q 919.1"
111,AEN Aurora,449.15,-,5,Tone,136.5,136.5,23,23,NN,DIG,5,CO Arapahoe Aurora WR0AEN 449.15
112,JSC Westcliffe,448.325,-,5,Tone,100,100,23,23,NN,FM,5,CO Custer Westcliffe K0JSC 448.325
113,Z0N Hartsel,448.575,-,5,Tone,103.5,103.5,23,23,NN,FM,5,CO Park Hartsel WZ0N 448.575
114,FSX Punkin Center,449.9,-,5,Tone,107.2,107.2,23,23,NN,FM,5,CO Lincoln Punkin Center N1FSX 449.9
115,"0TX Lakewood, Green Mtn",449.775,-,5,Tone,100,100,23,23,NN,DIG,5,"CO Jefferson Lakewood, Green Mtn W0TX 449.775"
116,"0TX Lakewood, Green Mountain",147.33,+,0.6,Tone,100,100,23,23,NN,FM,5,"CO Jefferson Lakewood, Green Mountain W0TX 147.33"
117,"0TX Lakewood, Green Mountain",224.38,-,1.6,Tone,100,100,23,23,NN,FM,5,"CO Jefferson Lakewood, Green Mountain W0TX 224.38"
118,GUQ Evergreen,145.34,-,0.6,Tone,103.5,127.3,23,23,NN,FM,5,CO Jefferson Evergreen KE4GUQ 145.34
119,"0SZ Evergreen, Lower Squaw Mountain",145.175,-,0.6,DTCS,88.5,88.5,73,73,NN,DIG,5,"CO Clear Creek Evergreen, Lower Squaw Mountain N0SZ 145.175"
120,"LXX Morrison, Mt. Morrison",447.875,-,5,Tone,107.2,107.2,23,23,NN,FM,5,"CO Jefferson Morrison, Mt. Morrison N6LXX 447.875"
121,"LXX Morrison, Mt. Morrison",53.17,-,1.7,Tone,107.2,107.2,23,23,NN,FM,5,"CO Jefferson Morrison, Mt. Morrison N6LXX 53.17"
122,"UDD Aurora, Smokey Hill",448.5,-,5,Tone,100,100,23,23,NN,FM,5,"CO Denver Aurora, Smokey Hill KB0UDD 448.5"
123,ANT Aurora,448.825,-,5,,88.5,88.5,23,23,NN,DIG,5,CO Arapahoe Aurora WN7ANT 448.825
124,0BG Aurora,448.275,-,5,Tone,156.7,156.7,23,23,NN,FM,5,CO Arapahoe Aurora W0BG 448.275
125,ZUQ Aurora,448.4,-,5,Tone,94.8,94.8,23,23,NN,FM,5,CO Arapahoe Aurora N0ZUQ 448.4
126,ELY Lakewood,448.75,-,5,Tone,100,100,23,23,NN,FM,5,CO Jefferson Lakewood N0ELY 448.75
127,"0TX Lakewood, Green Mountain",53.09,-,1.7,Tone,107.2,107.2,23,23,NN,FM,5,"CO Jefferson Lakewood, Green Mountain W0TX 53.09"
128,TPT Denver,447.9,-,5,,88.5,88.5,23,23,NN,FM,5,CO Denver Denver WB0TPT 447.9
129,FEZ Denver,447.925,-,5,Tone,100,100,23,23,NN,FM,5,CO Denver Denver K0FEZ 447.925
130,AEN Denver,449.65,-,5,Tone,136.5,136.5,23,23,NN,DIG,5,CO Denver Denver WR0AEN 449.65
131,AEN Denver,449.675,-,5,Tone,136.5,136.5,23,23,NN,DIG,5,CO Denver Denver WR0AEN 449.675
132,JXN Denver,146.715,-,0.6,Tone,123,123,23,23,NN,FM,5,CO Denver Denver N0JXN 146.715
133,"0TX Lakewood, St Anthony Medical Campus",447.825,-,5,DTCS,88.5,88.5,73,73,NN,NFM,5,"CO Jefferson Lakewood, St Anthony Medical Campus W0TX 447.825"
134,"0SJ Boulder, Blue Mountain",145.475,-,0.6,Tone,100,100,23,23,NN,FM,5,"CO Jefferson Boulder, Blue Mountain KE0SJ 145.475"
135,EHP Denver,448.075,-,5,Tone,123,123,23,23,NN,FM,5,CO Denver Denver N5EHP 448.075
136,KIZ Denver,448.55,-,5,Tone,82.5,82.5,23,23,NN,FM,5,CO Denver Denver W0KIZ 448.55
137,"JRL Denver, Broadway Plaza Lofts",447.175,-,5,Tone,100,100,23,23,NN,FM,5,"CO Denver Denver, Broadway Plaza Lofts W0JRL 447.175"
138,"SSP Lakewood, Moffat Treatment Plant",448.35,-,5,Tone,225.7,225.7,23,23,NN,DIG,5,"CO Jefferson Lakewood, Moffat Treatment Plant KD0SSP 448.35"
139,"SSP Lakewood, Moffat Treatment Plant",147.21,+,0.6,Tone,100,100,23,23,NN,FM,5,"CO Jefferson Lakewood, Moffat Treatment Plant KD0SSP 147.21"
140,"YZT Golden, Lookout",446.8375,-,5,,88.5,88.5,23,23,NN,DIG,5,"CO Jefferson Golden, Lookout WA2YZT 446.8375"
141,"CDS Golden, Lookout Mountain",1299.9,,0,,88.5,88.5,23,23,NN,DIG,5,"CO Jefferson Golden, Lookout Mountain W0CDS 1299.9"
142,"CDS Golden, Lookout Mountain",446.9625,-,5,,88.5,88.5,23,23,NN,DIG,5,"CO Jefferson Golden, Lookout Mountain W0CDS 446.9625"
143,"CDS Golden, Lookout Mountain",1283.9625,-,20,,88.5,88.5,23,23,NN,DIG,5,"CO Jefferson Golden, Lookout Mountain W0CDS 1283.9625"
144,"CDS Golden, Lookout Mountain",145.25,-,0.6,,88.5,88.5,23,23,NN,DIG,5,"CO Jefferson Golden, Lookout Mountain W0CDS 145.25"
145,"0SZ Golden, Lookout Mountain",145.37,-,0.6,,88.5,88.5,23,23,NN,DIG,5,"CO Jefferson Golden, Lookout Mountain N0SZ 145.37"
146,"0KU Golden, Lookout Mountain",449.625,-,5,Tone,141.3,141.3,23,23,NN,FM,5,"CO Jefferson Golden, Lookout Mountain W0KU 449.625"
147,UPS Cedar Point,449.25,-,5,Tone,123,123,23,23,NN,FM,5,CO Elbert Cedar Point K0UPS 449.25
148,"GUR Denver, Green Valley Ranch",448.15,-,5,Tone,141.3,141.3,23,23,NN,FM,5,"CO Denver Denver, Green Valley Ranch K0GUR 448.15"
149,"0SZ Salida, Methodist Mountain",446.8125,-,5,,88.5,88.5,23,23,NN,DIG,5,"CO Chaffee Salida, Methodist Mountain N0SZ 446.8125"
150,"QPG Salida, Methodist Mountain",446.975,-,5,,88.5,88.5,23,23,NN,DIG,5,"CO Chaffee Salida, Methodist Mountain KD0QPG 446.975"
151,0GV Golden,448.975,-,5,Tone,123,123,23,23,NN,FM,5,CO Jefferson Golden W0GV 448.975
152,PYY Golden,927.7875,-,25,Tone,156.7,156.7,23,23,NN,FM,5,CO Jefferson Golden N0PYY 927.7875
153,PYY Golden,448.125,-,5,Tone,107.2,107.2,23,23,NN,FM,5,CO Jefferson Golden N0PYY 448.125
154,"AEN Idaho Springs, Squaw Mountain",449,-,5,Tone,136.5,136.5,23,23,NN,FM,5,"CO Clear Creek Idaho Springs, Squaw Mountain WR0AEN 449"
155,"CFI Idaho Springs, Squaw Mountain",448.675,-,5,Tone,100,100,23,23,NN,FM,5,"CO Denver Idaho Springs, Squaw Mountain W0CFI 448.675"
156,"PYY Evergreen, Squaw Mountain",147.3,+,0.6,Tone,103.5,103.5,23,23,NN,FM,5,"CO Clear Creek Evergreen, Squaw Mountain N0PYY 147.3"
157,"UDD Idaho Springs, Squaw Mountain",146.67,-,0.6,Tone,100,100,23,23,NN,FM,5,"CO Clear Creek Idaho Springs, Squaw Mountain KB0UDD 146.67"
158,"0TX Idaho Springs, Centennial Cone",145.49,-,0.6,Tone,100,100,23,23,NN,FM,5,"CO Jefferson Idaho Springs, Centennial Cone W0TX 145.49"
159,"0TX Idaho Springs, Squaw Mountain",449.35,-,5,Tone,100,100,23,23,NN,FM,5,"CO Clear Creek Idaho Springs, Squaw Mountain W0TX 449.35"
160,"CRA Idaho Springs, Squaw Mountain",145.145,-,0.6,Tone,107.2,107.2,23,23,NN,FM,5,"CO Clear Creek Idaho Springs, Squaw Mountain W0CRA 145.145"
161,"WYX Idaho Springs, Squaw Mountain",146.94,-,0.6,Tone,103.5,103.5,23,23,NN,FM,5,"CO Clear Creek Idaho Springs, Squaw Mountain W0WYX 146.94"
162,"0SZ Idaho Springs, Squaw Mountain",448.225,-,5,Tone,141.3,141.3,23,23,NN,FM,5,"CO Clear Creek Idaho Springs, Squaw Mountain N0SZ 448.225"
163,"0SZ Idaho Springs, Squaw Mountain",446.9375,-,5,,88.5,88.5,23,23,NN,DIG,5,"CO Clear Creek Idaho Springs, Squaw Mountain N0SZ 446.9375"
164,"DUN Idaho Springs, Squaw Mountain",449.45,-,5,Tone,103.5,127.3,23,23,NN,FM,5,"CO Clear Creek Idaho Springs, Squaw Mountain K1DUN 449.45"
165,"CRA Idaho Springs, Squaw Mountain",447.575,-,5,Tone,107.2,107.2,23,23,NN,FM,5,"CO Clear Creek Idaho Springs, Squaw Mountain W0CRA 447.575"
166,"VGD Golden, Table Mountain",446.975,-,5,,88.5,88.5,23,23,NN,DIG,5,"CO Jefferson Golden, Table Mountain KB0VGD 446.975"
167,"VJJ Salida, Methodist Mountain",147.285,+,0.6,Tone,88.5,123,23,23,NN,FM,5,"CO Chaffee Salida, Methodist Mountain KB0VJJ 147.285"
168,"CVU Salida, Methodist Mountain",145.295,-,0.6,Tone,107.2,107.2,23,23,NN,FM,5,"CO Chaffee Salida, Methodist Mountain KC0CVU 145.295"
169,"0KQ Evergreen, Saddleback Mountain",447.85,-,5,Tone,141.3,141.3,23,23,NN,FM,5,"CO Clear Creek Evergreen, Saddleback Mountain AC0KQ 447.85"
170,"JSC Salida, Methodist Mountain",449.975,-,5,Tone,100,100,23,23,NN,FM,5,"CO Chaffee Salida, Methodist Mountain K0JSC 449.975"
171,"TUB Golden, Centennial Cone",146.64,-,0.6,Tone,100,100,23,23,NN,FM,5,"CO Jefferson Golden, Centennial Cone WB0TUB 146.64"
172,"FEZ Golden, Centennial Cone",146.985,-,0.6,Tone,100,100,23,23,NN,FM,5,"CO Denver Golden, Centennial Cone K0FEZ 146.985"
173,"0SJ Golden, Centennial Cone",145.28,-,0.6,Tone,100,100,23,23,NN,FM,5,"CO Jefferson Golden, Centennial Cone KE0SJ 145.28"
174,"CVU Salida, Methodist Mountain",449.65,-,5,Tone,107.2,107.2,23,23,NN,FM,5,"CO Chaffee Salida, Methodist Mountain KC0CVU 449.65"
175,"0TX Golden, Centennial Cone",448.625,-,5,Tone,100,100,23,23,NN,FM,5,"CO Jefferson Golden, Centennial Cone W0TX 448.625"
176,"Z0N Salida, Methodist Mountain",449.925,-,5,Tone,103.5,103.5,23,23,NN,FM,5,"CO Chaffee Salida, Methodist Mountain WZ0N 449.925"
177,"0SJ Golden, Centennial Cone",449.525,-,5,,88.5,88.5,23,23,NN,FM,5,"CO Jefferson Golden, Centennial Cone KE0SJ 449.525"
178,UPS Westminster,449.3,-,5,Tone,100,100,23,23,NN,FM,5,CO Adams Westminster N1UPS 449.3
179,"CBI Golden, Guy Hill",147.15,+,0.6,Tone,100,100,23,23,NN,FM,5,"CO Jefferson Golden, Guy Hill W0CBI 147.15"
180,"POH Golden, Guy Hill",224.74,-,1.6,Tone,88.5,88.5,23,23,NN,FM,5,"CO Jefferson Golden, Guy Hill N0POH 224.74"
181,"MHU Golden, Guy Hill",224,-,1.6,Tone,103.5,103.5,23,23,NN,FM,5,"CO Jefferson Golden, Guy Hill N0MHU 224"
182,"0GO Golden, Guy Hill",449.75,-,5,Tone,103.5,103.5,23,23,NN,FM,5,"CO Jefferson Golden, Guy Hill KI0GO 449.75"
183,"T0C Golden, Guy Hill",145.22,-,0.6,Tone,103.5,103.5,23,23,NN,DIG,5,"CO Jefferson Golden, Guy Hill WT0C 145.22"
184,"IBM Golden, Guy Hill",448.85,-,5,Tone,88.5,88.5,23,23,NN,FM,5,"CO Jefferson Golden, Guy Hill K0IBM 448.85"
185,"0TX Denver, Centennial Cone",446.7875,-,5,,88.5,88.5,23,23,NN,DIG,5,"CO Jefferson Denver, Centennial Cone W0TX 446.7875"
186,"0HC Golden, Centennial Cone",927.8375,-,25.8,DTCS,88.5,88.5,205,205,NN,DIG,5,"CO Jefferson Golden, Centennial Cone KI0HC 927.8375"
187,"UFO Fairplay, Sacramento Mountain",447.125,-,5,Tone,103.5,103.5,23,23,NN,FM,5,"CO Park Fairplay, Sacramento Mountain KC0UFO 447.125"
188,"G0N Idaho Springs, Squaw Mountain",449.05,-,5,Tone,107.2,107.2,23,23,NN,FM,5,"CO Denver Idaho Springs, Squaw Mountain WG0N 449.05"
189,0ML Northglenn,147.045,+,0.6,Tone,123,123,23,23,NN,FM,5,CO Adams Northglenn K0ML 147.045
190,VJD Hugo,447,-,5,Tone,103.5,103.5,23,23,NN,DIG,5,CO Lincoln Hugo KC0VJD 447
191,"VJJ Breckenridge, Bald Mountain",147.39,+,0.6,Tone,88.5,123,23,23,NN,FM,5,"CO Summit Breckenridge, Bald Mountain KB0VJJ 147.39"
192,LSD Nathrop,146.745,-,0.6,Tone,100,100,23,23,NN,FM,5,CO Chaffee Nathrop W0LSD 146.745
193,"0SZ Breckenridge, Baldy",445.0875,-,5,,88.5,88.5,23,23,NN,DIG,5,"CO Fremont Breckenridge, Baldy N0SZ 445.0875"
194,"D0Q Walsenburg, N Rattlesnake Butte",146.73,-,0.6,Tone,88.5,88.5,23,23,NN,FM,5,"CO Huerfano Walsenburg, N Rattlesnake Butte ND0Q 146.73"
195,WYX Broomfield,449.825,-,5,Tone,103.5,103.5,23,23,NN,FM,5,CO Boulder Broomfield W0WYX 449.825
196,LMA Broomfield,448.925,-,5,Tone,131.8,131.8,23,23,NN,FM,5,CO Boulder Broomfield W0LMA 448.925
197,"RTS Genoa, Limon",446.7375,-,5,,88.5,88.5,23,23,NN,DIG,5,"CO Lincoln Genoa, Limon K0RTS 446.7375"
198,0AE Genoa,147.06,+,0.6,Tone,103.5,103.5,23,23,NN,DIG,5,CO Lincoln Genoa KE0AE 147.06
199,"0SZ Leadville, Mosquito Pass",445.05,-,5,,88.5,88.5,23,23,NN,DIG,5,"CO Lake Leadville, Mosquito Pass N0SZ 445.05"
200,QMR Breckenridge,146.7,-,0.6,Tone,107.2,107.2,23,23,NN,FM,5,CO Summit Breckenridge WB0QMR 146.7
201,"VJJ Leadville, Mosquito Pass",145.445,-,0.6,Tone,88.5,88.5,23,23,NN,FM,5,"CO Lake Leadville, Mosquito Pass KB0VJJ 145.445"
202,"VJJ Boulder, Thorodin Mountain",145.31,-,0.6,Tone,88.5,123,23,23,NN,FM,5,"CO Gilpin Boulder, Thorodin Mountain KB0VJJ 145.31"
203,"0SZ Denver, Thorodin Mountain",449.225,-,5,Tone,141.3,141.3,23,23,NN,FM,5,"CO Gilpin Denver, Thorodin Mountain N0SZ 449.225"
204,0SJ Lochbuie,447.625,-,5,Tone,100,100,23,23,NN,FM,5,CO Adams Lochbuie KE0SJ 447.625
205,0KC Fort Lupton,447.3,-,5,Tone,107.2,107.2,23,23,NN,FM,5,CO Weld Fort Lupton AC0KC 447.3
206,0RG Hudson,449.925,-,5,Tone,114.8,114.8,23,23,NN,FM,5,CO Weld Hudson KD0RG 449.925
207,"0DK Boulder, Table Mesa",448.9,-,5,Tone,100,100,23,23,NN,FM,5,"CO Boulder Boulder, Table Mesa W0DK 448.9"
208,0DK Boulder,146.61,-,0.6,Tone,100,100,23,23,NN,FM,5,CO Boulder Boulder W0DK 146.61
209,"0DK Boulder, Table Mountain",146.7,-,0.6,Tone,100,100,23,23,NN,FM,5,"CO Boulder Boulder, Table Mountain W0DK 146.7"
210,0RM Rollinsville,224.6,-,1.6,Tone,100,100,23,23,NN,FM,5,CO Gilpin Rollinsville W0RM 224.6
211,"ZSN Leadville, Quail Mountain",147.24,+,0.6,Tone,156.7,156.7,23,23,NN,FM,5,"CO Lake Leadville, Quail Mountain N0ZSN 147.24"
212,0IA Boulder,449.55,-,5,Tone,100,100,23,23,NN,FM,5,CO Boulder Boulder W0IA 449.55
213,0DK Boulder,449.4,-,5,Tone,91.5,91.5,23,23,NN,FM,5,CO Boulder Boulder K0DK 449.4
214,0DK Boulder,1299.5,-,20,,88.5,88.5,23,23,NN,DIG,5,CO Boulder Boulder W0DK 1299.5
215,"0SZ Boulder, Mount Thorodin",446.8,-,5,,88.5,88.5,23,23,NN,DIG,5,"CO Boulder Boulder, Mount Thorodin N0SZ 446.8"
216,0DS Boulder,446.8625,-,5,,88.5,88.5,23,23,NN,DIG,5,CO Boulder Boulder KC0DS 446.8625
217,"MRC Maysville, CO",145.325,-,0.6,Tone,100,100,23,23,NN,FM,5,"CO Chaffee Maysville, CO KD0MRC 145.325"
218,0DS Boulder,145.3875,-,0.6,,88.5,88.5,23,23,NN,DIG,5,CO Boulder Boulder KC0DS 145.3875
219,0DS Boulder,1283.8625,-,20,,88.5,88.5,23,23,NN,DIG,5,CO Boulder Boulder KC0DS 1283.8625
220,"0IA Boulder, Gunbarrel Hill",146.76,-,0.6,Tone,100,100,23,23,NN,FM,5,"CO Boulder Boulder, Gunbarrel Hill W0IA 146.76"
221,0KC Fort Lupton,224.96,-,1.6,,88.5,88.5,23,23,NN,FM,5,CO Weld Fort Lupton AC0KC 224.96
222,0DK Boulder,146.73,-,0.6,Tone,91.5,91.5,23,23,NN,FM,5,CO Boulder Boulder K0DK 146.73
223,"VJJ Winter Park, Winter Park",147.285,+,0.6,Tone,88.5,123,23,23,NN,FM,5,"CO Grand Winter Park, Winter Park KB0VJJ 147.285"
