Location,Name,Frequency,Duplex,Offset,Tone,rToneFreq,cToneFreq,DtcsCode,DtcsRxCode,DtcsPolarity,Mode,TStep,Comment
224,"0SZ Boulder, Lee Hill",446.9875,-,5,,88.5,88.5,23,23,NN,DIG,5,"CO Boulder Boulder, Lee Hill N0SZ 446.9875"
225,"CRA Boulder, Eldorado Mountain",447.975,-,5,Tone,107.2,107.2,23,23,NN,FM,5,"CO Boulder Boulder, Eldorado Mountain W0CRA 447.975"
226,"CRA Boulder, Eldorado Mountain",145.46,-,0.6,Tone,107.2,107.2,23,23,NN,FM,5,"CO Boulder Boulder, Eldorado Mountain W0CRA 145.46"
227,"0SZ Boulder, Lee Hill",447.75,-,5,Tone,141.3,141.3,23,23,NN,FM,5,"CO Boulder Boulder, Lee Hill N0SZ 447.75"
228,"0IA Boulder, Lee Hill",224.02,-,1.6,,88.5,88.5,23,23,NN,FM,5,"CO Boulder Boulder, Lee Hill W0IA 224.02"
229,"0SZ Boulder, Lee Hill",445.05,-,5,,88.5,88.5,23,23,NN,DIG,5,"CO Boulder Boulder, Lee Hill N0SZ 445.05"
230,0JZ Gold Hill,146.91,+,0.6,Tone,123,127.3,23,23,NN,FM,5,CO Boulder Gold Hill W0JZ 146.91
231,"ITF La Junta, North La Junta",147.36,+,0.6,,88.5,123,23,23,NN,DIG,5,"CO Otero La Junta, North La Junta KC0ITF 147.36"
232,"ITF La Junta, North La Junta",446.75,-,5,,88.5,88.5,23,23,NN,DIG,5,"CO Otero La Junta, North La Junta KC0ITF 446.75"
233,JPX La Veta,145.355,-,0.6,Tone,100,100,23,23,NN,FM,5,CO Huerfano La Veta N0JPX 145.355
234,CCC Winter Park,447.45,-,5,Tone,103.5,103.5,23,23,NN,FM,5,CO Grand Winter Park WA4CCC 447.45
235,EPA Longmont,448.525,-,5,Tone,151.4,151.4,23,23,NN,FM,5,CO Boulder Longmont N0EPA 448.525
236,ENO Longmont,448.8,-,5,Tone,88.5,88.5,23,23,NN,FM,5,CO Boulder Longmont W0ENO 448.8
237,ENO Longmont,147.27,+,0.6,Tone,100,100,23,23,NN,FM,5,CO Boulder Longmont W0ENO 147.27
238,"YNA Gunnison, W Mountain or Tenderfoot Mountain",447.65,-,5,Tone,151.4,151.4,23,23,NN,FM,5,"CO Gunnison Gunnison, W Mountain or Tenderfoot Mountain KB0YNA 447.65"
239,"0RV Vail, Bald Mountain",146.61,-,0.6,Tone,107.2,107.2,23,23,NN,FM,5,"CO Eagle Vail, Bald Mountain K0RV 146.61"
240,"0HG Allenspark, AFPD Station #5",147.03,+,0.6,Tone,100,100,23,23,NN,FM,5,"CO Boulder Allenspark, AFPD Station #5 KI0HG 147.03"
241,AFO Vail,224.8,-,1.6,,88.5,88.5,23,23,NN,FM,5,CO Eagle Vail N0AFO 224.8
242,AFO Vail,449.9,-,5,Tone,107.2,107.2,23,23,NN,FM,5,CO Eagle Vail N0AFO 449.9
243,0KM Center,146.64,-,0.6,Tone,77,77,23,23,NN,FM,5,CO Rio Grande Center N0KM 146.64
244,0KM Center,447.1,-,5,Tone,77,77,23,23,NN,FM,5,CO Saguache Center N0KM 447.1
245,0SZ Vail,445.075,-,5,,88.5,88.5,23,23,NN,DIG,5,CO Eagle Vail N0SZ 445.075
246,"ZSN La Veta, Cordova Pass",449.75,-,5,Tone,100,100,23,23,NN,FM,5,"CO Las Animas La Veta, Cordova Pass N0ZSN 449.75"
247,VJJ Vail,147.345,+,0.6,Tone,88.5,123,23,23,NN,FM,5,CO Eagle Vail KB0VJJ 147.345
248,YDW Granby,146.82,-,0.6,Tone,123,123,23,23,NN,FM,5,CO Grand Granby KA0YDW 146.82
249,"PFJ Granby, Mt Chauncey",446.875,-,5,,88.5,88.5,23,23,NN,DIG,5,"CO Clear Creek Granby, Mt Chauncey K7PFJ 446.875"
250,"0OJ Greeley, UNC",449.725,-,5,Tone,127.3,127.3,23,23,NN,FM,5,"CO Weld Greeley, UNC K0OJ 449.725"
251,"UPS Greeley, UNC",146.85,-,0.6,Tone,100,100,23,23,NN,FM,5,"CO Weld Greeley, UNC W0UPS 146.85"
252,"LRA Loveland, Namaqua Hill",449.575,-,5,Tone,100,100,23,23,NN,FM,5,"CO Larimer Loveland, Namaqua Hill W0LRA 449.575"
253,6VV Loveland,224.32,-,1.6,Tone,100,100,23,23,NN,FM,5,CO Larimer Loveland KN6VV 224.32
254,"LRA Loveland, Namaqua Hill",147.195,+,0.6,Tone,100,100,23,23,NN,FM,5,"CO Larimer Loveland, Namaqua Hill W0LRA 147.195"
255,KWD Greeley,448.475,-,5,Tone,100,100,23,23,NN,FM,5,CO Weld Greeley KC0KWD 448.475
256,AEN Greeley,449.325,-,5,Tone,136.5,136.5,23,23,NN,DIG,5,CO Weld Greeley WR0AEN 449.325
257,KWD Greeley,147,+,0.6,Tone,100,100,23,23,NN,DIG,5,CO Weld Greeley KC0KWD 147
258,"0VQ Aspen, Aspen Mountain",447.05,-,5,Tone,136.5,136.5,23,23,NN,FM,5,"CO Pitkin Aspen, Aspen Mountain K0VQ 447.05"
259,0FH Estes Park,146.685,-,0.6,Tone,123,123,23,23,NN,FM,5,CO Larimer Estes Park N0FH 146.685
260,"UPS Loveland, Budweiser Event Center",448.025,-,5,Tone,100,100,23,23,NN,DIG,5,"CO Larimer Loveland, Budweiser Event Center W0UPS 448.025"
261,"0FT Fort Morgan, Fort Morgan EOC",448.2,-,5,,88.5,88.5,23,23,NN,DIG,5,"CO Morgan Fort Morgan, Fort Morgan EOC W0FT 448.2"
262,0FH Estes Park,449.8,-,5,Tone,123,123,23,23,NN,FM,5,CO Larimer Estes Park N0FH 449.8
263,5GF Gunnison,449.95,-,5,,88.5,88.5,23,23,NN,FM,5,CO Gunnison Gunnison K5GF 449.95
264,VTL Gunnison,147.12,+,0.6,,88.5,88.5,23,23,NN,FM,5,CO Gunnison Gunnison W0VTL 147.12
265,7RF Fort Collins,447.725,-,5,Tone,131.8,131.8,23,23,NN,FM,5,CO Larimer Fort Collins W7RF 447.725
266,"5JL Trinidad, Raton Pass",447.375,-,5,Tone,100,100,23,23,NN,DIG,5,"CO Las Animas Trinidad, Raton Pass KG5JL 447.375"
267,"CVU Trinidad, Raton Pass",449.6,-,5,Tone,107.2,107.2,23,23,NN,FM,5,"CO Las Animas Trinidad, Raton Pass KC0CVU 449.6"
268,"0BV Trinidad, Raton Pass",147.375,+,0.6,Tone,100,100,23,23,NN,FM,5,"CO Las Animas Trinidad, Raton Pass K0BV 147.375"
269,0CL Snowmass Village,146.67,-,0.6,Tone,107.2,107.2,23,23,NN,FM,5,CO Pitkin Snowmass Village K0CL 146.67
270,"RDI Trinidad, Raton Pass",446.775,-,5,,88.5,88.5,23,23,NN,DIG,5,"CO Las Animas Trinidad, Raton Pass KD0RDI 446.775"
271,AOL Fort Collins,446.7375,-,5,,88.5,88.5,23,23,NN,DIG,5,CO Larimer Fort Collins N0AOL 446.7375
272,RBT Fort Collins,447.45,-,5,Tone,123,123,23,23,NN,FM,5,CO Larimer Fort Collins KC0RBT 447.45
273,1TJ Fort Collins,1283.55,-,20,Tone,100,100,23,23,NN,FM,5,CO Larimer Fort Collins K1TJ 1283.55
274,"DMR Fort Collins, Timnath",147.39,+,0.6,,88.5,88.5,23,23,NN,DIG,5,"CO Larimer Fort Collins, Timnath W0DMR 147.39"
275,"VJJ Kremmling, Santoy Peak",147.075,+,0.6,Tone,88.5,123,23,23,NN,FM,5,"CO Grand Kremmling, Santoy Peak KB0VJJ 147.075"
276,"VGD Fort Collins , Horsetooth Mountain",145.265,-,0.6,,88.5,88.5,23,23,NN,DIG,5,"CO Larimer Fort Collins , Horsetooth Mountain KB0VGD 145.265"
277,"PFJ Fort Collins, Horsetooth Mountain",446.75,-,5,,88.5,88.5,23,23,NN,DIG,5,"CO Larimer Fort Collins, Horsetooth Mountain K7PFJ 446.75"
278,"UPS Fort Collins, Horsetooth Mountain",145.115,-,0.6,Tone,100,100,23,23,NN,FM,5,"CO Larimer Fort Collins, Horsetooth Mountain W0UPS 145.115"
279,"0SF Fort Collins, Horsetooth Mountain",927.825,-,25,Tone,100,100,23,23,NN,FM,5,"CO Larimer Fort Collins, Horsetooth Mountain AB0SF 927.825"
280,"UPS Fort Collins, Horsetooth Mountain",447.275,-,5,Tone,100,100,23,23,NN,FM,5,"CO Larimer Fort Collins, Horsetooth Mountain W0UPS 447.275"
281,"UPS Fort Collins, Horsetooth Mountain",224.52,-,1.6,Tone,100,100,23,23,NN,FM,5,"CO Larimer Fort Collins, Horsetooth Mountain W0UPS 224.52"
282,"1TJ Fort Collins, Horsetooth Mountain",927.95,-,25,Tone,100,100,23,23,NN,FM,5,"CO Larimer Fort Collins, Horsetooth Mountain K1TJ 927.95"
283,"QEY Fort Collins, CSU Durward Hall",147.36,+,0.6,Tone,100,100,23,23,NN,FM,5,"CO Larimer Fort Collins, CSU Durward Hall W0QEY 147.36"
284,"RFI Severance, Cactus Hill",447.2,-,5,Tone,82.5,82.5,23,23,NN,FM,5,"CO Weld Severance, Cactus Hill N6RFI 447.2"
285,"QEY Fort Collins, CSU Durward Hall",446.8125,-,5,,88.5,88.5,23,23,NN,DIG,5,"CO Larimer Fort Collins, CSU Durward Hall W0QEY 446.8125"
286,"DMR Fort Collins, Timnath",446.775,-,5,,88.5,88.5,23,23,NN,DIG,5,"CO Larimer Fort Collins, Timnath W0DMR 446.775"
287,"QEY Fort Collins, CSU Durward Hall",449.85,-,5,Tone,100,100,23,23,NN,FM,5,"CO Larimer Fort Collins, CSU Durward Hall W0QEY 449.85"
288,"ZUQ Fort Collins, Christ Mountain",449.425,-,5,Tone,94.8,94.8,23,23,NN,FM,5,"CO Larimer Fort Collins, Christ Mountain N0ZUQ 449.425"
289,"ZUQ Fort Collins, Christ Mountain",927.875,-,25,DTCS,88.5,88.5,114,114,NN,FM,5,"CO Larimer Fort Collins, Christ Mountain N0ZUQ 927.875"
290,0AE Stratton,146.895,-,0.6,Tone,103.5,103.5,23,23,NN,FM,5,CO Kit Carson Stratton KE0AE 146.895
291,VJJ Akron,145.4,-,0.6,Tone,88.5,123,23,23,NN,FM,5,CO Washington Akron KB0VJJ 145.4
292,0FT Akron,448.175,-,5,,88.5,88.5,23,23,NN,DIG,5,CO Morgan Akron W0FT 448.175
293,"UPS Fort Collins, Buckhorn Mountain",447.7,-,5,Tone,100,100,23,23,NN,FM,5,"CO Larimer Fort Collins, Buckhorn Mountain W0UPS 447.7"
294,"UPS Fort Collins, Buckhorn Mountain",146.625,-,0.6,Tone,100,100,23,23,NN,FM,5,"CO Larimer Fort Collins, Buckhorn Mountain W0UPS 146.625"
295,"UPS Fort Collins, Buckhorn Mountain",224.84,-,1.6,Tone,100,100,23,23,NN,FM,5,"CO Larimer Fort Collins, Buckhorn Mountain W0UPS 224.84"
296,"IFI Trinidad, Raton Pass",145.43,-,0.6,Tone,107.2,107.2,23,23,NN,FM,5,"CO Las Animas Trinidad, Raton Pass WA6IFI 145.43"
297,"0VQ Carbondale, Missouri Heights",447.15,-,5,Tone,136.5,136.5,23,23,NN,FM,5,"CO Garfield Carbondale, Missouri Heights K0VQ 447.15"
298,"RDI Raton, Raton Pass",446.775,-,5,,88.5,88.5,23,23,NN,DIG,5,"NM Colfax Raton, Raton Pass KD0RDI 446.775"
299,UPS Wellington,448.325,-,5,Tone,110.9,110.9,23,23,NN,FM,5,CO Larimer Wellington WB7UPS 448.325
300,0HH Lamar,146.61,-,0.6,Tone,123,123,23,23,NN,FM,5,CO Prowers Lamar KC0HH 146.61
301,0HH Lamar,449.5,-,5,Tone,123,123,23,23,NN,FM,5,CO Prowers Lamar KC0HH 449.5
302,0JS Creede,146.925,-,0.6,,88.5,88.5,23,23,NN,FM,5,CO Mineral Creede WA0JS 146.925
303,"5ML Raton, Sierra Grande",147.28,+,0.6,Tone,100,100,23,23,NN,FM,5,"NM Colfax Raton, Sierra Grande NM5ML 147.28"
304,"ELK Carbondale, Four Mile Ridge",449.725,-,5,Tone,179.9,179.9,23,23,NN,FM,5,"CO Garfield Carbondale, Four Mile Ridge K0ELK 449.725"
305,"SNO Carbondale, Four Mile Ridge",147.39,+,0.6,Tone,107.2,107.2,23,23,NN,FM,5,"CO Garfield Carbondale, Four Mile Ridge K0SNO 147.39"
306,"PKT Creede, Bristol Head",449.525,-,5,Tone,100,100,23,23,NN,FM,5,"CO Mineral Creede, Bristol Head N0PKT 449.525"
307,I0G Glenwood Springs,224.02,-,1.6,,88.5,88.5,23,23,NN,FM,5,CO Garfield Glenwood Springs KI0G 224.02
308,"0VQ Glenwood Springs, Three Mile Ridge",147.3,+,0.6,Tone,107.2,107.2,23,23,NN,FM,5,"CO Garfield Glenwood Springs, Three Mile Ridge K0VQ 147.3"
309,"HND Glenwood Springs, Lookout Mountain",449.85,-,5,Tone,131.8,131.8,23,23,NN,FM,5,"CO Garfield Glenwood Springs, Lookout Mountain WA4HND 449.85"
310,I0G Glenwood Springs,447.6,-,5,,88.5,88.5,23,23,NN,FM,5,CO Garfield Glenwood Springs KI0G 447.6
311,"VJJ Glenwood Springs, Sunlight Peak",146.85,-,0.6,Tone,88.5,123,23,23,NN,FM,5,"CO Garfield Glenwood Springs, Sunlight Peak KB0VJJ 146.85"
312,"I0G Glenwood Springs, Sunlight Peak",447.1,-,5,Tone,107.2,107.2,23,23,NN,FM,5,"CO Garfield Glenwood Springs, Sunlight Peak KI0G 447.1"
313,"I0G Glenwood Springs, Sunlight Peak",146.88,-,0.6,Tone,107.2,107.2,23,23,NN,FM,5,"CO Garfield Glenwood Springs, Sunlight Peak KI0G 146.88"
314,"XLI Glenwood Springs, Sunlight Peak",449.6,-,5,Tone,107.2,107.2,23,23,NN,FM,5,"CO Garfield Glenwood Springs, Sunlight Peak N0XLI 449.6"
315,"PFO Red River, Valle Vidal",145.25,-,0.6,Tone,123,123,23,23,NN,FM,5,"NM Taos Red River, Valle Vidal KF5PFO 145.25"
316,"ITS Lake City, Hill 71",147.135,-,0.6,Tone,123,123,23,23,NN,FM,5,"CO Hinsdale Lake City, Hill 71 KB5ITS 147.135"
317,"DEM Pritchett,  Tator Butte",146.64,-,0.6,Tone,100,100,23,23,NN,FM,5,"CO Las Animas Pritchett,  Tator Butte KZ0DEM 146.64"
318,0MR Paonia,147.33,+,0.6,Tone,107.2,107.2,23,23,NN,FM,5,CO Delta Paonia KI0MR 147.33
319,"VJJ Walden, Peterson Ridge",145.16,-,0.6,Tone,88.5,123,23,23,NN,FM,5,"CO Jackson Walden, Peterson Ridge KB0VJJ 145.16"
320,"7GR Cheyenne, Chalk Bluffs",449.3,-,5,Tone,131.8,131.8,23,23,NN,DIG,5,"WY Laramie Cheyenne, Chalk Bluffs WB7GR 449.3"
321,"JTB Sterling, CO",145.295,-,0.6,,88.5,88.5,23,23,NN,FM,5,"CO Logan Sterling, CO WA0JTB 145.295"
322,"5ML Tres Piedras, San Antonio Mountain",147.22,+,0.6,Tone,100,100,23,23,NN,FM,5,"NM Rio Arriba Tres Piedras, San Antonio Mountain NM5ML 147.22"
323,"PFO Tres Piedras,  San Antonio Mountain",146.76,-,0.6,Tone,67,67,23,23,NN,FM,5,"NM Rio Arriba Tres Piedras,  San Antonio Mountain KF5PFO 146.76"
324,"PFO Red River, Molycorp",145.39,-,0.6,Tone,100,100,23,23,NN,FM,5,"NM Taos Red River, Molycorp KF5PFO 145.39"
325,BOP Des Moines,146.85,-,0.6,Tone,100,100,23,23,NN,FM,5,NM Union Des Moines N5BOP 146.85
326,"5EM Des Moines, Sierra Grande",147.175,+,0.6,Tone,141.3,141.3,23,23,NN,FM,5,"NM Union Des Moines, Sierra Grande NM5EM 147.175"
327,BOP Des Moines,444.8,+,5,Tone,77,77,23,23,NN,FM,5,NM Union Des Moines N5BOP 444.8
328,"PFJ Cheyenne, South",449.9375,-,5,,88.5,88.5,23,23,NN,DIG,5,"WY Laramie Cheyenne, South K7PFJ 449.9375"
329,DEM Springfield,449.2,-,5,Tone,118.8,118.8,23,23,NN,FM,5,CO Baca Springfield KZ0DEM 449.2
330,DEM Springfield,147.09,+,0.6,Tone,118.8,118.8,23,23,NN,FM,5,CO Baca Springfield KZ0DEM 147.09
331,DEM Springfield,147.33,+,0.6,Tone,118.8,118.8,23,23,NN,FM,5,CO Baca Springfield KZ0DEM 147.33
332,"5ML Eagle Nest, Iron Mountain",444.35,+,5,Tone,100,100,23,23,NN,FM,5,"NM Colfax Eagle Nest, Iron Mountain NM5ML 444.35"
333,D0H Steamboat Springs,147.21,+,0.6,Tone,107.2,107.2,23,23,NN,FM,5,CO Routt Steamboat Springs KD0H 147.21
334,VJJ Steamboat Springs,449.625,-,5,Tone,123,123,23,23,NN,FM,5,CO Routt Steamboat Springs KB0VJJ 449.625
335,VJJ Steamboat Springs,147.165,+,0.6,Tone,88.5,123,23,23,NN,FM,5,CO Routt Steamboat Springs KB0VJJ 147.165
336,"HND Montrose, Waterdog Peak",447.2,-,5,Tone,107.2,107.2,23,23,NN,FM,5,"CO Montrose Montrose, Waterdog Peak WA4HND 447.2"
337,"YNA Montrose, Waterdog Peak",448.65,-,5,,88.5,151.4,23,23,NN,FM,5,"CO Montrose Montrose, Waterdog Peak KB0YNA 448.65"
338,"5EM Eagle Nest, Touch Me Not",147.04,+,0.6,Tone,141.3,141.3,23,23,NN,FM,5,"NM Colfax Eagle Nest, Touch Me Not NM5EM 147.04"
339,"5ML Taos, Ski Valley",147.14,+,0.6,Tone,67,67,23,23,NN,FM,5,"NM Taos Taos, Ski Valley NM5ML 147.14"
340,"SNO Cheyenne, Denver Hill",146.775,-,0.6,Tone,114.8,114.8,23,23,NN,FM,5,"WY Laramie Cheyenne, Denver Hill KC7SNO 146.775"
341,JJY Cheyenne,449.9,-,5,Tone,100,100,23,23,NN,FM,5,WY Laramie Cheyenne N7JJY 449.9
342,SWR Cheyenne,145.235,-,0.6,Tone,114.8,114.8,23,23,NN,FM,5,WY Laramie Cheyenne KB7SWR 145.235
343,"SNO Cheyenne, North Park",147.105,+,0.6,Tone,114.8,91.5,23,23,NN,FM,5,"WY Laramie Cheyenne, North Park KC7SNO 147.105"
344,"DHF Cheyenne, Old airport control tower",448.95,-,5,Tone,151.4,151.4,23,23,NN,DIG,5,"WY Laramie Cheyenne, Old airport control tower KC7DHF 448.95"
345,GDR Cimarron,145.21,-,0.6,Tone,110.9,110.9,23,23,NN,FM,5,NM Colfax Cimarron N5GDR 145.21
346,"TSV Taos, Wheeler Peak",444.975,+,5,Tone,123,123,23,23,NN,FM,5,"NM Taos Taos, Wheeler Peak N5TSV 444.975"
347,SWR Cheyenne,448.15,-,5,Tone,100,100,23,23,NN,FM,5,WY Laramie Cheyenne KB7SWR 448.15
348,"5EM Tres Piedras, San Antonio Mtn.",145.175,-,0.6,Tone,141.3,141.3,23,23,NN,FM,5,"NM Taos Tres Piedras, San Antonio Mtn. NM5EM 145.175"
349,"PFO Tres Piedras, San Antonio Mountain",146.76,-,0.6,Tone,67,67,23,23,NN,FM,5,"NM Taos Tres Piedras, San Antonio Mountain KF5PFO 146.76"
350,"5SF Chama, Overlook Mtn",147.08,+,0.6,Tone,162.2,162.2,23,23,NN,FM,5,"NM Rio Arriba Chama, Overlook Mtn W5SF 147.08"
351,"ITS Ouray, Engineer Mountain",147.27,+,0.6,Tone,127.3,127.3,23,23,NN,FM,5,"CO Ouray Ouray, Engineer Mountain KB5ITS 147.27"
352,SWE Rifle,146.76,-,0.6,Tone,107.2,107.2,23,23,NN,FM,5,CO Garfield Rifle N0SWE 146.76
353,UUX Montrose,146.91,-,0.6,Tone,107.2,107.2,23,23,NN,FM,5,CO Montrose Montrose KC0UUX 146.91
354,OPD Montrose,146.79,-,0.6,Tone,107.2,107.2,23,23,NN,FM,5,CO Montrose Montrose KD5OPD 146.79
355,ALC Cedaredge,147.36,+,0.6,Tone,100,100,23,23,NN,FM,5,CO Delta Cedaredge W0ALC 147.36
356,"QXX Cedaredge, Cedar Mesa",147.195,+,0.6,Tone,107.2,107.2,23,23,NN,FM,5,"CO Delta Cedaredge, Cedar Mesa KC0QXX 147.195"
357,ALC Cedaredge,449.825,-,5,Tone,100,100,23,23,NN,FM,5,CO Delta Cedaredge W0ALC 449.825
358,WPM Tribune,442.175,+,5,Tone,156.7,156.7,23,23,NN,FM,5,KS Greeley Tribune K0WPM 442.175
359,"7UW Laramie, Jelm Mountain",147.015,+,0.6,Tone,146.2,146.2,23,23,NN,DIG,5,"WY Albany Laramie, Jelm Mountain N7UW 147.015"
360,"JSP Pagosa Springs, Oakbrush Hill",146.61,-,0.6,Tone,123,123,23,23,NN,FM,5,"CO Archuleta Pagosa Springs, Oakbrush Hill N0JSP 146.61"
361,"VJJ Grand Junction, Grand Mesa",145.355,-,0.6,Tone,88.5,123,23,23,NN,FM,5,"CO Mesa Grand Junction, Grand Mesa KB0VJJ 145.355"
362,"YNA Grand Junction, Grand Mesa",449.65,-,5,Tone,151.4,151.4,23,23,NN,FM,5,"CO Mesa Grand Junction, Grand Mesa KB0YNA 449.65"
363,"ITS Silverton, Kendall Mountain",147.375,+,0.6,Tone,156.7,156.7,23,23,NN,FM,5,"CO San Juan Silverton, Kendall Mountain KB5ITS 147.375"
364,"ITS Silverton, Hazelton",444,+,5,Tone,67,67,23,23,NN,FM,5,"CO San Juan Silverton, Hazelton KB5ITS 444"
365,ITS Silverton,447.525,-,5,Tone,127.3,127.3,23,23,NN,FM,5,CO San Juan Silverton KB5ITS 447.525
366,"ITS Silverton, Buffalo Boy",145.325,-,0.6,Tone,127.3,127.3,23,23,NN,FM,5,"CO San Juan Silverton, Buffalo Boy KB5ITS 145.325"
367," Cedaredge, Grand Mesa",447.35,-,5,Tone,107.2,107.2,23,23,NN,FM,5,"CO Delta Cedaredge, Grand Mesa  447.35"
368,0SW Collbran,449.5,-,5,Tone,107.2,107.2,23,23,NN,FM,5,CO Mesa Collbran KB0SW 449.5
369,"EOC Laramie, Pilot Hill",447.225,-,5,,88.5,88.5,23,23,NN,DIG,5,"WY Albany Laramie, Pilot Hill WY7EOC 447.225"
370,ECT Syracuse,444,+,5,Tone,141.3,141.3,23,23,NN,FM,5,KS Hamilton Syracuse K0ECT 444
371,"LEM Angel Fire, Agua Fria Peak",147.34,+,0.6,Tone,100,100,23,23,NN,FM,5,"NM Colfax Angel Fire, Agua Fria Peak N5LEM 147.34"
372,VJR Wallace,444.6,+,5,Tone,146.2,146.2,23,23,NN,FM,5,KS Wallace Wallace WA0VJR 444.6
373,"UWR Laramie,  Pilot Hill",53.03,-,1,,88.5,88.5,23,23,NN,FM,5,"WY Albany Laramie,  Pilot Hill K7UWR 53.03"
374,"SNO Laramie, Beacon Hill",146.82,-,0.6,Tone,114.8,114.8,23,23,NN,FM,5,"WY Albany Laramie, Beacon Hill KC7SNO 146.82"
375,"7UW Laramie, University",146.61,-,0.6,,88.5,88.5,23,23,NN,DIG,5,"WY Albany Laramie, University N7UW 146.61"
376,TAO Syracuse,146.775,-,0.6,,88.5,88.5,23,23,NN,FM,5,KS Hamilton Syracuse KA0TAO 146.775
377,5SJ Dulce,145.43,-,0.6,Tone,136.5,136.5,23,23,NN,FM,5,NM Rio Arriba Dulce NM5SJ 145.43
378,"HND Parachute, Mount Callahan",449.8,-,5,Tone,107.2,107.2,23,23,NN,FM,5,"CO Garfield Parachute, Mount Callahan WA4HND 449.8"
379,GLD Goodland,147.03,+,0.6,Tone,88.5,88.5,23,23,NN,FM,5,KS Sherman Goodland KS0GLD 147.03
380,"ITT Silverton, Engineer Mountain",147.27,+,0.6,Tone,127.3,127.3,23,23,NN,FM,5,"CO San Juan Silverton, Engineer Mountain KB5ITT 147.27"
381,"YNA Telluride, Gray Head",449.7,-,5,Tone,107.2,107.2,23,23,NN,FM,5,"CO San Miguel Telluride, Gray Head KB0YNA 449.7"
382,JUN Holyoke,146.955,-,0.6,,88.5,88.5,23,23,NN,FM,5,CO Phillips Holyoke N0JUN 146.955
383,SNO Albin,147.165,+,0.6,Tone,114.8,114.8,23,23,NN,FM,5,WY Laramie Albin KC7SNO 147.165
384,"0BX Grand Junction, Grand Mesa",446.9125,-,5,,88.5,88.5,23,23,NN,DIG,5,"CO Mesa Grand Junction, Grand Mesa W0BX 446.9125"
385,"PFO Taos, Picuris Peak",449.875,-,5,Tone,123,123,23,23,NN,FM,5,"NM Taos Taos, Picuris Peak KF5PFO 449.875"
386,"PFO Taos, Picuris Peak",224.4,-,1.6,Tone,225.7,225.7,23,23,NN,FM,5,"NM Taos Taos, Picuris Peak KF5PFO 224.4"
387,"PFO Taos, Picuris Peak",51.5,,0,Tone,100,100,23,23,NN,FM,5,"NM Taos Taos, Picuris Peak KF5PFO 51.5"
388,"PFO Taos, Picuris Peak",147.12,+,0.6,Tone,67,67,23,23,NN,FM,5,"NM Taos Taos, Picuris Peak KF5PFO 147.12"
389,"HND Grand Junction, Grand Mesa",449.3,-,5,Tone,107.2,107.2,23,23,NN,FM,5,"CO Mesa Grand Junction, Grand Mesa WA4HND 449.3"
390,HAM Craig,145.265,-,0.6,Tone,107.2,107.2,23,23,NN,FM,5,CO Moffat Craig WD0HAM 145.265
391,VJJ Craig,146.97,-,0.6,Tone,88.5,123,23,23,NN,FM,5,CO Moffat Craig KB0VJJ 146.97
392,"0EP Durango, Missionary Ridge",146.7,-,0.6,Tone,100,100,23,23,NN,FM,5,"CO La Plata Durango, Missionary Ridge K0EP 146.7"
393,"VJJ Durango, Missionary Ridge",147.345,+,0.6,Tone,88.5,123,23,23,NN,FM,5,"CO La Plata Durango, Missionary Ridge KB0VJJ 147.345"
394,"0SZ Durango, Missionary Ridge",445.1375,-,5,,88.5,88.5,23,23,NN,DIG,5,"CO La Plata Durango, Missionary Ridge N0SZ 445.1375"
395,"5PX Dixon, Cerro Abajo",147.18,+,0.6,Tone,100,100,23,23,NN,FM,5,"NM Rio Arriba Dixon, Cerro Abajo KD5PX 147.18"
396,NEB Harrisburg,147,-,0.6,Tone,103.5,103.5,23,23,NN,FM,5,NE Banner Harrisburg N0NEB 147
397, Boise City,147.35,+,0.6,Tone,88.5,88.5,23,23,NN,FM,5,OK Cimarron Boise City  147.35
398,"ITS Ignacio, Spring Creek",147.15,+,0.6,Tone,100,100,23,23,NN,FM,5,"CO La Plata Ignacio, Spring Creek KB5ITS 147.15"
399,JNI Wagon Mound,444.4,+,5,Tone,100,100,23,23,NN,FM,5,NM Mora Wagon Mound N7JNI 444.4
400,"5ML Wagon Mound, Turkey Mountain",147.2,+,0.6,Tone,67,67,23,23,NN,FM,5,"NM Mora Wagon Mound, Turkey Mountain NM5ML 147.2"
401,"5EM Wagon Mound, Turkey Mtn",145.37,-,0.6,Tone,141.3,141.3,23,23,NN,FM,5,"NM Mora Wagon Mound, Turkey Mtn NM5EM 145.37"
402,GJT Grand Junction,448.15,-,5,Tone,100,100,23,23,NN,FM,5,CO Mesa Grand Junction W0GJT 448.15
403,EVE Durango,448.625,-,5,Tone,131.8,131.8,23,23,NN,FM,5,CO La Plata Durango KC5EVE 448.625
404,0EP Durango,449.85,-,5,Tone,100,100,23,23,NN,FM,5,CO La Plata Durango K0EP 449.85
405,"5EM Abiquiu, Cerro Pelon",147.04,+,0.6,Tone,141.3,141.3,23,23,NN,FM,5,"NM Rio Arriba Abiquiu, Cerro Pelon NM5EM 147.04"
406,"0EP Durango, Eagle Pass",146.67,-,0.6,Tone,100,100,23,23,NN,FM,5,"CO La Plata Durango, Eagle Pass K0EP 146.67"
407,"RRZ Grand Junction, GJT",145.175,-,0.6,Tone,107.2,107.2,23,23,NN,FM,5,"CO Mesa Grand Junction, GJT W0RRZ 145.175"
408,"ITS Durango, Smelter Mountain",147.135,+,0.6,Tone,100,100,23,23,NN,FM,5,"CO La Plata Durango, Smelter Mountain KB5ITS 147.135"
409,ARV Grand Junction,447.5,-,5,Tone,114.8,114.8,23,23,NN,FM,5,CO Mesa Grand Junction KC0ARV 447.5
410,RED Grand Junction,446.775,-,5,,88.5,88.5,23,23,NN,DIG,5,CO Mesa Grand Junction KD0RED 446.775
411,GJT Grand Junction,146.82,-,0.6,Tone,107.2,107.2,23,23,NN,FM,5,CO Mesa Grand Junction W0GJT 146.82
412,SSI Grand Junction,147.105,+,0.6,,88.5,88.5,23,23,NN,FM,5,CO Mesa Grand Junction K0SSI 147.105
413,0SW Grand Junction,449,-,5,,88.5,107.2,23,23,NN,FM,5,CO Mesa Grand Junction KB0SW 449
414,0TY Grand Junction,145.22,-,0.6,Tone,107.2,107.2,23,23,NN,FM,5,CO Mesa Grand Junction KE0TY 145.22
415,SMZ Grand Junction,449.775,-,5,Tone,173.8,88.5,23,23,NN,FM,5,CO Mesa Grand Junction KD0SMZ 449.775
416,0TY Grand Junction,147.39,+,0.6,Tone,107.2,107.2,23,23,NN,FM,5,CO Mesa Grand Junction KE0TY 147.39
417,"VJJ Grand Junction, Grand Mesa",147.355,-,0.6,Tone,88.5,123,23,23,NN,FM,5,"CO Mesa Grand Junction, Grand Mesa KB0VJJ 147.355"
418,OMC Lakin,146.985,-,0.6,Tone,156.7,156.7,23,23,NN,FM,5,KS Kearney Lakin N0OMC 146.985
419,"V8Q Colby, K-Link",444.75,+,5,Tone,162.2,162.2,23,23,NN,FM,5,"KS Thomas Colby, K-Link NV8Q 444.75"
420,VIU Hesperus,145.37,-,0.6,Tone,100,100,23,23,NN,FM,5,CO La Plata Hesperus KB0VIU 145.37
421,W0K Colby,146.82,-,0.6,Tone,156.7,156.7,23,23,NN,FM,5,KS Thomas Colby NW0K 146.82
422,ECT Colby,444.4,+,5,Tone,141.3,141.3,23,23,NN,FM,5,KS Thomas Colby K0ECT 444.4
423,"YNA Delta, Uncompahgre Butte",449.4,-,5,Tone,131.8,131.8,23,23,NN,FM,5,"CO Mesa Delta, Uncompahgre Butte KB0YNA 449.4"
424,"7GR Scottsbluff, Stage Hill",444.125,+,5,Tone,114.8,114.8,23,23,NN,FM,5,"NE Scotts Bluff Scottsbluff, Stage Hill WB7GR 444.125"
425,ECT Ulysses,147.06,+,0.6,,88.5,88.5,23,23,NN,FM,5,KS Grant Ulysses K0ECT 147.06
426,"ITS Navajo Dam, Navajo Lake",147.36,+,0.6,Tone,100,100,23,23,NN,FM,5,"NM San Juan Navajo Dam, Navajo Lake KB5ITS 147.36"
427,"ITS Mancos, Caviness Mountain",442.375,+,5,Tone,100,100,23,23,NN,FM,5,"CO Montezuma Mancos, Caviness Mountain KB5ITS 442.375"
428,OQA Scott City,146.7,-,0.6,Tone,141.3,141.3,23,23,NN,DIG,5,KS Scott Scott City WA0OQA 146.7
429,ECT Elkader,444.3,+,5,Tone,141.3,141.3,23,23,NN,FM,5,KS Logan Elkader K0ECT 444.3
430,"5SJ Nebo, Cedar Hill",147.06,+,0.6,Tone,100,100,23,23,NN,FM,5,"NM San Juan Nebo, Cedar Hill NM5SJ 147.06"
431,"HND Grand Junction, Black Ridge",449.575,-,5,Tone,131.8,131.8,23,23,NN,FM,5,"CO Mesa Grand Junction, Black Ridge WA4HND 449.575"
432,"RRZ Grand Junction, Black Ridge (Above Colorado Ntl Monument)",146.94,-,0.6,Tone,107.2,107.2,23,23,NN,FM,5,"CO Mesa Grand Junction, Black Ridge (Above Colorado Ntl Monument) W0RRZ 146.94"
433,"0MI Scott City, K-Link",444.95,+,5,Tone,100,100,23,23,NN,FM,5,"KS Scott Scott City, K-Link W0MI 444.95"
434,"GCR Rawlins, Elk Mountain",147.24,+,0.6,Tone,100,100,23,23,NN,FM,5,"WY Carbon Rawlins, Elk Mountain N7GCR 147.24"
435,"ITS Mancos, Menefee Mountain",145.325,-,0.6,Tone,100,100,23,23,NN,FM,5,"CO Montezuma Mancos, Menefee Mountain KB5ITS 145.325"
436,"ECT Ulysses, Wagon Bed Springs",444.525,+,5,Tone,141.3,141.3,23,23,NN,FM,5,"KS Grant Ulysses, Wagon Bed Springs K0ECT 444.525"
437,"UBJ Mancos, Caviness Mountain",446.7375,-,5,,88.5,88.5,23,23,NN,DIG,5,"CO Montezuma Mancos, Caviness Mountain N5UBJ 446.7375"
438,"ITS Dolores, Summit Ridge",145.19,-,0.6,Tone,100,100,23,23,NN,FM,5,"CO Montezuma Dolores, Summit Ridge KB5ITS 145.19"
439,"ITS Dolores, Summit Ridge",447.275,-,5,Tone,100,100,23,23,NN,FM,5,"CO Montezuma Dolores, Summit Ridge KB5ITS 447.275"
440,"VBD Bloomfield, Harris Mesa",1292.3,-,20,,88.5,88.5,23,23,NN,DIG,5,"NM San Juan Bloomfield, Harris Mesa KF5VBD 1292.3"
441,OQA Garden City,146.91,-,0.6,Tone,141.3,141.3,23,23,NN,FM,5,KS Finney Garden City WA0OQA 146.91
442,ITS Aztec,447.45,-,5,Tone,107.2,107.2,23,23,NN,FM,5,NM San Juan Aztec KB5ITS 447.45
443,5SJ Aztec,146.74,-,0.6,Tone,100,100,23,23,NN,FM,5,NM San Juan Aztec NM5SJ 146.74
444,UBJ Aztec,442.25,+,5,,88.5,88.5,23,23,NN,DIG,5,NM San Juan Aztec N5UBJ 442.25
445,"ITS Aztec, Tank Mtn",146.88,-,0.6,Tone,100,100,23,23,NN,FM,5,"NM San Juan Aztec, Tank Mtn KB5ITS 146.88"
446,VBE Aztec,1291.1,-,20,,88.5,88.5,23,23,NN,DIG,5,NM Bernalillo Aztec KF5VBE 1291.1
447,VBE Farmington,145.115,-,0.6,,88.5,88.5,23,23,NN,DIG,5,NM San Juan Farmington KF5VBE 145.115
448,"5ML Bloomfield, Harris Mesa",147.28,+,0.6,Tone,67,67,23,23,NN,FM,5,"NM San Juan Bloomfield, Harris Mesa NM5ML 147.28"
449,"5ML Cuba, Eureka Mesa",147.24,+,0.6,Tone,67,67,23,23,NN,FM,5,"NM Sandoval Cuba, Eureka Mesa NM5ML 147.24"
450,"ITS Bloomfield, Harris mesa",147.1,+,0.6,Tone,100,100,23,23,NN,FM,5,"NM San Juan Bloomfield, Harris mesa KB5ITS 147.1"
451,WXI Bloomfield,146.92,-,0.6,Tone,100,100,23,23,NN,FM,5,NM San Juan Bloomfield K5WXI 146.92
452,ITS Bloomfield,448.65,-,5,Tone,127.3,127.3,23,23,NN,FM,5,NM San Juan Bloomfield KB5ITS 448.65
