Location,Name,Frequency,Duplex,Offset,Tone,rToneFreq,cToneFreq,DtcsCode,DtcsRxCode,DtcsPolarity,Mode,TStep,Comment
453,"5EM Cuba, Eureka Mesa",145.175,-,0.6,Tone,141.3,141.3,23,23,NN,FM,5,"NM Sandoval Cuba, Eureka Mesa NM5EM 145.175"
454,UGO Ogallala,146.76,-,0.6,Tone,123,123,23,23,NN,FM,5,NE Keith Ogallala N0UGO 146.76
455,"LWU Cortez, Downtown",146.79,-,0.6,Tone,127.3,127.3,23,23,NN,FM,5,"CO Montezuma Cortez, Downtown KD5LWU 146.79"
456,LWU Cortez,449.175,-,5,Tone,127.3,127.3,23,23,NN,FM,5,CO Montezuma Cortez KD5LWU 449.175
457,"0SZ Rangely, Cathedral Bluffs",445.2625,-,5,,88.5,88.5,23,23,NN,DIG,5,"CO Rio Blanco Rangely, Cathedral Bluffs N0SZ 445.2625"
458,DFQ Guymon,444.975,+,5,Tone,88.5,88.5,23,23,NN,FM,5,OK Texas Guymon N5DFQ 444.975
459,5SJ Lybrook,145.49,-,0.6,Tone,100,100,23,23,NN,FM,5,NM Rio Arriba Lybrook NM5SJ 145.49
460,DFQ Guymon,147.15,+,0.6,Tone,88.5,88.5,23,23,NN,FM,5,OK Texas Guymon N5DFQ 147.15
461,ITS Farmington,53.01,-,1,Tone,131.8,131.8,23,23,NN,FM,5,NM San Juan Farmington KB5ITS 53.01
462,ITS Farmington,146.76,-,0.6,Tone,100,100,23,23,NN,FM,5,NM San Juan Farmington KB5ITS 146.76
463,WXI Farmington,146.85,-,0.6,Tone,100,100,23,23,NN,FM,5,NM San Juan Farmington K5WXI 146.85
464,ITS Farmington,147,+,0.6,Tone,100,100,23,23,NN,FM,5,NM San Juan Farmington KB5ITS 147
465,5WY Farmington,449,-,5,Tone,100,100,23,23,NN,FM,5,NM San Juan Farmington K5WY 449
466,VBF Farmington,444.15,+,5,,88.5,88.5,23,23,NN,DIG,5,NM San Juan Farmington KF5VBF 444.15
467,UBJ Farmington,442.325,+,5,,88.5,88.5,23,23,NN,DIG,5,NM San Juan Farmington N5UBJ 442.325
468,"VBF Farmington, Farmington Bluffs",1291.7,-,20,,88.5,88.5,23,23,NN,DIG,5,"NM San Juan Farmington, Farmington Bluffs KF5VBF 1291.7"
469,KKS Liberal,146.805,-,0.6,Tone,103.5,103.5,23,23,NN,FM,5,KS Seward Liberal W0KKS 146.805
470,ECT Liberal,443.1,+,5,Tone,141.3,141.3,23,23,NN,FM,5,KS Seward Liberal K0ECT 443.1
471,WBK Spearman,443.2,+,5,Tone,88.5,88.5,23,23,NN,FM,5,TX Hansford Spearman KC5WBK 443.2
472,DFQ Spearman,442,+,5,Tone,88.5,88.5,23,23,NN,FM,5,TX Hansford Spearman N5DFQ 442
473,DFQ Spearman,147.04,+,0.6,Tone,88.5,88.5,23,23,NN,FM,5,TX Hansford Spearman N5DFQ 147.04
