Location,Name,Frequency,Duplex,Offset,Tone,rToneFreq,cToneFreq,DtcsCode,DtcsRxCode,DtcsPolarity,Mode,TStep,Comment
0,0KMcenter,447.1,-,5,Tone,77,77,23,23,NN,FM,5,CO Saguache Center N0KM 447.1 OPEN On-Air
1,0KMcenter,146.64,-,0.6,TSQL,77,77,23,23,NN,FM,5,CO Rio Grande Center N0KM 146.64 OPEN On-Air
2,0JScreede,146.925,-,0.6,,88.5,88.5,23,23,NN,FM,5,CO Mineral Creede WA0JS 146.925 OPEN Off-Air
3,"PKTcreede,bristol head",449.525,-,5,TSQL,100,100,23,23,NN,FM,5,"CO Mineral Creede, Bristol Head N0PKT 449.525 OPEN On-Air"
4,"JSPpagosasprings, oakbrush hill",146.61,-,0.6,Tone,123,123,23,23,NN,FM,5,"CO Archuleta Pagosa Springs, Oakbrush Hill N0JSP 146.61 OPEN On-Air"
5,"5SFchama,overlook mtn",147.08,+,0.6,Tone,162.2,162.2,23,23,NN,FM,5,"NM Rio Arriba Chama, Overlook Mtn W5SF 147.08 OPEN On-Air"
6,"JSCsalida,methodist mountain",449.975,-,5,TSQL,100,100,23,23,NN,FM,5,"CO Chaffee Salida, Methodist Mountain K0JSC 449.975 OPEN On-Air"
7,"CVUsalida,methodist mountain",449.65,-,5,Tone,107.2,107.2,23,23,NN,FM,5,"CO Chaffee Salida, Methodist Mountain KC0CVU 449.65 OPEN On-Air"
8,"Z0Nsalida,methodist mountain",449.925,-,5,TSQL,103.5,103.5,23,23,NN,FM,5,"CO Chaffee Salida, Methodist Mountain WZ0N 449.925 OPEN On-Air"
9,"VJJsalida,methodist mountain",147.285,+,0.6,Cross,88.5,123,23,23,NN,FM,5,"CO Chaffee Salida, Methodist Mountain KB0VJJ 147.285 OPEN On-Air"
10,"CVUsalida,methodist mountain",145.295,-,0.6,Tone,107.2,107.2,23,23,NN,FM,5,"CO Chaffee Salida, Methodist Mountain KC0CVU 145.295 OPEN On-Air"
11,"MRCmaysville,co",145.325,-,0.6,Tone,100,100,23,23,NN,FM,5,"CO Chaffee Maysville, CO KD0MRC 145.325 OPEN On-Air"
12,JSCwestcliffe,448.325,-,5,TSQL,100,100,23,23,NN,FM,5,CO Custer Westcliffe K0JSC 448.325 OPEN On-Air
13,"D0Qwestcliffe,deer peak",919.1,-,25,Tone,88.5,88.5,23,23,NN,FM,5,"CO Pueblo Westcliffe, Deer Peak ND0Q 919.1 OPEN Off-Air"
14,TUCwestcliffe,147.06,+,0.6,TSQL,77,77,23,23,NN,FM,5,CO Custer Westcliffe KB0TUC 147.06 OPEN On-Air
15,TUCwestcliffe,448.15,-,5,TSQL,103.5,103.5,23,23,NN,FM,5,CO Custer Westcliffe KB0TUC 448.15 OPEN On-Air
16,TUCwestcliffe,927.775,-,25,DTCS,88.5,88.5,116,116,NN,FM,5,CO Custer Westcliffe KB0TUC 927.775 OPEN On-Air
17,"ITSlakecity, hill 71",147.135,-,0.6,Tone,123,123,23,23,NN,FM,5,"CO Hinsdale Lake City, Hill 71 KB5ITS 147.135 OPEN On-Air"
18,"PFOtrespiedras,  san antonio mountain",146.76,-,0.6,Tone,67,67,23,23,NN,FM,5,"NM Rio Arriba Tres Piedras,  San Antonio Mountain KF5PFO 146.76 OPEN On-Air"
19,"5MLtrespiedras, san antonio mountain",147.22,+,0.6,Tone,100,100,23,23,NN,FM,5,"NM Rio Arriba Tres Piedras, San Antonio Mountain NM5ML 147.22 OPEN On-Air"
20,"QPGsalida,methodist mountain",446.975,-,5,,88.5,88.5,23,23,NN,DIG,5,"CO Chaffee Salida, Methodist Mountain KD0QPG 446.975 OPEN On-Air"
21,"0SZsalida,methodist mountain",446.8125,-,5,,88.5,88.5,23,23,NN,DIG,5,"CO Chaffee Salida, Methodist Mountain N0SZ 446.8125 OPEN On-Air"
22,5SJdulce,145.43,-,0.6,Tone,136.5,136.5,23,23,NN,FM,5,NM Rio Arriba Dulce NM5SJ 145.43 OPEN On-Air
23,"YNAgunnison,w mountain or tenderfoot mountain",447.65,-,5,TSQL,151.4,151.4,23,23,NN,FM,5,"CO Gunnison Gunnison, W Mountain or Tenderfoot Mountain KB0YNA 447.65 OPEN On-Air"
24,5GFgunnison,449.95,-,5,,88.5,88.5,23,23,NN,FM,5,CO Gunnison Gunnison K5GF 449.95 OPEN 
25,VTLgunnison,147.12,+,0.6,,88.5,88.5,23,23,NN,FM,5,CO Gunnison Gunnison W0VTL 147.12 OPEN On-Air
26,"CVUpueblo,deer peak",449.625,-,5,Tone,107.2,107.2,23,23,NN,FM,5,"CO Custer Pueblo, Deer Peak KC0CVU 449.625 OPEN On-Air"
27,"D0Qwalsenburg,deer peak",224.32,-,1.6,Tone,88.5,88.5,23,23,NN,FM,5,"CO Custer Walsenburg, Deer Peak ND0Q 224.32 OPEN Off-Air"
28,"D0Qpueblo,deer peak",447.175,-,5,Tone,88.5,88.5,23,23,NN,FM,5,"CO Pueblo Pueblo, Deer Peak ND0Q 447.175 OPEN Off-Air"
29,"ITSsilverton,kendall mountain",147.375,+,0.6,Tone,156.7,156.7,23,23,NN,FM,5,"CO San Juan Silverton, Kendall Mountain KB5ITS 147.375 OPEN On-Air"
30,LSDnathrop,146.745,-,0.6,Tone,100,100,23,23,NN,FM,5,CO Chaffee Nathrop W0LSD 146.745 OPEN Off-Air
31,"ITSsilverton,buffalo boy",145.325,-,0.6,Tone,127.3,127.3,23,23,NN,FM,5,"CO San Juan Silverton, Buffalo Boy KB5ITS 145.325 OPEN On-Air"
32,"ITSsilverton,hazelton",444,+,5,Tone,67,67,23,23,NN,FM,5,"CO San Juan Silverton, Hazelton KB5ITS 444 OPEN On-Air"
33,ITSsilverton,447.525,-,5,Tone,127.3,127.3,23,23,NN,FM,5,CO San Juan Silverton KB5ITS 447.525 OPEN On-Air
34,"PFOtrespiedras, san antonio mountain",146.76,-,0.6,Tone,67,67,23,23,NN,FM,5,"NM Taos Tres Piedras, San Antonio Mountain KF5PFO 146.76 OPEN On-Air"
35,"5EMtrespiedras, san antonio mtn.",145.175,-,0.6,Tone,141.3,141.3,23,23,NN,FM,5,"NM Taos Tres Piedras, San Antonio Mtn. NM5EM 145.175 OPEN Off-Air"
36,JPXlaveta,145.355,-,0.6,Tone,100,100,23,23,NN,FM,5,CO Huerfano La Veta N0JPX 145.355 OPEN On-Air
37,"ITSouray,engineer mountain",147.27,+,0.6,Tone,127.3,127.3,23,23,NN,FM,5,"CO Ouray Ouray, Engineer Mountain KB5ITS 147.27 OPEN On-Air"
38,"ZSNlaveta, cordova pass",449.75,-,5,TSQL,100,100,23,23,NN,FM,5,"CO Las Animas La Veta, Cordova Pass N0ZSN 449.75 OPEN On-Air"
39,"JSCcanoncity, fremont peak",446.7375,-,5,,88.5,88.5,23,23,NN,DIG,5,"CO Fremont Canon City, Fremont Peak K0JSC 446.7375 OPEN On-Air"
40,"JSCcanoncity, fremont peak",447.25,-,5,TSQL,100,100,23,23,NN,FM,5,"CO Fremont Canon City, Fremont Peak K0JSC 447.25 OPEN On-Air"
41,"WDFcanoncity, fremont peak",53.03,-,1.7,TSQL,88.5,88.5,23,23,NN,FM,5,"CO Fremont Canon City, Fremont Peak WB0WDF 53.03 OPEN On-Air"
42,"EKRcanoncity, fremont peak",145.49,-,0.6,TSQL,103.5,103.5,23,23,NN,FM,5,"CO Fremont Canon City, Fremont Peak WD0EKR 145.49 OPEN On-Air"
43,"EKRcanoncity, fremont peak",223.96,-,1.6,TSQL,103.5,103.5,23,23,NN,FM,5,"CO Fremont Canon City, Fremont Peak WD0EKR 223.96 OPEN On-Air"
44,"EKRcanoncity, fremont peak",447.75,-,5,TSQL,103.5,103.5,23,23,NN,FM,5,"CO Fremont Canon City, Fremont Peak WD0EKR 447.75 OPEN On-Air"
45,"TUCcanoncity, fremont peak",927.7,-,25,DTCS,88.5,88.5,114,114,NN,FM,5,"CO Fremont Canon City, Fremont Peak KB0TUC 927.7 OPEN On-Air"
46,"ITTsilverton,engineer mountain",147.27,+,0.6,Tone,127.3,127.3,23,23,NN,FM,5,"CO San Juan Silverton, Engineer Mountain KB5ITT 147.27 OPEN On-Air"
47,"JSCcanoncity, colorado",447.975,-,5,TSQL,100,100,23,23,NN,FM,5,"CO Fremont Canon City, Colorado K0JSC 447.975 OPEN On-Air"
48,"ITSignacio,spring creek",147.15,+,0.6,Tone,100,100,23,23,NN,FM,5,"CO La Plata Ignacio, Spring Creek KB5ITS 147.15 OPEN On-Air"
49,"0EPdurango,missionary ridge",146.7,-,0.6,TSQL,100,100,23,23,NN,FM,5,"CO La Plata Durango, Missionary Ridge K0EP 146.7 OPEN On-Air"
50,"VJJdurango,missionary ridge",147.345,+,0.6,Cross,88.5,123,23,23,NN,FM,5,"CO La Plata Durango, Missionary Ridge KB0VJJ 147.345 OPEN On-Air"
51,"WDFcanoncity, eightmile mountain",449,-,5,TSQL,67,67,23,23,NN,FM,5,"CO Fremont Canon City, eightmile Mountain WB0WDF 449 OPEN On-Air"
52,"0SZdurango,missionary ridge",445.1375,-,5,,88.5,88.5,23,23,NN,DIG,5,"CO La Plata Durango, Missionary Ridge N0SZ 445.1375 OPEN On-Air"
53,"PFOredriver, molycorp",145.39,-,0.6,Tone,100,100,23,23,NN,FM,5,"NM Taos Red River, Molycorp KF5PFO 145.39 OPEN On-Air"
54,"JSCcanoncity, canon city",449.975,-,5,TSQL,100,100,23,23,NN,FM,5,"CO Fremont Canon City, Canon City K0JSC 449.975 OPEN On-Air"
55,"PFOredriver, valle vidal",145.25,-,0.6,Tone,123,123,23,23,NN,FM,5,"NM Taos Red River, Valle Vidal KF5PFO 145.25 OPEN On-Air"
56,Z0Nhartsel,448.575,-,5,TSQL,103.5,103.5,23,23,NN,FM,5,CO Park Hartsel WZ0N 448.575 OPEN Off-Air
57,"YNAmontrose,waterdog peak",448.65,-,5,Cross,88.5,151.4,23,23,NN,FM,5,"CO Montrose Montrose, Waterdog Peak KB0YNA 448.65 OPEN On-Air"
58,"HNDmontrose,waterdog peak",447.2,-,5,TSQL,107.2,107.2,23,23,NN,FM,5,"CO Montrose Montrose, Waterdog Peak WA4HND 447.2 OPEN On-Air"
59,0EPdurango,449.85,-,5,TSQL,100,100,23,23,NN,FM,5,CO La Plata Durango K0EP 449.85 OPEN On-Air
60,EVEdurango,448.625,-,5,TSQL,131.8,131.8,23,23,NN,FM,5,CO La Plata Durango KC5EVE 448.625 OPEN On-Air
61,"ITSdurango,smelter mountain",147.135,+,0.6,TSQL,100,100,23,23,NN,FM,5,"CO La Plata Durango, Smelter Mountain KB5ITS 147.135 OPEN On-Air"
62,"5MLtaos,ski valley",147.14,+,0.6,Tone,67,67,23,23,NN,FM,5,"NM Taos Taos, Ski Valley NM5ML 147.14 OPEN On-Air"
63,"YNAtelluride,gray head",449.7,-,5,TSQL,107.2,107.2,23,23,NN,FM,5,"CO San Miguel Telluride, Gray Head KB0YNA 449.7 OPEN On-Air"
64,"ITSnavajodam, navajo lake",147.36,+,0.6,Tone,100,100,23,23,NN,FM,5,"NM San Juan Navajo Dam, Navajo Lake KB5ITS 147.36 OPEN On-Air"
65,"0EPdurango,eagle pass",146.67,-,0.6,Tone,100,100,23,23,NN,FM,5,"CO La Plata Durango, Eagle Pass K0EP 146.67 OPEN On-Air"
66,"TSVtaos,wheeler peak",444.975,+,5,Tone,123,123,23,23,NN,FM,5,"NM Taos Taos, Wheeler Peak N5TSV 444.975 OPEN On-Air"
67,VIUhesperus,145.37,-,0.6,TSQL,100,100,23,23,NN,FM,5,CO La Plata Hesperus KB0VIU 145.37 OPEN On-Air
68,"5MLeaglenest, iron mountain",444.35,+,5,Tone,100,100,23,23,NN,FM,5,"NM Colfax Eagle Nest, Iron Mountain NM5ML 444.35 OPEN On-Air"
69,"5SJnebo,cedar hill",147.06,+,0.6,Tone,100,100,23,23,NN,FM,5,"NM San Juan Nebo, Cedar Hill NM5SJ 147.06 OPEN On-Air"
70,X0Gcripplecreek,147.015,+,0.6,Tone,107.2,107.2,23,23,NN,FM,5,CO Teller Cripple Creek NX0G 147.015 OPEN On-Air
71,WDFcripplecreek,1287.7,-,20,Tone,67,67,23,23,NN,FM,5,CO Teller Cripple Creek WB0WDF 1287.7 OPEN Testing
72,WDFcripplecreek,145.46,-,0.6,Tone,67,67,23,23,NN,FM,5,CO Teller Cripple Creek WB0WDF 145.46 OPEN On-Air
73,WDFcripplecreek,224.94,-,1.6,Tone,67,67,23,23,NN,FM,5,CO Teller Cripple Creek WB0WDF 224.94 OPEN Testing
74,WDFcripplecreek,447.4,-,5,Tone,67,67,23,23,NN,FM,5,CO Teller Cripple Creek WB0WDF 447.4 OPEN On-Air
75,"0SZfairplay,badger",446.7625,-,5,,88.5,88.5,23,23,NN,DIG,5,"CO Park Fairplay, Badger N0SZ 446.7625 OPEN On-Air"
76,JSCpueblowest,448.975,-,5,TSQL,100,100,23,23,NN,FM,5,CO Pueblo Pueblo West K0JSC 448.975 OPEN On-Air
77,"5EMeaglenest, touch me not",147.04,+,0.6,Tone,141.3,141.3,23,23,NN,FM,5,"NM Colfax Eagle Nest, Touch Me Not NM5EM 147.04 OPEN On-Air"
78,UUXmontrose,146.91,-,0.6,TSQL,107.2,107.2,23,23,NN,FM,5,CO Montrose Montrose KC0UUX 146.91 OPEN On-Air
79,OPDmontrose,146.79,-,0.6,TSQL,107.2,107.2,23,23,NN,FM,5,CO Montrose Montrose KD5OPD 146.79 OPEN On-Air
80,"ITSmancos,caviness mountain",442.375,+,5,Tone,100,100,23,23,NN,FM,5,"CO Montezuma Mancos, Caviness Mountain KB5ITS 442.375 OPEN On-Air"
81,"5EMabiquiu,cerro pelon",147.04,+,0.6,Tone,141.3,141.3,23,23,NN,FM,5,"NM Rio Arriba Abiquiu, Cerro Pelon NM5EM 147.04 OPEN Off-Air"
82,JSCpueblo,446.9875,-,5,,88.5,88.5,23,23,NN,DIG,5,CO Pueblo Pueblo K0JSC 446.9875 OPEN Off-Air
83,"JSCpueblo,metro",447.275,-,5,TSQL,100,100,23,23,NN,FM,5,"CO Pueblo Pueblo, Metro K0JSC 447.275 OPEN On-Air"
84,J0Tpueblo,147.24,+,0.6,Tone,103.5,103.5,23,23,NN,FM,5,CO Pueblo Pueblo KJ0T 147.24 OPEN Off-Air
85,"0STpueblo,pueblo",146.655,-,0.6,Tone,123,123,23,23,NN,FM,5,"CO Pueblo Pueblo, Pueblo K0ST 146.655 OPEN On-Air"
86,"0KRpueblo,pueblo",447.7,-,5,TSQL,210.7,210.7,23,23,NN,DIG,5,"CO Pueblo Pueblo, Pueblo KF0KR 447.7 PRIVATE Off-Air"
87,PWZpalmerdivide,449.725,-,5,Tone,100,100,23,23,NN,FM,5,CO El Paso Palmer Divide N0PWZ 449.725 OPEN On-Air
88,D0Qpueblo,145.115,-,0.6,Tone,88.5,88.5,23,23,NN,FM,5,CO Pueblo Pueblo ND0Q 145.115 OPEN Off-Air
89,"D0Qpueblo,deer peak",146.88,-,0.6,Tone,88.5,88.5,23,23,NN,FM,5,"CO Pueblo Pueblo, Deer Peak ND0Q 146.88 OPEN On-Air"
90,"D0Qwalsenburg,n rattlesnake butte",146.73,-,0.6,Tone,88.5,88.5,23,23,NN,FM,5,"CO Huerfano Walsenburg, N Rattlesnake Butte ND0Q 146.73 OPEN On-Air"
91,"E0Zpueblo,csu",147,+,0.6,,88.5,88.5,23,23,NN,FM,5,"CO Pueblo Pueblo, CSU NE0Z 147 PRIVATE On-Air"
92,"RDItrinidad,raton pass",446.775,-,5,,88.5,88.5,23,23,NN,DIG,5,"CO Las Animas Trinidad, Raton Pass KD0RDI 446.775 OPEN On-Air"
93,"JSCpueblo,cedarwood",449.975,-,5,TSQL,100,100,23,23,NN,FM,5,"CO Pueblo Pueblo, Cedarwood K0JSC 449.975 OPEN On-Air"
94,lakegeorge,449.7,-,5,Tone,107.2,107.2,23,23,NN,FM,5,CO Park Lake George  449.7 OPEN 
95,"CVUlakegeorge, badger mountain",147.36,+,0.6,TSQL,107.2,107.2,23,23,NN,FM,5,"CO Park Lake George, Badger Mountain KC0CVU 147.36 OPEN On-Air"
96,"X0Glakegeorge, badger mountain",146.685,-,0.6,TSQL,107.2,107.2,23,23,NN,FM,5,"CO Park Lake George, Badger Mountain NX0G 146.685 OPEN On-Air"
97,"5PXdixon,cerro abajo",147.18,+,0.6,TSQL,100,100,23,23,NN,FM,5,"NM Rio Arriba Dixon, Cerro Abajo KD5PX 147.18 OPEN On-Air"
98,"0SPcoloradosprings, almagre mountain",147.18,+,0.6,Tone,100,100,23,23,NN,FM,5,"CO El Paso Colorado Springs, Almagre Mountain AA0SP 147.18 PRIVATE On-Air"
99,"PFJcoloradosprings, almagre mountain",446.95,-,5,,88.5,88.5,23,23,NN,DIG,5,"CO Teller Colorado Springs, Almagre Mountain K7PFJ 446.95 OPEN On-Air"
100,"IFIcoloradosprings, almagre mountain",927.725,-,25,DTCS,88.5,88.5,114,114,NN,FM,5,"CO Teller Colorado Springs, Almagre Mountain WA6IFI 927.725 OPEN On-Air"
101,SRJcoloradosprings,145.265,-,0.6,TSQL,100,100,23,23,NN,DIG,5,CO El Paso Colorado Springs KB0SRJ 145.265 OPEN Off-Air
102,"SRJcoloradosprings, uccs",448.8,-,5,TSQL,100,100,23,23,NN,DIG,5,"CO El Paso Colorado Springs, UCCS KB0SRJ 448.8 OPEN Off-Air"
103,0MRpaonia,147.33,+,0.6,Tone,107.2,107.2,23,23,NN,FM,5,CO Delta Paonia KI0MR 147.33 OPEN On-Air
104,"PFOtaos,picuris peak",51.5,,0,Tone,100,100,23,23,NN,FM,5,"NM Taos Taos, Picuris Peak KF5PFO 51.5 OPEN On-Air"
105,"PFOtaos,picuris peak",147.12,+,0.6,Tone,67,67,23,23,NN,FM,5,"NM Taos Taos, Picuris Peak KF5PFO 147.12 OPEN On-Air"
106,"PFOtaos,picuris peak",224.4,-,1.6,Tone,225.7,225.7,23,23,NN,FM,5,"NM Taos Taos, Picuris Peak KF5PFO 224.4 OPEN On-Air"
107,"PFOtaos,picuris peak",449.875,-,5,Tone,123,123,23,23,NN,FM,5,"NM Taos Taos, Picuris Peak KF5PFO 449.875 OPEN Off-Air"
108,"VBDbloomfield,harris mesa",1292.3,-,20,,88.5,88.5,23,23,NN,DIG,5,"NM San Juan Bloomfield, Harris Mesa KF5VBD 1292.3 CLOSED On-Air"
109,"0VQaspen,aspen mountain",447.05,-,5,TSQL,136.5,136.5,23,23,NN,FM,5,"CO Pitkin Aspen, Aspen Mountain K0VQ 447.05 OPEN On-Air"
110,"ITSmancos,menefee mountain",145.325,-,0.6,Tone,100,100,23,23,NN,FM,5,"CO Montezuma Mancos, Menefee Mountain KB5ITS 145.325 OPEN On-Air"
111,"UFOfairplay,sacramento mountain",447.125,-,5,TSQL,103.5,103.5,23,23,NN,FM,5,"CO Park Fairplay, Sacramento Mountain KC0UFO 447.125 OPEN On-Air"
112,"SRJcoloradosprings, pikes peak",146.97,-,0.6,Cross,100,123,23,23,NN,FM,5,"CO El Paso Colorado Springs, Pikes Peak KB0SRJ 146.97 OPEN On-Air"
113,"SRJcoloradosprings, pikes peak",448.45,-,5,Tone,100,100,23,23,NN,FM,5,"CO El Paso Colorado Springs, Pikes Peak KB0SRJ 448.45 OPEN On-Air"
114,"0BVtrinidad,raton pass",147.375,+,0.6,TSQL,100,100,23,23,NN,FM,5,"CO Las Animas Trinidad, Raton Pass K0BV 147.375 OPEN Off-Air"
115,"CVUtrinidad,raton pass",449.6,-,5,Tone,107.2,107.2,23,23,NN,FM,5,"CO Las Animas Trinidad, Raton Pass KC0CVU 449.6 OPEN Off-Air"
116,"5JLtrinidad,raton pass",447.375,-,5,Tone,100,100,23,23,NN,DIG,5,"CO Las Animas Trinidad, Raton Pass KG5JL 447.375 OPEN On-Air"
117,ITSaztec,447.45,-,5,Tone,107.2,107.2,23,23,NN,FM,5,NM San Juan Aztec KB5ITS 447.45 OPEN On-Air
118,5SJaztec,146.74,-,0.6,Tone,100,100,23,23,NN,FM,5,NM San Juan Aztec NM5SJ 146.74 OPEN On-Air
119,"ITSaztec,tank mtn",146.88,-,0.6,Tone,100,100,23,23,NN,FM,5,"NM San Juan Aztec, Tank Mtn KB5ITS 146.88 OPEN On-Air"
120,UBJaztec,442.25,+,5,,88.5,88.5,23,23,NN,DIG,5,NM San Juan Aztec N5UBJ 442.25 OPEN On-Air
121,"CVUcoloradosprings, cheyenne mountain",146.76,-,0.6,TSQL,107.2,107.2,23,23,NN,FM,5,"CO El Paso Colorado Springs, Cheyenne Mountain KC0CVU 146.76 OPEN On-Air"
122,"CVUcoloradosprings, cheyenne mountain",448,-,5,Tone,107.2,107.2,23,23,NN,FM,5,"CO El Paso Colorado Springs, Cheyenne Mountain KC0CVU 448 OPEN On-Air"
123,"CVUcoloradosprings, cheyenne mountain",448.1,-,5,TSQL,107.2,107.2,23,23,NN,FM,5,"CO El Paso Colorado Springs, Cheyenne Mountain KC0CVU 448.1 OPEN On-Air"
124,"CVUcoloradosprings, cheyenne mountain",147.345,+,0.6,TSQL,107.2,107.2,23,23,NN,FM,5,"CO El Paso Colorado Springs, Cheyenne Mountain KC0CVU 147.345 OPEN On-Air"
125,"CRAcoloradosprings, cheyenne mountain",145.16,-,0.6,TSQL,107.2,107.2,23,23,NN,FM,5,"CO El Paso Colorado Springs, Cheyenne Mountain W0CRA 145.16 OPEN On-Air"
126,"UBJmancos,caviness mountain",446.7375,-,5,,88.5,88.5,23,23,NN,DIG,5,"CO Montezuma Mancos, Caviness Mountain N5UBJ 446.7375 OPEN On-Air"
127,"ZSNleadville,quail mountain",147.24,+,0.6,TSQL,156.7,156.7,23,23,NN,FM,5,"CO Lake Leadville, Quail Mountain N0ZSN 147.24 OPEN Off-Air"
128,"ITSbloomfield,harris mesa",147.1,+,0.6,Tone,100,100,23,23,NN,FM,5,"NM San Juan Bloomfield, Harris mesa KB5ITS 147.1 OPEN On-Air"
129,"5MLbloomfield,harris mesa",147.28,+,0.6,Tone,67,67,23,23,NN,FM,5,"NM San Juan Bloomfield, Harris Mesa NM5ML 147.28 OPEN On-Air"
130,VBEaztec,1291.1,-,20,,88.5,88.5,23,23,NN,DIG,5,NM Bernalillo Aztec KF5VBE 1291.1 CLOSED On-Air
131,VBEfarmington,145.115,-,0.6,,88.5,88.5,23,23,NN,DIG,5,NM San Juan Farmington KF5VBE 145.115 OPEN On-Air
132,"CVUcoloradosprings, cheyenne mountain",145.375,-,0.6,,88.5,88.5,23,23,NN,DIG,5,"CO El Paso Colorado Springs, Cheyenne Mountain KC0CVU 145.375 OPEN Off-Air"
133,"VJJcoloradosprings, cheyenne mountain",145.13,-,0.6,Cross,88.5,123,23,23,NN,FM,5,"CO El Paso Colorado Springs, Cheyenne Mountain KB0VJJ 145.13 OPEN On-Air"
134,"CVUcoloradosprings, cheyenne mountain",446.9125,-,5,,88.5,88.5,23,23,NN,DIG,5,"CO El Paso Colorado Springs, Cheyenne Mountain KC0CVU 446.9125 OPEN On-Air"
135,"CVUcoloradosprings, cheyenne mountain",927.85,-,25,DTCS,88.5,88.5,114,114,NN,FM,5,"CO Teller Colorado Springs, Cheyenne Mountain KC0CVU 927.85 OPEN On-Air"
136,"0SZcoloradosprings, cheyenne mountain",445.0625,-,5,,88.5,88.5,23,23,NN,DIG,5,"CO El Paso Colorado Springs, Cheyenne Mountain N0SZ 445.0625 OPEN Off-Air"
137,"IFIcoloradosprings, cheyenne mountain",53.13,-,1.7,TSQL,107.2,107.2,23,23,NN,FM,5,"CO El Paso Colorado Springs, Cheyenne Mountain WA6IFI 53.13 OPEN On-Air"
138,"D0Qpueblo,baculite mesa",146.79,-,0.6,Tone,88.5,88.5,23,23,NN,FM,5,"CO Pueblo Pueblo, Baculite Mesa ND0Q 146.79 OPEN On-Air"
139,"D0Qpueblo,baculite mesa",224.26,-,1.6,Tone,88.5,88.5,23,23,NN,FM,5,"CO Pueblo Pueblo, Baculite Mesa ND0Q 224.26 OPEN Off-Air"
140,D0Qpueblo,447.95,-,5,Tone,88.5,88.5,23,23,NN,FM,5,CO Pueblo Pueblo ND0Q 447.95 OPEN On-Air
141,"0SZleadville,mosquito pass",445.05,-,5,,88.5,88.5,23,23,NN,DIG,5,"CO Lake Leadville, Mosquito Pass N0SZ 445.05 OPEN On-Air"
142,0CLsnowmassvillage,146.67,-,0.6,Tone,107.2,107.2,23,23,NN,FM,5,CO Pitkin Snowmass Village K0CL 146.67 OPEN On-Air
143,"LEMangelfire, agua fria peak",147.34,+,0.6,Tone,100,100,23,23,NN,FM,5,"NM Colfax Angel Fire, Agua Fria Peak N5LEM 147.34 OPEN On-Air"
144,"VJJleadville,mosquito pass",145.445,-,0.6,Tone,88.5,88.5,23,23,NN,FM,5,"CO Lake Leadville, Mosquito Pass KB0VJJ 145.445 OPEN On-Air"
145,"TTFcoloradosprings, fillmore hill",448.725,-,5,Tone,123,123,23,23,NN,FM,5,"CO El Paso Colorado Springs, Fillmore Hill KA0TTF 448.725 OPEN On-Air"
146,WXIbloomfield,146.92,-,0.6,Tone,100,100,23,23,NN,FM,5,NM San Juan Bloomfield K5WXI 146.92 OPEN On-Air
147,ITSbloomfield,448.65,-,5,Tone,127.3,127.3,23,23,NN,FM,5,NM San Juan Bloomfield KB5ITS 448.65 OPEN On-Air
148,GDRcimarron,145.21,-,0.6,TSQL,110.9,110.9,23,23,NN,FM,5,NM Colfax Cimarron N5GDR 145.21 OPEN On-Air
149,"RDIraton,raton pass",446.775,-,5,,88.5,88.5,23,23,NN,DIG,5,"NM Colfax Raton, Raton Pass KD0RDI 446.775 OPEN On-Air"
150,"IFItrinidad,raton pass",145.43,-,0.6,Tone,107.2,107.2,23,23,NN,FM,5,"CO Las Animas Trinidad, Raton Pass WA6IFI 145.43 OPEN On-Air"
151,WUCwoodlandpark,927.9,-,25,DTCS,88.5,88.5,205,205,NN,FM,5,CO Teller Woodland Park KA0WUC 927.9 OPEN On-Air
152,WUCwoodlandpark,145.415,-,0.6,Tone,179.9,179.9,23,23,NN,FM,5,CO Teller Woodland Park KA0WUC 145.415 OPEN 
153,WUCwoodlandpark,447.675,-,5,TSQL,179.9,179.9,23,23,NN,FM,5,CO Teller Woodland Park KA0WUC 447.675 OPEN On-Air
154,WUCwoodlandpark,449.025,-,5,Tone,141.3,141.3,23,23,NN,FM,5,CO Teller Woodland Park KA0WUC 449.025 OPEN 
155,"EPSwoodlandpark, paradise pines",449.325,-,5,TSQL,103.5,103.5,23,23,NN,FM,5,"CO Teller Woodland Park, Paradise Pines KA4EPS 449.325 OPEN On-Air"
156,X0Gwoodlandpark,146.82,-,0.6,Tone,107.2,107.2,23,23,NN,FM,5,CO Teller Woodland Park NX0G 146.82 OPEN On-Air
157,X0Gwoodlandpark,448.65,-,5,Tone,107.2,107.2,23,23,NN,FM,5,CO Teller Woodland Park NX0G 448.65 OPEN On-Air
158,coloradosprings,449.575,-,5,,88.5,88.5,23,23,NN,FM,5,CO El Paso Colorado Springs  449.575 CLOSED On-Air
159,A0Lcoloradosprings,448.3,-,5,Tone,100,100,23,23,NN,FM,5,CO El Paso Colorado Springs AA0L 448.3 OPEN On-Air
160,IRPcoloradosprings,447.35,-,5,Tone,151.4,151.4,23,23,NN,FM,5,CO El Paso Colorado Springs K0IRP 447.35 OPEN On-Air
161,SRJcoloradosprings,224.06,-,1.6,,88.5,88.5,23,23,NN,FM,5,CO El Paso Colorado Springs KB0SRJ 224.06 CLOSED 
162,0WFcoloradosprings,447.025,-,5,Tone,123,123,23,23,NN,FM,5,CO El Paso Colorado Springs KF0WF 447.025 OPEN Off-Air
163,"0KGcoloradosprings, broadmoor area",448.25,-,5,Tone,123,123,23,23,NN,FM,5,"CO El Paso Colorado Springs, Broadmoor Area N0KG 448.25 OPEN Off-Air"
164,X0Gcoloradosprings,447.475,-,5,Tone,107.2,107.2,23,23,NN,FM,5,CO El Paso Colorado Springs NX0G 447.475 OPEN 
165,MOGcoloradosprings,448.6,-,5,Tone,114.8,114.8,23,23,NN,FM,5,CO El Paso Colorado Springs W0MOG 448.6 OPEN 
166,MOGcoloradosprings,927.8,-,25,DTCS,88.5,88.5,116,116,NN,FM,5,CO Teller Colorado Springs W0MOG 927.8 OPEN On-Air
167,IFIcoloradosprings,447.55,-,5,Tone,123,123,23,23,NN,FM,5,CO El Paso Colorado Springs WA6IFI 447.55 OPEN On-Air
168,coloradosprings,147.27,+,0.6,,88.5,88.5,23,23,NN,FM,5,CO El Paso Colorado Springs  147.27 OPEN On-Air
169,IRPcoloradosprings,146.91,-,0.6,TSQL,151.4,151.4,23,23,NN,FM,5,CO El Paso Colorado Springs K0IRP 146.91 OPEN On-Air
170,MOGcoloradosprings,147.39,+,0.6,Tone,103.5,103.5,23,23,NN,FM,5,CO El Paso Colorado Springs W0MOG 147.39 OPEN On-Air
171,RSHcoloradosprings,146.85,-,0.6,Tone,103.5,103.5,23,23,NN,FM,5,CO El Paso Colorado Springs W0RSH 146.85 OPEN On-Air
172,A0Lcoloradosprings,147.135,+,0.6,Tone,100,100,23,23,NN,FM,5,CO El Paso Colorado Springs AA0L 147.135 OPEN On-Air
173,"5MLraton,sierra grande",147.28,+,0.6,Tone,100,100,23,23,NN,FM,5,"NM Colfax Raton, Sierra Grande NM5ML 147.28 OPEN On-Air"
174,"5MLcuba,eureka mesa",147.24,+,0.6,Tone,67,67,23,23,NN,FM,5,"NM Sandoval Cuba, Eureka Mesa NM5ML 147.24 OPEN On-Air"
175,"ITSdolores,summit ridge",145.19,-,0.6,Tone,100,100,23,23,NN,FM,5,"CO Montezuma Dolores, Summit Ridge KB5ITS 145.19 OPEN On-Air"
176,"ITSdolores,summit ridge",447.275,-,5,Tone,100,100,23,23,NN,FM,5,"CO Montezuma Dolores, Summit Ridge KB5ITS 447.275 OPEN On-Air"
177,"5EMcuba,eureka mesa",145.175,-,0.6,Tone,141.3,141.3,23,23,NN,FM,5,"NM Sandoval Cuba, Eureka Mesa NM5EM 145.175 OPEN Off-Air"
178,MOGcoloradosprings,224.72,-,1.6,TSQL,103.5,103.5,23,23,NN,FM,5,CO El Paso Colorado springs W0MOG 224.72 OPEN On-Air
179,"QXXcedaredge,cedar mesa",147.195,+,0.6,Tone,107.2,107.2,23,23,NN,FM,5,"CO Delta Cedaredge, Cedar Mesa KC0QXX 147.195 OPEN "
180,ALCcedaredge,147.36,+,0.6,Tone,100,100,23,23,NN,FM,5,CO Delta Cedaredge W0ALC 147.36 OPEN 
181,ALCcedaredge,449.825,-,5,Tone,100,100,23,23,NN,FM,5,CO Delta Cedaredge W0ALC 449.825 OPEN 
182,5SJlybrook,145.49,-,0.6,Tone,100,100,23,23,NN,FM,5,NM Rio Arriba Lybrook NM5SJ 145.49 OPEN On-Air
183,0SZwestcreek,446.875,-,5,,88.5,88.5,23,23,NN,DIG,5,CO Douglas Westcreek N0SZ 446.875 OPEN On-Air
184,WXIfarmington,146.85,-,0.6,TSQL,100,100,23,23,NN,FM,5,NM San Juan Farmington K5WXI 146.85 OPEN On-Air
185,5WYfarmington,449,-,5,Tone,100,100,23,23,NN,FM,5,NM San Juan Farmington K5WY 449 OPEN 
186,ITSfarmington,53.01,-,1,Tone,131.8,131.8,23,23,NN,FM,5,NM San Juan Farmington KB5ITS 53.01 OPEN On-Air
187,ITSfarmington,146.76,-,0.6,TSQL,100,100,23,23,NN,FM,5,NM San Juan Farmington KB5ITS 146.76 OPEN On-Air
188,ITSfarmington,147,+,0.6,Tone,100,100,23,23,NN,FM,5,NM San Juan Farmington KB5ITS 147 OPEN On-Air
189,VBFfarmington,444.15,+,5,,88.5,88.5,23,23,NN,DIG,5,NM San Juan Farmington KF5VBF 444.15 OPEN On-Air
190,UBJfarmington,442.325,+,5,,88.5,88.5,23,23,NN,DIG,5,NM San Juan Farmington N5UBJ 442.325 OPEN On-Air
191,"PDOlosalamos, barranca mesa",146.88,-,0.6,,88.5,88.5,23,23,NN,FM,5,"NM Los Alamos Los Alamos, Barranca Mesa W5PDO 146.88 OPEN On-Air"
192,"VBFfarmington,farmington bluffs",1291.7,-,20,,88.5,88.5,23,23,NN,DIG,5,"NM San Juan Farmington, Farmington Bluffs KF5VBF 1291.7 CLOSED On-Air"
193,BIWlosalamos,224.04,-,1.6,TSQL,100,100,23,23,NN,FM,5,NM Los Alamos Los Alamos KA5BIW 224.04 OPEN On-Air
194,BIWlosalamos,442,+,5,Tone,100,100,23,23,NN,FM,5,NM Los Alamos Los Alamos KA5BIW 442 OPEN On-Air
195,"VJJbreckenridge,bald mountain",147.39,+,0.6,Cross,88.5,123,23,23,NN,FM,5,"CO Summit Breckenridge, Bald Mountain KB0VJJ 147.39 OPEN On-Air"
196,5WRlosalamos,442.425,+,5,,88.5,88.5,23,23,NN,DIG,5,NM Los Alamos Los Alamos NM5WR 442.425 OPEN On-Air
197,"5SFlosalamos, pajarito mountain",145.19,-,0.6,Tone,162.2,162.2,23,23,NN,DIG,5,"NM Los Alamos Los Alamos, Pajarito Mountain W5SF 145.19 OPEN On-Air"
198,CMSlosalamos,444.775,+,5,Tone,131.8,131.8,23,23,NN,DIG,5,NM Los Alamos Los Alamos WD9CMS 444.775 OPEN On-Air
199,"5RXlosalamos, pajarito mountain",223.94,-,1.6,,88.5,88.5,23,23,NN,FM,5,"NM Los Alamos Los Alamos, Pajarito Mountain KB5RX 223.94 OPEN On-Air"
200,HSOlosalamos,144.265,,0,Tone,203.5,203.5,23,23,NN,FM,5,NM Los Alamos Los Alamos KC2HSO 144.265 OPEN On-Air
201,AVNlosalamos,442.925,+,5,,88.5,88.5,23,23,NN,DIG,5,NM Los Alamos Los Alamos KE8AVN 442.925 OPEN On-Air
202,5BBlosalamos,442.25,+,5,,88.5,88.5,23,23,NN,DIG,5,NM Los Alamos Los Alamos NM5BB 442.25 OPEN Off-Air
203,CMSlosalamos,927.9,-,25,Tone,131.8,131.8,23,23,NN,DIG,5,NM Los Alamos Los Alamos WD9CMS 927.9 OPEN On-Air
204,"LWUcortez,downtown",146.79,-,0.6,TSQL,127.3,127.3,23,23,NN,FM,5,"CO Montezuma Cortez, Downtown KD5LWU 146.79 OPEN On-Air"
205,LWUcortez,449.175,-,5,Tone,127.3,127.3,23,23,NN,FM,5,CO Montezuma Cortez KD5LWU 449.175 OPEN Off-Air
206,"0SZbreckenridge,baldy",445.0875,-,5,,88.5,88.5,23,23,NN,DIG,5,"CO Fremont Breckenridge, Baldy N0SZ 445.0875 OPEN On-Air"
