Location,Name,Frequency,Duplex,Offset,Tone,rToneFreq,cToneFreq,DtcsCode,DtcsRxCode,DtcsPolarity,Mode,TStep,Comment
207,"JSClarkspur,westcreek",449.975,-,5,TSQL,100,100,23,23,NN,FM,5,"CO Douglas Larkspur, Westcreek K0JSC 449.975 OPEN On-Air"
208,"CRAlarkspur,westcreek",147.225,+,0.6,TSQL,107.2,107.2,23,23,NN,FM,5,"CO Douglas Larkspur, Westcreek W0CRA 147.225 OPEN On-Air"
209,"CRAlarkspur,westcreek",448.425,-,5,TSQL,107.2,107.2,23,23,NN,FM,5,"CO Douglas Larkspur, Westcreek W0CRA 448.425 OPEN On-Air"
210,QMRbreckenridge,146.7,-,0.6,Tone,107.2,107.2,23,23,NN,FM,5,CO Summit Breckenridge WB0QMR 146.7 OPEN On-Air
211,5HOlacueva,145.41,-,0.6,Tone,100,100,23,23,NN,FM,5,NM Santa Fe La Cueva W5HO 145.41 OPEN Off-Air
212,"cedaredge,grand mesa",447.35,-,5,Tone,107.2,107.2,23,23,NN,FM,5,"CO Delta Cedaredge, Grand Mesa  447.35 OPEN "
213,"0NRmonument,monument hill",447.725,-,5,TSQL,100,100,23,23,NN,FM,5,"CO El Paso Monument, Monument Hill K0NR 447.725 OPEN On-Air"
214,"XLFpalmerlake, monument hill",145.19,-,0.6,TSQL,131.8,131.8,23,23,NN,FM,5,"CO Douglas Palmer Lake, Monument Hill N0XLF 145.19 OPEN On-Air"
215,"0VQcarbondale,missouri heights",447.15,-,5,Tone,136.5,136.5,23,23,NN,FM,5,"CO Garfield Carbondale, Missouri Heights K0VQ 447.15 OPEN On-Air"
216,falcon,447.2,-,5,Tone,151.4,151.4,23,23,NN,DIG,5,CO El Paso Falcon  447.2 OPEN Testing
217,"0PCbailey,dick mountain",146.895,-,0.6,TSQL,100,100,23,23,NN,FM,5,"CO Park Bailey, Dick Mountain AB0PC 146.895 OPEN On-Air"
218,"ESQcastlerock, devils head",446.925,-,5,,88.5,88.5,23,23,NN,DIG,5,"CO Douglas Castle Rock, Devils Head N0ESQ 446.925 OPEN On-Air"
219,"ESQcastlerock, devils head (pike national forest)",447.525,-,5,TSQL,146.2,146.2,23,23,NN,FM,5,"CO Douglas Castle Rock, Devils Head (Pike National Forest) N0ESQ 447.525 OPEN On-Air"
220,"VJJgrandjunction, grand mesa",145.355,-,0.6,Cross,88.5,123,23,23,NN,FM,5,"CO Mesa Grand Junction, Grand Mesa KB0VJJ 145.355 OPEN On-Air"
221,"YNAgrandjunction, grand mesa",449.65,-,5,TSQL,151.4,151.4,23,23,NN,FM,5,"CO Mesa Grand Junction, Grand Mesa KB0YNA 449.65 OPEN On-Air"
222,"ELKcarbondale,four mile ridge",449.725,-,5,Tone,179.9,179.9,23,23,NN,FM,5,"CO Garfield Carbondale, Four Mile Ridge K0ELK 449.725 OPEN On-Air"
223,"SNOcarbondale,four mile ridge",147.39,+,0.6,Tone,107.2,107.2,23,23,NN,FM,5,"CO Garfield Carbondale, Four Mile Ridge K0SNO 147.39 OPEN On-Air"
224,"VJJglenwoodsprings, sunlight peak",146.85,-,0.6,Cross,88.5,123,23,23,NN,FM,5,"CO Garfield Glenwood Springs, Sunlight Peak KB0VJJ 146.85 OPEN On-Air"
225,"I0Gglenwoodsprings, sunlight peak",146.88,-,0.6,Tone,107.2,107.2,23,23,NN,FM,5,"CO Garfield Glenwood Springs, Sunlight Peak KI0G 146.88 OPEN On-Air"
226,"I0Gglenwoodsprings, sunlight peak",447.1,-,5,Tone,107.2,107.2,23,23,NN,FM,5,"CO Garfield Glenwood Springs, Sunlight Peak KI0G 447.1 OPEN On-Air"
227,"XLIglenwoodsprings, sunlight peak",449.6,-,5,Tone,107.2,107.2,23,23,NN,FM,5,"CO Garfield Glenwood Springs, Sunlight Peak N0XLI 449.6 OPEN On-Air"
228,"0RVvail,bald mountain",146.61,-,0.6,Tone,107.2,107.2,23,23,NN,FM,5,"CO Eagle Vail, Bald Mountain K0RV 146.61 OPEN On-Air"
229,"MDPfalcon,black forest",447.625,-,5,TSQL,100,100,23,23,NN,FM,5,"CO El Paso Falcon, Black Forest KD0MDP 447.625 OPEN On-Air"
230,"ZQEsantafe, tesuque peak",442.825,+,5,Tone,131.8,131.8,23,23,NN,FM,5,"NM Santa Fe Santa Fe, Tesuque Peak KB5ZQE 442.825 OPEN On-Air"
231,"5EMsantafe, tesuque peak",147.02,+,0.6,Tone,141.3,141.3,23,23,NN,FM,5,"NM Santa Fe Santa Fe, Tesuque Peak NM5EM 147.02 OPEN On-Air"
232,"5SFsantafe,  tesuque peak",146.82,-,0.6,Tone,162.2,162.2,23,23,NN,FM,5,"NM Santa Fe Santa Fe,  Tesuque Peak W5SF 146.82 OPEN On-Air"
233,0SZvail,445.075,-,5,,88.5,88.5,23,23,NN,DIG,5,CO Eagle Vail N0SZ 445.075 OPEN On-Air
234,AFOvail,224.8,-,1.6,,88.5,88.5,23,23,NN,FM,5,CO Eagle Vail N0AFO 224.8 OPEN Off-Air
235,AFOvail,449.9,-,5,TSQL,107.2,107.2,23,23,NN,FM,5,CO Eagle Vail N0AFO 449.9 OPEN Off-Air
236,VJJvail,147.345,+,0.6,Cross,88.5,123,23,23,NN,FM,5,CO Eagle Vail KB0VJJ 147.345 OPEN On-Air
237,"ARAcritchell,critchell mountain",147.12,+,0.6,TSQL,88.5,88.5,23,23,NN,FM,5,"CO Jefferson Critchell, Critchell Mountain N0ARA 147.12 OPEN On-Air"
238,"CRAconifer,conifer mountain",53.05,-,1.7,TSQL,107.2,107.2,23,23,NN,FM,5,"CO Jefferson Conifer, Conifer Mountain W0CRA 53.05 OPEN Off-Air"
239,0SWcollbran,449.5,-,5,Tone,107.2,107.2,23,23,NN,FM,5,CO Mesa Collbran KB0SW 449.5 OPEN Off-Air
240,"OWYconifer,critchell mountain",447.5,-,5,TSQL,88.5,88.5,23,23,NN,FM,5,"CO Jefferson Conifer, Critchell Mountain N0OWY 447.5 OPEN On-Air"
241,"YNAdelta,uncompahgre butte",449.4,-,5,TSQL,131.8,131.8,23,23,NN,FM,5,"CO Mesa Delta, Uncompahgre Butte KB0YNA 449.4 OPEN On-Air"
242,"5MLpecos,elk mountain",147.26,+,0.6,Tone,67,67,23,23,NN,FM,5,"NM San Miguel Pecos, Elk Mountain NM5ML 147.26 OPEN On-Air"
243,"CRAconifer,conifer mountain",1287.9,-,20,,88.5,88.5,23,23,NN,FM,5,"CO Jefferson Conifer, Conifer Mountain W0CRA 1287.9 OPEN Off-Air"
244,"CRAconifer,conifer mountain",224.98,-,1.6,TSQL,107.2,107.2,23,23,NN,FM,5,"CO Jefferson Conifer, Conifer Mountain W0CRA 224.98 OPEN Off-Air"
245,"CRAconifer,conifer mountain",447.15,-,5,TSQL,107.2,107.2,23,23,NN,FM,5,"CO Jefferson Conifer, Conifer Mountain W0CRA 447.15 OPEN Off-Air"
246,"5SFlasvegas,  elk mountain",147.3,+,0.6,Tone,162.2,162.2,23,23,NN,FM,5,"NM San Miguel Las Vegas,  Elk Mountain W5SF 147.3 OPEN On-Air"
247,santafe,145.19,-,0.6,Tone,162.2,162.2,23,23,NN,FM,5,NM Bernalillo Santa Fe  145.19 OPEN On-Air
248,"0VQglenwoodsprings, three mile ridge",147.3,+,0.6,Tone,107.2,107.2,23,23,NN,FM,5,"CO Garfield Glenwood Springs, Three Mile Ridge K0VQ 147.3 OPEN Off-Air"
249,I0Gglenwoodsprings,224.02,-,1.6,,88.5,88.5,23,23,NN,FM,5,CO Garfield Glenwood Springs KI0G 224.02 CLOSED 
250,I0Gglenwoodsprings,447.6,-,5,,88.5,88.5,23,23,NN,FM,5,CO Garfield Glenwood Springs KI0G 447.6 CLOSED 
251,5SFsantafe,145.21,-,0.6,,88.5,88.5,23,23,NN,DIG,5,NM Santa Fe Santa Fe W5SF 145.21 OPEN On-Air
252,5SFsantafe,444.575,+,5,,88.5,88.5,23,23,NN,DIG,5,NM Santa Fe Santa Fe W5SF 444.575 OPEN On-Air
253,"HNDglenwoodsprings, lookout mountain",449.85,-,5,TSQL,131.8,131.8,23,23,NN,FM,5,"CO Garfield Glenwood Springs, Lookout Mountain WA4HND 449.85 OPEN On-Air"
254,"5SCsanysidro, pajarito peak",443.1,+,5,Tone,100,100,23,23,NN,FM,5,"NM Sandoval San Ysidro, Pajarito Peak NM5SC 443.1 OPEN On-Air"
255,"HNDgrandjunction, grand mesa",449.3,-,5,TSQL,107.2,107.2,23,23,NN,FM,5,"CO Mesa Grand Junction, Grand Mesa WA4HND 449.3 OPEN On-Air"
256,"0BXgrandjunction, grand mesa",446.9125,-,5,,88.5,88.5,23,23,NN,DIG,5,"CO Mesa Grand Junction, Grand Mesa W0BX 446.9125 OPEN On-Air"
257,"5SFsantafe, st vincent hospital",147.2,+,0.6,Tone,162.2,162.2,23,23,NN,FM,5,"NM Santa Fe Santa Fe, St Vincent Hospital W5SF 147.2 OPEN On-Air"
258,GAJsantafe,449.275,-,5,Tone,146.2,146.2,23,23,NN,FM,5,NM Santa Fe Santa Fe K9GAJ 449.275 OPEN On-Air
259,SGTsantafe,447.775,-,5,Tone,100,100,23,23,NN,FM,5,NM Santa Fe Santa Fe KF5SGT 447.775 OPEN On-Air
260,"5EMwagonmound, turkey mtn",145.37,-,0.6,Tone,141.3,141.3,23,23,NN,FM,5,"NM Mora Wagon Mound, Turkey Mtn NM5EM 145.37 OPEN Off-Air"
261,"5MLwagonmound, turkey mountain",147.2,+,0.6,Tone,67,67,23,23,NN,FM,5,"NM Mora Wagon Mound, Turkey Mountain NM5ML 147.2 OPEN On-Air"
262,"TUBcentennial,warren mountain",146.88,-,0.6,Tone,100,100,23,23,NN,FM,5,"CO Jefferson Centennial, Warren Mountain WB0TUB 146.88 OPEN On-Air"
263,"TUBcentennial,warren mountain",449.6,-,5,Tone,100,100,23,23,NN,FM,5,"CO Jefferson Centennial, Warren Mountain WB0TUB 449.6 OPEN On-Air"
264,GJTgrandjunction,448.15,-,5,Tone,100,100,23,23,NN,FM,5,CO Mesa Grand Junction W0GJT 448.15 OPEN On-Air
265,"AENidahosprings, squaw mountain",449,-,5,TSQL,136.5,136.5,23,23,NN,FM,5,"CO Clear Creek Idaho Springs, Squaw Mountain WR0AEN 449 OPEN On-Air"
266,"DUNidahosprings, squaw mountain",449.45,-,5,Cross,103.5,127.3,23,23,NN,FM,5,"CO Clear Creek Idaho Springs, Squaw Mountain K1DUN 449.45 OPEN On-Air"
267,"UDDidahosprings, squaw mountain",146.67,-,0.6,TSQL,100,100,23,23,NN,FM,5,"CO Clear Creek Idaho Springs, Squaw Mountain KB0UDD 146.67 OPEN On-Air"
268,"PYYevergreen,squaw mountain",147.3,+,0.6,TSQL,103.5,103.5,23,23,NN,FM,5,"CO Clear Creek Evergreen, Squaw Mountain N0PYY 147.3 OPEN On-Air"
269,SWErifle,146.76,-,0.6,Tone,107.2,107.2,23,23,NN,FM,5,CO Garfield Rifle N0SWE 146.76 OPEN Off-Air
270,"0SZidahosprings, squaw mountain",446.9375,-,5,,88.5,88.5,23,23,NN,DIG,5,"CO Clear Creek Idaho Springs, Squaw Mountain N0SZ 446.9375 OPEN On-Air"
271,"0SZidahosprings, squaw mountain",448.225,-,5,TSQL,141.3,141.3,23,23,NN,FM,5,"CO Clear Creek Idaho Springs, Squaw Mountain N0SZ 448.225 OPEN On-Air"
272,"CFIidahosprings, squaw mountain",448.675,-,5,TSQL,100,100,23,23,NN,FM,5,"CO Denver Idaho Springs, Squaw Mountain W0CFI 448.675 OPEN On-Air"
273,"CRAidahosprings, squaw mountain",145.145,-,0.6,TSQL,107.2,107.2,23,23,NN,FM,5,"CO Clear Creek Idaho Springs, Squaw Mountain W0CRA 145.145 OPEN On-Air"
274,"CRAidahosprings, squaw mountain",447.575,-,5,TSQL,107.2,107.2,23,23,NN,FM,5,"CO Clear Creek Idaho Springs, Squaw Mountain W0CRA 447.575 OPEN On-Air"
275,"0TXidahosprings, centennial cone",145.49,-,0.6,TSQL,100,100,23,23,NN,FM,5,"CO Jefferson Idaho Springs, Centennial Cone W0TX 145.49 OPEN On-Air"
276,"0TXidahosprings, squaw mountain",449.35,-,5,TSQL,100,100,23,23,NN,FM,5,"CO Clear Creek Idaho Springs, Squaw Mountain W0TX 449.35 OPEN On-Air"
277,"WYXidahosprings, squaw mountain",146.94,-,0.6,TSQL,103.5,103.5,23,23,NN,FM,5,"CO Clear Creek Idaho Springs, Squaw Mountain W0WYX 146.94 OPEN On-Air"
278,GUQevergreen,145.34,-,0.6,Cross,103.5,127.3,23,23,NN,FM,5,CO Jefferson Evergreen KE4GUQ 145.34 OPEN On-Air
279,"0SZevergreen,lower squaw mountain",145.175,-,0.6,DTCS,88.5,88.5,73,73,NN,DIG,5,"CO Clear Creek Evergreen, Lower Squaw Mountain N0SZ 145.175 OPEN Off-Air"
280,"9SLcastlepines, daniels park",449.95,-,5,TSQL,77,77,23,23,NN,FM,5,"CO Douglas Castle Pines, Daniels Park W9SL 449.95 OPEN On-Air"
281,JNIwagonmound,444.4,+,5,Tone,100,100,23,23,NN,FM,5,NM Mora Wagon Mound N7JNI 444.4 OPEN Off-Air
282,PGQlacueva,53.2,-,1,Tone,107.2,107.2,23,23,NN,FM,5,NM Santa Fe La Cueva N9PGQ 53.2 OPEN Off-Air
283,PGQlacueva,146.84,-,0.6,Tone,107.2,107.2,23,23,NN,FM,5,NM Santa Fe La Cueva N9PGQ 146.84 OPEN 
284,PGQlacueva,442.125,+,5,Tone,107.2,107.2,23,23,NN,FM,5,NM Santa Fe La Cueva N9PGQ 442.125 OPEN 
285,PRAfranktown,446.85,-,5,,88.5,88.5,23,23,NN,DIG,5,CO Douglas Franktown K0PRA 446.85 OPEN On-Air
286,"0KQevergreen,saddleback mountain",447.85,-,5,TSQL,141.3,141.3,23,23,NN,FM,5,"CO Clear Creek Evergreen, Saddleback Mountain AC0KQ 447.85 OPEN On-Air"
287,"YEJsanluis, cabezon",443,+,5,Tone,100,100,23,23,NN,FM,5,"NM Sandoval San Luis, Cabezon K5YEJ 443 OPEN On-Air"
288,"G0Nidahosprings, squaw mountain",449.05,-,5,TSQL,107.2,107.2,23,23,NN,FM,5,"CO Denver Idaho Springs, Squaw Mountain WG0N 449.05 OPEN On-Air"
289,"ESQparker,hess reservoir",447.525,-,5,Cross,203.5,146.2,23,23,NN,FM,5,"CO Douglas Parker, Hess Reservoir N0ESQ 447.525 OPEN On-Air"
290,"LXXmorrison,mt. morrison",53.17,-,1.7,Tone,107.2,107.2,23,23,NN,FM,5,"CO Jefferson Morrison, Mt. Morrison N6LXX 53.17 OPEN On-Air"
291,"LXXmorrison,mt. morrison",447.875,-,5,TSQL,107.2,107.2,23,23,NN,FM,5,"CO Jefferson Morrison, Mt. Morrison N6LXX 447.875 OPEN On-Air"
292,PRAparker,445.075,-,5,,88.5,88.5,23,23,NN,DIG,5,CO Douglas Parker K0PRA 445.075 OPEN On-Air
293,BOPdesmoines,146.85,-,0.6,Tone,100,100,23,23,NN,FM,5,NM Union Des Moines N5BOP 146.85 OPEN Off-Air
294,BOPdesmoines,444.8,+,5,Tone,77,77,23,23,NN,FM,5,NM Union Des Moines N5BOP 444.8 OPEN Off-Air
295,"5EMdesmoines, sierra grande",147.175,+,0.6,Tone,141.3,141.3,23,23,NN,FM,5,"NM Union Des Moines, Sierra Grande NM5EM 147.175 OPEN On-Air"
296,SSIgrandjunction,147.105,+,0.6,,88.5,88.5,23,23,NN,FM,5,CO Mesa Grand Junction K0SSI 147.105 OPEN On-Air
297,0SWgrandjunction,449,-,5,Cross,88.5,107.2,23,23,NN,FM,5,CO Mesa Grand Junction KB0SW 449 CLOSED On-Air
298,ARVgrandjunction,447.5,-,5,Tone,114.8,114.8,23,23,NN,FM,5,CO Mesa Grand Junction KC0ARV 447.5 OPEN 
299,REDgrandjunction,446.775,-,5,,88.5,88.5,23,23,NN,DIG,5,CO Mesa Grand Junction KD0RED 446.775 OPEN On-Air
300,SMZgrandjunction,449.775,-,5,Cross,173.8,88.5,23,23,NN,FM,5,CO Mesa Grand Junction KD0SMZ 449.775 OPEN On-Air
301,0TYgrandjunction,145.22,-,0.6,Tone,107.2,107.2,23,23,NN,FM,5,CO Mesa Grand Junction KE0TY 145.22 OPEN 
302,0TYgrandjunction,147.39,+,0.6,Tone,107.2,107.2,23,23,NN,FM,5,CO Mesa Grand Junction KE0TY 147.39 OPEN 
303,GJTgrandjunction,146.82,-,0.6,Tone,107.2,107.2,23,23,NN,FM,5,CO Mesa Grand Junction W0GJT 146.82 OPEN On-Air
304,"VJJgrandjunction, grand mesa",147.355,-,0.6,Cross,88.5,123,23,23,NN,FM,5,"CO Mesa Grand Junction, Grand Mesa KB0VJJ 147.355 OPEN On-Air"
305,"FEZgolden,centennial cone",146.985,-,0.6,TSQL,100,100,23,23,NN,FM,5,"CO Denver Golden, Centennial Cone K0FEZ 146.985 OPEN On-Air"
306,"0SJgolden,centennial cone",145.28,-,0.6,Tone,100,100,23,23,NN,FM,5,"CO Jefferson Golden, Centennial Cone KE0SJ 145.28 OPEN On-Air"
307,"0SJgolden,centennial cone",449.525,-,5,,88.5,88.5,23,23,NN,FM,5,"CO Jefferson Golden, Centennial Cone KE0SJ 449.525 OPEN On-Air"
308,"0TXlakewood,green mountain",147.33,+,0.6,Tone,100,100,23,23,NN,FM,5,"CO Jefferson Lakewood, Green Mountain W0TX 147.33 OPEN On-Air"
309,"0TXlakewood,green mountain",224.38,-,1.6,TSQL,100,100,23,23,NN,FM,5,"CO Jefferson Lakewood, Green Mountain W0TX 224.38 OPEN On-Air"
310,"0TXgolden,centennial cone",448.625,-,5,TSQL,100,100,23,23,NN,FM,5,"CO Jefferson Golden, Centennial Cone W0TX 448.625 OPEN On-Air"
311,"0TXlakewood,green mtn",449.775,-,5,TSQL,100,100,23,23,NN,DIG,5,"CO Jefferson Lakewood, Green Mtn W0TX 449.775 OPEN On-Air"
312,"TUBgolden,centennial cone",146.64,-,0.6,Tone,100,100,23,23,NN,FM,5,"CO Jefferson Golden, Centennial Cone WB0TUB 146.64 OPEN On-Air"
313,"HNDparachute,mount callahan",449.8,-,5,Tone,107.2,107.2,23,23,NN,FM,5,"CO Garfield Parachute, Mount Callahan WA4HND 449.8 OPEN On-Air"
314,"0TXlakewood,green mountain",53.09,-,1.7,Tone,107.2,107.2,23,23,NN,FM,5,"CO Jefferson Lakewood, Green Mountain W0TX 53.09 OPEN On-Air"
315,"0HCgolden,centennial cone",927.8375,-,25.8,DTCS,88.5,88.5,205,205,NN,DIG,5,"CO Jefferson Golden, Centennial Cone KI0HC 927.8375 OPEN On-Air"
316,"0TXdenver,centennial cone",446.7875,-,5,,88.5,88.5,23,23,NN,DIG,5,"CO Jefferson Denver, Centennial Cone W0TX 446.7875 OPEN On-Air"
317,"RRZgrandjunction, gjt",145.175,-,0.6,Tone,107.2,107.2,23,23,NN,FM,5,"CO Mesa Grand Junction, GJT W0RRZ 145.175 OPEN On-Air"
318,"0SZgolden,lookout mountain",145.37,-,0.6,,88.5,88.5,23,23,NN,DIG,5,"CO Jefferson Golden, Lookout Mountain N0SZ 145.37 OPEN On-Air"
319,"CDSgolden,lookout mountain",1283.9625,-,20,,88.5,88.5,23,23,NN,DIG,5,"CO Jefferson Golden, Lookout Mountain W0CDS 1283.9625 OPEN On-Air"
320,"CDSgolden,lookout mountain",1299.9,,0,,88.5,88.5,23,23,NN,DIG,5,"CO Jefferson Golden, Lookout Mountain W0CDS 1299.9 OPEN On-Air"
321,"CDSgolden,lookout mountain",145.25,-,0.6,,88.5,88.5,23,23,NN,DIG,5,"CO Jefferson Golden, Lookout Mountain W0CDS 145.25 OPEN On-Air"
322,"CDSgolden,lookout mountain",446.9625,-,5,,88.5,88.5,23,23,NN,DIG,5,"CO Jefferson Golden, Lookout Mountain W0CDS 446.9625 OPEN On-Air"
323,"0KUgolden,lookout mountain",449.625,-,5,TSQL,141.3,141.3,23,23,NN,FM,5,"CO Jefferson Golden, Lookout Mountain W0KU 449.625 OPEN On-Air"
324,"YZTgolden,lookout",446.8375,-,5,,88.5,88.5,23,23,NN,DIG,5,"CO Jefferson Golden, Lookout WA2YZT 446.8375 OPEN On-Air"
325,Q8Mparker,448.7,-,5,Tone,146.2,146.2,23,23,NN,FM,5,CO Douglas Parker WQ8M 448.7 OPEN On-Air
326,ELYlakewood,448.75,-,5,TSQL,100,100,23,23,NN,FM,5,CO Jefferson Lakewood N0ELY 448.75 OPEN On-Air
327,"IBMgolden,guy hill",448.85,-,5,TSQL,88.5,88.5,23,23,NN,FM,5,"CO Jefferson Golden, Guy Hill K0IBM 448.85 OPEN On-Air"
328,"MHUgolden,guy hill",224,-,1.6,TSQL,103.5,103.5,23,23,NN,FM,5,"CO Jefferson Golden, Guy Hill N0MHU 224 OPEN On-Air"
329,"CBIgolden,guy hill",147.15,+,0.6,TSQL,100,100,23,23,NN,FM,5,"CO Jefferson Golden, Guy Hill W0CBI 147.15 OPEN On-Air"
330,"0GOgolden,guy hill",449.75,-,5,TSQL,103.5,103.5,23,23,NN,FM,5,"CO Jefferson Golden, Guy Hill KI0GO 449.75 OPEN On-Air"
331,"POHgolden,guy hill",224.74,-,1.6,TSQL,88.5,88.5,23,23,NN,FM,5,"CO Jefferson Golden, Guy Hill N0POH 224.74 OPEN On-Air"
332,"T0Cgolden,guy hill",145.22,-,0.6,TSQL,103.5,103.5,23,23,NN,DIG,5,"CO Jefferson Golden, Guy Hill WT0C 145.22 OPEN On-Air"
333,"0TXlakewood,st anthony medical campus",447.825,-,5,DTCS,88.5,88.5,73,73,NN,NFM,5,"CO Jefferson Lakewood, St Anthony Medical Campus W0TX 447.825 OPEN On-Air"
334,"ITFlajunta, north la junta",147.36,+,0.6,Cross,88.5,123,23,23,NN,DIG,5,"CO Otero La Junta, North La Junta KC0ITF 147.36 PRIVATE On-Air"
335,"ITFlajunta, north la junta",446.75,-,5,,88.5,88.5,23,23,NN,DIG,5,"CO Otero La Junta, North La Junta KC0ITF 446.75 PRIVATE On-Air"
336,"VJJwinterpark, winter park",147.285,+,0.6,Cross,88.5,123,23,23,NN,FM,5,"CO Grand Winter Park, Winter Park KB0VJJ 147.285 OPEN On-Air"
337,PYYgolden,448.125,-,5,Tone,107.2,107.2,23,23,NN,FM,5,CO Jefferson Golden N0PYY 448.125 OPEN On-Air
338,PYYgolden,927.7875,-,25,Tone,156.7,156.7,23,23,NN,FM,5,CO Jefferson Golden N0PYY 927.7875 OPEN On-Air
339,0GVgolden,448.975,-,5,Tone,123,123,23,23,NN,FM,5,CO Jefferson Golden W0GV 448.975 OPEN On-Air
340,WEZlasvegas,145.45,-,0.6,,88.5,88.5,23,23,NN,FM,5,NM San Miguel Las Vegas KB5WEZ 145.45 OPEN Off-Air
341,"SSPlakewood,moffat treatment plant",147.21,+,0.6,TSQL,100,100,23,23,NN,FM,5,"CO Jefferson Lakewood, Moffat Treatment Plant KD0SSP 147.21 OPEN On-Air"
342,"SSPlakewood,moffat treatment plant",448.35,-,5,Tone,225.7,225.7,23,23,NN,DIG,5,"CO Jefferson Lakewood, Moffat Treatment Plant KD0SSP 448.35 OPEN On-Air"
343,"VGDgolden,table mountain",446.975,-,5,,88.5,88.5,23,23,NN,DIG,5,"CO Jefferson Golden, Table Mountain KB0VGD 446.975 OPEN On-Air"
344,"UDDaurora,smoky hill",145.4,-,0.8,Tone,100,100,23,23,NN,FM,5,"CO Arapahoe Aurora, Smoky Hill KB0UDD 145.4 OPEN On-Air"
345,CCCwinterpark,447.45,-,5,Tone,103.5,103.5,23,23,NN,FM,5,CO Grand Winter Park WA4CCC 447.45 OPEN On-Air
346,OBAaurora,145.19,-,0.6,Cross,151.4,131.8,23,23,NN,FM,5,CO Arapahoe Aurora N0OBA 145.19 OPEN On-Air
347,PWOcentennial,449.425,-,5,DTCS,88.5,88.5,23,23,NN,FM,5,CO Arapahoe Centennial K0PWO 449.425 OPEN Off-Air
348,FEZdenver,447.925,-,5,TSQL,100,100,23,23,NN,FM,5,CO Denver Denver K0FEZ 447.925 OPEN On-Air
349,TPTdenver,447.9,-,5,,88.5,88.5,23,23,NN,FM,5,CO Denver Denver WB0TPT 447.9 OPEN Off-Air
350,AENdenver,449.65,-,5,Tone,136.5,136.5,23,23,NN,DIG,5,CO Denver Denver WR0AEN 449.65 OPEN On-Air
351,AENdenver,449.675,-,5,Tone,136.5,136.5,23,23,NN,DIG,5,CO Denver Denver WR0AEN 449.675 OPEN On-Air
352,"0SJboulder,blue mountain",145.475,-,0.6,Tone,100,100,23,23,NN,FM,5,"CO Jefferson Boulder, Blue Mountain KE0SJ 145.475 OPEN On-Air"
353,JXNdenver,146.715,-,0.6,TSQL,123,123,23,23,NN,FM,5,CO Denver Denver N0JXN 146.715 OPEN On-Air
354,EHPdenver,448.075,-,5,Tone,123,123,23,23,NN,FM,5,CO Denver Denver N5EHP 448.075 OPEN On-Air
355,KIZdenver,448.55,-,5,Tone,82.5,82.5,23,23,NN,FM,5,CO Denver Denver W0KIZ 448.55 OPEN Off-Air
356,"VJJboulder,thorodin mountain",145.31,-,0.6,Cross,88.5,123,23,23,NN,FM,5,"CO Gilpin Boulder, Thorodin Mountain KB0VJJ 145.31 OPEN On-Air"
357,0HCparker,927.8375,-,25.8,Tone,100,100,23,23,NN,DIG,5,CO Douglas Parker KI0HC 927.8375 OPEN On-Air
358,"0SZdenver,thorodin mountain",449.225,-,5,TSQL,141.3,141.3,23,23,NN,FM,5,"CO Gilpin Denver, Thorodin Mountain N0SZ 449.225 OPEN On-Air"
359,"JRLdenver,broadway plaza lofts",447.175,-,5,TSQL,100,100,23,23,NN,FM,5,"CO Denver Denver, Broadway Plaza Lofts W0JRL 447.175 OPEN On-Air"
360,0RMrollinsville,224.6,-,1.6,Tone,100,100,23,23,NN,FM,5,CO Gilpin Rollinsville W0RM 224.6 OPEN 
361,"RRZgrandjunction, black ridge (above colorado ntl monument)",146.94,-,0.6,TSQL,107.2,107.2,23,23,NN,FM,5,"CO Mesa Grand Junction, Black Ridge (Above Colorado Ntl Monument) W0RRZ 146.94 OPEN On-Air"
362,"HNDgrandjunction, black ridge",449.575,-,5,TSQL,131.8,131.8,23,23,NN,FM,5,"CO Mesa Grand Junction, Black Ridge WA4HND 449.575 OPEN On-Air"
363,"AKWplacitas,sandia peak",443.4,+,5,Tone,100,100,23,23,NN,FM,5,"NM Sandoval Placitas, Sandia Peak K5AKW 443.4 OPEN On-Air"
364,AENaurora,449.15,-,5,Tone,136.5,136.5,23,23,NN,DIG,5,CO Arapahoe Aurora WR0AEN 449.15 OPEN On-Air
365,0DEsimla,147.105,+,0.6,TSQL,107.2,107.2,23,23,NN,FM,5,CO Elbert Simla WA0DE 147.105 OPEN On-Air
366,"UDDaurora,smokey hill",448.5,-,5,Tone,100,100,23,23,NN,FM,5,"CO Denver Aurora, Smokey Hill KB0UDD 448.5 OPEN On-Air"
367,ZUQaurora,448.4,-,5,Tone,94.8,94.8,23,23,NN,FM,5,CO Arapahoe Aurora N0ZUQ 448.4 OPEN On-Air
368,0BGaurora,448.275,-,5,Tone,156.7,156.7,23,23,NN,FM,5,CO Arapahoe Aurora W0BG 448.275 OPEN On-Air
369,ANTaurora,448.825,-,5,,88.5,88.5,23,23,NN,DIG,5,CO Arapahoe Aurora WN7ANT 448.825 OPEN On-Air
370,"5SCplacitas,la madera",147.08,+,0.6,Tone,100,100,23,23,NN,FM,5,"NM Sandoval Placitas, La Madera NM5SC 147.08 OPEN On-Air"
371,"VJJkremmling,santoy peak",147.075,+,0.6,Cross,88.5,123,23,23,NN,FM,5,"CO Grand Kremmling, Santoy Peak KB0VJJ 147.075 OPEN On-Air"
372,UPSwestminster,449.3,-,5,Tone,100,100,23,23,NN,FM,5,CO Adams Westminster N1UPS 449.3 OPEN On-Air
373,FSXpunkincenter,449.9,-,5,Tone,107.2,107.2,23,23,NN,FM,5,CO Lincoln Punkin Center N1FSX 449.9 OPEN On-Air
374,OLDriorancho,442.35,+,5,Tone,100,100,23,23,NN,FM,5,NM Sandoval Rio Rancho WA5OLD 442.35 OPEN On-Air
375,IPKriorancho,442.75,+,5,Tone,162.2,162.2,23,23,NN,FM,5,NM Sandoval Rio Rancho KC5IPK 442.75 OPEN On-Air
376,"5RRriorancho, rainbow",147.1,+,0.6,TSQL,100,100,23,23,NN,FM,5,"NM Sandoval Rio Rancho, Rainbow NM5RR 147.1 OPEN On-Air"
377,"5RRriorancho, rainbow",443,+,5,Tone,100,100,23,23,NN,FM,5,"NM Sandoval Rio Rancho, Rainbow NM5RR 443 OPEN On-Air"
378,"PFJgranby,mt chauncey",446.875,-,5,,88.5,88.5,23,23,NN,DIG,5,"CO Clear Creek Granby, Mt Chauncey K7PFJ 446.875 OPEN On-Air"
379,YDWgranby,146.82,-,0.6,Tone,123,123,23,23,NN,FM,5,CO Grand Granby KA0YDW 146.82 OPEN 
380,"0DKboulder,table mountain",146.7,-,0.6,Tone,100,100,23,23,NN,FM,5,"CO Boulder Boulder, Table Mountain W0DK 146.7 OPEN On-Air"
381,0DKboulder,146.61,-,0.6,Tone,100,100,23,23,NN,FM,5,CO Boulder Boulder W0DK 146.61 OPEN Off-Air
382,"0DKboulder,table mesa",448.9,-,5,Tone,100,100,23,23,NN,FM,5,"CO Boulder Boulder, Table Mesa W0DK 448.9 OPEN On-Air"
383,LMAbroomfield,448.925,-,5,Tone,131.8,131.8,23,23,NN,FM,5,CO Boulder Broomfield W0LMA 448.925 OPEN On-Air
384,WYXbroomfield,449.825,-,5,Tone,103.5,103.5,23,23,NN,FM,5,CO Boulder Broomfield W0WYX 449.825 OPEN On-Air
385,0MLnorthglenn,147.045,+,0.6,Tone,123,123,23,23,NN,FM,5,CO Adams Northglenn K0ML 147.045 OPEN On-Air
386,5QDcorrales,443.2,+,5,,88.5,88.5,23,23,NN,DIG,5,NM Sandoval Corrales N5QD 443.2 OPEN On-Air
387,"SLGriorancho, nm 528 and corrales rd",442.4,+,5,,88.5,88.5,23,23,NN,DIG,5,"NM Sandoval Rio Rancho, NM 528 and Corrales Rd KG5SLG 442.4 OPEN On-Air"
388,"IHLlasvegas, mesa apache",444.375,+,5,Tone,100,100,23,23,NN,FM,5,"NM San Miguel Las Vegas, Mesa Apache WA5IHL 444.375 CLOSED On-Air"
389,"GURdenver,green valley ranch",448.15,-,5,TSQL,141.3,141.3,23,23,NN,FM,5,"CO Denver Denver, Green Valley Ranch K0GUR 448.15 OPEN On-Air"
390,"CCBalbuquerque,sandia peak",443.75,+,5,Tone,100,100,23,23,NN,FM,5,"NM Bernalillo Albuquerque, Sandia Peak WA6CCB 443.75 CLOSED Off-Air"
391,"KREalbuquerque,sandia crest",443.3,+,5,,88.5,88.5,23,23,NN,DIG,5,"NM Bernalillo Albuquerque, Sandia Crest K5KRE 443.3 OPEN Testing"
392,"QEQmonticello,abajo pk",223.94,-,1.6,,88.5,88.5,23,23,NN,FM,5,"UT San Juan Monticello, Abajo Pk K7QEQ 223.94 CLOSED "
393,"QEQmonticello,abajo peak",447.1,-,5,TSQL,107.2,107.2,23,23,NN,FM,5,"UT San Juan Monticello, Abajo Peak K7QEQ 447.1 OPEN On-Air"
394,"QEQmonticello,abajo peak",447.4,-,5,,88.5,88.5,23,23,NN,FM,5,"UT San Juan Monticello, Abajo Peak K7QEQ 447.4 CLOSED "
395,"SDCmonticello,abajo peak",146.61,-,0.6,Tone,88.5,88.5,23,23,NN,FM,5,"UT San Juan Monticello, Abajo Peak K7SDC 146.61 OPEN On-Air"
396,"IUZalbuquerque,sandia crest",51.7,-,1,Tone,156.7,156.7,23,23,NN,FM,5,"NM Bernalillo Albuquerque, Sandia Crest WB5IUZ 51.7 OPEN Off-Air"
397,"CPUriorancho, intel corp",444.7,+,5,Tone,100,100,23,23,NN,FM,5,"NM Sandoval Rio Rancho, Intel Corp K5CPU 444.7 OPEN On-Air"
398,"JMWalbuquerque,sandia crest",442.9,+,5,,88.5,88.5,23,23,NN,DIG,5,"NM Bernalillo Albuquerque, Sandia Crest KA8JMW 442.9 OPEN On-Air"
399,"MPZalbuquerque,sandia crest",443.8,+,5,,88.5,88.5,23,23,NN,DIG,5,"NM Bernalillo Albuquerque, Sandia Crest W5MPZ 443.8 OPEN On-Air"
400,"FSBalbuquerque,sandia peak",442.6,+,5,Tone,100,100,23,23,NN,FM,5,"NM Bernalillo Albuquerque, Sandia Peak K5FSB 442.6 OPEN On-Air"
401,"GASalbuquerque,sandia crest",442.1,+,5,Tone,162.2,162.2,23,23,NN,FM,5,"NM Bernalillo Albuquerque, Sandia Crest KB5GAS 442.1 OPEN On-Air"
402,"IPKalbuquerque,sandia crest",442.75,+,5,Tone,162.2,162.2,23,23,NN,FM,5,"NM Bernalillo Albuquerque, Sandia Crest KC5IPK 442.75 OPEN On-Air"
403,"5MLalbuquerque,sandia crest",145.29,-,0.6,Tone,100,100,23,23,NN,FM,5,"NM Bernalillo Albuquerque, Sandia Crest NM5ML 145.29 OPEN On-Air"
404,"5MLalbuquerque,sandia crest",444.325,+,5,Tone,100,100,23,23,NN,FM,5,"NM Bernalillo Albuquerque, Sandia Crest NM5ML 444.325 OPEN On-Air"
405,"CSYalbuquerque,sandia crest",145.33,-,0.6,Tone,100,100,23,23,NN,FM,5,"NM Bernalillo Albuquerque, Sandia Crest W5CSY 145.33 OPEN On-Air"
406,"CSYalbuquerque,sandia crest",444,+,5,Tone,100,100,23,23,NN,FM,5,"NM Bernalillo Albuquerque, Sandia Crest W5CSY 444 OPEN On-Air"
407,0DKboulder,449.4,-,5,Tone,91.5,91.5,23,23,NN,FM,5,CO Boulder Boulder K0DK 449.4 OPEN Off-Air
408,0DSboulder,446.8625,-,5,,88.5,88.5,23,23,NN,DIG,5,CO Boulder Boulder KC0DS 446.8625 OPEN On-Air
409,"0SZboulder,mount thorodin",446.8,-,5,,88.5,88.5,23,23,NN,DIG,5,"CO Boulder Boulder, Mount Thorodin N0SZ 446.8 OPEN On-Air"
410,0DKboulder,1299.5,-,20,,88.5,88.5,23,23,NN,DIG,5,CO Boulder Boulder W0DK 1299.5 OPEN On-Air
411,0IAboulder,449.55,-,5,Tone,100,100,23,23,NN,FM,5,CO Boulder Boulder W0IA 449.55 OPEN On-Air
