Location,Name,Frequency,Duplex,Offset,Tone,rToneFreq,cToneFreq,DtcsCode,DtcsRxCode,DtcsPolarity,Mode,TStep,Comment
412,"LIEalbuquerque,northeast heights area",224.48,-,1.6,Tone,100,100,23,23,NN,FM,5,"NM Bernalillo Albuquerque, Northeast Heights area K6LIE 224.48 OPEN On-Air"
413,"QEQmoab,bald mesa",146.76,-,0.6,Tone,88.5,88.5,23,23,NN,FM,5,"UT Grand Moab, Bald Mesa K7QEQ 146.76 OPEN On-Air"
414,"QEQmoab,bald mesa",449.1,-,5,TSQL,107.2,107.2,23,23,NN,FM,5,"UT Grand Moab, Bald Mesa K7QEQ 449.1 OPEN On-Air"
415,0JZgoldhill,146.91,+,0.6,Cross,123,127.3,23,23,NN,FM,5,CO Boulder Gold Hill W0JZ 146.91 OPEN On-Air
416,5HDriorancho,145.37,-,0.6,Tone,162.2,162.2,23,23,NN,FM,5,NM Sandoval Rio Rancho NM5HD 145.37 OPEN On-Air
417,"ITSlukachukai,roof butte",145.25,-,0.6,Tone,100,100,23,23,NN,FM,5,"AZ Apache Lukachukai, Roof Butte KB5ITS 145.25 OPEN On-Air"
418,"5SJlukachukai,roof butte",146.82,-,0.6,Tone,100,100,23,23,NN,FM,5,"AZ Apache Lukachukai, Roof Butte NM5SJ 146.82 OPEN On-Air"
419,"BIQalbuquerque,bcfd fire station 35",145.13,-,0.6,TSQL,100,100,23,23,NN,FM,5,"NM Bernalillo Albuquerque, BCFD Fire Station 35 K5BIQ 145.13 OPEN On-Air"
420,0DSboulder,1283.8625,-,20,,88.5,88.5,23,23,NN,DIG,5,CO Boulder Boulder KC0DS 1283.8625 OPEN On-Air
421,0DSboulder,145.3875,-,0.6,,88.5,88.5,23,23,NN,DIG,5,CO Boulder Boulder KC0DS 145.3875 OPEN On-Air
422,AOXsandiapark,224.94,-,1.6,,88.5,88.5,23,23,NN,FM,5,NM Bernalillo Sandia Park W5AOX 224.94 OPEN Off-Air
423,AOXsandiapark,444.15,+,5,Tone,100,100,23,23,NN,FM,5,NM Bernalillo Sandia park W5AOX 444.15 OPEN On-Air
424,QIZalbuquerque,443.85,+,5,Tone,103.5,103.5,23,23,NN,FM,5,NM Bernalillo Albuquerque KC0QIZ 443.85 OPEN On-Air
425,"0SZboulder,lee hill",445.05,-,5,,88.5,88.5,23,23,NN,DIG,5,"CO Boulder Boulder, Lee Hill N0SZ 445.05 OPEN On-Air"
426,"0SZboulder,lee hill",446.9875,-,5,,88.5,88.5,23,23,NN,DIG,5,"CO Boulder Boulder, Lee Hill N0SZ 446.9875 OPEN On-Air"
427,"0SZboulder,lee hill",447.75,-,5,TSQL,141.3,141.3,23,23,NN,FM,5,"CO Boulder Boulder, Lee Hill N0SZ 447.75 OPEN On-Air"
428,"CRAboulder,eldorado mountain",145.46,-,0.6,TSQL,107.2,107.2,23,23,NN,FM,5,"CO Boulder Boulder, Eldorado Mountain W0CRA 145.46 OPEN On-Air"
429,"CRAboulder,eldorado mountain",447.975,-,5,TSQL,107.2,107.2,23,23,NN,FM,5,"CO Boulder Boulder, Eldorado Mountain W0CRA 447.975 OPEN On-Air"
430,"0IAboulder,lee hill",224.02,-,1.6,,88.5,88.5,23,23,NN,FM,5,"CO Boulder Boulder, Lee Hill W0IA 224.02 OPEN On-Air"
431,0DKboulder,146.73,-,0.6,TSQL,91.5,91.5,23,23,NN,FM,5,CO Boulder Boulder K0DK 146.73 OPEN Off-Air
432,UGUalbuquerque,223.9,-,1.6,,88.5,88.5,23,23,NN,FM,5,NM Bernalillo Albuquerque KB5UGU 223.9 OPEN On-Air
433,5SHalbuquerque,443.65,+,5,,88.5,88.5,23,23,NN,DIG,5,NM Bernalillo Albuquerque NM5SH 443.65 OPEN On-Air
434,JTMalbuquerque,224.58,-,1.6,Tone,100,100,23,23,NN,FM,5,NM Bernalillo Albuquerque KH6JTM 224.58 OPEN On-Air
435,LXPalbuquerque,147.32,+,0.6,Tone,100,100,23,23,NN,FM,5,NM Bernalillo Albuquerque K5LXP 147.32 OPEN On-Air
436,"0IAboulder,gunbarrel hill",146.76,-,0.6,Tone,100,100,23,23,NN,FM,5,"CO Boulder Boulder, Gunbarrel Hill W0IA 146.76 OPEN On-Air"
437,5XEalbuquerque,147.36,+,0.6,Tone,100,100,23,23,NN,FM,5,NM Bernalillo Albuquerque KB5XE 147.36 OPEN Off-Air
438,MHQalbuquerque,146.74,-,0.6,Tone,146.2,146.2,23,23,NN,FM,5,NM Bernalillo Albuquerque KD5MHQ 146.74 OPEN On-Air
439,"0HGallenspark,afpd station #5",147.03,+,0.6,Tone,100,100,23,23,NN,FM,5,"CO Boulder Allenspark, AFPD Station #5 KI0HG 147.03 OPEN On-Air"
440,MHGalbuquerque,147.465,,0,Tone,88.5,88.5,23,23,NN,FM,5,NM Bernalillo Albuquerque W5MHG 147.465 OPEN On-Air
441,"PRNalbuquerque,unm campus",442.525,+,5,Tone,100,100,23,23,NN,FM,5,"NM Bernalillo Albuquerque, UNM Campus K5PRN 442.525 OPEN On-Air"
442,5GUalbuquerque,147.38,+,0.6,,88.5,88.5,23,23,NN,FM,5,NM Bernalillo Albuquerque N5GU 147.38 OPEN On-Air
443,"5GUalbuquerque,southeast",444.6,+,5,,88.5,88.5,23,23,NN,DIG,5,"NM Bernalillo Albuquerque, Southeast N5GU 444.6 OPEN On-Air"
444,"FIQalbuquerque,northern sandia mountain top",442.45,+,5,TSQL,67,67,23,23,NN,FM,5,"NM Bernalillo Albuquerque, Northern Sandia Mountain Top K5FIQ 442.45 OPEN On-Air"
445,5XEalbuquerque,443.5,-,5,Tone,123,123,23,23,NN,FM,5,NM Bernalillo Albuquerque KE5XE 443.5 OPEN 
446,"SCAalbuquerque,sandia crest",145.01,,0,,88.5,88.5,23,23,NN,FM,5,"NM Bernalillo Albuquerque, Sandia Crest W5SCA 145.01 OPEN "
447,"IHLalbuquerque,sandia mnts",145.29,-,0.6,Tone,100,100,23,23,NN,FM,5,"NM Bernalillo Albuquerque, Sandia Mnts WA5IHL 145.29 OPEN On-Air"
448,ZXWalbuquerque,927.65,-,25,Tone,151.4,151.4,23,23,NN,FM,5,NM Bernalillo Albuquerque KC5ZXW 927.65 OPEN Off-Air
449,EZOalbuquerque,927.7,-,25,Tone,210.7,210.7,23,23,NN,FM,5,NM Bernalillo Albuquerque WB5EZO 927.7 OPEN Off-Air
450,UPScedarpoint,449.25,-,5,TSQL,123,123,23,23,NN,FM,5,CO Elbert Cedar Point K0UPS 449.25 OPEN On-Air
451,"ZXWalbuquerque,southeast",444.1,+,5,Tone,100,100,23,23,NN,FM,5,"NM Bernalillo Albuquerque, Southeast KC5ZXW 444.1 OPEN On-Air"
452,"FYLgrants,la mosca peak",444.95,+,5,Tone,100,100,23,23,NN,DIG,5,"NM Bernalillo Grants, La Mosca Peak KE5FYL 444.95 OPEN On-Air"
453,"5EMgrants,mt taylor",146.98,-,0.6,TSQL,141.3,141.3,23,23,NN,FM,5,"NM Cibola Grants, Mt Taylor NM5EM 146.98 OPEN On-Air"
454,"BIQtijeras,cedro peak",145.15,-,0.6,TSQL,100,100,23,23,NN,FM,5,"NM Bernalillo Tijeras, Cedro Peak K5BIQ 145.15 OPEN On-Air"
455,"5MLtijeras,cedro peak",147.34,+,0.6,Tone,67,67,23,23,NN,FM,5,"NM Bernalillo Tijeras, Cedro Peak NM5ML 147.34 OPEN On-Air"
456,"BIQalbuquerque,west mesa",442.05,+,5,TSQL,100,100,23,23,NN,FM,5,"NM Bernalillo Albuquerque, West Mesa K5BIQ 442.05 OPEN On-Air"
457,"WDVgallup,deza bluffs",448.2,-,5,Tone,100,100,23,23,NN,FM,5,"NM McKinley Gallup, Deza Bluffs KC5WDV 448.2 OPEN On-Air"
458,"5MLgallup,deza bluffs",147.22,+,0.6,Tone,67,67,23,23,NN,FM,5,"NM McKinley Gallup, Deza Bluffs NM5ML 147.22 OPEN On-Air"
459,"FIQalbuquerque,op ctr",146.9,-,0.6,Tone,67,67,23,23,NN,FM,5,"NM Bernalillo Albuquerque, Op Ctr K5FIQ 146.9 OPEN On-Air"
460,"FIQalbuquerque, op ctr",449.55,-,5,Tone,71.9,71.9,23,23,NN,FM,5,"NM Bernalillo Albuquerque,  Op Ctr K5FIQ 449.55 OPEN On-Air"
461,"FIQalbuquerque, op ctr",449.8,-,5,Tone,67,67,23,23,NN,FM,5,"NM Bernalillo Albuquerque,  Op Ctr K5FIQ 449.8 OPEN On-Air"
462,"URRalbuquerque,op center",449.45,-,5,,88.5,88.5,23,23,NN,DIG,5,"NM Bernalillo Albuquerque, Op Center W5URR 449.45 OPEN On-Air"
463,VJDhugo,447,-,5,Tone,103.5,103.5,23,23,NN,DIG,5,CO Lincoln Hugo KC0VJD 447 OPEN On-Air
464,IHLalbuquerque,442.25,+,5,,88.5,88.5,23,23,NN,DIG,5,NM Bernalillo Albuquerque WA5IHL 442.25 OPEN On-Air
465,"EKPgrants, mt taylor",146.94,-,0.6,Tone,100,100,23,23,NN,FM,5,"NM Cibola Grants,  Mt Taylor WB5EKP 146.94 OPEN On-Air"
466,0KCfortlupton,447.3,-,5,Tone,107.2,107.2,23,23,NN,FM,5,CO Weld Fort Lupton AC0KC 447.3 OPEN On-Air
467,0SJlochbuie,447.625,-,5,Tone,100,100,23,23,NN,FM,5,CO Adams Lochbuie KE0SJ 447.625 OPEN On-Air
468,QEQmoab,146.9,-,0.6,Tone,88.5,88.5,23,23,NN,FM,5,UT Grand Moab K7QEQ 146.9 OPEN On-Air
469,EPAlongmont,448.525,-,5,Tone,151.4,151.4,23,23,NN,FM,5,CO Boulder Longmont N0EPA 448.525 OPEN On-Air
470,ENOlongmont,147.27,+,0.6,TSQL,100,100,23,23,NN,FM,5,CO Boulder Longmont W0ENO 147.27 OPEN On-Air
471,ENOlongmont,448.8,-,5,TSQL,88.5,88.5,23,23,NN,FM,5,CO Boulder Longmont W0ENO 448.8 OPEN On-Air
472,"URRgrants,mw ridge",146.64,-,0.6,TSQL,67,67,23,23,NN,FM,5,"NM Bernalillo Grants, MW Ridge K5URR 146.64 OPEN On-Air"
473,0KCfortlupton,224.96,-,1.6,,88.5,88.5,23,23,NN,FM,5,CO Weld Fort Lupton AC0KC 224.96 OPEN On-Air
474,"CQHtijeras,raven road",146.72,-,0.6,Cross,100,127.3,23,23,NN,FM,5,"NM Bernalillo Tijeras, Raven Road K5CQH 146.72 OPEN On-Air"
475,"CQHtijeras,raven road",224,-,1.6,Tone,100,100,23,23,NN,FM,5,"NM Bernalillo Tijeras, Raven Road K5CQH 224 OPEN Off-Air"
476,0RGhudson,449.925,-,5,TSQL,114.8,114.8,23,23,NN,FM,5,CO Weld Hudson KD0RG 449.925 OPEN On-Air
477,"FIQclinescorners, tapia mesa",147.06,+,0.6,Tone,67,67,23,23,NN,FM,5,"NM San Miguel Clines Corners, Tapia Mesa K5FIQ 147.06 OPEN On-Air"
478,ERCalbuquerque,146.92,-,0.6,Tone,67,67,23,23,NN,FM,5,NM Bernalillo Albuquerque KF5ERC 146.92 OPEN Off-Air
479,"RTSgenoa,limon",446.7375,-,5,,88.5,88.5,23,23,NN,DIG,5,"CO Lincoln Genoa, Limon K0RTS 446.7375 OPEN On-Air"
480,0AEgenoa,147.06,+,0.6,Tone,103.5,103.5,23,23,NN,DIG,5,CO Lincoln Genoa KE0AE 147.06 OPEN On-Air
481,0FHestespark,146.685,-,0.6,Tone,123,123,23,23,NN,FM,5,CO Larimer Estes Park N0FH 146.685 OPEN On-Air
482,0FHestespark,449.8,-,5,Tone,123,123,23,23,NN,FM,5,CO Larimer Estes Park N0FH 449.8 OPEN On-Air
483,"0SWloma,baxter pass",447,-,5,Tone,107.2,107.2,23,23,NN,FM,5,"CO Garfield Loma, Baxter Pass KB0SW 447 OPEN On-Air"
484,B1Qisletapueblo,147.04,+,0.6,Tone,100,100,23,23,NN,FM,5,NM Bernalillo Isleta Pueblo AB1Q 147.04 OPEN Off-Air
485,"B1Qalbuquerque,isleta pueblo",442.15,+,5,Tone,100,100,23,23,NN,FM,5,"NM Bernalillo Albuquerque, Isleta Pueblo AB1Q 442.15 OPEN Off-Air"
486,"DEMpritchett, tator butte",146.64,-,0.6,TSQL,100,100,23,23,NN,FM,5,"CO Las Animas Pritchett,  Tator Butte KZ0DEM 146.64 OPEN Off-Air"
487,"WDVgallup,gibson peak",147.26,+,0.6,Tone,100,100,23,23,NN,FM,5,"NM McKinley Gallup, Gibson Peak KC5WDV 147.26 OPEN On-Air"
488,"EMOgrants,515 west high street",444.975,+,5,TSQL,67,67,23,23,NN,FM,5,"NM Cibola Grants, 515 West High Street K5EMO 444.975 OPEN On-Air"
489,FYLgrants,147.18,+,0.6,TSQL,100,100,23,23,NN,FM,5,NM Cibola Grants KE5FYL 147.18 OPEN On-Air
490,"FYLgrants,rogers rock",444.65,+,5,,88.5,88.5,23,23,NN,DIG,5,"NM Bernalillo Grants, Rogers Rock KE5FYL 444.65 OPEN On-Air"
491,"5MLgrants,microwave ridge",146.66,-,0.6,Tone,100,100,23,23,NN,FM,5,"NM Cibola Grants, Microwave Ridge NM5ML 146.66 OPEN On-Air"
492,"5MLgrants,la mosca",444.8,+,5,Tone,67,67,23,23,NN,FM,5,"NM Cibola Grants, La Mosca NM5ML 444.8 OPEN On-Air"
493,VJJsteamboatsprings,147.165,+,0.6,Cross,88.5,123,23,23,NN,FM,5,CO Routt Steamboat Springs KB0VJJ 147.165 OPEN On-Air
494,VJJsteamboatsprings,449.625,-,5,TSQL,123,123,23,23,NN,FM,5,CO Routt Steamboat Springs KB0VJJ 449.625 OPEN On-Air
495,D0Hsteamboatsprings,147.21,+,0.6,TSQL,107.2,107.2,23,23,NN,FM,5,CO Routt Steamboat Springs KD0H 147.21 OPEN On-Air
496,"VPZmcintosh,mcintosh post office west",447.275,-,5,TSQL,71.9,71.9,23,23,NN,FM,5,"NM Torrance McIntosh, McIntosh Post office west KB5VPZ 447.275 OPEN On-Air"
497,VJYalbuquerque,223.82,-,1.6,,88.5,88.5,23,23,NN,FM,5,NM Bernalillo Albuquerque WA5VJY 223.82 OPEN Off-Air
498,WDVgallup,449.75,-,5,Tone,100,100,23,23,NN,FM,5,NM McKinley Gallup KC5WDV 449.75 OPEN On-Air
499,"LRAloveland,namaqua hill",147.195,+,0.6,Tone,100,100,23,23,NN,FM,5,"CO Larimer Loveland, Namaqua Hill W0LRA 147.195 OPEN On-Air"
500,HLLmexicanhat,449.9,-,5,Tone,123,123,23,23,NN,FM,5,UT San Juan Mexican Hat KD7HLL 449.9 OPEN On-Air
501,CULloslunas,442.225,+,5.1,,88.5,88.5,23,23,NN,FM,5,NM Valencia Los Lunas N5CUL 442.225 OPEN Off-Air
502,TSVloslunas,444.125,+,5,Tone,100,100,23,23,NN,FM,5,NM Valencia Los Lunas WA5TSV 444.125 OPEN On-Air
503,6VVloveland,224.32,-,1.6,TSQL,100,100,23,23,NN,FM,5,CO Larimer Loveland KN6VV 224.32 OPEN Off-Air
504,"LRAloveland,namaqua hill",449.575,-,5,Tone,100,100,23,23,NN,FM,5,"CO Larimer Loveland, Namaqua Hill W0LRA 449.575 OPEN On-Air"
505,LENwindowrock,145.29,-,0.6,Tone,123,123,23,23,NN,FM,5,NM McKinley Window Rock K7LEN 145.29 OPEN Off-Air
506,"UPSloveland,budweiser event center",448.025,-,5,TSQL,100,100,23,23,NN,DIG,5,"CO Larimer Loveland, Budweiser Event Center W0UPS 448.025 OPEN On-Air"
507,0HHlamar,146.61,-,0.6,TSQL,123,123,23,23,NN,FM,5,CO Prowers Lamar KC0HH 146.61 OPEN On-Air
508,0HHlamar,449.5,-,5,Tone,123,123,23,23,NN,FM,5,CO Prowers Lamar KC0HH 449.5 OPEN On-Air
509,DEMspringfield,147.09,+,0.6,TSQL,118.8,118.8,23,23,NN,FM,5,CO Baca Springfield KZ0DEM 147.09 OPEN 
510,DEMspringfield,147.33,+,0.6,TSQL,118.8,118.8,23,23,NN,FM,5,CO Baca Springfield KZ0DEM 147.33 OPEN Off-Air
511,DEMspringfield,449.2,-,5,TSQL,118.8,118.8,23,23,NN,FM,5,CO Baca Springfield KZ0DEM 449.2 OPEN On-Air
512,VJJcraig,146.97,-,0.6,Cross,88.5,123,23,23,NN,FM,5,CO Moffat Craig KB0VJJ 146.97 OPEN On-Air
513,HAMcraig,145.265,-,0.6,Tone,107.2,107.2,23,23,NN,FM,5,CO Moffat Craig WD0HAM 145.265 OPEN 
514,"5MLconchasdam, mesa rica",147.36,+,0.6,Tone,100,100,23,23,NN,FM,5,"NM San Miguel Conchas Dam, Mesa Rica NM5ML 147.36 OPEN On-Air"
515,7RFfortcollins,447.725,-,5,Tone,131.8,131.8,23,23,NN,FM,5,CO Larimer Fort Collins W7RF 447.725 OPEN On-Air
516,1TJfortcollins,1283.55,-,20,Tone,100,100,23,23,NN,FM,5,CO Larimer Fort Collins K1TJ 1283.55 OPEN On-Air
517,RBTfortcollins,447.45,-,5,Tone,123,123,23,23,NN,FM,5,CO Larimer Fort Collins KC0RBT 447.45 OPEN On-Air
518,AOLfortcollins,446.7375,-,5,,88.5,88.5,23,23,NN,DIG,5,CO Larimer Fort Collins N0AOL 446.7375 OPEN On-Air
519,"0SFfortcollins, horsetooth mountain",927.825,-,25,TSQL,100,100,23,23,NN,FM,5,"CO Larimer Fort Collins, Horsetooth Mountain AB0SF 927.825 OPEN On-Air"
520,"1TJfortcollins, horsetooth mountain",927.95,-,25,TSQL,100,100,23,23,NN,FM,5,"CO Larimer Fort Collins, Horsetooth Mountain K1TJ 927.95 OPEN On-Air"
521,"UPSfortcollins, horsetooth mountain",145.115,-,0.6,TSQL,100,100,23,23,NN,FM,5,"CO Larimer Fort Collins, Horsetooth Mountain W0UPS 145.115 OPEN On-Air"
522,"UPSfortcollins, horsetooth mountain",224.52,-,1.6,TSQL,100,100,23,23,NN,FM,5,"CO Larimer Fort Collins, Horsetooth Mountain W0UPS 224.52 OPEN Off-Air"
523,"UPSfortcollins, horsetooth mountain",447.275,-,5,TSQL,100,100,23,23,NN,FM,5,"CO Larimer Fort Collins, Horsetooth Mountain W0UPS 447.275 OPEN On-Air"
524,"PFJfortcollins, horsetooth mountain",446.75,-,5,,88.5,88.5,23,23,NN,DIG,5,"CO Larimer Fort Collins, Horsetooth Mountain K7PFJ 446.75 OPEN On-Air"
525,"VGDfortcollins , horsetooth mountain",145.265,-,0.6,,88.5,88.5,23,23,NN,DIG,5,"CO Larimer Fort Collins , Horsetooth Mountain KB0VGD 145.265 OPEN On-Air"
526,"0OJgreeley,unc",449.725,-,5,Tone,127.3,127.3,23,23,NN,FM,5,"CO Weld Greeley, UNC K0OJ 449.725 OPEN On-Air"
527,"UPSgreeley,unc",146.85,-,0.6,TSQL,100,100,23,23,NN,FM,5,"CO Weld Greeley, UNC W0UPS 146.85 OPEN On-Air"
528,"ZUQfortcollins, christ mountain",449.425,-,5,Tone,94.8,94.8,23,23,NN,FM,5,"CO Larimer Fort Collins, Christ Mountain N0ZUQ 449.425 OPEN On-Air"
529,"ZUQfortcollins, christ mountain",927.875,-,25,DTCS,88.5,88.5,114,114,NN,FM,5,"CO Larimer Fort Collins, Christ Mountain N0ZUQ 927.875 OPEN Off-Air"
530,KWDgreeley,147,+,0.6,TSQL,100,100,23,23,NN,DIG,5,CO Weld Greeley KC0KWD 147 OPEN On-Air
531,KWDgreeley,448.475,-,5,Tone,100,100,23,23,NN,FM,5,CO Weld Greeley KC0KWD 448.475 OPEN On-Air
532,AENgreeley,449.325,-,5,Tone,136.5,136.5,23,23,NN,DIG,5,CO Weld Greeley WR0AEN 449.325 OPEN On-Air
533,"5EMsantarosa, moon ranch",147.04,+,0.6,Tone,141.3,141.3,23,23,NN,FM,5,"NM Guadalupe Santa Rosa, Moon Ranch NM5EM 147.04 OPEN On-Air"
534,"QEYfortcollins, csu durward hall",147.36,+,0.6,TSQL,100,100,23,23,NN,FM,5,"CO Larimer Fort Collins, CSU Durward Hall W0QEY 147.36 OPEN On-Air"
535,"DMRfortcollins, timnath",147.39,+,0.6,,88.5,88.5,23,23,NN,DIG,5,"CO Larimer Fort Collins, Timnath W0DMR 147.39 OPEN On-Air"
536,"0SZrangely,cathedral bluffs",445.2625,-,5,,88.5,88.5,23,23,NN,DIG,5,"CO Rio Blanco Rangely, Cathedral Bluffs N0SZ 445.2625 OPEN On-Air"
537,boisecity,147.35,+,0.6,TSQL,88.5,88.5,23,23,NN,FM,5,OK Cimarron Boise City  147.35 OPEN On-Air
538,"0FTfortmorgan, fort morgan eoc",448.2,-,5,,88.5,88.5,23,23,NN,DIG,5,"CO Morgan Fort Morgan, Fort Morgan EOC W0FT 448.2 OPEN On-Air"
539,EMAtucumcari,146.88,-,0.6,,88.5,88.5,23,23,NN,FM,5,NM Quay Tucumcari WA5EMA 146.88 OPEN On-Air
540,EMAtucumcari,224.98,-,1.6,,88.5,88.5,23,23,NN,FM,5,NM Quay Tucumcari WA5EMA 224.98 OPEN 
541,EMAtucumcari,443.75,+,5,,88.5,88.5,23,23,NN,FM,5,NM Quay Tucumcari WA5EMA 443.75 OPEN On-Air
542,SARzuni,145.43,-,0.6,Tone,162.2,162.2,23,23,NN,FM,5,NM McKinley Zuni KD5SAR 145.43 OPEN On-Air
543,"DSTlogan,ute lake",147.34,+,0.6,Tone,131.8,131.8,23,23,NN,FM,5,"NM Quay Logan, Ute Lake K5DST 147.34 OPEN On-Air"
544,"5MLtucumcari,tucumcari mountain",147.22,+,0.6,Tone,100,100,23,23,NN,FM,5,"NM Quay Tucumcari, Tucumcari Mountain NM5ML 147.22 OPEN On-Air"
545,0AEstratton,146.895,-,0.6,Tone,103.5,103.5,23,23,NN,FM,5,CO Kit Carson Stratton KE0AE 146.895 OPEN On-Air
546,"BARvernal,uintah county eoc",449.9,-,5,Tone,136.5,136.5,23,23,NN,FM,5,"UT Uintah Vernal, Uintah County EOC W7BAR 449.9 OPEN "
547,BYUroosevelt,146.92,-,0.6,Tone,136.5,136.5,23,23,NN,FM,5,UT Duchesne Roosevelt W7BYU 146.92 OPEN Off-Air
548,BYUvernal,449.7,-,5,Tone,136.5,136.5,23,23,NN,FM,5,UT Uintah Vernal W7BYU 449.7 OPEN 
549,"BARvernal,blue mountain",147.1,+,0.6,Tone,136.5,136.5,23,23,NN,FM,5,"UT Uintah Vernal, Blue Mountain W7BAR 147.1 OPEN On-Air"
550,0FTakron,448.175,-,5,,88.5,88.5,23,23,NN,DIG,5,CO Morgan Akron W0FT 448.175 OPEN On-Air
551,VJJakron,145.4,-,0.6,Cross,88.5,123,23,23,NN,FM,5,CO Washington Akron KB0VJJ 145.4 OPEN On-Air
552,"SDCsunnyside,bruin point",147.32,+,0.6,Tone,88.5,88.5,23,23,NN,FM,5,"UT Carbon Sunnyside, Bruin Point K7SDC 147.32 OPEN On-Air"
553,"SDCsunnyside,bruin point",449.05,-,5,Tone,88.5,88.5,23,23,NN,FM,5,"UT Carbon Sunnyside, Bruin Point K7SDC 449.05 OPEN On-Air"
554,"X7Ysunnyside, bruin peak",145.175,-,0.6,,88.5,88.5,23,23,NN,FM,5,"UT Carbon Sunny Side, Bruin Peak WX7Y 145.175 OPEN On-Air"
555,"BYUmyton,flat top",145.49,-,0.6,Tone,136.5,136.5,23,23,NN,FM,5,"UT Duchesne Myton, Flat Top W7BYU 145.49 OPEN On-Air"
556,7ZWaltamont,147.28,+,0.6,TSQL,107.2,107.2,23,23,NN,FM,5,UT Duchesne Altamont AD7ZW 147.28 OPEN On-Air
557,CBSaltamont,146.74,-,0.6,Tone,100,100,23,23,NN,FM,5,UT Duchesne Altamont WB7CBS 146.74 OPEN Off-Air
558,ARZholbrook,146.68,-,0.6,,88.5,88.5,23,23,NN,FM,5,AZ Navajo Holbrook KA7ARZ 146.68 OPEN On-Air
