Location,Name,Frequency,Duplex,Offset,Tone,rToneFreq,cToneFreq,DtcsCode,DtcsRxCode,DtcsPolarity,Mode,TStep,Comment
422,"FOPriverton,griffey hill",145.115,-,0.6,Tone,100,100,23,23,NN,FM,5,"WY Fremont Riverton, Griffey Hill K0FOP 145.115 OPEN On-Air"
423,"HYFriverton,griffy hill",449.975,-,5,Tone,127.3,127.3,23,23,NN,FM,5,"WY Fremont Riverton, Griffy Hill N7HYF 449.975 OPEN On-Air"
424,"DMOriverton,griffy hill",441.67,+,5,,88.5,88.5,23,23,NN,DIG,5,"WY Fremont Riverton, Griffy Hill N7DMO 441.67 OPEN On-Air"
425,OQAgardencity,146.91,-,0.6,TSQL,141.3,141.3,23,23,NN,FM,5,KS Finney Garden City WA0OQA 146.91 OPEN On-Air
426,ECTulysses,147.06,+,0.6,,88.5,88.5,23,23,NN,FM,5,KS Grant Ulysses K0ECT 147.06 OPEN On-Air
