Location,Name,Frequency,Duplex,Offset,Tone,rToneFreq,cToneFreq,DtcsCode,DtcsRxCode,DtcsPolarity,Mode,TStep,Comment
208,VJJvail,147.345,+,0.6,Cross,88.5,123,23,23,NN,FM,5,CO Eagle Vail KB0VJJ 147.345 OPEN On-Air
209,0SZvail,445.075,-,5,,88.5,88.5,23,23,NN,DIG,5,CO Eagle Vail N0SZ 445.075 OPEN On-Air
210,A0Lcoloradosprings,147.135,+,0.6,Tone,100,100,23,23,NN,FM,5,CO El Paso Colorado Springs AA0L 147.135 OPEN On-Air
211,coloradosprings,147.27,+,0.6,,88.5,88.5,23,23,NN,FM,5,CO El Paso Colorado Springs  147.27 OPEN On-Air
212,IRPcoloradosprings,146.91,-,0.6,TSQL,151.4,151.4,23,23,NN,FM,5,CO El Paso Colorado Springs K0IRP 146.91 OPEN On-Air
213,MOGcoloradosprings,147.39,+,0.6,Tone,103.5,103.5,23,23,NN,FM,5,CO El Paso Colorado Springs W0MOG 147.39 OPEN On-Air
214,RSHcoloradosprings,146.85,-,0.6,Tone,103.5,103.5,23,23,NN,FM,5,CO El Paso Colorado Springs W0RSH 146.85 OPEN On-Air
215,coloradosprings,449.575,-,5,,88.5,88.5,23,23,NN,FM,5,CO El Paso Colorado Springs  449.575 CLOSED On-Air
216,A0Lcoloradosprings,448.3,-,5,Tone,100,100,23,23,NN,FM,5,CO El Paso Colorado Springs AA0L 448.3 OPEN On-Air
217,IRPcoloradosprings,447.35,-,5,Tone,151.4,151.4,23,23,NN,FM,5,CO El Paso Colorado Springs K0IRP 447.35 OPEN On-Air
218,SRJcoloradosprings,224.06,-,1.6,,88.5,88.5,23,23,NN,FM,5,CO El Paso Colorado Springs KB0SRJ 224.06 CLOSED 
219,0WFcoloradosprings,447.025,-,5,Tone,123,123,23,23,NN,FM,5,CO El Paso Colorado Springs KF0WF 447.025 OPEN Off-Air
220,"0KGcoloradosprings, broadmoor area",448.25,-,5,Tone,123,123,23,23,NN,FM,5,"CO El Paso Colorado Springs, Broadmoor Area N0KG 448.25 OPEN Off-Air"
221,X0Gcoloradosprings,447.475,-,5,Tone,107.2,107.2,23,23,NN,FM,5,CO El Paso Colorado Springs NX0G 447.475 OPEN 
222,MOGcoloradosprings,448.6,-,5,Tone,114.8,114.8,23,23,NN,FM,5,CO El Paso Colorado Springs W0MOG 448.6 OPEN 
223,MOGcoloradosprings,927.8,-,25,DTCS,88.5,88.5,116,116,NN,FM,5,CO Teller Colorado Springs W0MOG 927.8 OPEN On-Air
224,IFIcoloradosprings,447.55,-,5,Tone,123,123,23,23,NN,FM,5,CO El Paso Colorado Springs WA6IFI 447.55 OPEN On-Air
225,"SRJcoloradosprings, pikes peak",146.97,-,0.6,Cross,100,123,23,23,NN,FM,5,"CO El Paso Colorado Springs, Pikes Peak KB0SRJ 146.97 OPEN On-Air"
226,"SRJcoloradosprings, pikes peak",448.45,-,5,Tone,100,100,23,23,NN,FM,5,"CO El Paso Colorado Springs, Pikes Peak KB0SRJ 448.45 OPEN On-Air"
227,"VJJleadville,mosquito pass",145.445,-,0.6,Tone,88.5,88.5,23,23,NN,FM,5,"CO Lake Leadville, Mosquito Pass KB0VJJ 145.445 OPEN On-Air"
228,"UFOfairplay,sacramento mountain",447.125,-,5,TSQL,103.5,103.5,23,23,NN,FM,5,"CO Park Fairplay, Sacramento Mountain KC0UFO 447.125 OPEN On-Air"
229,D0Hsteamboatsprings,147.21,+,0.6,TSQL,107.2,107.2,23,23,NN,FM,5,CO Routt Steamboat Springs KD0H 147.21 OPEN On-Air
230,VJJsteamboatsprings,147.165,+,0.6,Cross,88.5,123,23,23,NN,FM,5,CO Routt Steamboat Springs KB0VJJ 147.165 OPEN On-Air
231,VJJsteamboatsprings,449.625,-,5,TSQL,123,123,23,23,NN,FM,5,CO Routt Steamboat Springs KB0VJJ 449.625 OPEN On-Air
232,"0SZleadville,mosquito pass",445.05,-,5,,88.5,88.5,23,23,NN,DIG,5,"CO Lake Leadville, Mosquito Pass N0SZ 445.05 OPEN On-Air"
233,"0SZfairplay,badger",446.7625,-,5,,88.5,88.5,23,23,NN,DIG,5,"CO Park Fairplay, Badger N0SZ 446.7625 OPEN On-Air"
234,7AFwheatland,224.68,-,1.6,,88.5,88.5,23,23,NN,FM,5,WY Platte Wheatland AE7AF 224.68 OPEN On-Air
235,SNUwheatland,146.88,-,0.6,TSQL,100,100,23,23,NN,FM,5,WY Platte Wheatland WA7SNU 146.88 OPEN On-Air
236,SNUwheatland,449.625,-,5,Tone,151.4,151.4,23,23,NN,FM,5,WY Platte Wheatland WA7SNU 449.625 OPEN On-Air
237,"TTFcoloradosprings, fillmore hill",448.725,-,5,Tone,123,123,23,23,NN,FM,5,"CO El Paso Colorado Springs, Fillmore Hill KA0TTF 448.725 OPEN On-Air"
238,KAVscottsbluff,444.825,+,5,,88.5,88.5,23,23,NN,FM,5,NE Scotts Bluff Scottsbluff W0KAV 444.825 OPEN On-Air
239,BQMscottsbluff,145.475,-,0.6,,88.5,88.5,23,23,NN,FM,5,NE Scotts Bluff Scottsbluff WD0BQM 145.475 OPEN On-Air
240,VJDhugo,447,-,5,Tone,103.5,103.5,23,23,NN,DIG,5,CO Lincoln Hugo KC0VJD 447 OPEN On-Air
241,"PFJcoloradosprings, almagre mountain",446.95,-,5,,88.5,88.5,23,23,NN,DIG,5,"CO Teller Colorado Springs, Almagre Mountain K7PFJ 446.95 OPEN On-Air"
242,"IFIcoloradosprings, almagre mountain",927.725,-,25,DTCS,88.5,88.5,114,114,NN,FM,5,"CO Teller Colorado Springs, Almagre Mountain WA6IFI 927.725 OPEN On-Air"
243,"0SPcoloradosprings, almagre mountain",147.18,+,0.6,Tone,100,100,23,23,NN,FM,5,"CO El Paso Colorado Springs, Almagre Mountain AA0SP 147.18 PRIVATE On-Air"
244,BQMmitchell,445.1,,0,TSQL,100,100,23,23,NN,FM,5,NE Scotts Bluff Mitchell WD0BQM 445.1 OPEN On-Air
245,"VJJcoloradosprings, cheyenne mountain",145.13,-,0.6,Cross,88.5,123,23,23,NN,FM,5,"CO El Paso Colorado Springs, Cheyenne Mountain KB0VJJ 145.13 OPEN On-Air"
246,"CVUcoloradosprings, cheyenne mountain",446.9125,-,5,,88.5,88.5,23,23,NN,DIG,5,"CO El Paso Colorado Springs, Cheyenne Mountain KC0CVU 446.9125 OPEN On-Air"
247,"CVUcoloradosprings, cheyenne mountain",927.85,-,25,DTCS,88.5,88.5,114,114,NN,FM,5,"CO Teller Colorado Springs, Cheyenne Mountain KC0CVU 927.85 OPEN On-Air"
248,"0SZcoloradosprings, cheyenne mountain",445.0625,-,5,,88.5,88.5,23,23,NN,DIG,5,"CO El Paso Colorado Springs, Cheyenne Mountain N0SZ 445.0625 OPEN Off-Air"
249,"IFIcoloradosprings, cheyenne mountain",53.13,-,1.7,TSQL,107.2,107.2,23,23,NN,FM,5,"CO El Paso Colorado Springs, Cheyenne Mountain WA6IFI 53.13 OPEN On-Air"
250,"CVUcoloradosprings, cheyenne mountain",145.375,-,0.6,,88.5,88.5,23,23,NN,DIG,5,"CO El Paso Colorado Springs, Cheyenne Mountain KC0CVU 145.375 OPEN Off-Air"
251,"ZSNleadville,quail mountain",147.24,+,0.6,TSQL,156.7,156.7,23,23,NN,FM,5,"CO Lake Leadville, Quail Mountain N0ZSN 147.24 OPEN Off-Air"
252,"CVUcoloradosprings, cheyenne mountain",146.76,-,0.6,TSQL,107.2,107.2,23,23,NN,FM,5,"CO El Paso Colorado Springs, Cheyenne Mountain KC0CVU 146.76 OPEN On-Air"
253,"CVUcoloradosprings, cheyenne mountain",147.345,+,0.6,TSQL,107.2,107.2,23,23,NN,FM,5,"CO El Paso Colorado Springs, Cheyenne Mountain KC0CVU 147.345 OPEN On-Air"
254,"CVUcoloradosprings, cheyenne mountain",448,-,5,Tone,107.2,107.2,23,23,NN,FM,5,"CO El Paso Colorado Springs, Cheyenne Mountain KC0CVU 448 OPEN On-Air"
255,"CVUcoloradosprings, cheyenne mountain",448.1,-,5,TSQL,107.2,107.2,23,23,NN,FM,5,"CO El Paso Colorado Springs, Cheyenne Mountain KC0CVU 448.1 OPEN On-Air"
256,"CRAcoloradosprings, cheyenne mountain",145.16,-,0.6,TSQL,107.2,107.2,23,23,NN,FM,5,"CO El Paso Colorado Springs, Cheyenne Mountain W0CRA 145.16 OPEN On-Air"
257,NEBscottsbluff,147.075,+,0.6,,88.5,88.5,23,23,NN,FM,5,NE Scotts Bluff Scottsbluff N0NEB 147.075 OPEN On-Air
258,G0Nscottsbluff,146.445,,0,TSQL,88.5,88.5,23,23,NN,FM,5,NE Scotts Bluff Scottsbluff AG0N 146.445 OPEN On-Air
259,X0Gcripplecreek,147.015,+,0.6,Tone,107.2,107.2,23,23,NN,FM,5,CO Teller Cripple Creek NX0G 147.015 OPEN On-Air
260,WDFcripplecreek,1287.7,-,20,Tone,67,67,23,23,NN,FM,5,CO Teller Cripple Creek WB0WDF 1287.7 OPEN Testing
261,WDFcripplecreek,145.46,-,0.6,Tone,67,67,23,23,NN,FM,5,CO Teller Cripple Creek WB0WDF 145.46 OPEN On-Air
262,WDFcripplecreek,224.94,-,1.6,Tone,67,67,23,23,NN,FM,5,CO Teller Cripple Creek WB0WDF 224.94 OPEN Testing
263,WDFcripplecreek,447.4,-,5,Tone,67,67,23,23,NN,FM,5,CO Teller Cripple Creek WB0WDF 447.4 OPEN On-Air
264,SRJcoloradosprings,145.265,-,0.6,TSQL,100,100,23,23,NN,DIG,5,CO El Paso Colorado Springs KB0SRJ 145.265 OPEN Off-Air
265,"SRJcoloradosprings, uccs",448.8,-,5,TSQL,100,100,23,23,NN,DIG,5,"CO El Paso Colorado Springs, UCCS KB0SRJ 448.8 OPEN Off-Air"
266,FSXpunkincenter,449.9,-,5,Tone,107.2,107.2,23,23,NN,FM,5,CO Lincoln Punkin Center N1FSX 449.9 OPEN On-Air
267,Z0Nhartsel,448.575,-,5,TSQL,103.5,103.5,23,23,NN,FM,5,CO Park Hartsel WZ0N 448.575 OPEN Off-Air
268,"GCRrawlins,elk mountain",147.24,+,0.6,Tone,100,100,23,23,NN,FM,5,"WY Carbon Rawlins, Elk Mountain N7GCR 147.24 OPEN On-Air"
269,JUNholyoke,146.955,-,0.6,,88.5,88.5,23,23,NN,FM,5,CO Phillips Holyoke N0JUN 146.955 OPEN 
270,"WDFcanoncity, eightmile mountain",449,-,5,TSQL,67,67,23,23,NN,FM,5,"CO Fremont Canon City, eightmile Mountain WB0WDF 449 OPEN On-Air"
271,0AEstratton,146.895,-,0.6,Tone,103.5,103.5,23,23,NN,FM,5,CO Kit Carson Stratton KE0AE 146.895 OPEN On-Air
272,"JSCcanoncity, canon city",449.975,-,5,TSQL,100,100,23,23,NN,FM,5,"CO Fremont Canon City, Canon City K0JSC 449.975 OPEN On-Air"
273,"JSCcanoncity, fremont peak",446.7375,-,5,,88.5,88.5,23,23,NN,DIG,5,"CO Fremont Canon City, Fremont Peak K0JSC 446.7375 OPEN On-Air"
274,"JSCcanoncity, fremont peak",447.25,-,5,TSQL,100,100,23,23,NN,FM,5,"CO Fremont Canon City, Fremont Peak K0JSC 447.25 OPEN On-Air"
275,"TUCcanoncity, fremont peak",927.7,-,25,DTCS,88.5,88.5,114,114,NN,FM,5,"CO Fremont Canon City, Fremont Peak KB0TUC 927.7 OPEN On-Air"
276,"WDFcanoncity, fremont peak",53.03,-,1.7,TSQL,88.5,88.5,23,23,NN,FM,5,"CO Fremont Canon City, Fremont Peak WB0WDF 53.03 OPEN On-Air"
277,"EKRcanoncity, fremont peak",145.49,-,0.6,TSQL,103.5,103.5,23,23,NN,FM,5,"CO Fremont Canon City, Fremont Peak WD0EKR 145.49 OPEN On-Air"
278,"EKRcanoncity, fremont peak",223.96,-,1.6,TSQL,103.5,103.5,23,23,NN,FM,5,"CO Fremont Canon City, Fremont Peak WD0EKR 223.96 OPEN On-Air"
279,"EKRcanoncity, fremont peak",447.75,-,5,TSQL,103.5,103.5,23,23,NN,FM,5,"CO Fremont Canon City, Fremont Peak WD0EKR 447.75 OPEN On-Air"
280,"JSCcanoncity, colorado",447.975,-,5,TSQL,100,100,23,23,NN,FM,5,"CO Fremont Canon City, Colorado K0JSC 447.975 OPEN On-Air"
281,"D0Qpueblo,baculite mesa",146.79,-,0.6,Tone,88.5,88.5,23,23,NN,FM,5,"CO Pueblo Pueblo, Baculite Mesa ND0Q 146.79 OPEN On-Air"
282,"D0Qpueblo,baculite mesa",224.26,-,1.6,Tone,88.5,88.5,23,23,NN,FM,5,"CO Pueblo Pueblo, Baculite Mesa ND0Q 224.26 OPEN Off-Air"
283,D0Qpueblo,447.95,-,5,Tone,88.5,88.5,23,23,NN,FM,5,CO Pueblo Pueblo ND0Q 447.95 OPEN On-Air
284,"0VQaspen,aspen mountain",447.05,-,5,TSQL,136.5,136.5,23,23,NN,FM,5,"CO Pitkin Aspen, Aspen Mountain K0VQ 447.05 OPEN On-Air"
285,LSDnathrop,146.745,-,0.6,Tone,100,100,23,23,NN,FM,5,CO Chaffee Nathrop W0LSD 146.745 OPEN Off-Air
286,"0VQcarbondale,missouri heights",447.15,-,5,Tone,136.5,136.5,23,23,NN,FM,5,"CO Garfield Carbondale, Missouri Heights K0VQ 447.15 OPEN On-Air"
287,0CLsnowmassvillage,146.67,-,0.6,Tone,107.2,107.2,23,23,NN,FM,5,CO Pitkin Snowmass Village K0CL 146.67 OPEN On-Air
288,"E0Zpueblo,csu",147,+,0.6,,88.5,88.5,23,23,NN,FM,5,"CO Pueblo Pueblo, CSU NE0Z 147 PRIVATE On-Air"
289,JSCpueblowest,448.975,-,5,TSQL,100,100,23,23,NN,FM,5,CO Pueblo Pueblo West K0JSC 448.975 OPEN On-Air
290,"QPGsalida,methodist mountain",446.975,-,5,,88.5,88.5,23,23,NN,DIG,5,"CO Chaffee Salida, Methodist Mountain KD0QPG 446.975 OPEN On-Air"
291,"0SZsalida,methodist mountain",446.8125,-,5,,88.5,88.5,23,23,NN,DIG,5,"CO Chaffee Salida, Methodist Mountain N0SZ 446.8125 OPEN On-Air"
292,VJJcraig,146.97,-,0.6,Cross,88.5,123,23,23,NN,FM,5,CO Moffat Craig KB0VJJ 146.97 OPEN On-Air
293,HAMcraig,145.265,-,0.6,Tone,107.2,107.2,23,23,NN,FM,5,CO Moffat Craig WD0HAM 145.265 OPEN 
294,VHZalliance,147.015,+,0.6,,88.5,88.5,23,23,NN,FM,5,NE Box Butte Alliance N2VHZ 147.015 OPEN On-Air
295,"0STpueblo,pueblo",146.655,-,0.6,Tone,123,123,23,23,NN,FM,5,"CO Pueblo Pueblo, Pueblo K0ST 146.655 OPEN On-Air"
296,"0KRpueblo,pueblo",447.7,-,5,TSQL,210.7,210.7,23,23,NN,DIG,5,"CO Pueblo Pueblo, Pueblo KF0KR 447.7 PRIVATE Off-Air"
297,PWZpalmerdivide,449.725,-,5,Tone,100,100,23,23,NN,FM,5,CO El Paso Palmer Divide N0PWZ 449.725 OPEN On-Air
298,D0Qpueblo,145.115,-,0.6,Tone,88.5,88.5,23,23,NN,FM,5,CO Pueblo Pueblo ND0Q 145.115 OPEN Off-Air
299,"D0Qpueblo,deer peak",146.88,-,0.6,Tone,88.5,88.5,23,23,NN,FM,5,"CO Pueblo Pueblo, Deer Peak ND0Q 146.88 OPEN On-Air"
300,"0VQglenwoodsprings, three mile ridge",147.3,+,0.6,Tone,107.2,107.2,23,23,NN,FM,5,"CO Garfield Glenwood Springs, Three Mile Ridge K0VQ 147.3 OPEN Off-Air"
301,I0Gglenwoodsprings,224.02,-,1.6,,88.5,88.5,23,23,NN,FM,5,CO Garfield Glenwood Springs KI0G 224.02 CLOSED 
302,I0Gglenwoodsprings,447.6,-,5,,88.5,88.5,23,23,NN,FM,5,CO Garfield Glenwood Springs KI0G 447.6 CLOSED 
303,NEBalliance,146.715,-,0.6,TSQL,103.5,103.5,23,23,NN,FM,5,NE Box Butte Alliance N0NEB 146.715 OPEN On-Air
304,"HNDglenwoodsprings, lookout mountain",449.85,-,5,TSQL,131.8,131.8,23,23,NN,FM,5,"CO Garfield Glenwood Springs, Lookout Mountain WA4HND 449.85 OPEN On-Air"
305,JSCpueblo,446.9875,-,5,,88.5,88.5,23,23,NN,DIG,5,CO Pueblo Pueblo K0JSC 446.9875 OPEN Off-Air
306,"JSCpueblo,metro",447.275,-,5,TSQL,100,100,23,23,NN,FM,5,"CO Pueblo Pueblo, Metro K0JSC 447.275 OPEN On-Air"
307,J0Tpueblo,147.24,+,0.6,Tone,103.5,103.5,23,23,NN,FM,5,CO Pueblo Pueblo KJ0T 147.24 OPEN Off-Air
308,"VJJsalida,methodist mountain",147.285,+,0.6,Cross,88.5,123,23,23,NN,FM,5,"CO Chaffee Salida, Methodist Mountain KB0VJJ 147.285 OPEN On-Air"
309,"CVUsalida,methodist mountain",145.295,-,0.6,Tone,107.2,107.2,23,23,NN,FM,5,"CO Chaffee Salida, Methodist Mountain KC0CVU 145.295 OPEN On-Air"
310,"CVUsalida,methodist mountain",449.65,-,5,Tone,107.2,107.2,23,23,NN,FM,5,"CO Chaffee Salida, Methodist Mountain KC0CVU 449.65 OPEN On-Air"
311,"Z0Nsalida,methodist mountain",449.925,-,5,TSQL,103.5,103.5,23,23,NN,FM,5,"CO Chaffee Salida, Methodist Mountain WZ0N 449.925 OPEN On-Air"
312,"JSCsalida,methodist mountain",449.975,-,5,TSQL,100,100,23,23,NN,FM,5,"CO Chaffee Salida, Methodist Mountain K0JSC 449.975 OPEN On-Air"
313,"ELKcarbondale,four mile ridge",449.725,-,5,Tone,179.9,179.9,23,23,NN,FM,5,"CO Garfield Carbondale, Four Mile Ridge K0ELK 449.725 OPEN On-Air"
314,"SNOcarbondale,four mile ridge",147.39,+,0.6,Tone,107.2,107.2,23,23,NN,FM,5,"CO Garfield Carbondale, Four Mile Ridge K0SNO 147.39 OPEN On-Air"
315,"VJJglenwoodsprings, sunlight peak",146.85,-,0.6,Cross,88.5,123,23,23,NN,FM,5,"CO Garfield Glenwood Springs, Sunlight Peak KB0VJJ 146.85 OPEN On-Air"
316,"I0Gglenwoodsprings, sunlight peak",146.88,-,0.6,Tone,107.2,107.2,23,23,NN,FM,5,"CO Garfield Glenwood Springs, Sunlight Peak KI0G 146.88 OPEN On-Air"
317,"I0Gglenwoodsprings, sunlight peak",447.1,-,5,Tone,107.2,107.2,23,23,NN,FM,5,"CO Garfield Glenwood Springs, Sunlight Peak KI0G 447.1 OPEN On-Air"
318,"XLIglenwoodsprings, sunlight peak",449.6,-,5,Tone,107.2,107.2,23,23,NN,FM,5,"CO Garfield Glenwood Springs, Sunlight Peak N0XLI 449.6 OPEN On-Air"
319,"MRCmaysville,co",145.325,-,0.6,Tone,100,100,23,23,NN,FM,5,"CO Chaffee Maysville, CO KD0MRC 145.325 OPEN On-Air"
320,"YNAgunnison,w mountain or tenderfoot mountain",447.65,-,5,TSQL,151.4,151.4,23,23,NN,FM,5,"CO Gunnison Gunnison, W Mountain or Tenderfoot Mountain KB0YNA 447.65 OPEN On-Air"
321,OZUrawlins,146.76,-,0.6,Tone,100,100,23,23,NN,FM,5,WY Carbon Rawlins KC7OZU 146.76 OPEN On-Air
322,7BNrawlins,147.39,+,0.6,Tone,100,100,23,23,NN,FM,5,WY Carbon Rawlins KD7BN 147.39 OPEN On-Air
323,7SUrawlins,448.3,-,5,Tone,100,100,23,23,NN,FM,5,WY Carbon Rawlins KD7SU 448.3 OPEN 
324,RONrawlins,146.7,-,0.6,Tone,162.2,162.2,23,23,NN,FM,5,WY Carbon Rawlins N7RON 146.7 OPEN On-Air
325,RONrawlins,449.8,-,5,Tone,146.2,146.2,23,23,NN,FM,5,WY Carbon Rawlins N7RON 449.8 OPEN 
326,EOCrawlins,445.05,-,5,,88.5,88.5,23,23,NN,DIG,5,WY Carbon Rawlins WY7EOC 445.05 CLOSED On-Air
327,"lusk,77 hill",147.33,+,0.6,,88.5,88.5,23,23,NN,FM,5,"WY Niobrara Lusk, 77 Hill  147.33 OPEN On-Air"
328,JSCwestcliffe,448.325,-,5,TSQL,100,100,23,23,NN,FM,5,CO Custer Westcliffe K0JSC 448.325 OPEN On-Air
329,TUCwestcliffe,147.06,+,0.6,TSQL,77,77,23,23,NN,FM,5,CO Custer Westcliffe KB0TUC 147.06 OPEN On-Air
330,TUCwestcliffe,448.15,-,5,TSQL,103.5,103.5,23,23,NN,FM,5,CO Custer Westcliffe KB0TUC 448.15 OPEN On-Air
331,TUCwestcliffe,927.775,-,25,DTCS,88.5,88.5,116,116,NN,FM,5,CO Custer Westcliffe KB0TUC 927.775 OPEN On-Air
332,"D0Qwestcliffe,deer peak",919.1,-,25,Tone,88.5,88.5,23,23,NN,FM,5,"CO Pueblo Westcliffe, Deer Peak ND0Q 919.1 OPEN Off-Air"
333,UGOogallala,146.76,-,0.6,Tone,123,123,23,23,NN,FM,5,NE Keith Ogallala N0UGO 146.76 OPEN On-Air
334,"JSCpueblo,cedarwood",449.975,-,5,TSQL,100,100,23,23,NN,FM,5,"CO Pueblo Pueblo, Cedarwood K0JSC 449.975 OPEN On-Air"
335,"CVUpueblo,deer peak",449.625,-,5,Tone,107.2,107.2,23,23,NN,FM,5,"CO Custer Pueblo, Deer Peak KC0CVU 449.625 OPEN On-Air"
336,"D0Qwalsenburg,deer peak",224.32,-,1.6,Tone,88.5,88.5,23,23,NN,FM,5,"CO Custer Walsenburg, Deer Peak ND0Q 224.32 OPEN Off-Air"
337,"D0Qpueblo,deer peak",447.175,-,5,Tone,88.5,88.5,23,23,NN,FM,5,"CO Pueblo Pueblo, Deer Peak ND0Q 447.175 OPEN Off-Air"
338,SWErifle,146.76,-,0.6,Tone,107.2,107.2,23,23,NN,FM,5,CO Garfield Rifle N0SWE 146.76 OPEN Off-Air
339,5GFgunnison,449.95,-,5,,88.5,88.5,23,23,NN,FM,5,CO Gunnison Gunnison K5GF 449.95 OPEN 
340,VTLgunnison,147.12,+,0.6,,88.5,88.5,23,23,NN,FM,5,CO Gunnison Gunnison W0VTL 147.12 OPEN On-Air
341,"ITFlajunta, north la junta",147.36,+,0.6,Cross,88.5,123,23,23,NN,DIG,5,"CO Otero La Junta, North La Junta KC0ITF 147.36 PRIVATE On-Air"
342,"ITFlajunta, north la junta",446.75,-,5,,88.5,88.5,23,23,NN,DIG,5,"CO Otero La Junta, North La Junta KC0ITF 446.75 PRIVATE On-Air"
343,7BAdouglas,147.15,+,0.6,,88.5,88.5,23,23,NN,FM,5,WY Converse Douglas KK7BA 147.15 OPEN On-Air
344,"FLOchadron,nebraska national forest",147.36,+,0.6,TSQL,123,123,23,23,NN,FM,5,"NE Dawes Chadron, Nebraska National Forest W0FLO 147.36 OPEN On-Air"
345,"PLAcasper,casper mountain",145.46,-,0.6,TSQL,110.9,110.9,23,23,NN,FM,5,"WY Natrona Casper, Casper Mountain K7PLA 145.46 OPEN On-Air"
346,"AGAcasper,casper mountain",146.64,-,0.6,Tone,173.8,173.8,23,23,NN,FM,5,"WY Natrona Casper, Casper Mountain KD7AGA 146.64 OPEN Off-Air"
347,"RRBcasper,casper mountain",449.9,-,5,,88.5,88.5,23,23,NN,DIG,5,"WY Natrona Casper, Casper Mountain N7RRB 449.9 OPEN On-Air"
348,"VNJcasper,casper mountain",146.94,-,0.6,TSQL,123,123,23,23,NN,FM,5,"WY Natrona Casper, Casper Mountain W7VNJ 146.94 OPEN On-Air"
349,GLDgoodland,147.03,+,0.6,Tone,88.5,88.5,23,23,NN,FM,5,KS Sherman Goodland KS0GLD 147.03 OPEN Off-Air
350,"B7Icasper,casper mtn.",449.5,-,5,Tone,100,100,23,23,NN,FM,5,"WY Natrona Casper, Casper Mtn. NB7I 449.5 OPEN On-Air"
351,"D0Qwalsenburg,n rattlesnake butte",146.73,-,0.6,Tone,88.5,88.5,23,23,NN,FM,5,"CO Huerfano Walsenburg, N Rattlesnake Butte ND0Q 146.73 OPEN On-Air"
352,VNJcasper,147.28,+,0.6,DTCS,88.5,88.5,32,32,NN,DIG,5,WY Natrona Casper W7VNJ 147.28 OPEN On-Air
353,"VNJcasper,wyoming med center",449.575,-,5,TSQL,173.8,173.8,23,23,NN,FM,5,"WY Natrona Casper, Wyoming Med Center W7VNJ 449.575 OPEN On-Air"
354,0MRpaonia,147.33,+,0.6,Tone,107.2,107.2,23,23,NN,FM,5,CO Delta Paonia KI0MR 147.33 OPEN On-Air
355,MJIcasper,147.345,+,0.6,,88.5,88.5,23,23,NN,FM,5,WY Natrona Casper KC7MJI 147.345 OPEN 
356,7GTcasper,146.91,-,0.6,,88.5,88.5,23,23,NN,FM,5,WY Natrona Casper N7GT 146.91 OPEN 
357,G7Tcasper,449.1,-,5,,88.5,88.5,23,23,NN,FM,5,WY Natrona Casper NG7T 449.1 OPEN 
358,VNJcasper,52.98,-,1,Tone,141.3,141.3,23,23,NN,FM,5,WY Natrona Casper W7VNJ 52.98 OPEN Off-Air
359,"EOCcasper,casper mountain",449.9875,-,5,,88.5,88.5,23,23,NN,DIG,5,"WY Natrona Casper, Casper Mountain WY7EOC 449.9875 CLOSED On-Air"
360,chadron,446.3,,0,,88.5,88.5,23,23,NN,FM,5,NE Dawes Chadron  446.3 OPEN On-Air
361,FLOchadron,145.62,,0,TSQL,100,100,23,23,NN,FM,5,NE Dawes Chadron W0FLO 145.62 OPEN On-Air
362,"HNDparachute,mount callahan",449.8,-,5,Tone,107.2,107.2,23,23,NN,FM,5,"CO Garfield Parachute, Mount Callahan WA4HND 449.8 OPEN On-Air"
363,0SWcollbran,449.5,-,5,Tone,107.2,107.2,23,23,NN,FM,5,CO Mesa Collbran KB0SW 449.5 OPEN Off-Air
364,"VJJgrandjunction, grand mesa",145.355,-,0.6,Cross,88.5,123,23,23,NN,FM,5,"CO Mesa Grand Junction, Grand Mesa KB0VJJ 145.355 OPEN On-Air"
365,"YNAgrandjunction, grand mesa",449.65,-,5,TSQL,151.4,151.4,23,23,NN,FM,5,"CO Mesa Grand Junction, Grand Mesa KB0YNA 449.65 OPEN On-Air"
366,VJRwallace,444.6,+,5,Tone,146.2,146.2,23,23,NN,FM,5,KS Wallace Wallace WA0VJR 444.6 OPEN On-Air
367,0HHlamar,146.61,-,0.6,TSQL,123,123,23,23,NN,FM,5,CO Prowers Lamar KC0HH 146.61 OPEN On-Air
368,0HHlamar,449.5,-,5,Tone,123,123,23,23,NN,FM,5,CO Prowers Lamar KC0HH 449.5 OPEN On-Air
369,0KMcenter,146.64,-,0.6,TSQL,77,77,23,23,NN,FM,5,CO Rio Grande Center N0KM 146.64 OPEN On-Air
370,0KMcenter,447.1,-,5,Tone,77,77,23,23,NN,FM,5,CO Saguache Center N0KM 447.1 OPEN On-Air
371,"cedaredge,grand mesa",447.35,-,5,Tone,107.2,107.2,23,23,NN,FM,5,"CO Delta Cedaredge, Grand Mesa  447.35 OPEN "
372,"QXXcedaredge,cedar mesa",147.195,+,0.6,Tone,107.2,107.2,23,23,NN,FM,5,"CO Delta Cedaredge, Cedar Mesa KC0QXX 147.195 OPEN "
373,ALCcedaredge,147.36,+,0.6,Tone,100,100,23,23,NN,FM,5,CO Delta Cedaredge W0ALC 147.36 OPEN 
374,ALCcedaredge,449.825,-,5,Tone,100,100,23,23,NN,FM,5,CO Delta Cedaredge W0ALC 449.825 OPEN 
375,"V8Qcolby,k-link",444.75,+,5,TSQL,162.2,162.2,23,23,NN,FM,5,"KS Thomas Colby, K-Link NV8Q 444.75 OPEN "
376,W0Kcolby,146.82,-,0.6,TSQL,156.7,156.7,23,23,NN,FM,5,KS Thomas Colby NW0K 146.82 OPEN On-Air
377,ECTcolby,444.4,+,5,Tone,141.3,141.3,23,23,NN,FM,5,KS Thomas Colby K0ECT 444.4 OPEN On-Air
378,WPMtribune,442.175,+,5,Tone,156.7,156.7,23,23,NN,FM,5,KS Greeley Tribune K0WPM 442.175 OPEN On-Air
379,"0BXgrandjunction, grand mesa",446.9125,-,5,,88.5,88.5,23,23,NN,DIG,5,"CO Mesa Grand Junction, Grand Mesa W0BX 446.9125 OPEN On-Air"
380,UVPgordon,146.67,-,0.6,,88.5,88.5,23,23,NN,FM,5,NE Sheridan Gordon N0UVP 146.67 OPEN Off-Air
381,"HNDgrandjunction, grand mesa",449.3,-,5,TSQL,107.2,107.2,23,23,NN,FM,5,"CO Mesa Grand Junction, Grand Mesa WA4HND 449.3 OPEN On-Air"
382,"YNAmontrose,waterdog peak",448.65,-,5,Cross,88.5,151.4,23,23,NN,FM,5,"CO Montrose Montrose, Waterdog Peak KB0YNA 448.65 OPEN On-Air"
383,"HNDmontrose,waterdog peak",447.2,-,5,TSQL,107.2,107.2,23,23,NN,FM,5,"CO Montrose Montrose, Waterdog Peak WA4HND 447.2 OPEN On-Air"
384,KDCnorthplatte,146.835,-,0.6,,88.5,88.5,23,23,NN,FM,5,NE Lincoln North Platte K0KDC 146.835 OPEN On-Air
385,0NPnorthplatte,146.7,-,0.6,Cross,88.5,123,23,23,NN,FM,5,NE Lincoln North Platte NE0NP 146.7 OPEN Off-Air
386,0IQnorthplatte,147.33,+,0.6,Tone,123,123,23,23,NN,FM,5,NE Lincoln North Platte N0IQ 147.33 OPEN On-Air
387,0IQnorthplatte,444.4,+,5,Tone,123,123,23,23,NN,FM,5,NE Lincoln North Platte N0IQ 444.4 OPEN On-Air
388,UGOnorthplatte,146.94,-,0.6,Tone,123,123,23,23,NN,FM,5,NE Lincoln North Platte N0UGO 146.94 OPEN On-Air
389,UGOnorthplatte,442.25,+,5,Tone,123,123,23,23,NN,FM,5,NE Lincoln North Platte N0UGO 442.25 OPEN Off-Air
390,0JScreede,146.925,-,0.6,,88.5,88.5,23,23,NN,FM,5,CO Mineral Creede WA0JS 146.925 OPEN Off-Air
391,UUXmontrose,146.91,-,0.6,TSQL,107.2,107.2,23,23,NN,FM,5,CO Montrose Montrose KC0UUX 146.91 OPEN On-Air
392,OPDmontrose,146.79,-,0.6,TSQL,107.2,107.2,23,23,NN,FM,5,CO Montrose Montrose KD5OPD 146.79 OPEN On-Air
393,"ITSlakecity, hill 71",147.135,-,0.6,Tone,123,123,23,23,NN,FM,5,"CO Hinsdale Lake City, Hill 71 KB5ITS 147.135 OPEN On-Air"
394,"PKTcreede,bristol head",449.525,-,5,TSQL,100,100,23,23,NN,FM,5,"CO Mineral Creede, Bristol Head N0PKT 449.525 OPEN On-Air"
395,ECTsyracuse,444,+,5,TSQL,141.3,141.3,23,23,NN,FM,5,KS Hamilton Syracuse K0ECT 444 OPEN On-Air
396,"RRZgrandjunction, gjt",145.175,-,0.6,Tone,107.2,107.2,23,23,NN,FM,5,"CO Mesa Grand Junction, GJT W0RRZ 145.175 OPEN On-Air"
397,0TYgrandjunction,147.39,+,0.6,Tone,107.2,107.2,23,23,NN,FM,5,CO Mesa Grand Junction KE0TY 147.39 OPEN 
398,GJTgrandjunction,146.82,-,0.6,Tone,107.2,107.2,23,23,NN,FM,5,CO Mesa Grand Junction W0GJT 146.82 OPEN On-Air
399,SSIgrandjunction,147.105,+,0.6,,88.5,88.5,23,23,NN,FM,5,CO Mesa Grand Junction K0SSI 147.105 OPEN On-Air
400,0SWgrandjunction,449,-,5,Cross,88.5,107.2,23,23,NN,FM,5,CO Mesa Grand Junction KB0SW 449 CLOSED On-Air
401,ARVgrandjunction,447.5,-,5,Tone,114.8,114.8,23,23,NN,FM,5,CO Mesa Grand Junction KC0ARV 447.5 OPEN 
402,REDgrandjunction,446.775,-,5,,88.5,88.5,23,23,NN,DIG,5,CO Mesa Grand Junction KD0RED 446.775 OPEN On-Air
403,SMZgrandjunction,449.775,-,5,Cross,173.8,88.5,23,23,NN,FM,5,CO Mesa Grand Junction KD0SMZ 449.775 OPEN On-Air
404,0TYgrandjunction,145.22,-,0.6,Tone,107.2,107.2,23,23,NN,FM,5,CO Mesa Grand Junction KE0TY 145.22 OPEN 
405,"VJJgrandjunction, grand mesa",147.355,-,0.6,Cross,88.5,123,23,23,NN,FM,5,"CO Mesa Grand Junction, Grand Mesa KB0VJJ 147.355 OPEN On-Air"
406,GJTgrandjunction,448.15,-,5,Tone,100,100,23,23,NN,FM,5,CO Mesa Grand Junction W0GJT 448.15 OPEN On-Air
407,"ITSouray,engineer mountain",147.27,+,0.6,Tone,127.3,127.3,23,23,NN,FM,5,"CO Ouray Ouray, Engineer Mountain KB5ITS 147.27 OPEN On-Air"
408,ECTelkader,444.3,+,5,TSQL,141.3,141.3,23,23,NN,FM,5,KS Logan Elkader K0ECT 444.3 OPEN On-Air
409,TAOsyracuse,146.775,-,0.6,,88.5,88.5,23,23,NN,FM,5,KS Hamilton Syracuse KA0TAO 146.775 OPEN On-Air
410,"ITSsilverton,kendall mountain",147.375,+,0.6,Tone,156.7,156.7,23,23,NN,FM,5,"CO San Juan Silverton, Kendall Mountain KB5ITS 147.375 OPEN On-Air"
411,OQAscottcity,146.7,-,0.6,TSQL,141.3,141.3,23,23,NN,DIG,5,KS Scott Scott City WA0OQA 146.7 OPEN On-Air
412,"ITSsilverton,buffalo boy",145.325,-,0.6,Tone,127.3,127.3,23,23,NN,FM,5,"CO San Juan Silverton, Buffalo Boy KB5ITS 145.325 OPEN On-Air"
413,"ITSsilverton,hazelton",444,+,5,Tone,67,67,23,23,NN,FM,5,"CO San Juan Silverton, Hazelton KB5ITS 444 OPEN On-Air"
414,ITSsilverton,447.525,-,5,Tone,127.3,127.3,23,23,NN,FM,5,CO San Juan Silverton KB5ITS 447.525 OPEN On-Air
415,"YNAtelluride,gray head",449.7,-,5,TSQL,107.2,107.2,23,23,NN,FM,5,"CO San Miguel Telluride, Gray Head KB0YNA 449.7 OPEN On-Air"
416,"0MIscottcity, k-link",444.95,+,5,TSQL,100,100,23,23,NN,FM,5,"KS Scott Scott City, K-Link W0MI 444.95 OPEN On-Air"
417,"YNAdelta,uncompahgre butte",449.4,-,5,TSQL,131.8,131.8,23,23,NN,FM,5,"CO Mesa Delta, Uncompahgre Butte KB0YNA 449.4 OPEN On-Air"
418,"PPPlander,airport",145.445,-,0.6,Tone,110.9,110.9,23,23,NN,FM,5,"WY Fremont Lander, airport KD7PPP 145.445 OPEN On-Air"
419,"ITTsilverton,engineer mountain",147.27,+,0.6,Tone,127.3,127.3,23,23,NN,FM,5,"CO San Juan Silverton, Engineer Mountain KB5ITT 147.27 OPEN On-Air"
420,OMClakin,146.985,-,0.6,TSQL,156.7,156.7,23,23,NN,FM,5,KS Kearney Lakin N0OMC 146.985 OPEN On-Air
421,"ECTgardencity, tennis",442.5,+,5,TSQL,141.3,141.3,23,23,NN,FM,5,"KS Finney Garden City, Tennis K0ECT 442.5 OPEN On-Air"
