Location,Name,Frequency,Duplex,Offset,Tone,rToneFreq,cToneFreq,DtcsCode,DtcsRxCode,DtcsPolarity,Mode,TStep,Comment
221,"CRAconifer,conifer mountain",1287.9,-,20,,88.5,88.5,23,23,NN,FM,5,"CO Jefferson Conifer, Conifer Mountain W0CRA 1287.9 OPEN Off-Air"
222,"CRAconifer,conifer mountain",224.98,-,1.6,TSQL,107.2,107.2,23,23,NN,FM,5,"CO Jefferson Conifer, Conifer Mountain W0CRA 224.98 OPEN Off-Air"
223,"CRAconifer,conifer mountain",447.15,-,5,TSQL,107.2,107.2,23,23,NN,FM,5,"CO Jefferson Conifer, Conifer Mountain W0CRA 447.15 OPEN Off-Air"
224,"0NRmonument,monument hill",447.725,-,5,TSQL,100,100,23,23,NN,FM,5,"CO El Paso Monument, Monument Hill K0NR 447.725 OPEN On-Air"
225,"KOMstockton,k-link",146.79,-,0.6,Tone,162.2,162.2,23,23,NN,FM,5,"KS Rooks Stockton, K-Link N0KOM 146.79 OPEN On-Air"
226,"XLFpalmerlake, monument hill",145.19,-,0.6,TSQL,131.8,131.8,23,23,NN,FM,5,"CO Douglas Palmer Lake, Monument Hill N0XLF 145.19 OPEN On-Air"
227,"WWVcampbell,mid-rivers e911 dispatch center",444.475,+,5,TSQL,123,123,23,23,NN,FM,5,"NE Franklin Campbell, Mid-Rivers E911 Dispatch Center W0WWV 444.475 OPEN On-Air"
228,"G0Nidahosprings, squaw mountain",449.05,-,5,TSQL,107.2,107.2,23,23,NN,FM,5,"CO Denver Idaho Springs, Squaw Mountain WG0N 449.05 OPEN On-Air"
229,0IPwoodriver,444.7,+,5,Tone,167.9,167.9,23,23,NN,DIG,5,NE Hall Wood River N0IP 444.7 OPEN On-Air
230,"ESQcastlerock, devils head",446.925,-,5,,88.5,88.5,23,23,NN,DIG,5,"CO Douglas Castle Rock, Devils Head N0ESQ 446.925 OPEN On-Air"
231,"ESQcastlerock, devils head (pike national forest)",447.525,-,5,TSQL,146.2,146.2,23,23,NN,FM,5,"CO Douglas Castle Rock, Devils Head (Pike National Forest) N0ESQ 447.525 OPEN On-Air"
232,"ARAcritchell,critchell mountain",147.12,+,0.6,TSQL,88.5,88.5,23,23,NN,FM,5,"CO Jefferson Critchell, Critchell Mountain N0ARA 147.12 OPEN On-Air"
233,"CRAconifer,conifer mountain",53.05,-,1.7,TSQL,107.2,107.2,23,23,NN,FM,5,"CO Jefferson Conifer, Conifer Mountain W0CRA 53.05 OPEN Off-Air"
234,"AENidahosprings, squaw mountain",449,-,5,TSQL,136.5,136.5,23,23,NN,FM,5,"CO Clear Creek Idaho Springs, Squaw Mountain WR0AEN 449 OPEN On-Air"
235,"PYYevergreen,squaw mountain",147.3,+,0.6,TSQL,103.5,103.5,23,23,NN,FM,5,"CO Clear Creek Evergreen, Squaw Mountain N0PYY 147.3 OPEN On-Air"
236,"CFIidahosprings, squaw mountain",448.675,-,5,TSQL,100,100,23,23,NN,FM,5,"CO Denver Idaho Springs, Squaw Mountain W0CFI 448.675 OPEN On-Air"
237,"UDDidahosprings, squaw mountain",146.67,-,0.6,TSQL,100,100,23,23,NN,FM,5,"CO Clear Creek Idaho Springs, Squaw Mountain KB0UDD 146.67 OPEN On-Air"
238,"CRAidahosprings, squaw mountain",145.145,-,0.6,TSQL,107.2,107.2,23,23,NN,FM,5,"CO Clear Creek Idaho Springs, Squaw Mountain W0CRA 145.145 OPEN On-Air"
239,"CRAidahosprings, squaw mountain",447.575,-,5,TSQL,107.2,107.2,23,23,NN,FM,5,"CO Clear Creek Idaho Springs, Squaw Mountain W0CRA 447.575 OPEN On-Air"
240,"0TXidahosprings, centennial cone",145.49,-,0.6,TSQL,100,100,23,23,NN,FM,5,"CO Jefferson Idaho Springs, Centennial Cone W0TX 145.49 OPEN On-Air"
241,"0TXidahosprings, squaw mountain",449.35,-,5,TSQL,100,100,23,23,NN,FM,5,"CO Clear Creek Idaho Springs, Squaw Mountain W0TX 449.35 OPEN On-Air"
242,"DUNidahosprings, squaw mountain",449.45,-,5,Cross,103.5,127.3,23,23,NN,FM,5,"CO Clear Creek Idaho Springs, Squaw Mountain K1DUN 449.45 OPEN On-Air"
243,"0SZidahosprings, squaw mountain",446.9375,-,5,,88.5,88.5,23,23,NN,DIG,5,"CO Clear Creek Idaho Springs, Squaw Mountain N0SZ 446.9375 OPEN On-Air"
244,"0SZidahosprings, squaw mountain",448.225,-,5,TSQL,141.3,141.3,23,23,NN,FM,5,"CO Clear Creek Idaho Springs, Squaw Mountain N0SZ 448.225 OPEN On-Air"
245,"WYXidahosprings, squaw mountain",146.94,-,0.6,TSQL,103.5,103.5,23,23,NN,FM,5,"CO Clear Creek Idaho Springs, Squaw Mountain W0WYX 146.94 OPEN On-Air"
246,"JSClarkspur,westcreek",449.975,-,5,TSQL,100,100,23,23,NN,FM,5,"CO Douglas Larkspur, Westcreek K0JSC 449.975 OPEN On-Air"
247,"CRAlarkspur,westcreek",147.225,+,0.6,TSQL,107.2,107.2,23,23,NN,FM,5,"CO Douglas Larkspur, Westcreek W0CRA 147.225 OPEN On-Air"
248,"CRAlarkspur,westcreek",448.425,-,5,TSQL,107.2,107.2,23,23,NN,FM,5,"CO Douglas Larkspur, Westcreek W0CRA 448.425 OPEN On-Air"
249,CUOelba,147.24,+,0.6,Tone,123,123,23,23,NN,FM,5,NE Howard Elba W0CUO 147.24 OPEN On-Air
250,"7UWlaramie,jelm mountain",147.015,+,0.6,Tone,146.2,146.2,23,23,NN,DIG,5,"WY Albany Laramie, Jelm Mountain N7UW 147.015 OPEN On-Air"
251,ECTsyracuse,444,+,5,TSQL,141.3,141.3,23,23,NN,FM,5,KS Hamilton Syracuse K0ECT 444 OPEN On-Air
252,MOGcoloradosprings,224.72,-,1.6,TSQL,103.5,103.5,23,23,NN,FM,5,CO El Paso Colorado springs W0MOG 224.72 OPEN On-Air
253,"CUOgrandisland, nebraska state fair",145.415,-,0.6,Tone,123,123,23,23,NN,DIG,5,"NE Hall Grand Island, Nebraska State Fair W0CUO 145.415 OPEN On-Air"
254,0IPstlibory,444.925,+,5,Tone,100,100,23,23,NN,FM,5,NE Howard St Libory N0IP 444.925 OPEN On-Air
255,0SZwestcreek,446.875,-,5,,88.5,88.5,23,23,NN,DIG,5,CO Douglas Westcreek N0SZ 446.875 OPEN On-Air
256,CCCwinterpark,447.45,-,5,Tone,103.5,103.5,23,23,NN,FM,5,CO Grand Winter Park WA4CCC 447.45 OPEN On-Air
257,"VJJwinterpark, winter park",147.285,+,0.6,Cross,88.5,123,23,23,NN,FM,5,"CO Grand Winter Park, Winter Park KB0VJJ 147.285 OPEN On-Air"
258,A0Lcoloradosprings,147.135,+,0.6,Tone,100,100,23,23,NN,FM,5,CO El Paso Colorado Springs AA0L 147.135 OPEN On-Air
259,"0HScuster,mt coolidge",147.12,+,0.6,TSQL,146.2,146.2,23,23,NN,FM,5,"SD Custer Custer, Mt Coolidge K0HS 147.12 OPEN On-Air"
260,coloradosprings,147.27,+,0.6,,88.5,88.5,23,23,NN,FM,5,CO El Paso Colorado Springs  147.27 OPEN On-Air
261,IRPcoloradosprings,146.91,-,0.6,TSQL,151.4,151.4,23,23,NN,FM,5,CO El Paso Colorado Springs K0IRP 146.91 OPEN On-Air
262,MOGcoloradosprings,147.39,+,0.6,Tone,103.5,103.5,23,23,NN,FM,5,CO El Paso Colorado Springs W0MOG 147.39 OPEN On-Air
263,RSHcoloradosprings,146.85,-,0.6,Tone,103.5,103.5,23,23,NN,FM,5,CO El Paso Colorado Springs W0RSH 146.85 OPEN On-Air
264,coloradosprings,449.575,-,5,,88.5,88.5,23,23,NN,FM,5,CO El Paso Colorado Springs  449.575 CLOSED On-Air
265,A0Lcoloradosprings,448.3,-,5,Tone,100,100,23,23,NN,FM,5,CO El Paso Colorado Springs AA0L 448.3 OPEN On-Air
266,IRPcoloradosprings,447.35,-,5,Tone,151.4,151.4,23,23,NN,FM,5,CO El Paso Colorado Springs K0IRP 447.35 OPEN On-Air
267,SRJcoloradosprings,224.06,-,1.6,,88.5,88.5,23,23,NN,FM,5,CO El Paso Colorado Springs KB0SRJ 224.06 CLOSED 
268,0WFcoloradosprings,447.025,-,5,Tone,123,123,23,23,NN,FM,5,CO El Paso Colorado Springs KF0WF 447.025 OPEN Off-Air
269,"0KGcoloradosprings, broadmoor area",448.25,-,5,Tone,123,123,23,23,NN,FM,5,"CO El Paso Colorado Springs, Broadmoor Area N0KG 448.25 OPEN Off-Air"
270,X0Gcoloradosprings,447.475,-,5,Tone,107.2,107.2,23,23,NN,FM,5,CO El Paso Colorado Springs NX0G 447.475 OPEN 
271,MOGcoloradosprings,448.6,-,5,Tone,114.8,114.8,23,23,NN,FM,5,CO El Paso Colorado Springs W0MOG 448.6 OPEN 
272,MOGcoloradosprings,927.8,-,25,DTCS,88.5,88.5,116,116,NN,FM,5,CO Teller Colorado Springs W0MOG 927.8 OPEN On-Air
273,IFIcoloradosprings,447.55,-,5,Tone,123,123,23,23,NN,FM,5,CO El Paso Colorado Springs WA6IFI 447.55 OPEN On-Air
274,"0PCbailey,dick mountain",146.895,-,0.6,TSQL,100,100,23,23,NN,FM,5,"CO Park Bailey, Dick Mountain AB0PC 146.895 OPEN On-Air"
275,WUCwoodlandpark,145.415,-,0.6,Tone,179.9,179.9,23,23,NN,FM,5,CO Teller Woodland Park KA0WUC 145.415 OPEN 
276,WUCwoodlandpark,449.025,-,5,Tone,141.3,141.3,23,23,NN,FM,5,CO Teller Woodland Park KA0WUC 449.025 OPEN 
277,X0Gwoodlandpark,146.82,-,0.6,Tone,107.2,107.2,23,23,NN,FM,5,CO Teller Woodland Park NX0G 146.82 OPEN On-Air
278,X0Gwoodlandpark,448.65,-,5,Tone,107.2,107.2,23,23,NN,FM,5,CO Teller Woodland Park NX0G 448.65 OPEN On-Air
279,WUCwoodlandpark,447.675,-,5,TSQL,179.9,179.9,23,23,NN,FM,5,CO Teller Woodland Park KA0WUC 447.675 OPEN On-Air
280,WUCwoodlandpark,927.9,-,25,DTCS,88.5,88.5,205,205,NN,FM,5,CO Teller Woodland Park KA0WUC 927.9 OPEN On-Air
281,"EPSwoodlandpark, paradise pines",449.325,-,5,TSQL,103.5,103.5,23,23,NN,FM,5,"CO Teller Woodland Park, Paradise Pines KA4EPS 449.325 OPEN On-Air"
282,"HAMransom,k-link",443.575,+,5,TSQL,162.2,162.2,23,23,NN,FM,5,"KS Ness Ransom, K-Link K0HAM 443.575 OPEN On-Air"
283,"PFJgranby,mt chauncey",446.875,-,5,,88.5,88.5,23,23,NN,DIG,5,"CO Clear Creek Granby, Mt Chauncey K7PFJ 446.875 OPEN On-Air"
284,YDWgranby,146.82,-,0.6,Tone,123,123,23,23,NN,FM,5,CO Grand Granby KA0YDW 146.82 OPEN 
285,"PBVgrandisland, st. francis hospital",146.655,-,0.6,,88.5,88.5,23,23,NN,DIG,5,"NE Hall Grand Island, St. Francis Hospital KD0PBV 146.655 OPEN On-Air"
286,HZXgrandisland,443.95,+,5,Tone,123,123,23,23,NN,FM,5,NE Hall Grand Island KE0HZX 443.95 OPEN On-Air
287,"QJNcuster,water tank hill",147.09,+,0.6,TSQL,146.2,146.2,23,23,NN,FM,5,"SD Custer Custer, Water Tank Hill WN6QJN 147.09 OPEN On-Air"
288,CUOgrandisland,53.35,-,1.7,,88.5,88.5,23,23,NN,FM,5,NE Hall Grand Island W0CUO 53.35 OPEN On-Air
289,"WWVhastings,hastings museum",147.48,,0,TSQL,88.5,88.5,23,23,NN,FM,5,"NE Adams Hastings, Hastings Museum W0WWV 147.48 OPEN On-Air"
290,"ENXgrandisland, heartland event center",444.75,+,5,Tone,123,123,23,23,NN,DIG,5,"NE Hall Grand Island, Heartland Event Center KD0ENX 444.75 OPEN On-Air"
291,CUOgrandisland,146.94,-,0.6,Tone,123,123,23,23,NN,FM,5,NE Hall Grand Island W0CUO 146.94 OPEN On-Air
292,"TTFcoloradosprings, fillmore hill",448.725,-,5,Tone,123,123,23,23,NN,FM,5,"CO El Paso Colorado Springs, Fillmore Hill KA0TTF 448.725 OPEN On-Air"
293,ENXgrandisland,147.345,+,0.6,Tone,123,123,23,23,NN,DIG,5,NE Hall Grand Island KD0ENX 147.345 OPEN On-Air
294,"WWVhastings,hastings dog-walk park",443.2,+,5,TSQL,123,123,23,23,NN,FM,5,"NE Adams Hastings, Hastings Dog-Walk Park W0WWV 443.2 OPEN On-Air"
295,"EQAhastings,ne",147.525,,0,TSQL,141.3,141.3,23,23,NN,FM,5,"NE Adams Hastings, NE KC0EQA 147.525 OPEN On-Air"
296,0LLsmithcenter,146.61,-,0.6,,88.5,88.5,23,23,NN,FM,5,KS Smith Smith Center N0LL 146.61 OPEN On-Air
297,"VJJcoloradosprings, cheyenne mountain",145.13,-,0.6,Cross,88.5,123,23,23,NN,FM,5,"CO El Paso Colorado Springs, Cheyenne Mountain KB0VJJ 145.13 OPEN On-Air"
298,"CVUcoloradosprings, cheyenne mountain",446.9125,-,5,,88.5,88.5,23,23,NN,DIG,5,"CO El Paso Colorado Springs, Cheyenne Mountain KC0CVU 446.9125 OPEN On-Air"
299,"CVUcoloradosprings, cheyenne mountain",927.85,-,25,DTCS,88.5,88.5,114,114,NN,FM,5,"CO Teller Colorado Springs, Cheyenne Mountain KC0CVU 927.85 OPEN On-Air"
300,"0SZcoloradosprings, cheyenne mountain",445.0625,-,5,,88.5,88.5,23,23,NN,DIG,5,"CO El Paso Colorado Springs, Cheyenne Mountain N0SZ 445.0625 OPEN Off-Air"
301,"IFIcoloradosprings, cheyenne mountain",53.13,-,1.7,TSQL,107.2,107.2,23,23,NN,FM,5,"CO El Paso Colorado Springs, Cheyenne Mountain WA6IFI 53.13 OPEN On-Air"
302,"CVUcoloradosprings, cheyenne mountain",145.375,-,0.6,,88.5,88.5,23,23,NN,DIG,5,"CO El Paso Colorado Springs, Cheyenne Mountain KC0CVU 145.375 OPEN Off-Air"
303,"WWVhastings,kcnt tower",145.13,-,0.6,Tone,123,123,23,23,NN,FM,5,"NE Adams Hastings, KCNT Tower W0WWV 145.13 OPEN On-Air"
304,"CVUcoloradosprings, cheyenne mountain",146.76,-,0.6,TSQL,107.2,107.2,23,23,NN,FM,5,"CO El Paso Colorado Springs, Cheyenne Mountain KC0CVU 146.76 OPEN On-Air"
305,"CVUcoloradosprings, cheyenne mountain",147.345,+,0.6,TSQL,107.2,107.2,23,23,NN,FM,5,"CO El Paso Colorado Springs, Cheyenne Mountain KC0CVU 147.345 OPEN On-Air"
306,"CVUcoloradosprings, cheyenne mountain",448,-,5,Tone,107.2,107.2,23,23,NN,FM,5,"CO El Paso Colorado Springs, Cheyenne Mountain KC0CVU 448 OPEN On-Air"
307,"CVUcoloradosprings, cheyenne mountain",448.1,-,5,TSQL,107.2,107.2,23,23,NN,FM,5,"CO El Paso Colorado Springs, Cheyenne Mountain KC0CVU 448.1 OPEN On-Air"
308,"CRAcoloradosprings, cheyenne mountain",145.16,-,0.6,TSQL,107.2,107.2,23,23,NN,FM,5,"CO El Paso Colorado Springs, Cheyenne Mountain W0CRA 145.16 OPEN On-Air"
309,"SRJcoloradosprings, pikes peak",146.97,-,0.6,Cross,100,123,23,23,NN,FM,5,"CO El Paso Colorado Springs, Pikes Peak KB0SRJ 146.97 OPEN On-Air"
310,"SRJcoloradosprings, pikes peak",448.45,-,5,Tone,100,100,23,23,NN,FM,5,"CO El Paso Colorado Springs, Pikes Peak KB0SRJ 448.45 OPEN On-Air"
311,KIYhays,443.6,+,5,Tone,100,100,23,23,NN,DIG,5,KS Ellis Hays KE0KIY 443.6 OPEN On-Air
312,"ECTgardencity, tennis",442.5,+,5,TSQL,141.3,141.3,23,23,NN,FM,5,"KS Finney Garden City, Tennis K0ECT 442.5 OPEN On-Air"
313,"0SPcoloradosprings, almagre mountain",147.18,+,0.6,Tone,100,100,23,23,NN,FM,5,"CO El Paso Colorado Springs, Almagre Mountain AA0SP 147.18 PRIVATE On-Air"
314,"PFJcoloradosprings, almagre mountain",446.95,-,5,,88.5,88.5,23,23,NN,DIG,5,"CO Teller Colorado Springs, Almagre Mountain K7PFJ 446.95 OPEN On-Air"
315,"IFIcoloradosprings, almagre mountain",927.725,-,25,DTCS,88.5,88.5,114,114,NN,FM,5,"CO Teller Colorado Springs, Almagre Mountain WA6IFI 927.725 OPEN On-Air"
316,SRJcoloradosprings,145.265,-,0.6,TSQL,100,100,23,23,NN,DIG,5,CO El Paso Colorado Springs KB0SRJ 145.265 OPEN Off-Air
317,"SRJcoloradosprings, uccs",448.8,-,5,TSQL,100,100,23,23,NN,DIG,5,"CO El Paso Colorado Springs, UCCS KB0SRJ 448.8 OPEN Off-Air"
318,"EZQhays,catherine road",927.0375,-,25,Tone,131.8,131.8,23,23,NN,FM,5,"KS Ellis Hays, Catherine Road KD0EZQ 927.0375 OPEN On-Air"
319,JYShays,147.045,+,0.6,TSQL,131.8,131.8,23,23,NN,DIG,5,KS Ellis Hays N7JYS 147.045 OPEN On-Air
320,JYShays,224.28,-,1.6,TSQL,131.8,131.8,23,23,NN,FM,5,KS Ellis Hays N7JYS 224.28 OPEN On-Air
321,"JYShays,k-link",442.45,+,5,TSQL,162.2,162.2,23,23,NN,FM,5,"KS Ellis Hays, K-Link N7JYS 442.45 OPEN On-Air"
322,USYhays,444,+,5,,88.5,88.5,23,23,NN,DIG,5,KS Ellis Hays K0USY 444 OPEN On-Air
323,7BAdouglas,147.15,+,0.6,,88.5,88.5,23,23,NN,FM,5,WY Converse Douglas KK7BA 147.15 OPEN On-Air
324,GRPo'neill,444.875,+,5,Tone,146.2,146.2,23,23,NN,FM,5,NE Holt O'Neill KB0GRP 444.875 OPEN On-Air
325,"BXHcuster,bear mountain",146.85,-,0.6,Tone,146.2,146.2,23,23,NN,FM,5,"SD Pennington Custer, Bear Mountain KC0BXH 146.85 OPEN On-Air"
326,KIYhays,147.18,+,0.6,TSQL,100,100,23,23,NN,FM,5,KS Ellis Hays KE0KIY 147.18 OPEN On-Air
327,ECQhays,444.825,+,5,TSQL,114.8,114.8,23,23,NN,FM,5,KS Ellis Hays N0ECQ 444.825 OPEN On-Air
328,USYhays,444.6725,+,5,,88.5,88.5,23,23,NN,DIG,5,KS Ellis Hays K0USY 444.6725 OPEN On-Air
329,lakegeorge,449.7,-,5,Tone,107.2,107.2,23,23,NN,FM,5,CO Park Lake George  449.7 OPEN 
330,"Z0Mosborne,k-link",147.375,+,0.6,Tone,162.2,162.2,23,23,NN,FM,5,"KS Osborne Osborne, K-Link NZ0M 147.375 OPEN On-Air"
331,"D0Qpueblo,baculite mesa",146.79,-,0.6,Tone,88.5,88.5,23,23,NN,FM,5,"CO Pueblo Pueblo, Baculite Mesa ND0Q 146.79 OPEN On-Air"
332,"D0Qpueblo,baculite mesa",224.26,-,1.6,Tone,88.5,88.5,23,23,NN,FM,5,"CO Pueblo Pueblo, Baculite Mesa ND0Q 224.26 OPEN Off-Air"
333,D0Qpueblo,447.95,-,5,Tone,88.5,88.5,23,23,NN,FM,5,CO Pueblo Pueblo ND0Q 447.95 OPEN On-Air
334,"CVUlakegeorge, badger mountain",147.36,+,0.6,TSQL,107.2,107.2,23,23,NN,FM,5,"CO Park Lake George, Badger Mountain KC0CVU 147.36 OPEN On-Air"
335,"X0Glakegeorge, badger mountain",146.685,-,0.6,TSQL,107.2,107.2,23,23,NN,FM,5,"CO Park Lake George, Badger Mountain NX0G 146.685 OPEN On-Air"
336,WDFcripplecreek,447.4,-,5,Tone,67,67,23,23,NN,FM,5,CO Teller Cripple Creek WB0WDF 447.4 OPEN On-Air
337,X0Gcripplecreek,147.015,+,0.6,Tone,107.2,107.2,23,23,NN,FM,5,CO Teller Cripple Creek NX0G 147.015 OPEN On-Air
338,WDFcripplecreek,1287.7,-,20,Tone,67,67,23,23,NN,FM,5,CO Teller Cripple Creek WB0WDF 1287.7 OPEN Testing
339,WDFcripplecreek,145.46,-,0.6,Tone,67,67,23,23,NN,FM,5,CO Teller Cripple Creek WB0WDF 145.46 OPEN On-Air
340,WDFcripplecreek,224.94,-,1.6,Tone,67,67,23,23,NN,FM,5,CO Teller Cripple Creek WB0WDF 224.94 OPEN Testing
341,GRPo'neill,146.61,-,0.6,Tone,131.8,131.8,23,23,NN,FM,5,NE Holt O'Neill KB0GRP 146.61 OPEN On-Air
342,OQAgardencity,52.87,-,1.7,TSQL,141.3,141.3,23,23,NN,FM,5,KS Finney Garden City WA0OQA 52.87 OPEN On-Air
343,"0SZbreckenridge,baldy",445.0875,-,5,,88.5,88.5,23,23,NN,DIG,5,"CO Fremont Breckenridge, Baldy N0SZ 445.0875 OPEN On-Air"
344,"VJJbreckenridge,bald mountain",147.39,+,0.6,Cross,88.5,123,23,23,NN,FM,5,"CO Summit Breckenridge, Bald Mountain KB0VJJ 147.39 OPEN On-Air"
345,"E0Zpueblo,csu",147,+,0.6,,88.5,88.5,23,23,NN,FM,5,"CO Pueblo Pueblo, CSU NE0Z 147 PRIVATE On-Air"
346,QMRbreckenridge,146.7,-,0.6,Tone,107.2,107.2,23,23,NN,FM,5,CO Summit Breckenridge WB0QMR 146.7 OPEN On-Air
347,"0STpueblo,pueblo",146.655,-,0.6,Tone,123,123,23,23,NN,FM,5,"CO Pueblo Pueblo, Pueblo K0ST 146.655 OPEN On-Air"
348,"0KRpueblo,pueblo",447.7,-,5,TSQL,210.7,210.7,23,23,NN,DIG,5,"CO Pueblo Pueblo, Pueblo KF0KR 447.7 PRIVATE Off-Air"
349,PWZpalmerdivide,449.725,-,5,Tone,100,100,23,23,NN,FM,5,CO El Paso Palmer Divide N0PWZ 449.725 OPEN On-Air
350,D0Qpueblo,145.115,-,0.6,Tone,88.5,88.5,23,23,NN,FM,5,CO Pueblo Pueblo ND0Q 145.115 OPEN Off-Air
351,"D0Qpueblo,deer peak",146.88,-,0.6,Tone,88.5,88.5,23,23,NN,FM,5,"CO Pueblo Pueblo, Deer Peak ND0Q 146.88 OPEN On-Air"
352,JSCpueblowest,448.975,-,5,TSQL,100,100,23,23,NN,FM,5,CO Pueblo Pueblo West K0JSC 448.975 OPEN On-Air
353,JSCpueblo,446.9875,-,5,,88.5,88.5,23,23,NN,DIG,5,CO Pueblo Pueblo K0JSC 446.9875 OPEN Off-Air
354,"JSCpueblo,metro",447.275,-,5,TSQL,100,100,23,23,NN,FM,5,"CO Pueblo Pueblo, Metro K0JSC 447.275 OPEN On-Air"
355,J0Tpueblo,147.24,+,0.6,Tone,103.5,103.5,23,23,NN,FM,5,CO Pueblo Pueblo KJ0T 147.24 OPEN Off-Air
356,HMNspencer,147.33,+,0.6,TSQL,131.8,131.8,23,23,NN,FM,5,NE Boyd Spencer KC0HMN 147.33 OPEN On-Air
357,HFArussell,442.85,+,5,TSQL,141.3,141.3,23,23,NN,FM,5,KS Russell Russell KC0HFA 442.85 OPEN On-Air
358,SJRrussell,442,+,5,,88.5,88.5,23,23,NN,DIG,5,KS Russell Russell KB0SJR 442 OPEN On-Air
359,JYSrussell,442.475,+,5,TSQL,131.8,131.8,23,23,NN,DIG,5,KS Russell Russell N7JYS 442.475 OPEN On-Air
360,0UOrussell,147.285,+,0.6,TSQL,162.2,162.2,23,23,NN,FM,5,KS Russell Russell AB0UO 147.285 OPEN On-Air
361,"0UOrussell,k-link",444.95,+,5,TSQL,162.2,162.2,23,23,NN,FM,5,"KS Russell Russell, K-Link AB0UO 444.95 OPEN On-Air"
362,"0SZfairplay,badger",446.7625,-,5,,88.5,88.5,23,23,NN,DIG,5,"CO Park Fairplay, Badger N0SZ 446.7625 OPEN On-Air"
363,"JSCcanoncity, canon city",449.975,-,5,TSQL,100,100,23,23,NN,FM,5,"CO Fremont Canon City, Canon City K0JSC 449.975 OPEN On-Air"
364,"WDFcanoncity, eightmile mountain",449,-,5,TSQL,67,67,23,23,NN,FM,5,"CO Fremont Canon City, eightmile Mountain WB0WDF 449 OPEN On-Air"
365,"UFOfairplay,sacramento mountain",447.125,-,5,TSQL,103.5,103.5,23,23,NN,FM,5,"CO Park Fairplay, Sacramento Mountain KC0UFO 447.125 OPEN On-Air"
366,"JSCcanoncity, colorado",447.975,-,5,TSQL,100,100,23,23,NN,FM,5,"CO Fremont Canon City, Colorado K0JSC 447.975 OPEN On-Air"
367,"TUCcanoncity, fremont peak",927.7,-,25,DTCS,88.5,88.5,114,114,NN,FM,5,"CO Fremont Canon City, Fremont Peak KB0TUC 927.7 OPEN On-Air"
368,"JSCcanoncity, fremont peak",446.7375,-,5,,88.5,88.5,23,23,NN,DIG,5,"CO Fremont Canon City, Fremont Peak K0JSC 446.7375 OPEN On-Air"
369,"JSCcanoncity, fremont peak",447.25,-,5,TSQL,100,100,23,23,NN,FM,5,"CO Fremont Canon City, Fremont Peak K0JSC 447.25 OPEN On-Air"
370,"WDFcanoncity, fremont peak",53.03,-,1.7,TSQL,88.5,88.5,23,23,NN,FM,5,"CO Fremont Canon City, Fremont Peak WB0WDF 53.03 OPEN On-Air"
371,"EKRcanoncity, fremont peak",145.49,-,0.6,TSQL,103.5,103.5,23,23,NN,FM,5,"CO Fremont Canon City, Fremont Peak WD0EKR 145.49 OPEN On-Air"
372,"EKRcanoncity, fremont peak",223.96,-,1.6,TSQL,103.5,103.5,23,23,NN,FM,5,"CO Fremont Canon City, Fremont Peak WD0EKR 223.96 OPEN On-Air"
373,"EKRcanoncity, fremont peak",447.75,-,5,TSQL,103.5,103.5,23,23,NN,FM,5,"CO Fremont Canon City, Fremont Peak WD0EKR 447.75 OPEN On-Air"
374,"VJJleadville,mosquito pass",145.445,-,0.6,Tone,88.5,88.5,23,23,NN,FM,5,"CO Lake Leadville, Mosquito Pass KB0VJJ 145.445 OPEN On-Air"
375,"0SZleadville,mosquito pass",445.05,-,5,,88.5,88.5,23,23,NN,DIG,5,"CO Lake Leadville, Mosquito Pass N0SZ 445.05 OPEN On-Air"
376,NPOreliance,146.94,-,0.6,Tone,146.2,146.2,23,23,NN,FM,5,SD Lyman Reliance N0NPO 146.94 OPEN On-Air
377,Z0Nhartsel,448.575,-,5,TSQL,103.5,103.5,23,23,NN,FM,5,CO Park Hartsel WZ0N 448.575 OPEN Off-Air
378,"HAMhoisington,k-link",147.135,+,0.6,TSQL,88.5,88.5,23,23,NN,FM,5,"KS Barton Hoisington, K-Link K0HAM 147.135 OPEN On-Air"
379,JYShoisington,224,-,1.6,Tone,131.8,131.8,23,23,NN,FM,5,KS Barton Hoisington N7JYS 224 OPEN On-Air
380,BHNwilson,146.97,-,0.6,TSQL,118.8,118.8,23,23,NN,FM,5,KS Ellsworth Wilson K0BHN 146.97 OPEN On-Air
381,"VPXhoisington,beaver",444.925,+,5,TSQL,100,100,23,23,NN,DIG,5,"KS Barton Hoisington, Beaver N0VPX 444.925 OPEN On-Air"
382,"7WYwright,little thunder",147.06,+,0.6,Tone,100,100,23,23,NN,FM,5,"WY Campbell Wright, Little Thunder NE7WY 147.06 OPEN Off-Air"
383,VPXpawneerock,146.835,-,0.6,TSQL,100,100,23,23,NN,DIG,5,KS Barton Pawnee Rock N0VPX 146.835 OPEN On-Air
384,VPXpawneerock,444.325,+,5,,88.5,88.5,23,23,NN,DIG,5,KS Barton Pawnee Rock N0VPX 444.325 OPEN On-Air
385,0NNgreatbend,146.76,-,0.6,TSQL,103.5,103.5,23,23,NN,FM,5,KS Barton Great Bend KI0NN 146.76 OPEN On-Air
386,VPXgreatbend,442.075,+,5,,88.5,88.5,23,23,NN,DIG,5,KS Barton Great Bend N0VPX 442.075 OPEN On-Air
387,VPXgreatbend,444.1,+,5,TSQL,100,100,23,23,NN,DIG,5,KS Barton Great Bend N0VPX 444.1 OPEN On-Air
388,JSCwestcliffe,448.325,-,5,TSQL,100,100,23,23,NN,FM,5,CO Custer Westcliffe K0JSC 448.325 OPEN On-Air
389,TUCwestcliffe,147.06,+,0.6,TSQL,77,77,23,23,NN,FM,5,CO Custer Westcliffe KB0TUC 147.06 OPEN On-Air
390,TUCwestcliffe,448.15,-,5,TSQL,103.5,103.5,23,23,NN,FM,5,CO Custer Westcliffe KB0TUC 448.15 OPEN On-Air
391,TUCwestcliffe,927.775,-,25,DTCS,88.5,88.5,116,116,NN,FM,5,CO Custer Westcliffe KB0TUC 927.775 OPEN On-Air
392,"D0Qwestcliffe,deer peak",919.1,-,25,Tone,88.5,88.5,23,23,NN,FM,5,"CO Pueblo Westcliffe, Deer Peak ND0Q 919.1 OPEN Off-Air"
393,"QPGsalida,methodist mountain",446.975,-,5,,88.5,88.5,23,23,NN,DIG,5,"CO Chaffee Salida, Methodist Mountain KD0QPG 446.975 OPEN On-Air"
394,"0SZsalida,methodist mountain",446.8125,-,5,,88.5,88.5,23,23,NN,DIG,5,"CO Chaffee Salida, Methodist Mountain N0SZ 446.8125 OPEN On-Air"
395,LSDnathrop,146.745,-,0.6,Tone,100,100,23,23,NN,FM,5,CO Chaffee Nathrop W0LSD 146.745 OPEN Off-Air
396,"X7Zwright,pumpkin butte",146.985,-,0.6,Tone,100,100,23,23,NN,FM,5,"WY Campbell Wright, Pumpkin Butte NX7Z 146.985 OPEN On-Air"
397,"VJJsalida,methodist mountain",147.285,+,0.6,Cross,88.5,123,23,23,NN,FM,5,"CO Chaffee Salida, Methodist Mountain KB0VJJ 147.285 OPEN On-Air"
398,"CVUsalida,methodist mountain",145.295,-,0.6,Tone,107.2,107.2,23,23,NN,FM,5,"CO Chaffee Salida, Methodist Mountain KC0CVU 145.295 OPEN On-Air"
399,"CVUsalida,methodist mountain",449.65,-,5,Tone,107.2,107.2,23,23,NN,FM,5,"CO Chaffee Salida, Methodist Mountain KC0CVU 449.65 OPEN On-Air"
400,"Z0Nsalida,methodist mountain",449.925,-,5,TSQL,103.5,103.5,23,23,NN,FM,5,"CO Chaffee Salida, Methodist Mountain WZ0N 449.925 OPEN On-Air"
401,"JSCsalida,methodist mountain",449.975,-,5,TSQL,100,100,23,23,NN,FM,5,"CO Chaffee Salida, Methodist Mountain K0JSC 449.975 OPEN On-Air"
