Location,Name,Frequency,Duplex,Offset,Tone,rToneFreq,cToneFreq,DtcsCode,DtcsRxCode,DtcsPolarity,Mode,TStep,Comment
0,JUNholyoke,146.955,-,0.6,,88.5,88.5,23,23,NN,FM,5,CO Phillips Holyoke N0JUN 146.955 OPEN 
1,UGOogallala,146.76,-,0.6,Tone,123,123,23,23,NN,FM,5,NE Keith Ogallala N0UGO 146.76 OPEN On-Air
2,"JTBsterling,co",145.295,-,0.6,,88.5,88.5,23,23,NN,FM,5,"CO Logan Sterling, CO WA0JTB 145.295 OPEN On-Air"
3,VJJakron,145.4,-,0.6,Cross,88.5,123,23,23,NN,FM,5,CO Washington Akron KB0VJJ 145.4 OPEN On-Air
4,0FTakron,448.175,-,5,,88.5,88.5,23,23,NN,DIG,5,CO Morgan Akron W0FT 448.175 OPEN On-Air
5,KDCnorthplatte,146.835,-,0.6,,88.5,88.5,23,23,NN,FM,5,NE Lincoln North Platte K0KDC 146.835 OPEN On-Air
6,0NPnorthplatte,146.7,-,0.6,Cross,88.5,123,23,23,NN,FM,5,NE Lincoln North Platte NE0NP 146.7 OPEN Off-Air
7,0IQnorthplatte,147.33,+,0.6,Tone,123,123,23,23,NN,FM,5,NE Lincoln North Platte N0IQ 147.33 OPEN On-Air
8,0IQnorthplatte,444.4,+,5,Tone,123,123,23,23,NN,FM,5,NE Lincoln North Platte N0IQ 444.4 OPEN On-Air
9,UGOnorthplatte,146.94,-,0.6,Tone,123,123,23,23,NN,FM,5,NE Lincoln North Platte N0UGO 146.94 OPEN On-Air
10,UGOnorthplatte,442.25,+,5,Tone,123,123,23,23,NN,FM,5,NE Lincoln North Platte N0UGO 442.25 OPEN Off-Air
11,VHZalliance,147.015,+,0.6,,88.5,88.5,23,23,NN,FM,5,NE Box Butte Alliance N2VHZ 147.015 OPEN On-Air
12,NEBalliance,146.715,-,0.6,TSQL,103.5,103.5,23,23,NN,FM,5,NE Box Butte Alliance N0NEB 146.715 OPEN On-Air
13,NEBharrisburg,147,-,0.6,Tone,103.5,103.5,23,23,NN,FM,5,NE Banner Harrisburg N0NEB 147 OPEN On-Air
14,"7GRscottsbluff,stage hill",444.125,+,5,Tone,114.8,114.8,23,23,NN,FM,5,"NE Scotts Bluff Scottsbluff, Stage Hill WB7GR 444.125 OPEN On-Air"
15,G0Nscottsbluff,146.445,,0,TSQL,88.5,88.5,23,23,NN,FM,5,NE Scotts Bluff Scottsbluff AG0N 146.445 OPEN On-Air
16,"0FTfortmorgan, fort morgan eoc",448.2,-,5,,88.5,88.5,23,23,NN,DIG,5,"CO Morgan Fort Morgan, Fort Morgan EOC W0FT 448.2 OPEN On-Air"
17,KAVscottsbluff,444.825,+,5,,88.5,88.5,23,23,NN,FM,5,NE Scotts Bluff Scottsbluff W0KAV 444.825 OPEN On-Air
18,BQMscottsbluff,145.475,-,0.6,,88.5,88.5,23,23,NN,FM,5,NE Scotts Bluff Scottsbluff WD0BQM 145.475 OPEN On-Air
19,NEBscottsbluff,147.075,+,0.6,,88.5,88.5,23,23,NN,FM,5,NE Scotts Bluff Scottsbluff N0NEB 147.075 OPEN On-Air
20,SNOalbin,147.165,+,0.6,Tone,114.8,114.8,23,23,NN,FM,5,WY Laramie Albin KC7SNO 147.165 OPEN On-Air
21,"TAJmccook,180' tower s. of mccook",147.27,+,0.6,,88.5,88.5,23,23,NN,FM,5,"NE Red Willow McCook, 180' tower S. of McCook K0TAJ 147.27 OPEN On-Air"
22,UVWmccook,444.5,+,5,Tone,151.4,151.4,23,23,NN,FM,5,NE Frontier McCook N7UVW 444.5 OPEN On-Air
23,UVWmccook,444.8,+,5,Tone,162.2,162.2,23,23,NN,FM,5,NE Red Willow McCook N7UVW 444.8 OPEN On-Air
24,BQMmitchell,445.1,,0,TSQL,100,100,23,23,NN,FM,5,NE Scotts Bluff Mitchell WD0BQM 445.1 OPEN On-Air
25,GLDgoodland,147.03,+,0.6,Tone,88.5,88.5,23,23,NN,FM,5,KS Sherman Goodland KS0GLD 147.03 OPEN Off-Air
26,0AEstratton,146.895,-,0.6,Tone,103.5,103.5,23,23,NN,FM,5,CO Kit Carson Stratton KE0AE 146.895 OPEN On-Air
27,"7GRcheyenne,chalk bluffs",449.3,-,5,Tone,131.8,131.8,23,23,NN,DIG,5,"WY Laramie Cheyenne, Chalk Bluffs WB7GR 449.3 OPEN On-Air"
28,DZBoberlin,145.19,-,0.6,,88.5,88.5,23,23,NN,FM,5,KS Decatur Oberlin KB0DZB 145.19 OPEN On-Air
29,SOKcozad,147.135,+,0.6,,88.5,88.5,23,23,NN,FM,5,NE Dawson Cozad W0SOK 147.135 OPEN Off-Air
30,UVPgordon,146.67,-,0.6,,88.5,88.5,23,23,NN,FM,5,NE Sheridan Gordon N0UVP 146.67 OPEN Off-Air
31,"V8Qcolby,k-link",444.75,+,5,TSQL,162.2,162.2,23,23,NN,FM,5,"KS Thomas Colby, K-Link NV8Q 444.75 OPEN "
32,W0Kcolby,146.82,-,0.6,TSQL,156.7,156.7,23,23,NN,FM,5,KS Thomas Colby NW0K 146.82 OPEN On-Air
33,"FLOchadron,nebraska national forest",147.36,+,0.6,TSQL,123,123,23,23,NN,FM,5,"NE Dawes Chadron, Nebraska National Forest W0FLO 147.36 OPEN On-Air"
34,ECTcolby,444.4,+,5,Tone,141.3,141.3,23,23,NN,FM,5,KS Thomas Colby K0ECT 444.4 OPEN On-Air
35,FLOchadron,145.62,,0,TSQL,100,100,23,23,NN,FM,5,NE Dawes Chadron W0FLO 145.62 OPEN On-Air
36,0VLlexington,146.85,-,0.6,TSQL,123,123,23,23,NN,FM,5,NE Dawson Lexington N0VL 146.85 OPEN On-Air
37,chadron,446.3,,0,,88.5,88.5,23,23,NN,FM,5,NE Dawes Chadron  446.3 OPEN On-Air
38,"SNOcheyenne,denver hill",146.775,-,0.6,Tone,114.8,114.8,23,23,NN,FM,5,"WY Laramie Cheyenne, Denver Hill KC7SNO 146.775 OPEN On-Air"
39,SWRcheyenne,145.235,-,0.6,Tone,114.8,114.8,23,23,NN,FM,5,WY Laramie Cheyenne KB7SWR 145.235 OPEN On-Air
40,"DHFcheyenne,old airport control tower",448.95,-,5,TSQL,151.4,151.4,23,23,NN,DIG,5,"WY Laramie Cheyenne, Old airport control tower KC7DHF 448.95 OPEN On-Air"
41,"SNOcheyenne,north park",147.105,+,0.6,Cross,114.8,91.5,23,23,NN,FM,5,"WY Laramie Cheyenne, North Park KC7SNO 147.105 OPEN On-Air"
42,JJYcheyenne,449.9,-,5,TSQL,100,100,23,23,NN,FM,5,WY Laramie Cheyenne N7JJY 449.9 OPEN On-Air
43,"UPSgreeley,unc",146.85,-,0.6,TSQL,100,100,23,23,NN,FM,5,"CO Weld Greeley, UNC W0UPS 146.85 OPEN On-Air"
44,KWDgreeley,147,+,0.6,TSQL,100,100,23,23,NN,DIG,5,CO Weld Greeley KC0KWD 147 OPEN On-Air
45,KWDgreeley,448.475,-,5,Tone,100,100,23,23,NN,FM,5,CO Weld Greeley KC0KWD 448.475 OPEN On-Air
46,AENgreeley,449.325,-,5,Tone,136.5,136.5,23,23,NN,DIG,5,CO Weld Greeley WR0AEN 449.325 OPEN On-Air
47,"0OJgreeley,unc",449.725,-,5,Tone,127.3,127.3,23,23,NN,FM,5,"CO Weld Greeley, UNC K0OJ 449.725 OPEN On-Air"
48,"RTSgenoa,limon",446.7375,-,5,,88.5,88.5,23,23,NN,DIG,5,"CO Lincoln Genoa, Limon K0RTS 446.7375 OPEN On-Air"
49,0AEgenoa,147.06,+,0.6,Tone,103.5,103.5,23,23,NN,DIG,5,CO Lincoln Genoa KE0AE 147.06 OPEN On-Air
50,"PFJcheyenne,south",449.9375,-,5,,88.5,88.5,23,23,NN,DIG,5,"WY Laramie Cheyenne, South K7PFJ 449.9375 OPEN On-Air"
51,UPScedarpoint,449.25,-,5,TSQL,123,123,23,23,NN,FM,5,CO Elbert Cedar Point K0UPS 449.25 OPEN On-Air
52,R0Abrokenbow,146.865,-,0.6,,88.5,88.5,23,23,NN,FM,5,NE Custer Broken Bow KR0A 146.865 OPEN Off-Air
53,R0Abrokenbow,147.06,+,0.6,,88.5,88.5,23,23,NN,FM,5,NE Custer Broken Bow KR0A 147.06 OPEN On-Air
54,0ANedison,146.745,-,0.6,,88.5,88.5,23,23,NN,FM,5,NE Furnas Edison KD0AN 146.745 OPEN On-Air
55,"RFIseverance,cactus hill",447.2,-,5,Tone,82.5,82.5,23,23,NN,FM,5,"CO Weld Severance, Cactus Hill N6RFI 447.2 OPEN On-Air"
56,0RGhudson,449.925,-,5,TSQL,114.8,114.8,23,23,NN,FM,5,CO Weld Hudson KD0RG 449.925 OPEN On-Air
57,"DMRfortcollins, timnath",446.775,-,5,,88.5,88.5,23,23,NN,DIG,5,"CO Larimer Fort Collins, Timnath W0DMR 446.775 OPEN On-Air"
58,"DMRfortcollins, timnath",147.39,+,0.6,,88.5,88.5,23,23,NN,DIG,5,"CO Larimer Fort Collins, Timnath W0DMR 147.39 OPEN On-Air"
59,UPSwellington,448.325,-,5,Tone,110.9,110.9,23,23,NN,FM,5,CO Larimer Wellington WB7UPS 448.325 OPEN On-Air
60,0SJlochbuie,447.625,-,5,Tone,100,100,23,23,NN,FM,5,CO Adams Lochbuie KE0SJ 447.625 OPEN On-Air
61,"UPSloveland,budweiser event center",448.025,-,5,TSQL,100,100,23,23,NN,DIG,5,"CO Larimer Loveland, Budweiser Event Center W0UPS 448.025 OPEN On-Air"
62,0KCfortlupton,224.96,-,1.6,,88.5,88.5,23,23,NN,FM,5,CO Weld Fort Lupton AC0KC 224.96 OPEN On-Air
63,VJRwallace,444.6,+,5,Tone,146.2,146.2,23,23,NN,FM,5,KS Wallace Wallace WA0VJR 444.6 OPEN On-Air
64,0KCfortlupton,447.3,-,5,Tone,107.2,107.2,23,23,NN,FM,5,CO Weld Fort Lupton AC0KC 447.3 OPEN On-Air
65,VJDhugo,447,-,5,Tone,103.5,103.5,23,23,NN,DIG,5,CO Lincoln Hugo KC0VJD 447 OPEN On-Air
66,PCAloomis,146.895,-,0.6,TSQL,123,123,23,23,NN,FM,5,NE Phelps Loomis K0PCA 146.895 OPEN On-Air
67,"QEYfortcollins, csu durward hall",147.36,+,0.6,TSQL,100,100,23,23,NN,FM,5,"CO Larimer Fort Collins, CSU Durward Hall W0QEY 147.36 OPEN On-Air"
68,"QEYfortcollins, csu durward hall",449.85,-,5,TSQL,100,100,23,23,NN,FM,5,"CO Larimer Fort Collins, CSU Durward Hall W0QEY 449.85 OPEN On-Air"
69,"QEYfortcollins, csu durward hall",446.8125,-,5,,88.5,88.5,23,23,NN,DIG,5,"CO Larimer Fort Collins, CSU Durward Hall W0QEY 446.8125 OPEN On-Air"
70,7RFfortcollins,447.725,-,5,Tone,131.8,131.8,23,23,NN,FM,5,CO Larimer Fort Collins W7RF 447.725 OPEN On-Air
71,6VVloveland,224.32,-,1.6,TSQL,100,100,23,23,NN,FM,5,CO Larimer Loveland KN6VV 224.32 OPEN Off-Air
72,"LRAloveland,namaqua hill",449.575,-,5,Tone,100,100,23,23,NN,FM,5,"CO Larimer Loveland, Namaqua Hill W0LRA 449.575 OPEN On-Air"
73,1TJfortcollins,1283.55,-,20,Tone,100,100,23,23,NN,FM,5,CO Larimer Fort Collins K1TJ 1283.55 OPEN On-Air
74,SWRcheyenne,448.15,-,5,Tone,100,100,23,23,NN,FM,5,WY Laramie Cheyenne KB7SWR 448.15 OPEN Off-Air
75,RBTfortcollins,447.45,-,5,Tone,123,123,23,23,NN,FM,5,CO Larimer Fort Collins KC0RBT 447.45 OPEN On-Air
76,AOLfortcollins,446.7375,-,5,,88.5,88.5,23,23,NN,DIG,5,CO Larimer Fort Collins N0AOL 446.7375 OPEN On-Air
77,"GURdenver,green valley ranch",448.15,-,5,TSQL,141.3,141.3,23,23,NN,FM,5,"CO Denver Denver, Green Valley Ranch K0GUR 448.15 OPEN On-Air"
78,"KOMlenora,k-link",146.88,-,0.6,TSQL,162.2,162.2,23,23,NN,FM,5,"KS Norton Lenora, K-Link N0KOM 146.88 OPEN On-Air"
79,"LRAloveland,namaqua hill",147.195,+,0.6,Tone,100,100,23,23,NN,FM,5,"CO Larimer Loveland, Namaqua Hill W0LRA 147.195 OPEN On-Air"
80,0DEsimla,147.105,+,0.6,TSQL,107.2,107.2,23,23,NN,FM,5,CO Elbert Simla WA0DE 147.105 OPEN On-Air
81,"PFJfortcollins, horsetooth mountain",446.75,-,5,,88.5,88.5,23,23,NN,DIG,5,"CO Larimer Fort Collins, Horsetooth Mountain K7PFJ 446.75 OPEN On-Air"
82,"VGDfortcollins , horsetooth mountain",145.265,-,0.6,,88.5,88.5,23,23,NN,DIG,5,"CO Larimer Fort Collins , Horsetooth Mountain KB0VGD 145.265 OPEN On-Air"
83,"0SFfortcollins, horsetooth mountain",927.825,-,25,TSQL,100,100,23,23,NN,FM,5,"CO Larimer Fort Collins, Horsetooth Mountain AB0SF 927.825 OPEN On-Air"
84,"UPSfortcollins, horsetooth mountain",145.115,-,0.6,TSQL,100,100,23,23,NN,FM,5,"CO Larimer Fort Collins, Horsetooth Mountain W0UPS 145.115 OPEN On-Air"
85,"UPSfortcollins, horsetooth mountain",224.52,-,1.6,TSQL,100,100,23,23,NN,FM,5,"CO Larimer Fort Collins, Horsetooth Mountain W0UPS 224.52 OPEN Off-Air"
86,"UPSfortcollins, horsetooth mountain",447.275,-,5,TSQL,100,100,23,23,NN,FM,5,"CO Larimer Fort Collins, Horsetooth Mountain W0UPS 447.275 OPEN On-Air"
87,"1TJfortcollins, horsetooth mountain",927.95,-,25,TSQL,100,100,23,23,NN,FM,5,"CO Larimer Fort Collins, Horsetooth Mountain K1TJ 927.95 OPEN On-Air"
88,SNUwheatland,146.88,-,0.6,TSQL,100,100,23,23,NN,FM,5,WY Platte Wheatland WA7SNU 146.88 OPEN On-Air
89,7AFwheatland,224.68,-,1.6,,88.5,88.5,23,23,NN,FM,5,WY Platte Wheatland AE7AF 224.68 OPEN On-Air
90,0HCparker,927.8375,-,25.8,Tone,100,100,23,23,NN,DIG,5,CO Douglas Parker KI0HC 927.8375 OPEN On-Air
91,SNUwheatland,449.625,-,5,Tone,151.4,151.4,23,23,NN,FM,5,WY Platte Wheatland WA7SNU 449.625 OPEN On-Air
92,EPAlongmont,448.525,-,5,Tone,151.4,151.4,23,23,NN,FM,5,CO Boulder Longmont N0EPA 448.525 OPEN On-Air
93,ENOlongmont,147.27,+,0.6,TSQL,100,100,23,23,NN,FM,5,CO Boulder Longmont W0ENO 147.27 OPEN On-Air
94,ENOlongmont,448.8,-,5,TSQL,88.5,88.5,23,23,NN,FM,5,CO Boulder Longmont W0ENO 448.8 OPEN On-Air
95,"ZUQfortcollins, christ mountain",449.425,-,5,Tone,94.8,94.8,23,23,NN,FM,5,"CO Larimer Fort Collins, Christ Mountain N0ZUQ 449.425 OPEN On-Air"
96,"ZUQfortcollins, christ mountain",927.875,-,25,DTCS,88.5,88.5,114,114,NN,FM,5,"CO Larimer Fort Collins, Christ Mountain N0ZUQ 927.875 OPEN Off-Air"
97,PWOcentennial,449.425,-,5,DTCS,88.5,88.5,23,23,NN,FM,5,CO Arapahoe Centennial K0PWO 449.425 OPEN Off-Air
98,"UDDaurora,smokey hill",448.5,-,5,Tone,100,100,23,23,NN,FM,5,"CO Denver Aurora, Smokey Hill KB0UDD 448.5 OPEN On-Air"
99,ZUQaurora,448.4,-,5,Tone,94.8,94.8,23,23,NN,FM,5,CO Arapahoe Aurora N0ZUQ 448.4 OPEN On-Air
100,0BGaurora,448.275,-,5,Tone,156.7,156.7,23,23,NN,FM,5,CO Arapahoe Aurora W0BG 448.275 OPEN On-Air
101,ANTaurora,448.825,-,5,,88.5,88.5,23,23,NN,DIG,5,CO Arapahoe Aurora WN7ANT 448.825 OPEN On-Air
102,M0Lainsworth,147.36,+,0.6,TSQL,225.7,225.7,23,23,NN,FM,5,NE Brown Ainsworth WM0L 147.36 OPEN On-Air
103,AENaurora,449.15,-,5,Tone,136.5,136.5,23,23,NN,DIG,5,CO Arapahoe Aurora WR0AEN 449.15 OPEN On-Air
104,OBAaurora,145.19,-,0.6,Cross,151.4,131.8,23,23,NN,FM,5,CO Arapahoe Aurora N0OBA 145.19 OPEN On-Air
105,"UDDaurora,smoky hill",145.4,-,0.8,Tone,100,100,23,23,NN,FM,5,"CO Arapahoe Aurora, Smoky Hill KB0UDD 145.4 OPEN On-Air"
106,"UPSfortcollins, buckhorn mountain",447.7,-,5,TSQL,100,100,23,23,NN,FM,5,"CO Larimer Fort Collins, Buckhorn Mountain W0UPS 447.7 OPEN On-Air"
107,0MLnorthglenn,147.045,+,0.6,Tone,123,123,23,23,NN,FM,5,CO Adams Northglenn K0ML 147.045 OPEN On-Air
108,"UPSfortcollins, buckhorn mountain",146.625,-,0.6,TSQL,100,100,23,23,NN,FM,5,"CO Larimer Fort Collins, Buckhorn Mountain W0UPS 146.625 OPEN On-Air"
109,"UPSfortcollins, buckhorn mountain",224.84,-,1.6,TSQL,100,100,23,23,NN,FM,5,"CO Larimer Fort Collins, Buckhorn Mountain W0UPS 224.84 OPEN On-Air"
110,RCZalma,145.205,-,0.6,,88.5,88.5,23,23,NN,FM,5,NE Harlan Alma KA0RCZ 145.205 OPEN On-Air
111,"0IAboulder,gunbarrel hill",146.76,-,0.6,Tone,100,100,23,23,NN,FM,5,"CO Boulder Boulder, Gunbarrel Hill W0IA 146.76 OPEN On-Air"
112,LMAbroomfield,448.925,-,5,Tone,131.8,131.8,23,23,NN,FM,5,CO Boulder Broomfield W0LMA 448.925 OPEN On-Air
113,WYXbroomfield,449.825,-,5,Tone,103.5,103.5,23,23,NN,FM,5,CO Boulder Broomfield W0WYX 449.825 OPEN On-Air
114,Q8Mparker,448.7,-,5,Tone,146.2,146.2,23,23,NN,FM,5,CO Douglas Parker WQ8M 448.7 OPEN On-Air
115,"EOClaramie,pilot hill",447.225,-,5,,88.5,88.5,23,23,NN,DIG,5,"WY Albany Laramie, Pilot Hill WY7EOC 447.225 CLOSED On-Air"
116,FSXpunkincenter,449.9,-,5,Tone,107.2,107.2,23,23,NN,FM,5,CO Lincoln Punkin Center N1FSX 449.9 OPEN On-Air
117,UPSwestminster,449.3,-,5,Tone,100,100,23,23,NN,FM,5,CO Adams Westminster N1UPS 449.3 OPEN On-Air
118,"lusk,77 hill",147.33,+,0.6,,88.5,88.5,23,23,NN,FM,5,"WY Niobrara Lusk, 77 Hill  147.33 OPEN On-Air"
119,"WZLkearney,kearney water tower",147,-,0.6,Tone,123,123,23,23,NN,FM,5,"NE Buffalo Kearney, Kearney Water Tower KC0WZL 147 OPEN On-Air"
120,"JRLdenver,broadway plaza lofts",447.175,-,5,TSQL,100,100,23,23,NN,FM,5,"CO Denver Denver, Broadway Plaza Lofts W0JRL 447.175 OPEN On-Air"
121,PRAparker,445.075,-,5,,88.5,88.5,23,23,NN,DIG,5,CO Douglas Parker K0PRA 445.075 OPEN On-Air
122,"0SJboulder,blue mountain",145.475,-,0.6,Tone,100,100,23,23,NN,FM,5,"CO Jefferson Boulder, Blue Mountain KE0SJ 145.475 OPEN On-Air"
123,JXNdenver,146.715,-,0.6,TSQL,123,123,23,23,NN,FM,5,CO Denver Denver N0JXN 146.715 OPEN On-Air
124,EHPdenver,448.075,-,5,Tone,123,123,23,23,NN,FM,5,CO Denver Denver N5EHP 448.075 OPEN On-Air
125,KIZdenver,448.55,-,5,Tone,82.5,82.5,23,23,NN,FM,5,CO Denver Denver W0KIZ 448.55 OPEN Off-Air
126,FEZdenver,447.925,-,5,TSQL,100,100,23,23,NN,FM,5,CO Denver Denver K0FEZ 447.925 OPEN On-Air
127,TPTdenver,447.9,-,5,,88.5,88.5,23,23,NN,FM,5,CO Denver Denver WB0TPT 447.9 OPEN Off-Air
128,AENdenver,449.65,-,5,Tone,136.5,136.5,23,23,NN,DIG,5,CO Denver Denver WR0AEN 449.65 OPEN On-Air
129,AENdenver,449.675,-,5,Tone,136.5,136.5,23,23,NN,DIG,5,CO Denver Denver WR0AEN 449.675 OPEN On-Air
130,"UWRlaramie, pilot hill",53.03,-,1,,88.5,88.5,23,23,NN,FM,5,"WY Albany Laramie,  Pilot Hill K7UWR 53.03 OPEN Off-Air"
131,DBKkearney,147.39,+,0.6,TSQL,123,123,23,23,NN,FM,5,NE Buffalo Kearney KA0DBK 147.39 OPEN On-Air
132,RCZkearney,147.315,+,0.6,TSQL,123,123,23,23,NN,FM,5,NE Buffalo Kearney KA0RCZ 147.315 OPEN On-Air
133,RCZkearney,444.85,+,5,TSQL,74.4,74.4,23,23,NN,FM,5,NE Buffalo Kearney KA0RCZ 444.85 OPEN On-Air
134,PBWkearney,147.03,+,0.6,,88.5,88.5,23,23,NN,DIG,5,NE Buffalo Kearney KD0PBW 147.03 OPEN On-Air
135,0KYkearney,146.625,-,0.6,TSQL,123,123,23,23,NN,FM,5,NE Buffalo Kearney W0KY 146.625 OPEN On-Air
136,ECTelkader,444.3,+,5,TSQL,141.3,141.3,23,23,NN,FM,5,KS Logan Elkader K0ECT 444.3 OPEN On-Air
137,0HJphillipsburg,443.275,+,5,Tone,100,100,23,23,NN,FM,5,KS Phillips Phillipsburg AA0HJ 443.275 OPEN On-Air
138,PRAfranktown,446.85,-,5,,88.5,88.5,23,23,NN,DIG,5,CO Douglas Franktown K0PRA 446.85 OPEN On-Air
139,KOMlogan,442.3,+,5,TSQL,162.2,162.2,23,23,NN,FM,5,KS Phillips Logan N0KOM 442.3 OPEN On-Air
140,0DKboulder,146.73,-,0.6,TSQL,91.5,91.5,23,23,NN,FM,5,CO Boulder Boulder K0DK 146.73 OPEN Off-Air
141,0DSboulder,1283.8625,-,20,,88.5,88.5,23,23,NN,DIG,5,CO Boulder Boulder KC0DS 1283.8625 OPEN On-Air
142,0DSboulder,145.3875,-,0.6,,88.5,88.5,23,23,NN,DIG,5,CO Boulder Boulder KC0DS 145.3875 OPEN On-Air
143,"RCZaxtell,ntv studio",444.625,+,5,,88.5,88.5,23,23,NN,FM,5,"NE Kearney Axtell, NTV Studio KA0RCZ 444.625 OPEN On-Air"
144,"ESQparker,hess reservoir",447.525,-,5,Cross,203.5,146.2,23,23,NN,FM,5,"CO Douglas Parker, Hess Reservoir N0ESQ 447.525 OPEN On-Air"
145,EJLburwell,147.09,+,0.6,,88.5,88.5,23,23,NN,FM,5,NE Garfield Burwell W0EJL 147.09 OPEN On-Air
146,0DKboulder,449.4,-,5,Tone,91.5,91.5,23,23,NN,FM,5,CO Boulder Boulder K0DK 449.4 OPEN Off-Air
147,0IAboulder,449.55,-,5,Tone,100,100,23,23,NN,FM,5,CO Boulder Boulder W0IA 449.55 OPEN On-Air
148,0DSboulder,446.8625,-,5,,88.5,88.5,23,23,NN,DIG,5,CO Boulder Boulder KC0DS 446.8625 OPEN On-Air
149,"0SZboulder,mount thorodin",446.8,-,5,,88.5,88.5,23,23,NN,DIG,5,"CO Boulder Boulder, Mount Thorodin N0SZ 446.8 OPEN On-Air"
150,0DKboulder,1299.5,-,20,,88.5,88.5,23,23,NN,DIG,5,CO Boulder Boulder W0DK 1299.5 OPEN On-Air
151,0FHestespark,146.685,-,0.6,Tone,123,123,23,23,NN,FM,5,CO Larimer Estes Park N0FH 146.685 OPEN On-Air
152,0DKboulder,146.61,-,0.6,Tone,100,100,23,23,NN,FM,5,CO Boulder Boulder W0DK 146.61 OPEN Off-Air
153,"0DKboulder,table mesa",448.9,-,5,Tone,100,100,23,23,NN,FM,5,"CO Boulder Boulder, Table Mesa W0DK 448.9 OPEN On-Air"
154,"SSPlakewood,moffat treatment plant",147.21,+,0.6,TSQL,100,100,23,23,NN,FM,5,"CO Jefferson Lakewood, Moffat Treatment Plant KD0SSP 147.21 OPEN On-Air"
155,"SSPlakewood,moffat treatment plant",448.35,-,5,Tone,225.7,225.7,23,23,NN,DIG,5,"CO Jefferson Lakewood, Moffat Treatment Plant KD0SSP 448.35 OPEN On-Air"
156,"0DKboulder,table mountain",146.7,-,0.6,Tone,100,100,23,23,NN,FM,5,"CO Boulder Boulder, Table Mountain W0DK 146.7 OPEN On-Air"
157,"9SLcastlepines, daniels park",449.95,-,5,TSQL,77,77,23,23,NN,FM,5,"CO Douglas Castle Pines, Daniels Park W9SL 449.95 OPEN On-Air"
158,"7UWlaramie,university",146.61,-,0.6,,88.5,88.5,23,23,NN,DIG,5,"WY Albany Laramie, University N7UW 146.61 OPEN On-Air"
159,"0SZboulder,lee hill",445.05,-,5,,88.5,88.5,23,23,NN,DIG,5,"CO Boulder Boulder, Lee Hill N0SZ 445.05 OPEN On-Air"
160,"0SZboulder,lee hill",446.9875,-,5,,88.5,88.5,23,23,NN,DIG,5,"CO Boulder Boulder, Lee Hill N0SZ 446.9875 OPEN On-Air"
161,"0SZboulder,lee hill",447.75,-,5,TSQL,141.3,141.3,23,23,NN,FM,5,"CO Boulder Boulder, Lee Hill N0SZ 447.75 OPEN On-Air"
162,"CRAboulder,eldorado mountain",145.46,-,0.6,TSQL,107.2,107.2,23,23,NN,FM,5,"CO Boulder Boulder, Eldorado Mountain W0CRA 145.46 OPEN On-Air"
163,"CRAboulder,eldorado mountain",447.975,-,5,TSQL,107.2,107.2,23,23,NN,FM,5,"CO Boulder Boulder, Eldorado Mountain W0CRA 447.975 OPEN On-Air"
164,"0IAboulder,lee hill",224.02,-,1.6,,88.5,88.5,23,23,NN,FM,5,"CO Boulder Boulder, Lee Hill W0IA 224.02 OPEN On-Air"
165,"SNOlaramie,beacon hill",146.82,-,0.6,Tone,114.8,114.8,23,23,NN,FM,5,"WY Albany Laramie, Beacon Hill KC7SNO 146.82 OPEN On-Air"
166,"0TXlakewood,st anthony medical campus",447.825,-,5,DTCS,88.5,88.5,73,73,NN,NFM,5,"CO Jefferson Lakewood, St Anthony Medical Campus W0TX 447.825 OPEN On-Air"
167,ELYlakewood,448.75,-,5,TSQL,100,100,23,23,NN,FM,5,CO Jefferson Lakewood N0ELY 448.75 OPEN On-Air
168,"0NMhillcity, k-link",443.7,+,5,Tone,162.2,162.2,23,23,NN,FM,5,"KS Graham Hill City, K-Link N0NM 443.7 OPEN On-Air"
169,0FHestespark,449.8,-,5,Tone,123,123,23,23,NN,FM,5,CO Larimer Estes Park N0FH 449.8 OPEN On-Air
170,WPMtribune,442.175,+,5,Tone,156.7,156.7,23,23,NN,FM,5,KS Greeley Tribune K0WPM 442.175 OPEN On-Air
171,"VGDgolden,table mountain",446.975,-,5,,88.5,88.5,23,23,NN,DIG,5,"CO Jefferson Golden, Table Mountain KB0VGD 446.975 OPEN On-Air"
172,"0TXlakewood,green mountain",147.33,+,0.6,Tone,100,100,23,23,NN,FM,5,"CO Jefferson Lakewood, Green Mountain W0TX 147.33 OPEN On-Air"
173,"0TXlakewood,green mountain",224.38,-,1.6,TSQL,100,100,23,23,NN,FM,5,"CO Jefferson Lakewood, Green Mountain W0TX 224.38 OPEN On-Air"
174,"0TXlakewood,green mtn",449.775,-,5,TSQL,100,100,23,23,NN,DIG,5,"CO Jefferson Lakewood, Green Mtn W0TX 449.775 OPEN On-Air"
175,ARWphillipsburg,442.725,+,5,,88.5,88.5,23,23,NN,FM,5,KS Phillips Phillipsburg KD0ARW 442.725 OPEN On-Air
176,0HJphillipsburg,147.12,+,0.6,,88.5,88.5,23,23,NN,FM,5,KS Phillips Phillipsburg AA0HJ 147.12 OPEN On-Air
177,0JZgoldhill,146.91,+,0.6,Cross,123,127.3,23,23,NN,FM,5,CO Boulder Gold Hill W0JZ 146.91 OPEN On-Air
178,"0HGallenspark,afpd station #5",147.03,+,0.6,Tone,100,100,23,23,NN,FM,5,"CO Boulder Allenspark, AFPD Station #5 KI0HG 147.03 OPEN On-Air"
179,"0TXlakewood,green mountain",53.09,-,1.7,Tone,107.2,107.2,23,23,NN,FM,5,"CO Jefferson Lakewood, Green Mountain W0TX 53.09 OPEN On-Air"
180,PYYgolden,448.125,-,5,Tone,107.2,107.2,23,23,NN,FM,5,CO Jefferson Golden N0PYY 448.125 OPEN On-Air
181,PYYgolden,927.7875,-,25,Tone,156.7,156.7,23,23,NN,FM,5,CO Jefferson Golden N0PYY 927.7875 OPEN On-Air
182,0GVgolden,448.975,-,5,Tone,123,123,23,23,NN,FM,5,CO Jefferson Golden W0GV 448.975 OPEN On-Air
183,"0SZgolden,lookout mountain",145.37,-,0.6,,88.5,88.5,23,23,NN,DIG,5,"CO Jefferson Golden, Lookout Mountain N0SZ 145.37 OPEN On-Air"
184,"CDSgolden,lookout mountain",1283.9625,-,20,,88.5,88.5,23,23,NN,DIG,5,"CO Jefferson Golden, Lookout Mountain W0CDS 1283.9625 OPEN On-Air"
185,"CDSgolden,lookout mountain",1299.9,,0,,88.5,88.5,23,23,NN,DIG,5,"CO Jefferson Golden, Lookout Mountain W0CDS 1299.9 OPEN On-Air"
186,"CDSgolden,lookout mountain",145.25,-,0.6,,88.5,88.5,23,23,NN,DIG,5,"CO Jefferson Golden, Lookout Mountain W0CDS 145.25 OPEN On-Air"
187,"CDSgolden,lookout mountain",446.9625,-,5,,88.5,88.5,23,23,NN,DIG,5,"CO Jefferson Golden, Lookout Mountain W0CDS 446.9625 OPEN On-Air"
188,"YZTgolden,lookout",446.8375,-,5,,88.5,88.5,23,23,NN,DIG,5,"CO Jefferson Golden, Lookout WA2YZT 446.8375 OPEN On-Air"
189,"0KUgolden,lookout mountain",449.625,-,5,TSQL,141.3,141.3,23,23,NN,FM,5,"CO Jefferson Golden, Lookout Mountain W0KU 449.625 OPEN On-Air"
190,FUIhotsprings,146.475,,0,TSQL,146.2,146.2,23,23,NN,FM,5,SD Fall River Hot Springs W0FUI 146.475 OPEN On-Air
191,"0HShotsprings, battle mountain",146.7,-,0.6,TSQL,146.2,146.2,23,23,NN,FM,5,"SD Fall River Hot Springs, Battle Mountain K0HS 146.7 OPEN On-Air"
192,"LXXmorrison,mt. morrison",53.17,-,1.7,Tone,107.2,107.2,23,23,NN,FM,5,"CO Jefferson Morrison, Mt. Morrison N6LXX 53.17 OPEN On-Air"
193,"LXXmorrison,mt. morrison",447.875,-,5,TSQL,107.2,107.2,23,23,NN,FM,5,"CO Jefferson Morrison, Mt. Morrison N6LXX 447.875 OPEN On-Air"
194,"0GOgolden,guy hill",449.75,-,5,TSQL,103.5,103.5,23,23,NN,FM,5,"CO Jefferson Golden, Guy Hill KI0GO 449.75 OPEN On-Air"
195,"POHgolden,guy hill",224.74,-,1.6,TSQL,88.5,88.5,23,23,NN,FM,5,"CO Jefferson Golden, Guy Hill N0POH 224.74 OPEN On-Air"
196,"T0Cgolden,guy hill",145.22,-,0.6,TSQL,103.5,103.5,23,23,NN,DIG,5,"CO Jefferson Golden, Guy Hill WT0C 145.22 OPEN On-Air"
197,"IBMgolden,guy hill",448.85,-,5,TSQL,88.5,88.5,23,23,NN,FM,5,"CO Jefferson Golden, Guy Hill K0IBM 448.85 OPEN On-Air"
198,"MHUgolden,guy hill",224,-,1.6,TSQL,103.5,103.5,23,23,NN,FM,5,"CO Jefferson Golden, Guy Hill N0MHU 224 OPEN On-Air"
199,"CBIgolden,guy hill",147.15,+,0.6,TSQL,100,100,23,23,NN,FM,5,"CO Jefferson Golden, Guy Hill W0CBI 147.15 OPEN On-Air"
200,"TUBcentennial,warren mountain",146.88,-,0.6,Tone,100,100,23,23,NN,FM,5,"CO Jefferson Centennial, Warren Mountain WB0TUB 146.88 OPEN On-Air"
201,"TUBcentennial,warren mountain",449.6,-,5,Tone,100,100,23,23,NN,FM,5,"CO Jefferson Centennial, Warren Mountain WB0TUB 449.6 OPEN On-Air"
202,"VJJboulder,thorodin mountain",145.31,-,0.6,Cross,88.5,123,23,23,NN,FM,5,"CO Gilpin Boulder, Thorodin Mountain KB0VJJ 145.31 OPEN On-Air"
203,"MDPfalcon,black forest",447.625,-,5,TSQL,100,100,23,23,NN,FM,5,"CO El Paso Falcon, Black Forest KD0MDP 447.625 OPEN On-Air"
204,"0SZdenver,thorodin mountain",449.225,-,5,TSQL,141.3,141.3,23,23,NN,FM,5,"CO Gilpin Denver, Thorodin Mountain N0SZ 449.225 OPEN On-Air"
205,"WWVheartwell,kgin tv tower",146.82,-,0.6,TSQL,123,123,23,23,NN,FM,5,"NE Kearney Heartwell, KGIN TV Tower W0WWV 146.82 OPEN On-Air"
206,"0HCgolden,centennial cone",927.8375,-,25.8,DTCS,88.5,88.5,205,205,NN,DIG,5,"CO Jefferson Golden, Centennial Cone KI0HC 927.8375 OPEN On-Air"
207,"0TXdenver,centennial cone",446.7875,-,5,,88.5,88.5,23,23,NN,DIG,5,"CO Jefferson Denver, Centennial Cone W0TX 446.7875 OPEN On-Air"
208,"FEZgolden,centennial cone",146.985,-,0.6,TSQL,100,100,23,23,NN,FM,5,"CO Denver Golden, Centennial Cone K0FEZ 146.985 OPEN On-Air"
209,"0SJgolden,centennial cone",145.28,-,0.6,Tone,100,100,23,23,NN,FM,5,"CO Jefferson Golden, Centennial Cone KE0SJ 145.28 OPEN On-Air"
210,"0SJgolden,centennial cone",449.525,-,5,,88.5,88.5,23,23,NN,FM,5,"CO Jefferson Golden, Centennial Cone KE0SJ 449.525 OPEN On-Air"
211,"0TXgolden,centennial cone",448.625,-,5,TSQL,100,100,23,23,NN,FM,5,"CO Jefferson Golden, Centennial Cone W0TX 448.625 OPEN On-Air"
212,"TUBgolden,centennial cone",146.64,-,0.6,Tone,100,100,23,23,NN,FM,5,"CO Jefferson Golden, Centennial Cone WB0TUB 146.64 OPEN On-Air"
213,0RMrollinsville,224.6,-,1.6,Tone,100,100,23,23,NN,FM,5,CO Gilpin Rollinsville W0RM 224.6 OPEN 
214,OQAscottcity,146.7,-,0.6,TSQL,141.3,141.3,23,23,NN,DIG,5,KS Scott Scott City WA0OQA 146.7 OPEN On-Air
215,GUQevergreen,145.34,-,0.6,Cross,103.5,127.3,23,23,NN,FM,5,CO Jefferson Evergreen KE4GUQ 145.34 OPEN On-Air
216,"0SZevergreen,lower squaw mountain",145.175,-,0.6,DTCS,88.5,88.5,73,73,NN,DIG,5,"CO Clear Creek Evergreen, Lower Squaw Mountain N0SZ 145.175 OPEN Off-Air"
217,"OWYconifer,critchell mountain",447.5,-,5,TSQL,88.5,88.5,23,23,NN,FM,5,"CO Jefferson Conifer, Critchell Mountain N0OWY 447.5 OPEN On-Air"
218,"0MIscottcity, k-link",444.95,+,5,TSQL,100,100,23,23,NN,FM,5,"KS Scott Scott City, K-Link W0MI 444.95 OPEN On-Air"
219,falcon,447.2,-,5,Tone,151.4,151.4,23,23,NN,DIG,5,CO El Paso Falcon  447.2 OPEN Testing
220,"0KQevergreen,saddleback mountain",447.85,-,5,TSQL,141.3,141.3,23,23,NN,FM,5,"CO Clear Creek Evergreen, Saddleback Mountain AC0KQ 447.85 OPEN On-Air"
