Location,Name,Frequency,Duplex,Offset,Tone,rToneFreq,cToneFreq,DtcsCode,DtcsRxCode,DtcsPolarity,Mode,TStep,Comment
212,"CDSgolden,lookout mountain",1299.9,,0,,88.5,88.5,23,23,NN,DIG,5,"CO Jefferson Golden, Lookout Mountain W0CDS 1299.9 OPEN On-Air"
213,"CDSgolden,lookout mountain",145.25,-,0.6,,88.5,88.5,23,23,NN,DIG,5,"CO Jefferson Golden, Lookout Mountain W0CDS 145.25 OPEN On-Air"
214,"CDSgolden,lookout mountain",446.9625,-,5,,88.5,88.5,23,23,NN,DIG,5,"CO Jefferson Golden, Lookout Mountain W0CDS 446.9625 OPEN On-Air"
215,"YZTgolden,lookout",446.8375,-,5,,88.5,88.5,23,23,NN,DIG,5,"CO Jefferson Golden, Lookout WA2YZT 446.8375 OPEN On-Air"
216,"0KUgolden,lookout mountain",449.625,-,5,TSQL,141.3,141.3,23,23,NN,FM,5,"CO Jefferson Golden, Lookout Mountain W0KU 449.625 OPEN On-Air"
217,"0SZfairplay,badger",446.7625,-,5,,88.5,88.5,23,23,NN,DIG,5,"CO Park Fairplay, Badger N0SZ 446.7625 OPEN On-Air"
218,PYYgolden,448.125,-,5,Tone,107.2,107.2,23,23,NN,FM,5,CO Jefferson Golden N0PYY 448.125 OPEN On-Air
219,PYYgolden,927.7875,-,25,Tone,156.7,156.7,23,23,NN,FM,5,CO Jefferson Golden N0PYY 927.7875 OPEN On-Air
220,0GVgolden,448.975,-,5,Tone,123,123,23,23,NN,FM,5,CO Jefferson Golden W0GV 448.975 OPEN On-Air
221,0KMcenter,146.64,-,0.6,TSQL,77,77,23,23,NN,FM,5,CO Rio Grande Center N0KM 146.64 OPEN On-Air
222,"5MLtaos,ski valley",147.14,+,0.6,Tone,67,67,23,23,NN,FM,5,"NM Taos Taos, Ski Valley NM5ML 147.14 OPEN On-Air"
223,0KMcenter,447.1,-,5,Tone,77,77,23,23,NN,FM,5,CO Saguache Center N0KM 447.1 OPEN On-Air
224,0KCfortlupton,447.3,-,5,Tone,107.2,107.2,23,23,NN,FM,5,CO Weld Fort Lupton AC0KC 447.3 OPEN On-Air
225,"TSVtaos,wheeler peak",444.975,+,5,Tone,123,123,23,23,NN,FM,5,"NM Taos Taos, Wheeler Peak N5TSV 444.975 OPEN On-Air"
226,"VGDgolden,table mountain",446.975,-,5,,88.5,88.5,23,23,NN,DIG,5,"CO Jefferson Golden, Table Mountain KB0VGD 446.975 OPEN On-Air"
227,"LEMangelfire, agua fria peak",147.34,+,0.6,Tone,100,100,23,23,NN,FM,5,"NM Colfax Angel Fire, Agua Fria Peak N5LEM 147.34 OPEN On-Air"
228,LMAbroomfield,448.925,-,5,Tone,131.8,131.8,23,23,NN,FM,5,CO Boulder Broomfield W0LMA 448.925 OPEN On-Air
229,WYXbroomfield,449.825,-,5,Tone,103.5,103.5,23,23,NN,FM,5,CO Boulder Broomfield W0WYX 449.825 OPEN On-Air
230,0KCfortlupton,224.96,-,1.6,,88.5,88.5,23,23,NN,FM,5,CO Weld Fort Lupton AC0KC 224.96 OPEN On-Air
231,"0TXgolden,centennial cone",448.625,-,5,TSQL,100,100,23,23,NN,FM,5,"CO Jefferson Golden, Centennial Cone W0TX 448.625 OPEN On-Air"
232,"FEZgolden,centennial cone",146.985,-,0.6,TSQL,100,100,23,23,NN,FM,5,"CO Denver Golden, Centennial Cone K0FEZ 146.985 OPEN On-Air"
233,"0SJgolden,centennial cone",145.28,-,0.6,Tone,100,100,23,23,NN,FM,5,"CO Jefferson Golden, Centennial Cone KE0SJ 145.28 OPEN On-Air"
234,"0SJgolden,centennial cone",449.525,-,5,,88.5,88.5,23,23,NN,FM,5,"CO Jefferson Golden, Centennial Cone KE0SJ 449.525 OPEN On-Air"
235,"0GOgolden,guy hill",449.75,-,5,TSQL,103.5,103.5,23,23,NN,FM,5,"CO Jefferson Golden, Guy Hill KI0GO 449.75 OPEN On-Air"
236,"POHgolden,guy hill",224.74,-,1.6,TSQL,88.5,88.5,23,23,NN,FM,5,"CO Jefferson Golden, Guy Hill N0POH 224.74 OPEN On-Air"
237,"TUBgolden,centennial cone",146.64,-,0.6,Tone,100,100,23,23,NN,FM,5,"CO Jefferson Golden, Centennial Cone WB0TUB 146.64 OPEN On-Air"
238,"T0Cgolden,guy hill",145.22,-,0.6,TSQL,103.5,103.5,23,23,NN,DIG,5,"CO Jefferson Golden, Guy Hill WT0C 145.22 OPEN On-Air"
239,"IBMgolden,guy hill",448.85,-,5,TSQL,88.5,88.5,23,23,NN,FM,5,"CO Jefferson Golden, Guy Hill K0IBM 448.85 OPEN On-Air"
240,"MHUgolden,guy hill",224,-,1.6,TSQL,103.5,103.5,23,23,NN,FM,5,"CO Jefferson Golden, Guy Hill N0MHU 224 OPEN On-Air"
241,"CBIgolden,guy hill",147.15,+,0.6,TSQL,100,100,23,23,NN,FM,5,"CO Jefferson Golden, Guy Hill W0CBI 147.15 OPEN On-Air"
242,JNIwagonmound,444.4,+,5,Tone,100,100,23,23,NN,FM,5,NM Mora Wagon Mound N7JNI 444.4 OPEN Off-Air
243,"0HCgolden,centennial cone",927.8375,-,25.8,DTCS,88.5,88.5,205,205,NN,DIG,5,"CO Jefferson Golden, Centennial Cone KI0HC 927.8375 OPEN On-Air"
244,"0TXdenver,centennial cone",446.7875,-,5,,88.5,88.5,23,23,NN,DIG,5,"CO Jefferson Denver, Centennial Cone W0TX 446.7875 OPEN On-Air"
245,"AENidahosprings, squaw mountain",449,-,5,TSQL,136.5,136.5,23,23,NN,FM,5,"CO Clear Creek Idaho Springs, Squaw Mountain WR0AEN 449 OPEN On-Air"
246,"PYYevergreen,squaw mountain",147.3,+,0.6,TSQL,103.5,103.5,23,23,NN,FM,5,"CO Clear Creek Evergreen, Squaw Mountain N0PYY 147.3 OPEN On-Air"
247,"CFIidahosprings, squaw mountain",448.675,-,5,TSQL,100,100,23,23,NN,FM,5,"CO Denver Idaho Springs, Squaw Mountain W0CFI 448.675 OPEN On-Air"
248,"0KQevergreen,saddleback mountain",447.85,-,5,TSQL,141.3,141.3,23,23,NN,FM,5,"CO Clear Creek Evergreen, Saddleback Mountain AC0KQ 447.85 OPEN On-Air"
249,"DUNidahosprings, squaw mountain",449.45,-,5,Cross,103.5,127.3,23,23,NN,FM,5,"CO Clear Creek Idaho Springs, Squaw Mountain K1DUN 449.45 OPEN On-Air"
250,"UDDidahosprings, squaw mountain",146.67,-,0.6,TSQL,100,100,23,23,NN,FM,5,"CO Clear Creek Idaho Springs, Squaw Mountain KB0UDD 146.67 OPEN On-Air"
251,"0SZidahosprings, squaw mountain",446.9375,-,5,,88.5,88.5,23,23,NN,DIG,5,"CO Clear Creek Idaho Springs, Squaw Mountain N0SZ 446.9375 OPEN On-Air"
252,"0SZidahosprings, squaw mountain",448.225,-,5,TSQL,141.3,141.3,23,23,NN,FM,5,"CO Clear Creek Idaho Springs, Squaw Mountain N0SZ 448.225 OPEN On-Air"
253,"CRAidahosprings, squaw mountain",145.145,-,0.6,TSQL,107.2,107.2,23,23,NN,FM,5,"CO Clear Creek Idaho Springs, Squaw Mountain W0CRA 145.145 OPEN On-Air"
254,"CRAidahosprings, squaw mountain",447.575,-,5,TSQL,107.2,107.2,23,23,NN,FM,5,"CO Clear Creek Idaho Springs, Squaw Mountain W0CRA 447.575 OPEN On-Air"
255,"0TXidahosprings, centennial cone",145.49,-,0.6,TSQL,100,100,23,23,NN,FM,5,"CO Jefferson Idaho Springs, Centennial Cone W0TX 145.49 OPEN On-Air"
256,"0TXidahosprings, squaw mountain",449.35,-,5,TSQL,100,100,23,23,NN,FM,5,"CO Clear Creek Idaho Springs, Squaw Mountain W0TX 449.35 OPEN On-Air"
257,"WYXidahosprings, squaw mountain",146.94,-,0.6,TSQL,103.5,103.5,23,23,NN,FM,5,"CO Clear Creek Idaho Springs, Squaw Mountain W0WYX 146.94 OPEN On-Air"
258,BAIensign,444.375,+,5,,88.5,88.5,23,23,NN,FM,5,KS Gray Ensign K0BAI 444.375 OPEN Off-Air
259,ROKdumas,443.0125,+,5,,88.5,88.5,23,23,NN,DIG,5,TX Moore Dumas KD5ROK 443.0125 OPEN On-Air
260,LTZdumas,444.35,+,5,Tone,88.5,88.5,23,23,NN,FM,5,TX Moore Dumas N5LTZ 444.35 OPEN On-Air
261,LSDnathrop,146.745,-,0.6,Tone,100,100,23,23,NN,FM,5,CO Chaffee Nathrop W0LSD 146.745 OPEN Off-Air
262,AKNforgan,147.39,+,0.6,,88.5,88.5,23,23,NN,FM,5,OK Beaver Forgan N5AKN 147.39 OPEN 
263,"G0Nidahosprings, squaw mountain",449.05,-,5,TSQL,107.2,107.2,23,23,NN,FM,5,"CO Denver Idaho Springs, Squaw Mountain WG0N 449.05 OPEN On-Air"
264,WBKspearman,443.2,+,5,Tone,88.5,88.5,23,23,NN,FM,5,TX Hansford Spearman KC5WBK 443.2 OPEN On-Air
265,DFQspearman,147.04,+,0.6,Tone,88.5,88.5,23,23,NN,FM,5,TX Hansford Spearman N5DFQ 147.04 OPEN 
266,DFQspearman,442,+,5,Tone,88.5,88.5,23,23,NN,FM,5,TX Hansford Spearman N5DFQ 442 OPEN 
267,"5EMwagonmound, turkey mtn",145.37,-,0.6,Tone,141.3,141.3,23,23,NN,FM,5,"NM Mora Wagon Mound, Turkey Mtn NM5EM 145.37 OPEN Off-Air"
268,"5MLwagonmound, turkey mountain",147.2,+,0.6,Tone,67,67,23,23,NN,FM,5,"NM Mora Wagon Mound, Turkey Mountain NM5ML 147.2 OPEN On-Air"
269,"MRCmaysville,co",145.325,-,0.6,Tone,100,100,23,23,NN,FM,5,"CO Chaffee Maysville, CO KD0MRC 145.325 OPEN On-Air"
270,0DKboulder,146.61,-,0.6,Tone,100,100,23,23,NN,FM,5,CO Boulder Boulder W0DK 146.61 OPEN Off-Air
271,"0DKboulder,table mesa",448.9,-,5,Tone,100,100,23,23,NN,FM,5,"CO Boulder Boulder, Table Mesa W0DK 448.9 OPEN On-Air"
272,"0DKboulder,table mountain",146.7,-,0.6,Tone,100,100,23,23,NN,FM,5,"CO Boulder Boulder, Table Mountain W0DK 146.7 OPEN On-Air"
273,"0IAboulder,gunbarrel hill",146.76,-,0.6,Tone,100,100,23,23,NN,FM,5,"CO Boulder Boulder, Gunbarrel Hill W0IA 146.76 OPEN On-Air"
274,"VJJboulder,thorodin mountain",145.31,-,0.6,Cross,88.5,123,23,23,NN,FM,5,"CO Gilpin Boulder, Thorodin Mountain KB0VJJ 145.31 OPEN On-Air"
275,"0SZdenver,thorodin mountain",449.225,-,5,TSQL,141.3,141.3,23,23,NN,FM,5,"CO Gilpin Denver, Thorodin Mountain N0SZ 449.225 OPEN On-Air"
276,0DSboulder,1283.8625,-,20,,88.5,88.5,23,23,NN,DIG,5,CO Boulder Boulder KC0DS 1283.8625 OPEN On-Air
277,0DSboulder,145.3875,-,0.6,,88.5,88.5,23,23,NN,DIG,5,CO Boulder Boulder KC0DS 145.3875 OPEN On-Air
278,"UFOfairplay,sacramento mountain",447.125,-,5,TSQL,103.5,103.5,23,23,NN,FM,5,"CO Park Fairplay, Sacramento Mountain KC0UFO 447.125 OPEN On-Air"
279,0DKboulder,449.4,-,5,Tone,91.5,91.5,23,23,NN,FM,5,CO Boulder Boulder K0DK 449.4 OPEN Off-Air
280,0IAboulder,449.55,-,5,Tone,100,100,23,23,NN,FM,5,CO Boulder Boulder W0IA 449.55 OPEN On-Air
281,0DSboulder,446.8625,-,5,,88.5,88.5,23,23,NN,DIG,5,CO Boulder Boulder KC0DS 446.8625 OPEN On-Air
282,"0SZboulder,mount thorodin",446.8,-,5,,88.5,88.5,23,23,NN,DIG,5,"CO Boulder Boulder, Mount Thorodin N0SZ 446.8 OPEN On-Air"
283,0DKboulder,1299.5,-,20,,88.5,88.5,23,23,NN,DIG,5,CO Boulder Boulder W0DK 1299.5 OPEN On-Air
284,"5MLtrespiedras, san antonio mountain",147.22,+,0.6,Tone,100,100,23,23,NN,FM,5,"NM Rio Arriba Tres Piedras, San Antonio Mountain NM5ML 147.22 OPEN On-Air"
285,"PFOtrespiedras,  san antonio mountain",146.76,-,0.6,Tone,67,67,23,23,NN,FM,5,"NM Rio Arriba Tres Piedras,  San Antonio Mountain KF5PFO 146.76 OPEN On-Air"
286,"HAMdodgecity, k-link",443.675,+,5,TSQL,162.2,162.2,23,23,NN,FM,5,"KS Ford Dodge City, K-Link K0HAM 443.675 OPEN On-Air"
287,0DKboulder,146.73,-,0.6,TSQL,91.5,91.5,23,23,NN,FM,5,CO Boulder Boulder K0DK 146.73 OPEN Off-Air
288,"VJJbreckenridge,bald mountain",147.39,+,0.6,Cross,88.5,123,23,23,NN,FM,5,"CO Summit Breckenridge, Bald Mountain KB0VJJ 147.39 OPEN On-Air"
289,5ISperryton,146.64,-,0.6,Tone,88.5,88.5,23,23,NN,FM,5,TX Ochiltree Perryton K5IS 146.64 OPEN 
290,U0Ldodgecity,147.03,+,0.6,Tone,123,123,23,23,NN,FM,5,KS Ford Dodge City KU0L 147.03 OPEN On-Air
291,U0Ldodgecity,442.375,+,5,Tone,123,123,23,23,NN,FM,5,KS Ford Dodge City KU0L 442.375 OPEN On-Air
292,EPAlongmont,448.525,-,5,Tone,151.4,151.4,23,23,NN,FM,5,CO Boulder Longmont N0EPA 448.525 OPEN On-Air
293,ENOlongmont,147.27,+,0.6,TSQL,100,100,23,23,NN,FM,5,CO Boulder Longmont W0ENO 147.27 OPEN On-Air
294,ENOlongmont,448.8,-,5,TSQL,88.5,88.5,23,23,NN,FM,5,CO Boulder Longmont W0ENO 448.8 OPEN On-Air
295,"JTBsterling,co",145.295,-,0.6,,88.5,88.5,23,23,NN,FM,5,"CO Logan Sterling, CO WA0JTB 145.295 OPEN On-Air"
296,"0SZbreckenridge,baldy",445.0875,-,5,,88.5,88.5,23,23,NN,DIG,5,"CO Fremont Breckenridge, Baldy N0SZ 445.0875 OPEN On-Air"
297,0RMrollinsville,224.6,-,1.6,Tone,100,100,23,23,NN,FM,5,CO Gilpin Rollinsville W0RM 224.6 OPEN 
298,ECTdodgecity,444.55,+,5,Tone,141.3,141.3,23,23,NN,FM,5,KS Ford Dodge City K0ECT 444.55 OPEN On-Air
299,"HAMransom,k-link",443.575,+,5,TSQL,162.2,162.2,23,23,NN,FM,5,"KS Ness Ransom, K-Link K0HAM 443.575 OPEN On-Air"
300,"0SZboulder,lee hill",445.05,-,5,,88.5,88.5,23,23,NN,DIG,5,"CO Boulder Boulder, Lee Hill N0SZ 445.05 OPEN On-Air"
301,"0SZboulder,lee hill",446.9875,-,5,,88.5,88.5,23,23,NN,DIG,5,"CO Boulder Boulder, Lee Hill N0SZ 446.9875 OPEN On-Air"
302,"0SZboulder,lee hill",447.75,-,5,TSQL,141.3,141.3,23,23,NN,FM,5,"CO Boulder Boulder, Lee Hill N0SZ 447.75 OPEN On-Air"
303,"CRAboulder,eldorado mountain",145.46,-,0.6,TSQL,107.2,107.2,23,23,NN,FM,5,"CO Boulder Boulder, Eldorado Mountain W0CRA 145.46 OPEN On-Air"
304,"CRAboulder,eldorado mountain",447.975,-,5,TSQL,107.2,107.2,23,23,NN,FM,5,"CO Boulder Boulder, Eldorado Mountain W0CRA 447.975 OPEN On-Air"
305,"0IAboulder,lee hill",224.02,-,1.6,,88.5,88.5,23,23,NN,FM,5,"CO Boulder Boulder, Lee Hill W0IA 224.02 OPEN On-Air"
306,"PFOtrespiedras, san antonio mountain",146.76,-,0.6,Tone,67,67,23,23,NN,FM,5,"NM Taos Tres Piedras, San Antonio Mountain KF5PFO 146.76 OPEN On-Air"
307,"0SZleadville,mosquito pass",445.05,-,5,,88.5,88.5,23,23,NN,DIG,5,"CO Lake Leadville, Mosquito Pass N0SZ 445.05 OPEN On-Air"
308,"5EMtrespiedras, san antonio mtn.",145.175,-,0.6,Tone,141.3,141.3,23,23,NN,FM,5,"NM Taos Tres Piedras, San Antonio Mtn. NM5EM 145.175 OPEN Off-Air"
309,"UPSgreeley,unc",146.85,-,0.6,TSQL,100,100,23,23,NN,FM,5,"CO Weld Greeley, UNC W0UPS 146.85 OPEN On-Air"
310,"0OJgreeley,unc",449.725,-,5,Tone,127.3,127.3,23,23,NN,FM,5,"CO Weld Greeley, UNC K0OJ 449.725 OPEN On-Air"
311,QMRbreckenridge,146.7,-,0.6,Tone,107.2,107.2,23,23,NN,FM,5,CO Summit Breckenridge WB0QMR 146.7 OPEN On-Air
312,"VJJleadville,mosquito pass",145.445,-,0.6,Tone,88.5,88.5,23,23,NN,FM,5,"CO Lake Leadville, Mosquito Pass KB0VJJ 145.445 OPEN On-Air"
313,ECTjetmore,444.5,+,5,TSQL,141.3,141.3,23,23,NN,FM,5,KS Hodgeman Jetmore K0ECT 444.5 OPEN On-Air
314,JUNholyoke,146.955,-,0.6,,88.5,88.5,23,23,NN,FM,5,CO Phillips Holyoke N0JUN 146.955 OPEN 
315,0JZgoldhill,146.91,+,0.6,Cross,123,127.3,23,23,NN,FM,5,CO Boulder Gold Hill W0JZ 146.91 OPEN On-Air
316,KWDgreeley,147,+,0.6,TSQL,100,100,23,23,NN,DIG,5,CO Weld Greeley KC0KWD 147 OPEN On-Air
317,KWDgreeley,448.475,-,5,Tone,100,100,23,23,NN,FM,5,CO Weld Greeley KC0KWD 448.475 OPEN On-Air
318,AENgreeley,449.325,-,5,Tone,136.5,136.5,23,23,NN,DIG,5,CO Weld Greeley WR0AEN 449.325 OPEN On-Air
319,5CJstinnett,443.4375,+,5,,88.5,88.5,23,23,NN,DIG,5,TX Hutchinson Stinnett KE5CJ 443.4375 OPEN On-Air
320,WDRstinnett,444.8,+,5,,88.5,88.5,23,23,NN,DIG,5,TX Hutchinson Stinnett W5WDR 444.8 OPEN On-Air
321,"PFOtaos,picuris peak",51.5,,0,Tone,100,100,23,23,NN,FM,5,"NM Taos Taos, Picuris Peak KF5PFO 51.5 OPEN On-Air"
322,"PFOtaos,picuris peak",147.12,+,0.6,Tone,67,67,23,23,NN,FM,5,"NM Taos Taos, Picuris Peak KF5PFO 147.12 OPEN On-Air"
323,"PFOtaos,picuris peak",224.4,-,1.6,Tone,225.7,225.7,23,23,NN,FM,5,"NM Taos Taos, Picuris Peak KF5PFO 224.4 OPEN On-Air"
324,"PFOtaos,picuris peak",449.875,-,5,Tone,123,123,23,23,NN,FM,5,"NM Taos Taos, Picuris Peak KF5PFO 449.875 OPEN Off-Air"
325,"YNAgunnison,w mountain or tenderfoot mountain",447.65,-,5,TSQL,151.4,151.4,23,23,NN,FM,5,"CO Gunnison Gunnison, W Mountain or Tenderfoot Mountain KB0YNA 447.65 OPEN On-Air"
326,"ZSNleadville,quail mountain",147.24,+,0.6,TSQL,156.7,156.7,23,23,NN,FM,5,"CO Lake Leadville, Quail Mountain N0ZSN 147.24 OPEN Off-Air"
327,"VJJwinterpark, winter park",147.285,+,0.6,Cross,88.5,123,23,23,NN,FM,5,"CO Grand Winter Park, Winter Park KB0VJJ 147.285 OPEN On-Air"
328,"DSTlogan,ute lake",147.34,+,0.6,Tone,131.8,131.8,23,23,NN,FM,5,"NM Quay Logan, Ute Lake K5DST 147.34 OPEN On-Air"
329,"0HGallenspark,afpd station #5",147.03,+,0.6,Tone,100,100,23,23,NN,FM,5,"CO Boulder Allenspark, AFPD Station #5 KI0HG 147.03 OPEN On-Air"
330,DZBoberlin,145.19,-,0.6,,88.5,88.5,23,23,NN,FM,5,KS Decatur Oberlin KB0DZB 145.19 OPEN On-Air
331,6VVloveland,224.32,-,1.6,TSQL,100,100,23,23,NN,FM,5,CO Larimer Loveland KN6VV 224.32 OPEN Off-Air
332,"LRAloveland,namaqua hill",449.575,-,5,Tone,100,100,23,23,NN,FM,5,"CO Larimer Loveland, Namaqua Hill W0LRA 449.575 OPEN On-Air"
333,"UPSloveland,budweiser event center",448.025,-,5,TSQL,100,100,23,23,NN,DIG,5,"CO Larimer Loveland, Budweiser Event Center W0UPS 448.025 OPEN On-Air"
334,CCCwinterpark,447.45,-,5,Tone,103.5,103.5,23,23,NN,FM,5,CO Grand Winter Park WA4CCC 447.45 OPEN On-Air
335,"LRAloveland,namaqua hill",147.195,+,0.6,Tone,100,100,23,23,NN,FM,5,"CO Larimer Loveland, Namaqua Hill W0LRA 147.195 OPEN On-Air"
336,CSFborger,147.06,+,0.6,,88.5,88.5,23,23,NN,FM,5,TX Hutchinson Borger WA5CSF 147.06 OPEN Off-Air
337,"DMRfortcollins, timnath",147.39,+,0.6,,88.5,88.5,23,23,NN,DIG,5,"CO Larimer Fort Collins, Timnath W0DMR 147.39 OPEN On-Air"
338,7RFfortcollins,447.725,-,5,Tone,131.8,131.8,23,23,NN,FM,5,CO Larimer Fort Collins W7RF 447.725 OPEN On-Air
339,"5PXdixon,cerro abajo",147.18,+,0.6,TSQL,100,100,23,23,NN,FM,5,"NM Rio Arriba Dixon, Cerro Abajo KD5PX 147.18 OPEN On-Air"
340,"RFIseverance,cactus hill",447.2,-,5,Tone,82.5,82.5,23,23,NN,FM,5,"CO Weld Severance, Cactus Hill N6RFI 447.2 OPEN On-Air"
341,WDRborger,147,+,0.6,TSQL,88.5,88.5,23,23,NN,DIG,5,TX Hutchinson Borger W5WDR 147 OPEN On-Air
342,"DMRfortcollins, timnath",446.775,-,5,,88.5,88.5,23,23,NN,DIG,5,"CO Larimer Fort Collins, Timnath W0DMR 446.775 OPEN On-Air"
343,1TJfortcollins,1283.55,-,20,Tone,100,100,23,23,NN,FM,5,CO Larimer Fort Collins K1TJ 1283.55 OPEN On-Air
344,RBTfortcollins,447.45,-,5,Tone,123,123,23,23,NN,FM,5,CO Larimer Fort Collins KC0RBT 447.45 OPEN On-Air
345,AOLfortcollins,446.7375,-,5,,88.5,88.5,23,23,NN,DIG,5,CO Larimer Fort Collins N0AOL 446.7375 OPEN On-Air
346,0FHestespark,146.685,-,0.6,Tone,123,123,23,23,NN,FM,5,CO Larimer Estes Park N0FH 146.685 OPEN On-Air
347,"0RVvail,bald mountain",146.61,-,0.6,Tone,107.2,107.2,23,23,NN,FM,5,"CO Eagle Vail, Bald Mountain K0RV 146.61 OPEN On-Air"
348,"QEYfortcollins, csu durward hall",147.36,+,0.6,TSQL,100,100,23,23,NN,FM,5,"CO Larimer Fort Collins, CSU Durward Hall W0QEY 147.36 OPEN On-Air"
349,"QEYfortcollins, csu durward hall",446.8125,-,5,,88.5,88.5,23,23,NN,DIG,5,"CO Larimer Fort Collins, CSU Durward Hall W0QEY 446.8125 OPEN On-Air"
350,5WXamarillo,146.94,-,0.6,Tone,88.5,88.5,23,23,NN,DIG,5,TX Potter Amarillo W5WX 146.94 OPEN On-Air
351,"PFJfortcollins, horsetooth mountain",446.75,-,5,,88.5,88.5,23,23,NN,DIG,5,"CO Larimer Fort Collins, Horsetooth Mountain K7PFJ 446.75 OPEN On-Air"
352,"VGDfortcollins , horsetooth mountain",145.265,-,0.6,,88.5,88.5,23,23,NN,DIG,5,"CO Larimer Fort Collins , Horsetooth Mountain KB0VGD 145.265 OPEN On-Air"
353,"QEYfortcollins, csu durward hall",449.85,-,5,TSQL,100,100,23,23,NN,FM,5,"CO Larimer Fort Collins, CSU Durward Hall W0QEY 449.85 OPEN On-Air"
354,"5SFchama,overlook mtn",147.08,+,0.6,Tone,162.2,162.2,23,23,NN,FM,5,"NM Rio Arriba Chama, Overlook Mtn W5SF 147.08 OPEN On-Air"
355,"0NMhillcity, k-link",443.7,+,5,Tone,162.2,162.2,23,23,NN,FM,5,"KS Graham Hill City, K-Link N0NM 443.7 OPEN On-Air"
356,"0SFfortcollins, horsetooth mountain",927.825,-,25,TSQL,100,100,23,23,NN,FM,5,"CO Larimer Fort Collins, Horsetooth Mountain AB0SF 927.825 OPEN On-Air"
357,"1TJfortcollins, horsetooth mountain",927.95,-,25,TSQL,100,100,23,23,NN,FM,5,"CO Larimer Fort Collins, Horsetooth Mountain K1TJ 927.95 OPEN On-Air"
358,"UPSfortcollins, horsetooth mountain",145.115,-,0.6,TSQL,100,100,23,23,NN,FM,5,"CO Larimer Fort Collins, Horsetooth Mountain W0UPS 145.115 OPEN On-Air"
359,"UPSfortcollins, horsetooth mountain",224.52,-,1.6,TSQL,100,100,23,23,NN,FM,5,"CO Larimer Fort Collins, Horsetooth Mountain W0UPS 224.52 OPEN Off-Air"
360,"UPSfortcollins, horsetooth mountain",447.275,-,5,TSQL,100,100,23,23,NN,FM,5,"CO Larimer Fort Collins, Horsetooth Mountain W0UPS 447.275 OPEN On-Air"
361,AFOvail,224.8,-,1.6,,88.5,88.5,23,23,NN,FM,5,CO Eagle Vail N0AFO 224.8 OPEN Off-Air
362,AFOvail,449.9,-,5,TSQL,107.2,107.2,23,23,NN,FM,5,CO Eagle Vail N0AFO 449.9 OPEN Off-Air
363,0FHestespark,449.8,-,5,Tone,123,123,23,23,NN,FM,5,CO Larimer Estes Park N0FH 449.8 OPEN On-Air
364,"PFJgranby,mt chauncey",446.875,-,5,,88.5,88.5,23,23,NN,DIG,5,"CO Clear Creek Granby, Mt Chauncey K7PFJ 446.875 OPEN On-Air"
365,YDWgranby,146.82,-,0.6,Tone,123,123,23,23,NN,FM,5,CO Grand Granby KA0YDW 146.82 OPEN 
366,EMAtucumcari,146.88,-,0.6,,88.5,88.5,23,23,NN,FM,5,NM Quay Tucumcari WA5EMA 146.88 OPEN On-Air
367,EMAtucumcari,224.98,-,1.6,,88.5,88.5,23,23,NN,FM,5,NM Quay Tucumcari WA5EMA 224.98 OPEN 
368,EMAtucumcari,443.75,+,5,,88.5,88.5,23,23,NN,FM,5,NM Quay Tucumcari WA5EMA 443.75 OPEN On-Air
369,0JScreede,146.925,-,0.6,,88.5,88.5,23,23,NN,FM,5,CO Mineral Creede WA0JS 146.925 OPEN Off-Air
370,UVWmccook,444.5,+,5,Tone,151.4,151.4,23,23,NN,FM,5,NE Frontier McCook N7UVW 444.5 OPEN On-Air
371,UVWmccook,444.8,+,5,Tone,162.2,162.2,23,23,NN,FM,5,NE Red Willow McCook N7UVW 444.8 OPEN On-Air
372,"KOMlenora,k-link",146.88,-,0.6,TSQL,162.2,162.2,23,23,NN,FM,5,"KS Norton Lenora, K-Link N0KOM 146.88 OPEN On-Air"
373,"TAJmccook,180' tower s. of mccook",147.27,+,0.6,,88.5,88.5,23,23,NN,FM,5,"NE Red Willow McCook, 180' tower S. of McCook K0TAJ 147.27 OPEN On-Air"
374,5GFgunnison,449.95,-,5,,88.5,88.5,23,23,NN,FM,5,CO Gunnison Gunnison K5GF 449.95 OPEN 
375,VTLgunnison,147.12,+,0.6,,88.5,88.5,23,23,NN,FM,5,CO Gunnison Gunnison W0VTL 147.12 OPEN On-Air
376,WEZlasvegas,145.45,-,0.6,,88.5,88.5,23,23,NN,FM,5,NM San Miguel Las Vegas KB5WEZ 145.45 OPEN Off-Air
377,"5MLconchasdam, mesa rica",147.36,+,0.6,Tone,100,100,23,23,NN,FM,5,"NM San Miguel Conchas Dam, Mesa Rica NM5ML 147.36 OPEN On-Air"
378,0SZvail,445.075,-,5,,88.5,88.5,23,23,NN,DIG,5,CO Eagle Vail N0SZ 445.075 OPEN On-Air
379,"5MLpecos,elk mountain",147.26,+,0.6,Tone,67,67,23,23,NN,FM,5,"NM San Miguel Pecos, Elk Mountain NM5ML 147.26 OPEN On-Air"
380,"5SFlasvegas,  elk mountain",147.3,+,0.6,Tone,162.2,162.2,23,23,NN,FM,5,"NM San Miguel Las Vegas,  Elk Mountain W5SF 147.3 OPEN On-Air"
381,"ZUQfortcollins, christ mountain",449.425,-,5,Tone,94.8,94.8,23,23,NN,FM,5,"CO Larimer Fort Collins, Christ Mountain N0ZUQ 449.425 OPEN On-Air"
382,"ZUQfortcollins, christ mountain",927.875,-,25,DTCS,88.5,88.5,114,114,NN,FM,5,"CO Larimer Fort Collins, Christ Mountain N0ZUQ 927.875 OPEN Off-Air"
383,VJJvail,147.345,+,0.6,Cross,88.5,123,23,23,NN,FM,5,CO Eagle Vail KB0VJJ 147.345 OPEN On-Air
384,UPSwellington,448.325,-,5,Tone,110.9,110.9,23,23,NN,FM,5,CO Larimer Wellington WB7UPS 448.325 OPEN On-Air
385,"ROKborger,nw well field",146.13125,-,0.6,,88.5,88.5,23,23,NN,DIG,5,"TX Hutchinson Borger, NW Well Field KD5ROK 146.13125 OPEN On-Air"
386,"UPSfortcollins, buckhorn mountain",447.7,-,5,TSQL,100,100,23,23,NN,FM,5,"CO Larimer Fort Collins, Buckhorn Mountain W0UPS 447.7 OPEN On-Air"
387,"UPSfortcollins, buckhorn mountain",146.625,-,0.6,TSQL,100,100,23,23,NN,FM,5,"CO Larimer Fort Collins, Buckhorn Mountain W0UPS 146.625 OPEN On-Air"
388,"UPSfortcollins, buckhorn mountain",224.84,-,1.6,TSQL,100,100,23,23,NN,FM,5,"CO Larimer Fort Collins, Buckhorn Mountain W0UPS 224.84 OPEN On-Air"
389,"0VQaspen,aspen mountain",447.05,-,5,TSQL,136.5,136.5,23,23,NN,FM,5,"CO Pitkin Aspen, Aspen Mountain K0VQ 447.05 OPEN On-Air"
390,"PKTcreede,bristol head",449.525,-,5,TSQL,100,100,23,23,NN,FM,5,"CO Mineral Creede, Bristol Head N0PKT 449.525 OPEN On-Air"
391,LTZamarillo,444.2,+,5,TSQL,88.5,88.5,23,23,NN,FM,5,TX Potter Amarillo N5LTZ 444.2 OPEN On-Air
392,IDNamarillo,927.1625,-,25,Tone,151.4,151.4,23,23,NN,FM,5,TX Potter Amarillo KA3IDN 927.1625 OPEN On-Air
393,IDNamarillo,444.9625,+,5,,88.5,88.5,23,23,NN,DIG,5,TX Potter Amarillo KA3IDN 444.9625 OPEN On-Air
394,LULamarillo,441.65,+,5,Tone,127.3,127.3,23,23,NN,FM,5,TX Potter Amarillo N5LUL 441.65 OPEN On-Air
395,JTCamarillo,444.3,+,5,,88.5,88.5,23,23,NN,DIG,5,TX Potter Amarillo W5JTC 444.3 OPEN On-Air
396,R9Bamarillo,441.375,+,5,Tone,88.5,88.5,23,23,NN,FM,5,TX Randall Amarillo WR9B 441.375 OPEN On-Air
397,LTZamarillo,146.92,-,0.6,,88.5,88.5,23,23,NN,FM,5,TX Randall Amarillo N5LTZ 146.92 OPEN 
398,LTZamarillo,443.5,+,5,,88.5,88.5,23,23,NN,FM,5,TX Potter Amarillo N5LTZ 443.5 CLOSED 
399,ZLUamarillo,146.74,-,0.6,Tone,88.5,88.5,23,23,NN,FM,5,TX Randall Amarillo N5ZLU 146.74 OPEN On-Air
400,"ZQEsantafe, tesuque peak",442.825,+,5,Tone,131.8,131.8,23,23,NN,FM,5,"NM Santa Fe Santa Fe, Tesuque Peak KB5ZQE 442.825 OPEN On-Air"
401,"5EMsantafe, tesuque peak",147.02,+,0.6,Tone,141.3,141.3,23,23,NN,FM,5,"NM Santa Fe Santa Fe, Tesuque Peak NM5EM 147.02 OPEN On-Air"
402,"5SFsantafe,  tesuque peak",146.82,-,0.6,Tone,162.2,162.2,23,23,NN,FM,5,"NM Santa Fe Santa Fe,  Tesuque Peak W5SF 146.82 OPEN On-Air"
403,5WXamarillo,147.34,+,0.6,Tone,88.5,88.5,23,23,NN,DIG,5,TX Randall Amarillo W5WX 147.34 OPEN On-Air
404,5WXamarillo,444.475,+,5,Tone,88.5,88.5,23,23,NN,DIG,5,TX Randall Amarillo W5WX 444.475 OPEN On-Air
405,"5EMabiquiu,cerro pelon",147.04,+,0.6,Tone,141.3,141.3,23,23,NN,FM,5,"NM Rio Arriba Abiquiu, Cerro Pelon NM5EM 147.04 OPEN Off-Air"
406,"IHLlasvegas, mesa apache",444.375,+,5,Tone,100,100,23,23,NN,FM,5,"NM San Miguel Las Vegas, Mesa Apache WA5IHL 444.375 CLOSED On-Air"
407,KIYhays,147.18,+,0.6,TSQL,100,100,23,23,NN,FM,5,KS Ellis Hays KE0KIY 147.18 OPEN On-Air
408,TSVpampa,146.9,-,0.6,,88.5,88.5,23,23,NN,FM,5,TX Gray Pampa W5TSV 146.9 OPEN On-Air
409,HFZbuffalo,52.81,-,1.7,Tone,131.8,131.8,23,23,NN,FM,5,OK Harper Buffalo W5HFZ 52.81 OPEN 
410,HFZbuffalo,442.075,+,5,Tone,131.8,131.8,23,23,NN,FM,5,OK Harper Buffalo W5HFZ 442.075 OPEN 
411,HFZbuffalo,145.13,-,0.6,Tone,131.8,131.8,23,23,NN,FM,5,OK Harper Buffalo W5HFZ 145.13 OPEN 
412,LTZpampa,444.4,+,5,Tone,88.5,88.5,23,23,NN,FM,5,TX Gray Pampa N5LTZ 444.4 OPEN On-Air
413,0CLsnowmassvillage,146.67,-,0.6,Tone,107.2,107.2,23,23,NN,FM,5,CO Pitkin Snowmass Village K0CL 146.67 OPEN On-Air
414,LTZcanadian,443.75,+,5,,88.5,88.5,23,23,NN,FM,5,TX Hemphill Canadian N5LTZ 443.75 CLOSED 
415,GPRbuffalo,147.12,+,0.6,Tone,203.5,203.5,23,23,NN,FM,5,OK Harper Buffalo W5GPR 147.12 OPEN 
416,USYhays,444,+,5,,88.5,88.5,23,23,NN,DIG,5,KS Ellis Hays K0USY 444 OPEN On-Air
417,KIYhays,443.6,+,5,Tone,100,100,23,23,NN,DIG,5,KS Ellis Hays KE0KIY 443.6 OPEN On-Air
418,LTZmiami,444.85,+,5,Tone,88.5,88.5,23,23,NN,FM,5,TX Roberts Miami N5LTZ 444.85 OPEN On-Air
419,ECQhays,444.825,+,5,TSQL,114.8,114.8,23,23,NN,FM,5,KS Ellis Hays N0ECQ 444.825 OPEN On-Air
420,"VJJkremmling,santoy peak",147.075,+,0.6,Cross,88.5,123,23,23,NN,FM,5,"CO Grand Kremmling, Santoy Peak KB0VJJ 147.075 OPEN On-Air"
421,"EZQhays,catherine road",927.0375,-,25,Tone,131.8,131.8,23,23,NN,FM,5,"KS Ellis Hays, Catherine Road KD0EZQ 927.0375 OPEN On-Air"
422,JYShays,147.045,+,0.6,TSQL,131.8,131.8,23,23,NN,DIG,5,KS Ellis Hays N7JYS 147.045 OPEN On-Air
423,JYShays,224.28,-,1.6,TSQL,131.8,131.8,23,23,NN,FM,5,KS Ellis Hays N7JYS 224.28 OPEN On-Air
424,"JYShays,k-link",442.45,+,5,TSQL,162.2,162.2,23,23,NN,FM,5,"KS Ellis Hays, K-Link N7JYS 442.45 OPEN On-Air"
425,PGQlacueva,53.2,-,1,Tone,107.2,107.2,23,23,NN,FM,5,NM Santa Fe La Cueva N9PGQ 53.2 OPEN Off-Air
426,PGQlacueva,146.84,-,0.6,Tone,107.2,107.2,23,23,NN,FM,5,NM Santa Fe La Cueva N9PGQ 146.84 OPEN 
427,PGQlacueva,442.125,+,5,Tone,107.2,107.2,23,23,NN,FM,5,NM Santa Fe La Cueva N9PGQ 442.125 OPEN 
