Location,Name,Frequency,Duplex,Offset,Tone,rToneFreq,cToneFreq,DtcsCode,DtcsRxCode,DtcsPolarity,Mode,TStep,Comment
428,"JSPpagosasprings, oakbrush hill",146.61,-,0.6,Tone,123,123,23,23,NN,FM,5,"CO Archuleta Pagosa Springs, Oakbrush Hill N0JSP 146.61 OPEN On-Air"
429,USYhays,444.6725,+,5,,88.5,88.5,23,23,NN,DIG,5,KS Ellis Hays K0USY 444.6725 OPEN On-Air
430,5SJdulce,145.43,-,0.6,Tone,136.5,136.5,23,23,NN,FM,5,NM Rio Arriba Dulce NM5SJ 145.43 OPEN On-Air
431,santafe,145.19,-,0.6,Tone,162.2,162.2,23,23,NN,FM,5,NM Bernalillo Santa Fe  145.19 OPEN On-Air
432,5SFsantafe,145.21,-,0.6,,88.5,88.5,23,23,NN,DIG,5,NM Santa Fe Santa Fe W5SF 145.21 OPEN On-Air
433,5SFsantafe,444.575,+,5,,88.5,88.5,23,23,NN,DIG,5,NM Santa Fe Santa Fe W5SF 444.575 OPEN On-Air
434,KQHmiami,145.11,-,0.6,Tone,88.5,88.5,23,23,NN,FM,5,TX Roberts Miami KA5KQH 145.11 OPEN 
435,"5SFsantafe, st vincent hospital",147.2,+,0.6,Tone,162.2,162.2,23,23,NN,FM,5,"NM Santa Fe Santa Fe, St Vincent Hospital W5SF 147.2 OPEN On-Air"
436,KOMlogan,442.3,+,5,TSQL,162.2,162.2,23,23,NN,FM,5,KS Phillips Logan N0KOM 442.3 OPEN On-Air
437,"PDOlosalamos, barranca mesa",146.88,-,0.6,,88.5,88.5,23,23,NN,FM,5,"NM Los Alamos Los Alamos, Barranca Mesa W5PDO 146.88 OPEN On-Air"
438,BIWlosalamos,224.04,-,1.6,TSQL,100,100,23,23,NN,FM,5,NM Los Alamos Los Alamos KA5BIW 224.04 OPEN On-Air
439,BIWlosalamos,442,+,5,Tone,100,100,23,23,NN,FM,5,NM Los Alamos Los Alamos KA5BIW 442 OPEN On-Air
440,SGTsantafe,447.775,-,5,Tone,100,100,23,23,NN,FM,5,NM Santa Fe Santa Fe KF5SGT 447.775 OPEN On-Air
441,GAJsantafe,449.275,-,5,Tone,146.2,146.2,23,23,NN,FM,5,NM Santa Fe Santa Fe K9GAJ 449.275 OPEN On-Air
442,5WRlosalamos,442.425,+,5,,88.5,88.5,23,23,NN,DIG,5,NM Los Alamos Los Alamos NM5WR 442.425 OPEN On-Air
443,CMSlosalamos,444.775,+,5,Tone,131.8,131.8,23,23,NN,DIG,5,NM Los Alamos Los Alamos WD9CMS 444.775 OPEN On-Air
444,HSOlosalamos,144.265,,0,Tone,203.5,203.5,23,23,NN,FM,5,NM Los Alamos Los Alamos KC2HSO 144.265 OPEN On-Air
445,AVNlosalamos,442.925,+,5,,88.5,88.5,23,23,NN,DIG,5,NM Los Alamos Los Alamos KE8AVN 442.925 OPEN On-Air
446,CMSlosalamos,927.9,-,25,Tone,131.8,131.8,23,23,NN,DIG,5,NM Los Alamos Los Alamos WD9CMS 927.9 OPEN On-Air
447,5BBlosalamos,442.25,+,5,,88.5,88.5,23,23,NN,DIG,5,NM Los Alamos Los Alamos NM5BB 442.25 OPEN Off-Air
448,"0VQcarbondale,missouri heights",447.15,-,5,Tone,136.5,136.5,23,23,NN,FM,5,"CO Garfield Carbondale, Missouri Heights K0VQ 447.15 OPEN On-Air"
449,"5RXlosalamos, pajarito mountain",223.94,-,1.6,,88.5,88.5,23,23,NN,FM,5,"NM Los Alamos Los Alamos, Pajarito Mountain KB5RX 223.94 OPEN On-Air"
450,"5SFlosalamos, pajarito mountain",145.19,-,0.6,Tone,162.2,162.2,23,23,NN,DIG,5,"NM Los Alamos Los Alamos, Pajarito Mountain W5SF 145.19 OPEN On-Air"
451,"GPRwoodward, airport",146.73,-,0.6,Tone,203.5,203.5,23,23,NN,FM,5,"OK Woodward Woodward,  airport W5GPR 146.73 OPEN "
452,"KOMstockton,k-link",146.79,-,0.6,Tone,162.2,162.2,23,23,NN,FM,5,"KS Rooks Stockton, K-Link N0KOM 146.79 OPEN On-Air"
453,DFQwoodward,442.2,+,5,Tone,88.5,88.5,23,23,NN,FM,5,OK Woodward Woodward N5DFQ 442.2 OPEN Off-Air
454,ALZwoodward,442.05,+,5,Tone,103.5,103.5,23,23,NN,FM,5,OK Woodward Woodward W5ALZ 442.05 OPEN On-Air
455,0ANedison,146.745,-,0.6,,88.5,88.5,23,23,NN,FM,5,NE Furnas Edison KD0AN 146.745 OPEN On-Air
456,ARWphillipsburg,442.725,+,5,,88.5,88.5,23,23,NN,FM,5,KS Phillips Phillipsburg KD0ARW 442.725 OPEN On-Air
457,0HJphillipsburg,147.12,+,0.6,,88.5,88.5,23,23,NN,FM,5,KS Phillips Phillipsburg AA0HJ 147.12 OPEN On-Air
458,0HJphillipsburg,443.275,+,5,Tone,100,100,23,23,NN,FM,5,KS Phillips Phillipsburg AA0HJ 443.275 OPEN On-Air
459,5HOlacueva,145.41,-,0.6,Tone,100,100,23,23,NN,FM,5,NM Santa Fe La Cueva W5HO 145.41 OPEN Off-Air
460,"5MLcuba,eureka mesa",147.24,+,0.6,Tone,67,67,23,23,NN,FM,5,"NM Sandoval Cuba, Eureka Mesa NM5ML 147.24 OPEN On-Air"
461,"VJJwalden,peterson ridge",145.16,-,0.6,Cross,88.5,123,23,23,NN,FM,5,"CO Jackson Walden, Peterson Ridge KB0VJJ 145.16 OPEN On-Air"
462,GUDsharon,147.315,+,0.6,,88.5,88.5,23,23,NN,DIG,5,OK Woodward Sharon K5GUD 147.315 OPEN 
463,GSMwoodward,147,+,0.6,Tone,103.5,103.5,23,23,NN,FM,5,OK Woodward Woodward K5GSM 147 OPEN On-Air
464,GUDsharon,146.625,-,0.6,Tone,88.5,88.5,23,23,NN,FM,5,OK Woodward Sharon K5GUD 146.625 OPEN Off-Air
465,5WOsharon,147.36,+,0.6,Tone,88.5,88.5,23,23,NN,FM,5,OK Woodward Sharon N5WO 147.36 OPEN 
466,"5EMcuba,eureka mesa",145.175,-,0.6,Tone,141.3,141.3,23,23,NN,FM,5,"NM Sandoval Cuba, Eureka Mesa NM5EM 145.175 OPEN Off-Air"
467,RCZalma,145.205,-,0.6,,88.5,88.5,23,23,NN,FM,5,NE Harlan Alma KA0RCZ 145.205 OPEN On-Air
468,5WOvici,444.95,+,5,Tone,88.5,88.5,23,23,NN,FM,5,OK Dewey Vici N5WO 444.95 OPEN 
469,SOKcozad,147.135,+,0.6,,88.5,88.5,23,23,NN,FM,5,NE Dawson Cozad W0SOK 147.135 OPEN Off-Air
470,D0Hsteamboatsprings,147.21,+,0.6,TSQL,107.2,107.2,23,23,NN,FM,5,CO Routt Steamboat Springs KD0H 147.21 OPEN On-Air
471,VJJsteamboatsprings,147.165,+,0.6,Cross,88.5,123,23,23,NN,FM,5,CO Routt Steamboat Springs KB0VJJ 147.165 OPEN On-Air
472,VJJsteamboatsprings,449.625,-,5,TSQL,123,123,23,23,NN,FM,5,CO Routt Steamboat Springs KB0VJJ 449.625 OPEN On-Air
473,"5SCsanysidro, pajarito peak",443.1,+,5,Tone,100,100,23,23,NN,FM,5,"NM Sandoval San Ysidro, Pajarito Peak NM5SC 443.1 OPEN On-Air"
474,PCAloomis,146.895,-,0.6,TSQL,123,123,23,23,NN,FM,5,NE Phelps Loomis K0PCA 146.895 OPEN On-Air
475,"AKWplacitas,sandia peak",443.4,+,5,Tone,100,100,23,23,NN,FM,5,"NM Sandoval Placitas, Sandia Peak K5AKW 443.4 OPEN On-Air"
476,"5SCplacitas,la madera",147.08,+,0.6,Tone,100,100,23,23,NN,FM,5,"NM Sandoval Placitas, La Madera NM5SC 147.08 OPEN On-Air"
477,0VLlexington,146.85,-,0.6,TSQL,123,123,23,23,NN,FM,5,NE Dawson Lexington N0VL 146.85 OPEN On-Air
478,"KREalbuquerque,sandia crest",443.3,+,5,,88.5,88.5,23,23,NN,DIG,5,"NM Bernalillo Albuquerque, Sandia Crest K5KRE 443.3 OPEN Testing"
479,"CCBalbuquerque,sandia peak",443.75,+,5,Tone,100,100,23,23,NN,FM,5,"NM Bernalillo Albuquerque, Sandia Peak WA6CCB 443.75 CLOSED Off-Air"
480,"IUZalbuquerque,sandia crest",51.7,-,1,Tone,156.7,156.7,23,23,NN,FM,5,"NM Bernalillo Albuquerque, Sandia Crest WB5IUZ 51.7 OPEN Off-Air"
481,"JMWalbuquerque,sandia crest",442.9,+,5,,88.5,88.5,23,23,NN,DIG,5,"NM Bernalillo Albuquerque, Sandia Crest KA8JMW 442.9 OPEN On-Air"
482,"FSBalbuquerque,sandia peak",442.6,+,5,Tone,100,100,23,23,NN,FM,5,"NM Bernalillo Albuquerque, Sandia Peak K5FSB 442.6 OPEN On-Air"
483,"GASalbuquerque,sandia crest",442.1,+,5,Tone,162.2,162.2,23,23,NN,FM,5,"NM Bernalillo Albuquerque, Sandia Crest KB5GAS 442.1 OPEN On-Air"
484,"IPKalbuquerque,sandia crest",442.75,+,5,Tone,162.2,162.2,23,23,NN,FM,5,"NM Bernalillo Albuquerque, Sandia Crest KC5IPK 442.75 OPEN On-Air"
485,"5MLalbuquerque,sandia crest",145.29,-,0.6,Tone,100,100,23,23,NN,FM,5,"NM Bernalillo Albuquerque, Sandia Crest NM5ML 145.29 OPEN On-Air"
486,"5MLalbuquerque,sandia crest",444.325,+,5,Tone,100,100,23,23,NN,FM,5,"NM Bernalillo Albuquerque, Sandia Crest NM5ML 444.325 OPEN On-Air"
487,"CSYalbuquerque,sandia crest",145.33,-,0.6,Tone,100,100,23,23,NN,FM,5,"NM Bernalillo Albuquerque, Sandia Crest W5CSY 145.33 OPEN On-Air"
488,"CSYalbuquerque,sandia crest",444,+,5,Tone,100,100,23,23,NN,FM,5,"NM Bernalillo Albuquerque, Sandia Crest W5CSY 444 OPEN On-Air"
489,"MPZalbuquerque,sandia crest",443.8,+,5,,88.5,88.5,23,23,NN,DIG,5,"NM Bernalillo Albuquerque, Sandia Crest W5MPZ 443.8 OPEN On-Air"
490,"LIEalbuquerque,northeast heights area",224.48,-,1.6,Tone,100,100,23,23,NN,FM,5,"NM Bernalillo Albuquerque, Northeast Heights area K6LIE 224.48 OPEN On-Air"
491,OLDriorancho,442.35,+,5,Tone,100,100,23,23,NN,FM,5,NM Sandoval Rio Rancho WA5OLD 442.35 OPEN On-Air
492,"BIQalbuquerque,bcfd fire station 35",145.13,-,0.6,TSQL,100,100,23,23,NN,FM,5,"NM Bernalillo Albuquerque, BCFD Fire Station 35 K5BIQ 145.13 OPEN On-Air"
493,5QDcorrales,443.2,+,5,,88.5,88.5,23,23,NN,DIG,5,NM Sandoval Corrales N5QD 443.2 OPEN On-Air
494,"SLGriorancho, nm 528 and corrales rd",442.4,+,5,,88.5,88.5,23,23,NN,DIG,5,"NM Sandoval Rio Rancho, NM 528 and Corrales Rd KG5SLG 442.4 OPEN On-Air"
495,"CPUriorancho, intel corp",444.7,+,5,Tone,100,100,23,23,NN,FM,5,"NM Sandoval Rio Rancho, Intel Corp K5CPU 444.7 OPEN On-Air"
496,"YEJsanluis, cabezon",443,+,5,Tone,100,100,23,23,NN,FM,5,"NM Sandoval San Luis, Cabezon K5YEJ 443 OPEN On-Air"
497,IPKriorancho,442.75,+,5,Tone,162.2,162.2,23,23,NN,FM,5,NM Sandoval Rio Rancho KC5IPK 442.75 OPEN On-Air
498,"5RRriorancho, rainbow",147.1,+,0.6,TSQL,100,100,23,23,NN,FM,5,"NM Sandoval Rio Rancho, Rainbow NM5RR 147.1 OPEN On-Air"
499,"5RRriorancho, rainbow",443,+,5,Tone,100,100,23,23,NN,FM,5,"NM Sandoval Rio Rancho, Rainbow NM5RR 443 OPEN On-Air"
500,5GWelkcity,146.76,-,0.6,TSQL,88.5,88.5,23,23,NN,FM,5,OK Beckham Elk City AA5GW 146.76 OPEN On-Air
501,BSAelkcity,444.525,+,5,TSQL,88.5,88.5,23,23,NN,FM,5,OK Beckham Elk City WX5BSA 444.525 OPEN On-Air
502,5HDriorancho,145.37,-,0.6,Tone,162.2,162.2,23,23,NN,FM,5,NM Sandoval Rio Rancho NM5HD 145.37 OPEN On-Air
503,ELKelkcity,146.685,-,0.6,,88.5,88.5,23,23,NN,DIG,5,OK Beckham Elk City K5ELK 146.685 OPEN On-Air
504,ELKelkcity,443.025,+,5,,88.5,88.5,23,23,NN,DIG,5,OK Beckham Elk City K5ELK 443.025 OPEN On-Air
