Location,Name,Frequency,Duplex,Offset,Tone,rToneFreq,cToneFreq,DtcsCode,DtcsRxCode,DtcsPolarity,Mode,TStep,Comment
413,"5RXlosalamos, pajarito mountain",223.94,-,1.6,,88.5,88.5,23,23,NN,FM,5,"NM Los Alamos Los Alamos, Pajarito Mountain KB5RX 223.94 OPEN On-Air"
414,0KCfortlupton,224.96,-,1.6,,88.5,88.5,23,23,NN,FM,5,CO Weld Fort Lupton AC0KC 224.96 OPEN On-Air
415,"LRAloveland,namaqua hill",147.195,+,0.6,Tone,100,100,23,23,NN,FM,5,"CO Larimer Loveland, Namaqua Hill W0LRA 147.195 OPEN On-Air"
416,"PDOlosalamos, barranca mesa",146.88,-,0.6,,88.5,88.5,23,23,NN,FM,5,"NM Los Alamos Los Alamos, Barranca Mesa W5PDO 146.88 OPEN On-Air"
417,5WRlosalamos,442.425,+,5,,88.5,88.5,23,23,NN,DIG,5,NM Los Alamos Los Alamos NM5WR 442.425 OPEN On-Air
418,CMSlosalamos,444.775,+,5,Tone,131.8,131.8,23,23,NN,DIG,5,NM Los Alamos Los Alamos WD9CMS 444.775 OPEN On-Air
419,BIWlosalamos,224.04,-,1.6,TSQL,100,100,23,23,NN,FM,5,NM Los Alamos Los Alamos KA5BIW 224.04 OPEN On-Air
420,BIWlosalamos,442,+,5,Tone,100,100,23,23,NN,FM,5,NM Los Alamos Los Alamos KA5BIW 442 OPEN On-Air
421,5BBlosalamos,442.25,+,5,,88.5,88.5,23,23,NN,DIG,5,NM Los Alamos Los Alamos NM5BB 442.25 OPEN Off-Air
422,HSOlosalamos,144.265,,0,Tone,203.5,203.5,23,23,NN,FM,5,NM Los Alamos Los Alamos KC2HSO 144.265 OPEN On-Air
423,AVNlosalamos,442.925,+,5,,88.5,88.5,23,23,NN,DIG,5,NM Los Alamos Los Alamos KE8AVN 442.925 OPEN On-Air
424,CMSlosalamos,927.9,-,25,Tone,131.8,131.8,23,23,NN,DIG,5,NM Los Alamos Los Alamos WD9CMS 927.9 OPEN On-Air
425,0SJlochbuie,447.625,-,5,Tone,100,100,23,23,NN,FM,5,CO Adams Lochbuie KE0SJ 447.625 OPEN On-Air
426,6VVloveland,224.32,-,1.6,TSQL,100,100,23,23,NN,FM,5,CO Larimer Loveland KN6VV 224.32 OPEN Off-Air
427,"LRAloveland,namaqua hill",449.575,-,5,Tone,100,100,23,23,NN,FM,5,"CO Larimer Loveland, Namaqua Hill W0LRA 449.575 OPEN On-Air"
428,"ZUQfortcollins, christ mountain",449.425,-,5,Tone,94.8,94.8,23,23,NN,FM,5,"CO Larimer Fort Collins, Christ Mountain N0ZUQ 449.425 OPEN On-Air"
429,"ZUQfortcollins, christ mountain",927.875,-,25,DTCS,88.5,88.5,114,114,NN,FM,5,"CO Larimer Fort Collins, Christ Mountain N0ZUQ 927.875 OPEN Off-Air"
430,"5SCsanysidro, pajarito peak",443.1,+,5,Tone,100,100,23,23,NN,FM,5,"NM Sandoval San Ysidro, Pajarito Peak NM5SC 443.1 OPEN On-Air"
431,"UPSfortcollins, buckhorn mountain",447.7,-,5,TSQL,100,100,23,23,NN,FM,5,"CO Larimer Fort Collins, Buckhorn Mountain W0UPS 447.7 OPEN On-Air"
432,"UPSfortcollins, buckhorn mountain",146.625,-,0.6,TSQL,100,100,23,23,NN,FM,5,"CO Larimer Fort Collins, Buckhorn Mountain W0UPS 146.625 OPEN On-Air"
433,"UPSfortcollins, buckhorn mountain",224.84,-,1.6,TSQL,100,100,23,23,NN,FM,5,"CO Larimer Fort Collins, Buckhorn Mountain W0UPS 224.84 OPEN On-Air"
434,"IMFephraim, horseshoe",224.64,-,1.6,,88.5,88.5,23,23,NN,FM,5,"UT Sanpete Ephraim,  Horseshoe N7IMF 224.64 OPEN "
435,"DHHephraim,horseshoe",146.66,-,0.6,Tone,100,100,23,23,NN,FM,5,"UT Sanpete Ephraim, Horseshoe W7DHH 146.66 OPEN On-Air"
436,"RELindianola,indianola peak",146.72,-,0.6,Tone,100,100,23,23,NN,FM,5,"UT Sanpete Indianola, Indianola Peak WB7REL 146.72 OPEN On-Air"
437,"0SFfortcollins, horsetooth mountain",927.825,-,25,TSQL,100,100,23,23,NN,FM,5,"CO Larimer Fort Collins, Horsetooth Mountain AB0SF 927.825 OPEN On-Air"
438,"1TJfortcollins, horsetooth mountain",927.95,-,25,TSQL,100,100,23,23,NN,FM,5,"CO Larimer Fort Collins, Horsetooth Mountain K1TJ 927.95 OPEN On-Air"
439,"UPSfortcollins, horsetooth mountain",145.115,-,0.6,TSQL,100,100,23,23,NN,FM,5,"CO Larimer Fort Collins, Horsetooth Mountain W0UPS 145.115 OPEN On-Air"
440,"UPSfortcollins, horsetooth mountain",224.52,-,1.6,TSQL,100,100,23,23,NN,FM,5,"CO Larimer Fort Collins, Horsetooth Mountain W0UPS 224.52 OPEN Off-Air"
441,"UPSfortcollins, horsetooth mountain",447.275,-,5,TSQL,100,100,23,23,NN,FM,5,"CO Larimer Fort Collins, Horsetooth Mountain W0UPS 447.275 OPEN On-Air"
442,"PFJfortcollins, horsetooth mountain",446.75,-,5,,88.5,88.5,23,23,NN,DIG,5,"CO Larimer Fort Collins, Horsetooth Mountain K7PFJ 446.75 OPEN On-Air"
443,"VGDfortcollins , horsetooth mountain",145.265,-,0.6,,88.5,88.5,23,23,NN,DIG,5,"CO Larimer Fort Collins , Horsetooth Mountain KB0VGD 145.265 OPEN On-Air"
444,1TJfortcollins,1283.55,-,20,Tone,100,100,23,23,NN,FM,5,CO Larimer Fort Collins K1TJ 1283.55 OPEN On-Air
445,RBTfortcollins,447.45,-,5,Tone,123,123,23,23,NN,FM,5,CO Larimer Fort Collins KC0RBT 447.45 OPEN On-Air
446,AOLfortcollins,446.7375,-,5,,88.5,88.5,23,23,NN,DIG,5,CO Larimer Fort Collins N0AOL 446.7375 OPEN On-Air
447,"RDItrinidad,raton pass",446.775,-,5,,88.5,88.5,23,23,NN,DIG,5,"CO Las Animas Trinidad, Raton Pass KD0RDI 446.775 OPEN On-Air"
448,"DSOvernal,tabby mountain",147.34,+,0.6,Tone,136.5,136.5,23,23,NN,FM,5,"UT Uintah Vernal, Tabby Mountain KG7DSO 147.34 OPEN On-Air"
449,0RGhudson,449.925,-,5,TSQL,114.8,114.8,23,23,NN,FM,5,CO Weld Hudson KD0RG 449.925 OPEN On-Air
450,"YEJsanluis, cabezon",443,+,5,Tone,100,100,23,23,NN,FM,5,"NM Sandoval San Luis, Cabezon K5YEJ 443 OPEN On-Air"
451,"WDVgallup,gibson peak",147.26,+,0.6,Tone,100,100,23,23,NN,FM,5,"NM McKinley Gallup, Gibson Peak KC5WDV 147.26 OPEN On-Air"
452,LENwindowrock,145.29,-,0.6,Tone,123,123,23,23,NN,FM,5,NM McKinley Window Rock K7LEN 145.29 OPEN Off-Air
453,7RFfortcollins,447.725,-,5,Tone,131.8,131.8,23,23,NN,FM,5,CO Larimer Fort Collins W7RF 447.725 OPEN On-Air
454,"0BVtrinidad,raton pass",147.375,+,0.6,TSQL,100,100,23,23,NN,FM,5,"CO Las Animas Trinidad, Raton Pass K0BV 147.375 OPEN Off-Air"
455,"CVUtrinidad,raton pass",449.6,-,5,Tone,107.2,107.2,23,23,NN,FM,5,"CO Las Animas Trinidad, Raton Pass KC0CVU 449.6 OPEN Off-Air"
456,"5JLtrinidad,raton pass",447.375,-,5,Tone,100,100,23,23,NN,DIG,5,"CO Las Animas Trinidad, Raton Pass KG5JL 447.375 OPEN On-Air"
457,"UPSloveland,budweiser event center",448.025,-,5,TSQL,100,100,23,23,NN,DIG,5,"CO Larimer Loveland, Budweiser Event Center W0UPS 448.025 OPEN On-Air"
458,"LEMangelfire, agua fria peak",147.34,+,0.6,Tone,100,100,23,23,NN,FM,5,"NM Colfax Angel Fire, Agua Fria Peak N5LEM 147.34 OPEN On-Air"
459,"7UWlaramie,jelm mountain",147.015,+,0.6,Tone,146.2,146.2,23,23,NN,DIG,5,"WY Albany Laramie, Jelm Mountain N7UW 147.015 OPEN On-Air"
460,"QEYfortcollins, csu durward hall",446.8125,-,5,,88.5,88.5,23,23,NN,DIG,5,"CO Larimer Fort Collins, CSU Durward Hall W0QEY 446.8125 OPEN On-Air"
461,"QEYfortcollins, csu durward hall",147.36,+,0.6,TSQL,100,100,23,23,NN,FM,5,"CO Larimer Fort Collins, CSU Durward Hall W0QEY 147.36 OPEN On-Air"
462,"QEYfortcollins, csu durward hall",449.85,-,5,TSQL,100,100,23,23,NN,FM,5,"CO Larimer Fort Collins, CSU Durward Hall W0QEY 449.85 OPEN On-Air"
463,YFZmanti,449.75,-,5,Tone,131.8,131.8,23,23,NN,FM,5,UT Sanpete Manti N7YFZ 449.75 OPEN 
464,0DEsimla,147.105,+,0.6,TSQL,107.2,107.2,23,23,NN,FM,5,CO Elbert Simla WA0DE 147.105 OPEN On-Air
465,BSKsterling,145.15,-,0.6,,88.5,88.5,23,23,NN,DIG,5,UT Utah Sterling KB7BSK 145.15 OPEN 
466,BSKsterling,447.95,-,5,,88.5,88.5,23,23,NN,DIG,5,UT Utah Sterling KB7BSK 447.95 OPEN 
467,"RELstarling,sterling",145.29,-,0.6,Tone,131.8,131.8,23,23,NN,FM,5,"UT Sanpete Starling, Sterling WB7REL 145.29 OPEN On-Air"
468,RELsterling,447.85,-,5,Tone,131.8,131.8,23,23,NN,FM,5,UT Sanpete Sterling WB7REL 447.85 OPEN On-Air
469,"DMRfortcollins, timnath",147.39,+,0.6,,88.5,88.5,23,23,NN,DIG,5,"CO Larimer Fort Collins, Timnath W0DMR 147.39 OPEN On-Air"
470,GDRcimarron,145.21,-,0.6,TSQL,110.9,110.9,23,23,NN,FM,5,NM Colfax Cimarron N5GDR 145.21 OPEN On-Air
471,"RDIraton,raton pass",446.775,-,5,,88.5,88.5,23,23,NN,DIG,5,"NM Colfax Raton, Raton Pass KD0RDI 446.775 OPEN On-Air"
472,"IFItrinidad,raton pass",145.43,-,0.6,Tone,107.2,107.2,23,23,NN,FM,5,"CO Las Animas Trinidad, Raton Pass WA6IFI 145.43 OPEN On-Air"
473,"RELsterling,salina canyon",449.25,-,5,Tone,131.8,131.8,23,23,NN,FM,5,"UT Sevier Sterling, Salina Canyon WB7REL 449.25 OPEN "
474,"DMRfortcollins, timnath",446.775,-,5,,88.5,88.5,23,23,NN,DIG,5,"CO Larimer Fort Collins, Timnath W0DMR 446.775 OPEN On-Air"
475,"RELeastsalina, salina canyon",146.72,-,0.6,Tone,100,100,23,23,NN,FM,5,"UT Sanpete East Salina, Salina Canyon WB7REL 146.72 OPEN On-Air"
476,"RFIseverance,cactus hill",447.2,-,5,Tone,82.5,82.5,23,23,NN,FM,5,"CO Weld Severance, Cactus Hill N6RFI 447.2 OPEN On-Air"
477,"0OJgreeley,unc",449.725,-,5,Tone,127.3,127.3,23,23,NN,FM,5,"CO Weld Greeley, UNC K0OJ 449.725 OPEN On-Air"
478,"DSNspanishfork,  teat mountain",447.4,-,5,Tone,100,100,23,23,NN,FM,5,"UT Utah Spanish Fork,  Teat Mountain K7DSN 447.4 OPEN "
479,"UPSgreeley,unc",146.85,-,0.6,TSQL,100,100,23,23,NN,FM,5,"CO Weld Greeley, UNC W0UPS 146.85 OPEN On-Air"
480,KWDgreeley,147,+,0.6,TSQL,100,100,23,23,NN,DIG,5,CO Weld Greeley KC0KWD 147 OPEN On-Air
481,KWDgreeley,448.475,-,5,Tone,100,100,23,23,NN,FM,5,CO Weld Greeley KC0KWD 448.475 OPEN On-Air
482,AENgreeley,449.325,-,5,Tone,136.5,136.5,23,23,NN,DIG,5,CO Weld Greeley WR0AEN 449.325 OPEN On-Air
483,UPSwellington,448.325,-,5,Tone,110.9,110.9,23,23,NN,FM,5,CO Larimer Wellington WB7UPS 448.325 OPEN On-Air
484,"5MLraton,sierra grande",147.28,+,0.6,Tone,100,100,23,23,NN,FM,5,"NM Colfax Raton, Sierra Grande NM5ML 147.28 OPEN On-Air"
485,"RVSgunnison,n7rvs qth",447.35,-,5,Tone,88.5,88.5,23,23,NN,FM,5,"UT Sanpete Gunnison, N7RVS QTH N7RVS 447.35 OPEN "
486,"7YEmanti,barton peak",448.275,-,5,Tone,107.2,107.2,23,23,NN,FM,5,"UT Sanpete Manti, Barton Peak KD7YE 448.275 OPEN On-Air"
487,"5EMsantafe, tesuque peak",147.02,+,0.6,Tone,141.3,141.3,23,23,NN,FM,5,"NM Santa Fe Santa Fe, Tesuque Peak NM5EM 147.02 OPEN On-Air"
488,"ZQEsantafe, tesuque peak",442.825,+,5,Tone,131.8,131.8,23,23,NN,FM,5,"NM Santa Fe Santa Fe, Tesuque Peak KB5ZQE 442.825 OPEN On-Air"
489,"5SFsantafe,  tesuque peak",146.82,-,0.6,Tone,162.2,162.2,23,23,NN,FM,5,"NM Santa Fe Santa Fe,  Tesuque Peak W5SF 146.82 OPEN On-Air"
490,"7BVmountainview, hickey mtn",144.635,+,0.6,Tone,100,100,23,23,NN,FM,5,"WY Uinta Mountain View, Hickey Mtn WY7BV 144.635 OPEN Off-Air"
491,santafe,145.19,-,0.6,Tone,162.2,162.2,23,23,NN,FM,5,NM Bernalillo Santa Fe  145.19 OPEN On-Air
492,5SFsantafe,145.21,-,0.6,,88.5,88.5,23,23,NN,DIG,5,NM Santa Fe Santa Fe W5SF 145.21 OPEN On-Air
493,5SFsantafe,444.575,+,5,,88.5,88.5,23,23,NN,DIG,5,NM Santa Fe Santa Fe W5SF 444.575 OPEN On-Air
494,GAJsantafe,449.275,-,5,Tone,146.2,146.2,23,23,NN,FM,5,NM Santa Fe Santa Fe K9GAJ 449.275 OPEN On-Air
495,SGTsantafe,447.775,-,5,Tone,100,100,23,23,NN,FM,5,NM Santa Fe Santa Fe KF5SGT 447.775 OPEN On-Air
496,"5SFsantafe, st vincent hospital",147.2,+,0.6,Tone,162.2,162.2,23,23,NN,FM,5,"NM Santa Fe Santa Fe, St Vincent Hospital W5SF 147.2 OPEN On-Air"
497,"GIEroosevelt,mirror lake",147.38,+,0.6,Tone,100,100,23,23,NN,FM,5,"UT Duchesne Roosevelt, Mirror Lake WA7GIE 147.38 OPEN On-Air"
498,"HENhebercity, strawberry peak",147.16,+,0.6,Tone,136.5,136.5,23,23,NN,FM,5,"UT Wasatch Heber City, Strawberry Peak K7HEN 147.16 OPEN Off-Air"
499,"7JLlevan,levan peak",145.27,-,0.6,Tone,103.5,103.5,23,23,NN,FM,5,"UT Juab Levan, Levan Peak K7JL 145.27 OPEN On-Air"
500,"5MLpecos,elk mountain",147.26,+,0.6,Tone,67,67,23,23,NN,FM,5,"NM San Miguel Pecos, Elk Mountain NM5ML 147.26 OPEN On-Air"
501,"5SFlasvegas,  elk mountain",147.3,+,0.6,Tone,162.2,162.2,23,23,NN,FM,5,"NM San Miguel Las Vegas,  Elk Mountain W5SF 147.3 OPEN On-Air"
502,WSTwoodlandhills,449.8,-,1,,88.5,88.5,23,23,NN,DIG,5,UT Utah Woodland Hills KC7WST 449.8 OPEN On-Air
503,RPFwoodlandhills,447.3,-,5,Tone,77,77,23,23,NN,FM,5,UT Utah Woodland Hills WB7RPF 447.3 OPEN On-Air
504,EZOmapleton,146.8,-,0.6,Tone,100,100,23,23,NN,FM,5,UT Utah Mapleton N6EZO 146.8 OPEN On-Air
505,KYYspringville,447.325,-,5,Tone,114.8,114.8,23,23,NN,FM,5,UT Utah Springville N7KYY 447.325 OPEN On-Air
506,"SNOlaramie,beacon hill",146.82,-,0.6,Tone,114.8,114.8,23,23,NN,FM,5,"WY Albany Laramie, Beacon Hill KC7SNO 146.82 OPEN On-Air"
507,7FQsalem,447.075,-,5,Tone,131.8,131.8,23,23,NN,FM,5,UT Utah Salem N7FQ 447.075 OPEN Off-Air
508,"RELsalina,beesting peak",449.3,-,5,Tone,88.5,88.5,23,23,NN,FM,5,"UT Sevier Salina, Beesting Peak WB7REL 449.3 OPEN Off-Air"
509,"7UWlaramie,university",146.61,-,0.6,,88.5,88.5,23,23,NN,DIG,5,"WY Albany Laramie, University N7UW 146.61 OPEN On-Air"
510,D7Nspringville,447.475,-,5,Tone,186.2,186.2,23,23,NN,FM,5,UT Utah Springville WD7N 447.475 OPEN On-Air
511,PGQlacueva,53.2,-,1,Tone,107.2,107.2,23,23,NN,FM,5,NM Santa Fe La Cueva N9PGQ 53.2 OPEN Off-Air
512,PGQlacueva,146.84,-,0.6,Tone,107.2,107.2,23,23,NN,FM,5,NM Santa Fe La Cueva N9PGQ 146.84 OPEN 
513,PGQlacueva,442.125,+,5,Tone,107.2,107.2,23,23,NN,FM,5,NM Santa Fe La Cueva N9PGQ 442.125 OPEN 
514,"UCApayson,mountain view hospital",447.125,-,5,Tone,100,100,23,23,NN,FM,5,"UT Utah Payson, Mountain View Hospital K7UCA 447.125 OPEN Off-Air"
515,V7Vpayson,447,-,5,TSQL,100,100,23,23,NN,FM,5,UT Utah Payson NV7V 447 OPEN On-Air
516,"EOClaramie,pilot hill",447.225,-,5,,88.5,88.5,23,23,NN,DIG,5,"WY Albany Laramie, Pilot Hill WY7EOC 447.225 CLOSED On-Air"
517,SWRcheyenne,448.15,-,5,Tone,100,100,23,23,NN,FM,5,WY Laramie Cheyenne KB7SWR 448.15 OPEN Off-Air
518,B7Mpayson,448.025,-,5,Tone,100,100,23,23,NN,FM,5,UT Utah Payson KB7M 448.025 OPEN On-Air
519,"UWRlaramie, pilot hill",53.03,-,1,,88.5,88.5,23,23,NN,FM,5,"WY Albany Laramie,  Pilot Hill K7UWR 53.03 OPEN Off-Air"
520,YOTprovo,449.825,-,5,Tone,167.9,167.9,23,23,NN,FM,5,UT Utah Provo KB7YOT 449.825 OPEN Off-Air
521,"BYUprovo,byu",145.33,-,0.6,Tone,100,100,23,23,NN,FM,5,"UT Utah Provo, BYU N7BYU 145.33 OPEN On-Air"
522,"BYUprovo,byu",449.075,-,5,Tone,167.9,167.9,23,23,NN,FM,5,"UT Utah Provo, BYU N7BYU 449.075 OPEN On-Air"
523,EVCprovo,447.425,-,5,,88.5,88.5,23,23,NN,FM,5,UT Utah Provo N7EVC 447.425 OPEN Off-Air
524,"FFMprovo,uvrmc",449.85,-,5,Tone,146.2,146.2,23,23,NN,FM,5,"UT Utah Provo, UVRMC WA7FFM 449.85 OPEN On-Air"
525,"YZRprovo,edgemont sc",147.22,+,0.6,,88.5,88.5,23,23,NN,FM,5,"UT Utah Provo, Edgemont SC WA7YZR 147.22 OPEN Off-Air"
526,"5EMwagonmound, turkey mtn",145.37,-,0.6,Tone,141.3,141.3,23,23,NN,FM,5,"NM Mora Wagon Mound, Turkey Mtn NM5EM 145.37 OPEN Off-Air"
527,"5MLwagonmound, turkey mountain",147.2,+,0.6,Tone,67,67,23,23,NN,FM,5,"NM Mora Wagon Mound, Turkey Mountain NM5ML 147.2 OPEN On-Air"
528,"UVAprovo,sundance",145.25,-,0.6,Tone,100,100,23,23,NN,FM,5,"UT Utah Provo, Sundance K7UVA 145.25 OPEN On-Air"
529,ZOImidway,449.95,-,5,,88.5,88.5,23,23,NN,FM,5,UT Wasatch Midway N7ZOI 449.95 OPEN On-Air
530,"QWUpayson,west mountain",448.25,-,5,Tone,100,100,23,23,NN,FM,5,"UT Utah Payson, West Mountain N6QWU 448.25 OPEN Off-Air"
531,"FFMgoshen, west mountain",448.95,-,5,,88.5,88.5,23,23,NN,FM,5,"UT Utah Goshen,  West Mountain WA7FFM 448.95 OPEN "
532,"UAHgoshen,west mountain",147.02,+,0.6,Tone,100,100,23,23,NN,FM,5,"UT Utah Goshen, West Mountain WA7UAH 147.02 OPEN On-Air"
533,"UCSgoshen,west mountain",147.34,+,0.6,Tone,100,100,23,23,NN,FM,5,"UT Utah Goshen, West Mountain K7UCS 147.34 OPEN On-Air"
534,"PFJcheyenne,south",449.9375,-,5,,88.5,88.5,23,23,NN,DIG,5,"WY Laramie Cheyenne, South K7PFJ 449.9375 OPEN On-Air"
535,"BSAorem,qth ac7dm",145.47,-,0.6,Tone,100,100,23,23,NN,FM,5,"UT Utah Orem, QTH AC7DM N7BSA 145.47 OPEN "
536,"ZOImidway,wilson peak",147.2,+,0.6,Tone,88.5,88.5,23,23,NN,FM,5,"UT Wasatch Midway, Wilson Peak N7ZOI 147.2 OPEN On-Air"
537,IMForem,224.88,-,1.6,Tone,156.7,156.7,23,23,NN,FM,5,UT Utah Orem N7IMF 224.88 CLOSED On-Air
538,"RBRorem,point of the mountain",447.6,-,5,Tone,162.2,162.2,23,23,NN,FM,5,"UT Utah Orem, Point of the Mountain KD7RBR 447.6 OPEN On-Air"
539,"UCAorem, timpanogos hospital",447.275,-,5,Tone,100,100,23,23,NN,FM,5,"UT Utah Orem,  Timpanogos Hospital K7UCA 447.275 OPEN Off-Air"
540,BKTpleasantgrove,449.775,-,5,,88.5,88.5,23,23,NN,FM,5,UT Utah Pleasant Grove K8BKT 449.775 OPEN On-Air
541,YOTpleasantgrove,223.88,-,1.6,Tone,156.7,156.7,23,23,NN,FM,5,UT Utah Pleasant Grove KB7YOT 223.88 OPEN 
542,JNIwagonmound,444.4,+,5,Tone,100,100,23,23,NN,FM,5,NM Mora Wagon Mound N7JNI 444.4 OPEN Off-Air
543,"SNOcheyenne,denver hill",146.775,-,0.6,Tone,114.8,114.8,23,23,NN,FM,5,"WY Laramie Cheyenne, Denver Hill KC7SNO 146.775 OPEN On-Air"
544,SWRcheyenne,145.235,-,0.6,Tone,114.8,114.8,23,23,NN,FM,5,WY Laramie Cheyenne KB7SWR 145.235 OPEN On-Air
545,"SNOcheyenne,north park",147.105,+,0.6,Cross,114.8,91.5,23,23,NN,FM,5,"WY Laramie Cheyenne, North Park KC7SNO 147.105 OPEN On-Air"
546,JJYcheyenne,449.9,-,5,TSQL,100,100,23,23,NN,FM,5,WY Laramie Cheyenne N7JJY 449.9 OPEN On-Air
547,"UVAalpine,silver lake flat",448.225,-,5,Tone,100,100,23,23,NN,FM,5,"UT Utah Alpine, Silver Lake Flat K7UVA 448.225 OPEN On-Air"
548,"DHFcheyenne,old airport control tower",448.95,-,5,TSQL,151.4,151.4,23,23,NN,DIG,5,"WY Laramie Cheyenne, Old airport control tower KC7DHF 448.95 OPEN On-Air"
549,"7JLbrighton,scotts peak",145.27,-,0.6,Tone,100,100,23,23,NN,FM,5,"UT Salt Lake Brighton, Scotts Peak K7JL 145.27 OPEN On-Air"
550,"7JLbrighton,scott's peak",449.525,-,5,TSQL,131.8,131.8,23,23,NN,FM,5,"UT Salt Lake Brighton, Scott's Peak K7JL 449.525 OPEN On-Air"
551,"3STamericanfork, kd7bbc qth",447.975,-,5,,88.5,88.5,23,23,NN,DIG,5,"UT Utah American Fork, KD7BBC QTH NT3ST 447.975 OPEN On-Air"
552,"7JLsnowbird,hidden peak",147.18,+,0.6,Tone,100,100,23,23,NN,FM,5,"UT Utah Snowbird, Hidden Peak K7JL 147.18 OPEN On-Air"
553,WEZlasvegas,145.45,-,0.6,,88.5,88.5,23,23,NN,FM,5,NM San Miguel Las Vegas KB5WEZ 145.45 OPEN Off-Air
554,"7GRcheyenne,chalk bluffs",449.3,-,5,Tone,131.8,131.8,23,23,NN,DIG,5,"WY Laramie Cheyenne, Chalk Bluffs WB7GR 449.3 OPEN On-Air"
555,"EGCamericanfork, utah lake",449.175,-,5,Tone,131.8,131.8,23,23,NN,FM,5,"UT Utah American Fork, Utah Lake KA7EGC 449.175 OPEN On-Air"
556,"7VChighland,kx7vc qth",447.725,-,5,TSQL,167.9,167.9,23,23,NN,FM,5,"UT Utah Highland, KX7VC QTH KX7VC 447.725 OPEN On-Air"
557,Z6Zparkcity,145.23,-,0.6,Tone,100,100,23,23,NN,FM,5,UT Summit Park City NZ6Z 145.23 OPEN 
558,Z6Zparkcity,447.5,-,5,,88.5,88.5,23,23,NN,FM,5,UT Summit Park City NZ6Z 447.5 OPEN On-Air
559,WSUlehi,447.05,-,5,,88.5,88.5,23,23,NN,DIG,5,UT Utah Lehi KC7WSU 447.05 OPEN Off-Air
560,QWUlehi,448.875,-,5,,88.5,88.5,23,23,NN,DIG,5,UT Utah Lehi KG7QWU 448.875 OPEN On-Air
561,"HAFparkcity,  murdock peak",448.475,-,5,,88.5,88.5,23,23,NN,FM,5,"UT Summit Park City,  Murdock Peak KB7HAF 448.475 OPEN On-Air"
562,"HENcoalville,lewis peak",147.24,+,0.6,Tone,136.5,136.5,23,23,NN,FM,5,"UT Summit Coalville, Lewis Peak K7HEN 147.24 OPEN On-Air"
563,"GIEcoalville,lewis peak",147.36,+,0.6,Tone,100,100,23,23,NN,FM,5,"UT Summit Coalville, Lewis Peak WA7GIE 147.36 OPEN On-Air"
564,"GIEcoalville, lewis peak",448.65,-,5,,88.5,88.5,23,23,NN,FM,5,"UT Summit Coalville,  Lewis Peak WA7GIE 448.65 CLOSED On-Air"
565,"GIEcoalville, lewis peak",449.55,-,5,Tone,100,100,23,23,NN,FM,5,"UT Summit Coalville,  Lewis Peak WA7GIE 449.55 OPEN On-Air"
566,"TSQcoalville, lewis peak",448.9,-,5,,88.5,88.5,23,23,NN,FM,5,"UT Summit Coalville,  Lewis Peak WB7TSQ 448.9 OPEN "
567,"7JLevanston,medicine butte",146.86,-,0.6,Tone,100,100,23,23,NN,FM,5,"WY Uinta Evanston, Medicine Butte K7JL 146.86 OPEN On-Air"
568,QGTdraper,447,-,5,Tone,88.5,88.5,23,23,NN,FM,5,UT Salt Lake Draper KE7QGT 447 OPEN Off-Air
569,"EGMdraper,fire station",447.1,-,5,Tone,100,100,23,23,NN,FM,5,"UT Salt Lake Draper, Fire Station KG7EGM 447.1 OPEN On-Air"
570,ROYsandy,448.375,-,5,Tone,100,100,23,23,NN,FM,5,UT Salt Lake Sandy W7ROY 448.375 OPEN On-Air
571,MRSsaltlake city,447.25,-,5,Tone,100,100,23,23,NN,FM,5,UT Salt Lake Salt Lake City K7MRS 447.25 OPEN On-Air
572,"7NXsaltlake city,  u of u hospital",146.74,-,0.6,Tone,114.8,114.8,23,23,NN,FM,5,"UT Salt Lake Salt Lake City,  U of U Hospital KD7NX 146.74 OPEN On-Air"
573,"7NXsaltlake city,  u of u hospital",448.1,-,5,Tone,114.8,114.8,23,23,NN,FM,5,"UT Salt Lake Salt Lake City,  U of U Hospital KD7NX 448.1 OPEN On-Air"
574,"DAVbountiful,golf course",449.925,-,5,TSQL,100,100,23,23,NN,DIG,5,"UT Davis Bountiful, golf course K7DAV 449.925 OPEN On-Air"
575,"ZCLmorgan,tv site.",147.1,+,0.6,Tone,123,123,23,23,NN,DIG,5,"UT Morgan Morgan, TV Site. KB7ZCL 147.1 OPEN On-Air"
576,"JSQhuntsville,herd mountain",146.68,-,0.6,Tone,123,123,23,23,NN,FM,5,"UT Morgan Huntsville, Herd Mountain N7JSQ 146.68 OPEN On-Air"
577,"DAVfarmington, shepard peak",53.01,-,1,TSQL,141.3,141.3,23,23,NN,FM,5,"UT Davis Farmington,  Shepard Peak K7DAV 53.01 OPEN Off-Air"
578,"DAVlayton, shepard peak",449.875,-,5,DTCS,88.5,88.5,51,51,NN,DIG,5,"UT Davis Layton,  Shepard Peak K7DAV 449.875 OPEN On-Air"
579,"MLAlayton, francis peak",146.96,-,0.6,Tone,100,100,23,23,NN,FM,5,"UT Davis Layton,  Francis Peak K7MLA 146.96 OPEN On-Air"
580,"I7Jlayton, kaysville peak",449.6,-,5,Tone,136.5,136.5,23,23,NN,FM,5,"UT Weber Layton,  Kaysville Peak AI7J 449.6 OPEN On-Air"
581,DBAhuntsville,145.21,-,0.6,Tone,123,123,23,23,NN,FM,5,UT Weber Huntsville W7DBA 145.21 OPEN 
582,DBAhuntsville,448.025,-,5,Tone,123,123,23,23,NN,FM,5,UT Weber Huntsville W7DBA 448.025 OPEN On-Air
583,7YEeden,447.6,-,5,,88.5,88.5,23,23,NN,FM,5,UT Weber Eden KJ7YE 447.6 OPEN 
584,"SUMogden,powder mountain",145.47,-,0.6,Tone,123,123,23,23,NN,FM,5,"UT Weber Ogden, Powder Mountain KC7SUM 145.47 OPEN On-Air"
585,"TOPogden,powder mountain",224,-,1.6,Tone,167.9,167.9,23,23,NN,FM,5,"UT Weber Ogden, Powder Mountain N7TOP 224 OPEN "
586,"TOPogden, powder mountain",447.775,-,5,Tone,123,123,23,23,NN,FM,5,"UT Weber Ogden,  Powder Mountain N7TOP 447.775 OPEN On-Air"
