Location,Name,Frequency,Duplex,Offset,Tone,rToneFreq,cToneFreq,DtcsCode,DtcsRxCode,DtcsPolarity,Mode,TStep,Comment
206,WUCwoodlandpark,449.025,-,5,Tone,141.3,141.3,23,23,NN,FM,5,CO Teller Woodland Park KA0WUC 449.025 OPEN 
207,WUCwoodlandpark,927.9,-,25,DTCS,88.5,88.5,205,205,NN,FM,5,CO Teller Woodland Park KA0WUC 927.9 OPEN On-Air
208,"EPSwoodlandpark, paradise pines",449.325,-,5,TSQL,103.5,103.5,23,23,NN,FM,5,"CO Teller Woodland Park, Paradise Pines KA4EPS 449.325 OPEN On-Air"
209,5SJlybrook,145.49,-,0.6,Tone,100,100,23,23,NN,FM,5,NM Rio Arriba Lybrook NM5SJ 145.49 OPEN On-Air
210,X0Gwoodlandpark,146.82,-,0.6,Tone,107.2,107.2,23,23,NN,FM,5,CO Teller Woodland Park NX0G 146.82 OPEN On-Air
211,X0Gwoodlandpark,448.65,-,5,Tone,107.2,107.2,23,23,NN,FM,5,CO Teller Woodland Park NX0G 448.65 OPEN On-Air
212,"0KQevergreen,saddleback mountain",447.85,-,5,TSQL,141.3,141.3,23,23,NN,FM,5,"CO Clear Creek Evergreen, Saddleback Mountain AC0KQ 447.85 OPEN On-Air"
213,"0SPcoloradosprings, almagre mountain",147.18,+,0.6,Tone,100,100,23,23,NN,FM,5,"CO El Paso Colorado Springs, Almagre Mountain AA0SP 147.18 PRIVATE On-Air"
214,"PFJcoloradosprings, almagre mountain",446.95,-,5,,88.5,88.5,23,23,NN,DIG,5,"CO Teller Colorado Springs, Almagre Mountain K7PFJ 446.95 OPEN On-Air"
215,"IFIcoloradosprings, almagre mountain",927.725,-,25,DTCS,88.5,88.5,114,114,NN,FM,5,"CO Teller Colorado Springs, Almagre Mountain WA6IFI 927.725 OPEN On-Air"
216,"ESQcastlerock, devils head",446.925,-,5,,88.5,88.5,23,23,NN,DIG,5,"CO Douglas Castle Rock, Devils Head N0ESQ 446.925 OPEN On-Air"
217,"ESQcastlerock, devils head (pike national forest)",447.525,-,5,TSQL,146.2,146.2,23,23,NN,FM,5,"CO Douglas Castle Rock, Devils Head (Pike National Forest) N0ESQ 447.525 OPEN On-Air"
218,GUQevergreen,145.34,-,0.6,Cross,103.5,127.3,23,23,NN,FM,5,CO Jefferson Evergreen KE4GUQ 145.34 OPEN On-Air
219,"0SZevergreen,lower squaw mountain",145.175,-,0.6,DTCS,88.5,88.5,73,73,NN,DIG,5,"CO Clear Creek Evergreen, Lower Squaw Mountain N0SZ 145.175 OPEN Off-Air"
220,"OWYconifer,critchell mountain",447.5,-,5,TSQL,88.5,88.5,23,23,NN,FM,5,"CO Jefferson Conifer, Critchell Mountain N0OWY 447.5 OPEN On-Air"
221,"JSClarkspur,westcreek",449.975,-,5,TSQL,100,100,23,23,NN,FM,5,"CO Douglas Larkspur, Westcreek K0JSC 449.975 OPEN On-Air"
222,"CRAlarkspur,westcreek",147.225,+,0.6,TSQL,107.2,107.2,23,23,NN,FM,5,"CO Douglas Larkspur, Westcreek W0CRA 147.225 OPEN On-Air"
223,"CRAlarkspur,westcreek",448.425,-,5,TSQL,107.2,107.2,23,23,NN,FM,5,"CO Douglas Larkspur, Westcreek W0CRA 448.425 OPEN On-Air"
224,"SDChanksville,ellen peak",147.08,+,0.6,Tone,136.5,136.5,23,23,NN,FM,5,"UT Wayne Hanksville, Ellen Peak K7SDC 147.08 OPEN On-Air"
225,"FEZgolden,centennial cone",146.985,-,0.6,TSQL,100,100,23,23,NN,FM,5,"CO Denver Golden, Centennial Cone K0FEZ 146.985 OPEN On-Air"
226,"0SJgolden,centennial cone",145.28,-,0.6,Tone,100,100,23,23,NN,FM,5,"CO Jefferson Golden, Centennial Cone KE0SJ 145.28 OPEN On-Air"
227,"0SJgolden,centennial cone",449.525,-,5,,88.5,88.5,23,23,NN,FM,5,"CO Jefferson Golden, Centennial Cone KE0SJ 449.525 OPEN On-Air"
228,"TUBgolden,centennial cone",146.64,-,0.6,Tone,100,100,23,23,NN,FM,5,"CO Jefferson Golden, Centennial Cone WB0TUB 146.64 OPEN On-Air"
229,"0TXgolden,centennial cone",448.625,-,5,TSQL,100,100,23,23,NN,FM,5,"CO Jefferson Golden, Centennial Cone W0TX 448.625 OPEN On-Air"
230,"0HCgolden,centennial cone",927.8375,-,25.8,DTCS,88.5,88.5,205,205,NN,DIG,5,"CO Jefferson Golden, Centennial Cone KI0HC 927.8375 OPEN On-Air"
231,"0TXdenver,centennial cone",446.7875,-,5,,88.5,88.5,23,23,NN,DIG,5,"CO Jefferson Denver, Centennial Cone W0TX 446.7875 OPEN On-Air"
232,0RMrollinsville,224.6,-,1.6,Tone,100,100,23,23,NN,FM,5,CO Gilpin Rollinsville W0RM 224.6 OPEN 
233,SRJcoloradosprings,145.265,-,0.6,TSQL,100,100,23,23,NN,DIG,5,CO El Paso Colorado Springs KB0SRJ 145.265 OPEN Off-Air
234,"SRJcoloradosprings, uccs",448.8,-,5,TSQL,100,100,23,23,NN,DIG,5,"CO El Paso Colorado Springs, UCCS KB0SRJ 448.8 OPEN Off-Air"
235,"CVUcoloradosprings, cheyenne mountain",146.76,-,0.6,TSQL,107.2,107.2,23,23,NN,FM,5,"CO El Paso Colorado Springs, Cheyenne Mountain KC0CVU 146.76 OPEN On-Air"
236,"CVUcoloradosprings, cheyenne mountain",147.345,+,0.6,TSQL,107.2,107.2,23,23,NN,FM,5,"CO El Paso Colorado Springs, Cheyenne Mountain KC0CVU 147.345 OPEN On-Air"
237,"CVUcoloradosprings, cheyenne mountain",448,-,5,Tone,107.2,107.2,23,23,NN,FM,5,"CO El Paso Colorado Springs, Cheyenne Mountain KC0CVU 448 OPEN On-Air"
238,"CVUcoloradosprings, cheyenne mountain",448.1,-,5,TSQL,107.2,107.2,23,23,NN,FM,5,"CO El Paso Colorado Springs, Cheyenne Mountain KC0CVU 448.1 OPEN On-Air"
239,"CRAcoloradosprings, cheyenne mountain",145.16,-,0.6,TSQL,107.2,107.2,23,23,NN,FM,5,"CO El Paso Colorado Springs, Cheyenne Mountain W0CRA 145.16 OPEN On-Air"
240,"IBMgolden,guy hill",448.85,-,5,TSQL,88.5,88.5,23,23,NN,FM,5,"CO Jefferson Golden, Guy Hill K0IBM 448.85 OPEN On-Air"
241,"VJJboulder,thorodin mountain",145.31,-,0.6,Cross,88.5,123,23,23,NN,FM,5,"CO Gilpin Boulder, Thorodin Mountain KB0VJJ 145.31 OPEN On-Air"
242,"0GOgolden,guy hill",449.75,-,5,TSQL,103.5,103.5,23,23,NN,FM,5,"CO Jefferson Golden, Guy Hill KI0GO 449.75 OPEN On-Air"
243,"MHUgolden,guy hill",224,-,1.6,TSQL,103.5,103.5,23,23,NN,FM,5,"CO Jefferson Golden, Guy Hill N0MHU 224 OPEN On-Air"
244,"POHgolden,guy hill",224.74,-,1.6,TSQL,88.5,88.5,23,23,NN,FM,5,"CO Jefferson Golden, Guy Hill N0POH 224.74 OPEN On-Air"
245,"0SZdenver,thorodin mountain",449.225,-,5,TSQL,141.3,141.3,23,23,NN,FM,5,"CO Gilpin Denver, Thorodin Mountain N0SZ 449.225 OPEN On-Air"
246,"CBIgolden,guy hill",147.15,+,0.6,TSQL,100,100,23,23,NN,FM,5,"CO Jefferson Golden, Guy Hill W0CBI 147.15 OPEN On-Air"
247,"T0Cgolden,guy hill",145.22,-,0.6,TSQL,103.5,103.5,23,23,NN,DIG,5,"CO Jefferson Golden, Guy Hill WT0C 145.22 OPEN On-Air"
248,"TUBcentennial,warren mountain",146.88,-,0.6,Tone,100,100,23,23,NN,FM,5,"CO Jefferson Centennial, Warren Mountain WB0TUB 146.88 OPEN On-Air"
249,"TUBcentennial,warren mountain",449.6,-,5,Tone,100,100,23,23,NN,FM,5,"CO Jefferson Centennial, Warren Mountain WB0TUB 449.6 OPEN On-Air"
250,"VJJcoloradosprings, cheyenne mountain",145.13,-,0.6,Cross,88.5,123,23,23,NN,FM,5,"CO El Paso Colorado Springs, Cheyenne Mountain KB0VJJ 145.13 OPEN On-Air"
251,"CVUcoloradosprings, cheyenne mountain",145.375,-,0.6,,88.5,88.5,23,23,NN,DIG,5,"CO El Paso Colorado Springs, Cheyenne Mountain KC0CVU 145.375 OPEN Off-Air"
252,"CVUcoloradosprings, cheyenne mountain",446.9125,-,5,,88.5,88.5,23,23,NN,DIG,5,"CO El Paso Colorado Springs, Cheyenne Mountain KC0CVU 446.9125 OPEN On-Air"
253,"CVUcoloradosprings, cheyenne mountain",927.85,-,25,DTCS,88.5,88.5,114,114,NN,FM,5,"CO Teller Colorado Springs, Cheyenne Mountain KC0CVU 927.85 OPEN On-Air"
254,"0SZcoloradosprings, cheyenne mountain",445.0625,-,5,,88.5,88.5,23,23,NN,DIG,5,"CO El Paso Colorado Springs, Cheyenne Mountain N0SZ 445.0625 OPEN Off-Air"
255,"IFIcoloradosprings, cheyenne mountain",53.13,-,1.7,TSQL,107.2,107.2,23,23,NN,FM,5,"CO El Paso Colorado Springs, Cheyenne Mountain WA6IFI 53.13 OPEN On-Air"
256,"PFOtrespiedras, san antonio mountain",146.76,-,0.6,Tone,67,67,23,23,NN,FM,5,"NM Taos Tres Piedras, San Antonio Mountain KF5PFO 146.76 OPEN On-Air"
257,"5EMtrespiedras, san antonio mtn.",145.175,-,0.6,Tone,141.3,141.3,23,23,NN,FM,5,"NM Taos Tres Piedras, San Antonio Mtn. NM5EM 145.175 OPEN Off-Air"
258,"TTFcoloradosprings, fillmore hill",448.725,-,5,Tone,123,123,23,23,NN,FM,5,"CO El Paso Colorado Springs, Fillmore Hill KA0TTF 448.725 OPEN On-Air"
259,"LXXmorrison,mt. morrison",53.17,-,1.7,Tone,107.2,107.2,23,23,NN,FM,5,"CO Jefferson Morrison, Mt. Morrison N6LXX 53.17 OPEN On-Air"
260,"LXXmorrison,mt. morrison",447.875,-,5,TSQL,107.2,107.2,23,23,NN,FM,5,"CO Jefferson Morrison, Mt. Morrison N6LXX 447.875 OPEN On-Air"
261,"XLFpalmerlake, monument hill",145.19,-,0.6,TSQL,131.8,131.8,23,23,NN,FM,5,"CO Douglas Palmer Lake, Monument Hill N0XLF 145.19 OPEN On-Air"
262,"0KUgolden,lookout mountain",449.625,-,5,TSQL,141.3,141.3,23,23,NN,FM,5,"CO Jefferson Golden, Lookout Mountain W0KU 449.625 OPEN On-Air"
263,"0SZgolden,lookout mountain",145.37,-,0.6,,88.5,88.5,23,23,NN,DIG,5,"CO Jefferson Golden, Lookout Mountain N0SZ 145.37 OPEN On-Air"
264,"CDSgolden,lookout mountain",1283.9625,-,20,,88.5,88.5,23,23,NN,DIG,5,"CO Jefferson Golden, Lookout Mountain W0CDS 1283.9625 OPEN On-Air"
265,"CDSgolden,lookout mountain",1299.9,,0,,88.5,88.5,23,23,NN,DIG,5,"CO Jefferson Golden, Lookout Mountain W0CDS 1299.9 OPEN On-Air"
266,"CDSgolden,lookout mountain",145.25,-,0.6,,88.5,88.5,23,23,NN,DIG,5,"CO Jefferson Golden, Lookout Mountain W0CDS 145.25 OPEN On-Air"
267,"CDSgolden,lookout mountain",446.9625,-,5,,88.5,88.5,23,23,NN,DIG,5,"CO Jefferson Golden, Lookout Mountain W0CDS 446.9625 OPEN On-Air"
268,"YZTgolden,lookout",446.8375,-,5,,88.5,88.5,23,23,NN,DIG,5,"CO Jefferson Golden, Lookout WA2YZT 446.8375 OPEN On-Air"
269,coloradosprings,147.27,+,0.6,,88.5,88.5,23,23,NN,FM,5,CO El Paso Colorado Springs  147.27 OPEN On-Air
270,coloradosprings,449.575,-,5,,88.5,88.5,23,23,NN,FM,5,CO El Paso Colorado Springs  449.575 CLOSED On-Air
271,A0Lcoloradosprings,448.3,-,5,Tone,100,100,23,23,NN,FM,5,CO El Paso Colorado Springs AA0L 448.3 OPEN On-Air
272,IRPcoloradosprings,146.91,-,0.6,TSQL,151.4,151.4,23,23,NN,FM,5,CO El Paso Colorado Springs K0IRP 146.91 OPEN On-Air
273,IRPcoloradosprings,447.35,-,5,Tone,151.4,151.4,23,23,NN,FM,5,CO El Paso Colorado Springs K0IRP 447.35 OPEN On-Air
274,SRJcoloradosprings,224.06,-,1.6,,88.5,88.5,23,23,NN,FM,5,CO El Paso Colorado Springs KB0SRJ 224.06 CLOSED 
275,0WFcoloradosprings,447.025,-,5,Tone,123,123,23,23,NN,FM,5,CO El Paso Colorado Springs KF0WF 447.025 OPEN Off-Air
276,"0KGcoloradosprings, broadmoor area",448.25,-,5,Tone,123,123,23,23,NN,FM,5,"CO El Paso Colorado Springs, Broadmoor Area N0KG 448.25 OPEN Off-Air"
277,X0Gcoloradosprings,447.475,-,5,Tone,107.2,107.2,23,23,NN,FM,5,CO El Paso Colorado Springs NX0G 447.475 OPEN 
278,MOGcoloradosprings,147.39,+,0.6,Tone,103.5,103.5,23,23,NN,FM,5,CO El Paso Colorado Springs W0MOG 147.39 OPEN On-Air
279,MOGcoloradosprings,448.6,-,5,Tone,114.8,114.8,23,23,NN,FM,5,CO El Paso Colorado Springs W0MOG 448.6 OPEN 
280,MOGcoloradosprings,927.8,-,25,DTCS,88.5,88.5,116,116,NN,FM,5,CO Teller Colorado Springs W0MOG 927.8 OPEN On-Air
281,RSHcoloradosprings,146.85,-,0.6,Tone,103.5,103.5,23,23,NN,FM,5,CO El Paso Colorado Springs W0RSH 146.85 OPEN On-Air
282,IFIcoloradosprings,447.55,-,5,Tone,123,123,23,23,NN,FM,5,CO El Paso Colorado Springs WA6IFI 447.55 OPEN On-Air
283,"0NRmonument,monument hill",447.725,-,5,TSQL,100,100,23,23,NN,FM,5,"CO El Paso Monument, Monument Hill K0NR 447.725 OPEN On-Air"
284,PYYgolden,448.125,-,5,Tone,107.2,107.2,23,23,NN,FM,5,CO Jefferson Golden N0PYY 448.125 OPEN On-Air
285,PYYgolden,927.7875,-,25,Tone,156.7,156.7,23,23,NN,FM,5,CO Jefferson Golden N0PYY 927.7875 OPEN On-Air
286,0GVgolden,448.975,-,5,Tone,123,123,23,23,NN,FM,5,CO Jefferson Golden W0GV 448.975 OPEN On-Air
287,"0TXlakewood,green mountain",53.09,-,1.7,Tone,107.2,107.2,23,23,NN,FM,5,"CO Jefferson Lakewood, Green Mountain W0TX 53.09 OPEN On-Air"
288,A0Lcoloradosprings,147.135,+,0.6,Tone,100,100,23,23,NN,FM,5,CO El Paso Colorado Springs AA0L 147.135 OPEN On-Air
289,MOGcoloradosprings,224.72,-,1.6,TSQL,103.5,103.5,23,23,NN,FM,5,CO El Paso Colorado springs W0MOG 224.72 OPEN On-Air
290,"0TXlakewood,green mountain",147.33,+,0.6,Tone,100,100,23,23,NN,FM,5,"CO Jefferson Lakewood, Green Mountain W0TX 147.33 OPEN On-Air"
291,"0TXlakewood,green mountain",224.38,-,1.6,TSQL,100,100,23,23,NN,FM,5,"CO Jefferson Lakewood, Green Mountain W0TX 224.38 OPEN On-Air"
292,"0TXlakewood,green mtn",449.775,-,5,TSQL,100,100,23,23,NN,DIG,5,"CO Jefferson Lakewood, Green Mtn W0TX 449.775 OPEN On-Air"
293,"VGDgolden,table mountain",446.975,-,5,,88.5,88.5,23,23,NN,DIG,5,"CO Jefferson Golden, Table Mountain KB0VGD 446.975 OPEN On-Air"
294,"BYUmyton,flat top",145.49,-,0.6,Tone,136.5,136.5,23,23,NN,FM,5,"UT Duchesne Myton, Flat Top W7BYU 145.49 OPEN On-Air"
295,"VJJwalden,peterson ridge",145.16,-,0.6,Cross,88.5,123,23,23,NN,FM,5,"CO Jackson Walden, Peterson Ridge KB0VJJ 145.16 OPEN On-Air"
296,JPXlaveta,145.355,-,0.6,Tone,100,100,23,23,NN,FM,5,CO Huerfano La Veta N0JPX 145.355 OPEN On-Air
297,ELYlakewood,448.75,-,5,TSQL,100,100,23,23,NN,FM,5,CO Jefferson Lakewood N0ELY 448.75 OPEN On-Air
298,"0TXlakewood,st anthony medical campus",447.825,-,5,DTCS,88.5,88.5,73,73,NN,NFM,5,"CO Jefferson Lakewood, St Anthony Medical Campus W0TX 447.825 OPEN On-Air"
299,JSCpueblowest,448.975,-,5,TSQL,100,100,23,23,NN,FM,5,CO Pueblo Pueblo West K0JSC 448.975 OPEN On-Air
300,0JZgoldhill,146.91,+,0.6,Cross,123,127.3,23,23,NN,FM,5,CO Boulder Gold Hill W0JZ 146.91 OPEN On-Air
301,"SSPlakewood,moffat treatment plant",147.21,+,0.6,TSQL,100,100,23,23,NN,FM,5,"CO Jefferson Lakewood, Moffat Treatment Plant KD0SSP 147.21 OPEN On-Air"
302,"SSPlakewood,moffat treatment plant",448.35,-,5,Tone,225.7,225.7,23,23,NN,DIG,5,"CO Jefferson Lakewood, Moffat Treatment Plant KD0SSP 448.35 OPEN On-Air"
303,"0DKboulder,table mountain",146.7,-,0.6,Tone,100,100,23,23,NN,FM,5,"CO Boulder Boulder, Table Mountain W0DK 146.7 OPEN On-Air"
304,0DKboulder,146.61,-,0.6,Tone,100,100,23,23,NN,FM,5,CO Boulder Boulder W0DK 146.61 OPEN Off-Air
305,"0DKboulder,table mesa",448.9,-,5,Tone,100,100,23,23,NN,FM,5,"CO Boulder Boulder, Table Mesa W0DK 448.9 OPEN On-Air"
306,"0HGallenspark,afpd station #5",147.03,+,0.6,Tone,100,100,23,23,NN,FM,5,"CO Boulder Allenspark, AFPD Station #5 KI0HG 147.03 OPEN On-Air"
307,"0SZboulder,lee hill",445.05,-,5,,88.5,88.5,23,23,NN,DIG,5,"CO Boulder Boulder, Lee Hill N0SZ 445.05 OPEN On-Air"
308,"0SZboulder,lee hill",446.9875,-,5,,88.5,88.5,23,23,NN,DIG,5,"CO Boulder Boulder, Lee Hill N0SZ 446.9875 OPEN On-Air"
309,"0SZboulder,lee hill",447.75,-,5,TSQL,141.3,141.3,23,23,NN,FM,5,"CO Boulder Boulder, Lee Hill N0SZ 447.75 OPEN On-Air"
310,"CRAboulder,eldorado mountain",145.46,-,0.6,TSQL,107.2,107.2,23,23,NN,FM,5,"CO Boulder Boulder, Eldorado Mountain W0CRA 145.46 OPEN On-Air"
311,"CRAboulder,eldorado mountain",447.975,-,5,TSQL,107.2,107.2,23,23,NN,FM,5,"CO Boulder Boulder, Eldorado Mountain W0CRA 447.975 OPEN On-Air"
312,"0IAboulder,lee hill",224.02,-,1.6,,88.5,88.5,23,23,NN,FM,5,"CO Boulder Boulder, Lee Hill W0IA 224.02 OPEN On-Air"
313,"ZSNlaveta, cordova pass",449.75,-,5,TSQL,100,100,23,23,NN,FM,5,"CO Las Animas La Veta, Cordova Pass N0ZSN 449.75 OPEN On-Air"
314,"9SLcastlepines, daniels park",449.95,-,5,TSQL,77,77,23,23,NN,FM,5,"CO Douglas Castle Pines, Daniels Park W9SL 449.95 OPEN On-Air"
315,0DSboulder,446.8625,-,5,,88.5,88.5,23,23,NN,DIG,5,CO Boulder Boulder KC0DS 446.8625 OPEN On-Air
316,"0SZboulder,mount thorodin",446.8,-,5,,88.5,88.5,23,23,NN,DIG,5,"CO Boulder Boulder, Mount Thorodin N0SZ 446.8 OPEN On-Air"
317,0DKboulder,1299.5,-,20,,88.5,88.5,23,23,NN,DIG,5,CO Boulder Boulder W0DK 1299.5 OPEN On-Air
318,0DKboulder,449.4,-,5,Tone,91.5,91.5,23,23,NN,FM,5,CO Boulder Boulder K0DK 449.4 OPEN Off-Air
319,0IAboulder,449.55,-,5,Tone,100,100,23,23,NN,FM,5,CO Boulder Boulder W0IA 449.55 OPEN On-Air
320,"7GXprice,wood hill",147.2,+,0.6,Tone,88.5,88.5,23,23,NN,FM,5,"UT Carbon Price, Wood Hill K7GX 147.2 OPEN On-Air"
321,"7GXprice,wood hill",448.3,-,5,,88.5,88.5,23,23,NN,FM,5,"UT Carbon Price, Wood Hill K7GX 448.3 OPEN "
322,"CEUprice, wood hill",145.43,-,0.6,Tone,88.5,88.5,23,23,NN,FM,5,"UT Carbon Price,  Wood Hill W7CEU 145.43 OPEN "
323,"CEUprice, wood hill",224.5,-,1.6,Tone,88.5,88.5,23,23,NN,FM,5,"UT Carbon Price,  Wood Hill W7CEU 224.5 OPEN "
324,"CEUprice, wood hill",448.3,-,5,Tone,88.5,88.5,23,23,NN,FM,5,"UT Carbon Price,  Wood Hill W7CEU 448.3 OPEN "
325,"E0Zpueblo,csu",147,+,0.6,,88.5,88.5,23,23,NN,FM,5,"CO Pueblo Pueblo, CSU NE0Z 147 PRIVATE On-Air"
326,"5EMcuba,eureka mesa",145.175,-,0.6,Tone,141.3,141.3,23,23,NN,FM,5,"NM Sandoval Cuba, Eureka Mesa NM5EM 145.175 OPEN Off-Air"
327,PQDduchense,147.26,+,0.6,,88.5,88.5,23,23,NN,FM,5,UT Duchesne Duchense N7PQD 147.26 OPEN On-Air
328,FEZdenver,447.925,-,5,TSQL,100,100,23,23,NN,FM,5,CO Denver Denver K0FEZ 447.925 OPEN On-Air
329,JSCpueblo,446.9875,-,5,,88.5,88.5,23,23,NN,DIG,5,CO Pueblo Pueblo K0JSC 446.9875 OPEN Off-Air
330,"JSCpueblo,metro",447.275,-,5,TSQL,100,100,23,23,NN,FM,5,"CO Pueblo Pueblo, Metro K0JSC 447.275 OPEN On-Air"
331,"0STpueblo,pueblo",146.655,-,0.6,Tone,123,123,23,23,NN,FM,5,"CO Pueblo Pueblo, Pueblo K0ST 146.655 OPEN On-Air"
332,"0KRpueblo,pueblo",447.7,-,5,TSQL,210.7,210.7,23,23,NN,DIG,5,"CO Pueblo Pueblo, Pueblo KF0KR 447.7 PRIVATE Off-Air"
333,J0Tpueblo,147.24,+,0.6,Tone,103.5,103.5,23,23,NN,FM,5,CO Pueblo Pueblo KJ0T 147.24 OPEN Off-Air
334,"ESQparker,hess reservoir",447.525,-,5,Cross,203.5,146.2,23,23,NN,FM,5,"CO Douglas Parker, Hess Reservoir N0ESQ 447.525 OPEN On-Air"
335,PWZpalmerdivide,449.725,-,5,Tone,100,100,23,23,NN,FM,5,CO El Paso Palmer Divide N0PWZ 449.725 OPEN On-Air
336,D0Qpueblo,145.115,-,0.6,Tone,88.5,88.5,23,23,NN,FM,5,CO Pueblo Pueblo ND0Q 145.115 OPEN Off-Air
337,"D0Qpueblo,deer peak",146.88,-,0.6,Tone,88.5,88.5,23,23,NN,FM,5,"CO Pueblo Pueblo, Deer Peak ND0Q 146.88 OPEN On-Air"
338,TPTdenver,447.9,-,5,,88.5,88.5,23,23,NN,FM,5,CO Denver Denver WB0TPT 447.9 OPEN Off-Air
339,AENdenver,449.65,-,5,Tone,136.5,136.5,23,23,NN,DIG,5,CO Denver Denver WR0AEN 449.65 OPEN On-Air
340,AENdenver,449.675,-,5,Tone,136.5,136.5,23,23,NN,DIG,5,CO Denver Denver WR0AEN 449.675 OPEN On-Air
341,"0SJboulder,blue mountain",145.475,-,0.6,Tone,100,100,23,23,NN,FM,5,"CO Jefferson Boulder, Blue Mountain KE0SJ 145.475 OPEN On-Air"
342,JXNdenver,146.715,-,0.6,TSQL,123,123,23,23,NN,FM,5,CO Denver Denver N0JXN 146.715 OPEN On-Air
343,EHPdenver,448.075,-,5,Tone,123,123,23,23,NN,FM,5,CO Denver Denver N5EHP 448.075 OPEN On-Air
344,KIZdenver,448.55,-,5,Tone,82.5,82.5,23,23,NN,FM,5,CO Denver Denver W0KIZ 448.55 OPEN Off-Air
345,0DSboulder,1283.8625,-,20,,88.5,88.5,23,23,NN,DIG,5,CO Boulder Boulder KC0DS 1283.8625 OPEN On-Air
346,0DSboulder,145.3875,-,0.6,,88.5,88.5,23,23,NN,DIG,5,CO Boulder Boulder KC0DS 145.3875 OPEN On-Air
347,0DKboulder,146.73,-,0.6,TSQL,91.5,91.5,23,23,NN,FM,5,CO Boulder Boulder K0DK 146.73 OPEN Off-Air
348,"BARvernal,grizzly ridge",147.04,+,0.6,Tone,136.5,136.5,23,23,NN,FM,5,"UT Uintah Vernal, Grizzly Ridge W7BAR 147.04 OPEN On-Air"
349,"JRLdenver,broadway plaza lofts",447.175,-,5,TSQL,100,100,23,23,NN,FM,5,"CO Denver Denver, Broadway Plaza Lofts W0JRL 447.175 OPEN On-Air"
350,"PFOredriver, molycorp",145.39,-,0.6,Tone,100,100,23,23,NN,FM,5,"NM Taos Red River, Molycorp KF5PFO 145.39 OPEN On-Air"
351,UPSwestminster,449.3,-,5,Tone,100,100,23,23,NN,FM,5,CO Adams Westminster N1UPS 449.3 OPEN On-Air
352,"5EMabiquiu,cerro pelon",147.04,+,0.6,Tone,141.3,141.3,23,23,NN,FM,5,"NM Rio Arriba Abiquiu, Cerro Pelon NM5EM 147.04 OPEN Off-Air"
353,falcon,447.2,-,5,Tone,151.4,151.4,23,23,NN,DIG,5,CO El Paso Falcon  447.2 OPEN Testing
354,"HENvernal,grizzly ridge",145.49,-,0.6,Tone,136.5,136.5,23,23,NN,FM,5,"UT Uintah Vernal, Grizzly Ridge K7HEN 145.49 OPEN On-Air"
355,"5MLcuba,eureka mesa",147.24,+,0.6,Tone,67,67,23,23,NN,FM,5,"NM Sandoval Cuba, Eureka Mesa NM5ML 147.24 OPEN On-Air"
356,LMAbroomfield,448.925,-,5,Tone,131.8,131.8,23,23,NN,FM,5,CO Boulder Broomfield W0LMA 448.925 OPEN On-Air
357,WYXbroomfield,449.825,-,5,Tone,103.5,103.5,23,23,NN,FM,5,CO Boulder Broomfield W0WYX 449.825 OPEN On-Air
358,"D0Qpueblo,baculite mesa",146.79,-,0.6,Tone,88.5,88.5,23,23,NN,FM,5,"CO Pueblo Pueblo, Baculite Mesa ND0Q 146.79 OPEN On-Air"
359,"D0Qpueblo,baculite mesa",224.26,-,1.6,Tone,88.5,88.5,23,23,NN,FM,5,"CO Pueblo Pueblo, Baculite Mesa ND0Q 224.26 OPEN Off-Air"
360,D0Qpueblo,447.95,-,5,Tone,88.5,88.5,23,23,NN,FM,5,CO Pueblo Pueblo ND0Q 447.95 OPEN On-Air
361,"MDPfalcon,black forest",447.625,-,5,TSQL,100,100,23,23,NN,FM,5,"CO El Paso Falcon, Black Forest KD0MDP 447.625 OPEN On-Air"
362,Q8Mparker,448.7,-,5,Tone,146.2,146.2,23,23,NN,FM,5,CO Douglas Parker WQ8M 448.7 OPEN On-Air
363,0FHestespark,449.8,-,5,Tone,123,123,23,23,NN,FM,5,CO Larimer Estes Park N0FH 449.8 OPEN On-Air
364,"0IAboulder,gunbarrel hill",146.76,-,0.6,Tone,100,100,23,23,NN,FM,5,"CO Boulder Boulder, Gunbarrel Hill W0IA 146.76 OPEN On-Air"
365,"YIXtorquerville,hurricane mesa",1299.25,-,20,,88.5,88.5,23,23,NN,DIG,5,"UT Washington Torquerville, Hurricane Mesa KF7YIX 1299.25 OPEN On-Air"
366,0MLnorthglenn,147.045,+,0.6,Tone,123,123,23,23,NN,FM,5,CO Adams Northglenn K0ML 147.045 OPEN On-Air
367,7ZWaltamont,147.28,+,0.6,TSQL,107.2,107.2,23,23,NN,FM,5,UT Duchesne Altamont AD7ZW 147.28 OPEN On-Air
368,CBSaltamont,146.74,-,0.6,Tone,100,100,23,23,NN,FM,5,UT Duchesne Altamont WB7CBS 146.74 OPEN Off-Air
369,"SDCcastledale, horn mountain",147.06,+,0.6,Tone,88.5,88.5,23,23,NN,FM,5,"UT Emery Castle Dale, Horn Mountain K7SDC 147.06 OPEN On-Air"
370,"7YIcastledale, horn mountain",447.625,-,5,Tone,100,100,23,23,NN,FM,5,"UT Emery Castle Dale, Horn Mountain K7YI 447.625 OPEN On-Air"
371,"X7Yhuntington, skyline dr",223.92,-,1.6,Tone,88.5,88.5,23,23,NN,FM,5,"UT Emery Huntington,  Skyline Dr WX7Y 223.92 OPEN "
372,"X7Ycastledale, horn mountain",447.7,-,5,Tone,123,123,23,23,NN,FM,5,"UT Emery Castle Dale, Horn Mountain WX7Y 447.7 OPEN "
373,PRAparker,445.075,-,5,,88.5,88.5,23,23,NN,DIG,5,CO Douglas Parker K0PRA 445.075 OPEN On-Air
374,PRAfranktown,446.85,-,5,,88.5,88.5,23,23,NN,DIG,5,CO Douglas Franktown K0PRA 446.85 OPEN On-Air
375,0FHestespark,146.685,-,0.6,Tone,123,123,23,23,NN,FM,5,CO Larimer Estes Park N0FH 146.685 OPEN On-Air
376,"PFOredriver, valle vidal",145.25,-,0.6,Tone,123,123,23,23,NN,FM,5,"NM Taos Red River, Valle Vidal KF5PFO 145.25 OPEN On-Air"
377,"WDVgallup,deza bluffs",448.2,-,5,Tone,100,100,23,23,NN,FM,5,"NM McKinley Gallup, Deza Bluffs KC5WDV 448.2 OPEN On-Air"
378,"5MLgallup,deza bluffs",147.22,+,0.6,Tone,67,67,23,23,NN,FM,5,"NM McKinley Gallup, Deza Bluffs NM5ML 147.22 OPEN On-Air"
379,"UDDaurora,smokey hill",448.5,-,5,Tone,100,100,23,23,NN,FM,5,"CO Denver Aurora, Smokey Hill KB0UDD 448.5 OPEN On-Air"
380,ZUQaurora,448.4,-,5,Tone,94.8,94.8,23,23,NN,FM,5,CO Arapahoe Aurora N0ZUQ 448.4 OPEN On-Air
381,0BGaurora,448.275,-,5,Tone,156.7,156.7,23,23,NN,FM,5,CO Arapahoe Aurora W0BG 448.275 OPEN On-Air
382,ANTaurora,448.825,-,5,,88.5,88.5,23,23,NN,DIG,5,CO Arapahoe Aurora WN7ANT 448.825 OPEN On-Air
383,AENaurora,449.15,-,5,Tone,136.5,136.5,23,23,NN,DIG,5,CO Arapahoe Aurora WR0AEN 449.15 OPEN On-Air
384,OBAaurora,145.19,-,0.6,Cross,151.4,131.8,23,23,NN,FM,5,CO Arapahoe Aurora N0OBA 145.19 OPEN On-Air
385,"UDDaurora,smoky hill",145.4,-,0.8,Tone,100,100,23,23,NN,FM,5,"CO Arapahoe Aurora, Smoky Hill KB0UDD 145.4 OPEN On-Air"
386,"5MLtaos,ski valley",147.14,+,0.6,Tone,67,67,23,23,NN,FM,5,"NM Taos Taos, Ski Valley NM5ML 147.14 OPEN On-Air"
387,"JSCpueblo,cedarwood",449.975,-,5,TSQL,100,100,23,23,NN,FM,5,"CO Pueblo Pueblo, Cedarwood K0JSC 449.975 OPEN On-Air"
388,PWOcentennial,449.425,-,5,DTCS,88.5,88.5,23,23,NN,FM,5,CO Arapahoe Centennial K0PWO 449.425 OPEN Off-Air
389,"VHFpage,navajo mountain",448.6,-,5,Tone,100,100,23,23,NN,FM,5,"UT San Juan Page, Navajo Mountain WA7VHF 448.6 OPEN On-Air"
390,EPAlongmont,448.525,-,5,Tone,151.4,151.4,23,23,NN,FM,5,CO Boulder Longmont N0EPA 448.525 OPEN On-Air
391,ENOlongmont,147.27,+,0.6,TSQL,100,100,23,23,NN,FM,5,CO Boulder Longmont W0ENO 147.27 OPEN On-Air
392,ENOlongmont,448.8,-,5,TSQL,88.5,88.5,23,23,NN,FM,5,CO Boulder Longmont W0ENO 448.8 OPEN On-Air
393,"SDCscofield,ford ridge",145.31,-,0.6,Tone,88.5,88.5,23,23,NN,FM,5,"UT Carbon Scofield, Ford Ridge K7SDC 145.31 OPEN On-Air"
394,"TSVtaos,wheeler peak",444.975,+,5,Tone,123,123,23,23,NN,FM,5,"NM Taos Taos, Wheeler Peak N5TSV 444.975 OPEN On-Air"
395,"GURdenver,green valley ranch",448.15,-,5,TSQL,141.3,141.3,23,23,NN,FM,5,"CO Denver Denver, Green Valley Ranch K0GUR 448.15 OPEN On-Air"
396,"7DBpage(az), navajo mountain",448.75,-,5,Tone,100,100,23,23,NN,FM,5,"UT San Juan Page (az), Navajo Mountain NA7DB 448.75 OPEN On-Air"
397,"CWIpage(az), navajo mountain",449.925,-,5,Tone,100,100,23,23,NN,FM,5,"UT San Juan Page (AZ), Navajo Mountain W7CWI 449.925 OPEN On-Air"
398,"WACpage(az), navajo mountain",146.96,-,0.6,Tone,100,100,23,23,NN,FM,5,"UT San Juan Page (AZ), Navajo Mountain W7WAC 146.96 OPEN On-Air"
399,"5PXdixon,cerro abajo",147.18,+,0.6,TSQL,100,100,23,23,NN,FM,5,"NM Rio Arriba Dixon, Cerro Abajo KD5PX 147.18 OPEN On-Air"
400,0HCparker,927.8375,-,25.8,Tone,100,100,23,23,NN,DIG,5,CO Douglas Parker KI0HC 927.8375 OPEN On-Air
401,"D0Qwalsenburg,n rattlesnake butte",146.73,-,0.6,Tone,88.5,88.5,23,23,NN,FM,5,"CO Huerfano Walsenburg, N Rattlesnake Butte ND0Q 146.73 OPEN On-Air"
402,5HOlacueva,145.41,-,0.6,Tone,100,100,23,23,NN,FM,5,NM Santa Fe La Cueva W5HO 145.41 OPEN Off-Air
403,"5MLeaglenest, iron mountain",444.35,+,5,Tone,100,100,23,23,NN,FM,5,"NM Colfax Eagle Nest, Iron Mountain NM5ML 444.35 OPEN On-Air"
404,"SDCscofield,boardinghouse ridge",147.08,+,0.6,Tone,88.5,88.5,23,23,NN,FM,5,"UT Carbon Scofield, Boardinghouse Ridge K7SDC 147.08 OPEN On-Air"
405,"X7Yscofield,boardinghouse rdge",224.98,-,1.6,Tone,88.5,88.5,23,23,NN,FM,5,"UT Carbon Scofield, Boardinghouse Rdge WX7Y 224.98 OPEN "
406,"PFOtaos,picuris peak",51.5,,0,Tone,100,100,23,23,NN,FM,5,"NM Taos Taos, Picuris Peak KF5PFO 51.5 OPEN On-Air"
407,"PFOtaos,picuris peak",147.12,+,0.6,Tone,67,67,23,23,NN,FM,5,"NM Taos Taos, Picuris Peak KF5PFO 147.12 OPEN On-Air"
408,"PFOtaos,picuris peak",224.4,-,1.6,Tone,225.7,225.7,23,23,NN,FM,5,"NM Taos Taos, Picuris Peak KF5PFO 224.4 OPEN On-Air"
409,"5SFlosalamos, pajarito mountain",145.19,-,0.6,Tone,162.2,162.2,23,23,NN,DIG,5,"NM Los Alamos Los Alamos, Pajarito Mountain W5SF 145.19 OPEN On-Air"
410,"PFOtaos,picuris peak",449.875,-,5,Tone,123,123,23,23,NN,FM,5,"NM Taos Taos, Picuris Peak KF5PFO 449.875 OPEN Off-Air"
411,0KCfortlupton,447.3,-,5,Tone,107.2,107.2,23,23,NN,FM,5,CO Weld Fort Lupton AC0KC 447.3 OPEN On-Air
412,"5EMeaglenest, touch me not",147.04,+,0.6,Tone,141.3,141.3,23,23,NN,FM,5,"NM Colfax Eagle Nest, Touch Me Not NM5EM 147.04 OPEN On-Air"
