Location,Name,Frequency,Duplex,Offset,Tone,rToneFreq,cToneFreq,DtcsCode,DtcsRxCode,DtcsPolarity,Mode,TStep,Comment
0,UUXmontrose,146.91,-,0.6,TSQL,107.2,107.2,23,23,NN,FM,5,CO Montrose Montrose KC0UUX 146.91 OPEN On-Air
1,OPDmontrose,146.79,-,0.6,TSQL,107.2,107.2,23,23,NN,FM,5,CO Montrose Montrose KD5OPD 146.79 OPEN On-Air
2,"YNAmontrose,waterdog peak",448.65,-,5,Cross,88.5,151.4,23,23,NN,FM,5,"CO Montrose Montrose, Waterdog Peak KB0YNA 448.65 OPEN On-Air"
3,"HNDmontrose,waterdog peak",447.2,-,5,TSQL,107.2,107.2,23,23,NN,FM,5,"CO Montrose Montrose, Waterdog Peak WA4HND 447.2 OPEN On-Air"
4,"QXXcedaredge,cedar mesa",147.195,+,0.6,Tone,107.2,107.2,23,23,NN,FM,5,"CO Delta Cedaredge, Cedar Mesa KC0QXX 147.195 OPEN "
5,ALCcedaredge,147.36,+,0.6,Tone,100,100,23,23,NN,FM,5,CO Delta Cedaredge W0ALC 147.36 OPEN 
6,ALCcedaredge,449.825,-,5,Tone,100,100,23,23,NN,FM,5,CO Delta Cedaredge W0ALC 449.825 OPEN 
7,0MRpaonia,147.33,+,0.6,Tone,107.2,107.2,23,23,NN,FM,5,CO Delta Paonia KI0MR 147.33 OPEN On-Air
8,"ITSouray,engineer mountain",147.27,+,0.6,Tone,127.3,127.3,23,23,NN,FM,5,"CO Ouray Ouray, Engineer Mountain KB5ITS 147.27 OPEN On-Air"
9,"YNAtelluride,gray head",449.7,-,5,TSQL,107.2,107.2,23,23,NN,FM,5,"CO San Miguel Telluride, Gray Head KB0YNA 449.7 OPEN On-Air"
10,"cedaredge,grand mesa",447.35,-,5,Tone,107.2,107.2,23,23,NN,FM,5,"CO Delta Cedaredge, Grand Mesa  447.35 OPEN "
11,"VJJgrandjunction, grand mesa",145.355,-,0.6,Cross,88.5,123,23,23,NN,FM,5,"CO Mesa Grand Junction, Grand Mesa KB0VJJ 145.355 OPEN On-Air"
12,"YNAgrandjunction, grand mesa",449.65,-,5,TSQL,151.4,151.4,23,23,NN,FM,5,"CO Mesa Grand Junction, Grand Mesa KB0YNA 449.65 OPEN On-Air"
13,"YNAdelta,uncompahgre butte",449.4,-,5,TSQL,131.8,131.8,23,23,NN,FM,5,"CO Mesa Delta, Uncompahgre Butte KB0YNA 449.4 OPEN On-Air"
14,"ITSlakecity, hill 71",147.135,-,0.6,Tone,123,123,23,23,NN,FM,5,"CO Hinsdale Lake City, Hill 71 KB5ITS 147.135 OPEN On-Air"
15,GJTgrandjunction,448.15,-,5,Tone,100,100,23,23,NN,FM,5,CO Mesa Grand Junction W0GJT 448.15 OPEN On-Air
16,"HNDgrandjunction, grand mesa",449.3,-,5,TSQL,107.2,107.2,23,23,NN,FM,5,"CO Mesa Grand Junction, Grand Mesa WA4HND 449.3 OPEN On-Air"
17,"0BXgrandjunction, grand mesa",446.9125,-,5,,88.5,88.5,23,23,NN,DIG,5,"CO Mesa Grand Junction, Grand Mesa W0BX 446.9125 OPEN On-Air"
18,"ITSsilverton,buffalo boy",145.325,-,0.6,Tone,127.3,127.3,23,23,NN,FM,5,"CO San Juan Silverton, Buffalo Boy KB5ITS 145.325 OPEN On-Air"
19,"ITSsilverton,hazelton",444,+,5,Tone,67,67,23,23,NN,FM,5,"CO San Juan Silverton, Hazelton KB5ITS 444 OPEN On-Air"
20,ITSsilverton,447.525,-,5,Tone,127.3,127.3,23,23,NN,FM,5,CO San Juan Silverton KB5ITS 447.525 OPEN On-Air
21,"ITSsilverton,kendall mountain",147.375,+,0.6,Tone,156.7,156.7,23,23,NN,FM,5,"CO San Juan Silverton, Kendall Mountain KB5ITS 147.375 OPEN On-Air"
22,5GFgunnison,449.95,-,5,,88.5,88.5,23,23,NN,FM,5,CO Gunnison Gunnison K5GF 449.95 OPEN 
23,VTLgunnison,147.12,+,0.6,,88.5,88.5,23,23,NN,FM,5,CO Gunnison Gunnison W0VTL 147.12 OPEN On-Air
24,0SWcollbran,449.5,-,5,Tone,107.2,107.2,23,23,NN,FM,5,CO Mesa Collbran KB0SW 449.5 OPEN Off-Air
25,"ITTsilverton,engineer mountain",147.27,+,0.6,Tone,127.3,127.3,23,23,NN,FM,5,"CO San Juan Silverton, Engineer Mountain KB5ITT 147.27 OPEN On-Air"
26,"VJJgrandjunction, grand mesa",147.355,-,0.6,Cross,88.5,123,23,23,NN,FM,5,"CO Mesa Grand Junction, Grand Mesa KB0VJJ 147.355 OPEN On-Air"
27,SSIgrandjunction,147.105,+,0.6,,88.5,88.5,23,23,NN,FM,5,CO Mesa Grand Junction K0SSI 147.105 OPEN On-Air
28,0SWgrandjunction,449,-,5,Cross,88.5,107.2,23,23,NN,FM,5,CO Mesa Grand Junction KB0SW 449 CLOSED On-Air
29,ARVgrandjunction,447.5,-,5,Tone,114.8,114.8,23,23,NN,FM,5,CO Mesa Grand Junction KC0ARV 447.5 OPEN 
30,REDgrandjunction,446.775,-,5,,88.5,88.5,23,23,NN,DIG,5,CO Mesa Grand Junction KD0RED 446.775 OPEN On-Air
31,SMZgrandjunction,449.775,-,5,Cross,173.8,88.5,23,23,NN,FM,5,CO Mesa Grand Junction KD0SMZ 449.775 OPEN On-Air
32,0TYgrandjunction,145.22,-,0.6,Tone,107.2,107.2,23,23,NN,FM,5,CO Mesa Grand Junction KE0TY 145.22 OPEN 
33,0TYgrandjunction,147.39,+,0.6,Tone,107.2,107.2,23,23,NN,FM,5,CO Mesa Grand Junction KE0TY 147.39 OPEN 
34,GJTgrandjunction,146.82,-,0.6,Tone,107.2,107.2,23,23,NN,FM,5,CO Mesa Grand Junction W0GJT 146.82 OPEN On-Air
35,"RRZgrandjunction, gjt",145.175,-,0.6,Tone,107.2,107.2,23,23,NN,FM,5,"CO Mesa Grand Junction, GJT W0RRZ 145.175 OPEN On-Air"
36,"RRZgrandjunction, black ridge (above colorado ntl monument)",146.94,-,0.6,TSQL,107.2,107.2,23,23,NN,FM,5,"CO Mesa Grand Junction, Black Ridge (Above Colorado Ntl Monument) W0RRZ 146.94 OPEN On-Air"
37,"HNDgrandjunction, black ridge",449.575,-,5,TSQL,131.8,131.8,23,23,NN,FM,5,"CO Mesa Grand Junction, Black Ridge WA4HND 449.575 OPEN On-Air"
38,"PKTcreede,bristol head",449.525,-,5,TSQL,100,100,23,23,NN,FM,5,"CO Mineral Creede, Bristol Head N0PKT 449.525 OPEN On-Air"
39,0JScreede,146.925,-,0.6,,88.5,88.5,23,23,NN,FM,5,CO Mineral Creede WA0JS 146.925 OPEN Off-Air
40,"HNDparachute,mount callahan",449.8,-,5,Tone,107.2,107.2,23,23,NN,FM,5,"CO Garfield Parachute, Mount Callahan WA4HND 449.8 OPEN On-Air"
41,SWErifle,146.76,-,0.6,Tone,107.2,107.2,23,23,NN,FM,5,CO Garfield Rifle N0SWE 146.76 OPEN Off-Air
42,"ELKcarbondale,four mile ridge",449.725,-,5,Tone,179.9,179.9,23,23,NN,FM,5,"CO Garfield Carbondale, Four Mile Ridge K0ELK 449.725 OPEN On-Air"
43,"SNOcarbondale,four mile ridge",147.39,+,0.6,Tone,107.2,107.2,23,23,NN,FM,5,"CO Garfield Carbondale, Four Mile Ridge K0SNO 147.39 OPEN On-Air"
44,"VJJglenwoodsprings, sunlight peak",146.85,-,0.6,Cross,88.5,123,23,23,NN,FM,5,"CO Garfield Glenwood Springs, Sunlight Peak KB0VJJ 146.85 OPEN On-Air"
45,"I0Gglenwoodsprings, sunlight peak",146.88,-,0.6,Tone,107.2,107.2,23,23,NN,FM,5,"CO Garfield Glenwood Springs, Sunlight Peak KI0G 146.88 OPEN On-Air"
46,"I0Gglenwoodsprings, sunlight peak",447.1,-,5,Tone,107.2,107.2,23,23,NN,FM,5,"CO Garfield Glenwood Springs, Sunlight Peak KI0G 447.1 OPEN On-Air"
47,"XLIglenwoodsprings, sunlight peak",449.6,-,5,Tone,107.2,107.2,23,23,NN,FM,5,"CO Garfield Glenwood Springs, Sunlight Peak N0XLI 449.6 OPEN On-Air"
48,0CLsnowmassvillage,146.67,-,0.6,Tone,107.2,107.2,23,23,NN,FM,5,CO Pitkin Snowmass Village K0CL 146.67 OPEN On-Air
49,"YNAgunnison,w mountain or tenderfoot mountain",447.65,-,5,TSQL,151.4,151.4,23,23,NN,FM,5,"CO Gunnison Gunnison, W Mountain or Tenderfoot Mountain KB0YNA 447.65 OPEN On-Air"
50,"0EPdurango,eagle pass",146.67,-,0.6,Tone,100,100,23,23,NN,FM,5,"CO La Plata Durango, Eagle Pass K0EP 146.67 OPEN On-Air"
51,"0VQaspen,aspen mountain",447.05,-,5,TSQL,136.5,136.5,23,23,NN,FM,5,"CO Pitkin Aspen, Aspen Mountain K0VQ 447.05 OPEN On-Air"
52,"0EPdurango,missionary ridge",146.7,-,0.6,TSQL,100,100,23,23,NN,FM,5,"CO La Plata Durango, Missionary Ridge K0EP 146.7 OPEN On-Air"
53,"0SZdurango,missionary ridge",445.1375,-,5,,88.5,88.5,23,23,NN,DIG,5,"CO La Plata Durango, Missionary Ridge N0SZ 445.1375 OPEN On-Air"
54,"ITSdolores,summit ridge",145.19,-,0.6,Tone,100,100,23,23,NN,FM,5,"CO Montezuma Dolores, Summit Ridge KB5ITS 145.19 OPEN On-Air"
55,"ITSdolores,summit ridge",447.275,-,5,Tone,100,100,23,23,NN,FM,5,"CO Montezuma Dolores, Summit Ridge KB5ITS 447.275 OPEN On-Air"
56,"0VQcarbondale,missouri heights",447.15,-,5,Tone,136.5,136.5,23,23,NN,FM,5,"CO Garfield Carbondale, Missouri Heights K0VQ 447.15 OPEN On-Air"
57,"VJJdurango,missionary ridge",147.345,+,0.6,Cross,88.5,123,23,23,NN,FM,5,"CO La Plata Durango, Missionary Ridge KB0VJJ 147.345 OPEN On-Air"
58,"QEQmoab,bald mesa",146.76,-,0.6,Tone,88.5,88.5,23,23,NN,FM,5,"UT Grand Moab, Bald Mesa K7QEQ 146.76 OPEN On-Air"
59,"QEQmoab,bald mesa",449.1,-,5,TSQL,107.2,107.2,23,23,NN,FM,5,"UT Grand Moab, Bald Mesa K7QEQ 449.1 OPEN On-Air"
60,"ITSmancos,caviness mountain",442.375,+,5,Tone,100,100,23,23,NN,FM,5,"CO Montezuma Mancos, Caviness Mountain KB5ITS 442.375 OPEN On-Air"
61,"0VQglenwoodsprings, three mile ridge",147.3,+,0.6,Tone,107.2,107.2,23,23,NN,FM,5,"CO Garfield Glenwood Springs, Three Mile Ridge K0VQ 147.3 OPEN Off-Air"
62,I0Gglenwoodsprings,224.02,-,1.6,,88.5,88.5,23,23,NN,FM,5,CO Garfield Glenwood Springs KI0G 224.02 CLOSED 
63,I0Gglenwoodsprings,447.6,-,5,,88.5,88.5,23,23,NN,FM,5,CO Garfield Glenwood Springs KI0G 447.6 CLOSED 
64,"HNDglenwoodsprings, lookout mountain",449.85,-,5,TSQL,131.8,131.8,23,23,NN,FM,5,"CO Garfield Glenwood Springs, Lookout Mountain WA4HND 449.85 OPEN On-Air"
65,"UBJmancos,caviness mountain",446.7375,-,5,,88.5,88.5,23,23,NN,DIG,5,"CO Montezuma Mancos, Caviness Mountain N5UBJ 446.7375 OPEN On-Air"
66,VIUhesperus,145.37,-,0.6,TSQL,100,100,23,23,NN,FM,5,CO La Plata Hesperus KB0VIU 145.37 OPEN On-Air
67,"ITSmancos,menefee mountain",145.325,-,0.6,Tone,100,100,23,23,NN,FM,5,"CO Montezuma Mancos, Menefee Mountain KB5ITS 145.325 OPEN On-Air"
68,"MRCmaysville,co",145.325,-,0.6,Tone,100,100,23,23,NN,FM,5,"CO Chaffee Maysville, CO KD0MRC 145.325 OPEN On-Air"
69,0EPdurango,449.85,-,5,TSQL,100,100,23,23,NN,FM,5,CO La Plata Durango K0EP 449.85 OPEN On-Air
70,EVEdurango,448.625,-,5,TSQL,131.8,131.8,23,23,NN,FM,5,CO La Plata Durango KC5EVE 448.625 OPEN On-Air
71,"ITSdurango,smelter mountain",147.135,+,0.6,TSQL,100,100,23,23,NN,FM,5,"CO La Plata Durango, Smelter Mountain KB5ITS 147.135 OPEN On-Air"
72,"LWUcortez,downtown",146.79,-,0.6,TSQL,127.3,127.3,23,23,NN,FM,5,"CO Montezuma Cortez, Downtown KD5LWU 146.79 OPEN On-Air"
73,LWUcortez,449.175,-,5,Tone,127.3,127.3,23,23,NN,FM,5,CO Montezuma Cortez KD5LWU 449.175 OPEN Off-Air
74,QEQmoab,146.9,-,0.6,Tone,88.5,88.5,23,23,NN,FM,5,UT Grand Moab K7QEQ 146.9 OPEN On-Air
75,LSDnathrop,146.745,-,0.6,Tone,100,100,23,23,NN,FM,5,CO Chaffee Nathrop W0LSD 146.745 OPEN Off-Air
76,"ITSignacio,spring creek",147.15,+,0.6,Tone,100,100,23,23,NN,FM,5,"CO La Plata Ignacio, Spring Creek KB5ITS 147.15 OPEN On-Air"
77,"0SWloma,baxter pass",447,-,5,Tone,107.2,107.2,23,23,NN,FM,5,"CO Garfield Loma, Baxter Pass KB0SW 447 OPEN On-Air"
78,"QEQmonticello,abajo pk",223.94,-,1.6,,88.5,88.5,23,23,NN,FM,5,"UT San Juan Monticello, Abajo Pk K7QEQ 223.94 CLOSED "
79,"QEQmonticello,abajo peak",447.1,-,5,TSQL,107.2,107.2,23,23,NN,FM,5,"UT San Juan Monticello, Abajo Peak K7QEQ 447.1 OPEN On-Air"
80,"QEQmonticello,abajo peak",447.4,-,5,,88.5,88.5,23,23,NN,FM,5,"UT San Juan Monticello, Abajo Peak K7QEQ 447.4 CLOSED "
81,"SDCmonticello,abajo peak",146.61,-,0.6,Tone,88.5,88.5,23,23,NN,FM,5,"UT San Juan Monticello, Abajo Peak K7SDC 146.61 OPEN On-Air"
82,"JSPpagosasprings, oakbrush hill",146.61,-,0.6,Tone,123,123,23,23,NN,FM,5,"CO Archuleta Pagosa Springs, Oakbrush Hill N0JSP 146.61 OPEN On-Air"
83,"CVUsalida,methodist mountain",449.65,-,5,Tone,107.2,107.2,23,23,NN,FM,5,"CO Chaffee Salida, Methodist Mountain KC0CVU 449.65 OPEN On-Air"
84,"ZSNleadville,quail mountain",147.24,+,0.6,TSQL,156.7,156.7,23,23,NN,FM,5,"CO Lake Leadville, Quail Mountain N0ZSN 147.24 OPEN Off-Air"
85,"Z0Nsalida,methodist mountain",449.925,-,5,TSQL,103.5,103.5,23,23,NN,FM,5,"CO Chaffee Salida, Methodist Mountain WZ0N 449.925 OPEN On-Air"
86,"JSCsalida,methodist mountain",449.975,-,5,TSQL,100,100,23,23,NN,FM,5,"CO Chaffee Salida, Methodist Mountain K0JSC 449.975 OPEN On-Air"
87,"VJJsalida,methodist mountain",147.285,+,0.6,Cross,88.5,123,23,23,NN,FM,5,"CO Chaffee Salida, Methodist Mountain KB0VJJ 147.285 OPEN On-Air"
88,"CVUsalida,methodist mountain",145.295,-,0.6,Tone,107.2,107.2,23,23,NN,FM,5,"CO Chaffee Salida, Methodist Mountain KC0CVU 145.295 OPEN On-Air"
89,"QPGsalida,methodist mountain",446.975,-,5,,88.5,88.5,23,23,NN,DIG,5,"CO Chaffee Salida, Methodist Mountain KD0QPG 446.975 OPEN On-Air"
90,"0SZsalida,methodist mountain",446.8125,-,5,,88.5,88.5,23,23,NN,DIG,5,"CO Chaffee Salida, Methodist Mountain N0SZ 446.8125 OPEN On-Air"
91,"5SJnebo,cedar hill",147.06,+,0.6,Tone,100,100,23,23,NN,FM,5,"NM San Juan Nebo, Cedar Hill NM5SJ 147.06 OPEN On-Air"
92,"0SZleadville,mosquito pass",445.05,-,5,,88.5,88.5,23,23,NN,DIG,5,"CO Lake Leadville, Mosquito Pass N0SZ 445.05 OPEN On-Air"
93,"VJJleadville,mosquito pass",145.445,-,0.6,Tone,88.5,88.5,23,23,NN,FM,5,"CO Lake Leadville, Mosquito Pass KB0VJJ 145.445 OPEN On-Air"
94,0KMcenter,447.1,-,5,Tone,77,77,23,23,NN,FM,5,CO Saguache Center N0KM 447.1 OPEN On-Air
95,0KMcenter,146.64,-,0.6,TSQL,77,77,23,23,NN,FM,5,CO Rio Grande Center N0KM 146.64 OPEN On-Air
96,Z0Nhartsel,448.575,-,5,TSQL,103.5,103.5,23,23,NN,FM,5,CO Park Hartsel WZ0N 448.575 OPEN Off-Air
97,"UFOfairplay,sacramento mountain",447.125,-,5,TSQL,103.5,103.5,23,23,NN,FM,5,"CO Park Fairplay, Sacramento Mountain KC0UFO 447.125 OPEN On-Air"
98,0SZvail,445.075,-,5,,88.5,88.5,23,23,NN,DIG,5,CO Eagle Vail N0SZ 445.075 OPEN On-Air
99,VJJvail,147.345,+,0.6,Cross,88.5,123,23,23,NN,FM,5,CO Eagle Vail KB0VJJ 147.345 OPEN On-Air
100,"0RVvail,bald mountain",146.61,-,0.6,Tone,107.2,107.2,23,23,NN,FM,5,"CO Eagle Vail, Bald Mountain K0RV 146.61 OPEN On-Air"
101,AFOvail,224.8,-,1.6,,88.5,88.5,23,23,NN,FM,5,CO Eagle Vail N0AFO 224.8 OPEN Off-Air
102,AFOvail,449.9,-,5,TSQL,107.2,107.2,23,23,NN,FM,5,CO Eagle Vail N0AFO 449.9 OPEN Off-Air
103,"ITSaztec,tank mtn",146.88,-,0.6,Tone,100,100,23,23,NN,FM,5,"NM San Juan Aztec, Tank Mtn KB5ITS 146.88 OPEN On-Air"
104,ITSaztec,447.45,-,5,Tone,107.2,107.2,23,23,NN,FM,5,NM San Juan Aztec KB5ITS 447.45 OPEN On-Air
105,UBJaztec,442.25,+,5,,88.5,88.5,23,23,NN,DIG,5,NM San Juan Aztec N5UBJ 442.25 OPEN On-Air
106,5SJaztec,146.74,-,0.6,Tone,100,100,23,23,NN,FM,5,NM San Juan Aztec NM5SJ 146.74 OPEN On-Air
107,"0SZfairplay,badger",446.7625,-,5,,88.5,88.5,23,23,NN,DIG,5,"CO Park Fairplay, Badger N0SZ 446.7625 OPEN On-Air"
108,"ITSnavajodam, navajo lake",147.36,+,0.6,Tone,100,100,23,23,NN,FM,5,"NM San Juan Navajo Dam, Navajo Lake KB5ITS 147.36 OPEN On-Air"
109,5SJdulce,145.43,-,0.6,Tone,136.5,136.5,23,23,NN,FM,5,NM Rio Arriba Dulce NM5SJ 145.43 OPEN On-Air
110,VBEaztec,1291.1,-,20,,88.5,88.5,23,23,NN,DIG,5,NM Bernalillo Aztec KF5VBE 1291.1 CLOSED On-Air
111,VBEfarmington,145.115,-,0.6,,88.5,88.5,23,23,NN,DIG,5,NM San Juan Farmington KF5VBE 145.115 OPEN On-Air
112,QMRbreckenridge,146.7,-,0.6,Tone,107.2,107.2,23,23,NN,FM,5,CO Summit Breckenridge WB0QMR 146.7 OPEN On-Air
113,"0SZrangely,cathedral bluffs",445.2625,-,5,,88.5,88.5,23,23,NN,DIG,5,"CO Rio Blanco Rangely, Cathedral Bluffs N0SZ 445.2625 OPEN On-Air"
114,WXIbloomfield,146.92,-,0.6,Tone,100,100,23,23,NN,FM,5,NM San Juan Bloomfield K5WXI 146.92 OPEN On-Air
115,ITSbloomfield,448.65,-,5,Tone,127.3,127.3,23,23,NN,FM,5,NM San Juan Bloomfield KB5ITS 448.65 OPEN On-Air
116,"VJJbreckenridge,bald mountain",147.39,+,0.6,Cross,88.5,123,23,23,NN,FM,5,"CO Summit Breckenridge, Bald Mountain KB0VJJ 147.39 OPEN On-Air"
117,WXIfarmington,146.85,-,0.6,TSQL,100,100,23,23,NN,FM,5,NM San Juan Farmington K5WXI 146.85 OPEN On-Air
118,5WYfarmington,449,-,5,Tone,100,100,23,23,NN,FM,5,NM San Juan Farmington K5WY 449 OPEN 
119,ITSfarmington,53.01,-,1,Tone,131.8,131.8,23,23,NN,FM,5,NM San Juan Farmington KB5ITS 53.01 OPEN On-Air
120,ITSfarmington,146.76,-,0.6,TSQL,100,100,23,23,NN,FM,5,NM San Juan Farmington KB5ITS 146.76 OPEN On-Air
121,ITSfarmington,147,+,0.6,Tone,100,100,23,23,NN,FM,5,NM San Juan Farmington KB5ITS 147 OPEN On-Air
122,VBFfarmington,444.15,+,5,,88.5,88.5,23,23,NN,DIG,5,NM San Juan Farmington KF5VBF 444.15 OPEN On-Air
123,"0SZbreckenridge,baldy",445.0875,-,5,,88.5,88.5,23,23,NN,DIG,5,"CO Fremont Breckenridge, Baldy N0SZ 445.0875 OPEN On-Air"
124,UBJfarmington,442.325,+,5,,88.5,88.5,23,23,NN,DIG,5,NM San Juan Farmington N5UBJ 442.325 OPEN On-Air
125,"VBFfarmington,farmington bluffs",1291.7,-,20,,88.5,88.5,23,23,NN,DIG,5,"NM San Juan Farmington, Farmington Bluffs KF5VBF 1291.7 CLOSED On-Air"
126,"VBDbloomfield,harris mesa",1292.3,-,20,,88.5,88.5,23,23,NN,DIG,5,"NM San Juan Bloomfield, Harris Mesa KF5VBD 1292.3 CLOSED On-Air"
127,"ITSbloomfield,harris mesa",147.1,+,0.6,Tone,100,100,23,23,NN,FM,5,"NM San Juan Bloomfield, Harris mesa KB5ITS 147.1 OPEN On-Air"
128,"5MLbloomfield,harris mesa",147.28,+,0.6,Tone,67,67,23,23,NN,FM,5,"NM San Juan Bloomfield, Harris Mesa NM5ML 147.28 OPEN On-Air"
129,"5SFchama,overlook mtn",147.08,+,0.6,Tone,162.2,162.2,23,23,NN,FM,5,"NM Rio Arriba Chama, Overlook Mtn W5SF 147.08 OPEN On-Air"
130,JSCwestcliffe,448.325,-,5,TSQL,100,100,23,23,NN,FM,5,CO Custer Westcliffe K0JSC 448.325 OPEN On-Air
131,"D0Qwestcliffe,deer peak",919.1,-,25,Tone,88.5,88.5,23,23,NN,FM,5,"CO Pueblo Westcliffe, Deer Peak ND0Q 919.1 OPEN Off-Air"
132,TUCwestcliffe,147.06,+,0.6,TSQL,77,77,23,23,NN,FM,5,CO Custer Westcliffe KB0TUC 147.06 OPEN On-Air
133,TUCwestcliffe,448.15,-,5,TSQL,103.5,103.5,23,23,NN,FM,5,CO Custer Westcliffe KB0TUC 448.15 OPEN On-Air
134,TUCwestcliffe,927.775,-,25,DTCS,88.5,88.5,116,116,NN,FM,5,CO Custer Westcliffe KB0TUC 927.775 OPEN On-Air
135,"CVUlakegeorge, badger mountain",147.36,+,0.6,TSQL,107.2,107.2,23,23,NN,FM,5,"CO Park Lake George, Badger Mountain KC0CVU 147.36 OPEN On-Air"
136,"X0Glakegeorge, badger mountain",146.685,-,0.6,TSQL,107.2,107.2,23,23,NN,FM,5,"CO Park Lake George, Badger Mountain NX0G 146.685 OPEN On-Air"
137,"VJJkremmling,santoy peak",147.075,+,0.6,Cross,88.5,123,23,23,NN,FM,5,"CO Grand Kremmling, Santoy Peak KB0VJJ 147.075 OPEN On-Air"
138,"WDFcanoncity, eightmile mountain",449,-,5,TSQL,67,67,23,23,NN,FM,5,"CO Fremont Canon City, eightmile Mountain WB0WDF 449 OPEN On-Air"
139,"BARvernal,uintah county eoc",449.9,-,5,Tone,136.5,136.5,23,23,NN,FM,5,"UT Uintah Vernal, Uintah County EOC W7BAR 449.9 OPEN "
140,"JSCcanoncity, fremont peak",446.7375,-,5,,88.5,88.5,23,23,NN,DIG,5,"CO Fremont Canon City, Fremont Peak K0JSC 446.7375 OPEN On-Air"
141,"JSCcanoncity, fremont peak",447.25,-,5,TSQL,100,100,23,23,NN,FM,5,"CO Fremont Canon City, Fremont Peak K0JSC 447.25 OPEN On-Air"
142,"WDFcanoncity, fremont peak",53.03,-,1.7,TSQL,88.5,88.5,23,23,NN,FM,5,"CO Fremont Canon City, Fremont Peak WB0WDF 53.03 OPEN On-Air"
143,"EKRcanoncity, fremont peak",145.49,-,0.6,TSQL,103.5,103.5,23,23,NN,FM,5,"CO Fremont Canon City, Fremont Peak WD0EKR 145.49 OPEN On-Air"
144,"EKRcanoncity, fremont peak",223.96,-,1.6,TSQL,103.5,103.5,23,23,NN,FM,5,"CO Fremont Canon City, Fremont Peak WD0EKR 223.96 OPEN On-Air"
145,"EKRcanoncity, fremont peak",447.75,-,5,TSQL,103.5,103.5,23,23,NN,FM,5,"CO Fremont Canon City, Fremont Peak WD0EKR 447.75 OPEN On-Air"
146,lakegeorge,449.7,-,5,Tone,107.2,107.2,23,23,NN,FM,5,CO Park Lake George  449.7 OPEN 
147,"TUCcanoncity, fremont peak",927.7,-,25,DTCS,88.5,88.5,114,114,NN,FM,5,"CO Fremont Canon City, Fremont Peak KB0TUC 927.7 OPEN On-Air"
148,HLLmexicanhat,449.9,-,5,Tone,123,123,23,23,NN,FM,5,UT San Juan Mexican Hat KD7HLL 449.9 OPEN On-Air
149,VJJcraig,146.97,-,0.6,Cross,88.5,123,23,23,NN,FM,5,CO Moffat Craig KB0VJJ 146.97 OPEN On-Air
150,HAMcraig,145.265,-,0.6,Tone,107.2,107.2,23,23,NN,FM,5,CO Moffat Craig WD0HAM 145.265 OPEN 
151,"JSCcanoncity, colorado",447.975,-,5,TSQL,100,100,23,23,NN,FM,5,"CO Fremont Canon City, Colorado K0JSC 447.975 OPEN On-Air"
152,"0PCbailey,dick mountain",146.895,-,0.6,TSQL,100,100,23,23,NN,FM,5,"CO Park Bailey, Dick Mountain AB0PC 146.895 OPEN On-Air"
153,"JSCcanoncity, canon city",449.975,-,5,TSQL,100,100,23,23,NN,FM,5,"CO Fremont Canon City, Canon City K0JSC 449.975 OPEN On-Air"
154,BYUroosevelt,146.92,-,0.6,Tone,136.5,136.5,23,23,NN,FM,5,UT Duchesne Roosevelt W7BYU 146.92 OPEN Off-Air
155,BYUvernal,449.7,-,5,Tone,136.5,136.5,23,23,NN,FM,5,UT Uintah Vernal W7BYU 449.7 OPEN 
156,"BARvernal,blue mountain",147.1,+,0.6,Tone,136.5,136.5,23,23,NN,FM,5,"UT Uintah Vernal, Blue Mountain W7BAR 147.1 OPEN On-Air"
157,X0Gcripplecreek,147.015,+,0.6,Tone,107.2,107.2,23,23,NN,FM,5,CO Teller Cripple Creek NX0G 147.015 OPEN On-Air
158,WDFcripplecreek,1287.7,-,20,Tone,67,67,23,23,NN,FM,5,CO Teller Cripple Creek WB0WDF 1287.7 OPEN Testing
159,WDFcripplecreek,145.46,-,0.6,Tone,67,67,23,23,NN,FM,5,CO Teller Cripple Creek WB0WDF 145.46 OPEN On-Air
160,WDFcripplecreek,224.94,-,1.6,Tone,67,67,23,23,NN,FM,5,CO Teller Cripple Creek WB0WDF 224.94 OPEN Testing
161,WDFcripplecreek,447.4,-,5,Tone,67,67,23,23,NN,FM,5,CO Teller Cripple Creek WB0WDF 447.4 OPEN On-Air
162,"CVUpueblo,deer peak",449.625,-,5,Tone,107.2,107.2,23,23,NN,FM,5,"CO Custer Pueblo, Deer Peak KC0CVU 449.625 OPEN On-Air"
163,"D0Qwalsenburg,deer peak",224.32,-,1.6,Tone,88.5,88.5,23,23,NN,FM,5,"CO Custer Walsenburg, Deer Peak ND0Q 224.32 OPEN Off-Air"
164,"D0Qpueblo,deer peak",447.175,-,5,Tone,88.5,88.5,23,23,NN,FM,5,"CO Pueblo Pueblo, Deer Peak ND0Q 447.175 OPEN Off-Air"
165,"VJJwinterpark, winter park",147.285,+,0.6,Cross,88.5,123,23,23,NN,FM,5,"CO Grand Winter Park, Winter Park KB0VJJ 147.285 OPEN On-Air"
166,VJJsteamboatsprings,147.165,+,0.6,Cross,88.5,123,23,23,NN,FM,5,CO Routt Steamboat Springs KB0VJJ 147.165 OPEN On-Air
167,VJJsteamboatsprings,449.625,-,5,TSQL,123,123,23,23,NN,FM,5,CO Routt Steamboat Springs KB0VJJ 449.625 OPEN On-Air
168,D0Hsteamboatsprings,147.21,+,0.6,TSQL,107.2,107.2,23,23,NN,FM,5,CO Routt Steamboat Springs KD0H 147.21 OPEN On-Air
169,CCCwinterpark,447.45,-,5,Tone,103.5,103.5,23,23,NN,FM,5,CO Grand Winter Park WA4CCC 447.45 OPEN On-Air
170,"PFOtrespiedras,  san antonio mountain",146.76,-,0.6,Tone,67,67,23,23,NN,FM,5,"NM Rio Arriba Tres Piedras,  San Antonio Mountain KF5PFO 146.76 OPEN On-Air"
171,"5MLtrespiedras, san antonio mountain",147.22,+,0.6,Tone,100,100,23,23,NN,FM,5,"NM Rio Arriba Tres Piedras, San Antonio Mountain NM5ML 147.22 OPEN On-Air"
172,"PFJgranby,mt chauncey",446.875,-,5,,88.5,88.5,23,23,NN,DIG,5,"CO Clear Creek Granby, Mt Chauncey K7PFJ 446.875 OPEN On-Air"
173,YDWgranby,146.82,-,0.6,Tone,123,123,23,23,NN,FM,5,CO Grand Granby KA0YDW 146.82 OPEN 
174,"DUNidahosprings, squaw mountain",449.45,-,5,Cross,103.5,127.3,23,23,NN,FM,5,"CO Clear Creek Idaho Springs, Squaw Mountain K1DUN 449.45 OPEN On-Air"
175,"UDDidahosprings, squaw mountain",146.67,-,0.6,TSQL,100,100,23,23,NN,FM,5,"CO Clear Creek Idaho Springs, Squaw Mountain KB0UDD 146.67 OPEN On-Air"
176,"0SZidahosprings, squaw mountain",446.9375,-,5,,88.5,88.5,23,23,NN,DIG,5,"CO Clear Creek Idaho Springs, Squaw Mountain N0SZ 446.9375 OPEN On-Air"
177,"0SZidahosprings, squaw mountain",448.225,-,5,TSQL,141.3,141.3,23,23,NN,FM,5,"CO Clear Creek Idaho Springs, Squaw Mountain N0SZ 448.225 OPEN On-Air"
178,"CRAidahosprings, squaw mountain",145.145,-,0.6,TSQL,107.2,107.2,23,23,NN,FM,5,"CO Clear Creek Idaho Springs, Squaw Mountain W0CRA 145.145 OPEN On-Air"
179,"CRAidahosprings, squaw mountain",447.575,-,5,TSQL,107.2,107.2,23,23,NN,FM,5,"CO Clear Creek Idaho Springs, Squaw Mountain W0CRA 447.575 OPEN On-Air"
180,"0TXidahosprings, centennial cone",145.49,-,0.6,TSQL,100,100,23,23,NN,FM,5,"CO Jefferson Idaho Springs, Centennial Cone W0TX 145.49 OPEN On-Air"
181,"0TXidahosprings, squaw mountain",449.35,-,5,TSQL,100,100,23,23,NN,FM,5,"CO Clear Creek Idaho Springs, Squaw Mountain W0TX 449.35 OPEN On-Air"
182,"WYXidahosprings, squaw mountain",146.94,-,0.6,TSQL,103.5,103.5,23,23,NN,FM,5,"CO Clear Creek Idaho Springs, Squaw Mountain W0WYX 146.94 OPEN On-Air"
183,"CFIidahosprings, squaw mountain",448.675,-,5,TSQL,100,100,23,23,NN,FM,5,"CO Denver Idaho Springs, Squaw Mountain W0CFI 448.675 OPEN On-Air"
184,"PYYevergreen,squaw mountain",147.3,+,0.6,TSQL,103.5,103.5,23,23,NN,FM,5,"CO Clear Creek Evergreen, Squaw Mountain N0PYY 147.3 OPEN On-Air"
185,"AENidahosprings, squaw mountain",449,-,5,TSQL,136.5,136.5,23,23,NN,FM,5,"CO Clear Creek Idaho Springs, Squaw Mountain WR0AEN 449 OPEN On-Air"
186,"CRAconifer,conifer mountain",53.05,-,1.7,TSQL,107.2,107.2,23,23,NN,FM,5,"CO Jefferson Conifer, Conifer Mountain W0CRA 53.05 OPEN Off-Air"
187,"ARAcritchell,critchell mountain",147.12,+,0.6,TSQL,88.5,88.5,23,23,NN,FM,5,"CO Jefferson Critchell, Critchell Mountain N0ARA 147.12 OPEN On-Air"
188,0SZwestcreek,446.875,-,5,,88.5,88.5,23,23,NN,DIG,5,CO Douglas Westcreek N0SZ 446.875 OPEN On-Air
189,"G0Nidahosprings, squaw mountain",449.05,-,5,TSQL,107.2,107.2,23,23,NN,FM,5,"CO Denver Idaho Springs, Squaw Mountain WG0N 449.05 OPEN On-Air"
190,"ITSlukachukai,roof butte",145.25,-,0.6,Tone,100,100,23,23,NN,FM,5,"AZ Apache Lukachukai, Roof Butte KB5ITS 145.25 OPEN On-Air"
191,"5SJlukachukai,roof butte",146.82,-,0.6,Tone,100,100,23,23,NN,FM,5,"AZ Apache Lukachukai, Roof Butte NM5SJ 146.82 OPEN On-Air"
192,"SDCsunnyside,bruin point",147.32,+,0.6,Tone,88.5,88.5,23,23,NN,FM,5,"UT Carbon Sunnyside, Bruin Point K7SDC 147.32 OPEN On-Air"
193,"SDCsunnyside,bruin point",449.05,-,5,Tone,88.5,88.5,23,23,NN,FM,5,"UT Carbon Sunnyside, Bruin Point K7SDC 449.05 OPEN On-Air"
194,"7YIprice,cedar mountain",448.075,-,5,,88.5,88.5,23,23,NN,DIG,5,"UT Carbon Price, Cedar Mountain K7YI 448.075 OPEN Off-Air"
195,"SRJcoloradosprings, pikes peak",146.97,-,0.6,Cross,100,123,23,23,NN,FM,5,"CO El Paso Colorado Springs, Pikes Peak KB0SRJ 146.97 OPEN On-Air"
196,"SRJcoloradosprings, pikes peak",448.45,-,5,Tone,100,100,23,23,NN,FM,5,"CO El Paso Colorado Springs, Pikes Peak KB0SRJ 448.45 OPEN On-Air"
197,"SDCcastledale, cedar mountain",448.55,-,5,Tone,88.5,88.5,23,23,NN,FM,5,"UT Emery Castle Dale, Cedar Mountain K7SDC 448.55 OPEN On-Air"
198,"7YIcastledale, cedar mountain",447.125,-,5,Tone,100,100,23,23,NN,FM,5,"UT Emery Castle Dale, Cedar Mountain K7YI 447.125 CLOSED "
199,"X7Ysunnyside, bruin peak",145.175,-,0.6,,88.5,88.5,23,23,NN,FM,5,"UT Carbon Sunny Side, Bruin Peak WX7Y 145.175 OPEN On-Air"
200,"SDCcastledale, cedar mountain",147.14,+,0.6,Tone,88.5,88.5,23,23,NN,FM,5,"UT Emery Castle Dale, Cedar Mountain K7SDC 147.14 OPEN On-Air"
201,"CRAconifer,conifer mountain",1287.9,-,20,,88.5,88.5,23,23,NN,FM,5,"CO Jefferson Conifer, Conifer Mountain W0CRA 1287.9 OPEN Off-Air"
202,"CRAconifer,conifer mountain",224.98,-,1.6,TSQL,107.2,107.2,23,23,NN,FM,5,"CO Jefferson Conifer, Conifer Mountain W0CRA 224.98 OPEN Off-Air"
203,"CRAconifer,conifer mountain",447.15,-,5,TSQL,107.2,107.2,23,23,NN,FM,5,"CO Jefferson Conifer, Conifer Mountain W0CRA 447.15 OPEN Off-Air"
204,WUCwoodlandpark,145.415,-,0.6,Tone,179.9,179.9,23,23,NN,FM,5,CO Teller Woodland Park KA0WUC 145.415 OPEN 
205,WUCwoodlandpark,447.675,-,5,TSQL,179.9,179.9,23,23,NN,FM,5,CO Teller Woodland Park KA0WUC 447.675 OPEN On-Air
